大地	ふぅ、ごちそうさま。今朝も美味しかったよ、皐月
皐月	ありがとうございます、お兄ちゃん♪
主人公	にっこり笑顔の皐月は、そのまま食卓の上を片付けていく。
空	手伝うわ、皐月
皐月	はい、ありがとうございます。くーちゃん
主人公	空と皐月が一緒になってキッチンを動き回る。
大地	うーん、なんだか凄く贅沢な空間であり時間だよね、これは
主人公	美少女二人が朝から甲斐甲斐しく働いている姿。それをのんびりと見ていられる幸せは、そうそう無いと言って間違いない。
主人公	しかも美少女のレベルが尋常でないもんだから、その背中のラインもまた……うん、実に至福。
空	そんな風にのんびり見てるだけなんだったら、大地も手伝いなさいよ
大地	あ、うん
皐月	いえ、大丈夫です。キッチンは私たちの仕事場なんですから、お兄ちゃんはゆっくりと休んでいて下さいっ
主人公	返事をして立ち上がろうとした僕を、皐月の優しくも有無を言わせない声が引き止める。
空	あのぉ、皐月？　今、私『たち』って……
皐月	ダメですよ、くーちゃん。キッチンは女の戦場。お兄ちゃん厨房に入るべからずなんです
空	……あくまでお兄ちゃん限定なのね
主人公	普段よりも強い口調で主張する皐月に、空は諦めた様子で肩を落とした。
皐月	お兄ちゃんは、私たちに尽くされるためにいるんですから
空	いやあの、お願いだからわたしを混ぜないで……
皐月	そういう訳ですから、お兄ちゃんは食後のお茶でも飲んでゆっくりしていてくださいね
主人公	そう言って、皐月はほうじ茶の入った湯呑みを差し出してくれた。
大地	あぁ、ありがとう、皐月
主人公	実際、こんな感じなので僕は普段キッチンに入ることが出来ない。
主人公	たまにノリであま姉に巻き込まれることがあるくらいだ。
空	なんにも出来ない男になっちゃったら困ると思うんだけど……
皐月	それで良いんです、その分は全部、私が面倒を見ればいいんですから
空	そこまで計画してるのね……
空	……本当に、誰かなんとかしないとマズイんじゃないかしら
主人公	ボソッと呟いた空の一言に、ほんの少し同意してしまう僕でした。
大地	でもまぁ、こんな天気の良い日にこうして部屋でのんびりしてるだけってのは、もったいない気がするね
主人公	気持ち良い日差しと、心地よい風が吹いているおかげで、今日はとても過ごしやすい。
皐月	私は、こうしてお兄ちゃんたちと一緒に居られるだけで充分に幸せです♪
主人公	僕の隣にちょこんと座っている皐月は、本当に幸せそうに微笑んでいる。
空	まぁ、こういう日があっても良いとは思うけど。せっかくの日曜日なんだし、ゆっくり出来るのは悪いことじゃないわ
天音	なにを若いウチから枯れたことを言っているの、空！
空	えっ？　あま姉？
銀一郎	おっと、俺を忘れてもらっちゃ困るな
主人公	いつものごとく唐突にあま姉とアニキが現れる。
皐月	いらっしゃい、あまねちゃん、銀くん
天音	はぁい、みんな、元気にしてたかな？
大地	今日は早いね、アニキたち
銀一郎	あぁ、ちょうどこっちもこんな天気で家に引っ込んでるのはもったいないって話になってな
大地	なるほどね
主人公	さすがは付き合いの長い幼馴染。考えることは似るらしい。
天音	そんな訳だから、大くん、空、さっちゃん。出かける用意をしなさい！
空	そ、そんな急に言われても
天音	考えてみれば、空が来てからのんびり街に出たことってなかったでしょ？
大地	あぁ、言われてみれば……
主人公	空が戻って早々に、星座候補試験だったから休日も引っ張り出されてたんだっけ。
大地	そうだね、確かにみんなで街に出るのもいいかもしれない
皐月	くーちゃんも、久しぶりの街をのんびり見て回れますね
空	い、いいわよ、わたしは。こっちに来てすぐに、だいたいの所は見回ってるし……ひゃぁんっ！　あ、あま姉？
主人公	遠慮している空を、あま姉が後ろから羽交い締めにする。
天音	ふっふーん、グダグダと言ってる暇があったらとっとと準備よ、空。それともあたしが服を選んであげよっか？
主人公	そう言いながらあま姉は空の服を脱がそうとしていく。
天音	ほーら大くーん、空がどれだけ成長してるか気になるわよねえ
大地	それはもう、当然の如くです、はい！
空	ちょ、ちょっと待っ……こら、見るな大地ー！　分かりました、分かったから服は脱がさないでっ、この格好で行くんだからーっ
大地	ちぇー。あっさりと陥落……
主人公	こういう説得は、やはりあま姉に任せるのが一番だ。
主人公	もちろん、僕が同じ被害に遭うこともしばしばだけど……。
主人公	でも、今日はピンクの水玉かあ。
銀一郎	ま、こういう時は外出てパーッと遊ぶのが一番ってことだな
皐月	はい。それじゃキッチンを片付け終わったらすぐに出かけましょうか
天音	よし、それじゃそんな感じで行ってみましょう！　良いわね？　大くん
大地	もちろんオッケーです、あま姉
