主人公	そこは僕がよく知っている場所だった。いや、よく知っている場所にしか思えなかった。
主人公	生まれた時からずっといる街。僕が育って、そして多くの人達と出会った街。
主人公	みんなと走って、遊んで、別れて、また出会った街。
主人公	僕が今、そしてこれからも暮らし続ける街。
主人公	たくさんの人が駅の中へと飲み込まれ、そして駅の中から現われ、様々な道を歩いて去っていく。
主人公	そこは紛れもない、茜橋の街だった。
大地	これが、ソラの中にある世界……凄いな。本物そっくりだ……
主人公	ただ風景が同じというだけじゃない。ここには生命がある。
主人公	街で生活する人達。周囲を色取る木々に、視界を横切る鳥や猫。動物達。そんな生命の存在が、この街をただの風景から世界に変えていた。
主人公	そっと手を伸ばして、周囲のものに触れてみる。そこにある質感も、さらりと流れる風の匂いも、すべてが僕の知る茜橋と変わらない。
主人公	見上げた空は抜けるような青。どこまでも広がっていきそうな無限の広さがある。
主人公	これが、この街を知っているたくさんの人達の記憶から作られたっていうなら、僕達の住む世界のすべてを再現することだって可能なのかも知れない。
主人公	『再現』することなら。
ソラ	……見つけた
大地	って、ソラ？　あれ、だってここ……
ソラ	ここはソラの中にある精神世界。ソラの精神と直結してる
ソラ	そうでなければ、この世界を確認し、維持することもできない
大地	……なるほど、なんとなく納得
大地	それで、なんの用だい
主人公	まさか今更追い出しに来たとは思えないけれど、それでも警戒はしておいた方がいい。
ソラ	蒼のところに連れて行く
大地	……随分いきなりだね
ソラ	お前たちは言ってた。あの花の記憶のありかを教えてくれると
ソラ	ソラは、その言葉を信じる。ソラの、この名前にかけて
大地	信用してもらえた、っていうことなのかな
主人公	まっすぐに僕を見つめ続けるソラの瞳。そこには少しの陰りもなくて、ソラの想いをそのままに映し出していた。
主人公	だから、分かる。ソラの今の言葉に、嘘も偽りもないことが。
大地	橘大地。できれば、お前、じゃなくて名前で呼んでほしいかなあ
ソラ	橘、大地……分かった。そう呼ぶ
主人公	ソラは言うと、僕に背を向けて歩き出す。多分、ついてこい、っていうことなんだろう。
主人公	僕はそのソラの小さな背中を、慌てて追いかけていった。
主人公	駅前を離れても、この世界は僕の知っている世界と何も変わらなかった。
主人公	行き交うたくさんの車と、通行人。そのどれもが、まるで生きているみたいに、それぞれの意思に従って動いている。
主人公	この世界がどこまで広がっているのかは分からないけれど、この世界にいる人達にとってこの記憶世界は、きっと本物なんだ。
主人公	だけど、違う。この世界は決して本物にはなれない。
主人公	この世界には、足りないものがあるから……。
ソラ	ここ
主人公	そう言って、ソラの足がピタリと止まった。
主人公	遊びに来たたくさんの子供達や、憩いを求めてきた多くの人達で賑わう午後の公園。
主人公	その公園のとある一点を、ソラがそっと指さす。
主人公	日当たりのいいベンチに、長い髪の女の子が座っていた。
主人公	この場所には不釣り合いのパジャマ姿で、楽しそうに足を振っている。
主人公	それは、あの病院でのホロスコープで見た女の子に間違いなかった。ただ一つ違うのは……
主人公	あの子の両目が、開いていた。
蒼	あなたの中でなら、その世界でなら、わたしも空を見ることが出来るのかな。どこまでも拡がる、大きな青空
主人公	ホロスコープの中で、蒼ちゃんが言ってた言葉を思い出す。
主人公	この世界は、確かにその願いを叶えてくれているんだ。蒼ちゃんにとってこの世界は、夢なんだ。
主人公	だけど、それでも……それでもやっぱり、だめなんだ。
主人公	僕は、これから自分が壊そうとしてるものが、彼女にとってどういう世界なのかをしっかりと刻み込んで、足を踏み出した。
大地	……蒼ちゃん、だよね
蒼	はい？
主人公	僕の呼びかけに、本当に太陽を連想させる明るい笑顔を浮かべて、蒼ちゃんが顔を上げる。
蒼	あなたは……ひょっとして、大地さん？
大地	え、僕の名前、知ってるの？
蒼	うん。だって、この街を作り上げた記憶の中でも、とびきり強い想いを持ってた人だから
蒼	暇さえあれば、この世界の大地さんのことを、わたし見てた
主人公	どうやら蒼ちゃん限定で、この世界の僕は有名人みたいだ。キラキラとその瞳を輝かせて、蒼ちゃんは僕を見てる。それがちょっと気恥ずかしい。
蒼	でも、今の大地さんは、わたしが見てきた大地さんじゃあないよね？　だってすっごく成長してるし
蒼	わたしの見てきた大地さんは、もうちょっと幼くてかわいい感じだもん。あ、でも成長した大地さんはかっこいい感じだよ。うん、二重丸♪
主人公	なんていうか、本当に明るい子だなあ。
蒼	大地さん、実はソラの名付け親、なんだよ
大地	僕が？
蒼	うん。最初はね、名前を付けられるのを凄く嫌がってたんだ、ソラ
蒼	だけど、この世界で初めてソラの姿を見て。やっとソラと正面から話せるようになって
蒼	名前で呼べなくちゃ、友達って気がしないからやだ！　って言ったの
蒼	だから、最高の名前をあげるって約束してたんだけど……
蒼	そんな時にね、大地さんの記憶がこの世界の中に入ってきて
蒼	そこに、すっごく強い力を持った記憶があった。大地さんが、心の底から本当に大事にしていたんだって分かる記憶
蒼	その中心にあった名前が……ソラ
蒼	だからわたしは、その名前を贈ったの。あんな強い想いに繋がる名前でありますようにって
蒼	わたしがソラに贈ってあげられる、たった一つのものだったから
蒼	それに、蒼とソラ。二人合わせて蒼空。ちょっとかっこいいでしょ
主人公	蒼ちゃんは本当に楽しそうに、屈託のない笑顔でそう言った。
主人公	自由にも動けず、目も見えなかった彼女にとって、この記憶世界こそがきっと本物の世界。
主人公	そのために記憶を奪われるっていうことの不幸を、理解できていないんだ。
蒼	でも、成長した大地さんが、なんでここに？
蒼	あ、もしかして、あの花の記憶を持った大地さんなのかな
大地	残念だけど、あの花は咲かないよ、絶対に。この世界じゃあ
蒼	え……？
主人公	今まで、ただ明るかった蒼ちゃんの顔が、初めて小さな驚きを浮かべた。
大地	僕と空は、七年前に別れる時に、三つの約束をした。子供心に、そういう約束での繋がりがあれば、きっとまた一緒になれるって、そんな想いがあったんだと思う
大地	再会すること。大きくなったら、一緒に茜橋東学園に通うこと。そしてもう一つ……
大地	街外れの丘に植えた、花の種。その花の咲いた姿を、一緒に見よう……
大地	この世界の中で蒼ちゃんは、僕と空の約束を見た。そして、その花の咲いた風景を見たくなった。そうだよね
蒼	……うん。あんなに強い想いで植えられた花が、今どんな風景を作っているのか、それがどうしても見たかった
蒼	だからソラは、わたしのそんな願いに応えようとしてくれてた
大地	それでもね、やっぱり不可能なんだよ。あの花を咲かせることは
蒼	どういう、こと……？
大地	僕らもね、見たことがないんだ。あの花が咲いたところを
主人公	その僕の言葉に、蒼ちゃんは大きく目を見開いた。そんなこと、思ってもみなかったらしい。
蒼	な、なんで！？　だって、あんなに強い約束、大地さんも空さんも叶えられないはずが……っ
主人公	この先を言うことは、少し咎められた。蒼ちゃんに、僕の記憶のことを話すこと。それは、彼女にとって、この世界の正義を壊すことになるから。
主人公	彼女の願いをキッカケに作られたこの世界を、否定しなくちゃいけないから。
大地	……僕は五年前、この世界を作り上げるために、記憶を回収された。それは、僕から今まで生きて来たすべてを奪い取るってことだった
蒼	え……
主人公	そして予想通り、蒼ちゃんの顔に陰が差す。
大地	それでも僕は、空のおかげで助かった。空の記憶から僕の記憶をコピーすることで、僕は橘大地でいることができた
大地	だけどそれは、やっぱり今までの僕とは違うんだ。今まで僕自身が刻んできた記憶を持たない僕は、橘大地であっても橘大地でない。別人なんだ
大地	その約束をかわした橘大地は、僕じゃない
大地	僕が、その約束を果たしてしまうわけにはいかなかった。空も、そんな僕を約束の相手とは見てくれていなかった。だから僕達は、あの花を見に行っていない
大地	誰も見た人のいないあの花はね、過去にはないんだ。人の記憶の中には咲いていないんだ
大地	あの花は、未来にしか咲かない。過去で作られたこの世界には、決して咲かない
大地	僕と空がすべてを取り戻した、これから先の記憶にしか咲かないんだ
主人公	多くの生命に溢れているように見えるこの街も、この世界も、所詮は『再現』でしかない。
主人公	過去に誰かが見たことのある何かを再現することは出来ても、今この世界にないものを生み出すことはできない。
主人公	過去からしか作れないこの世界に、未来はない。それが、ただの記録でしかないこの世界の限界。真実。
蒼	未来のない、世界……
主人公	蒼ちゃんは呆然と呟くと、静かにベンチから立ち上がった。そして空を見上げ、眩しそうに手をかざす。
蒼	わたしね、子供の頃に目が見えなくなって、ずっと暗闇の中で過ごしてたんだ。そうしたら、青空ってどんな色だったのかすっかり忘れちゃってて……
蒼	でも、この世界では、目の見えた頃のわたしの記憶を使って、こうして空をみることが出来た。歩くこともできた
蒼	この、空いっぱいに広がる色が青なんだ、って感動して……
蒼	でも、違うの？　この空の色は、わたしが見たかった色じゃないの？
主人公	そんなことない。そう否定したくてたまらない蒼ちゃんを、
大地	……違うよ
主人公	けれど僕は、残酷的に、はっきりと切り捨てた。
大地	この色は、この世界を作った誰かが見た色だよ。蒼ちゃんの色じゃない
主人公	光を失った蒼ちゃんにこれを言うのは本当に残酷だと思う。彼女からすれば、それだって十分なもののはず。
主人公	だけど、蒼ちゃんにこの色を捧げた代わりに、自分の色を失った人がいるなら、それはやっぱり違う。
大地	蒼ちゃんが見たいと思ってくれた僕達の約束の花。その咲いた姿は、蒼ちゃんの中にあるかい？
大地	僕の中にも、空の中にもそれはないんだ。だから僕は、それを自分で見に行かなくちゃいけない。僕のこの目で
主人公	蒼ちゃんの手が、問いかけるみたいに、そっと自分の胸に触れる。そのまま静かに目を閉じて、寂しげに口を開いた。
蒼	そっか……咲かないんだね、この花は
主人公	そしてそのまま、もう一度空を仰ぐ。
蒼	この空もみんな、誰かが見た世界を借りているだけ。わたしが見たい空じゃ、ないんだね
蒼	わたしが見てる空じゃあないんだ。誰かが見ている空でしかないんだ
蒼	わたしの見たかった、青じゃあ……ないんだ……
主人公	瞬間、周囲に世界が広がった。
主人公	蒼ちゃんの想いが、記憶が、この世界に直接流れ込んでいるのか、それはまるでホロスコープツリーを使った時の映像みたいだ。
主人公	広がるその草原には見覚えがある。ここは、僕と空の約束の場所。
主人公	三つ目の約束をした、あの場所だ。
主人公	その草原の真ん中に二人が立っている。その上空に広がる青空を見上げ、微笑みながら、眩しそうに目を細めていた。
蒼	うん。今日もいい青空。吹き抜ける風に眩い太陽、綺麗な青空。やっぱり草原っていったらこうだよね
ソラ	この前の雨が降ってた時は、こんな景色も変わってていいね、とか言ってた
蒼	晴れには晴れの、雨には雨の良さがそれぞれあるんだよ。優劣なんてつけられない、それが自然の凄いところです
ソラ	物は言い様……
蒼	こういうものは言ったもの勝ちだもん
蒼	でもね、どっちでも綺麗なのは本当だよ。わたしはね、この世界に来て今まで知らなかった景色をいくつも見ることができた。それがすっごく嬉しい
主人公	蒼ちゃんは青空に目を細めながら、その本心からの言葉をこぼす。
主人公	そして、周囲の緑の草むらをざっと眺めた。
蒼	……大地さんと空さん、だっけ。あのとっても想い合ってる二人
蒼	ここで素敵な約束をして種を残していったけど……どんな花が咲くんだろうね
ソラ	……見たいの、蒼？
蒼	……うん、見たい。あの人達が、あんなに強い想いで残した種だもん。その結果がどんな景色になってるのか
蒼	あの人たちの約束が、この草原をどんな風に変えてるのか
蒼	きっと、見たこともない素敵な景色になるんだろうね
主人公	その風景を思い描いているのか、蒼ちゃんはうっとりと微笑んだ。
蒼	早く、咲かないかな、この花
蒼	それで、この草原を埋め尽くしてくれたら、きっと夢みたいだよね……
ソラ	……大丈夫。必ず咲くから
ソラ	蒼の望む風景を、この世界に広げる。それが、今のソラの存在理由
ソラ	きっと、咲かせる
ソラ	きっと……
主人公	ゆっくりと、その映像が薄れ始める。
主人公	蒼ちゃんとソラ。二人の想いが重なったその風景が消えていく。
大地	今のは……
主人公	そう呟いてしまう僕自身を、心の中で叱咤する。
主人公	分かってる。今のはきっと、蒼ちゃんが初めてあの花を求めた瞬間。ソラが初めてあの花の記憶を集めようって決めた瞬間。
主人公	僕がここで否定してしまったその想いが生まれた瞬間の光景。
主人公	その光景が、今確かに霧散し、消えていった。
主人公	それは蒼ちゃん自身が、この世界を否定してしまった証拠なのかもしれない。
ソラ	蒼……
主人公	悲しげに声をかけるソラに、けれど蒼ちゃんは笑っていた。
主人公	笑って、そして想いを告げる。
蒼	ありがとう、ソラ。あなたのおかげで、わたしは思い出せたよ。青空の色を。わたしが昔見ていた、空の色を
蒼	その色はね、確かに今の空とは違ってた
主人公	ここで笑えるその強さに、蒼ちゃんがどれだけ暗い世界で戦ってきたのかを思い知らされた。
主人公	これだけの強さを持っている蒼ちゃんだからこそ、過去じゃなくて、未来に向かって生きて欲しい。今、心からそう思える。
蒼	ねえソラ。わたしの夢はね、きっとこれでおしまいだから
蒼	だから今度は、この空の先を……本物の空を、見たい。わたしの青空を見たい
蒼	その空を見るために、本当の世界で、わたしの隣にいてくれる？
ソラ	蒼がそれを望むなら。ソラはずっと、いつまでも蒼の隣にいる
蒼	……うん
主人公	蒼ちゃんの手が、ソラをきゅっと抱きしめる。愛おしそうに、そのすべてを抱き止めるように。
蒼	大地さん。今までごめんなさい。わたしのワガママで奪ってしまったこの世界、お返しします
蒼	だからきっと、見てきてね。約束の花
大地	うん。絶対に
主人公	僕の言葉に、蒼ちゃんは嬉しそうに笑ったまま頷いた。
主人公	その目の端に、小さな涙を浮かべながら。
主人公	そして、言う。
蒼	ソラ。この世界を、みんなに返してあげて
主人公	この世界のすべてを終わらせる、その言葉を……。
