輝夜	あ、あの……み、見えますか……？
主人公	輝夜の身体を存分に感じて、僕はもう限界に達しようとしていた。
輝夜	わ、私、もっ！
主人公	そして、その昂ぶりが限界に達する直前、輝夜の膣内も大きく蠢き、僕を搾り取ろうとする。
大地	う、うああぁっ！
主人公	その、今まで以上の快感に、僕は抵抗することもなく輝夜の中へと放出してしまっていた。
輝夜	あ、ああっ！　あああああぁぁぁぁぁぁっ！
主人公	放出された樹液が、輝夜の最奥を撃った瞬間、輝夜も大きな声を上げて達していた。
大地	はぁ……はぁ……お、女の子の中って、こんな気持ちいいんだ……
主人公	想像したことはあっても、本当に味わったことのない快感が、今も僕を包んでいる。
輝夜	あ、あ、あ……大地先輩から、どくどくって……
輝夜	す、凄い、です……びゅくびゅくって動いて……あ、溢れてきて……
輝夜	身体のい、一番奥まで……流れていく感じで……
主人公	輝夜の中で、僕自身は未だに暴れている。
主人公	自分でも信じられないくらいに、放出が止まらない。
大地	ごめん、まさかこんな出るなんて……
輝夜	わ、私もあの……初めてなのに、二回も……
主人公	頬を染めながら、輝夜がそのことを告げる。
大地	それだけ、僕と輝夜の相性がいいってこと、なのかなぁ……
主人公	本当のことであれば、それは凄く嬉しいことだ。
輝夜	でも……
輝夜	これで私、大地先輩に捧げられたんですよね
主人公	上気して頬を染める輝夜は、僕を見つめながらにっこりと微笑んでくれた。
