輝夜	あ、あの……み、見えますか……？
主人公	今までに見たこともないくらいに頬を上気させた輝夜。
主人公	そんな彼女が、自らスカートをたくし上げて、僕にショーツを見せ付けている。
主人公	なんとも言えないくらいに背徳的な感じがして、思わず背筋をぞくりとした感覚が走り抜ける。
大地	う、うん……なんか、凄い光景……輝夜が自分で、なんて……
輝夜	あの、今日は私からお願いしたんですし、私の方が尽くして当然、ですから……
主人公	小さく震える手が、健気にスカートの高さを維持している。
大地	でも、輝夜震えてるし……無理しなくても……
輝夜	い、いいえ、大丈夫です。大地先輩が相手ですから、怖くなんて……
輝夜	で、ですから、どうぞ大地先輩の好きに触れて下さい。お望みのことがあれば、なんでも……
大地	こら
主人公	あまりに無理をしているのが丸分かりな台詞。
主人公	僕は思わず、輝夜の額を軽く突付いていた。
輝夜	え？
主人公	怒られるとは思いもしなかっただろう輝夜は、きょとんとした目で僕を見る。
大地	そりゃあ、僕も輝夜のこと抱きたいし抱くけど、身体だけが欲しいわけじゃないんだから。そんな無理させて抱けるわけないだろ
大地	その、僕だって初めてなんだから、こういうのはお互いに勉強していかないと
大地	だから、とりあえず輝夜、何をしてほしい？
主人公	そんな僕の質問に、輝夜は少しホッとしたような顔を浮かべた。
輝夜	す、すみません……あの……電気を消してもいいですか？　は、恥ずかしくて……
主人公	そして、小さく消え入りそうな声で輝夜はお願いしてくる。
大地	うん、分かった
主人公	僕は当然、その願いを聞きれた。
輝夜	ありがとうございます……でも、その、見えなくなったりとかは……
大地	大丈夫。輝夜が頑張ってくれてるから、これでもよく見えるよ
大地	それに月明かりって、なんか電気よりもよっぽどいやらしい感じするし
主人公	心配そうに聞く輝夜に、軽く笑って答える。
主人公	実際、月明かりに照らされた輝夜はとても綺麗だった。
輝夜	あ、あうぅ……
大地	それじゃあ、あの……触る、よ？
主人公	僕も、これ以上我慢するのは限界に来ている。
輝夜	は、はいっ……ど、どうぞっ
主人公	輝夜が頷くのを待ってから、僕はその秘所に指を這わせた。
輝夜	ひぁんっ
主人公	指が触れると同時に漏れる、輝夜の驚きの声。
大地	ご、ごめん。強かった？
輝夜	い、いいえ……いいえ……その、初めての感覚だったので、つい……
輝夜	つ、続けて下さい。大丈夫、ですから……
大地	そ、それじゃあ……うわ……本当に割れてる……
大地	タイツの上からでも、こんな柔らかいの分かるんだ……
主人公	服の上からでもはっきりと分かるその柔らかさと、体温。
主人公	今、自分が輝夜の大事な場所に触れていると、思い切り自覚させられる。
輝夜	あ……ん、くっ……
輝夜	こ、これが……だ、大地先輩の、指……
輝夜	ふぁ……あ……な、なんだか、変な感じ、です……か、身体が震えて……
主人公	ゆっくりと動く僕の指に合わせて、輝夜も素直な反応を返してくれる。
主人公	自分が輝夜を感じさせていると思うと、どんどんと嬉しくなってしまう。
主人公	僕はそのまま、輝夜の上着に手をかけて、その胸元を露出させた。
主人公	恥ずかしさからか、輝夜は僕の行為をただ黙って受け入れている。
大地	こうなると、大きいのがより分かるね
大地	手のひらになんて収まらなそう……
主人公	目の前に現れた、ブラジャーに包まれたままの輝夜の胸。
主人公	それは服の上から感じていた以上のボリューム感を誇っていた。
輝夜	ど、どうぞ。大地先輩の手に、収めて下さい……
大地	う、うん……
主人公	輝夜の言葉に促されるように、僕はその胸を手の平で包んだ。
輝夜	あ……
輝夜	大地、先輩の手……お、大きいです……
主人公	電車の中でのアクシデント以来の、輝夜の胸。
主人公	そして今はあの時と違い、服の上からではなく下着越しの感触。より直接に近い感触。
大地	そんなことないよ。僕なんて、男子の中じゃあ低い方だしね。やっぱり手も
大地	でも、輝夜の胸は本当に大きい……ブラの上からなのに、こんなにフカフカで、それに凄い弾力……
主人公	輝夜の胸は、想像以上に大きくてとても柔らかい。
主人公	それでいて指をしっかりと押し返してくるほどの弾力があった。
輝夜	ふぁ……あ……だ、だめ、です。大地先輩の手、動くと……こ、声がでちゃう……
主人公	それほど強く触れた訳でもないのに、輝夜は大きく反応している。
主人公	その無理に抑えようとする声が可愛くて、僕はもっと聞きたくなってしまう。
大地	全然平気だから、どんどん声出してほしいな。輝夜の声、聞きたい
輝夜	そんな、は、恥ずかしいですからダメ、です……
大地	それなら、これだとどう……？
主人公	輝夜の返事を待たずに、僕は胸を覆っていたブラジャーをずり上げた。
輝夜	あ……
主人公	下着の抑圧から解放された乳房が、ぷるんと揺れる。
主人公	それは本当に綺麗で、ずっと見ていたくなるような、そんな胸だった。
大地	輝夜の胸……ツンって上向いてて……綺麗な形してる
大地	凄いね……乳首、もうこんなに……
主人公	しっとりとして吸い付きそうな肌。
主人公	誰もが羨むようなボリュームで、しかも形も理想的と言っていいくらいに整っている。
主人公	上向きの乳房の先端では、薄い桜色の乳首が、少しだけその存在を主張していた。
輝夜	んうっ……あ、や、ああっ
輝夜	だ、大地、せんぱ……そ、そんな……つまんじゃ、だ、だめで……
主人公	こんなものを見せられて、大人しくしていられる訳がない。
主人公	僕はその弾力に満ちた乳房を味わいながら、先端の可愛らしい乳首を指に挟む。
大地	うわ……コリコリってしてる……胸も……
主人公	初めて直接触れる女の子の胸と乳首。
主人公	その行為に自ら興奮しつつ、輝夜の胸の感触を味わう。
輝夜	はあんっ
主人公	僕の指が、輝夜の乳房にめり込んだ。
主人公	それだけで輝夜は大きく身体を震わせてしまう。
大地	ち、直接触ると、こんなに違うんだ……
大地	柔らかくて……吸い付くみたいで……
輝夜	あ、あう……大地先輩の手が、あ、温かくて……あ、や、やあんっ
主人公	必死で声を抑えようとしつつも、次第にその声が大きくなり始めている。
大地	やっぱり、収まりきらないね……うわ、本当にゴムマリみたい……
主人公	僕の手の平には収まりきらない輝夜の胸。
主人公	指がめり込み、好きに形を変えるのにすぐに元に戻ろうと押し返してくる。
輝夜	ふあ……あぅ、ん、う……あ、ああっ
輝夜	や、あ、触り方、優しくて……何かぴりぴりって……
主人公	胸だけでも充分に感じてくれているらしい輝夜。
主人公	このまま胸だけを弄り続けたい欲望を感じつつも、僕は再び輝夜の秘所へと手を伸ばした。
主人公	下着越しでなく、直接輝夜の秘所へと指を這わせた瞬間。
輝夜	ぴあっ
主人公	輝夜は今まで以上に大きな声を上げた。
大地	うわ、凄い反応。ごめん、やっぱりここは早かったかな……
主人公	それは当然と言えば当然のことだけど。
輝夜	す、すみませんっ……わ、私が慣れてないだけですから、ど、どうぞ……
主人公	申し訳なさそうにしつつ、輝夜は僕の行為を許してくれる。
大地	う、うん……輝夜の、少しヌルヌルしてきてるね……
主人公	指先に、輝夜の秘所から溢れた蜜が絡んでいた。
主人公	そのことに少し驚きつつ、さらに指を這わせていく。
輝夜	あ、あう……い、言わないで下さい……大地先輩が優しいから、どうしても……
輝夜	あ、ああっ……や、あ、ゆ、指が……きゃうっ
輝夜	あ、あ、あ、ああっ、や、こんな……ぞくぞくって……んうっ
主人公	一番大事な場所には触れないように、ゆっくりと指先を動かした。
主人公	秘所に生えた柔らかな毛も、すでに蜜にまみれて濡れているのが分かる。
大地	う、うわ、凄い濡れてきた……もうこんな……
主人公	その割れ目に触れただけで、中からはトロリとした液体が溢れてきた。
輝夜	ひゃっ……あ、あふ……ん、んう……っ
輝夜	だ、だめ、です……私、指、が動く度、に……びくん、って……
輝夜	ふあ、あ、ああんっ
輝夜	も、もう、た、立って……られ……ん、あ、ああっ、はうっ
主人公	僕の指先が触れただけで、輝夜の身体は大きく震えそのまま力が抜け落ちて行く。
主人公	そんな輝夜を支えながら、僕は自分のベッドの上に彼女を誘った。
主人公	今度は、僕自身が彼女をゆっくりと見て、味わえるように。
輝夜	あ、あの、こ、この位置って……
輝夜	大地先輩の、顔が……
主人公	僕の目の前には、輝夜の大事な場所。
主人公	そしてその目線を少しずらせば、今も揺れる大きな胸と恥ずかしそうに頬を染めた輝夜の顔がはっきりと見える。
主人公	正直に言って、これは絶景だ。
大地	う、うん……輝夜の濡れてるのが、凄いよく分かるよ
大地	タイツまで染みになって……
大地	それに、輝夜の胸……凄い……
主人公	素直な輝夜は、僕のこんな無茶なお願いにも従ってくれている。
主人公	それがなんだか凄く嬉しい。
輝夜	あ、あんまり見ないで、下さい……は、恥ずかしくて……どうにかなっちゃいそうです……
主人公	そんなリアクションこそが、最高に僕自身を盛り上げてくれる。
輝夜	あ……
主人公	まずはタイツを脱がして、そのショーツをはっきりと露出させた。
大地	やっぱりタイツがあった方がいやらしいけど、この方が輝夜の可愛い下着、よく見えるね
大地	それに、濡れちゃってるのも……
主人公	目の前に晒されている下着は、すでに中央だけに留まらず染みが広がっているのが見て取れる。
輝夜	だ、大地先輩、えっちです……
輝夜	で、でも……大地先輩ですから……が、ガマン、できます……
主人公	僕の言葉に、頬を染めながらも輝夜はじっとしてくれていた。
輝夜	ふぁ……
主人公	そんな彼女に答えるように、ショーツの上からゆっくりと彼女自身に触れる。
大地	さっきより熱くて、柔らかい感じがする……
輝夜	あ、ああ……だめ……電気みたいなのが、は、走って……
輝夜	んんっ！　あ、あう……ん、くっ
主人公	今までの愛撫で、充分に柔らかくなっているのかもしれない。
主人公	ショーツ越しだというのに、輝夜は先ほどまでよりもずっと強い反応を返してくる。
大地	凄い。どんどん熱くなって、濡れてくる……輝夜、これ、下ろすよ……？
主人公	このままでは、もう下着の役割を果たさないくらいの勢いだった。
輝夜	あ……は、はい……大地先輩が見たい、なら……
主人公	輝夜の頷きを待ってから、僕はその秘所を覆う最後の一枚をゆっくりと引き剥がしていく。
主人公	秘所の奥から伸びた数本の糸が、凄くいやらしい。
大地	うわ……ほ、本当にピンク色……
主人公	正真正銘、初めて間近で見る女性自身。
主人公	輝夜のそこは綺麗なピンク色で、すでに溢れている蜜で光っているみたいに見えた。
輝夜	あ、あうぅ……あ、あんまりじっくりみないでください……
主人公	僕の言葉に、輝夜が泣きそうな声を上げる。
大地	ご、ごめん……だけど、これ、凄い綺麗で……ヘアーも薄めでふわふわしてて……
大地	でも、ここに入れるんだよねえ……？
主人公	今はまだ入り口を閉ざしている、輝夜の秘所にゆっくりと触れる。
輝夜	きゃうっ！
大地	これ、指も入らなそうだけど……ほ、本当にここ？
主人公	軽く触れる程度では、ここに何かが入るなんて思えない。だけど、そこ以外にそれらしい場所は見当たらない。
主人公	……この上の穴は小さすぎるしなあ……。
輝夜	た、多分……で、でも、私も女の子ですから、大丈夫です……
主人公	輝夜の答えも、どこか自信なさげだった。
大地	でも、もっと濡らしておいた方がいいよね……
主人公	僕はそう決意して、輝夜の割れ目への愛撫を続けていった。
輝夜	は、あ……あ、あうっ、ひ、ひぁ……ん、あぁんっ
輝夜	や、あ、ああっ……大地、先輩、指……う、動いて……んくうっ
輝夜	は、あ……あふ……ん、んあぁっ！
主人公	ゆっくりとほぐすように指を這わせ、そしてその隙間に指を滑らせる。
主人公	潤滑油になる輝夜から溢れる蜜は、留まるところを知らないかのように、中からどんどんと流れ出していた。
大地	輝夜、敏感なのかな……触れば触るだけ、どんどん奥の方から蜜が出てくる……
大地	僕の手も、もうこんなだよ……
主人公	もはやびしょびしょになった指先を、輝夜に見せ付ける。
主人公	その指先から輝夜は、恥ずかしそうに目を逸らした。
輝夜	あ、ああっ……は、ぁ……ん……はぁ、い、言わないで……あぁっ……ください……
輝夜	んあ……あ、はああっ……んく、ひ！　はぁ……んっ
輝夜	あ、や、あ、こんな……っ
輝夜	だ、だめ……あ、あうっ！
輝夜	はぁ……はぁ……ん、う……はぁ……だ、大地せんぱ……だ、だめ……っ
主人公	愛撫を続け、次第に割れ目がほぐれ出した頃、輝夜がその動きを止める。
大地	輝夜、どうかした？
輝夜	ご、ごめんなさ、い……お、下ろして……きゃうんっ
主人公	急にそう言い出した輝夜。その身体が、ぷるぷると小さく震えている。
輝夜	あ、はぁっ……ん、んあ、ああ……だ、だめ、です……も、もうっ
輝夜	大地、先輩！　お、おねがいっ、ゆ、許し、て……っ
主人公	僕の言葉に返答するよりも早く、輝夜の身体が今度は一際大きく震えた。どうやら、軽くでも達してしまったみたいだ。
輝夜	や、やあんっ！
主人公	そして、輝夜の抑え切れない声と共に、尿道から黄金色の液体が溢れ出してくる。
大地	え！？　こ、これって……お、おしっこ？
主人公	僕の顔に、容赦なく降りかかってくるその液体。
輝夜	い、言わないで下さい！　お、お願いですから、どいて下さい！
輝夜	と、止められないんですっ……いや、大地先輩にかかっちゃってるっ！
輝夜	き、汚いですから、先輩、よけてくださいっ
主人公	思い切り慌てる輝夜。
主人公	だけど、自分の意思ではその勢いを止められないみたいだ。
大地	うわ……女の子ってこんなとこから、こんな風に……
主人公	逆に僕は、初めて見る光景に目を奪われていた。
輝夜	お願いですから、見ないでぇっ
主人公	その羞恥から逃げ出したいかのように、輝夜は大きく首を振る。
主人公	それでも僕は、その光景をじっと眺め続ける。
大地	でも、なんか綺麗……
大地	ん……
主人公	僕は、輝夜から溢れるその黄金水へとそっと口を運ぶ。
主人公	口の中に広がる、温かな液体の味。これが輝夜の味なんだって思ったら、汚いなんて感覚もまるで感じない。
輝夜	え、ええ！？
輝夜	だ、だめです！　や、やめて、大地先輩！
輝夜	そんな、汚いですから！　お、お願いです！
主人公	そんな僕を見て、輝夜は必死で止めるように懇願してきた。だけどごめん、やめられない。
大地	ん……輝夜のだもん……平気……ん……
輝夜	へ、平気じゃないです！　や、あ、し、舌が……ひゃぁんっ
輝夜	あ、ああ！　やあ！　大地先輩、本当に、本当にお願いです！　も、もう！！
主人公	口の中に溢れる、塩気を含んだその液体。
主人公	股間を濡らしていた粘性のある蜜と共に、僕はそれを口の中へと舐め取っていく。
大地	……終わり、かな？
輝夜	あ、あううぅ……さ、最後までぇ……
輝夜	大地先輩、ひ、酷いです。私、は、恥ずかしくて、も、もう……
輝夜	大地先輩の顔、み、見られません……
主人公	放尿が終わって放心した輝夜は、首筋まで真っ赤になっていた。僕の今の行為が、本当に恥ずかしくてたまらなかったんだろう。
大地	ご、ごめん。なんだか、見てたらすごく綺麗だったから……
大地	その、味もそんな悪くないかなあ、なんて……
主人公	その様子を見ると、さすがに少し悪いことをした気分になって来る。
輝夜	だ、大地先輩、変態さんですっ
輝夜	わ、私の、お、おし……なんですよ、飲んだの！
大地	いや、なんだか本当にそういう風に思えなくて……ご、ごめん。なんでもしていいって言われてたからつい
主人公	どういう訳か、本当に汚いとかそういう風には思えなかった。
主人公	ただ、輝夜の全てを受け止めたいという気持ちだけだったんだけど……。
輝夜	あう……た、確かにそう言っちゃってましたけど……
輝夜	……そう、ですよね……私が言ったんですから、ガマンしないと……
輝夜	大地先輩が喜んで下さったんだって……そう思うことにします……がんばって……
主人公	僕の目を見て、頷いた輝夜は自分に言い聞かせるようにしつつ、一応納得してくれた様子だった。
主人公	そして輝夜は、僕の股間の上へと移動した。
輝夜	大地先輩の、凄い……
輝夜	こ、これが男の人、なんですね……
主人公	すでに今までの行為で、苦しいくらいに張り詰めている僕自身。
主人公	それを上から見下ろすようにしている輝夜には、わずかに怯えが見えた。
大地	本当にこの体勢でいいの……？
主人公	この体勢だと、輝夜だけに負担を強いることになりそうなんだけど……。
輝夜	は、はい……今日は私が、大地先輩に尽くす日ですから
輝夜	あ、あの、い、いきますっ
主人公	僕の心配を余所に、輝夜はいきなり行動を始める。僕へと指を這わすと自分自身へと合わせ、ゆっくりと腰を降ろし始めた。
輝夜	ひいっ！
輝夜	い、痛っ……あ、ああ……っ！　さ、裂けっ！
主人公	輝夜の指に誘われた僕自身が、少しずつ輝夜の中へと侵入していく。小さな何かを引き剥がすような、引き裂くような感覚が伝わってくる。
大地	か、輝夜、大丈夫！？
主人公	同時に感じる、ゆっくりと柔らかく温かいものに包まれていく感覚。
主人公	ただ、今はそれよりも辛そうな輝夜の方が気になってしまう。
輝夜	あ、あぐ……う……は、ぁ……はぁ……あ、ああ！
輝夜	こ、こんな、に……うぐっ！
輝夜	で、でも、あ、あと少、し……だ、大地先輩、のなんだから……っ！
主人公	痛がる素振りを隠さない輝夜は、それでもそのまま僕を包み込もうとするのを止めない。
大地	輝夜、そんな無茶はしないでも……
輝夜	へ、平気、ですっ！　も、もう……ほ、ほらっ！
主人公	そう言って、輝夜の身体が一気に僕自身を飲み込んだ。
主人公	途中に、なにかを突き破るような感覚と共に、僕は輝夜の中にいるという感覚を味わう。
輝夜	は、入っちゃいました、よ。大地先輩……
主人公	痛みに耐えながら、輝夜は頑張って微笑みかけてくれた。
大地	輝夜……相当痛いんじゃあ……
主人公	だけどその表情からは、確かな苦痛が伝わって来てしまう。
輝夜	え、えへ。痛い、ですけど……不思議です……凄く嬉しくて……
輝夜	私の中に……大地先輩が、いるんです……私、女の子に生まれてきて、よかった……
輝夜	ど、どうですか？　私の中……
主人公	今も痛みを感じたままに答える輝夜。
主人公	ただ、その言葉にも嘘はないことが僕に伝わってくる。
大地	う、うん。凄い熱くて……き、きつくて……す、凄いとしか……
大地	なんか、輝夜が僕に貼り付いてきてるみたいで……
主人公	だから僕も、輝夜の言葉に素直に答えることにする。
輝夜	それじゃあ……もっと気持ちよくなって、下さい……
主人公	僕の返事に気を良くしたのか、輝夜はそのまま腰を動かし始めた。
大地	うあっ！
大地	か、輝夜、ストップ！　こ、これ、凄すぎてっ
主人公	少し浮いた腰が、ゆっくりと下ろされまた上がる。
主人公	その繰り返しによる小さな摩擦が、信じられないような快感を僕に与えてくる。
輝夜	はぁ……はぁ……き、気持ちいい、です？
主人公	輝夜の中が、僕の中に絡み付いて離さない。
大地	よ、よすぎるっ
主人公	油断すれば、すぐにでも解き放ってしまいそうなほどの快感だ。
輝夜	あ、あはっ。嬉しいです。私も、すっごく痛いんですけど……すっごく気持ちよくて……
輝夜	大地先輩のが、私の中を上下するだけで、も、もう、ゾクゾクって、背筋にきて……
輝夜	あ、ああっ！　こ、こんな、の、初めてで……あ、ああんっ！
主人公	痛みと悦びの混じったような輝夜の声。
主人公	そんな彼女が動くだけで、僕は翻弄されてしまう。
大地	ぼ、僕も、輝夜が動くだけで、ゾクゾクって震えて……こ、こみ上げてきて……
大地	ごめんっ。本当にもう、全然押さえられ、ない！　で、出ちゃうから、輝夜！
主人公	初めて味わう快感とはいえ、自分でも信じられないくらいに早く達してしまいそうだった。
主人公	必死で押さえ込もうとしても、輝夜の膣内の擦れが、魅惑的に揺れるその乳房が僕の衝動を押さえさせてくれない。
輝夜	だ、大丈夫、です。今日は、平気、ですから……な、中で……
輝夜	大地先輩との初めて……お、奥に欲しい……あ、はあん！
輝夜	あ、ああ……！　大地先輩、お、おっきのが……んっ！　こ、こすれて！
輝夜	あ、ん、ああぅっ、は、はふ、ん、んあぁ！
主人公	輝夜は、一切の容赦なく腰を上下させ、その快感を止めてくれない。
大地	あ、あぐ！　か、輝夜の何かが、か、からみついて……
輝夜	だ、ダメ……おかしく、なっちゃいます……わ、私……！
輝夜	はぁ……はぁ……んっ、う、あぁ……っ！
輝夜	ぞ、ゾクゾクって……あ、ああ、ひ、んあぁっ……は、はうっ……！
輝夜	あ、ああっ、はああ、んっ、くぅ、あん、は、はあ、あああっ
主人公	少しずつ増えてくる輝夜の蜜が、その動きにぐちゅぐちゅと水音を立てる。
主人公	その音がまたいやらしく感じて、僕を更に感じさせていた。
大地	輝夜の中、グ、グチャグチャ、で！　も、もう！
大地	ご、ごめん、輝夜！
