主人公	この世は、五つの世界と、四つの種族で出来ている。
主人公	魔界。魔族と呼ばれる、魔力を破壊の力に使うことに長けた種族が住む世界。
主人公	神界。神族と呼ばれる、魔力にて様々な奇跡を起こす種族が住む世界。
主人公	竜界。竜族と呼ばれる、魔法が使えない代わりに、身体能力に長けた、女性だけの種族が住む世界。
主人公	人界。人族と呼ばれる、魔力を生み出せない代わりに、様々な知恵にて乗り切ることに長けた種族が住む世界。
主人公	そして、五つ目。学園世界、トリニティ。
主人公	魔族、神族、竜族と、三つの種族がその知恵と力を結集し作り上げた世界。
主人公	世界を守護する勇者を生み出す場所として、魔族、神族、竜族、人族。四つの種族が、その心を持って繋がろうとしている世界。
主人公	けれど今は、まだバラバラ。
主人公	その未来を求め、寄り添い続ける少年と少女達が、共に住む世界。
主人公	この世は、五つの世界と、四つの種族で出来ている。
主人公	皇女は、見上げていた。
主人公	学園世界の中心、大きな湖に浮かぶ巨大な城。それこそがトリニティの校舎。
主人公	かつて、全世界を巻き込んだ凄惨なる戦争、滅界戦争。
主人公	その戦争をきっかけとして作られた、勇者を育てるための学園、トリニティ。
主人公	自らの力を信じ、未来と勇名と富とを求めて、この門をくぐる若者達。けれど当然ながらその門は決して広くない。
主人公	勇者とは、世界を背負う存在。それを目指すからには、知、勇、武、すべてにおいて相応の力を求められる。
主人公	無事に全課程を修了してこの門に背を向ける者達は、入学時の半数ほどだとも言われている。
皇女	これが、トリニティ……
主人公	その独特の黒髪は、他の種族には決してありえない。紛れもない人族の証明。
主人公	その整った容姿には、まだ少し幼さが伺える。けれどもその二つの瞳には、真っ直ぐ突き進む強い意志の光があった。
皇女	二年、か……
主人公	そう呟きながら、皇女は一人の男性の顔を思い浮かべる。最後に会ってからもう二年。今ではもう少し大人っぽくなっているだろう。
皇女	てっきり、すぐダメ出しされて帰ってくるって思ってたんだけどなあ
主人公	その口元がわずかに緩む。
皇女	つまり、まだここで頑張ってるってことだよね。姫にぃ
主人公	当然それは、あくまでも、まだ在籍してるというだけだ。落第をしている可能性だって充分ある。下手をすれば、自分と同級生になる、なんていう可能性すらも。
主人公	滅界戦争の原因となった上、貧弱な力しかもたない人族は、他の種族からすれば蔑みの対象。下手をすれば路傍の石だ。
主人公	そんな環境で一人耐え続けるだなんて、どれだけの強い心が必要か。どれほど心細いことか。
主人公	事実、今こうしている自分の横を通っていく連中のほぼすべてが、そんな視線を向けていく。蔑み、馬鹿にし、あざ笑っていく。
皇女	でも、もう大丈夫っ。これからは、あたしがいるからね
主人公	その顔に、自信に満ちた笑みを浮かべると、皇女は一歩を踏み出した。湖上に浮かぶ巨大な城。そこへと続く一本の優雅な橋。
主人公	白鷺皇女。本年度唯一の、人族の新入生。
主人公	二年前、周囲の反対を押し切り、その夢のために単身トリニティへと向かった兄を追い、今こうして同じ場所へと立っている。
主人公	皇女は、その新しい舞台を踏みしめるかのように、一歩一歩、確かな歩みで進んで行く。
？	お前、人族か？
皇女	え？
主人公	不意に呼びかけられた声に思わず反応してしまったのは、その呼び声に一切の負の感情がなかったからだろう。
主人公	蔑みも嘲笑も見下しすらもなく、ただの疑問だけが含まれた言葉。
主人公	振り返ってみれば、そこには一人の、神族らしき少女がいた。
主人公	小柄……と呼ぶにはまだ小さすぎる。むしろ子供、と言うべきだろうか。そうとしか見えない、けれども可愛らしさと綺麗さを兼ね備えた容貌の少女。
主人公	一瞬、関係者の子供か、などとも思ったが、着ているのは紛れもないトリニティの制服だ。信じられないが、この少女もここの学生らしい。
皇女	そう、だけど……あなたは神族……よね？
カミシア	ああ。カミシアだ、今日から正式にここの学生となる。まあ、今さらだがな
主人公	正式、ということはどういうことだろうか。思わず皇女は首を傾げる。だが、それ以上に不思議なのは、目の前の少女が自分に対し普通に接していることだ。
主人公	『人族』である自分に。
カミシア	ん？　どうかしたか？　空気を入れすぎた風船みたいな顔をして
皇女	それ、どんな顔……あ、その……珍しいな、って思って
皇女	百歩譲って、多少親交のある竜族ならともかく、神族の子が、あたしが人族だって分かってて声をかけてくるなんて
主人公	皇女の疑問に、カミシアはしばし不思議そうに首を傾げると、やがて納得いったとばかりにポンと手を打った。
カミシア	ああ、そういえばあったなそんな設定
皇女	いやあの、設定じゃなくてさ、メチャクチャ重要なことなんですけど。あたしたち人族にとっては、特に
カミシア	確かに、それで随分と苦労をしてたな。だがまあ大丈夫だ。私はそんなこと気にしないし
皇女	気にしないって……なんか、不思議な子ね、あなた。こんなに気安い神族、初めて会った……
カミシア	そうか？　なら安心しろ。私なんかよりもよっぽど気安くておかしな神族が丁度来た
主人公	カミシアは楽しげにそう言うと、視線で皇女を促す。皇女がその視線を追った途端、わっ、とざわめきが起こった。
主人公	恐らくは新入生だろう、緊張気味の学生達、それも特に神族が何やら騒いでいる。まるで有名人でも見たかのように、キャアキャアと目を輝かせていた。
主人公	いや、ように、じゃない。まさしく有名人を見たようだ。
主人公	広がっていくざわめきの向こう。少し離れた場所から、鮮やかな銀髪の姉妹が真っ直ぐこちらへと歩いて来るのが見える。
皇女	あの銀髪……ノート＝ルゥム！？
主人公	神族の第一王女。数百年ぶりに誕生した完全銀髪。その名前は人界においても広く知られている。
主人公	しかもその強さは将来の神界を担うとまで言われている。戦士を目指す者にとっては、間違いなく憧れの存在だ。
主人公	そして、一緒に歩いてくる小柄な少女はまず間違いなく、その妹、アミア＝ルゥムだろう。
主人公	噂では、その魔力は部隊の一つや二つ、軽々と焼きつくすとか。
主人公	こうして離れた場所から見ているだけで、オーラのようなものをまとっているのが感じられる。
皇女	さすがはトリニティ、っていうのかな。あんなビックネームが当たり前のように歩いてるなんて……
皇女	にしても、なにあの容姿……噂なんかより遥かに綺麗じゃない
主人公	ルゥム姉妹以外にも、全世界に名を知られる存在が何人か在籍しているのは皇女も当然知っていた。
主人公	学園生活を続けていれば、どこかで会うなり戦うことなりあるかもしれないと期待はしていたが、まさか初日から出会うとは。さすがに、少し興奮してしまっている。
カミシア	まあ、ノートママだからな。だが、あの姿に騙されない方がいいぞ。ノートママの可愛らしさはその中身のどじっこぶりにあるからな
皇女	え？　なにそれ。どじっこ？　ていうか、ノートママ！？　ノート＝ルゥムって、ひょっとして、あの歳でもう一児の母だったりするの！？
カミシア	まあ、三割ほど正しくて、七割ほど不正解だな
皇女	どういうことよ、それ……
カミシア	まあ、気にするな。いずれ分かるかもしれないしな
主人公	言って、さらりと流してしまうカミシア。どうやら、少なくとも今は教えてくれるつもりはないらしい。そうなれば、これ以上ツッコムのもはばかられる。
皇女	……まあ、いいか。その口ぶりだと、いつかは教えてくれそうだし
皇女	そういえば、挨拶まだだったわね。あたしは……
主人公	そこまで言った瞬間、
主人公	学園のチャイムが高らかに鳴り響く。どうやら結構まずい時間のようだ。これから入学式の会場へと移動することを考えればのんびりはしていられそうにない。
カミシア	名乗りの途中で悪いが、ちょっと急がないとまずい時間のようだな。とりあえず、続きは場所を移してからの方がよさそうだ
皇女	そうね。さすがに初日から問題起こすのはさけたいわ。特にあたし、人族だし
主人公	人族が問題を起こした場合、その罪は大抵の場合通常より重いものにされる。しかも、そのマイナスは決して消えることなく積み重なる。
主人公	皇女とカミシアは頷き合うと、一緒に走り出した。
