主人公	多少の騒ぎはあったものの、入学式も無事終了。その後の簡単なホームルームも終わり、俺達はみんな、休憩室へと集まっていた。
主人公	もっとも、何人かはここにはいない。寮の方で、新入生達を受け入れる準備に奔走しているはずだ。
主人公	学園世界は、許可を得た者しか入ることを許されていない。それはトリニティの生徒であっても同じで、入学初日を迎えるまではまだ生徒でないとして拒否される。
主人公	入学試験などもそれぞれの世界の方で行われるため、すべての新入生達が今日の朝、初めてこの世界へと足を踏み入れたことになる。
姫	どうだ、初めて訪れたトリニティは
主人公	俺は、すぐ隣で緊張に硬くなっている皇女へと、苦笑しながら声をかけた。
皇女	ど、どうもなにも、その……
主人公	ガッチガチに固まったまま、テーブルについているみんなを見回す皇女。
皇女	……ヴェル＝セイン……魔界の黒翼……で、こっちがフォン＝テルム……竜魔の紅刃……
皇女	それに、ウルル＝カジュタ……竜界の金鱗……
オペラ	わくわく
皇女	神界第二王女のアミア＝ルゥムに……
オペラ	わくわくわくわく♪
皇女	人界の剣術界で記録を塗り替えていった、白川紅……
オペラ	わくわくわくわくわくわくわくわく♪♪
皇女	四世界の、オールスターみたいなレベルじゃない、これ……
オペラ	あっれー、さすがは白鷺さまの妹さまですよー、空気読めませんよー。この、いつ呼ばれるんだろう嬉し恥ずかしるんるん気分をぶちこわされちゃった私はどうすればー
姫	ウルルでも抱きしめてモフモフしてて下さい
オペラ	ウ・ル・ル・さ・まーーーーーーー！！
ウルル	うにゃーーーーーー！！　にいさま、酷いですー！！
アミア	うっわー、綺麗なルパンダイブ。ウルルちゃん、よける暇すらなかったよ
主人公	まさか本当に実行するとは……しかもあんな早業で。さすがに俺の方がビックリだ。
ミヤ	ふう。こういう時、有名でないというのは寂しいですよねえ
カミシア	まあ仕方ないだろ。私もお前も、現時点ではまったくの無名なんだ。ここならまだしも、外の世界じゃ知ってる奴なんて一人もいないはずだ
紅	いや、それを言ったらあたしも同じだぞ。人界でもそんな大したことしたつもりはないし、他の世界ともなれば……
紅	記録を塗り替えた、とはいっても、あくまで人界での話だからなあ。まさしく井の中の蛙だ
ミヤ	能力的には、この学園でもトップレベルなんですけどねー。私なんて、白鷺ハーレムの遠距離最大火力にして最大の盾、ですよ
アミア	意義あーり、だよミヤちゃん！　火力だったらわたしの神話級がはっきりＭＡＸ！
ミヤ	アミアちゃんは、遠距離捨てて近距離飛び込みますからねえ
アミア	う……魔導師としての存在価値を全否定されてるよぉ……でも何も言い返せねえっ
姫	あー、ミヤ？　その、ハーレムって言い方はさすがにその……特に今日はほら、妹もいるわけで……
ミヤ	でしたら、私も早く白鷺くんの手で傷物にしてください。まったく、いつ忍び込んできてくれるのかと、毎日待ってるんですから
姫	いやあの、それは……
皇女	……姫にぃ……今の発言はどういうことかな
主人公	ニッコリ笑顔で、けれど確かな怒りを浮かべて尋ねてくる皇女。いや、俺はむしろ必死に自分を抑制してきたわけだし、怒られるところじゃないような……。
ミヤ	ちなみに、白鷺ハーレム嘗めてはいけません。神界の銀月さんもいらっしゃいますよー
皇女	はい？　神界の銀月……って、ノート＝ルゥム！？
アミア	ふふーん、お姉ちゃんのお兄ちゃん好き好きっぷりは嘗めたらダメだよー。ヴェルさんにだって負けないからねー。特におっぱい
ヴェル	あら、言ってくれるじゃない、アミア。ヒメへの献身で私以上なんて絶対いないわ。ま、まあ、その……胸は、さすがに……
フォン	フォンも今の発言には異議ありです。フォンの姫先輩への恋慕は、他の誰にも劣ってない自信がありますよ。もっとも……その……胸は……
カミシア	ノートママ、ぶるんぶるんしてるしね。まあ、あれに挑めるといえば……
紅	な、なんだみんなしてあたしの胸に……や、ダメッ、見ないでっ
アミア	相変わらず恥ずかしがりやだよねえ、紅さん。そんな立派なもの持ってるくせに。ちくしょう、お姉ちゃんが持っていかなければ、わたしだって今頃はっ
ウルル	アミアちゃん、ダメですよ。そんなありもしない願望口にしちゃ
オペラ	ああ……数少ないお仲間に、ざけんなてめーんなことあるわけねーだろ自分の身体をちゃんと把握しろ！　と笑顔で語りかけるウルルさま……すーぱーらう゛りー♪
ミヤ	でも、そういえばノートちゃんの姿がありませんね。どうかしたんですか？
アミア	ほら、お姉ちゃん、神界に帰ってるお母さんの代わりに、寮の管理人さんになったでしょ。今日から新学年だし、頑張ります、って先に
ウルル	あ、そうか。新入生さんたちの受け入れとかありますしね
主人公	学園長のトリアさんも、寮長であるルアンさんも、今はこの世界にいない。
主人公	ゲンさんの起こしたトリニティ占拠事件の後始末と、それに伴う学園地下に封印された魔族の魔剣、神族が秘密裏に行ってきた憑依兵器。それらの対応のために一時帰還した。
主人公	雨降って地固まるというべきか。あの事件をきっかけとして、トリニティ内の魔族と神族は、多少ではあるがその関係を緩和させた。
主人公	せっかくだから、このタイミングで色々と片付けてしまえ、ということらしい。互いの種族のためにも。
主人公	最も、ヴェルとノートが言うには、
ヴェル	私とヒメが、いつ結婚してもいいように下準備に行ってくれたのよね
ノート	はい。ボクと姫くんが、明日結婚しても、みんなが祝福してくれるようにがんばってくれてるんです
主人公	だそうで。
主人公	二人の間に激しく散った火花は忘れよう。ウルルもぐるるるノド鳴らしてたし。
ヴェル	まったく。母さまたちも厄介なことを押しつけていってくれたわよね。学生やりながら責任者とか、これ相当に重労働よ
フォン	と言いつつも、ヴェルさま結構な量のお仕事、フォンに押しつけてるじゃないですか。デイルさんやハデラさんたちにまで
ヴェル	当たり前じゃない。そうしないと、ヒメとのこうしたお茶会の時間までなくなるのよ。そんなの、そのうち切れて、この校舎壊滅させちゃうわよ
紅	いや、ヴェルの場合は冗談にならないから本気でやめてくれ……
カミシア	とりあえず、ママたちもその辺にしておいた方がいいと思うぞ。ここに、状況についていけずに彫像になってる娘さんがいるからな
主人公	あっ、と言いながらみんなの視線がそこに集まる。
主人公	皇女の笑顔は引きつりながら固まり、まさしく彫像そのものだった。
オペラ	それで、そちらの美少女さまが、白鷺さまの実の妹さまなわけですね？　実の！　禁断の！　それでも手を出したくなっちゃうから隠れてこっそり、の！
姫	ああ、うん。この人はとりあえず意識の向こうに放置しておいていいから。こういう人だ、とだけ理解しておけば諦めもつく
主人公	ここぞという時には本当に頼れる人なんだけどなあ……。
主人公	そして、そんな俺の声を聞いて、ようやく金縛りから解放されたのか、皇女は俺を見ると、小さく溜息をついた。
皇女	ねえ、姫にぃ……本当にこの二年で何があったの？　他はおいといて、とりあえずハーレムってなに！？
姫	いや、むしろそっちを置け。大事なことを置くなっ
姫	単純に、女子が多いからそう言ってる連中がいるってだけだ。俺の仲間達、白鷺パーティーのことだよ
主人公	半年前のあの戦いで、俺が手に入れた大切な仲間達。俺の力そのもの。
主人公	ヴェル、ノート、ウルル、紅、フォン、アミア、デイル、ラーロン、カミシアにミヤ。オペラさんは、俺の、というよりは、あくまでもサポートだしな。
主人公	正直、よくこれだけの仲間が集まってくれたと思う。紛れもない、トリニティ最強のメンバーだ。
皇女	パーティーって……あの、この全世界オールスター、が……？
姫	ああ。誰一人欠けたらいけない、大事な仲間達、だな
ヴェル	うん、確かにそうね。信頼できる仲間、なのは間違いないんだけど……
主人公	顔を赤らめて、モジモジと指を突き合わせるヴェル。いやまあ、ヴェルがどう表現して欲しいのは分かってるつもりなんだけども、皇女の手前それはさすがに……。
オペラ	もう、何を仰ってるんですかヴェルさま。ハッキリと事実を言って差し上げればいいんですよ
オペラ	私は、白鷺さまの愛の奴隷、なのだと！
皇女	ぶうっ！
主人公	オペラさんの発言に、皇女は口に含んでいた紅茶を吹き出した。ああうん、このタイミング狙ってましたよね、オペラさん。
オペラ	さすがは白鷺さまの実妹。私が望んだ通りの反応を
主人公	狙ってたこと、隠す気もないんですねー。
皇女	ど、どどどどどど奴隷！？　あ、あああの、いくらなんでもそういう冗談は……
アミア	いやー、間違ってないところがポイントかなー、これは
ヴェル	も、もう。そういうのはおおっぴらにすることじゃないじゃない
アミア	あ、本人も否定はしないんだねー
フォン	ちなみに、フォンはヒメ先輩のペットですよ
ウルル	あああ、フォンさん、それはずるいですっ
皇女	……じー……
主人公	なんだろう、皇女の俺を見る目が、一気に三段階くらい冷たくなった気がする。
紅	ま、まあなんだ。えーと、皇女、でいいんだよね
主人公	そんな状況をさすがに察してくれたのか、紅が横から話しかけてくれた。
紅	二年も離れてたわけだし、色々言いたいことはあると思うんだけれど、でも、こういう状況になるだけのことを姫はやってのけたんだ
紅	去年の今頃は、姫もあたしも人族として皇女と同じように蔑まれてたし笑われてた。だけどそれを、姫は自分の力で変えてみせた
紅	そんな姫に、あたしたちは自分の意思でついていきたいって思ったんだ。まあメンバーがメンバーだし、驚くのは分かるけどね
フォン	そうですねえ。フォンなんて、初めて会った時にはどうやって殺してあげましょうか、なんて考えてたくらいですし……
フォン	あ、もちろん昔のことですよ、昔の。今のフォンは、身も心も身体の中まで全部姫先輩だけのものですから
アミア	フォンさんの心変わりも結構酷いよねー。まあ、わたしは最初からただ者じゃないって思ってたけど。だから勝負挑んだんだし
ウルル	ウルルは、最初からにいさま一筋でしたよ。えへへ。あの夜に繋いでくれた手、あったかかったです♪
ヴェル	私はヒメに会うために来たんだもの。当然最初からヒメしか見てないわ
紅	あー……あたしは、二人しかいない人族として、すぐに仲間になったかな
フォン	あの……ひょっとしてフォン四面楚歌？
カミシア	大丈夫だぞ、フォンちゃん。なんといっても１００％最初から最後まで敵だった奴がここにいる
ミヤ	むむ。正体隠して自分の未来のために白鷺くんをこき使ってた人には言われたくありません
ミヤ	今の私は、ちゃんと白鷺くんのことを認めて、パーティーの一人になってるんですから
カミシア	言ってることは間違っていないようで激しく間違ってるぞ。捏造報道はやめてほしいものだな
主人公	相も変わらずの二人のやり取りに、俺達は全員で苦笑する。なんだかんだでこの二人、実にいいコンビだ。
オペラ	ちなみに、フォンさまは既に自白してますけども、アミアさまもレーヴァテインありますし、白川さまは勇者クソジジイさまにほだされて裏切りました
アミア	な、なんのことかなぁ……
紅	あ、あれはその……姫を想いすぎてしまった結果というか……
オペラ	ノートさまも、最初の扉で悪役演じつつ本気でしたし、ヴェルさまは……
ヴェル	わ、私はヒメを殺しかけたことなんてないわよ！　迷宮試験の時はその、ケガさせないように気を遣ってたし……
オペラ	おほほほほ。何をおっしゃるラビットフォーム。人界で初対面の時、全力でやらかしたそうじゃあーりませんかー
ヴェル	いやー！　あの時のことは言わないでー！　あの時のは私じゃないの！　全部世界が悪いのよー！！
主人公	俺とヴェルとが初めて出会った日。人界で起こった血の儀式。あの時のヴェルは、確かに今のヴェルとは別人だった。
主人公	感情というものをほとんど持たず、ただ言われるがままにその力を振るって……騙され、その場にいる全員を殺そうとしていた。
主人公	けれど、その事件がきっかけになって、こうして俺を心から想って、俺に状況を変えるだけの力と意思をくれた。
主人公	世間じゃ、その強さと冷静さから結構怖がられてもいるみたいだけれど、俺の前では普通に可愛い女の子だ。
オペラ	というわけで、ウルルさま以外、全員が白鷺さまをぶっ殺しかけちゃった前例ありです♪
ウルル	えっとそのぉ……ウルルも、にいさま竜王化の時に、ちょっと……ふええ、にいさま、ごめんなさいっ。痛かったですよね、あの時っ
主人公	二つ目の扉の時、俺はウルルの攻撃を、ウルルが俺相手に全力を出せないと信用した上で正面からくらいまくった。
主人公	今思えば、全力ではないにせよ、よく後遺症も何も残らなかったものだ。
主人公	けれどウルルは、その時の俺の姿を思い出してしまったらしい。本気で焦ってしまっている。
姫	いやいや、ウルルのおかげで俺は無事だったんだから、もう気にするな。そもそもあれは、俺がそうなるように挑んだ結果だし
主人公	にしても、こう考えてみると、俺もみんなとそれなりに戦ってるんだな……。
皇女	姫にぃ……このメンバー相手にどうやって生き延びたの……
姫	ああ、うん。俺も今、本気でそれを考えてた
主人公	俺の言葉に、その場にいるパーティー全員の笑みが引きつった。
ヴェル	で、でも、さっすがヒメの妹さんよねえ、こんなに美人だなんて。お義姉ちゃん、って呼んでくれていいのよ
オペラ	おっとぉ、さすがはヴェルさま。ごまかしながらも、ここですかさずポイント稼ぎですか。将を射んと欲すれば先ず馬を人質にせよ、とはよく言ったものです
紅	いや、オペラさん？　それ違うから。ただの脅迫ですから
皇女	いえその……あの魔界の黒翼をお義姉ちゃんとか、ちょっと恐れ多いといいますか……
皇女	それに、ヴェルさん、の方が遥かに美人で恐れ多いというか……
主人公	皇女も多少はこの空気に慣れ始めているようだけれど、さすがにヴェルとの会話は緊張してしまうようだ。まあ、当然か。
皇女	ていうか、お兄ちゃんっ。お義姉ちゃんとか、本当にそういう関係なわけ！？
姫	あー、いやまあ、それなりの関係ではあるかなあ……
主人公	肉体関係、という意味では、ミヤ以外の全員と持ってしまっている。当然その全員に対して遊びのつもりもないし、みんなそれを納得してくれているからこそだ。
主人公	ヴェル以外のみんなも、その辺を売り込みたいらしく、その表情が実にウズウズしている。
姫	ま、まあ、ノートも紹介したいしな。詳しいことは夕食の時にでも話すよ
主人公	とりあえず、これ以上学園内で変なことを広められるのも怖いしな。詳しくは寮の方でにさせてもらおう。
主人公	事実、軽く周囲を見回してみれば、事情を知らない新入生達が思い切り聞き耳を立てていた。
姫	来たばかりで、街の方とか、寮への道もよく知らないだろ。とりあえず今はこの辺にして移動しないか？
主人公	皇女は今ひとつ釈然としないような表情をしながらも、この世界について何も知らない、ということは気にしていたらしい。頷いてくれた。
主人公	他のみんなも、ここにノートがいない、ということを気にはしていたらしい。同意してくれた。こういう、みんなの仲の良さが本当に嬉しい。
主人公	俺達は席を立つと、学園を後にする。
