主人公	この世は、五つの世界と、四つの種族で出来ていた。
主人公	魔界。魔族と呼ばれる、魔力を破壊の力に使うことに長けた種族が住む世界。
主人公	神界。神族と呼ばれる、魔力にて様々な奇跡を起こす種族が住む世界。
主人公	竜界。竜族と呼ばれる、魔法が使えない代わりに、身体能力に長けた、女性だけの種族が住む世界。
主人公	人界。人族と呼ばれる、魔力を生み出せない代わりに、様々な知恵にて乗り切ることに長けた種族が住む世界。
主人公	そして、五つ目。学園世界、トリニティ。
主人公	魔族、神族、竜族と、三つの種族がその知恵と力を結集し作り上げた世界。
主人公	かつては、世界を守護する勇者を生み出す場所として存在し、魔族、神族、竜族、人族。四つの種族が、その心を持って繋がり続けた世界。
主人公	けれど今は、あと一つ。
主人公	その存在を求め、争い続ける奇跡の少女が、共に住む世界。
主人公	この世は、五つの世界と、五つの種族で出来ている。
ニコ	いいかげんに諦めたらどうですか、リンセ
主人公	夕暮れに染まる草原の中、鋭い剣撃の音を響かせながら、二人の少女が刃を振るい合う。
リンセ	私の辞書に、諦める、という言葉は載ってはいますが黒く塗りつぶされています！
主人公	共に銀髪。獣を思わせる耳を持ち、その背からはそれぞれ十翼、八翼の翼が伸びている。
主人公	ウェディングドレスを思わせる服に身を包み、その身の丈に合わない巨大な剣を、自分の腕のように振り回す少女。
主人公	猫のようにしなやかな動きと共に二本のククリナイフを、疾風のような速さで振るう少女。
主人公	どちらも、その技量は尋常なものではない。かなり高位の戦士であることが分かる。
ニコ	……辞書に落書きをしてはいけないと何度も言ったはずなんですが。どうしてこうもイタズラ好きなんですか、あなたは……
リンセ	もちろん、お父さまとお母さまたちの教育のたまものですね♪　諦めたら全部終わっちゃうんですよ
リンセ	ニコも、えっちな単語に赤線引いたりしてないで、もっと有意義に使うべきです
ニコ	そ、そんなことはしていません。主さまに対してそんな妄想、失礼です
リンセ	あ、動揺しましたね。しかも、お父さまを相手にとは、なんてチャレンジャー
リンセ	お母さまたち全員を相手にしようだなんて、さしもの私も裸足で逃げ出す大偉業ですよ。その無謀な勇気が羨ましいです
ニコ	はあ……リンセこそ、気づいていないとでも思っているんですか。時々主さまの部屋に忍び込んで、ベッドに潜り込んで悦に浸ってニヤケ笑いを浮かべているくせに
ニコ	姫さまたちに見つかればどうなるか、ご相談してみるのもいいかもしれません
リンセ	絶対ダメです！　あれは私の密かな楽しみ、趣味なんですから。お母さまたちに見つかれば、その場所を取られてしまうじゃないですか！
主人公	まるで学園帰りの友人同士のような会話を繰り広げながら、けれどもその剣撃は決して緩まない。
主人公	むしろ速度を、圧力を増し、更に激しく、重くなっていく。
ニコ	なぜです……ニコはまだ存在しない者。リンセの方が生き残るべきなのは考えるまでもないでしょう。自殺願望を隠し持っていたとでもいうんですか
リンセ	それこそ今さらですよ。私はお父さまの娘なんです、二者択一の選択肢なんていりません
ニコ	その考えには称賛します。主さまが行ったことを考えれば、笑い飛ばすわけにもいきません
ニコ	ですが、リンセにその選択肢は見つけられなかった。違いますか
リンセ	だからって、私は諦めたりはしてあげないんです！　私の辞書のその言葉は、とっくに黒塗りモザイク化しちゃってますからね
ニコ	叶える手段もないのに言い続けるのは、ただのワガママです！
主人公	言葉と共に振り払われる刃から、対の衝撃波が放たれる。が、リンセはそれをまさしく気合いで受け止めた。
主人公	リンセの全身を覆う、薄いオーラ。竜族の持つ気鱗とそっくりなそれが、必殺の威力を持つはずの衝撃を儚く霧散させる。
主人公	と同時、リンセは、次は自分の番とばかりに手にしていた巨大な剣を両手で振りかぶった。
リンセ	お父さまの力強さ！
主人公	言葉には、魔力を導き、安定させ、増幅させる力がある。その技名によって輝きを増した光の刃を、リンセは力の限り振り下ろす。
主人公	地面に叩きつけられた剣が、ドズンッ、という地震のような震動を放ち、巨大な光の刃を放つ。
ニコ	相変わらずの力が抜けるその魔法名、変更したらどうですか。主さまへの献身！
主人公	軌道上にあるものすべてを粉々に砕きながら真っ直ぐに襲い掛かる光速の刃を、だがニコはさけようともせず防御力強化の魔法で受け止めた。
リンセ	お父さまか主さまかの違いしかないじゃないですかっ
ニコ	尽くすか尽くされるかの違いがあります。ニコは尽くすことこそが想いの証と考える女です
リンセ	私だって尽くす女ですよっ。それはもう、食事時のあ～ん、から、お休みされる時の膝枕うちわまでっ
主人公	そうして、二人は間合いを詰める。再び接近戦での撃ち合いが始まった。
主人公	放たれる刃は紛れもない命がけのもの。にも関わらず二人の間でかわされる会話には、悲壮感はもちろん緊張感すら感じない。
主人公	友人同士の仲のいい会話。小猫同士のじゃれ合い。もし見ている者がいたのなら、そんな微笑ましさすら感じてしまったことだろう。
主人公	それでも、その戦いは紛れもなく、互いの命を容易く奪えるレベルのもの。
主人公	速度による手数の多さはニコのが上。だが、破壊力はリンセの方が遥かに上。その一撃をまともに食らえば勝敗は決するレベルだ。
主人公	完全に受けに回りながらも、リンセはその一撃のチャンスを虎視眈々と狙っている。
主人公	襲い来る無数の刃と、食らえば終わる必殺の一撃。どちらも、そのプレッシャーは変わらない。
主人公	いや、相手の攻撃をその手数によって封じ続けなければいけないニコの方が、むしろ重かった。その焦りは徐々に積み重なり、やがて致命的な判断ミスへと繋がる。
リンセ	あっ！
主人公	ニコの放った軽いフェイント。だがその誘いにのせられ、リンセの体勢が大きく揺らぐ。そのスキをつき、放たれる二本の刃。
ニコ	この機会、いただきます！
主人公	千載一遇、恐らくは、この戦いにおける最後のチャンス。
主人公	そう思ってしまった判断ミスが、勝敗を分けた。
主人公	この体勢ならばここへと打ち込んでくるだろう。仕掛けたリンセの予想通りの場所へと狂い無くニコのナイフが向かっていく。
ニコ	しまっ……
主人公	自らが誘導されたことに途中で気が付きはしたものの、もう遅い。渾身の力で繰り出した一撃は、止めることも、軌道を変えることもできない。
ニコ	あうっ！
主人公	横に払われたリンセの大剣が、ニコのナイフを弾き飛ばした。
リンセ	これで、おしまい！
主人公	そのまま、勢いよく剣を振り上げるリンセ。背中の十翼が、リンセの持つ莫大な量の魔力を、フル稼働で制御する。
主人公	空間すらも歪んで見えるほどの力が、その光の刃へと集まっていった。
リンセ	ヴェル母さま直伝！　空間力割り、です！
主人公	その破壊力は知っている。この距離では、かわしたところでその余波によってやられるだけ。武器もない今、モーションを止めることも不可能。
主人公	ニコは覚悟を決めると、両腕を前で交差させ、気鱗を全開にし防御態勢に入る。
主人公	世界が、吹き飛んだかのようだった。
主人公	リンセの一撃が、ニコの身体を、空間ごと砕き、破壊する。気鱗なんて関係ない。存在する時空ごと、根底から破壊する最狂の一撃。
主人公	全身が粉々に砕かれるような衝撃に身体を大きく震わせて、ニコはその場へと崩れ落ちた。
リンセ	私の勝ち、ですね。ぶい
ニコ	……本当に、何から何まで正面からですね、リンセは……技の名前まで
ニコ	いつの間に、空間破壊だなんて……
リンセ	ふふ。だって、かっこいいじゃないですか。あんなかっこいい技、憶えなくっちゃもったいないです
リンセ	せっかく、お父さまとヴェル母さまからいただいた十翼なんですから
主人公	強大な魔力によって、あらゆるものを破壊する。それは確かに魔族の真骨頂だ。だが、空間そのものを砕くほどの魔力など、本来ならば制御できるはずがない。
主人公	それがたとえ、純粋たる魔王の血族であったとしても。
主人公	それは、無限の魔力を生み出し、それを制御しきれる器だからこそ。人族の至宝、儀式兵器としての力を持った、十枚の翼。
リンセ	約束、ですよ。勝った方が、扉を選んでいいって
ニコ	……分かってます。でも……
ニコ	あなたは、自分が生き残る扉を選ぶべきなんです。ニコのことなんか考えずに……
ニコ	だから、最後の抵抗です。もしこれでニコを選ぶのなら……絶交です
リンセ	……むう、そうきましたか。相変わらずずるっこい手を使ってきますね、本当に
ニコ	それであなたを守れるのなら本望です
リンセ	ふう……分かりました
ニコ	え……本当に……？
リンセ	はい、本当です。ニコの一途さはよく分かっていますし、このままじゃあ、ニコを選んでも一生口も利いてくれなくなりそうですからね
主人公	リンセは、諦めたようにガックリとうなだれると、そう言った。そして、ゆっくりと空を見上げ、声を張り上げる。
リンセ	剪定者として、世界に決断を申し上げます！
リンセ	私、リンセ＝ホワイトキャッスルが生き残る扉を、これからの未来に！
主人公	何か、歯車の軋むような音がした。そしてそのまま、今度は何かがガッチリとはまり込む、そんな音が。
主人公	この瞬間、未来は確かに定まった。
主人公	リンセとニコ。未来を定めるゲームの参加者。剪定者と可能性の世界の住人としての争いは、剪定者、リンセ＝ホワイトキャッスルの勝利として、確かに終わった。
主人公	その確かな結末に、ニコは心からの笑みを浮かべる。これでいい。自分は直に消滅するだろう。けれどその代わりに、リンセには確かな未来が約束された。
主人公	この、真面目で一直線で無鉄砲でイタズラ好きで小悪魔めいて子供っぽくてお馬鹿でどこか抜けていて……。
主人公	だけど、親友。このわずか数日間の出会いの中で、こんな自分の手を、強く温かく包み込んでくれた、大切な親友。
主人公	その、未来を、自分なんかが奪わずにすんだ。彼女を守ることができた。
リンセ	これでいいんですよね、ニコ
ニコ	はい……ありがとう、リンセ。ニコの最後の願いを、叶えてくれて……
主人公	涙混じりの言葉に、リンセは優しく微笑むと、気にするなと、そっと首を左右に振る。
リンセ	さて、扉を選んだ今、私は剪定者としてのご褒美をいただけるはず、でしたよね
ニコ	はい。過去、そして今定めた未来の扉内を改ざんするものでなければ、どんなものでも、世界が認める限り……
主人公	そう改めて教えたところで、ニコは背中に冷たいものを感じた。
主人公	目の前の少女が、笑っている。それもいつもの礼儀正しい、お嬢様のような笑みじゃない。ニヤリと、イタズラをする子供のような、何かを企んでいる笑顔。
ニコ	……リンセ、何を企んで……
リンセ	うっふっふ～♪　何も企んでなんかいませんよ。ただただ、私が今、とってもとーってもとーーーっても叶えてほしいお願いが一つありまして
リンセ	その瞬間がきたのだと、乙女な私の心臓が、どきどきわくわく高鳴っているだけです
主人公	未来を確定した剪定者には、その責任の重さに対する褒美が与えられる。
主人公	それは、ルールに則ったものならば、絶対だ。視界を埋め尽くす財宝であっても、世界中の人々からの尊敬であっても、想い人の心であっても。
主人公	リンセは再び空を見上げた。そうして、その願いを、求めるものを、高らかに宣言する。
リンセ	私は、たった今、私自身が選んだ扉の剪定に対し、一からのやり直しを求めます！
ニコ	な、何を！？
主人公	それは、存在の可能性があるかぎり悠久の時を生きる、可能性の世界の住人であるニコにとっても初めて聞く願いだった。もちろん、予想すらしたことがない。
リンセ	私、怒ってます。他でもない自分自身に
リンセ	私もニコもどちらも生き残って幸せになれる……そんな、第三の扉を生み出せなかった自分に。お父さまの娘でありながら、こんなにも不甲斐ない自分に
リンセ	でも仕方ありません。これは、私がまだまだ未熟であるということ
リンセ	そして、お父さまがそれほどまでに素晴らしい、男性の中の男性である証明。私なんかよりも遥かに素晴らしい人だという証明ですから
リンセ	ですから、私は考えました。私が未熟であるからニコを救うことができないというなら……
ニコ	ま、待って下さい！　リンセ、あなたはまさか！
リンセ	大丈夫♪　この時のために、カミシアちゃんとミヤちゃんに頼んで、時空移動の魔法は準備万端です
ニコ	そんなこと……過去を変えるなんて、世界が許すはず……
リンセ	私の剪定をやり直す許可は、剪定者の褒美としてルールの範囲内です。そして、これから変えるのは私たちの過去じゃありません
リンセ	お父さまたちにとっての、未来です
主人公	凜とした、強い決意の込められた瞳と共に言い切るリンセ。その意思の光の前に、ニコはもう何も言うことができなくなった。
主人公	そうだ。この強さこそが、自分がリンセ＝ホワイトキャッスルという少女に惹かれた理由。
主人公	本来ならば争い、蹴落とすべき相手でありながら、自分の存在なんかよりもその未来を守りたい、そう思ってしまった。この強さに、見惚れてしまった。
主人公	この強さを作り上げた方々に、四種族の姫たちに、そして何より、父親である勇者に、憧れてしまった。信じてしまった。
主人公	確かに、あの方なら。過去に一度、ルールそのものを作り替えてしまったイレギュラーな剪定者。
主人公	白鷺姫。主さまならば、できるかもしれない。リンセの、この無茶苦茶な願いを、本当に叶えてくれるかもしれない。
主人公	ニコ自身が心の中で思っていた本当の願いを、叶えてくれるかもしれない。
主人公	いつしかニコは、差し出されていたリンセの手を握っていた。
主人公	リンセが叶えてしまったありえない願いに対し、世界はきっと何かの強制力を動かすだろう。歴史を狂わすことなく、あるべき流れに戻そうとするだろう。
主人公	だから、行こう。そんな世界を相手にしても、決して引くことのないあの方のもとへ。
主人公	リンセは、真っ直ぐにニコを見つめていた。そしてニコも、その視線に応えるように頷いた。
主人公	リンセもニコも助かるハッピーエンド。リンセが諦めることなくそれを目指すというのなら、自分もそれを最善とする。
主人公	そして同時に、誓いを立てる。
主人公	自分の目指す未来、それは、リンセ＝ホワイトキャッスルが笑顔で暮らす、そんな未来なのだということを。
主人公	小さな黒点が、瞬時にその大きさを増した。それはまるで膨張し続ける宇宙のように、二人のいる空間を飲み込んでしまう。
主人公	この世界、この時代から、二人の姿は消失した。
主人公	けれど、二人は確かに繋がっている。
主人公	何も見えない漆黒の世界の中、リンセの指から伸びる、遥か彼方へと続く一本の光の糸。
主人公	その先にいる、自分達の可能性と。
