主人公	そして、次の休み時間。俺達は、あのルルウの資料を確認するため学園長室へとやって来ていた。
ヴェル	ちょっと待って
主人公	ヴェルは鍵付きの資料棚を開けると、中から一冊のバインダーを取り出す。恐らくは、今年の新入生に関する書類をまとめたものだろう。
主人公	普通だったら閲覧できるはずのない資料。あくまでヴェルが学園長代理の立ち場にあることと、調べる相手が相手だからこその特例だ。
主人公	もちろん、ルルウ以外のものは見るつもりもない。
ヴェル	見つけたわ。これね
主人公	バインダーの中を確認していたヴェルが、一通の書類を抜きとり、俺達の前に置く。
主人公	それには、ルルウ＝カジュタ、の名前と共に、今朝出会ったあの子の写真が貼られていた。
姫	……間違いないな。あの子だ
デイル	ほほう。こりゃまた結構な美少女だな。さすがは王女さまってか
フォン	竜族第二王女、とまで記されていますね。ヴェルさま、この資料を作ったのは？
ヴェル	ええ、母さまよ。母さまはあの子のこと知っていたみたいね。まあ、どこまで事情を知ってるかは分からないけど
紅	身分の証明に関しては、あの竜王の指輪があれば充分だしな
デイル	でもま、これで本当にドラ子の妹だっていうのは証明されたわけだな。やっかいなことが起きなきゃいいけどねえ
フォン	待って下さい。あの子確か、ルルウ＝アキ＝カジュタ、と名乗っていませんでしたか？
姫	……そう言えばそうだな。確かにそう名乗ってたはずだ。だけど資料は『ルルウ＝カジュタ』になってるぞ
デイル	てことは、アキ、の部分を後から勝手に付け足した、ってことか？
ヴェル	その部分に、何か思い入れがある、ってことかしらね。本名は間違いなく、こっちのはずよ
姫	アキ、か……
主人公	どこかで聞いたことあるような、無いような……。
紅	でも、生き残っていたもう一人の金竜か。なんでまた今頃になって出て来たんだろうな
フォン	ええ。オペラさんすら知らないということは、本当に秘中の秘。恐らく知っている人はいなかったでしょう。それほど厳重に隠していた……
デイル	それが、今になって表舞台へと飛び出した、か。隠れている理由がなくなったか、それとも隠れていては出来ない何かがあるのか……
姫	なんにせよ、警戒しておいた方がいいのは変わらないみたいだな
ヴェル	なんだったら、今から呼び出して聞いてみる？
主人公	なるほど、今のヴェルならそういうことも可能だったか。俺はその申し出に少し考える。が、最終的には首を左右に振った。
姫	やめておこう。目的が分からない以上、変に揺さぶりをかけると危険だ
主人公	それを、向こうが動くキッカケにされても困るしな。やるなら、もう少し彼女について分かってからにしたい。
紅	そうだな。まあ、あの学園長が入学許可を出してるんだ、今すぐにどう、ってことはないだろう
フォン	はい。トリアさまのお墨付きがあるなら、むしろ安全だとフォンは思います
ヴェル	私としては、あの母さまが、ってところで逆に不安だけどね。面白そうだったから、の一言でなんでも解決してそうだもの
デイル	ああ、それはあるな。マジである
姫	安心と不安が見事に入り交じった人だからなあ……
主人公	過去の様々な出来事を思い浮かべて、俺は苦笑する。
主人公	とはいえ、本当に何かがあるなら、ミヤがきっと話してくれるだろう。今できるとすれば……。
姫	まあ、どんな狙いがあるか分からない以上警戒は必要だな。その上で、しばらく様子見ってところか
主人公	俺の提案に、みんなが同時に頷いた。
