主人公	姫の姿が見えた。まだ幼い兄の姿が。そしてその隣に自分がいる。やはり幼い自分が。
主人公	そんな二人を見て、皇女は理解する。ああ、あの時の夢を見ているんだ、と。
主人公	あの時のことはよく憶えている。今から十年近く昔の話だ。まだ幼く、周囲へ挑む力なんて持っていなかった頃。だけど、大人ぶってみたかった、そんな頃。
主人公	家族が家にいなくなるという日、両親が皇女に一緒に行こう、と説得するが、皇女は頑なに拒んだ。
主人公	子供扱いされたくなかったから。一人で留守番くらいできると、そう自慢をしたかったから。
主人公	だけど、現実はそうならなかった。
主人公	一人きりの家は、幼い自分にとってはお城みたいに広く感じて。静まり返った家で響く音は、まるで怪物のうなり声のようだった。
主人公	当然、誰を呼んでも返答はない。懸命に家の中を探しても誰もいない。皇女は本当に一人ぼっちだった……。
主人公	夜になって陽が沈むと、その怖さはさらに増した。風の音が幽霊の声に聞こえた。だから、押し入れの奥に毛布にくるまって隠れてしまった。
皇女	だれか、きてよぉ……こわいよぉ……おにいちゃん……おにいちゃあん！
主人公	ずっと泣いていた。押し入れの襖を開けば、そこに幽霊がいそうで怖くて出られなかった。
主人公	トイレにもいけず、おもらしまでして、だけどただ泣いていた。
姫	みこ、もう平気だよ
主人公	襖の向こうから、そんな声が聞こえた。優しい声だった。ゆっくりと襖が開いて、そこにはお兄ちゃんがいた。
主人公	ホッとして、皇女はまた泣いてしまった。今までよりも、もっともっと大きな声で。
主人公	兄は、そんな皇女を優しく抱きしめた。自分の服が汚れてしまうことも厭わずに、ただ優しく、力強く。
姫	大丈夫だよ……もう本当に、大丈夫だから……怖くても、また見つけ出すから……
主人公	そんな兄の声が嬉しくて、心強くて、皇女もまた、姫をギュっと抱きしめ続けていた……。
皇女	……いけない、寝ちゃってたみたいっ
主人公	目を覚ました皇女は、慌てて時計を確認する。が、それはこの世界に入った時より、一秒たりとも進んではいなかった。
主人公	あれから、どれだけの時間が経っただろう。時の止まってしまったこの世界では、それすらも分からない。時間という感覚が完全に狂ってしまっている。
主人公	自分がどれだけ寝てしまっていたのかも分からない。ただ、こうしてまだ生きていることは確からしい。皇女はほっと胸を撫で下ろす。
主人公	どれだけ待ったのか、どれだけ待てばいいのか。もう何も分からない。そもそも、なぜ自分がこんな目に遭っているのかが不明だ。
主人公	この学園に来てまだ三日。特別な何かをした憶えもない。なのになんでこんな……それも、たった一人で……。
皇女	……姫にぃ、来てくれるよね……
主人公	その場にうずくまりながら、幼い頃のことを思い出す。たった一人での初めての留守番。あの時のことを。
主人公	あの時の、あの言葉があるからまだ頑張れる。寂しいけれど、怖いけれど、なんとかしがみついていられる。
皇女	……さすがに、ちょっと寒いな……
主人公	服は囮として使ってしまった。闘技場の更衣室にまで行ければ、まだ制服が残っているかもしれない。けれど、次にあの甲冑騎士と出会ってしまえば逃げられる保証はない。
皇女	どう、しよう……
主人公	ただ小さく呟いた、その瞬間だった。
皇女	な、なに！？　まさか……
主人公	外部からの攻撃によるものだろう。大聖堂の厚く頑丈な大扉が、爆発と共に粉々に吹き飛んだ。その爆音に、皇女は思わず立ち上がってしまう。
主人公	そしてそこには、思った通りに奴が立っていた。
主人公	巨躯なる殺意の存在が。
主人公	慌てて周囲を見回し、逃げ道を探る。けれども唯一の出入り口に、あの騎士が立っている以上ここからの脱出は出来そうにない。
主人公	隠れることだけを考え、いざという時の対応に関してを忘れていた。これは皇女にとって致命的なミスだった。実戦での経験の無さが出てしまったと言うべきか。
皇女	やるしかない……必撃！
主人公	瞬時に儀式兵器を展開させ、唯一効果があるだろう攻撃を繰り出す。だがその一矢を、甲冑騎士は手にした剣でいとも簡単に打ち払った。
主人公	鎧のパーツをガチャガチャと打ち鳴らしながら、一歩ずつ確実に迫ってくる甲冑騎士。皇女は壁伝いに逃げようとするものの、すぐに追い詰められる。
皇女	や……こない、で……
主人公	恐怖からか、足に力が入らない。ずるずるとその場に崩れ落ちてしまう。
皇女	あ……う……
主人公	ただ恐怖に怯えるだけの声をこぼしながら、目の前の騎士を見上げる。
主人公	頭の中が真っ白になり、何も考えられない。そもそも身体が震えて動いてくれない。
主人公	怖い。胸の奥からただその言葉だけが湧き上がってくる。恐らく自分は殺される。この目の前の騎士によって、いとも簡単に。
主人公	何故死ななければいけないのか。何故自分なのか。もう何も分からない。
主人公	自分に確実にのしかかろうとしている、死という名の不条理が、今はただ恐ろしい。
主人公	いつしかその股間は濡れ、床に小さな水たまりをつくっていた。けれどそんなことすら今の皇女は分からない。
皇女	やだ……死にたく、ない……
主人公	震えが止まらない。ただ怖くてたまらない。騎士が持つその長剣が振るわれれば、それで自分の命はあっけなく終わりを告げる。
主人公	冗談でも、夢でもなんでもなく、本当に終わるのだ。白鷺皇女、という一人の人間の生が、あっけなく終わりを遂げる。
皇女	たす、けて……
皇女	たすけて……姫にぃ……お兄ちゃん！！
姫	ああ、任せろ
皇女	え……
主人公	その声は、確かに本物だった。自分の心の中でだけ響いた幻聴なんかじゃない。
主人公	確かに今、この耳に届いた。この身体全体を震わせた。
主人公	そうしてもう一度。今度のその声は、
姫	皇女！！
主人公	紛れもなく、白鷺皇女、その少女の名を呼んだ。
主人公	皇女の視線が、その声の先へと向かう。そこには確かに、今一番待ち望んだ人の姿があった。
皇女	お兄……ちゃん……
主人公	その顔が、瞬く間に笑みへと変わる。絶望が希望へと一瞬で裏返る。
主人公	同時に、甲冑騎士も反応していた。その注意を皇女から姫へと移動させるがもう遅い。自らの危険を顧みず、ただ全力で走る姫は、瞬く間に甲冑騎士との間合いを詰めていた。
姫	俺の妹に何をしてる！！
主人公	その勢いを乗せた全力の振り下ろしが、甲冑騎士の身体を弾き飛ばした。
姫	良かった、間に合った……
主人公	俺は泣きながら怯えていた皇女と甲冑騎士の間へと素早く身体をいれる。幸い、こちらの先制攻撃は上手く決まってくれた。
皇女	お兄ちゃん気をつけてっ。そいつ、強い上に、固い！
姫	大丈夫、任せろ！
主人公	ここの扉の壊れ方からして、こいつの攻撃力の凄さは想像できる。そういう奴を調子に乗せていいことはない。ここは、俺のペースで押し切るのみ！
主人公	俺は、体勢を立て直したばかりの甲冑騎士へと肉薄すると、その肩の関節へと鋭い突きを放つ。
主人公	いくら全身を強固な甲冑で覆われていようと、関節部まで覆っては動けない。しかも肩をやられれば攻撃すらできなくなる。
主人公	甲冑騎士は、当然のごとく、わずかに身体を動かして鎧で受け止めようとした。最小の動きでの回避となれば、そう動くに決まっている。
主人公	そして、決まっているなら当然それは読んでいる。俺は、最初からそのつもりだった突きを途中で止めると、素早く引き戻し、二段突き。首を狙った。
主人公	さすがに驚異を感じたのか、甲冑騎士は後ろに跳んでどうにか防ぐ。が、その動きに合わせて俺も跳んでいた。間合いは変わらない！
主人公	そんな俺を振り払いたいのか、その長剣を薙ぎ払う甲冑騎士。だがそれも読めている。
姫	悪いが、妹の前でかっこ悪いところは見せられないんだよ！
主人公	俺は身体を低く沈めると、下からその長剣を切り上げ軌道を大きく逸らす。
姫	うおおおおおおお！！
主人公	そうして出来た懐の空間。すかさずそこへと踏み込むと、視界確保のために防御の薄くなるフェイスガードへと全力の突きを叩き込んだ。
主人公	硬質な物体がひしゃげる確かな感触。甲冑騎士の巨体が、そのまま背中から床へと叩き付けられた。
皇女	姫にぃ……すごい……
姫	とりあえず、正体を晒してもらうぞ
主人公	そのヘルムを奪い取るため、俺は巨体へと一歩近づき、
主人公	その刹那、甲冑騎士の発した激しい光に慌てて跳び退る。
主人公	その光が消えた後に、巨体の姿は何も残っていなかった……。
主人公	念のため周囲の気配や魔力を探るものの、やはりなんの痕跡も感じられない。
姫	逃げた、かな
皇女	姫にぃ……
姫	無事か、皇女
主人公	剣を収めながら、俺は皇女へと振り返る。
姫	なんか、凄い格好だなあ……
皇女	し、しかたない、じゃない……本当に、死んじゃうかもって、思って……
主人公	必死に泣くのを堪えているのが分かる震え声。そこからも、皇女がどれだけ怖い思いをしていたのかが伝わってくる。
姫	ごめんな、待たせた。でも、もう大丈夫だ
主人公	俺は笑顔で言い切ると、皇女へと手を差し伸べる。
皇女	うん♪
主人公	そして皇女も、笑顔で俺の手を取った。
皇女	でも、さっきの騎士、なんだったの……？
姫	ハッキリとは言えないけれど、多分可能性の世界の関係者、だろうな……
皇女	可能性の……世界……？
姫	後で、みんな揃った所で説明するよ。そろそろ戻されるだろうし
主人公	そう言ったのとほぼ同時、まるで狙っていたようなタイミングで世界が歪む感触がくる。
主人公	そしてそれが過ぎ去った時、空気が変わっていた。
皇女	え？　あ、あれ？　時計が動いてる……
姫	とりあえず、元に戻れた、か……
姫	ミヤとカミシアには、後でお礼言っとかないとな
皇女	あ、あの、姫にぃ？
姫	ん？　どうかしたか
皇女	その……改めて、本当にありがとうね。来てくれた時、すっごく嬉しかった……あの時の言葉、守ってくれて……
姫	どういたしまして
主人公	はにかむような笑みと一緒に送られてくる皇女の感謝の言葉に、俺は当たり前だと笑顔を返す。
姫	あー……でもなんだ……制服、闘技場の方にあって良かったな
姫	その、やっぱりまあ間に合わなかったみたいだし……
主人公	が、落ち着いたところで気がついてしまった。その、シミに。
主人公	皇女の顔が、凄まじい勢いで赤く染まっていく。
皇女	……お、お兄ちゃんの……
皇女	ばかああああああああああああああああああ！！
