バリアリーフ	今日の実戦授業は、途中から一階級が合流します
バリアリーフ	三階級の強さがどれほどのものか、ここでの時間がどれだけ皆さんの力となるのかを存分に見せつけてあげなさい
主人公	そんな、先生の言葉で始まった午後の実戦授業。
主人公	俺はラーロンと、互いの武器を構え向かい合っていた。
主人公	細かな技として魔法を使うデイルと違い、ラーロンはその魔王の血族としての強大な魔力で、単純な破壊力としての魔法を使う。
主人公	それは、魔法による強化や防御を使えない俺にとっては相性的にかなり不利だ。なんといっても広範囲破壊呪文を使われると、余程先読みしていないと手が出せない。
主人公	勝率も、デイル相手にはかろうじて四割、というところだが、ラーロン相手となると三割いくか、というところだろう。
ラーロン	悪いが、今日も私の勝ちとさせてもらおう
姫	さすがに、勝率三割はキープしたいんでね。今日は勝たせてもらう
主人公	けれど相性が悪い、なんていう言い訳をしたところで意味はない。強いか弱いか、勝ったか負けたか。ここではそれがすべてだ。
紅	どう見る？
フォン	いつも通り、姫先輩の勝ちにお昼のジュースを。ハデラさんの広範囲攻撃魔法を、どれだけ早く読めるか、ですね
ヴェル	ええ。いつも通りヒメの勝ちにお昼のデザートを。ハデラの広範囲魔法は、威力がありすぎる分、懐に入られたら使えなくなる。そこが勝機ね
ミヤ	ラーロンくん、魔力の純粋な破壊力への変換、まだ苦手ですからねえ
ヴェル	そうね。まあ、魔王の血族レベルの魔力を、たった六枚の翼で制御しきるのはさすがに厳しいのかしら
フォン	たった、とか言わないで下さい。それだと、同じ六翼のフォンが弱いみたいじゃないですか
フォン	あれは、ハデラさんがまだまだ魔力の制御が下手なだけです
ミヤ	それはありますね。デイルくんなんか、二枚翼なのにあれだけ上手く制御してますし
主人公	隣に立つデイルの顔を、どうです？　と尋ねるように見上げながらミヤが言う。デイルはそれに苦笑しながら答えた。
デイル	まあ、魔法を使った技術、が俺様の売りだもの。でもま、さすがに二枚じゃ大規模な魔法は厳しいのよね。制御しきれずこぼれちまう
ヴェル	でもフォンは、竜族の血もあってか、魔法をほとんど使わないじゃない。基本破壊力の上乗せで
フォン	長所を更に強化する方に使ってるだけです
紅	あたしからすれば、魔法としても、破壊力としても、どっちも驚異だけどなあ
デイル	紅っちは、その分速度でこっちの魔法をかわしてくれるからねえ。どうやって足を止めるか、毎回考えるの大変なんだぜ
ミヤ	その点、私の結界魔法は優秀ですね。結界で封じ込めてしまえば、それで終了。チェックメイトですから
紅	ほんと、ミヤ相手はやりにくいんだよなあ
ラーロン	外野の方は、私の方が有利だと判断しているようだな
姫	ああ、それは否定しないよ。実際、ラーロンの魔法攻撃は強力だからな
主人公	威力はもちろんだが、一番の問題はその範囲の広さだ。読みを外すと確実に巻き込まれる。
ラーロン	ふん。だが、お前の先読みの鋭さと攻撃の組み立ては、時折予知でもしてるかのような鋭さを見せるからな、最後まで侮れん
姫	そう評価してもらえるのは光栄だな。それじゃあ、いくぞ！
ラーロン	うむ。『業爆の魔弾！』
姫	って、やっぱりそう来るよな！
主人公	開始と共に出現するいくつもの火球。一つでも当たればそれで決着がつく威力がある。
主人公	だからこそ俺は、その火球に襲われることを覚悟の上で、真っ直ぐに走った。火球の誘爆範囲に、ラーロンをいれるために。
ラーロン	ちいっ、やはり読んでいたか！
姫	まずは剣技の時間といこうぜ！
主人公	俺の振り下ろした一撃を、ラーロンはガッシリと受け止めてみせた。
ヴェル	とりあえず、先手は取ったわね。あとは間合いを開かず押し切れるか
フォン	ハデラさんが時々行う、自爆覚悟の低威力魔法が厄介ですね
紅	小さくとも、確実にダメージはくらうからな。しかもそこで攻撃をとめられる
ミヤ	かといって、間合いを開けば高威力魔法の餌食、ですか
ヴェル	昔みたいに、真っ直ぐ破壊力で押してくるだけなら、いくらでもやりようはあったんだけどねえ
デイル	いやいやぁ、姫っちにも奥の手が来たみたいだぜ
主人公	デイルの言葉にみんなの視線が動く。そこには、闘技場へと入ってくる大勢の生徒達の姿が見えた。
バリアリーフ	見ての通り、既に何人かの上級生達が模擬戦闘を行っています
バリアリーフ	各自、巻き込まれないように注意しながら、まずはその戦いぶりを見学なさい。自分達とどれだけの差があるのかをちゃんと見るように
ヴェル	さーて、お兄ちゃんの本領発揮、ね
主人公	視線の端に、見覚えのない大勢の生徒達が闘技場へと入ってくるのが見える。
主人公	その中に、よく知っている黒髪の少女の姿があるのを、俺の意識は確実に捉えていた。
ラーロン	くっ！　なんだ貴様、いきなり一撃が重くなったではないか！
姫	いや、下級生の見学で、妹がどうも見にきてるらしいんでさっ
ラーロン	なるほど。身内の前、しかも人族を蔑む新入生達の前では、確かに負けられんな
ラーロン	だが、正面からの戦いでは、私の方がまだ上だ。そう易々とはゆずれんぞ！
姫	当然、手を抜かれても困る！　それでも、三割程度だが俺にも勝率はあるんだぜ！
姫	勇者って称号を継いだ以上、期待されてる時には負けられないんだよ！
ラーロン	なるほど！　その三割をここに持ってこようというわけか！
姫	勇者ってのは、期待されてる時だけは、誰にも負けちゃいけないんでな！
主人公	意識を狭めろ。ラーロンに集めて、そこからラーロンの動きに対するすべての情報を引き出せ。
主人公	目線、筋肉の動き、重心、バランス、力の配分、服のシワ、音、魔力の偏り、空気の流れ、いくらでも情報はあるはずだ。そこからすべてを暴き出せ。
主人公	ゲンさんと戦った、あの時の感覚。あの偉大な勇者の攻撃を、先の先まで読み切った感覚を思い出せ。
主人公	引き出した情報を集めて、感じろ。考えていたんじゃ間に合わない。何が来るか、それを予知し、身体を動かせ！　後に回るな、先に動け！
ラーロン	業火の爆槍！
主人公	突き出されたラーロンの手から、収束されば爆炎が吹き上がる。
主人公	それはまだ五メートル以上あったはずの俺達の間合いをものともせず、俺を焼き尽くそうと巨大な槍の形を取る。
主人公	だが、一瞬遅かった。俺の身体はわずかに横へとステップで跳ぶと、炎が腕を掠めるのも気にせずに、最小の動きでそれをかわしていた。
主人公	そのまま一気に、ラーロンの懐へと飛び込む。このままその腹を横薙ぎに……。
ラーロン	ああ、貴様ならきっとかわすと思っていた！
主人公	既に振り上げられていたラーロンの剣。そこには、破壊力へと転じられた魔力がのっている。
主人公	一撃で俺を昏倒できるだろう威力の剣が、振り下ろされ、
姫	ああ、俺もだ。ラーロンなら必ずってさ
主人公	そして、その刃を狙っていた俺の剣で、軌道を逸らされた。
ラーロン	な！？
主人公	そうして、完全に無防備状態のラーロンの懐へと俺は入り込む。そのまま、その拳を固く握りしめ、腹へと叩き込んだ。
ラーロン	うぐっ！！
主人公	咄嗟に後ろへ跳ぼうとしていたせいか、わずかに打撃力を吸収されるものの手応えは充分あった。背後に転がるラーロンを追って、俺は更に前へ出る。
主人公	今のラーロンの表情には覚えがある。あいつが、一瞬の隙をついて逆転の一手を狙ってる時だ。
主人公	この距離、この状態で高威力魔法は唱え直せない。だとすれば狙いは間違いなく……。
姫	死角から来る、火炎弾！
主人公	最初に生み出し、そのまま残されていた、たった一発の火炎弾。俺の視界から絶妙に外されていたその存在を、けれど俺はしっかりと憶えていた。
ラーロン	く！　そこまで読まれていたか！
主人公	俺はそれをギリギリのところでかわし、そのまま体勢の崩れているラーロンへと、必殺の一撃を振り下ろした。
姫	はあ……はあ……はあ……悪い、もう限界だ……
ラーロン	まったく、このバカめ。勝ったとはいえ、その後の保険用の力まで使い果たしてどうする
ラーロン	これが実戦なら、その後の戦闘で首を取られているぞ
姫	いやあ……面目ない。ほんと、その通り
姫	けどさ……はあ……ラーロン相手となると、全力で動き続けないと……はあ……
ラーロン	まあ、今日はお前の勝ちだ。少し休んでいるんだな
主人公	ラーロンは苦笑すると、そのまま離れていった。恐らく、軽い治療を受けにいくんだろう。最後のは手応えあったし。
ヴェル	大丈夫、ヒメ？
姫	ああ、なんとか。とりあえず勝率三割は守れたかな
フォン	相変わらずの真眼の切れ味でした。フォン、完全に見惚れてしまっていましたよ
紅	ずっとよそ見しながら、対戦相手、ダブルハーケンで粉砕してたもんなあ……
ミヤ	あの神族の子、大丈夫です？
フォン	どうでしょう。立ち上がられても更に時間を取られてしまうだけなので、とりあえず全力粉砕しておきましたから
ヴェル	あなたねえ……
紅	いや、ヴェル。お前もだ。いくらなんでも学生相手に十翼だすな
ヴェル	だってぇ、彼、神族だけあって防御魔法ですごく粘るんだもんっ
ミヤ	そういう時は頭を使うものですよ。私と紅ちゃんは、戦って拮抗しているフリしてずっと見てましたし♪
姫	デイルは……ああ、丁度対戦中か。新入生の前だからって、張り切ってるなあ
紅	お前が言えるのか？　皇女の前だからってあの動き
姫	はは……いや、やっぱりさ、それなりのところを見せないと、あいつの立ち場も微妙になるだろうし
主人公	白鷺皇女の兄は弱い。そんな認識を持たれてしまえば、皇女の周囲も大変だろう。けれどその逆なら……。
姫	見てくれてたならいいんだけどな
ヴェル	大丈夫よ、ヒメ。ちゃんと見てたから、あの子
主人公	そんなヴェルの笑顔に、俺も笑顔を返した。
皇女	ふふふ～ん♪
主人公	目の前で行われていた、姫とラーロンの戦いは凄かった。高レベルの剣技がぶつかり合い、高威力の魔法を必死にかわす。
主人公	最後まで温存してあった切り札の火球と、それすらも読み切ってみせた戦いの組み立て。
主人公	初めは、何秒保つか、などとあざ笑っていた他の生徒達も、完全に言葉を失っていた。皇女は自然と笑みを浮かべてしまう。
カミシア	うんうん、さすがのパパだったなー
皇女	だよね。ハデラさんが強いっていうのは聞いてたけど、まさかあそこまで強くて、しかもそれを破っちゃうとか
カミシア	ああ。ラーロンの方も空気を読んでか、あえて手を抜かずに戦っていたし、今の戦闘に文句を言えるものはいないだろう
新入生男Ａ	おいおい、人族に負けるとかさ、あの魔族大したことないな
新入生男Ｂ	俺なら、最初の魔法で決めてるよ。ま、魔法の扱いが下手なんだろう
カミシア	と思ったんだが……そうでもないらしいな
主人公	新入生達の間でも、魔王の血族であるラーロンの名前は有名だ。それを知らないというだけでも相当なモグリ。その実力も分かるというものだろう。
バリアリーフ	みなさんが今見たのが、三階級の力ですわ。この学園を目指したみなさんなら、恐らくは自分の力を試したくてウズウズしていることでしょう
バリアリーフ	ですので、まずは一階級同士で行うように。その上で勝ったものは、上級生への挑戦を、ハンデ付きで認めます
バリアリーフ	ただし、くれぐれも言っておきますが、生徒ヴェル！　生徒フォン！　生徒ミヤ！　生徒白鷺への暴言を理由に再起不能に追い込まないように！
暴言執行シスターズ	ぎくうっ！
主人公	本来ならば、気を利かせたバリアリーフのこの注意によって、彼らは命を救われたはずだった。
主人公	が、現在、一階級にもハンターはいる。
リンセ	えっと……ニコちゃん？　どうしたのかなぁ……？　随分とオーラが黒いですけども
ニコ	……止めないで下さい
リンセ	止めるに決まってます。だって、私もやるもん
ニコ	でしたら、リンセはゴミＡを。ニコはカスＢを殺ります
リンセ	まーかせてっ
主人公	そのハンター達の牙は、ヴェル達にも決して劣らぬほどに鋭く尖っていた……。
