姫	ふう……今日はこれくらい、かな
主人公	俺は日課の鍛錬を切り上げると、荒い呼吸を落ちつかせていく。
主人公	今日は思った以上に身体が動いてくれた。この感覚を忘れないようにしていけば、もう一手分踏み込めるようになるかもしれない。
主人公	真眼は、相手の動きを読んで、その読みに合わせて瞬時に身体を動かす必要がある。動けなければまったく無意味だしな。
主人公	逆に言えば、動くことができるなら、多少は無茶な手でも打てるということ。
主人公	相手の攻撃を受けるを、かわすに。かわすをカウンターに、と対応の手を引き上げられる。
姫	破壊力っていう切り札がないからなあ、俺は
主人公	細かな攻撃の積み重ねが、俺の戦い方。それほど多くはやってこないチャンスを確実に掴むために、やっぱり鍛錬は必要だ。
姫	とりあえず、汗を流していくかな
主人公	時間的にはもう問題ないはずだ。俺は真っ直ぐに風呂へと向かっていった。
姫	ふう……少しのんびりしすぎたかな
主人公	いつもよりかなり長湯をしてしまった。紅の奴も、もしかしたらもう寝てしまってるかもしれない。
主人公	部屋へと急ぐ中、不意に食堂の電気がまだついているのが目に入る。
姫	あれ？　こんな時間に電気ってついてたか？
姫	……誰かまだいたりするのか……あ……
主人公	何気なく立ち寄ってみたそこに、俺は彼女の姿を見つけていた。
姫	まあ、頑張ってるもんな、色々と……
ノート	……すぅ……すぅ……
主人公	俺の手の中で静かな寝息を立てるノート。
主人公	起こしてしまわないようにできるだけ注意をしながら、俺は彼女を部屋へと運んでいく。
姫	やっぱり大変なんだろうな、管理人なんて……
主人公	ルアンさんの代理として、寮のことをノートは今取り仕切ってる。トリニティの学生として頑張りながらの仕事だ。俺達が知らないだけで、実際相当な負荷だろう。
主人公	ノートはただでさえ頑張りすぎるところがあるからなあ。まあ、その結果が食堂で寝こけている、っていうのはいいことじゃないけど。
ノート	んう……お掃除、しないと……
姫	夢の中でも働いてるのか、このお姫さまは
主人公	ノートらしい寝言に苦笑しながら、俺はノートの部屋へと歩いていく。
ノート	ん……むにゃ……
主人公	できるだけ起こさないように気をつけてはいたんだが、やっぱり歩きながらは無理だったか。ノートは小さく身を震わせると、その目をぼんやりと開いた。
ノート	あれ……えっと……ここはぁ……
ノート	……姫くん、ですか……？
姫	ああ。今部屋に向かってるところだから、眠ってていいぞ
ノート	部屋、ですか……？
ノート	はわぁ……ボク、姫くんにだっこ、されてますよぉ……
主人公	まだ寝ぼけているんだろう。そのぼんやりとした物言いが妙に可愛らしい。
ノート	ボク、たしか食堂で……
姫	そう。食堂で寝ちゃってたんだよ。だから今、こうして部屋に強制連行されてるところだ
ノート	はぁ、そうでしたか……それで、おひめさまだっこ……
ノート	えへぇ……姫くんにおひめさまだっこ……
ノート	はわっ！？
ノート	あ、あの、これって……？
主人公	どうやら理由はともかく現状は把握したらしい。ノートが、その意識を覚醒させた。
姫	言った通りだ。ノートの部屋まで運んでるんだよ
ノート	で、でででも、あの、ボク、だっこされてて……
姫	頑張ってた女の子は、お姫さまとして扱われる権利があるからな。気にせず休んでなさい
ノート	はい……
ノート	あの……重く、ないですか……？
姫	全然。ノートはスタイルいいから、正直もっと重いと思ってたよ
姫	だからまあ、安心して運ばれろ
ノート	はい……お願いしますね……
主人公	赤らんだ笑顔を浮かべ、言われた通り俺の腕に収まるノート。
主人公	戦闘の時の凛々しさを感じる姿とはあまりに違う表情だけれど、こっちがノートの本当の姿だっていうことを俺は知っている。
主人公	王女、ではなく、あくまでも女の子。そういうところに俺も惹かれているわけで。
主人公	……でも、意識してみると本当にスタイルいいな……ていうか、柔らかい。
ノート	姫くん……
姫	ん？　どうかしたか？
ノート	いえ……ありがとうございます
姫	どういたしまして
主人公	俺はノートの感謝を素直に受け取り、そのまま部屋へと運んでいった。
主人公	管理人の仕事は手伝えないからな。こういうことで少しでも喜んでくれるなら、また運んでやろう。
主人公	腕の中にある笑顔に、俺は素直にそう思った。
