ヴェル	んふふふふ～ん♪
姫	なんか、随分ご機嫌だな、ヴェル。さっきまではあんなに疲れ切ってたのに
ヴェル	当たり前じゃない。だって、ヒメと二人っきりでデートなのよ。疲れなんてどっかの別の世界に吹っ飛んでいっちゃったわ
ヴェル	今頃はきっと、母さまにくっついて、ひいひい言わせてる頃ね
主人公	全部終わったとは言わないが、どうにかある程度先が見えてきたところで、今日の準備は終わりにした。
主人公	まあ、かなりいいところまではいったから、あとはどうにかなるだろう。
主人公	とはいえ、ここのところの業務もあってか、ヴェルは精神的にもかなり参っていたようなので、クラインズポットへの寄り道を持ちかけたら、もうこの通り。
主人公	俺の腕を抱き、ピッタリと寄り添って歩くヴェル。まあ、俺もその、ヴェルの感触とか凄い嬉しいわけだけれども、やっぱり少し恥ずかしい。
主人公	特に今は、まだ俺達のことをよく知らない新入生達が、興味本位の視線を向けてきてるからなあ。
ヴェル	大丈夫よ。もし新しい子たちが何か言ってきたら、その場で静かにさせてあげるから
姫	物理的に、は勘弁してくれよ
ヴェル	ヒメがそう言うなら、直接は当てないようにするわね
主人公	今のヴェルなら、余波だけで大抵の相手は倒せるからなあ……意識を失う、でなくて、命的な意味で。
ヴェル	フォンは置いてけぼりで可愛そうだけど、今日は二人きり、を譲れないから仕方ないわよね
姫	まあ、その辺は、また今度フォンと二人でデートするってことで納得してもらったよ
ヴェル	それはそれでちょっと妬けちゃうけど、その分私も二人きりを楽しめるってことだもん。仕方ないわよね
ヴェル	その分、今日はたっくさんヒメの愛を感じさせてもらっちゃうから、よろしくね
主人公	満面の笑顔で、更に強く俺の腕を抱きしめるヴェル。うん、こういう顔をされたらまあ、応えるしかないよな、男として。
主人公	俺はヴェルに笑顔を返すと、一緒にクラインズポットへの道を歩いていった。
ヴェル	ふふーん。今日はケーキセット、って決めてたのよね。ヒメとの甘い一時に、あま～いケーキ。至福よねえ
姫	ヴェルは甘いものを食べる時、本当に幸せそうな顔で食べるよな
ヴェル	あら、甘いものに限らないわよ。私にとっての最大の調味料は、ヒメだもの。ヒメと一緒に食べる時は、なんだっておいしいの
ヴェル	まあ、その中でも特に、甘いものが素敵なのは否定しないけど
ヴェル	ああ、でも今日のケーキどっちもおいしそう。こんなの迷っちゃうじゃない、ずるいっ
主人公	本気で困るヴェルの姿に、自然と笑みが浮かんでくる。
主人公	魔族の王女といっても、やっぱり普通の女の子だ。見ていて本当に可愛らしい。
姫	それじゃあ、俺の注文もヴェルが決めてくれ。それで交換すれば、二種類食べられるだろ
ヴェル	いいの！？
姫	もちろん。ヴェルがおいしそうに食べてる姿が見られるわけだろ。俺だけの特典だ
ヴェル	も、もう、ヒメったら。際限なく私にヒメを好きにさせる気よね
主人公	それからしばらくして運ばれてきたケーキを、俺達は分け合って食べた。
主人公	予想通りというか、予定通りというか、食べさせて、ときたのはまあ仕方ないだろう。
ヴェル	ふふーん♪
姫	えっと、俺の顔に何か付いてるとか？
ヴェル	ヒメの顔が、私の目の前にあるのよ。それはもう、見つめるしかないじゃない
ヴェル	もう、ヒメったら。顔立ちまで私好みなんだもん。本当にずるいんだから
主人公	ヴェルの好意は、いつも真っ直ぐで、俺に防御する暇を与えてくれないから困る。
主人公	ヴェルの方こそ、こんな美少女だとかずるいよな。ずっと見ていたくなる。
ヴェル	ねえ、ヒメ
姫	ん？　なんだ
ヴェル	好きよ
主人公	ニッコリとした笑顔から放たれた必殺の言葉。
主人公	正面からのその攻撃に、俺は何も言えない。ただ、頬が明らかに熱を持っていくのが分かる。
主人公	さっきの言葉ですら直撃だったわけだが、これはもう即死レベルだろう。
姫	えっと、その……
主人公	どう返していいか分からなくなり、俺は必死に考える。が、やっぱりまあ返せる言葉はこれしかなさそうだ。
姫	……うん、俺もだ
ヴェル	えへへ～♪
主人公	俺の返答に、ヴェルは更に機嫌良く笑う。
ヴェル	あ、ちなみになんだけど、ヒメがさっき言ったこと正解よ
姫	さっき言ったこと？
ヴェル	動かないでね
姫	え……ヴェル？
ヴェル	ヒメったら、口元にクリームついてるのよ。お茶目さん
主人公	小さく笑いながら、スッと伸ばされたヴェルの右手の指が、俺の口元のクリームを拭っていく。
姫	あ
主人公	そして、それをちょっと恥ずかしそうに嘗め取った。
ヴェル	えへへ、食べちゃった
ヴェル	ヒメの口元についてたやつなのよね。これも、間接キスの仲間入りできるかしら
姫	別にその……間接でなくても、直接してるし
主人公	さすがにこれを言うのは少し恥ずかしいと思ったけれど、それでも言っておきたくなった。
ヴェル	そうよね、やっぱり直接の方がいいわよね
ヴェル	ねえ、ヒメ……
主人公	ヴェルは、俺をはにかむような笑みで見ると、
ヴェル	んー……
主人公	そっと目を閉じ、その桜色の唇をわずかに突き出した。
姫	えっと、こんな所で？
主人公	人目もそれなりにあるし、そもそもヴェルはかなり目立つ存在だ。こんな所でキスなんかしたら、間違いなく広められる。
主人公	それを恐らく分かっていながら、ヴェルはその体勢を変えようとしない。
主人公	そして何より、その小さな唇を、俺自身が欲しいと思ってしまっている。
姫	……軽くだぞ
ヴェル	んむ……
ヴェル	えへへ。ヒメにもらっちゃった♪
主人公	ほんの数秒、軽く重ねる程度のキスだった。それでもヴェルは、嬉しそうに笑っている。
主人公	間違いなく、店内の結構な人達に見られたとは思うけれども、まあ、この笑顔がもらえたならいいか。
姫	ヴェルは、時々凄い甘えん坊になるからな
ヴェル	そうなの。私、ヒメに関しては思いっきり甘えん坊なのよ。だから、ちゃんと甘やかしてね
ヴェル	なんだったら、もう一回、する？
姫	あー……これ以上はその、キスで済まなくなりそうな気がするから却下
ヴェル	そうね。するにしても、ヒメ以外の人には見せたくないもの、私。他の場所で、がいいかな
姫	いや、それかなり爆弾発言だからな……
主人公	それから俺達は、陽が暮れるまでこの場所でイチャイチャを繰り返し、周囲に甚大な迷惑を与えてから寮へと帰った。
主人公	……反省はしているけれど、後悔はしてません。
