ニコ	妹さまがケガを、ですか？
ウルル	うん。一応、にいさまの応急手当とオペラの治癒魔法で、ほぼ完治したみたいだけど
オペラ	ふふーん、ウルルさま、褒めていただいてもよろしくってよっ
ウルル	うん、オペラえらい。おかげで皇女ちゃん回復したしね
オペラ	ああ、ウルルさまからのお褒めの言葉……オペラぞっくぞくきちゃうっ
ニコ	ですが、戻って来る時、少々様子がおかしかった気がします
ニコ	主さまとの間に違和感のようなものが
オペラ	あー、あれですあれ。軽いねんざだったんですが、さっすが私たちの白鷺さま！　スカートの中万歳！　と
ニコ	その……ニコのでしたら、主さまが望むなら提供しますのに……
ウルル	でも、ねんざだったら足を見るし、仕方ないよね。皇女ちゃんの戦闘時の服、スカートだし
ニコ	ひょっとしてですが、主さま、欲求不満なんでしょうか？
ニコ	みなさんのことを気遣いすぎているような気が……
ウルル	あ、それはあるかも。にいさま、みんなに優しいですから
オペラ	まあ、一人に手を出せば、他の全員ともやらないと不公平になる立ち場ですからねえ。いやあ、男として身体もたないでしょうねえ
ニコ	あ、あの、主さま？　ニコですけれど……
主人公	返答はなかった。気配を探ってみても、中に人がいるようには感じられない。
ニコ	お風呂……でしょうか？
主人公	念のためドアノブを持ってみると、
主人公	どうやら鍵はかかっていないらしい。簡単に開いてしまう。
ニコ	かけ忘れ……？
主人公	そっと中を覗いてみれば、やはり誰もいない。姫も紅も、その姿は見当たらなかった。
主人公	ここは出直すべきだ、と思うものの同時に、鍵をかけ忘れているこの部屋を放置してしまっていいのか、という考えがよぎる。
主人公	偶然とはいえ気づいてしまった自分が、部屋の留守を預った方がいいんじゃないか。
ニコ	……ここは、ニコが不法侵入で叱られようとも、主さまの留守を預るべきですね
主人公	そう判断を下すと、ニコは部屋の中へと入っていった。
ニコ	し、失礼します……
主人公	誰もいないとはいえ、姫が普段生活をしている部屋。ニコは恐る恐る中へと入ると、部屋の真ん中で正座をする。
主人公	姫か紅か、どちらかが戻ってくるまでこの部屋を死守すること。これが、今の自分がやるべき使命。
主人公	当然、何かに触れたりするなど言語道断。自分はただ見張るだけの存在。
主人公	が、
ニコ	……主さまの匂いがします……
主人公	その心はあっという間に崩れさった。
ニコ	……主さまが寝ている布団……
主人公	ぴょこぴょこと動いてしまう耳を必死に堪え、ニコは必死に誘惑に耐える。
主人公	いや、耐えていたつもりだった。
ニコ	……これは危険です……主さまの匂いに包まれているようで……なんていう安らぎが
主人公	だが、気づけばとっくにベッドの上に横になっていた。
ニコ	主さまは、いつもこの布団で……
ニコ	い、いえ、ダメです。いくらなんでも、そんな行為はふしだらすぎます……主さまを汚す行為ですっ
ニコ	耐えて、耐えて下さいニコ。ニコの想いは、そんな不純なものでは決してっ
主人公	この布団に顔を埋めて、存分に堪能したい。そんな欲望とニコは必死に闘い続ける。
ニコ	で、ですけども、す、少しくらいならニコの活力の源ということで……
主人公	それでも、充満する姫の匂いのせいだろうか。ニコはベッドの上に四つんばいになると、その布団を真剣な顔で見下ろし続ける。
ニコ	す、少しだけです。本当に少しだけ……
主人公	自らの進むべき道を定め、ニコはその顔を布団へと……。
姫	あれ、鍵かけ忘れてたか？
ニコ	きゃあああああああああああああ！！
姫	な、なんだあ！？
主人公	部屋へと戻ってきた瞬間、高らかに響いた悲鳴と大きな物音。
主人公	そして、この謎の物体。ていうか、布団被った誰か。
姫	ええと……誰か中に入ってるのかな？
主人公	念のため聞いてみる。いくらなんでも泥棒がこんな隠れ方をするとは思えないし、紅だったら隠れる必要もない。
主人公	多分、俺の知ってる誰かが遊びに来てたんだと思うけども……。
ニコ	は、入ってませんっ。断じて入ってません！
主人公	……今の声、ニコか。
主人公	なんでこんなことになってるのかは知らないが、まあこのままじゃ話もできないし。
姫	光る当たる世界へようこそ！
主人公	俺は、目の前の布団を強引に剥ぎ取った、
主人公	ら、凄いことになっていた。
ニコ	きゃああっ！
ニコ	あ、だ、ダメです！　ニコを見ないで下さい！　ニコはこんなところにはいないんです！
主人公	普段のニコからは考えられないくらいの慌てっぷり。これはこれで新鮮だなあ。
主人公	まあ、パンツ丸見えなこのポーズも、新鮮といえば新鮮だけれど。
姫	ええと、ニコ？　いったい何を……
ニコ	後生ですっ。後生ですから、見なかったことにして下さい！
主人公	なるほど、ニコの本質は普段のクールな感じよりも、こういったところにあるんだな。
姫	いや、別に怒ったりする気もないから大丈夫だぞ
ニコ	で、ですがですがぁ……
姫	そもそも、もうバレちゃってるんだから意味ないだろ
ニコ	あうっ
主人公	ようやく、その事実を受け入れるしかない、ということにニコは気づいたらしい。今にも泣きそうな顔で少しだけ考え、
ニコ	え、えへっ♪
主人公	ごまかすように、可愛らしく笑ってみせた。
主人公	うん、可愛いけどまったくごまかせてないからな。
姫	まあ、とりあえず一つだけ質問だ。部屋の鍵って、やっぱり開いてた？
ニコ	えへへ。開いてました♪
姫	あー、やっぱりか。いつもは紅が閉めてくれてたから、ついやっちゃったんだな。気をつけないと
姫	うん。ニコが可愛いってことはよく分かったから、とりあえず起き上がろうか
主人公	俺は背後からニコを抱きかかえると、そのまま持ち上げた。
主人公	床の上にペタンと座りこんだニコは、真っ赤になって俯いてしまっている。
姫	いや、本当に怒ったりするつもりはないから、そうかしこまらないでくれ
ニコ	は、はい……その、ニコとしたことが、本当にとんだ痴態を……
姫	痴態というか……まあ、いい物を色々と見せてもらった感じが
主人公	下着とか、慌てまくった姿とか、恥じらった笑顔とか。
ニコ	す、すみませんっ。本当に、もうなんと言っていいものか……
姫	いや、むしろまた見せてくれると嬉しいけどな。さっきの笑顔とかさ
ニコ	あう……えと、あの、き、機会がありましたら……
姫	それで、部屋にいたってことは尋ねてきたってことだよな。何か話でもあったのか？
主人公	俺の質問に、ニコは思い出したかのように、あ、っと小さく声をこぼした。
ニコ	は、はいっ。ぜひ、お伝えしたいことが……
主人公	今までとは打って変わった真剣な表情を浮かべるニコ。その重要さを察し、俺もニコへと正面から向き直った。
ニコ	昼間の、妹さまのケガの件を聞きました
姫	まさか、皇女に何かあったのか？
ニコ	いえ……ですがその時の主さまの態度につきまして……そ、その……妹さまの下着を見て、激しく動揺していたと
主人公	……さて、どの辺から聞いたか分からないけれど、随分脚色されて広まっていそうな気がするなあ、これは……。
姫	一応言っておくけども、わざと見たわけじゃないぞ。本当に足のケガが心配だったからでだな
ニコ	はい。そこは少しも疑っていません。むしろニコは、逆だと思ってます
姫	逆？
ニコ	主さまは、もっとみなさんに男性として手を出すべきじゃないかと！
姫	またストレートに来ましたねニコさん……
ニコ	英雄色を好むとも言いますし、主さまほどの勇者であれば複数の女性にそれはもう毎日朝昼晩と食事後のデザート代わりに手を出すことも当然です！
ニコ	にも関わらず、主さまは自分を抑制して、中々手をだしません
姫	いや、正直そこまであからさまに言い切られたのは初めてです
主人公	デザート代わりって、いくらなんでもねえ……。
ニコ	そこで、考えてみたんですが、主さまはもしかして、みなさんの身体を気遣って手を出さないのではと
姫	身体というかまあ……そういうことをしたいだけ、みたいに見られたくないというか……
主人公	更に言うなら、一人と関係もてば他の子とも、と連鎖するわけで……むしろ俺の身体がもたないというか……。
ニコ	そ、そこでなんですが！
主人公	ニコが、その頬を赤らめながら、思い切り前へと乗り出してきた。
ニコ	も、もしそれが理由でガマンができなくなってしまっているのでしたら、ニ、ニコの身体で存分に欲求を解消していただければっ
ニコ	初物なので具合はよくないかもしれませんけれども自由気まま好き勝手に開発する楽しさは感じていただけるのではないかとっ！
姫	…………えーと…………
主人公	……さて、俺はどう返せばいいんだろう。
主人公	まあ、ニコは外見的にも内面的にも可愛いし、そんな子が自由にして下さい、と言ってくれば男として当然心揺さぶられるわけで。
主人公	だからといって、本当にそんなことをできるわけもない。
ニコ	い、いかがでしょうか……？
主人公	どうやら、冗談でもなんでもなく、ニコは本気で、それもあくまで俺のことを考えた上で言ってくれているみたいだ。自分を犠牲にしてまで。
姫	いや、その気持ちはありがたいけれども大丈夫だよ。むしろ、女の子なんだから、そこまで自分を犠牲にしないでくれ
ニコ	そ、そうですか……
ニコ	残念です……
姫	……え？
主人公	なんていうか、今、予想外の言葉を聞いた気がしたんですが……。
ニコ	そ、それでは失礼します……
主人公	明らかにガッカリした態度で部屋から去って行くニコ。
姫	あの、もしかして……されたかった？
主人公	ま、まさかなあ。あのニコが……。
主人公	だとしたら、ちょっと勿体なかったような……いやいや、そういう考えはいけない。
主人公	俺は、ニコの出ていった扉を、ただ苦笑を浮かべて眺めていた。
