ルルウ	う……
主人公	ルルウの瞳がゆっくりと開く。どうやら目を覚ましてくれたらしい。
ヴェル	大丈夫？　ちょっとやりすぎちゃったかしら
ノート	さすがに、十翼は開かなくてもよかったんじゃないですか？
ヴェル	だって、それだと失礼じゃない。ルルウは、ヒメの全力を見たがってたんだし
ノート	確かに、姫くんの全力がたいしたことない、って思われちゃうのはイヤですね
オペラ	ということにして、年下のライバルを一人消そうとしたお二人の友情に、私感激です
ヴェル	そ、そんなことは……ねえ？
ノート	は、はい。ですよねえ……？
オペラ	いやー、まさか本気で本気の本気だったとは……さしものメイドさんもビックリですわー
ウルル	にいさま、ルルウちゃんの傷は……
主人公	俺は、ルルウの前にしゃがみ込むと、そっと手を差し出した。
姫	一応、治癒魔法はかけてもらったけど、立てそうか？
ルルウ	……はい……なんとか……あっ……
主人公	そして、そんな俺の手を取って、ルルウは少しふらつきながらも立ち上がろうとするが、やっぱりちょっと辛いらしい。身体を起こすだけでとどまった。
主人公	そのまま、ゆっくりと俺達を見回すルルウ。それは、改めて自分を納得させる儀式のようだった。
姫	悪いな。あえてああいう戦い方をさせてもらった
姫	一応、ルルウの期待に応えたつもり、なんだけど
主人公	俺の言葉に、ルルウは静かに微笑みを浮かべる。どこかスッキリとした、本当に満足そうな笑みだった。
ルルウ	本当に……本当に姫くんは、期待以上です
ルルウ	ルルが知りたいことをちゃんと理解して下さって……その上で最大の力を持ってきて下さいました
主人公	あの時、やっぱりこの場所でラーロンと戦った時のことを思い出す。
主人公	あいつもそうだった。俺一人の力なんてたかがしれている。だけどそれでも俺が見せられる力、すべての期待に応える勇者としての力を見たがっていた。
主人公	一対一で戦わなきゃならない時はもちろんある。だけど、それでは絶対に勝てない時、勝てない相手と対峙した時。
主人公	それでも俺は、勝たなきゃいけない。
主人公	敗北を許されない存在。それが、勇者だから。
主人公	汚いと言って見下されるならそれも構わない。そんな声すらすべて飲み込み、俺は前へと進んでみせる。
姫	ルルウは、俺に勝ってくれって願ってた
姫	勇者としての俺が勝つことを期待していた、だろ
姫	だったら、何があっても勝つのが俺の、勇者の使命だ
ルルウ	はい……間違いなく、ゲンくんの教えです
ルルウ	勇者は期待に応えなければいけない。そのための力を持たなくてはいけない
姫	まあ……男としてはちょっと情けないけどな
ルルウ	そんなことはありませんよ。信じてくれた方々を勝利へと導く存在。人はそこに、太陽のような希望を見出すんですから
ルルウ	あなたは本当に、彼が認めた勇者なんですね
主人公	そこには、泣き顔があった。
主人公	確かに笑ってはいたけれど、だけど俺には泣き顔に見えた。
ルルウ	ゲンくんは、ちゃんと託せる人を見つけていったんですね。ミヤちゃんを、ちゃんと守って……
主人公	勇者ゲンは、もういない。あの時、あの人は笑顔で旅立ってしまった。
主人公	俺なんかじゃあ、まだまだ届かない、そんな高見の世界へと。
主人公	ルルウはきっと、今それを実感した。分かってはいたけれど、分かりたくなかったこと。あえてうやむやにしていたこと。
主人公	それが事実だっていうことを、今、理解した。
主人公	ルルウはそのまま空を見上げると、静かに呼びかける。
ルルウ	おめでとう……ございます……
主人公	決別の言葉を贈るその姿を、俺達は黙って見つめていた。
主人公	その言葉があの人の元へ届いたことを、俺達も夜空へとただ祈る……。
ウルル	ルルウちゃん
主人公	そんなルルウの隣にウルルは立つと、そっと名前を呼んだ。
主人公	そうして、優しく妹の身体を抱きしめる。
ルルウ	ウルルお姉さま……
主人公	姉の胸に抱かれて、ルルウも寂しげながらも微笑んだ。
主人公	父を失った重みを、ウルルが一緒に背負っているんだろう。
ウルル	知りたかったこと、伝わったよね
ルルウ	はい。ちゃんと、伝わりました
ルルウ	……ウルルお姉さま……少しだけ、ここを借りてもいいですか……？
ウルル	うん、いいよ。好きなだけ使って
ウルル	ウルルは、ルルウちゃんのお姉さんだから
ルルウ	はい……
ルルウ	う……あ……ああああああっ！！
主人公	ウルルの腕に抱かれながら、ルルウは大声で泣き始めた。
ルルウ	うああああああああああああああ！！
主人公	ただ全力で、その想いのすべてをこめて、泣き続ける。
主人公	今はもういない人。どの世界のどこを探しても、もう会えない人。
主人公	その事実に、ただ泣き続ける。
主人公	そんな妹を、ウルルは姉として、しっかりと受け止めていた。
主人公	優しく、けれど強く、しっかりと。
ルルウ	うぐ……ひっく……ああああああああああ……
主人公	大切な人の想いに気づかず苦しみ続けたウルル。けれど、だからこそ、その想いに気づける大切さを分かってる。
主人公	ルルウが、その人の想いに気づけたことの意味を分かってる。
主人公	その意味ごと、受け止め続ける。
主人公	この姉妹の姿を、きっと見ていてくれるだろう……。
