姫	ふう……みんなには悪いけど、やっぱり夜に大浴場を独り占めできるのは贅沢だよな
主人公	日課の訓練を終えて一風呂浴びた帰りに、しみじみと呟いていたところで、俺はふと気がついた。
姫	なんか、小腹が減ったな……
主人公	夕食はしっかり食べたはずなのだが、訓練で動いたせいだろうか、それとも一風呂浴びて気が抜けたせいだろうか。
姫	とは言っても、今の時間じゃさすがにな
主人公	何かつまめるものがあればいいなと思うものの、既に消灯前で食堂も閉じてしまっている。
姫	仕方ないか……ま、あまり寝る前にモノを食べるのは良くないしな
ルルウ	あら？　姫くん
姫	お？
主人公	自分に言い聞かせるように呟いて、部屋に戻ろうとしたところで、丁度上から降りてきたルルウと目があった。
ルルウ	お疲れ様です、お風呂上がりですか？
姫	ああ、今丁度上がったところだよ。ルルウは？
ルルウ	お恥ずかしながら、脱衣所に忘れ物をしてしまって
姫	あ、そうなのか
主人公	思わず、何を忘れてきたのかというデリカシーの無いことを聞いてしてしまいそうになり、慌てて質問を飲み込む。
ルルウ	ええ、髪を結ぶリボンなんですけど。見ませんでしたか？
姫	悪い、気がつかなかった
主人公	なるほど、リボンか。確かにああいう小物は脱衣所に忘れがちだよな。
主人公	まあ、俺の場合、迂闊に忘れると日中は自分で取りに行けないので、毎度毎度忘れ物が無いかかなり入念にチェックする。
ルルウ	いえ、気になさらないでください
姫	もし脱衣所になかったらノートに聞いてみるといいぞ。落とし物とかは寮長が管理する事になってるから
主人公	普段であればルアンさんが保管しておいてくれている。今の寮長代理はノートなので、ルアンさんに変わって管理してくれているはずだ。
ルルウ	わかりました、ありがとうございます
主人公	俺の言葉に軽くお辞儀をするルルウに笑顔を返して、入れ違いに階段を上がろうとした時だった。
ルルウ	あ、ところで姫くん
姫	ん？
ルルウ	さっき、食堂を覗いてましたけど、もしかしてお腹減ってるんですか？
姫	見られてたか
ルルウ	くすっ、降りてくる時にちょっとですけどね。なんだかお腹をすかせた子犬みたいな顔をしていたので
姫	うわ、それは恥ずかしい
主人公	自分では気がつかなかったけれど、軽く食堂を覗きこんだ時に、俺はそんな顔をしていたらしい。
ルルウ	もしよろしければ、ルルが何か作りましょうか？
姫	え？　いいのか？
ルルウ	ええ、勿論です。むしろこのまま空腹状態で放置していくなんて、ルルのプライドが許しません！
姫	た、頼もしいな
ルルウ	ええ、ちょっと準備してきますので食堂で少々お待ち下さい
姫	わ、分かった
主人公	その勢いに押されつつ頷くと、ルルウは風のように階段を駆け上がっていった。
主人公	一瞬そこまでがんばらせるのは悪いと思ったけれど、そう言ったところでルルウは納得しないだろう。
主人公	それに、腹に何かを入れたかったのは事実だしな。ここは素直にルルウの言葉に甘えるとしよう。
姫	おお……
主人公	キッチンから漂ってくるいい匂いに思わず声を上げてしまう。
ルルウ	ふふふ～ん♪
姫	この匂いはたまらないなあ
ルルウ	ですよね、やっぱり料理中に漂う香りも料理の一部だとルルは思うんです
主人公	鼻唄混じりにフライパンを動かしながら、手際良く調理をするルルウに感心しながら後から眺める。
主人公	ちなみにルルウがメイド服なのは、本人曰くご奉仕をする以上この服装以外にありえないかららしく、先程部屋に戻ったのは着替える為だったらしい。
姫	さすがに手際いいなあ
ルルウ	ふふん、この服を纏っている時のルルウに失敗はありません
主人公	褒められたのが嬉しかったのか、ドヤ顔で答えるルルウ。さすがと言うべきか、多少料理から目を離していても、まったく危なげない。
姫	ちなみに何を作ってるかは……
ルルウ	内緒です
姫	あ、やっぱり
ルルウ	何が出てくるかワクワクしながら待つ時間、これがまたいいんです
主人公	その意見には充分共感できる。いい匂いがする食堂で料理が出来るのを待つ時間もまた楽しいものだ。
主人公	まあ、調理を始めてからほぼずっとルルウの後ろ姿を眺めていたので、何を作ってるのか大体予想ついているんだけれど、ここは言わぬが花というものだろうな。
姫	はは、ルルウはきっといいお嫁さんになるよ
主人公	そんなルルウの姿を見ながら、何気なくそうこぼすと、ルルウは頬を赤らめる。
ルルウ	お、お嫁さんだなんて……そんな、勿体ないですよ
主人公	そう口では謙遜しているルルウだが、俺の言葉が余程嬉しかったらしく、えへへと可愛らしい笑顔を浮かべている。
ルルウ	まだまだオペラさんたちには負けてしまいますし、ルルなんて全然ですよ
姫	いや、あの人を基準にすると、大抵の人がまだまだになっちゃうから
主人公	あの人の場合、料理に限らずありとあらゆる意味で規格外なお方だからな。あの人に勝てないからって落ち込んでいたらキリがない。
姫	でもまあ、身内の贔屓目を除いても、ルルウはすごいと思うぞ？
ルルウ	も、もう褒めてもなにも出ませんよ、えへへ～
主人公	そう言って嬉しそうに笑うルルウを見れただけでも、褒めた甲斐は充分にあると思うけれど、これもまあ言わぬが花だろう。
ルルウ	はい、完成です！　ルルウ特製オムライスです
姫	へえ、これは美味そうだなあ
主人公	簡単なものですが、と言いながらルルウが差し出してきたのは、予想通りオムライスだった。
主人公	形も良く綺麗に卵に包まれており、匂い一つとっても食欲を大いに刺激する。
主人公	そして、とどめとばかりにケチャップで俺の名前とハートマークまで入った、非の打ち所がない完成度のオムライスだ。
ルルウ	夜食ということで、塩分控えめ、ご飯少なめでお作りしました
姫	悪いな、そこまで気を遣ってもらって。ほんと、ルルウはいいメイドさんだ
ルルウ	くす。もう、本当にお上手なんですから
主人公	照れたように笑いながらも、まんざらでもなさそうに言うルルウに、こちらも嬉しくなる。
主人公	ちなみにルルウが言った通り、オムライスは若干小さめだが夜食としては充分だ。
姫	それじゃあ、さっそく
姫	いただきますっ
ルルウ	はい、どうぞ召し上がれ♪
主人公	スプーンでオムライスをすくって口に運ぶ。見た目に違わず、味も完璧で思わず声が出てしまう。
姫	これは美味いなあ
ルルウ	喜んでもらえて良かったです
姫	いや、本当に美味いよ。これは夜食としてじゃなくて、もっとしっかり食べたくなる
ルルウ	なら、今度はお昼にでもお作りしますよ
姫	ああ、是非頼むよ
主人公	そう言って俺は、スプーンを止める事なくオムライスを口に運び、あっという間に完食してしまった。
姫	いや、本当に美味かった。ごちそうさま
ルルウ	はい、お粗末様でした
主人公	お辞儀を一つして、こちらの食器を下げるルルウに、俺は慌ててついていく。
姫	俺が頼んだんだし、後片付けぐらいは俺が自分でやるよ
ルルウ	いけません。食器の片付けまで含めてルルの仕事です。これはゆずれません
姫	でもなぁ
主人公	さすがに悪いと思ったのだが、こちらを振り向いたルルウに上目使いで言われてしまう。
ルルウ	それとも姫くんは、ルルからお仕事を奪う気ですか？
姫	そ、それは反則だろ……
主人公	そう言われたら何も出来なくなってしまうが、ここまでしてもらったのに、何も返さないというのもやはり気になる。
主人公	そんな感情が顔に出ていたのか、ルルウはくすりと笑うと一つの提案をしてきた。
ルルウ	それじゃあ今日のお礼代わりに、今度一緒にルルの手作り料理を食べて下さい
姫	それじゃあ、お礼を返すどころか、むしろ積み重なってるような？
ルルウ	いいえ、新しい料理の試食をお願いするので、充分に助かりますよ。要は新作の実験台です
主人公	ウィンクを一つしながら冗談めかして言うルルウに、俺は苦笑しながら頷いた。
姫	了解した、それでルルウが満足するならいくらでも
ルルウ	はい、ありがとうございます♪
主人公	実験台と言っていたルルウだが、彼女が作る料理の時点でおかしな物が出てくるわけもない。やっぱりお礼どころか、借りを積み重ねてしまっているように思う。
主人公	けれど、ルルウの本当に嬉しそうな笑顔を見て、彼女がそれで喜んでくれるならいいか、と俺は思った。
