主人公	迷宮試験も中盤を迎え、俺達は特に問題も無く迷宮の攻略を続け、その道程の半分も過ぎたところだった。
リンセ	～♪
姫	えーと……
フォン	む～
主人公	そう、順調すぎて怖いぐらいで、なんの問題もない。
主人公	迷宮攻略に関しては。
姫	あの、リンセさん？
リンセ	はい、何ですか？
姫	なんで、ここまで密着する必要が？
主人公	迷宮試験も中盤に差し掛かった辺りで一度小休止を挟んだのだが、その後ぐらいからリンセがべったりとくっつき始めた。
主人公	さすがに、ちょっとくっつきすぎじゃないかと思って尋ねてみたんだが……。
リンセ	お父さまをしっかり守れるようにです、キリッ
フォン	うっわ、言い切りましたよこの子
姫	うん、その気持ちはありがたいんだけど……
リンセ	えー、だって、お父さまが今後はフォーメーションＤ４でいくって言ったんじゃないですか
リンセ	このフォーメーションは、フォンちゃんが前衛、その後でお父さまが周辺警戒、私がお父さまの護衛を担当、ってフォーメーションです
姫	そうだね、そう説明したのは俺だね
主人公	数日前の作戦会議より、俺達は戦闘中や進行中に素早く動けるように、いくつかのフォーメーションを決めていた。俺の号令一つですぐさまに陣形を組めるようにと。
主人公	このＤ４もその一つで、内容もリンセが言った通りなんだが、ここまで密着する必要はどこにもない。
姫	けど、やっぱりここまで密着する必要は……
リンセ	何を言ってるんですか！　リンセの役割はお父さまをこの身を挺して護る事！　つまりつまり、今の私はお父さまの所有する盾や鎧と同じ！
姫	お、おう……？
リンセ	そして武器や防具は持っているだけじゃ意味がありません！　装備しなければその力を発揮できないのです！　武器屋のおじさんもそう言ってました！
姫	えーと、つまり……？
リンセ	つまり、まさに今のこの状態こそ、私はお父さまに装備されている状態！　理想的で非の打ち所の無い完璧な防具としてのありかたなのです！　キリッ！
主人公	いや、その理屈はおかしい。
フォン	ものすごいとんでも理論なのに、ここまではっきり言われると、否定しにくいですね……
リンセ	それとも、お邪魔でしたか……？
姫	うぐっ……
主人公	こちらが返答に困っていると、すかさず上目遣いで尋ねてくる。
主人公	なんというか、色々とずるいと思う。
リンセ	こんな盾はいりませんか？　私、武器屋さんに５０ゴールドぐらいで、売られちゃう可哀想な盾ですか？
姫	い、いやそんな事はないぞ……リンセはすごく優秀だし
主人公	実際リンセはかなり優秀だ。ここに来るまで何度かモンスターと遭遇したり、パーティーとの戦闘も行ったけれど、リンセとフォンのおかげで苦戦らしい苦戦もしなかった。
主人公	たとえこの状態で、モンスターなどが現れたとしても。
モンスター	ぐるああああああああああ！（リア充爆発しろ！）
リンセ	きっ！（お父さまとの幸せタイムを邪魔するな！）
モンスター	ぎゅるあああああああああ！（すみませええええん！）
主人公	こんな感じで一睨みするだけで、吹き飛ばしてしまう。
フォン	敵の自動迎撃機能がついた盾、便利ですね
姫	うん、やっぱりリンセは凄く優秀だ……よね……？
リンセ	そうですか、なら良かったです♪
主人公	少しの陰りもないリンセの笑顔に、俺はまるで呪われた防具でも装備したかのような重さを感じつつ迷宮内を進んでいった……。
主人公	そして、それから更に数分後。
モンスター	ぎゅるあああああああああああ！（ほんとすみませんでしたああああ！）
主人公	怒濤の勢いで逃げていく、哀れなモンスター。
フォン	……あの、前衛としてのフォンの仕事取らないでほしいんですけど
主人公	モンスターの出現にハーケンを構えていたフォンが、呆れた様に呟いた。
主人公	相も変わらず、その一睨みでモンスター類を退けてしまうリンセに、すっかり手持ちぶさたになってしまっている。
フォン	というか、リンセさんばかりずるいです、フォンも姫先輩といちゃいちゃしたいです
リンセ	べ、別にイチャイチャしてないですよ、さっきも言った通り、私は今お父さまの装備品扱いですから
主人公	いい加減我慢できなくなったのか、つんつんとリンセの肩をつつきながら、フォンが唇をとがらせる。
フォン	それじゃ、フォンは姫先輩の武器として、もう片方の手に装備されちゃってもＯＫですね♪
リンセ	う、それは……
主人公	自分が言い出した事だけに否定出来ないのか、リンセが言葉に詰まる。
主人公	さすがに俺も両手を塞がれるのは勘弁してほしい。そんな俺の考えを察してか、フォンはくすりと笑った。
フォン	冗談ですよ。フォーメーション的にも、フォンは前衛を続けないといけないですし、これ以上姫先輩を困らせるのもしのびないですから
リンセ	ほっ
フォン	ま、ちゃんと自分の仕事はしっかりしてますし、今はそれほど急を要する事態じゃないですしね
フォン	ただし、その時が来たらちゃんと働いて下さいよ
リンセ	はいっ！
主人公	フォンの言葉にしっかり頷き、リンセはますます力を入れ身体に密着してくる。
リンセ	えへへ、お許しが出ましたよお父さま
姫	なんだか、俺の意思を無視して話が進んでたみたいだけど
リンセ	そんな事ないですよ～。お父さまが一言邪魔だと言ってくだされば、私はちゃ～んと離れます♪
姫	ぐぬぬ～
主人公	俺にそれが出来ない事を知っての発言に、思わず唸ってしまう俺と、それを見てくすくすと笑うフォン。
フォン	なるほど、さすがの姫先輩も娘には敵いませんか
フォン	きっと、というか間違いなく、将来姫先輩は自分の子供を甘やかすタイプですね
姫	うるさいです
リンセ	えへへ～、お父さま～
主人公	まあ、将来もなにも現在進行形で娘を思いっきり甘やかしているので、フォンの言葉は予想どころか予言に近い。
主人公	結局リンセという名の最強の盾を装備したまま、俺達は迷宮試験後半のチェックポイントである広場の一つに到着した。
姫	ここを過ぎれば、試験もいよいよ終盤だな
フォン	収集用のアイテムも大分手に入れましたし、タイムも悪くないです
姫	ああ、最初のスタートダッシュが効いたな
主人公	迷宮試験はただ単に迷宮攻略の速度を競うものではなく、各生徒の総合力を計る為の試験だ。
主人公	そのため単純な迷宮攻略の他にも、様々な課題が設定されている。フォンが言った収集アイテムもその一つで、どれだけの収集アイテムを確保出来たかも評価の対象になる。
主人公	収集アイテムは宝石や指輪などのアイテムであり、微量ではあるが魔力を纏っている。そのため、多くを手に入れれば手に入れるほど、敵やモンスターに発見されやすくなる。
リンセ	これなら本当に総合成績一位だって狙えちゃいますね！
姫	そうだな、まだ何が起こるかはわからないけど、このままのペースを保てれば充分狙える位置に俺達はいる
主人公	そう言いながら俺はフォンとリンセにある目配せをした。
フォン	そうですね、だからこそ……
リンセ	ここで後顧の憂いを断っておくのがいいですね！
姫	その通りだ
主人公	俺の視線に気がついてくれたのか、自然と二人の意識が戦闘モードへとシフトする。
姫	と、言うわけでそろそろ出てきてくれるかな？
主人公	俺はそう言って後を振り返って呼びかけるが、そこからは誰の言葉も返ってこない。
主人公	しかし、言葉は無くても相手が動揺したのは、何となく気配で察知できた。
フォン	出てこないならそれでいいですよ？　問答無用で吹き飛ばすだけですから
リンセ	あ、その方が楽ですね、それでいっちゃいましょうか？
主人公	笑顔のままそう告げる二人に、さすがにもう隠れていられないと思ったのか、後から数組のパーティーが現れる。
リンセ	やっぱり、つけられてましたね
フォン	あら？　それが分かってるから姫先輩に必要以上にくっついていたんでしょう？　いつでも姫先輩を守れるように
リンセ	確証はありませんでしたけどね
主人公	そう、リンセはただのワガママで俺に身体を密着させていた訳じゃない。後からこちらを追いかける気配に気がつき、俺を護る為に必要以上に身体を密着させていた。
敵パーティーリーダー	いつから気がついていた？
姫	最初からかな。正確に言うと、三番目のトラップを解除した時に偵察班が俺達のパーティーを見つけて、その後合流した……って感じか
フォン	さすがですね、フォンは最初の広場にたどり着くまで気がつきませんでした
姫	そこで本隊と合流してたからな
敵パーティーリーダー	…………
主人公	まさかそこまでだとは思ってなかったのか、敵パーティーのメンバーが呆然としている。見る限り一階級中心のパーティーだろう、筋は悪くないが色々と詰めが甘い。
主人公	特に本隊と合流した際は幻術魔法の規模故に、一瞬だが魔力光が漏れていた。俺のパーティーでなければ、あの場で逆に奇襲をかけられて全滅していただろう。
リンセ	さすがお父さまです！　私なんて休憩の時にやっと違和感に気がついたのに！
姫	いや、しかたないよ。相手の中に腕のいい神族が一人いるんだと思う、幻術系の魔法でずっと気配と姿を隠してたからな
敵パーティーリーダー	ちっ、さすが次期勇者様は俺達なんかとは格が違うってか？　卑しい人族の分際でよぉ
主人公	どうやら余裕を見せるこちらの態度が気にくわなかったらしい。男が吐き捨てるように言い、それに周囲の者たちが続く。
主人公	そんなヤジは既に聞き慣れてしまっている俺は苦笑しただけだったが、他二人の纏った空気が一瞬で凍えるような温度まで下がった。
フォン	言葉には気を付けた方がいいですよ？　あなたたちが見逃されていたのは姫先輩の温情であることをお忘れなく
リンセ	はい。お父さまの号令一つで、あなた程度かる～く捻ってあげます
リンセ	もっとも、これ以上の狼藉を続けるようなら、号令なしでも私の独断で、あなたたちを殲滅してさしあげますけどね
フォン	あ、ずるいですよリンセさん。あのパーティーを皆殺しにするなら、フォンもぜひ参加させてください♪
主人公	顔も口調も笑顔なのに、その瞳から放たれた殺気に、一瞬でその場が静まり返る。
姫	まあ、俺もこのまま後からくっついてくるだけなら、別にいいかなー、なんて思ってたんだけどな。実際隠密系の幻術はかなり練度が高かったし、俺達にもついてきたしね
主人公	俺は後からつけられ始めた時点で、少しだけ楽観視していた。練度を見る限り一階級であり、多分人数が少なくフットワークの軽いこちらにはついて来れないと。
主人公	しかし、彼らは俺の予想を裏切り、しっかりここまで追跡を続けてきた。いくら俺がトラップを解除しながら進んだとはいえ、中々できる事じゃない。
姫	けどさ、殺気があからさますぎ。奇襲をかけて襲うにしても、相手に気づかれる程の殺気を垂れ流してたら、さあ襲いますよって宣言してるようなもんだぞ？
主人公	そう言いながら俺は、暗に示す。ここで手を引くならこちらも手を出さないと。
主人公	こちらとしても試験の終盤前に消耗は避けたい。だから、リンセやフォン達にも待機を命じている。
敵パーティーリーダー	気にいらねぇ……
姫	…………
主人公	返答を待つこちらへの第一声は、歪んだ顔から放たれるそんな言葉だった。俺は思わず嘆息しそうになるのを堪える。
敵パーティーリーダー	気にいらねぇんだよ、その余裕面！　人族の分際で上から目線でものを言いやがって！　気にいらねぇ、本当に気にいらねぇ！
フォン	おやおや、どうやらちっぽけなプライドを傷つけてしまったようですね
リンセ	哀れで滑稽ですね
敵パーティーリーダー	てめぇみたいな、まぐれと偶然でのし上がったくせに、女侍らしてお山の大将気取ってる野郎が俺は一番嫌いなんだよ！
敵パーティーリーダー	ここでくたばって！　人族らしく無様をさらしやがれ！
主人公	そう言って男が手を上げた瞬間、周囲にいたパーティーが一斉に武器を手に動きだす。
主人公	俺は今度こそ嘆息をこぼしながら、武器を構えた。
姫	フォン、リンセ、やるぞ！
リンセ	まってました！
フォン	そろそろ、イライラが限界だったので助かりました♪
主人公	久々に向けられた純粋な敵意。人族という理由だけで向けられる悪意、慣れたとはいえやっぱり少し堪える。俺も残念ながら聖人君子じゃない。
主人公	あれだけの事を言われて、特にあの戦いをまぐれや偶然と言われ、一緒に闘ってくれる仲間を馬鹿にされてまで、黙っていられるほど俺はお人好しじゃあない。
姫	やるからには徹底的にだ！　ＦＡ７！
フォン	はい！　頭の足りないお猿さんに、見せつけてやりましょう、姫先輩の力を！
リンセ	行きますよ！
主人公	俺の言葉に瞬時に二人は反応し、フォーメーションを組み直すと、三人ひとかたまりになって突撃を敢行する。
敵男神族	ひゃっはー、馬鹿か！　この人数相手に正面からくるのかよ！
敵パーティーリーダー	目標は白鷺姫だけだ！　あいつは脆弱な人族だ！　一発でかいのを当てれば沈む！
主人公	敵の数は目視出来る限り六人、気配を消して後二人は周囲に隠れている。
主人公	確かに普通ならば正面から突撃は下策かもしれない。ただ、相手の練度とフォンとリンセの二人の実力を比べた結果。
フォン	どちらが馬鹿か、その身でたっぷりと味わいなさい！
リンセ	せーの！　吹っ飛べー！！
敵男神族	なっ！　ぎゃあああ！？
主人公	たとえ正面からの突撃でも、相手の隊列を食い破る事は可能と判断した。
敵女魔族	こ、このよくも！
敵女神族	しずめえええ！
姫	リンセ、頭を下げろ！
リンセ	はいっ！
敵女戦士二人	きゃあっ！
主人公	フォンとリンセの放った力任せな一撃に、突撃してきた四人のうち、二人が吹き飛ぶ。
主人公	そこに敵パーティーの二人が剣を振り下ろしてくるが、リンセが少し頭を下げただけで互いの武器同士をぶつけてしまい、悲鳴が上がる。
フォン	未熟がすぎますね
リンセ	鍛錬が足りませんよ！
主人公	互いの得物がぶつかるという想定外の衝撃に動きが止まった二人を、リンセとフォンが蹴り上げ、二人はそれこそ蹴鞠か何かのように空中を舞った。
姫	フォン、六時に斬撃！
フォン	ふっ！
敵男魔族	ぐぎゃっ！　な、なんで！？
姫	リンセ、四時に攻撃魔法
リンセ	お父さまの怒りを喰らいなさい！
敵男神族	う、うそだ――ぎゃあ！？
主人公	俺の指示に寸分違わぬ行動を返してくれる二人のおかげで、数の不利はあっという間に覆る。
敵パーティーリーダー	な、なんだよこれ！　どうしてこっちの動きが全部、読まれるんだよ！
姫	フォン、五時に遠距離、その後正面からの攻撃防御。リンセ脚部強化魔法発動、二時方向に跳んで斬撃
敵パーティー	ぐっ、ああああ！
フォン	やっぱり姫先輩と組むと戦いが楽すぎていけませんね。何も考えず指示に従ってるだけで勝てちゃうので、思考停止をしそうになります
リンセ	す、凄い、お父さまの指示通りに身体を動かすだけで、相手を圧倒できる……
姫	変更ＦＢ５、フォン十時の敵にダブルハーケン！　リンセそのまま二時に突撃、敵を押し出せ！
フォン	ダブルハーケン！
敵男神族	うわっ、うわあああ！
リンセ	出力最大！　せいやああ！
敵女魔族	ちょっと、やめ――ああああっ！
姫	変更、ＦＡ３！　リンセ結界発動、フォン拘束魔法発動
白鷺パーティー	了解！
主人公	リンセとフォンに徹底的に引っかき回され、結局敵パーティーの一人として俺の剣を振らせる事もできず、そのまま一人を除いて全員が、魔法により壁に拘束された。
敵パーティーリーダー	くそがっ！
姫	これで終わらせる
敵パーティーリーダー	はっ、人族風情が正面からくるか、馬鹿が！　てめえを倒せばそれで終わりだ！
主人公	敵の殆どを拘束した結果がら空きになった中央を駆けて、通路の入り口にいた敵パーティーのリーダーへと迫る。
主人公	相手が言うように、リーダーである俺がやられれば、それでそのパーティーは脱落となるが、当然それは相手にも言える事だ。
敵パーティーリーダー	はっ、あれが戦力の全てだとおも――
姫	無駄だ、全部見えてる
伏兵Ａ	あ、きゃんっ！
伏兵Ｂ	まじ……かよ！？
主人公	距離を詰める最中にすぐ横の影から躍り出てきた影を、剣を一閃して吹き飛ばし、すぐさま反対側から飛び出してきた影の腹に蹴りを入れる。
主人公	恐らくこの二人がパーティー全体に幻術をかけて、気配を消していた張本人だろう。
敵パーティーリーダー	は？
姫	隊長はその部隊の中心だ。どんなに数が多くても隊長の行動を読み切れば簡単に部隊の行動方針は割れる、君はちょっとわかりやすすぎだな
敵パーティーリーダー	くっ、黙れえええ！
主人公	俺の言葉にやけくそ気味に振られた剣を、俺の剣が横から正確に捉え、その力の方向をずらす。
主人公	剣は俺の横を通り過ぎ、空振り。そのままバランスを崩し無防備になった相手に、俺は剣を振り下ろした。
敵パーティーリーダー	ひっ、ぎゃああああ！
主人公	男の悲鳴が周囲に響き、やがて収まる。どうやら気絶してしまったらしい。
姫	敵パーティーのリーダーを撃破。リンセ、フォン、周辺警戒
リンセ	はい、問題ありません
フォン	オールクリアです
姫	戦闘終了、お疲れ二人とも
主人公	そう言って手を上げると、二人はその両手にそれぞれハイタッチを返してくれた。
フォン	それにしても、あっけなかったですね。一階級とはいえ、数をそろえて計画的に姫先輩を潰しに来たあたり、もうちょっと出来ると思ったんですが
リンセ	ま、今日までの学園生活で、いまだお父さまの実力を信じられないような、見る目の腐った奴が集めた仲間です。きっとこんなもんですよ
フォン	それもそうですね
姫	二人とも手厳しいな。確かにまだ色々詰めが甘かったおかげで圧倒は出来たけど、もうちょっと鍛錬を積んでたらもっと苦戦したと思うぞ
姫	特にこっちが気づいてない段階で、奇襲を受けたら危なかった
主人公	もっともその場合、奇襲をしようと動き始めた段階で気づいただろうけれど。
リンセ	お父さまを馬鹿にするような奴が、今後そのレベルまで鍛錬を続けられるとは思いませんけどね
主人公	手を振りながらしれっと言って、倒れている敵パーティーのリーダーへとリンセが視線を移す。
リンセ	えと、そういえばこの人、ちゃんと生きてますか？　結構ばっさりいったように見えたんですけど
姫	ああ、それなら問題無いよ
姫	一定以上のダメージを受けると、支給されてる指輪型のアイテムが壊れて失格扱いになるんだけど、その時指輪に込められた回復魔法が発動するからな
フォン	即死するか修復不可能なほどのダメージを受けない限りは、余程の事がないかぎり大丈夫ですよ。すぐに救護班が回収しにきますしね
リンセ	へえ～
主人公	倒れた男の身体をつんつんと突っつきながら頷くリンセに苦笑しながら、俺は改めて周囲を見渡す。
姫	それじゃあ、そろそろ行こうか。今の騒ぎを聞きつけて誰か別のパーティーが来ても困るしな
フォン	ですね、さっさと離れるのが得策かと
リンセ	ゴールまであと少し、ここまできたら絶対上位にはいりましょうね、お父さま
姫	ああ、もちろん――
襲撃者	けれど、そうは問屋がおろさないよっと
姫	！？
主人公	早く進もうと思い立ったその直後、突如聞き慣れた声が周囲の壁から響き、俺達は再び剣を構えた。
