主人公	リンセは、一人で広場のベンチに座っていた。
主人公	もう何時間になるだろう。いつしか日は落ち、夜となった。人通りもほぼ無くなり、静かな水音だけが響く。
主人公	そんな場所で、リンセは一人座っていた。
主人公	考えたいことがあった。どうにかして否定したいことがあった。
リンセ	昨日の、あの甲冑……
主人公	けれど、どれだけ考えても否定が出来ない。肯定する材料ばかりが出てきてしまう。
主人公	あの時、あのトドメの一撃を放った瞬間、甲冑騎士と同時に、確かに彼女もダメージを受けていた。
主人公	だからこそ、彼女は最後にあんな……けれどなぜ……。そうなる理由なんて、一つしか……。
リンセ	やっぱり、そういうことなんですか？
主人公	夜空への問いかけに対する返答は、もちろんない。
リンセ	なぜ……なんて聞くだけ野暮ですよねえ。だってそんなの、私のために決まってますし
リンセ	これで覆せる、覆してみせるって、そう思ってたんだけど……まだまだ未熟ですねえ、私
リンセ	つくづく思い知らされます。ほんと、お父さまって凄いなあ……普通、覆すなんて不可能ですよ、こんなの
主人公	夜空を見上げながら、力なく笑う。今の自分の力不足が痛かった。戦うための力でなく、手に入れるための力が、覆すための力が足りない。
リンセ	だけど、やらなきゃ。一人でなんてやらせない、一人になんてしない。私も、やらなきゃ
主人公	考える。今の自分に出来ること。今の自分がやるべきこと。それがないか。何か思いつかないか。
リンセ	私でなくてもいいんです。私はバカだから、分からない。でも、私に教えてくれる人……、考えてくれる人がいれば……
主人公	脳裏に浮かんだのは、二人だった。とりあえず、話そう。リンセは確かな覚悟と共に、決めた。
主人公	結果は覆らない。何もしなければ、絶対に覆らない。だから、やる。
