皇女	あは……な、なんだか変な感じだね……まさか姫にぃとこんな……
主人公	同時に、全身を包む快感を堪えきれないのか、ただ激しく喘ぎ続ける。その嬌声に刺激され、俺は更に腰の動きを強めていった。
皇女	や、あ、ああ！　こ、こんなの知らない、よお！　やだ、だめ、む、無理！
主人公	こつ、こつ、と奥の壁へとあたる度、皇女の嬌声が高くなる。下半身から湧き上がる快感に身を任せ、皇女は絶頂へと突き進んでいた。
姫	俺も、もう！　皇女！　だ、出す、ぞ……
主人公	そして俺も、もう何も考えられない。ただ皇女の中で解き放ちたい。達して、皇女を俺の欲望で汚したい。そんなことしか思い浮かばない。
皇女	は、はい、どうぞ！　な、中で！
皇女	あ、や、あぐ、んあ、あ、あ、ああっ、すごい……い、いいよ……あたし、もう！
主人公	俺を求める皇女の言葉を受けて、俺は一番奥まで腰を突き出す。同時に皇女の秘洞がぎゅう、っと締まり、その刺激を耐えることもできず、俺は自分を爆発させた。
姫	う、ああああっ！！
主人公	自分の先端から、熱いものが一気に皇女へと流れ込んでいく。
皇女	ふああああああああぁぁぁぁっ！！
主人公	そして、同時に皇女も達する。背中を大きく弓なりに反らし、嬌声と共に全身を痙攣させていた。
主人公	それと共に、結合部の上にある小さな穴から、温かな液体が噴き出す。皇女の中から流れるそれは、俺の身体を濡らし、シーツまでも汚していった。
皇女	お、お兄ちゃんのが、な、中に……あ……い、いっぱい……
主人公	けれど、自分がそんなことをしてしまっている、という自覚がないのか、分からないほどに感じてしまっているのか、皇女は体内に放たれる俺を、ただ呆然と感じ続けている。
姫	み、皇女？　う、く……あの、な、お前今……
皇女	え……？
主人公	俺に声をかけられ、皇女はぼんやりと俺を見る。
主人公	そして、今自分がしてしまっている粗相に気がついた。
皇女	あ、あの……これは、だから……
主人公	耳まで真っ赤に染めながら、泣きそうな顔で俺を見る皇女。
皇女	やぁ……力、はいらなくて……と、とめらんない、よぉ……
主人公	イってしまった反動か、全身に力が入らず、どうにも止められないらしい。温かいその液体が、皇女から俺へと浴びせられ続けている。
皇女	な、なんで姫にぃにはこんなのばっかり見られちゃうの……
皇女	お、お願い、見ないでください……
主人公	これ以上ないほどの羞恥の表情。けれど、目で見るのをやめたとしても、その温かさとか音とかは消せないわけで……。
姫	その、見ないのはいいんだけど……温かいのがかけられ続けてて……
皇女	あたし、緩くなんてないよ……ほ、本当に今が特別で……
皇女	姫にぃが、あんなに突くからあっ
主人公	なんていうか、必死な皇女が本当に可愛いと思えてしまった……。
皇女	その……申し訳ありません……すべて台無しにしまして……
主人公	それから少しして、ようやく出し切ったのか、粗相はどうにか止まってくれた。皇女は俺と目を合わせないように、その視線を逸らしている。
主人公	ま、まあ、それも仕方ないか。
姫	ま、まあ、気持ち良かったってことでいいんじゃないかなあ……
姫	その……そういうことやっちゃった子、他にもいるし……
皇女	うう……あたしの初体験がぁ……
主人公	どうにかフォローしようと奮闘する俺の言葉が聞こえているのかいないのか、皇女はただ羞恥に埋もれてしまっていた……。
主人公	……決して忘れない初体験、ということでどうにか……。
