主人公	それから間もなく、俺達は目的地であった広場へと辿り着いた。
主人公	広場とはいえ、公園のように芝生や遊具みたいなものがあるわけじゃない。都の中央、様々な建物の集まったその中心にある開けた区画だ。
主人公	女神の神殿や劇場なんかもあるため、休日なんかは本当に多くの人達が訪れる。そして、そういった人達目当ての出店なんかも多数ある、というわけだ。
フロウラ	結構色々なお店が出てるんですね。とてもいい匂いがします
主人公	早速、周囲に広がる串焼きの香りに、買い食い初挑戦の王女様が釣り上げられたようだ。
主人公	まあ、いくら庶民派王女といえども、普通はこんなとこ気軽に歩けないだろうし、そもそも屋台の食べ物なんて、食べさせてもらえるわけがないからな。毒味もしてないのに。
主人公	だがまあ、今ここには俺がいて、しかも目の前には神殿……ということはあれも目の前にいるわけだ。王城内よりもある意味安全だ。
悠樹	というわけだから、さあ、今夜の体重を気にするほどに食べていただこうかっ
フロウラ	え、あ、あの、体重増えちゃうのはさすがに困っちゃうんですけれど……
リム	そうですね……そんな重いものを二つもぶら下げているのが悪いんですよね。食べた分だけそれを取り外してしまうのはいかがでしょうか
フロウラ	あ、あの、リム？　笑顔怖いです……
トロン	それを取り外すなんてとんでもない！　夢と希望は大事に育てるものだよ！
ルビィ	トロンさん、君今すっごく不敬罪ですよ
トロン	分かってるさ……もちろん分かってるとも！　だけど男には、あえて戦わねばならない時があるんだよ！！　ですよねフロウラ様！！
フロウラ	え？　あ、は、はい……？
ルビィ	戦いっていうか、むしろ自殺じゃないですかねえ、これ
悠樹	その恐れを知らない無謀……嫌いじゃないぜ、トロン
リム	うう……ユウキさんまでこんな真剣な顔……やっぱりおっきいって特別なんですね
主人公	リムよ……ちっぱいもいいものだ。それは間違いない。だが、それはそれこれはこれ！　おっきいのもまた素晴らしいのだ！
主人公	その神々しさを俺が力説しようとした、その時だった。
女性	ユーウーーーーーーーーーー！！
悠樹	え？
主人公	なんだろう。どこかから聞こえてきたその声に、俺の背中を冷たい何かが通り抜ける。
主人公	コレハマズイ。魔王退治の旅で鍛えられたはずの俺の生存本能そのものを刺激するほどの危険が、今確かに迫っている！！
主人公	ここは間違いなく逃げの一手だ。命をだいじに！　ガンガンいっちゃだめー！！
悠樹	わふぅ
主人公	温かく肉厚な弾力に富んだ固まりが、俺の顔を完全に包み込んでいた。
主人公	なんだろう、この、母なる胎内に帰るかのような安らぎと心地よさは……。
悠樹	って、この胸の大きさと感触はフラン姉！！
主人公	俺の指摘に、母なる感触が離れ、目の前に一人の女性が立っていた。ああ……気持ちよかったなあ。
フラン	うふふふふー。ひっさしぶりのユウの感触。あー、やっぱユウはこうじゃなきゃダメよねー。あたしの癒しよねー
悠樹	いや、だからだなあ、もっと周囲の目を考えろと。それさえ考えていただければ最高ですのでさあばっちこーい！！
フラン	おっしゃぁ、まかせとけー♪
悠樹	おふぅ……ここは天国じゃぁ……
主人公	ああ、再びの感触。あったかいなー、やわらかいなー、いい匂いだなー、気持ちいいなー。
ルビィ	ね、ねえ、トロンくん？　あ、あたしの記憶間違ってなければなんですけど……
トロン	うん……僕の記憶も間違ってなければなんだけれど……
ルビィ	フランさま、ですよねぇ……
トロン	フラン様、だよねえ。あの、勇者パーティーの一人。聖女フラン様……
フロウラ	ふふ。ユウキさまとフランさま、やっぱり仲いいですね
リム	その……ま、まあそうですよね。仲いいんですよね、この二人……
リム	ですがその、そろそろですね、注目も浴びてきてしまっているので、離れてみたらどうかな、なんて思うんですが、お二人とも……
主人公	ちょっとこまったようなリムの声。この天国から脱出するというのは中々に辛いものがあるが、まあ仕方ない。
主人公	俺達はようやく分離して別個の生物となって。
フラン	ごめんね、リムちゃん。だってぇ、人目のないとこだと、ユウ、もっと恥ずかしいこと迫ってきそうなんだもん
悠樹	ああうん、それ俺の台詞な。フラン姉、本気で襲ってくるだろ。飢えた狼みたいに、飢えた狼みたいに！
フラン	なんだかすっごい勘違いされてる気がするんだけど、あたし、ちゃんと乙女よ。神様にお仕えしてるんだから
主人公	やっべ、嘘だっ、って言ってやりたいけど、言ったら多分俺の命無いな。
フラン	うわぁ、すごい、嘘だっ！　って言いたそうな顔してるわね。一歩でも踏み込んだら殺すけど
悠樹	本当に期待を外さないな、フラン姉は……
主人公	フラン＝ラシム。この王都における女神神殿の司祭を務める女性だ。見目麗しく穏やかですべてを包み込む慈愛溢れる、まさに女神に仕えるために生まれてきた人。
主人公	なんて言われてるらしいが……まあ、あくまで言われてるだけだな。
主人公	俺やハイレンと一緒に勇者パーティーの一員として戦った人で、その回復と補助魔法の実力は紛れもなく世界一。あとメイスによる殲滅力も。
主人公	こっちがボロボロで血まみれになってるのを放置して、女神さまのお慈悲をくらいやがれえ！　なんて叫びながらメイス振り回す姿はマジ夢に出て来そうだった。
主人公	とはいえ、この世界に召喚されたばかりの俺に、魔法を一から教えてくれた師匠でもあり、その面倒見の良さから、俺の姉貴分でもある人で、俺は未だに頭が上がらない。
ルビィ	あ、あの！　フランさま、ですよね？　聖女の……
主人公	そんな俺達の会話の中に、恐る恐るルビィが声をかけてくる。なんだろう、この恐れ多いオーラは。
フラン	えっと、その制服着て一緒にいるってことは、ユウのお友だち？　ふふ、聖女っていうのはちょっと言い過ぎな気もするけれど、多分合ってるはずよ
フラン	フラン＝ラシム。よろしくね
ルビィ	うわぁ……ふ、フランさまと話してしまいました！
トロン	凄い……聖女ってやっぱり実在したんだなあ……
悠樹	……………………なあ、フラン姉。聖女って誰だ？
フラン	もちろん♪
悠樹	………………………………………っ！！！！！！！！！！！
リム	あの、ユウキさん……その、お気持ちは分かるんですが、そこをなんとか呑み込んで下さい
フロウラ	じ、実際フランさまは凄いんですよっ。女神さまを信仰する皆さんの信頼も高く、多くの病人やケガ人を救っていますしっ
悠樹	……わ、わかった……思わず心臓止まるかと思ったけど、分かった……ことにできるようなんとか努力をしてみる所存にて……
主人公	ま、まあ、俺だって『大賢者』とかいう似合わない二つ名もらっちゃってるしな……。
主人公	この殺戮破壊司祭姉だって、似合わない二つ名の一つや二つくらい……。
フラン	その、ありえないんだけどでもだけどだってー！！　な感じの苦虫かみ殺したようなユウの顔、やっぱりいいわぁ。何度でも見たくなっちゃう♪
悠樹	それで、誰が聖女だって……？
フロウラ	ああ……やっぱり無理でしたか……
リム	姫さまも、最近は結構言っちゃいますよねぇ……
ルビィ	フランさまって、こんなに砕けた方だったんだ……全然偉ぶってなくて素敵だなぁ……
トロン	ユッキ、フラン様の胸に顔埋めるとか羨ましすぎ！　爆ぜろ！
悠樹	なあ、この方達の目って腐ってるのか？　さっきからの俺とのやり取り見て、なんでこんなに目が輝くの？
リム	それはまあ、紛れもない英雄の一角を担う方ですから
フロウラ	実際、魔王が倒されたことによって、この世界の人々はようやく希望を手に入れたんです
フロウラ	魔王を倒した方々の功績というのは、ユウキさまが思っている以上に大きいんですよ
フロウラ	もちろん、四人目にしてパーティーの頭脳、『大賢者さま』も同様ですね
主人公	わざとらしく、大賢者、を強調して俺に言うフロウラ。とはいえ、その名前はもう捨てたしな。
主人公	でもまあ、英雄か……。
フラン	ユウ、せっかくだし、ちょっと神殿の方も寄っていきなさいよ。丁度ね、会わせたい子もいるから
主人公	過去の記憶に埋もれそうになる俺を、フラン姉の声が引き戻す。
悠樹	それは当然美少女なんだろうな……
フラン	ええ、そうよ。それもとびっきり。まあ、この王都でもあのクラスの美少女なんてそういないわねえ
悠樹	いやあ、丁度歩き疲れたんだよねー。よーしいくぞみんなー！
主人公	フラン姉がそこまで言うほどの美少女ならば会わない理由などないであろう。俺は、みんなの返事を待つこともなく、真っ直ぐ神殿へと足を向けた。
ニケ	お、ユーキではないか。久しぶりじゃのーっ
主人公	そして、その場で固まった。
悠樹	ニケ、お前こんなところで何やってんだ！？
ニケ	敬虔な吸血姫としてな、女神にお祈りなのじゃ
ニケ	でも、ユーキの方こそどうしたのじゃ？　女神に祈るようなキャラではなかったはずなのじゃ
ニケ	さては、フランに無理やり捕まったのじゃな
悠樹	ニケ……なんという、王道のじゃーキャラ……
主人公	目の前にいるのは、ニケ＝コープ。なるほど、フラン姉が言うのも納得の美少女だ。しかもロリ巨乳属性を標準装備とかマジヒロイン。
主人公	まあ、その口調から想像した人もいるかもしれないが、まさしく長寿系ロリババア。いわゆる、吸血鬼一族の姫だ。
主人公	山奥でひっそり暮らしていた一族だったが、魔王の軍勢によって襲われ、ニケ以外の王族は皆死亡。ニケ自体も危なかったが、俺達がギリギリ間に合った。
主人公	それ以降は、パーティーの一員というわけじゃないが、様々な形で協力してくれた、紛れもない仲間だ。
主人公	もっとも、魔王を倒した今、山奥の城で生き残った一族の者と静かに暮らしているはずなんだが……。
ニケ	まあ、ちょっとした社会勉強じゃな。あの一件で、姫たち一族がいかに世間から取り残されているのかを知ってしまったのじゃ
ニケ	なので、今の世界がどうなっているのか、人間族というものがどのような生き方をしているのか、この目、この身で確かめようと思って出て来てみたのじゃが……
フラン	ほら、ニケちゃん、こっちに知り合いなんて全然いないでしょ。しかも街のことなんて知ってるわけもない
悠樹	それで、フラン姉にヘルプを頼みにきたわけか
ニケ	さすがはユーキ、大正解なのじゃ！
フラン	まあ、住む所の手配とか色々はもうすんでるから、ユウも色々と面倒見てあげなさい。妹みたいなもんだし
ニケ	いやいや、待つがよいフランよ。姫はこう見えても三百歳を越える大人じゃ。むしろユーキの姉……
フラン	この子がお姉ちゃんに見える人ー
主人公	壊滅でした。
ニケ	うううう……お姉ちゃんなのに、お姉ちゃんなのに……
主人公	ガックリと膝をつき涙するニケ。いやいや、お前の場合はむしろ妹属性全開の勝ち組だから安心しろ。
フロウラ	話には伺ってましたが、こちらがニケさまなんですね
リム	うわぁ……さすがというべきなんでしょうか、聞いていた以上に可愛い方ですよねえ
ニケ	聞いていた！？　それはつまり、ユーキが姫のことを言っていたということじゃな！？　いったいなんと！？
主人公	たった今までへこたれていたとは思えない速度で蘇ったニケは、そのままリムへと詰め寄った。
リム	え？　あ、はい……その……メチャクチャ可愛いロリババアが更に巨乳で属性上乗せ、と……
ニケ	……………………ユーキ
悠樹	リムくん。君はもう少し社交辞令というものを覚えた方がいいのではないかな！
主人公	眩い笑顔の口元から覗く鋭い牙が、その輝きを増したように見えた……。
フラン	一応言っておくけど、これはあたしのせいじゃないから
ルビィ	ねえ、トロンくん
トロン	うん。僕も多分、全く同じことを思ってると思うよ
ルビィ	ユーキさんって、なんなんでしょうねー
トロン	いやあ、射程範囲広いよねえ
