悠樹	ん……
主人公	愛用の腕時計がアラームを鳴らしている。
主人公	召喚時、身につけていたおかげで異世界から持ち込むことのできた数少ない品だ。ソーラー電池式だったおかげで、三年経った今でもなんの問題もなく使えている。
主人公	目覚まし時計、なんてものは当り前で存在しないこの世界。朝の五分を黒胡椒と引き換えにしてでも欲しい俺としては、マジ助かっている。
主人公	今日は入学式だ。俺自身が関係しているわけじゃあないが、遅刻はまずい。頑張って起きるとしよう……。
主人公	と目を開いたら、フロウラさんのロイヤルスマイル。
悠樹	………………………おはよう
フロウラ	はい、お早うございます♪
悠樹	えーと、ここで何をしてらっしゃる？
フロウラ	ユウキさまの寝顔を堪能していました。何か、朝の準備でお手伝いできることがあればと
主人公	朝起きたらこの守りたくなるような最高の笑顔。これはいい。むしろ素晴らしい。ほんと、最高の目覚めを演出してくれる。
主人公	ただ問題は……。
悠樹	ちゃんとさ、施錠してたと思うんだけど、俺……
フロウラ	はい。ですので、先日フランさまから習った、ぴっきんぐ、という技術で
悠樹	お前ほんとに王女か！！
フロウラ	今は、ユウキさまの所有物です
主人公	本当にもう……まったくもってもうだぞ、この王女はっ。
主人公	こっちがどれだけ必死に自分を抑えてると思ってる。こんな欠点０の美少女相手だぞ、本当に辛いんだからな。
主人公	これが本気で俺への好意、というならマジ遠慮しないんだが……フロウラのこれはむしろ謝罪だからな。さすがにそれを理由には抱けません。
主人公	リムすらもとりあえずは自重してくれたのになあ。
悠樹	とりあえず、手伝いは大丈夫だから、フロウラも部屋に戻って支度しなさい
フロウラ	あの、私でしたら大丈夫ですよ。素直に言っていただければ
悠樹	素直って、何を言えと？
フロウラ	その……男性は朝が辛い、とお兄さまが……
主人公	恥じらうように顔を赤らめ、その視線をずらすフロウラ。それが行き着く先は、まさか、と思ったもののやっぱりお約束で……。
悠樹	うん。今日もマイサンはすこぶる元気でいらっしゃる
フロウラ	鎮めるために、きっと私の手が必要だ、と教えてもらったのですけれど……お、お使いになります、か……？
悠樹	とりあえず、ハイレンのバカを後で張り倒すことだけは確定した……
悠樹	お使いになりませんので、どうぞお部屋にお戻り下さい
フロウラ	あの、本当に遠慮は必要ありませんよ……？
悠樹	いえ、本当に間に合ってますので
主人公	俺は半ば強引に、フロウラを部屋から追い出すのに成功した。
主人公	日本にいた頃には、こんな展開あり得るわけがない、なんて作者をこき下ろしてたもんだが……いやあ、まさか自分に本当に訪れるとは。
悠樹	くそ、本当にハイレンの奴。妹に何を教えてやがる。よりにもよって、フロウラの手と口でだなんて……
主人公	……………………ちょっと勿体なかったかも、なんて思ってないやい。
主人公	とりあえず、今日は一人で通学することにしよう。なんていうか、色々怖いです。俺の周囲の女の子。
主人公	据え膳食わぬは、なんて言うけども、そこに恥じらいって必要だよな、やっぱり。いや、恥じらってはいるんだけれど、覚悟決めすぎ？
悠樹	うーむ。俺って実は、かなりなへたれ化してるんだろうか……
主人公	だとしたらかなりショックである。
