主人公	そんなことがあった翌朝。俺はトロンに呼び止められた。
トロン	ユッキ、お客さんだよ
悠樹	俺にか？　スキャナやニケじゃなく？
トロン	うん。なんていうかさ、嫉妬する気も起きなくなるよね、ユッキには
悠樹	おい、その言葉で一気に出たくなくなったんだが……
主人公	俺は恐る恐る廊下の方へと視線を送る。そこに立っているのは、一人の女性。
主人公	あの人は確か……俺は仕方ない、とばかりに足を向けた。
女性	お呼びだてしてすみません。どうしても聞いておきたいことがあったもので
主人公	そこにいたのは、以前一度だけ見かけたことのある人だった。そう、アイカ先輩と一緒にいた人だ。
主人公	確か、マイネ先輩、だったか。五大貴族だったよなあ……。
女性	マイネ＝フォン＝ダムスと申します。よろしくお願いしますね
悠樹	えーっと、五大貴族家、ダムス家の方……でいいんですよね
マイネ	あ、はい。一応はその、五大貴族の一角を任されています
主人公	これで四つ目か。まさかここまで五大貴族に関わることになろうとは……遭遇率高過ぎないか。
主人公	正直、これ以上権力者と関わる気なんてこれっぽっちもないんだけどなあ。
マイネ	そこまで緊張しないで下さい。私は確かにダムス家の娘ですが、ここではただの一学生にすぎませんので
主人公	そう言いながら見せてくれた笑顔は、気さくで優しいただの先輩のものだった。
主人公	なるほど、この人はアイカ先輩同様まともな側か。バカサイドの印象が強すぎたせいで警戒してたが、ちょっと安心した。
マイネ	それに、ユウキさん。あなたはあのスキャナ様やフロウラ姫とも親交があるのですよね。お二人と比べれば、私なんてご近所付き合いのようなものですよ
主人公	小さな笑みを浮かべたままで言うマイネ先輩。まあ、そう言われてみるとその通りなんですけどね。
主人公	まあ、あの二人と違ってバカ貴族は本当にやらかすから困るんだよな。
悠樹	分かりました。それで、どういったご用でしょう？
マイネ	その……あなたが昨日、アイカと一緒に街の外に向かった、という話を聞きまして
マイネ	恐らくは泉に行ったのだろうと思うのですが、その時のアイカの様子を教えていただけないかと
主人公	その様子からするに、この先輩はアイカ先輩のことを本気で心配しているようだ。バカ貴族の件、お兄さんの件、どちらも知っているってことか？
主人公	……少なくとも、この人に教える分には問題ないか。俺は昨日のことを話すことにした。
マイネ	そうですか……やはり、まだ吹っ切れていないんですね……
主人公	寂しげに呟くマイネ先輩。その様子に、俺はこれ以上踏み込むべきかわずかに悩むものの、あえて踏み込むことにする。
悠樹	すみません。それは、アイカ先輩のお兄さんのこと、ですか？
マイネ	知っているのですか？
悠樹	ええまあ……スキャナからその、少しだけ話を聞いていたので
主人公	ランザ部隊長については、そこまで有名というわけでもない。それをただの一般人である俺が知っている、というのは少し無理があるだろう。
主人公	ここは知名度抜群、スキャナ様の名前を利用させてもらおう。
マイネ	なるほど。少なからず、スキャナ様に覚えていただけるだけのことを為したのですね、ランザ様は……
悠樹	ええ。本当に感謝をしていましたよ……
マイネ	にしても、ラード……脅迫とは随分とやってくれますね……
悠樹	マイネ先輩の方でなんとかできないんですか？　同じ五大貴族であれば無視もできないでしょうし
マイネ	……脅迫そのものに関しては、もちろんどうとでもできます。こんなことを言い広められれば、公爵家としての名が地に落ちますから
マイネ	ですが、それはあの子の……ランザ様の夢を潰すことになります。それをしてしまって本当にいいのか……
悠樹	ああ、確かに。アイカ先輩がそれを望んでいるのだとすれば、それは俺達が口を挟んでいいことじゃないですね……
主人公	アイカ先輩自身に出来る手が他にあるというならまだしも……それがないから、アイカ先輩はあんな風に悩んでるんだろうしな。
主人公	ランザ部隊長の夢を、どうやったら叶えられるのか。
マイネ	ええ。アイカが、自分を引き換えにしてでも叶えたいというのであれば、それを私が潰すわけにはいきません
マイネ	……本音を言えば、あんな男に捧げるくらいなら諦めてしまいなさい、と言いたいところなのですが……
悠樹	ああ、それは同意ですね
マイネ	ですが、それを呑み込んででもなんとか叶えて差し上げたい。そう思わせる方でした……ランザ様は……
主人公	その名前を呟く時のマイネ先輩の表情から、ああ、この人はランザ部隊長のことを見てくれていたんだ、と思った。
マイネ	なにはともあれ、お時間を取らせて申し訳ありません
マイネ	……無理かもしれませんが、アイカとはもう少し話してみたいと思いますので
主人公	マイネ先輩はそう言うと、背中を向けて去って行った。
主人公	少しお堅いイメージはあるんだけれど、いい人なのは間違いないな、マイネ先輩。
主人公	アイカ先輩もマイネ先輩も、みんなに好かれるだけのことはある。五大貴族の良心ってところか……。
