主人公	翌日の放課後、呼び出しを受けた俺は食堂へとやってくると、その姿を探す。お、発見。
悠樹	アイカ先輩、マイネ先輩、お疲れさまです
主人公	俺の呼びかけに、二人の先輩が顔を向けてくれた。
主人公	この前の俺の感想を受け入れてくれたのか、マイネ先輩は、あれからメガネを外すようになった。
主人公	うん、やっぱりこの方が可愛いくてよいな。
アイカ	ユウキさんも、お疲れさまですわ
マイネ	すみません。お時間を取らせてしまって
悠樹	いえいえ、これがハイレンと二人きり、とかなら全力で逃げますが、お二人と一緒だというならむしろ役得です
アイカ	ふふ。相変わらず女性を喜ばせるのがお上手ですわね
マイネ	もう少しその言葉の希少価値を高めていただければ、私もその気になってしまいそうですね
主人公	クスクスと笑う二人に、俺も笑顔を返しながら、前へと座る。
悠樹	それで、俺に用っていうのは？
アイカ	はい。実はハイレンさまから、学院の新しい行事についてまとめてほしいと頼まれましたの
マイネ	ハイレン殿下が仰るには、ユウキ様の世界の行事なので、ユウキ様と話して決めてほしい、と
悠樹	……あの野郎。一番ノリ気だったくせに、めんどくさいところを生徒に投げつけやがったな
主人公	今度フラン姉をけしかけてやろう。俺らが背負うのと同等のめんどくささをお前も背負え。
マイネ	それで、まずはどのような行事がよいのか、ということなのですけれど
アイカ	まずは、どういうものがいいのか方向性を決めまして、それに合う行事を、ユウキさんの知識の中からいただければと思ってますの
悠樹	そうですね。適当に行事の名前を並べても、あまり意味なさそうですし
悠樹	差し当たっては、生徒達がまだ馴染み切れてないだろうというのを前提に、でしょうか
マイネ	そうですね。ですから、チームを組んで、というのは厳しいかと思います。あぶれる生徒が出てしまう可能性がありますから……
アイカ	引っ込み思案な生徒は、自分から相手を探すのは難しいでしょうし……友人を作るキッカケが必要ですわね
悠樹	無理にチームやコンビを作らせようとすると、逆に孤立する生徒を作りかねないですね
主人公	自由に二人組を作れー、とか、あれなんて教師による公開イジメ！？　と俺も何度も思ったもんだ。まあ、俺は幸いにもボッチになることはなかったが。
マイネ	それに、最初から大騒ぎになりそうなものを企画しても、ハメを外しすぎてしまいそうな気がします
アイカ	そうなると、生徒の皆さんに騒いで楽しんでいただくのは、その後の体育祭としまして、今回は多少大人し目のものがよさそうですわね
アイカ	学院は学ぶ場所である、ということは覚えていただきたいですし、真面目な雰囲気のものが良さそうですわ
マイネ	その上で、個人という単位で競い合わせる、というのはいかがでしょう
悠樹	そうですねえ……コンセプトとしては間違ってないと思うので……そうなると、大人し目で真面目で個人単位の競争……あったかなあ、そんな行事……
主人公	正直、日本の学校行事なんて、余程心に残るようなものじゃなきゃ、あんま覚えてないんだよな。
主人公	そこまで色々あったわけでもないし……いや待てよ？
悠樹	うん、今回の行事は『弁論大会』でいきましょう
主人公	そんな俺の言葉を、二人の美貌の先輩は、首を傾げながら聞いていた。
