悠樹	ふう……やっぱり露天風呂はいいなあ。一日頑張ったご褒美サイコー
悠樹	これでコーヒー牛乳とかあれば完璧なんだが……いや待てよ。これこそルビィに教えてみるべきでは……いや、砂糖が高いから高級品になっちゃいそうだしなあ
主人公	風呂上がりに火照った身体を冷ますように、窓の外を眺めながら一息をつく。
主人公	やっぱりね、一日の終わりは湯船に入らんと疲れ抜けません。
主人公	旅の時には風呂なんかほんと入れなかったしな。川とかで身体拭いたり、小さな村でタライにお湯もらったり。
主人公	……ちょこっとスキャナの胸とかフラン姉の胸とか覗いちゃったのはナイショだ。離れたところで身体拭くくらいしかできなかったしね。
悠樹	うし。明日に備えてもう寝るかね
主人公	軽い背伸びをして戻ろうとした瞬間、何か白いものが視界の端に映った気がした。
悠樹	ん？
主人公	それが妙に気になった俺は、窓から外を見回してみる。なんだろう、何やら白っぽいものが動いているような……って、まさか。
主人公	俺は玄関の方へと足を向けていた。
フロウラ	はあ……はあ……はあ……
主人公	外に出ると、丁度フロウラが走るのを止め、息を落ち着かせているところだった。
主人公	王女にして神託の巫女として、運動なんてほとんどしたことのないフロウラ。体力だってそれほどあるわけもなく、結構苦しそうだ。
悠樹	大丈夫か、フロウラ
フロウラ	え……あ、はぁ……ユウキ……はぁ……さま……
悠樹	ああ、無理して話さないでいい。とりあえず休んでくれ
フロウラ	は、はい……はぁ……すみま、せん……はぁ……
主人公	フロウラは本当に苦しそうに、寮の壁に身体を寄りかからせる。空を仰ぎながら、懸命に空気を求めていた。
主人公	俺の差し出した水を受け取ると、ゆっくりと飲んでいく。
主人公	それから数分、ようやく落ち着いてきたのか、フロウラは俺に笑顔を向けてくれた。
フロウラ	すみません、お水、ありがとうございます
悠樹	いや、俺の方から来たんだし気にしないでくれ
悠樹	にしても、夜のマラソンとか、フロウラ、そんなのやってたっけか？
主人公	窓から見えたのは、一生懸命に寮の前を走り続けているフロウラの姿だった。
主人公	少なくとも、体重がどうこう気にするようなスタイルじゃないよな。まあ、これでも女の子は気にしちゃうのかもしれないけど。
主人公	俺の質問に、フロウラは恥ずかしそうに首を左右に振った。
フロウラ	いえ、恥ずかしながら今日からなんです。少しでも、体育祭で頑張りたいな、って
悠樹	あー、ひょっとして、あの賭けのため、か？
フロウラ	えっと、それだけ、ではないんですが、それが大半ですね
フロウラ	ユウキさまとのデートはもちろん行きたいですし、やっぱり、クラスのみんなと一緒に楽しみたいなとも思いますし
フロウラ	でも私、運動は本当に苦手ですから……あまりに結果が酷すぎると迷惑かけちゃいますし
悠樹	まあ、それに関してはあまり気にしなくてもいいと思うけどな。ハイレンも言ってたし、そもそもこの国の連中がお前に求めてるのは、そんな部分じゃないだろうしさ
フロウラ	ふふ。それでも、ですよ。皆さんと同じように楽しむためには、やっぱり私も、同じ高さに立てる努力をしませんと
主人公	王族らしからぬ親しみやすさと、そのための努力。フロウラが国民から慕われてるのは、こういうところなんだろうな、やっぱり。
悠樹	そっか……なら俺が何か言うのはおかしいな。頑張れよ、フロウラ
フロウラ	はい、ありがとうございます。デートの約束も、忘れたらいやですよ
悠樹	分かってるよ。でもさ、たかがデート一回だろ。別に今後も出来ないわけじゃない。それに関しては、そんな無理しなくてもいいんだぞ
フロウラ	それはダメです
主人公	俺の言葉に、フロウラは珍しく強い否定を発した。
フロウラ	だって、運動が苦手だから……たったそれだけの、その程度の理由で引き下がってしまったら、皆さんの想いに負けちゃいます
フロウラ	正直に言えば、勝負そのものは勝てると思っていません。でも、それは勝てなくてもいいんです。他の皆さんだって、ずっと昔から頑張ってきたから今の能力なんですし
フロウラ	でも、それでも……ユウキさまへの想い、という一点に関してだけは、絶対に負けたくないんです。負けてなんてあげません。だがら、頑張りますっ
主人公	その両手を握りしめ、むん、と可愛らしく気合いを入れるフロウラ。その言葉は間違いなく本心だ。それが分かる。
主人公	そしてその言葉を聞いて、俺は驚いていた。俺はひょっとして、間違えてたのか？　勘違いしてたのか？
主人公	フロウラの俺に対する気持ちっていうのは……所有物って言葉の意味は……違うのか？
悠樹	な、なあ。フロウラはさ、俺とのことどう思ってるんだ？　その、いつも所有物だ、とか言ってただろ。そこに恋愛感情とかって無理に持ち込まなくても……
フロウラ	無理になんて持ち込んでいませんよ。むしろ、そちらの方が先ですから
主人公	まさかと思って尋ねる俺に、フロウラの答えは即答だった。
悠樹	先？　えっと、それはつまり……
フロウラ	ですが、これ以上を求めたいとは思いません。でないとさすがにズルすぎますから。他の皆さんに申し訳が立ちません
フロウラ	ですから、私はあくまでもユウキさまの所有物。それでいさせて下さい
主人公	そんな言葉を口にするフロウラの目は、確かに俺を、俺だけを見つめていた。
主人公	そこに感じられる想いも、熱も、疑う余地なんてまったくなくて……。
悠樹	なんで、所有物だなんて……
フロウラ	ふふ。王族の女には色々あるんですよ
主人公	その口元に浮かぶ、自嘲めいた笑みに、俺はそれ以上を聞くことが出来なかった。
主人公	けれど納得してしまう。自分が完全に間違えていたことを。
主人公	風呂を覗こうとした時のフロウラ。あんな風に自ら裸を見せようとしたりとか、謝罪にしてもおかしいと思っていた。
主人公	けれど、もしあれが俺への想いからだったとすれば。
主人公	あんな姿を見せてまでも、他の子達に負けたくないと、そう思ってくれての行動なら。
主人公	あの時のフロウラは、いったいどれだけの羞恥をこらえていたんだろう。それだけじゃない。俺の前のフロウラの行動や言動のすべてが、その想いから来てるなら……。
主人公	スキャナのような、強い想いじゃないのかもしれない。ニケのような、強い憧れでもないのかもしれない。それでも、そこにわずかながらに、そんな想いがあるのなら……。
悠樹	ごめんなさいっ
フロウラ	え？　あの、ユウキさま？　頭を上げて下さい。その、謝られる理由が……
悠樹	フロウラがこれ以上を言えないというなら、俺もあえて言わない。けれど、悪かった
主人公	フロウラが言葉にしない以上、その気持ちが本当はどんなものなのか、俺には分からない。それでも、俺が考えていたものと、違うような気がする。
主人公	なら、俺は謝らないといけない。だから俺は、頭を下げる。
フロウラ	ユウキさま……
主人公	そんな俺の気持ちをちゃんと受け止めてくれたのか、フロウラは嬉しそうに微笑んでくれた。
フロウラ	それでは、私はもう少し走っていきたいと思いますので、ユウキさまも早めに休んで下さいね
主人公	そしてフロウラは一礼すると、またゆっくり走り始める。
悠樹	まったく……本当に女っていうのは強いよなあ。男なんて、どう足掻いても女の手のひらの上、って気がするよ
主人公	一生懸命に走り続けるフロウラにもう一度だけ視線を送って、俺は寮の中へと戻ることにした。
主人公	俺の関係することで頑張ってくれてる子の姿をジッと見てるっていうのは、なんだかズルい感じがしてしまったから。
悠樹	ああ、リム。丁度良かった
リム	ユウキさん、外に出てらしたんですか？
悠樹	ああ、ちょっとね
悠樹	それで、今フロウラが頑張ってるからさ、無理しすぎないように見てあげてくれ
リム	姫さまがですか。はい、分かりました。お任せ下さい
主人公	これでフロウラの方も大丈夫だろう。俺は外に向かっていくリムの姿を見送って、部屋への階段を昇っていった。
主人公	ほんと、俺も頑張らなくちゃなあ、色々と。
