リム	お疲れさまです、ユウキさん、姫さま。タオルと飲み物、どうぞ
ルビィ	さすがのコンビネーションですよねえ。まったく危なげなくて凄かったですよ
トロン	そうそう。三組も転んだのにさ、二人は全然その素振りも見せないし
悠樹	はっはっは。俺とフロウラが組めばこんなもんよ
フロウラ	ありがとうございます。ユウキさまのおかげですね
主人公	自分達の見学席へと戻った俺達を、みんなが笑顔で迎えてくれる。よし、士気の高さも充分だし、マジでいいとこいけるんじゃないかな、これは。
フラン	それでぇ、姫さまの身体はどうだった？
悠樹	最高でした。ああ、二人三脚マラソンとかあれば、俺きっと優勝できるよ……
ハイレン	お、その競技面白そうだな。来年はやってみるか
フラン	やめといた方がいいと思うわよ。ユウと姫さまが特別なだけで、絶対みんな転びまくるから
フラン	いやよ、ゴールまで選手の後追って治療し続けるとか
ハイレン	いや、治療はリタイアかゴールのみで
悠樹	それ、ゴールする人間でないんじゃないか？
悠樹	それで、今やってるのはなんだっけ？
リム	はい、借り物競走ですね。借り物が色々とこってて、見ていて面白いです
ハイレン	物品そのものだとつまらないからな。色々な考え方が出来るものを借り物には指定してある
悠樹	例えば？
ハイレン	あらゆる攻撃から頭部を守るもの、でカツラもＯＫ
悠樹	なるほど……確かに間違ってはいないが、人によっては人生に終止符うつかもしれないな……
主人公	なんて恐ろしい借り物競走だ……まあ、見ていて面白いのは確かかもしれないが。
主人公	なんて言っているうちにも、『黒歴史』という借り物に、別れた彼氏を連れてゴールした女性徒の姿があった。
ルビィ	なんていうか……何を持っていくかで性格が分かりますねぇ……
トロン	借り物と持っていったものをちゃんと明かすところが怖いよねえ。面白いんだけど……
フラン	ふふ。このえげつなさいいわねえ
悠樹	フラン姉、本性バレるからそのニンマリ顔はやめておこう
フロウラ	あ、アイカさんも出場してるんですね
悠樹	アイカ先輩が？　どれどれ……
主人公	また随分と危険な競技に出たもんだなあ……いや、こんな恐ろしい競技とは思わなかったっていうのが正しいか。
主人公	アイカ先輩はその長い足であっさり最速でチェックポイントへと辿り着くと、借り物の書かれたメモを開く。
アイカ	ふにゃっ！？
主人公	そんな声が聞こえた気がした。
フラン	ふふーん。あれはまた、随分と面白いものが当たったっぽいわねえ
リム	あの、アイカさま、なんだか顔が赤くないですか？
ルビィ	あれは、なんかとんでもないものが当たっちゃったみたいですねえ
トロン	ずばり、下着とみたね！
ハイレン	残念だが、さすがに正面からのエロはさけている。本気でやばいことになりかねないからな
フロウラ	意外です。お兄さまにしてはまっとうな意見ですね
ハイレン	フロウラ、お前は普段俺をどういう目で見てるんだ……
フロウラ	聞きたいですか♪
ハイレン	くっ。この妹、弁論大会から俺への風あたりが強すぎる！
悠樹	当り前だ
主人公	自分をヒロインにした官能小説をみんなの前で読まされて平気な妹とか、それはただのビッチだ。
主人公	なんて騒いでいたところで、たまたま俺とアイカ先輩の目が合った。
主人公	あれ？　なんかホッとした表情したような……って、こっち走ってくる？
アイカ	ユウキさん！
悠樹	は、はい！
主人公	その形相に、思わず直立不動してしまう。
アイカ	あ、あ、あ、あの……私の借り物なのですけれど……
悠樹	えーと、俺が貸せるものならなんでも……
アイカ	で、では、ぜひ私を……
主人公	言葉の途中で、ボン、とアイカ先輩の顔の赤みが更に増した。
フラン	これはこれは、なんだか素敵なラブの香りがするわねえ
ハイレン	ああ、なるほど。あれを引いたか。随分と運のいいことだ
主人公	後ろの二人の会話がマジ怖いぞ、おい。
アイカ	な、何も聞かずに一緒に来て下さいませっ！！
悠樹	ええ！？
主人公	アイカ先輩は顔を真っ赤に染めたまま、俺の手を取った。そして引っ張るが……。
ハイレン	待て、アイカ。その借り物が俺の予想通りなら、そこには特記事項が書いてあると思うが？
アイカ	あう……た、確かにそうですけれども、その……これはあんまりではありませんの！？
ハイレン	まあ、それをお前が引いたことに関しては、運が悪かった、としか言いようのないところだな
フラン	ではでは、その借り物、お姉さんに見せてごらんなさい
主人公	いつの間にやらアイカ先輩のすぐ後ろへと移動していたフラン姉が、そのメモを一瞬で手から抜き取った。スリのスキルでも持ってるのか、この人は。
アイカ	ああああああああ！
フラン	ええと、なになに
フラン	『白馬の王子様・王子様による抱っこ付き』うっわ、これはまた面白いもの考えたじゃない、レン
ハイレン	お褒めにあずかり光栄だが、それを考えたのは俺じゃないんだな、これが
ハイレン	さすがに数が多かったんでな、一部生徒にも手伝ってもらった
リム	あ、あはは……す、すみませぇん……
ルビィ	リムさん、夢見るお年頃ですからねえ
トロン	実は、自分が借り物競走出るつもりだったとか
フロウラ	そう考えると、ご褒美のように思えてきますね、この借り物
ハイレン	だそうだぞ
アイカ	うう～……わ、分かりましたっ。分かりましたわ！　ユウキさん、お願いします！
主人公	陥落し、俺を求めるアイカ先輩に、俺は苦笑すると、どこぞの執事のように腰を曲げ、腕を胸の前と背中へ持っていく。
悠樹	かしこまりました、お姫さま。この王子めにお任せ下さい
アイカ	きゃあっ
主人公	俺はアイカ先輩をお姫さまだっこで持ち上げ、笑いかける。
主人公	アイカ先輩は、こんな風に抱かれた経験がないのか、真っ赤になって俯いてしまっていた。
悠樹	乗り心地はいかがですか？　姫。もし痛かったりするなら……
アイカ	い、いえ、大丈夫ですの……
主人公	呟くように言って縮こまってしまっているアイカ先輩は本当に可愛らしい。
主人公	ではでは、ゴールの方までお連れいたしますかねえ。
悠樹	にしても、アイカ先輩、軽いですね。肉付きいいですしもう少しあるかと思ってたんですが……これなら楽々です
アイカ	ほ、ほんとですの？　体重は少し気になっているんですけれど……
主人公	俺の言葉に、アイカ先輩の顔が瞬時に上がった。あー、やっぱり女の子。体重は気にしてるんだなあ。全然平気なのに。
悠樹	ええ。むしろ軽すぎるとか言われたことありません？
アイカ	そんなこと……むしろ、ユウキさんが思ってた以上に逞しいんですわ
主人公	周囲の女性陣が羨ましそうな目で見ているが、これは仕方ない。この借り物を取ったアイカ先輩と、選ばれた俺へのご褒美だ。
アイカ	ユウキさんこそ、大賢者、なんて魔法使い系のはずなのに、こんなに逞しくて……
悠樹	昔はかなりヒョロヒョロだったんですよ。まあ、実戦で鍛えられた結果ですね
悠樹	おかげでこうしていい思いが出来るので、鍛えた甲斐があったというものです。マッスルバンザイ
アイカ	ユウキさん、なんだか慣れてらっしゃいますわね。その、持ち方も、おしゃべりの方も……
アイカ	やっぱりその……女性との肉体関係があると、そういう所に余裕が持てるのでしょうか
悠樹	こう見えても俺、女性とのそんな経験ないですよ
アイカ	え？　だってその、大賢者さま、ですわよね？　四英雄の一人の
アイカ	女性でしたら、よりどりみどり……
悠樹	……肝心なところでヘタレるんですごめんなさい……フラン姉にいつも言われております……
主人公	いや、ヘタレても仕方ないじゃないですかっ。だって、スキャナとの一件以来、色々引いちゃうんですよ。
アイカ	ふふ、申し訳ありません。でしたらユウキさんは、とても誠実な方なのですわね
主人公	はにかむような笑みを浮かべて答えるアイカ先輩。誠実。ああ、そう言ってくれるあなたが本当の司祭に見えます。どこかの姉と違って。
悠樹	そう言ってもらえると……実は、こうして密着しているだけで心臓バクバクしてます。触ってみますか？
悠樹	まあ、代わりに俺も触らせてもらいますけど
アイカ	もう。少しがっつきすぎですわよ、ユウキさん
アイカ	誠実、という言葉を撤回してしまいそうですわ
悠樹	大変失礼致しました。なんというか、俺にとって希望に満ちた単語なので、ぜひ撤回は無しでお願いします
主人公	そして俺達は、見事にトップでゴールに辿り着いた。
主人公	気がつけば、冷やかしの声と視線とが凄いことになっていたのは、まあ仕方のないことだろう。
アイカ	ユウキさん、ありがとうございました
主人公	無事にゴールへと辿りついた俺に、アイカ先輩が頭を下げる。俺としては、むしろいい思いをさせてもらったので、こっちがお礼を言いたいくらいなんだが。
アイカ	それで、ですね、ユウキさん……
悠樹	はい？
主人公	ちょっと深刻な表情を見せるアイカ先輩に、俺は訝しげに首を傾げた。
主人公	何かまずいことでもしちゃったか？
アイカ	……童貞は、早期治療が大事ですわよ？
悠樹	……それはすなわち、アイカ先輩が治療して下さる宣言？
アイカ	にゃっ！？　あのあの、えとえと……せ、責任を取って下さりますならその……か、かなり激しく前向きに考えさせていただく所存ですわ！
主人公	アイカ先輩は髪と見分けがつかないくらいに顔を真っ赤に染めながら、走り去っていった。
悠樹	可愛すぎない？
主人公	責任とっちゃってもいいかもしれない。かなり激しく前向きに、俺は考えてしまっていた。
