スキャナ	えへ……えへへへ……えへへへへへへへへ～♪
ニケ	むう。この魂から滲み出てくるような幸せ笑顔が実に腹立つのう……
スキャナ	えへへへへへへへへへへへへへへへへへ～～～～♪
ニケ	分かった、分かったのじゃっ。分かったからもうやめてなのじゃあ！！
主人公	昼休み、食堂へ入った俺達の前にいたのは、頬をバラ色に染めてぽわぽわしているスキャナと、顔を引きつらせているニケの姿だった。
悠樹	……なにやってるんだ、二人とも？
ニケ	うう、ユーキぃ……スキャナがキモイのじゃ……
スキャナ	えへへ……あは、あはははー……えへへへへへへへー♪
悠樹	あー、うん、そうだな。キモイな
悠樹	これは……やっぱりあれか？　デートの……
ニケ	なのじゃ。ユーキとのデートが決まってからもう、ずっとこの調子で……姫の精神はガリガリ削られっぱなしなのじゃ……
フロウラ	あの時のスキャナさまの喜びよう、凄かったですからねえ
リム	まさか嬉しくて泣き出してしまうとは思ってもいませんでした……
トロン	あれだけ喜んでもらえるって、男冥利に尽きるよねえ。羨ましいなあ、ユッキ
ルビィ	でも、あれから丸一日経つのに、まだこんな状態なんですか？
ニケ	むしろ丸一日経ったから、というべきかのう。どうも自分の中で更に喜びが増幅し続けているらしく……
フロウラ	むしろ、それがこぼれ出てしまわないように懸命に抑えている。ですか
リム	あはは……その結果がこの、こぼれる笑い、なんですか……
ルビィ	なんていいますかー……見てるだけでお腹いっぱいですねえ
トロン	でも、こうして見て初めて実感するよ。勇者様も、可愛い女の子なんだって
悠樹	まあ、そうだな。勇者だ英雄だ奇跡の担い手だ、とか色々言われてるけど、所詮はこんな残念ヒロインだよ、スキャナは
フロウラ	ふふ。それをそんな風に簡単に言えてしまう人だから、スキャナさまはユウキさまを選んだんでしょうね
リム	分かる気しちゃいますね。一人の女の子として見て、大事にしてくれる男の人……あの、ひょっとしてユウキさんって結構かっこいいです？
悠樹	お前、最初の頃の俺に対する崇拝、どこに落としてきたよ！
リム	ふっふっふ。英雄にして大賢者たるユウキさんを一人の男の子として見ている一人の女の子ですよ。お一人いかがですか
悠樹	よし買った。ふっふっふ、覚悟しておけよ……もう俺無しではいられない身体に作り替えてやるからなあ……あ～んなこととかぁ、こ～んなこととかぁ……じゅる
リム	て、貞操どころか尊厳の危機！？　ひ、姫さまぁ、お、お助けを……
フロウラ	むう……ずるいですリム。私ですら、まだそんなことしていただけないのに……
ルビィ	あららぁ、フロウラさま、別の意味でおかんむり
トロン	ユッキ、その時の研究成果はぜひ僕にも共有を
悠樹	承った。リムのすべてをさらけ出そう
リム	じ、冗談ですよね？　冗談だって言ってください、ユウキさん～っ
悠樹	あっはっは。リムの冗談はいつも面白いなあ
リム	言ってくれましたけど、意味が正反対に！？
ニケ	まあ、メイドがユーキの餌になるのは仕方ないとして、そろそろこれをどうにかしてほしいのじゃが……
リム	餌……人ですらないんですね、わたし……しくしく……
悠樹	あー、まあそうだな。周囲への被害甚大、というか……若者達の勇者に対する夢は守らねばならん
トロン	そうだねえ。憧れていればいるほど破壊力高いかなあ、このスキャナ様
主人公	うーん……俺としては、こんな自然なスキャナの方がいいと思うんだけどなあ。
悠樹	とりあえず呼び戻すか。おい、スキャナ？
スキャナ	え？　あ、ユウキだっ♪
フロウラ	一瞬、でしたねえ
ニケ	さっきまでの姫の苦しみはなんだったのじゃろうか……
ルビィ	本当にユーキさんのこと好きなんですねえ。入学式の突撃は伊達じゃありませんね
トロン	あの夜、何人の男女が涙で枕を濡らしたか……
ルビィ	その中から女性を抜いてほしいところですが……まあ本当にいるんでしょうね
ニケ	しかし、本当に羨ましいのじゃ。姫も頑張ったというのに、なにが足りなかったというのじゃっ
リム	むしろ、胸がありすぎたんじゃないですか？
スキャナ	…………あう
ニケ	…………うぐ
トロン	同時にノックアウトとは、リムちゃん凄まじい……
フロウラ	あ、あの、ユウキさま？　やっぱり胸は無い方がいいんでしょうか……
悠樹	いやいや大丈夫だから。フロウラはそのままのフロウラでいてくれ。ぼいんぼいんも大好きだからな
ニケ	ぐぬぬ……スキャナよ、体育祭当日は姫も頑張ったとは思わんか？　騎馬戦とか大奮闘じゃろ
スキャナ	うん、それは認める。騎馬戦とか、ニケのおかげで勝てたところもあるしね
ニケ	ならば、じゃっ。三人で、というのは
スキャナ	却下。無理。ダメ絶対。ありえない。不許可。認めない。断じて断る。ヤダ。おととい来てね
悠樹	マジ容赦ないな、スキャナさん……
ニケ	うぐぐ……な、ならば仕方ないのう。こっそり後をついていって三人で……
スキャナ	聖剣で真っ二つにされたい？　上下半分と左右半分どっちがいいかな
ニケ	寮で大人しく留守番しておりますのじゃ……
主人公	正解だニケ。あのスキャナは触れた者マジ傷つける。決して逆らうな。
主人公	そして、そんな仲のいい二人の会話が続く中、俺はふと思いついた疑問をみんなに尋ねることにする。
悠樹	なあ、デートっていってもさあ、どこに行けばいいと思う？
蔑む人々	………………
主人公	うわあ……皆さんのジト目が痛い。フロウラさんまでとか俺大ピンチ？
トロン	あのさあ、ユッキ？　それを考えるのも男の役目の一つなんじゃないかなあ
トロン	どういうことをすれば女の子が喜んでくれるのか、それを考えて、情報を手に入れ、実行し、そして喜んでもらう。ここまでやってこそのデートだよ
ルビィ	凄い……トロンくんがめっちゃくちゃ頼もしいです……
リム	トロンさん、本当にナンパ成功させてるんですね……
トロン	なんか、酷い誤解を見たなあ……普段どういう目で僕は見られてるんだろうねえ……
フロウラ	だ、大丈夫ですよトロンさん。トロンさんが女の子大好きで常に女の子のことしか考えていないというのは、みんな分かってますからっ
悠樹	フロウラ……その、善意の心に天然の言い回し被せて投げつけるのやめような……ほら、トロン落ち込んでるし
フロウラ	す、すみません。あの……わ、悪いことを言ったつもりはなかったのですけど……
ルビィ	ですが、トロンくんの言ってることって正しいと思いますよ。そういうところまでやって、かっこいいところ見せてほしいなーって
悠樹	いや、その言い分は分かるんだけどな、正式なデートなんて生まれて初めてなんだよっ。どう選べばいいのかなんて分からないんだって
ルビィ	はい？
リム	ええ！？
フロウラ	まあ……
トロン	……あの、本気で言ってる？
悠樹	本気だし本当だし事実だよ。日本に居た頃なんて全然モテたこともなかったからな。そんな機会あるわけない
フロウラ	信じられません！　それじゃあ、もし私が向こうの世界に一緒にいれば、ユウキさまを好き放題堪能できたということですかっ？
悠樹	ま、まあ……そうなるかな？　向こうでフロウラみたいな子に迫られたら、一秒も悩まず首縦に振ってるだろうし……
主人公	こっちの世界でだって、変なしがらみとかなければ二つ返事でＯＫだしなあ。
フロウラ	女神さま……ユウキさまが私と一緒に戻れる方法をどうか……
リム	姫さまにここまで思われてるユウキさんが、そんなにモテないだとかビックリですねえ
トロン	向こうの世界とこちらとでは、モテのポイントが違うのかもしれないなあ
ルビィ	うーん、そうなると、色々考えろと言うのも酷かもしれませんねえ。ユーキさん、経験なしの残念ヘタレでしたかあ
悠樹	こういう時にもヘタレっていうのか、おい
フロウラ	ですが、魔王討伐の旅が終わったら二人でデートされるつもりだったんですよね？　その時はどうするつもりだったんですか？
悠樹	それはまあ、俺もスキャナもどっちもそんな経験ないから、二人で相談しながら、のんびり自由に楽しもうよって
悠樹	そういう方向で話してた
フロウラ	でしたら、それをやればいいと思いますよ
主人公	俺の回答を聞いて、フロウラがニッコリ笑って答えてくれる。でもなあ……。
悠樹	いや、さっきもジト目されたしさあ、そういうのってガッカリされないか？
ルビィ	する人はいない……とは言えませんねえ
リム	男の人にはグイグイ引っ張って欲しいって思う女の子は、やっぱり多いと思いますよ
悠樹	だよなあ
主人公	特にこの世界は、日本なんかよりも遥かに危険に満ちてる。魔は倒したとはいえ、全滅はしてないし、獣や怪物なんかも存在する。
主人公	権力や武力を盾に無茶をするバカも多い。こんな世界じゃあ、重要視される一番は、やっぱり『強さ』だろう。
フロウラ	ですが、一緒にいられることそのものを楽しみにしている女の子からすれば、まったく気にならないと思います。特にスキャナさまなら
主人公	……確かに。スキャナの俺に対する想いがどんなものなのかは、よく分かってる。実際、単純な強さならあいつの方が上なんだ。
主人公	そんなあいつが俺に求めてくれているものは……そういうことだよな。
悠樹	そう、だな。ここはまあ、素直に聞いてみるか
フロウラ	それがいいと思います。特に、そういう約束、だったのですよね
悠樹	ああ。分かった、そうしよう。ありがとな、フロウラ。みんなも
リム	でも、ちょっと意外ですね
悠樹	ん、何がだ？
リム	だってですよ、その、スキャナさまと、じゃないですか。ユウキさん、もっと嫌がるか、適当にごまかしちゃうんじゃないかなあ、って……
主人公	ああ、なるほどな。確かに、あの裏切りの件を知ってる人からすればそう思われても当然か。
悠樹	まあ、思わなくはないこともない。けどまあ、今でもあいつの好意そのものはすげえ嬉しくもあるしな
悠樹	約束した以上はデートもするし、どうせするなら、やっぱり楽しませたいって思うだろ
主人公	当然だ、と言い切った俺に、なぜか女性陣が見とれるような視線を向けていた。
トロン	なんていうか……ユッキがたくさんの女の子に好かれる理由、ちょっと分かるね
悠樹	いや、俺そんな凄いこと言ったか？
主人公	俺の返しに、三人の女性は嬉しそうに笑っていた。
ニケ	せめてお土産をじゃな……
スキャナ	普段ならいいけど今回はダメ。あくまで私のことだけ考えてもらうの
主人公	そして、あちらは未だに続いていた……。
