悠樹	スキャナ！！
主人公	スキャナの部屋へと入るや否や、俺はスキャナの身体を強く抱きしめていた。
スキャナ	え？　あれ、ユウキ？　どうかしたの……？
主人公	いきなり抱きついてきた俺に、スキャナが困惑する。まあ、当然だよな。だけど俺は抱きしめないわけにはいかなかった。
主人公	さっきのフラン姉達のあの会話。元の世界に帰れるかもしれない。
主人公	今なら間違いなくスキャナを選ぶ俺だが、さっきのあの会話は、そんな俺の前からスキャナがいなくなる。そんな想像をさせるに充分だった。
主人公	だからこそ、この感触を改めて腕の中に収めたくて、俺は広場からここまで必死にガマンをしていた。
悠樹	うん……やっぱりスキャナの感触いいなあ……あったかいし、柔らかいし、サイズもピッタリ
スキャナ	も、もう、ユウキったら……どうかしたの？
主人公	ダメだ。俺はこの子を失いたくない。離れたくない。
主人公	やっと手に入れた、この世界の帰る場所。俺はここでいい。ここがいい。俺は手放してたまるかとばかりに、スキャナを抱きしめる。
悠樹	……いや、とにかくスキャナの存在を感じたかったんだよ……
スキャナ	そうなんだ……うん、私もね、とっても嬉しいんだけど……着替える時間だけもらっていい？
スキャナ	ずっと歩いてたし、その、汗とか……
主人公	まあ、そうまで言うなら仕方ない。俺はスキャナを愛でたいんであって、辱めたいわけじゃないしな。
悠樹	分かった。着替える間だけ待つ。出来るかぎり迅速によろしく
スキャナ	うん……私も、ユウキに抱きしめてもらうの好きだから……急ぐね
主人公	そうして、俺の腕から解放されたスキャナは、洋服の入ったチェストへと向かう。
主人公	そのまま、チラチラと俺を気にするも、やがて開き直ったかのように、こちらに背を向けたまま脱ぎ始めた。
主人公	……うん。細いスキャナの身体と下着との組み合わせが実に萌える。
主人公	スキャナは素早くいつもの部屋着に着替えると、俺の方へと戻ってきた。
スキャナ	お待たせ……もう、ユウキじっと見てるんだもん……恥ずかしかったです……
悠樹	スキャナであればどんな姿であっても見る。俺の絶対正義だ
スキャナ	きゃっ
主人公	言うが早いか、俺はスキャナを抱き上げると、そのままベッドへと向かっていった。
スキャナ	え？　ええ？　えええっ？　えっと、いきなり……？
悠樹	だめかな……？
スキャナ	う、ううん。ユウキが私を求めてくれるんだもん、嫌がることなんてない
スキャナ	だけどその……帰って来たばかりだし、お風呂入ってこないと、ちょっと汗臭い、かも……
悠樹	大丈夫。構わないから、このまま……
スキャナ	うう～……私は構っちゃうんだけど……でも、うん。ユウキが今がいいっていうなら……
スキャナ	だ、だけどね、本当にね、幻滅したりとかしないでねっ
悠樹	むしろどうやったらスキャナに幻滅出来るのかを教えてほしいな。あの試練をくぐり抜けた俺達に、障害になるものなどこの世には存在しない！
スキャナ	だ、だけどやっぱり女の子として、好きな男の子の前では気になっちゃうんですっ
悠樹	大丈夫だよ。ほら、こんなにいい匂いだ……
主人公	俺はスキャナをそっとベッドの上に寝かせると、その胸に顔を埋めて匂いを嗅いだ。
主人公	スキャナの香りが、胸いっぱいに広がっていく。
スキャナ	あうう～……恥ずかしいけど……うん……私も、ユウキに気持ち良くしてほしいから……
主人公	そんな恥じらいに満ちた笑顔に、俺はスキャナへの愛しさが爆発していくのを感じていた。
