バリアリーフ	昨日お伝えした試験についてですが、詳しいルールが決まりましたので連絡致しますわ
主人公	朝のホームルーム。教壇に立つ先生から、昨日と同じように試験に関する話が伝えられる。
主人公	内容が内容なせいか、さすがに寝たり呆けてる奴はいない。みな真剣に話を聞いている。
主人公	実際、このルールの中に色々と攻略のヒントに繋がる何かが隠れてる場合も多い。わざと曖昧にしておくことで、ルールの穴を作っておくわけだ。
バリアリーフ	内容は、クラス内でパーティーを組んでの地下迷宮攻略。入り口は複数ありますが、どこから入るのかは自由に選んでいただいて構いませんわ
バリアリーフ	また、内部には複数のチェックポイントを設置し、そこに通過の証となる指輪を置いておきます。ただしこれは先着順。必ずしも全パーティーに行き渡るわけではありません
バリアリーフ	ですが、この指輪は特別な魔力を発生しています。多く持つほどモンスターに襲われやすくもなりますので、入手するかは各パーティーで決めますように
バリアリーフ	そして評価対象となるものは、すべて、です。目的地への到着速度。手に入れた指輪の数。倒したモンスターの強さ、数、等々
バリアリーフ	いかに勝ち、生き残り、目的を達成するのか。皆さんの実力を存分に発揮してくださいませ
バリアリーフ	その他詳しいことについては、こちらの資料に書いてあります。しっかりと目を通しておいて下さいな
主人公	そう言いながら配られた紙には、小さな文字で様々なルールが書かれていた。多分、こんな資料でもちゃんと目を通しているか、というのも当日はチェックされるんだろう。
紅	パーティーはクラス内で組む事、か。最大五人らしいが、あたしたちは、どうせいつも通りだろうな
姫	ああ。俺と紅の二人だけだろ。人族と組んでくれる相手なんてそういないし
紅	その分、面倒に巻き込まれなくていいともいえるがな。強い相手と組めばそれだけ上位にいける確率も高い。高レベルのやつをどう引き抜くか
紅	一生懸命にゴマをすって引き抜きかけてる連中見てると、哀れにすら思えてくる
姫	うちの目玉はやっぱりラーロンと……デイルか？
紅	だろうな。最下級といえども魔王クラスのラーロン。そして二階級進級試験、トップ５のデイル
紅	普通にやってれば上位入賞は確定だ。まあ、どっちもクセのありすぎる連中だが
主人公	教室内を見回してみれば、教室中の神族と竜族が、悔しそうな顔を浮かべているのが分かる。
主人公	こういうパーティー制の時は、余程仲がよくないかぎり基本的には同種族で組むのがほとんどだ。このクラスのトップ２である二人はどっちも魔族。
主人公	他の種族からすれば、残念なことこの上ないだろう。
姫	まあ、ラーロンはいつも通りの取り巻き連中とだろうけども、デイルが誰と組むかだなあ
主人公	チラリと視線を送ってみれば、思った通り本人は、興味ないねとばかりに笑っているだけだった。
主人公	デイル＝グラン。魔族。二階級の中でもトップクラスの実力を持ち、その力は魔王クラスでもないのにラーロンと同等かそれ以上と言われている。
主人公	ただしかなりの変人でめんどくさがり。何らかの興味を持たない限り決して自分からは動かない。
主人公	もっとも、性格的にはラーロンなんかよりはかなりマシなようで、慕っている魔族は男女問わずかなり多いみたいだ。
ラーロン	教師Ａよ。質問がある
主人公	突然にラーロンが手を上げた。
バリアリーフ	構いませんわ、どうぞ
ラーロン	魔族の中でも上位クラスの者が、この階級に編入するという話を聞いた。それも相当に高貴な血の者が、だ。その者は参加するのか？
主人公	どうやら昨日話に出てた、あの噂の件みたいだ。なるほど、紅が聞いてこれるんだから、ラーロンだったら耳に入って当然か。
バリアリーフ	皆さん相変わらず耳の早いことですわね。本当に、どこから聞いてくるのやら
主人公	先生は呆れるように肩をすくめると、言葉を繋げた。
バリアリーフ	まずその噂ですが、ええ、事実ですわ。ですがその子がいつ、どのクラスに入るのか、詳しいことはまだ私も知らされておりませんの
バリアリーフ	もっとも、その子と組めば上位入賞の可能性も高まる。そう考える皆さんの気持ちも分からないではありません。情報が入り次第、きちんとお伝え致しますわ
ラーロン	なるほど、了解した。では続報を楽しみに待たせていただくとしよう
主人公	そう言って引き下がるラーロン。あの顔は、もしこのクラスに入るのなら間違いなく自分と組むはず、という顔だ。まあ同じ魔族だし、それも否定はできない。
主人公	そんな空気を悟ったのか、他のクラスメイト達から、いかにも落胆する声が響く。
バリアリーフ	それでは、今朝のホームルームはこれくらいにいたしましょう。引き続きまして授業に入ります。みなさん、各自教科書とノートを
主人公	そうして一時限目の授業が始まった。迷宮探索。俺のレベルでどこまでやれるかは分からないけれど、楽しみだ。少しでも上を目指せるよう、気合をいれないと。
