主人公	鳴り響く鐘の音が、今日の授業の終わりを教えてくれる。戦術担当の教師が教室から出て行くと、俺は大きく伸びをした。
姫	戦術関係の授業は結構好きなんだけど、試験前はさすがに身体を動かしたくなって焦れてくるな
紅	ああ、気持ちは分かる。とにかく少しでも剣を振って技術をあげておきたくなる
主人公	戦術を初めとする、座学で得る知識がどれだけ大切かは分かってるつもりだが、実技試験の時はどうしてもなあ。
紅	今日もこれから行くんだろう？
姫	ああ、少しでも鍛えておきたいしな。せっかくウルルも協力してくれてるんだし
紅	すまないが、あたしはちょっと調べ物があるので先に行っててくれ。すぐに追う
主人公	紅は言うと、カバンを片手に教室を出て行った。調べ物っていうことは図書室か。
主人公	この学園の図書室は、武術や魔法に関する様々な資料が置かれているから、そういったものを調べるには丁度いい。
姫	ま、俺の場合は技より先に身体能力の方だしな。頭で理解しようとしても身体がついてきてくれなきゃ意味ないし
主人公	基礎知識は必要だがそれより先の応用になれば、まずはそれを理解してついていける能力がなければなんの役にも立ってくれない。
主人公	優れた技には、それなりに高度な技術がどうしても求められるものだ。
姫	それじゃあ、先行ってるか。素振りくらいはできるだろうし
ラーロン	はっ、また無駄なことを
主人公	いきなりの声に分かっていながらも振り返れば、やっぱり分かっていた通りの姿があった。
主人公	いかにもに胸を張り、いかにもな見下し目線で俺を見ている。
姫	……ラーロン
ラーロン	何を言っているのやら。所詮は万年下位ランクの、たかが人族。永久の敗北者とまで呼ばれし下郎の力、学園内で知らぬ者はおらんほどだというのに
ラーロン	それが特訓とは。０をどれだけ乗算しても０にしかならん
主人公	突然現われた割には随分と好き勝手に言ってくれるもんだ。自分の実力は分かっているつもりだが、さすがにそこまで言われたことはないぞ。
姫	まあ、確かに０は何をかけても０だけどな。でも、足し算だったら増えていくんだぜ。０＋１はちゃんと１だ
主人公	いきなり１０や２０になれるなんて思ってない。けれど、たとえ１ずつでも足していけるなら、いつかは３０にだって、５０にだってなれるはずだ。
主人公	だがそんな俺の言葉を、ラーロンは鼻で笑い飛ばす。
ラーロン	はんっ。１をどれだけ足したところで所詮は背中を見続けるだけ。その差は開いていくのみだ
ラーロン	自分と他者の力の差も分からん下郎はこれだから困る。今更人族如きがどんな特訓をしたところで時間の無駄にしかならんのだがな
姫	弱いから、強くなろうと訓練をする。別に間違ってはいないはずだけどな。それとも魔王っていうのは、強いから弱くなるために訓練するのか？
主人公	言って、わざとらしく肩をすくめる。こういう奴は、無抵抗でいるほど面白がるからな。多少はつついておかないと。
ラーロン	貴様、この私を侮辱するつもりか……？
主人公	とはいえ、抵抗したらしたでこうなるわけで。本当にめんどくさい奴だ。
姫	少なくとも俺にそのつもりはないけどな。そう聞こえるなら、お前がそうされる心当たりがあるってことだ
姫	そもそも、３０＋０は永遠に３０のままなんだぜ。たとえ最初が３０だって、そこに足すものがなければいつかは抜かれる
ラーロン	貴様……
主人公	睨んでくるラーロン。しまった、少しつつきすぎたか。
ラーロン	……まあいい。踏み潰すのは簡単だが、こんなところでやってもこちらが汚れるだけよ
ラーロン	せいぜい、その時間の無駄を頑張るのだな。人族という存在の不必要さ、その身を以て証明するがいい
主人公	ラーロンは苛立たしげにそう言うと、俺の前から立ち去っていった。
オペラ	ぱちぱちぱちぱちー
姫	オペラさん
主人公	今まで様子を窺っていたのか、ラーロンがいなくなるのと同時に現われたメイドさんに少し驚く。
オペラ	素敵でしたよ白鷺さま。もう一つオマケでぱちぱちぱちぱちー
姫	いや、拍手だというのは分かるんですけど、口で言うのはちょっと……
オペラ	にしてもさっきのザコ魔王さま、中々に素晴らしい捻くれたご精神をお持ちのようですね。思わず殺っちゃおうかと思いました♪
姫	オペラさん、声、声が笑えてません
オペラ	まあ、これは失礼しました
オペラ	顔も笑うべきではありませんでしたね……
主人公	この人なら魔王であれ本気で殺れそうな気がする……。
姫	ところで、どうかしたんですか？　一人でいるなんて珍しいですけど
オペラ	はい、ウルルさまからの伝言です
オペラ	友人と試験について少し話してから向かうので、先に行っていてほしいと。終わり次第すぐに向かいますの、にいさま、先に帰っちゃ嫌ですよ、ウルル泣いちゃうシクシク
オペラ	とのことでした
主人公	最後の部分は間違いなく付け足したな……分かってはいるが主人に対してもこの仕打ち。恐ろしい人だ……。
姫	分かりました。それじゃあ俺は先に向かってますんで
オペラ	はい、よろしくお願いします
主人公	オペラさんは優雅にスカートをつまみ上げると、軽い会釈を残して去っていった。
姫	よし。それじゃあ行くか
主人公	俺は今度こそ誰にも邪魔されることなく、カバンを片手に教室を後にした。
