主人公	扉の向こうには、広大な空間が広がっていた。
主人公	闘技場より若干狭い程度の広い空間。天井も高く、巨大なゴーレムの一体くらいは易々と歩けるだろう。
主人公	通路と同様、魔法の松明によって照らされた広間は多少暗いものの、周囲を見る分には問題なさそうだ。
紅	まさか、地下迷宮の一番奥にこんな広間があったとはな……
姫	これだけの高さを降りてきたってことか。よくこんだけのものを、学園の地下なんかに作ったもんだ
主人公	驚きながらも、広間全体を見回しながら気配を探る。いくらなんでも俺達が先頭のはずはない。既にどこかから脱出しているのか、それともどこかに隠れて待ち伏せを……。
多分、奴	あーはっはっはっはっはっはっは！
主人公	唐突に、聞き覚えのある高笑いが広間内に響き渡った。
紅	姫、今のは
姫	ああ、間違いない。ラーロンだ
姫	やっぱり先について待ち伏せしてたみたいだな
主人公	俺達は互いの背中を合わせ死角を無くすと、笑い声の主を捜す。すると、奥に見える通路の中から、ラーロンを含めた四人の男女が歩いて来るのが見えた。
姫	お客さまを出迎えに来てくれた、って印象じゃないよな
紅	どうだかな。全員知ってるやつだ、編入生の姿がない。なんらかの出迎えを用意してくれてるのかもしれないぞ
姫	なるほど。主人の命に従って使用人が出てきたわけだ
ラーロン	……この私を使用人呼ばわりとはな。だが、いいだろう。今日の私は実に機嫌がいい。真の魔王の恩恵をこの身で受けているのだからな
ラーロン	苦しまぬよう、すぐ楽にしてやる！
主人公	四人がそれぞれの武器を抜く。さて、どうするか。ラーロンはもちろん、他の三人もそれなりに上位の方にいる連中だったはずだ。
姫	実は、隠れた特訓であいつらを一撃で倒せる必殺技を会得していた、とかないのか？
紅	そっちこそ、実は特別な力をその身体に封印していて、ここらで解放してみる、とかないのか？
姫	なくはないんだが、それを使うには乙女の熱いキスが必要でさ
紅	してやっても構わないが、あたしのは高いぞ。生涯背負ってもらうからな
姫	さすがに、この若さでそれは勘弁だな。別の方法を考えよう
主人公	互いの武器を構えながら、こちらへと向かってくる四人を油断無く見やる。背中越しに、紅が小さく呪文を唱えるのが聞こえた。
主人公	ラーロン達は、こちらを相当甘く見ているのかなんの警戒もなく真っ直ぐ歩いて来る。
紅	先手必勝だ！　魔力解放『風の槌』！
主人公	紅の愛用している武器は、儀式によって得られた物だ。当然ながら魔力の生成能力を持っている。それが持ち主の言葉と共に、作り出した魔力を解放。現象を生み出す。
主人公	高密度に圧縮された風の塊。不可視のハンマーが、四人の一角に振り下ろされた。
ラーロンパーティーＣ	きゃああっ！
主人公	魔族が使ったほどではないにせよ、直撃すればそれなりの威力はある。明らかに崩れたその隙を逃さず、俺達は飛びかかった。
主人公	紅はともかく、俺の実力では明らかにこいつらに勝てない。防戦状態になったら負けだ。
ラーロン	こざかしい真似を！
主人公	ラーロンの手にした両手剣が、振り下ろされる。
姫	くぅっ！
主人公	受け止めようとしたものの、魔力によって強化されたそれは、たやすく剣ごと俺の体を吹き飛ばす。
主人公	紅の持つ日本刀のように、儀式で得た武器は、その切れ味も耐久力も一級品だ。だが、俺のは違う。ごく普通の両手剣。
姫	……あんなの正面から受け続けてたら、間違いなく折れるな……
主人公	切れ味よりは頑丈さを重視した武器を選んではいるものの、別に伝説の剣というわけでもなんでもない。
ラーロン	馬鹿が。安心しろ、貴様程度でそう何度も受けられるような剣ではない。すぐに終わりにしてやる！
主人公	どうやらラーロンは俺を相手に絞ったらしい。一直線に俺のもとへと走ってくる。
主人公	一瞬だけ目をやれば、紅は他の三人との戦いになっている。実力的には紅のが上のはずだが、三人相手ではさすがに厳しい。
姫	こっちは俺一人でなんとかしないとな……
主人公	どんなにむかつく奴でも、その腕自体は本物だ。俺でどこまで勝負になるか……さすがに、背筋を冷たいものが降りていく。
ラーロン	さあ、せいぜい悪あがきをしてみせろっ。そして死ね！　この私のために、痛快な悲鳴を上げて死んでみせろ！
主人公	明らかに俺を下に見た大振りの攻撃。だがそれでも充分に早い。俺はどうにかかわすものの、ラーロンはもう次の挙動に入っている。
紅	姫！
主人公	心配げな紅の声が聞こえるが、向こうもこっちを助けに入る余裕はない。三対一でもたせているだけでも相当なんだ。
主人公	……せめて、紅が一人でも倒すくらいはもたせないと……。
ラーロン	あーっはっはっはっは！　分かるぞ、貴様の考え！　下郎Ｂがどうにか向こうを倒すまでこらえれば、というのだろう！
ラーロン	そうだな。下郎Ａ如きの力では、それが限界だ。いや、それすらも奇跡の大安売りというもの！
ラーロン	いいだろう。すぐに楽にするには下郎は少々調子に乗りすぎた。少しくらいは粘らせて、希望とやらをくれてやろう
主人公	下卑た笑顔で笑いながら、とにかく俺を責め続けるラーロン。こいつは明らかに楽しんでいる。俺を追い詰めることを。いつでも倒せるという確実な余裕。
主人公	けれども、その攻撃すらも凌ぐのがやっと。まずい。完全に防戦一方だ。攻撃に移る余裕も、間合いすら開けない。このままじゃあ、剣が折れた瞬間におしまいだ。
ラーロン	愉快だよ。実に愉快だ。そう。人族如きがこの私と同じ部屋で机を並べるということがそもそもおかしいのだ。現実にはこれほどの差があるというのに！
ラーロン	どうだ、少しは実感できたか？　人族というものがどれだけカスか。ゴミがこの私に逆らう愚かさが
ラーロン	知っているか？　パーティー同士の戦闘が許されたこの試験、腕の一本や二本失う程度のケガは充分有りだということを
ラーロン	まあ安心しろ、さすがに殺しはしない。そこまでは許されてもいないし、下郎の命如きでこの私の名を汚すのもバカらしい
主人公	ミシッ、と嫌な音が剣から聞こえた気がした。まずい、もう限界だ！
ラーロン	さらばだ、下郎Ａ。貴様のような雑魚がこの学園に来ることが罪なのだ。少しは自らの分をわきまえるべきだったなっ
姫	しまっ！
主人公	一際力のこもった一撃に、身体ごと吹き飛ばされる。地面に投げ出され、完全に体勢が崩れた。
ラーロン	これで、本当におしまいだあ！！
主人公	狂った笑顔を浮かべ、剣を振りかぶるラーロン。だめだ、これはかわせないっ。
紅	姫、ダメだ、かわせ！！
主人公	悲鳴のような紅の声が耳に届く。目の前のラーロンの動きが妙にゆっくりと見えるが、身体は動かない。どんなに命令しても、反応してくれない。
主人公	視界の中で、振り下ろされた銀の刃が、真っ直ぐに俺へと向かってくる……。
女の子	させませんっ
主人公	少女らしき声と共に、強大な圧力が目の前に落ちた。その一撃が地面を砕き、同時にラーロンの武器をも弾いていた。
ラーロン	な、なんだと！？
主人公	慌てて一歩飛び退くラーロン。俺も、まさか、とばかりに顔を上げる。
主人公	そこには、俺のよく知っている竜族の少女が立っていた。
姫	ウルル！？　なんでここに
ウルル	一階級もゴールは二階級と同じですから。たった今、辿り着いたところです
主人公	そして襲われている俺を見て、即座に加勢してくれたようだ。つまり今の一撃は、ウルルの拳か。
ウルル	でも、本当によかった……間に合って……にいさま……間に合いました……
主人公	その目に涙すら溜めて、安堵の言葉を漏してくれるウルル。その言葉が、今は本当に嬉しくて、そして何より心強い。
姫	……悪い。正直、助かった
主人公	そうウルルに感謝しつつ紅の方へと一瞬視線をやれば、ウルルのパーティーの子達だろう。やはり竜族の子達に助けられた紅が、体勢を整え直していた。
ラーロン	くっ、竜族の王女か。あと少しのところで邪魔をしおって！　だが、魔族と竜族では魔族の方が圧倒的に有利
ラーロン	強靱な肉体の代わりに、魔法防御に関しては人族以下な貴様らが数人集まったところで状況は変わらんぞ
ウルル	嘗めないで下さい。確かに魔法そのものには多少弱いですが、攻撃を当ててしまえばこちらの勝ちです。竜族の一撃に耐えられる物理防御力、あなたたちにありますか？
主人公	岩を、地面をもたやすく砕く高レベル竜族の一撃。確かに、一撃でも当ててしまえばそれで状況は覆る。
主人公	睨み合うウルルとラーロン。ふらつきながらも立ち上がると、俺もウルルの隣に立った。
主人公	いざとなれば、俺が盾になってウルルを守ればいい。一撃いれれば、それで戦況は一気に変わる。
ラーロン	……やはり、所詮は人族だな。一人では何もできないからと、そんな子供の力を借りるとは
主人公	安い挑発だ。向こうも分かってるってことだろう。ウルルの存在がどれだけバランスブレイカーなのか。
主人公	まだ一階級ということもあってあまり表に出ていないが、その常識外れの身体能力は既に学園トップレベル。まともに一撃くらえば、三階級だって沈むだろう。
ウルル	この方を守りたいと思わせる、それは立派な実力です。少なくともウルルは、あなたをこの拳で守りたいとは思いません
主人公	はっきり言い切ったウルルの言葉に、ラーロンの顔が怒りに歪む。
主人公	その血が故に常にちやほやされてきたラーロンにとって、今のは最大の侮辱になるんだろう。ラーロンは、さっき弾かれた剣を、再び拾い上げる。
ラーロン	……いいだろう。竜族など所詮は魔族に狩られる立場だということを教えてやるぞ！　この小娘があっ！
主人公	激昂し叫ぶラーロン。俺はウルルをかばうように前に出る。俺がラーロンの一撃を受けて、そこにウルルの全力を叩き込む。これが確実な勝利の方程式だ。
主人公	ウルルも分かっているのか、背中から心配するような気配が伝わってはくるものの、それを止めようとはしない。
ラーロン	どけい！　下賎な鼠ごときが邪魔をするなあ！
姫	ネズミでも、後ろに竜がいるなら噛みつくくらいはできるんだぜっ
主人公	剣を振り上げ飛び込んでくるラーロンに、俺も剣を両手でしっかりと握りしめて構える。この一撃を受けられるか否か、それですべてが決まる！
少女	そこまでよ
主人公	瞬間、広間の時間が凍り付いた。
主人公	広間全体に響き渡った、どこまでも静かな、けれど楽器の放つ旋律のような声。
姫	な、なんだ、これ……
主人公	そして正面、ラーロン達が出てきた通路の向こうから溢れ出してくる、まるで刃のように尖った空気。
紅	は、はは……凄いな、これは。身体が勝手に震えだして……
主人公	息をすることさえ苦しく感じる、鋭くも濃密な空気が広間全体に満ちていく。全身の毛穴が開き、嫌な汗が流れ始めて止まらない。
主人公	空間そのものが巨大な重りになったかのような圧力。まるで身体が彫刻にでもなってしまったみたいだ。動きたくとも指一本動いてくれない。
ウルル	ま、魔力、です……それもウルルたちが知っているものとは桁違いの密度の魔力……
主人公	奥から、少女がゆっくりと姿を現す。
主人公	綺麗な少女だった。黒く長い髪は柔らかく揺れ、真紅に輝く瞳は、まるで空間すら切り裂きそうな鋭さを持っている。
主人公	ウルルほどではないにせよ小柄な身体は木の枝のように細く、すぐにでも折れてしまいそうだ。
主人公	にも関わらず、手にした鎌は彼女の身体よりも巨大で、その刃は闇夜のように黒く妖しく光って見えた。
主人公	レベルが違う。いや、存在そのものが違う。まるで神話に出てくる巨人を目の前にしたかのような絶望。見るだけではっきりと分かる。
主人公	たとえ奇跡が起こったとしても、彼女には勝てない。
ラーロン	セ、セイン様……
セイン	もういいわ、ハデラ。後は私がやる
主人公	凛と澄んだ声が空気を震わせる。それは、聞く者によっては絶望の鐘の音にも聞こえただろう。
ラーロン	で、ですがセイン様……このような下賎な輩……
セイン	聞こえなかったかしら。もういいわ
ラーロン	か、かしこまりました……
主人公	ただつまらなそうに発したその言葉だけで、あのラーロン達四人が下がっていく。間違いない。彼女こそが……魔王の血族。真の魔王。
紅	……納得した。迷宮内の、あの無謀な進行。だが、こんな力を持っていたなら、むしろ最善だ……
ウルル	にいさま、紅さん、下がっていて下さい。あの方は別格です。ウルルがなんとかしてみせますから……
主人公	そう言ってくれるウルルだが、その声には絶望が感じられた。ウルルも分かっているんだ。自分では彼女に勝てないということを。
セイン	……人族の、少年……
主人公	まるで何かを懐かしむかのような声と共に、その赤い視線が俺を睨んだ。他など眼中にないとばかりに、まっすぐ俺を、俺だけを睨んでいる。
紅	向こうも、どうやら分かっているみたいだな。あたしたちの中心は、あくまで姫だっていうことを
ウルル	はい。紅さん、にいさまを守って後ろに……
姫	……そういうわけにもいかないみたいだな……
主人公	少女が、魔王が歩いて来る。俺を睨んだままで、ただ真っ直ぐに歩いて来る。
主人公	まるで俺以外のなにも目に入っていないかのように、俺を目指して歩いて来る。
ウルル	にいさま、逃げて下さいっ
主人公	ウルルが俺を守ろうと俺の前に出ようとする。けれど俺は、それを手で遮った。ウルルの気持ちは嬉しいけれど、これは無理だ。逃げられない。
主人公	なぜかは分からないけれど、あの少女は間違いなく俺を狙っている。俺だけを狙って、俺だけを狩ろうとしている……。
ウルル	にいさま！？
紅	姫、やめろ！
主人公	気がつけば、俺は自分から一歩を踏み出していた。
主人公	この広い空間全体すらをも包み込む強大な黒い魔力。この場にいるだけで呼吸すら苦しくなる、立っているのも辛い圧力。その中で、俺は一歩を踏み出していた。
主人公	なんだろう、この魔力。最初はただとてつもない力の塊、破壊の意思のようにも思えたけれど、気がついてみれば、それとは違う何かを感じる。
主人公	抑えることもなく、ただ無尽蔵に流されるこれは、まるで何かを示そうとしているみたいだ。
ラーロン	ふ、ふはは……あーっはっはっはっは
主人公	高らかに上がるラーロンの笑い声。完全に勝ち誇ったそれは、ただ愉悦に染まっていた。
主人公	黙って前に出る俺の姿が、逃げることもできずに狂ったとでも思えたか。俺がボロボロになって叩きのめされてるシーンでも想像しているんだろう。
姫	名前、聞いてもいいかな……
主人公	少女を真っ直ぐ見つめ返しながら問いかける。けれど返答はなかった。紅く揺れるその瞳は何も語ってくれない。
主人公	そうして気がつけば広間の中央。この空洞の中心で、俺達は向かい合う。
主人公	圧倒的だった。
主人公	こうしてその姿を見るだけで、いや、見なくても近くにいるだけで分かるだろう。それくらい圧倒的な力が、彼女の身体を包み込んでいる。
主人公	あんな細くて小柄な身体。にも関わらず、今この場にいる全員が下がってしまうほどの圧倒的な密度の力。
主人公	触れれば、その瞬間に粉々にされる。そんな恐怖を感じさせる力が、目の前の少女から発せられている。
主人公	間違いない。あれが、噂にもなっていた魔王の少女。
主人公	魔族の中でも特別な血と、根本的に質の違う力を持つ者しかなれないはずの、魔王というクラスの、それも頂点に立とうという少女。
ラーロン	ふは、はははははは！　あーははははははっ！
ラーロン	そうだ、これだ！　これこそが真の魔王だ！　崇めろ！　恐れろ！　跪け！　虫ケラの多少の努力など、ただの無駄でしかないことを思いしれ！
主人公	広間にラーロンの高笑いが響く。普段の俺ならさすがに否定する言葉だけれど、こんな現実を目の前に見せられれば、何も言えない。
主人公	ここ一週間行ってきた特訓も、この学園に入ってからの夜の訓練も、勇者になりたいと夢を抱いて剣を握ってからの何年にも渡る練習も……。
主人公	こんな力の前には全部吹き飛ぶ。なんの役にも立つはずがない。根本的に次元が違う。
ラーロン	さあ、今です！　人族などというゴミを、その魔族の象徴たる色で、黒き刃で、汚い肉塊へと変えてやって下さい！
主人公	ラーロンの、いかにも悪の参謀的言葉に、少女が動いた。
主人公	その背よりも長く巨大な暗黒の鎌。闇夜を思われる漆黒の刃が静かに揺らめき、俺へと向けられる。
主人公	次の瞬間、すぐ目の前に少女の姿が現われていた。
主人公	まるで瞬間移動でもしたかのような一瞬の踏み込み。その速さに、俺の目が、思考が、身体がついていかない。
主人公	俺のすべてを置き去りにして、その黒い刃が大きく振り上げられる。
主人公	触れれば間違いなくそのすべてを粉々に打ち砕くだろう必殺の刃。その破壊力が、こうして見ているだけで感じられる。当たれば間違いなくそこで終了だ。
主人公	動け！　全身にそう指令を発する。けれど俺の知覚よりも、動きよりも、彼女の刃の方が遙かに早い。
主人公	どんな大魔法を放ったのかと思うほどの破壊音が、この広間全体に響き渡る。
紅	姫！
ウルル	にいさま！
主人公	ほとんど悲鳴そのものな二人の声。これが聞こえるっていうことは、とりあえずまだ生きているみたいだ。
主人公	正直、どうやってかわしたのかも分かっていない。ただ必死に動けと自分に命令した結果。黒い刃は俺のすぐ横を走り抜けていた。
主人公	たったの一撃。その一撃が、地面を砕き、俺の身体を吹き飛ばしている。
主人公	必死に立ち上がれば、そこには黒い少女の視線があった。
主人公	その赤い瞳が、真っ直ぐに俺を見上げている。整った、精緻な彫刻すら思わせる顔立ち。それが、ただ無表情に俺だけを見つめている。
主人公	その視線に、俺は一つ気がついた。なぜ無表情なんだろう。
主人公	戦うことに喜びを見出しているでもなく、虚しさや、寂しさを抱いているでもない。だからといって他人の意思のもと戦っているとは思えない。あくまで自分の意思だろう。
主人公	だとしたら、なぜ無表情なのか。
主人公	いや、もしかして、無表情を装っているのか？
姫	……今の一撃、まさか……
主人公	まるで、その先を言葉にさせないとばかりに少女が再び鎌を振り上げる。
主人公	そしてそのまま、漆黒の鎌が薄暗い地下深くの広間に閃いた。
姫	あ、危なかった……
主人公	慌てて飛び退き、ゴロゴロと地面を転がる俺。黒い刃はギリギリで届かなかったらしい。
主人公	いや違う。今のはどう考えてもかわせるタイミングじゃなかった。刃が届かなかったところで、その余波で吹き飛ばされたはず。今のは、わざと外された。
主人公	俺はどうにか身体を起こすと、目の前の少女を見やる。相変わらずの無表情。あの仮面の下で、いったい何を考えているのか。
主人公	……やっぱり、そうなのか……？
姫	……遊ばれてる、のかな……
主人公	明らかに情けをかけられた今の一撃。俺は、それを確かめるようにわざと尋ねてみる。
魔王	……もし、そうだとしたら……？
姫	いや、本気出されたらどうなっちゃうのかなあ、と
魔王	そうね。あなた次第じゃないかしら
主人公	その口元に、小さいながらも笑みが浮かぶ。それは今までの無表情なんかと違って、遙かに魅力的な表情だった。
主人公	初めて見る、表情だった。
主人公	次の瞬間、再び一瞬で間合いが狭まる。
主人公	本来ならば中距離用武器であるのはずの巨大な鎌が、大きく振り上げられ……、
主人公	軌道上のすべてを粉々に打ち砕こうと、迷い無く、ただ真っ直ぐに振り下ろされた。
主人公	俺はその一撃をかわそうともせずにただ目の前の少女を見上げ、そして一言を音にする。
姫	ヴェル
主人公	ガキンッ、と鈍い音を立て、漆黒の刃が床へと付き立った。
主人公	俺は、床に座り込んだままだ。かわすどころか動いてもいない。けれどその刃は、俺の身体に届くことなく床を砕いている。
主人公	真紅の瞳が、俺を見下ろしていた。
主人公	その冷たい表情は既に崩れ、笑顔へと変わっている。
主人公	今にも泣き出しそうな、強い想いを必死に抑えこんだような、そんな、笑顔に。
主人公	そして、驚きに静まりかえる広間の中、今までとはまったく違うヴェルの言葉が響く。
ヴェル	……ヒメ
ヴェル	覚えてて……くれた……
姫	ごめん。最初は少しとまどった。俺が覚えてる姿よりも、その……なんていうか、可愛くなってたから……
ヴェル	ばか……
姫	えーと、ごめん。こういう言い方されるの嫌だったっけ
ヴェル	……違う
ヴェル	そういう台詞は、あの……二人きりの時がいい……
ヴェル	だから、ちょっとだけ待っててね。すぐに終わらせるから
主人公	その頬を恥じらいに染めながらも、嬉しそうに微笑むヴェル。その顔は俺の記憶の中にあるものよりも遙かに綺麗になっていて、俺も同じように赤面してしまう。
主人公	そしてヴェルは漆黒の鎌を片手に振り返った。その刃が、ラーロン達へと向けられる。
ラーロン	な、なんだ……？　どういう、ことだ……？　セ、セイン様？　い、いったい！？
主人公	突然の状況変化についていけず、青ざめ狼狽するラーロンパーティー。当然だ。今の状況を理解しているのは、俺とヴェルの二人しかいないはず。
