ヴェル	見ての通りよ。ヒメに敵対するあなたたちは私の敵。敵は滅ぼす。ただそれだけ
ラーロン	ば、ばかな！？　仲間に、パーティーのメンバーに刃を向けるというのですか！！
ヴェル	残念ね。私はあなたたちと行動を共にするとは言ったけれど、同じパーティーに入った覚えはないわ
ヴェル	私の組む相手は最初から一人だけ。ヒメ以外のパーティーに入るわけないじゃない
主人公	そう笑ったヴェルに、ラーロン達を絶望が包み込む。
ラーロン	だ、騙したのか！？　この私を！　ひ、卑怯だぞ貴様！　それでも誇り高き魔王の血族……
ヴェル	黙りなさい。私の誇りはヒメを守ることにある。ヒメの敵は、皆等しく私の敵よ
ラーロン	貴様、下郎Ａ！　いったい何をした！　どういう卑怯な手段をもって、セイン様を狂わせた！
ヴェル	狂ってなんかいないわ。だから言ってるでしょう。私は初めから、ヒメのパーティーだって
主人公	ヴェルは呆れたように言うと、楽しげに笑う。
ヴェル	この時を待っていたわ、ハデラ。学園で、街中で、そしてこの迷宮内で。ヒメをバカにし、ヒメを傷つけようとするあなたをこの手で砕く、この時を
ヴェル	ずっとね、ずっとずっとガマンしてたの。胸が引き裂かれそうだったわ。心を、身体を傷つけられるヒメを守るために、すぐにでも飛び出したかった
ヴェル	だけど、あなたを言葉だけで許せはしない。したくもない。そのためには理由が必要だった。学園の生徒を傷つけたとしても咎められない、その理由が
ヴェル	今なら、思い切りぶつけられる。でも、お願いだから死なないでね。ヒメは優しいから、あなたごときが相手でも、死ねばきっと悲しむもの
ラーロン	ひ、ひいぃっ！！
紅	……いったいどういうことなんだ、これは……
ウルル	にいさま……あの方とお知り合いだったんですか？
主人公	まだ信じられない、といった表情でやってくるみんな。当然の反応だろう。俺だって、こう見えても驚いているんだから。
姫	ヴェルが、昔の貸しを返しに来てくれたのさ……
主人公	そうだ、信じられないけれど、これは現実なんだ。今なら分かる。ヴェルは確かめたかったんだ。俺が、ヴェルのことを覚えているかを。
主人公	あの魔力もそうだ。制御するどころかあえて垂れ流すことで自分だって、俺に伝えようとしていた。無表情だったのも、きっと一生懸命に感情を押し殺してたから。
主人公	何も見せないことで、逆に俺に伝えようとしていた。
紅	……ずっと引っかかってはいたんだ。ラーロンたちのあまりに強引な迷宮探索。確かにそれだけの力を持っているなら利点はある。だが、そこまでする必要があったのか
紅	あれだけの力を持っているなら、普通に攻略するだけでも全然トップを取れるはずなんだ。なのに、妙な必死さを感じた
ウルル	確かに、です。別の通路を使っていたウルルたち一階級の間でも、今回は何かおかしいって騒がれていました
姫	どういうことだ？
紅	つまりだ。ヴェル、だったか。あの子がここまで必死になって急ぎ、他パーティーを潰しまくったのは、全部お前のためだったということだ
紅	あたしたちが生き残りやすい状況を作り、指輪を集め、最大の敵であるはずのラーロンたちすら倒してしまう
紅	今にして思えば、迷宮に入って早々やられていたラーロンの取り巻きパーティー。あれもあの子がやったんだろう。やられ際のセリフもそれなら納得がいく
取り巻きＡ	貴様……どんな手を……使いやが……った……
主人公	意識のあった一人は、そう言っていた。確かに、仲間だと思っていたはずの、それも魔族であるヴェルの突然の裏切り。あいつらにすれば信じられない行為だったろう。
ウルル	きっと、にいさまのために色々ガマンしてたんですね。素敵です……
主人公	目を輝かせてヴェルを見るウルル。ああ、そうか。ヴェルは本当に……本当に俺のために来てくれたんだな。
主人公	五年ぶりに再会した少女は、あの時よりも遙かに強く、綺麗になっていた。ただ違うのは、あの黒い刃が俺に向けてではなく、俺のために振るわれていること。
主人公	ヴェルの真っ直ぐな想いが伝わってくるみたいで、今はそれが、ただ嬉しい。
ラーロン	ま、待ってくれ！　いや、待って下さい！　た、助けっ
ヴェル	あなたの魔王としての生命力に、期待してるわ
主人公	そこにあるのは闇夜にも似た暗い笑み。そして、闇に浮かぶ月みたいに綺麗な笑み。
主人公	どこまでも静かに。どこまでも冷酷に。ヴェルは静かにその鎌を振るった。
ラーロン	うああああああああーーーーーーーっ！！
主人公	迷宮内に響く悲鳴。それは今までに聞いたことのない、恐怖の固まりだった。
