主人公	全ての準備を終えてさて闘技場に向かう途中、ウルルとオペラさんに事情を説明しに行った紅が二人を連れて合流する。
ウルル	に、にいさま！　アミアちゃんと決闘するって本当ですか！？
姫	決闘という程のことじゃ無いよ、ただの腕試しみたいなものさ
主人公	中庭で合流するなり、そうまくし立てるウルルに、苦笑しながら言葉を返す。
オペラ	白川さまから簡単な事情は聞きましたけれど、中々面白そうな状況になっているようですね
ウルル	実際、にいさまとヴェルさまの事は、一階級の方でもかなり話題になっていますから
紅	まあ、だろうなあ
主人公	ウルルの話を聞きつつ、苦笑する紅。まあ、ならない方がおかしいよな、普通は。
ヴェル	一階級でのあの子は、どんな感じなの？
ウルル	強いです。基本的には魔道師なんですけれど、体術の方もかなりのもので、生半可な戦士では追いつけません
ウルル	それに、取得している魔法の数も相当で、ウルルたちも知らないような魔法をいきなり使ったりするので驚かされます
オペラ	ですが、少々破壊力の高い魔法に頼る方向がありますね。焦れてくると正面から挑んでくるクセがあるようですから、ある意味料理はし易いかと
主人公	さすがというか、オペラさん、ちゃんと見てるなあ。
姫	いきなり勝負を挑んできたりした性格通りってことか
主人公	そんな情報を聞きつつ、俺達は闘技場へと辿り着く。さっそく噂を聞きつけていたのか、結構な野次馬が集まっていたが、普通に立ち入り禁止となっていた。
ヴェル	ご丁寧に、関係者以外立ち入り禁止になってたわね
紅	妥当な判断だな、そうでもしないとギャラリーで凄い事になるのが目に見えてる
ヴェル	言い換えれば、普段は見せないような魔法も使えるっていうことよ。ヒメ、今からでも遅くないわ。言ってくれれば私が……
姫	いや、向こうの目的はあくまで俺を見ることだしな。俺がいくよ
ウルル	にいさま……本当にアミアちゃんと戦うんですか？
姫	俺としては、あまり好んでるわけじゃないんだけどな。どうにも向こうが収まらないだろうし
ウルル	で、でも、さっきも話しましたけど、アミアちゃんの実力は一階級どころか三階級でも充分です。いくら第二階級のにいさまでも……
姫	実力が釣り合ってないのは、分かってるよ
主人公	心配するウルルの言葉を遮って答える。
姫	けどトップクラスの実力者と戦う事で、何かが見えるかもしれない。そう考えれば、俺にとってもいいチャンスなんだ
姫	それにまあ、俺の今の実力を見れば、彼女も色々納得してくれるよ
ウルル	にいさま……
オペラ	ウルルさま、こうなってしまった白鷺さまは誰にも止められません。ですから、私たちは精一杯応援しましょう
オペラ	白鷺さまが、明日の太陽を拝めますように、と
姫	いやそこ、応援の内容違うだろ！！
ウルル	にいさま、がんばってください！　明日の太陽が拝めますように！！
姫	……が、がんばるよ……
主人公	ほんと、オペラさんと離した方がウルルの教育にいいんじゃないのか？
アミア	あ、来た来た
主人公	闘技場の中央では、アミアが一人で待っていた。なんていうか、実に独創的な戦闘服だ。
主人公	……使い魔とか連れて変身の呪文とか唱えないだろうな。オープンなんとかとか……。
アミア	もう、遅いよ。待ちくたびれちゃった
姫	ごめんごめん、少し準備に手間取った
アミア	まあ、いいけどね。ちゃんと来てくれたんだし
アミア	それじゃあ、早速始めようよ！！
主人公	その言葉と同時にアミアの身体から魔力が吹き出す。それだけで、相手がどれほどの技量を持っているのかがよく分かる。
紅	すごい魔力だな……彼女、本当に第一階級なのか？
姫	それは間違いないな。あっはっは、逃げ出したくなってきたぞ
主人公	その魔力に気圧されないよう、わざと冗談めかして紅に答える。
主人公	試験の時にヴェルの魔力を感じていたから、こんな口調もできるけれど、あれがなかったら本気で逃げてたかもな。
主人公	ちらと見れば、横でヴェルは涼しい顔でアミアを見ていた。いや、見ているというよりは睨んでいる様に見える。
主人公	準備万端というアミアを改めて見やると、俺も愛用の剣をギュッと握った。
紅	それじゃあ、頑張れよ
主人公	紅は俺の肩を叩くと、ウルルとオペラさんと一緒に離れていく。
ウルル	にいさま、明日の太陽です！
オペラ	せめて今夜の月くらいは
主人公	……ま、まあ、色々な応援があるということで……。
姫	それじゃあ、ヴェルも離れててくれ。もう始まるから
ヴェル	ええ、分かってるわ。でも、これでいいのよ。だって私は……
姫	ヴェル？
ヴェル	ヒメの武器であり、所有魔法だもの！
アミア	はいぃ！？
主人公	ゴオッ、と、凄まじい勢いで、ヴェルの身体から魔力が吹き出す。それは、アミアが子供に見えてしまうほどに圧倒的なものだ。
主人公	その圧倒的な力に、さすがのアミアも顔を青くして慌てて叫ぶ。
アミア	ちょっ！　ちょっと待ってよ！　これはわたしと、白鷺さんとの勝負だよ！？　手出しは……
ヴェル	だから言ったじゃない。私はヒメの武器なの
主人公	しかしその言葉を遮って、ヴェルが俺の前に出る。
ヴェル	戦闘に自分の武器を使うのは当たり前でしょ。あなたが杖を持っているのと同じだもの。だからこの場で私があなたを排除するのは何の問題も無いわ
アミア	そ、そんな無茶苦茶な！？
ヴェル	あら、無茶苦茶はお互い様でしょ？
ヴェル	いきなり教室に殴り込んで、決闘申し込んでくるぐらいなんだから
ヴェル	それにねえ、今日は本当なら、これからヒメと楽しいデートのはずだったの。私もね、ちょおーっと、腹に据えかねてるものがあるのよ……
ヴェル	さあ、始めましょう
主人公	ヴェルの顔に笑みが浮かぶ。それに反して、アミアの顔が恐怖に引きつった。こ、これはさすがにやばい。ヴェルの奴、本気だ。
姫	ちょっ、ちょっと待った、ヴェル！
ヴェル	待っててねヒメ、すぐに終わらせるから
姫	いやいや、終わらせないでいいから。待った！　ストーップ！
姫	ヴェルの気持ちは嬉しい！　だけど今は押さえてくれ！　ここは俺にやらせてくれ！
ヴェル	ヒメ……もしかして、私は不必要？
姫	うっ……
主人公	上目遣いに、目に涙すらためてこちらを見るヴェル。その顔に俺は一瞬言葉を失ってしまう。ここでその顔は反則だろう。
姫	そ、そんな事はない！　ヴェルの気持ちはありがたいし、正直そこまで思ってくれるのは嬉しい！
姫	でも、今回は押さえてくれ！　俺の為にも、頼む！
主人公	しかし、ここで引くわけにはいかないと、まくし立てるように言葉を紡ぐ。
姫	いざと言うときはもちろん助けてもらうけど、今回の戦いは俺自身の為でもあるんだ。それにヴェルに頼りすぎて、依存するようにはなりたくない
ヴェル	私は、ヒメが依存してくれても構わない。ううん、頼ってほしいの……
姫	俺が嫌なんだ。ヴェルに頼りすぎて自分が弱くなるのが許せない。だからこういう場面では引いてくれ、頼む
主人公	ヴェルはしばらく俺の瞳をじっと見つめた後、消沈したようにうつむいた。
ヴェル	分かった、ヒメがそういうのなら……
姫	ありがとうヴェル
アミア	わ、わたし、助かった……？
ヴェル	覚えておきなさい。今日のあなたの命があるのは、ヒメのおかげだっていうことを……
アミア	は、はいいっ！！
主人公	ギロリ、とアミアを睨んで、とぼとぼとみんなの元へ歩いていくヴェル。その背中が本当に寂しすぎて申し訳ない気持ちでいっぱいになる。
主人公	……あとでどうにかして埋め合わせしないとな。
姫	悪い、待たせた
アミア	い、いえいえいえいえ。あの、こちらこそ命を救っていただきまして感謝感激雨あられです……
アミア	うう。まさか、あなたの毒牙がここまで凄いとは……
姫	いや、その言い方は勘弁……
姫	でもまあ、ヴェルの事、悪く思わないでくれよ、悪気があったわけじゃないんで
アミア	ああ、それは、うん。白鷺さんの事を守ろうと必死なの、分かるから
アミア	聞いたことないよ、あの魔界の黒翼が全身全霊をかけて守ろうとする相手。それに、教室の時もそうだったけど、白鷺さんの言葉だけは、しっかり聞くの
アミア	一体どんな魔法使ったの？
主人公	純粋に疑問だと首を傾げるアミアに、俺は苦笑しながら答える。
姫	別に特別な事は何もしてないよ。特別な事はね
アミア	ふ～ん……
姫	そんな事より、早く始めよう。じゃないと日が暮れちまう
主人公	こちらの言葉に納得がいってなさげなアミアに、勝負を促す。それを聞いて本来の目的を思い出したのか、アミアはそうだったと笑顔になった。
主人公	本当に表情がころころ変わる子だなと、つい微笑んでしまう。
姫	それで、ルールはどうするんだ？
アミア	勝負を申し込んだのはわたしだもん、白鷺さんが決めていいよ
姫	そうだな……時間制限無しの一本勝負にしよう。勝敗は先に相手に有効打を当てた方が勝利で
主人公	一般的な組み手のルールに則った対決法。これが一番手っ取り早く優劣を付ける方法だろうと提案すると、アミアもそれでいいと同意した。
姫	さて、それじゃ始めようか
アミア	了解～♪
主人公	俺は帯刀した剣を抜き放ち、正眼に構える。アミアもどこから取り出したのか杖をこちらに向けた。
アミア	それじゃあ見せてもらうね。ヴェルさんを引きつけたその実力を！
姫	いや、さっきも言ったが、俺は二階級でも最下級なんだ。だから期待外れでも怒らないでくれよ
アミア	まったくもう、また謙遜して。そういうのはいいって
主人公	そうして互いに言いたい事を言い切った後、
オペラ	始め！
主人公	オペラさんの合図の声が響いた。
主人公	さて、どう動くか。この距離だと、俺の間合いまでは……。
主人公	相手との距離を測りながら自分の間合いまで接近する方法を考える。すると視界の中で、アミアが先に動いた。
アミア	それじゃまずは！　小手調べ！
主人公	そうアミアが宣言した瞬間、彼女の周囲に魔力で生み出した光弾が複数生まれる。
姫	！
アミア	いっけぇ！
主人公	まずい、そう思った時にはもう遅い。次の瞬間、アミアの周囲に停滞していた魔力光弾が、一斉に俺に向かって放たれる。
姫	ちっ！
主人公	横っ飛びに大きく飛んでどうにか、第一波をかわす。
主人公	光弾はつい一瞬前まで俺のいたところに命中すると、破裂音と共に地面を抉った。
主人公	魔族の王女たるヴェルとは比べるまでもない破壊力だが、それでも相当量練り込まれた魔力光弾を防ぐ術は、今の俺には無い。
主人公	なんといっても、一切の魔法を使えない俺だ。
アミア	まだまだ、いっくよ～！
主人公	動きを止めたら、撃ち抜かれる！
主人公	アミアの言葉にさらに数を増やす光弾を見て、全力で走り出す。
主人公	光弾を防ぐ術が無い以上俺に出来る事は逃げ回ることしか出来ない。おそらく一撃でも今の俺には耐えられないだろう。
姫	とにかく、接近して剣の間合いにさえ入れれば……
主人公	ウルルから聞いた話でも、アミアは生粋の魔導師だ。だったら接近して剣の間合いにさえ持ち込めれば俺にも勝機はある。
主人公	そう思った直後だった。
姫	痛っ
主人公	光弾が足下をかすり、一瞬速度がゆるむ。瞬く閃光に目がくらんだ、その刹那、
アミア	どうしたの？　逃げてばかりじゃ勝てないよ
姫	！？
主人公	視界に、紅もかくやと言う速度で飛び込んできたアミアの姿が写る。
姫	自分から接近して来た！？
主人公	予想外の行動に動揺するが、紅との組み手のおかげか、反射的にアミアへ斬りかかる。
主人公	しかし、
アミア	遅いよ！
姫	ぐっ！
主人公	アミアの方が一瞬早い。手に持った杖を横凪に振ってくる、剣と杖とがぶつかり合った一瞬の拮抗の後。
姫	ぐぁ！
主人公	予想外の力に俺は地面を削りながら、後ろに押し返される。
姫	冗談だろ。今の重さが魔道師の攻撃か！？
主人公	彼女はその華奢な身体からは想像出来ないほど重い一撃を繰り出してきた。
主人公	見ると先ほどまで普通の杖だったものが、今は強い光に包まれて剣の様な形状に変化している。
姫	それは一体どんな手品なんだ？
主人公	先の一撃で再び開いた間合いを保ちながら、仕切り直しの意味も含めてアミアに問うとアミアは心底楽しそうに答えてきた。
アミア	えへ。魔力で武器を包んで、どんななまくらでも業物へと変える付加魔法
アミア	アミアの得意魔法の一つだよ♪
主人公	なるほど、付加魔法か。
主人公	確かに神族は武器や自分自身に魔力を込めて強化する補助魔法を得意としているが、それでも、ちょっと強力すぎるだろう、この付加魔法。
姫	一応確認しておくけど、君は魔導師だよね？
アミア	そうだよ、ごく普通の魔導師
姫	くっ！
主人公	おしゃべりはここまでと、再び展開される光弾、しかもそれは明らかに先ほどより大幅に数を増している。
アミア	お互いに小手調べは十分でしょ？　そろそろ本気でいっくよぉー！
姫	このまま逃げ回っててもじり貧。なら！
主人公	俺は光弾の放たれる一瞬前に、アミアに向かって走り出す。遠距離攻撃の手段を持たない以上、距離をとって逃げ回っていてもじり貧になるだけだ。
主人公	だったら、多少無謀でも一か八か最短距離でアミアの元へ走り抜ける。
姫	これでっ！
アミア	甘いよっ！
主人公	一斉に放たれた光弾が俺の身体を掠り皮膚を抉る。俺はそれでも構わず愚直なまでに、アミアに向かって走り込んだ。
姫	もらったぁ！
主人公	多少の運にも助けられ、浅い傷をあちこちに負いながらもアミアに肉薄する。いくら強力な付加魔法を持っていようと、純粋な剣技ではこちらに分があるはず。
主人公	そう思い、渾身の力で踏み込み大上段から剣を振り下ろす。
主人公	しかし、
アミア	その程度なの……？
姫	！？
主人公	こちらの全力の一撃を、アミアは光り輝く杖をもって、『片手で防いで見せた』。
姫	まだ、まだあっ！
主人公	全力の一撃を止められた動揺で、一瞬動きが止まりかける。けれどそれを何とか耐え、このチャンスを逃すまいと連撃を見舞う。
アミア	だから、おっそい！
主人公	だが、その全てをアミアはこともなげに弾いた。
姫	本当に魔導師かよ！
主人公	その一瞬の打ち合いで悟ってしまう。近距離戦ですら、俺は彼女にかなわない。その事実が一瞬だけ動きを鈍らせる。
アミア	隙あり！　今度はこっちの番だよ！
姫	しまった！
主人公	こちらの連撃の合間を縫って振られる光の杖。それを何とか剣で防ぐが、一撃の重さに耐えきれず、思わず後ろに跳んで間合いを離してしまう。
アミア	逃がさない！
主人公	そこにすかさず飛んでくる攻撃魔法。今度は光を収束させた光線が、一直線に俺に向かって放たれる。
姫	！
主人公	なんとか身をよじって直撃を避けたものの、光線はこちらの脇腹をかすり、鈍い痛みを残していった。
姫	また、振り出しか……
主人公	再び間合いを外されてしまった。また、アミアの魔法弾幕を避ける所からやり直しだ。
主人公	その後、降り注ぐ光弾や光線を何とか避けながら、必死に接近を試みるが、弾幕が厚すぎて容易には近づけない。
主人公	偶然に助けられつつ、なんとか接近しても、アミアの持つ杖に阻まれ結局間合いを外される。
姫	まったく！　何が普通の魔導師だっ。ここまで接近戦に秀でた魔導師なんて聞いた事がないぞ！
主人公	そうやけっぱち気味に叫ぶと、アミアは笑いながら言い返してきた。
アミア	前衛の陰に隠れて砲台やってる魔導師なんて、もう古いよ！　今は魔導師だって前衛に混じって戦う時代なんだから！
アミア	まぁ、わたしの持論だけどね
主人公	そういって、魔法で姿勢が崩れた所に、直接光の杖をたたき込むアミア。その攻撃に防戦一方の俺。
主人公	ここまできてやっと俺の実力に気づいたのか、アミアの攻撃がやんだ。
姫	はぁ……はぁ……
アミア	分からない……
主人公	そして、困惑しているような声が飛んでくる。
アミア	あなたの、白鷺姫っていう人族のことが分からないよ
アミア	あなたの実力、よく分かった。だけど、だったら、なんであのヴェル＝セインが、あそこまで惚れ込むの？
アミア	そんな力しかないあなたが、なんで他の種族の子供を守るために魔王の血族なんかにケンカを売るの？
アミア	あなたのことが、分からないよ……
姫	俺にも分からないな。何度も言ってる通り、これが俺の実力だ。隠してるものなんて何もない
姫	ヴェルのことも、シャルのことも、あくまで俺が感じて、したいと思った通りに動いてきただけだ。そこには本当に何もない
姫	そんな俺の、何を知りたがってるんだ、君は
主人公	そんな俺の言葉に、アミアはしばし難しい顔で考えた後、
アミア	……試させてね
主人公	決意に満ちた声でそう言うと、杖を構えた。端から見ても分かるほどの膨大な魔力が、その杖へと注がれていく。
アミア	見せてあげる。これがわたしのとっておき――だよ！
姫	なっ！？
主人公	膨れあがる魔力に思わず一歩引いてしまう。魔力は杖のキャパシティを完全に超えて注ぎ込まれ、あふれ出た魔力が紅い魔力光となって杖を包み込む。
アミア	はぁぁぁぁぁぁぁぁ！
主人公	アミアの声と共にさらに魔力は膨れあがり、あふれ出た紅い魔力光がやがて炎へと姿を変える。
主人公	魔力によって生まれた炎は杖を中心に螺旋を描きながら空へと伸び、やがて安定すると、杖を中心に収束、炎で紡がれた巨大な剣の形となる。
姫	ほ、炎の剣！？
アミア	ふぅ……やっぱり、これ作るのきっついなぁ……
主人公	アミアの身体よりも遥かに長い巨大な炎の剣。端から見ているみんなまでが、驚愕に息を飲む。
ヴェル	まさか、レーヴァテイン！？
アミア	あったりっ。遙か昔、魔族に伝わっていたという炎の超呪文。その魔力効率の悪さと制御の難しさから、いつしか忘れられた古代魔法
アミア	まだまだ研究中で、そのすべてを再現できたわけじゃないけど、威力だけは折り紙付き！
主人公	そ、そういえば、以前にオペラさんが言ってた気がする。
オペラ	アミアさま、神族の中でもかなりの魔法オタクとして有名ですから。普段はお目にかかれないような魔法を会得されてるようですし
主人公	にしたって、こんな魔法まで会得してるってのはやりすぎだろう！
主人公	こうして見ているだけで分かる。この炎に込められた魔力は尋常じゃない。こんなの食らったら、城壁だって一溜りもないだろう。
主人公	魔力効率も何も、これだけ巨大な炎の剣を生み出すにはかなりの魔力が必要なはずだ。
主人公	しかもその魔力を完全に制御しなければ不可能。どんな魔法技術があれば、こんなもの作り出せるんだ。
アミア	最初に言っておくけど、この魔法『手加減は一切出来ない』から
姫	なんだって？
アミア	つまり、当たると、ちょーっと痛いかもしれないから、がんばって避けてね
主人公	アミアの言葉に一瞬で顔から血の気が引いていく。あんなものくらったら、ケガどころか間違いなく命が危ない。いや、肉片一つ残らないだろう。
ヴェル	ヒメ！　逃げてっ！！
ウルル	きゃぁぁぁ！　にいさま逃げてださい！！
紅	まずい！　逃げろ姫！！
オペラ	白鷺さま！
主人公	離れて応援していたメンバーも、さすがにまずいと思ったのか、せっぱ詰まった声を上げている。
アミア	そっれじゃぁ！　いっくよぉ！！
主人公	そうして、一切の容赦も無く振り下ろされる炎の剣、俺はとにかく直撃だけは避けようと、思い切り地面を蹴る。
主人公	確かに直撃はしていない。むしろ炎剣自体は『完全に回避していた』それでも……、
姫	うあぁぁぁぁぁ！
主人公	それでも、振り下ろされた剣が地面に炸裂したその余波だけで、俺の身体は容易く吹き飛ばされていた。
ヴェル	ヒメ！　今行くから堪えて！
主人公	盛大に吹き飛ばされた俺を見て、ヴェルが飛び出そうとするのが見える。だが俺は受け身をとり素早く立ち上がると、
姫	来るな！！
主人公	叫ぶような口調でヴェルを制した。
ヴェル	っ！？
主人公	その叫びに、ヴェルの身体が硬直する。
姫	まだ勝負は終わってない！
ヴェル	で、でもっ！
ヴェル	……分かった、わ……
主人公	俺の目を見て引かないと分かってくれたのか、飛び出したいのを必死に我慢して、その場にとどまるヴェル。その瞳には涙が溜まっている様にも見えた。
主人公	……ごめん。
主人公	内心でヴェルに謝りつつ、再び振り上げられる炎剣へと視線を向ける。
アミア	……いいの？
姫	ああ
主人公	アミアはさっき『試させて』と言った。だからこれは、俺が受けないといけない。そうでなければ俺は負けたことになる。
主人公	挑みもせずに、負けたことになるんだ。
姫	男っていうのは、女の子の前で格好をつけたがる生き物でさ。どうせ負けるにしても、徹底的に足掻いた上で負けないと格好悪いだろ
アミア	なるほどね。それじゃあ、わたしにもぜひ見せてほしいかなっ
主人公	再び炎の剣が振り回される。俺は大きく後ろに飛ぶと、その余波からも距離を取る。
姫	なるほどね……
主人公	確かに一撃の威力は凄まじい。けれど攻撃魔法の弾幕があったさっきまでと違って、今は炎剣だけの攻撃しかない。
主人公	あれだけの魔力を制御するとなれば、さすがに余裕は無いんだろう。先ほどまでのような攻撃魔法の弾幕は張られてない。
主人公	だとすれば、あの大きさだ。何とか接近してしまえば。
姫	まあ、問題は、どうやって接近するかなんだけど！
アミア	ほらほら！　ぼうっとしてたら危ないよ！
