主人公	目の前に迫った炎剣を避けるために、横っ飛びに地面を転がるがやはり地面に炸裂した衝撃で吹き飛ばされる。
姫	痛ってぇ……これはちょっとハードすぎるだろう
主人公	炸裂するのは衝撃だけじゃない。地面を抉るたびに巻き上げられるつぶてが全身を撃ってくる。それだけで息が詰まりそうになる。
ヴェル	ヒメっ！
主人公	もはや泣きそうなヴェルの声に、強がりでも笑い返そうと視線を向ける。瞬間、昼間の授業中にヴェルに言われた事が、頭の中で蘇った。
ヴェル	相手の攻撃が目前に迫ってからじゃあ、もうかわせない。超人的な身体能力があるならまだしも、少なくとも今の姫はそれを持っていない
ヴェル	考え方自体は間違っていない。ただ行動に移るまでのプロセスが長すぎるだけ。相手を見てから動いていたのじゃ今のヒメじゃ攻撃をかわせない
ヴェル	だから、相手の『今』でなく『先』を見て。ヒメの目なら充分に見れるはず。相手の行動から、その先を予測して
姫	ほんと、昼間に言われたばかりなのになあ、もう忘れてた
主人公	そんな自分に、思わず苦笑してしまう。
主人公	そうだ、相手の懐に飛び込むのに相手が攻撃してからじゃ間に合わない。ならどうするか。答えは一つ、行動を先読みして先手をとる！
主人公	ぶっつけ本番でやってみるには少々リスクが大きそうだが、これができなきゃ強くはなれない。
アミア	まだまだ、行くよぉ！
主人公	再び、振り上げられる炎の剣。視線をそらさずに相手を見て、必死に観察する。
姫	確かにあの剣は威力が高いけど、その分攻撃自体は単調だ。だったら、今の俺でも充分読み切れる！
姫	ぐっ！　まだまだぁ！
主人公	幾度も炎剣に吹き飛ばされながらも、必死でその軌道と動きを観察する。
主人公	振り下ろすタイミング、狙う場所、そこへ至る軌道、炸裂後の衝撃範囲、その全てを読み切れ。
主人公	アミア自身がまだ研究中と言ったように、制御に難があるのか、どうやら炎剣で行えるアクションは単純に振り回すだけしかできないようだ。
主人公	しかもあの大きさだ。アミア自身が炎剣に振り回されている感があり、一度振り下ろせば地面に炸裂するまでその軌道は変えられない。
姫	だとしたら、狙いは一つ！
主人公	剣が、振り下ろされる瞬間。
主人公	俺は次の攻撃に飛び込む覚悟を決めると、アミアが剣を振り上げた瞬間に身構える。
主人公	チャンスは一度、二度目は無い。そう決めた瞬間、思考が一気にクリアになる。アミア以外のものは視界の外に流れ、時間の流れすら遅くなったように感じる。
主人公	そしてアミアが炎剣を振り上げ、こちらに狙いを定めて振り下ろそうとした瞬間……
姫	ここ……だっ！
主人公	俺は残る力の全てを振り絞り、全力で地面を蹴った。
アミア	え！？
主人公	突然の俺の行動に、アミアが驚きの声を放つ。今更気づいても、もう遅い。振り下ろされた炎剣は、もう止められない。
主人公	俺の予測通りの場所に炎剣が炸裂し、衝撃波が発生する。
姫	痛いぞ、ちきしょうっ！
主人公	しかし俺は、その直前に軽くステップを踏んで衝撃範囲から離脱していた。そのまま巻き上がるつぶてを堪えつつ、再加速して一気にアミアに肉薄する。
アミア	嘘っ！
主人公	振り下ろされた炎剣を再び振り上げる時間は既に無い。完全に無防備状態のアミアに向けて、俺は走り込んだ勢いのまま剣を振るう。
姫	もらったあ！
アミア	きゃああああああ！！
姫	はうっ！
主人公	次の瞬間、世界が反転していた。俺の身体が空中に舞っているのが分かる。これって、つまり……。
主人公	視界の中に、アミアがいた。その顔は驚きに強張り、炎の剣はもうその手にない。こちらへと突き出された手の平から小さな煙が上がっていた。
主人公	そしてゆっくりと、俺は地面に落ちる。
姫	あうっ
主人公	受け身もとれず、地面に倒れ、急速に闇に落ちる意識の中。
ヴェル	ヒメっ！　ヒメェっ！
主人公	ヴェルの声とみんなの駆け寄る音が、やたら遠くから聞こえてきた。
主人公	そしてそれがアミアとの勝負、その決着の合図となった。
