主人公	学園についてからＨＲが始まるまでのわずかな時間。今までならラーロン達が煩わしくちょっかいをかけてきたものだが、試験以降はさすがにそれも無くなった。
主人公	俺は、ヴェルや紅と一緒に、他愛も無い会話をして時間を潰す。
紅	今日の午後は、迷宮を使った実習らしいな
姫	ああ。準備はそれなりにしてあるし、さすがに試験の時ほどのモンスターはいないだろうからな。大丈夫だろう
姫	とはいえ、やっぱり、迷宮探索っていうのは何度経験しても緊張するな
ヴェル	今回は私も最初から一緒に行動するから安心してていいわよ。ヒメには傷一つ付けさせないから
ヴェル	あ、もちろん紅にもね
紅	ああ。ヴェルがいてくれるっていうだけで心強さが違うからな助かるよ
主人公	そんな感じで午後の授業について軽く話していた時だった。
？？？	す、すみませんっ！！
主人公	突如教室の扉が勢い良く開き、クラス中に大声が響き渡る。
主人公	その声に一斉に扉へと移るクラスメイト達の視線。なんだろう、この光景を俺はやたらと知っているような気がする。
主人公	送った視線のその先には、長い銀髪を揺らした、一人の美少女が立っていた。
主人公	ノート＝ルゥム。神界の王女にして、切り札と呼ばれる少女。
ノート	あ、あぅ……
主人公	一斉に注目されたことに驚いたのか、ノートは一度怯んだように身をすくませるものの、やがて意を決した様に大声で訪ねる。
ノート	あ、あの！　白鷺姫さんはどちらにいらっしゃいますか！？
主人公	直後、今までノートがさらされていた視線の集中砲火の矛先が、ぐりん、と一斉にこちらへと向けられる。その視線は皆一様にこう語っていた。
主人公	その視線がノートに正解を教えたらしい。その目が見事に俺と合う。そして、ぱたぱたと駆け寄ってくる神界の銀月。
主人公	ノートは俺の前までやってくると、
ノート	すみませんすみません妹がすみません！
主人公	怒涛の勢いで頭を下げまくってきた。
姫	い、いやあの……
主人公	想定外の光景に、頭の中が白く染まる。
ノート	悪気があったわけじゃないんです！　あの子、思い立ったらすぐ行動しちゃう子で……本当にすみません！　きつく言い聞かせますから！！
ノート	すみませんごめんなさい許して下さいいっ！！
姫	……
紅	……
ヴェル	……
主人公	状況についていけずに、思わず目を合わせてしまう俺達。これはいったい、どういう態度をとればいいんだろうか。
主人公	だがそんな俺達を、聞き覚えのある声が現実に連れ戻す。
アミア	もう、お姉ちゃん。そんなに謝らなくても大丈夫だよ
主人公	いつの間に現れたのか、アミアがぴょこんと目の前に立っていた。
姫	あれ？　アミア？
アミア	やっほー。お兄ちゃん、おっはよう
主人公	ひらひらと手を振りながら挨拶をするアミアの姿にノートが気づく。
ノート	こ、こらぁっ、もっとちゃんと反省しなさい！　す、すみませんすみません本当にすみません！
主人公	ノートは慌てて注意すると、再び猛烈な勢いで頭を下げ始めた。その姿はなんだか妙に可愛らしくて、俺が抱いていた彼女の姿とはまったくの別ものだ。
主人公	神界の切り札、神界の銀月、完全銀髪（グラン・ルナ）。様々な二つ名と共に伝え聞いた勇名から、もっと勇ましい少女だと思っていた。
主人公	この前、中庭で見たのはアミアのいたずらのせいで、本当の彼女はもっと違う姿なんだって。
ノート	あうぅ……本当に、本当にすみません……ごめんなさい！
主人公	けれど未だ何度も頭を下げる彼女は、どこからどう見ても普通の少女だ。そんな姿を見て、何故か嬉しく感じてしまう。
主人公	そして、そんな彼女の横で、相変わらずニコニコと笑っているアミア。なるほど、昨日の件を知って慌てて飛んできたわけだ。びっくりするくらい律儀な子だなあ。
主人公	でもまあ、だったら仕方ないか。
姫	えーと、ノートさん？
ノート	は、はい！
主人公	俺が声をかけると同時、彼女はビクン、と跳ねるように顔を上げた。そのまま直立でこちらの言葉を待つ。
姫	いや、そんなにかしこまらなくても
主人公	そんな姿に、つい苦笑してしまいながらも俺は言葉を続けた。
姫	昨日のアミアの事だったら大丈夫、全然気にしてないよ
ノート	はい？
主人公	予想外の俺の言葉に、ノートは唖然とした表情で首を傾げる。
姫	むしろさ、いい訓練にもなったし。俺も自分に足りないものとか、色々考えられたから
ノート	で、でも、あの……
主人公	笑顔で答える俺の言葉が信じられないのか、ノートはアミアの方へと視線を向ける。アミアは当然とばかりに頷いた。
アミア	ほらね、だから言ったでしょ
ノート	あ、あなたはもっと反省しなさい！　ほ、本当にすみません！
アミア	だから、気にしなくていいって
姫	ちなみに、それは本来俺の台詞であってアミアの台詞じゃないってこと、分かってるか？
姫	まったく、全然反省してないだろ、アミア
アミア	もう、わたしって信用ないなあ。こんなに反省しまくりなのに
アミア	ごめんね、てへ♪
紅	実際にしたかどうかはさておき、ここまで反省の色を感じない謝罪も珍しい
ヴェル	むしろ清々しさまで感じるわ
主人公	やれやれ、と肩をすくめて苦笑する俺に、アミアもえへへ、と笑顔を浮かべる。その光景を、ノートは意外そうに見つめていた。
ノート	あ、あの……アミちゃん？
アミア	なに、お姉ちゃん？
ノート	この人、もしかして……すっごく優しくていい人、ですか？
アミア	そうだよ。だからそう言ったじゃない
主人公	いや、なんか目の前でそういう風に言われると気恥ずかしいものが……。
ノート	ち、ちょっとすみません……
主人公	そう言って、俺の手をいきなり掴んでくるノート。俺はその意味が分からず、黙ってその様子を眺めていると、ノートの端正な顔が次第に小さな笑顔へと変わる。
ノート	この人、怖くないっ
アミア	ほら、チャンスだよ、お姉ちゃん
ノート	え？　あ……
姫	？
主人公	ニヤニヤと笑いながらのアミアの言葉で、瞬時に真っ赤になるノート。一体どうしたのかと首をかしげていると、意を決した様に俺を見る。
ノート	あ、あの！
姫	は、はい、なんでしょうっ
主人公	ノートの勢いに若干気圧されて、思わず直立不動になってしまう。あれ、なんか立場逆転してないか。
主人公	そして、ノートはそのまま一度大きく深呼吸をすると、
ノート	お、お友達からおねがいします！！
主人公	とんでもない爆弾発言を投下してくれた。
姫	……はい？
紅	……
ヴェル	……
アミア	お姉ちゃん、頑張った
主人公	一体何度目だろうか、この凍り付いたような冷たい空気を味わうのは。
主人公	クラスメイトを始め、ヴェルや紅までが言葉を失っている。まあ、けしかけたアミアだけはやたらと楽しそうなんだけど。
ノート	え？　あ、あの……ボク、何か間違えました？
姫	い、いやその……間違ってないといえば確かに間違ってはない、と思うんだけども……
ノート	よ、良かったです。ボク、こういうのあまり慣れてなくって……
ノート	そ、それで……ダメ、でしょうか……？
主人公	まるで拾ってくれる人を待っている子猫みたいな顔で、俺を上目遣いに見上げるノート。
主人公	この顔でこの表情は、その……ズルイだろう……。
アミア	さあ、お兄ちゃん、返答やいかに！
主人公	一人楽しげに煽っている少女にそこはかとない殺意を覚えつつも、俺は改めてノートを見下ろした。
主人公	神界の銀月。そう謳われるに値する容姿の持ち主。長く艶やかな銀髪は完全銀髪。神界の至宝の証。神界の切り札とまで言われる、トリニティでも最強クラスの少女。
主人公	だけどその実態は、妹の行動に大慌てで飛び込んで謝りまくって、こんな風に真剣一途な目で友達になってくれなんて言ってくる、どこかか弱さを感じる女の子。
主人公	そう。ごく普通の女の子だ。
姫	俺なんかでよければ、喜んで
主人公	そんな友人が増えることを喜びこそはすれ、嫌がる理由は一つもない。俺は笑って右手を差し出した。
ノート	あ……
主人公	その表情が、ぱあっと花開くかのように笑顔へと変わる。
主人公	神界の銀月。その呼び名は、この笑顔のことを言ってるんじゃないかと思ってしまう、そんな笑顔に。
姫	ええと、白鷺姫です。その、人族だけども……
ノート	はい。ノート＝ルゥムです。アミちゃん共々、よろしくお願いします
主人公	そんなの関係ありません、とばかりに俺の手を取るノート。それは思っていた以上に小さくて、温かくて、柔らかい。
アミア	ふつつかな姉ですけど、よろしくね、お兄ちゃん
ノート	こら、アミちゃんっ。やっぱり反省してないでしょう！
アミア	そんなことないよ、ちゃんとしてるよ。それじゃあ、そろそろ授業が始まっちゃうから、わたしたちは行くね。お兄ちゃんたち、また後で～
主人公	そして、軽い足取りで廊下へと出て行くアミア。
ノート	す、すみませんでした。本当にお騒がせしました
主人公	そして、ぺこりと頭を下げて、その後を追うように教室を後にするノート。
紅	……どんな台風だったんだ、今のは……
ヴェル	なんていうか、試験の時とはまるで別人ね……
主人公	まあ、本当に仲のいい姉妹ということは間違いない。にしても……
姫	まさか本当に神界の銀月が来るとは
主人公	こんなことってあるんだなあ……。
ヴェル	ところで姫、手、出して
姫	手？　別にいいけど何を……
主人公	いい終わらないうちに、ヴェルは俺の差し出した手を握ってくる。さっきのノートに負けず劣らず、こっちも温かくて柔らかい。
姫	ヴェ、ヴェル？
ヴェル	いいから、黙ってそのままでいてっ
姫	は、はい！
ヴェル	むぅ……ヒメったら、あんな簡単に……でも、ヒメの友達になったなら戦うわけにもいかないし……
主人公	何か拗ねたような顔で、ブツブツと呟き出すヴェル。やがて鐘が響き授業が始まるが、結局それから一時間ばかし、ヴェルは手を離してくれなかった。
紅	まあ、男冥利ってやつじゃないか、姫
主人公	などと笑っている紅が、なぜかやっぱり怖く思えたのは言わないでおこう。
主人公	……でもこれ、やっぱりヤキモチ……？
