姫	ふう、さすがに疲れたな
主人公	ベッドの上に身体を投げ出し時間を見れば、もう数時間で日が変わろうという時間だった。
主人公	残った料理はみんなで分け合い、片付けもさすがに超スーパーなメイドさんことオペラさん。手際よく終えていってくれた。
姫	ほんっと、騒がしかったなあ。ウルルもヴェルも、普段はもうちょっと静かなイメージだったんだけどな
紅	そうだな。あたしもちょっとビックリだった
紅	でも、楽しかった、だろ？
姫	何故、ばれた
紅	思いっきり太字で顔に書いてある
主人公	言われて、自分が笑っている事に気がついた。
主人公	人族として蔑まれてきた俺達の周りは、いつもどこか閉塞的だった。だけど、今はもう違う。それを、今日のみんなは教えてくれた。
主人公	ここ数日で急に変わった俺の周囲。俺はそれを戸惑いながらも、ちゃんと楽しんでいるらしい。
姫	ちなみに、紅の顔にも書いてあるぞ。額に『楽』って
紅	……寝ている間に本当に書くなよ
姫	さあて、な。起きたらまずは鏡と相談してみてくれ
主人公	そんなことを言い合いながら、俺達は互いに床についた。
主人公	どうやら俺達は本当についているらしい。だって、こんなにも。
主人公	友人達に恵まれている。
