主人公	今夜は静かないい夜だ。聞こえるのは微かな風の音だけ。窓から漏れる部屋の明かりもいくつかは消え、眠りについているのが分かる。
主人公	俺は寮の玄関前で、日課の素振りを続けていた。
姫	４９５……４９６……４９７……
主人公	振り下ろすたびに数をカウントしながら、ただひたすら同じ動作を繰り返す。
姫	４９９……５００！
主人公	そうして、いつも通りの回数をこなしたところで、俺は静かに剣をおろした。
姫	ふぅ……
ヴェル	お疲れ様
姫	ヴェル？　いつから……
主人公	突然横から差し出されたタオルに驚き振り返れば、そこにはヴェルの姿があった。
ヴェル	２００ぐらいからかな。集中してたから声かけなかったけど
主人公	どうやら、こちらに気を使って気配を消してくれていたらしい。
ヴェル	はい、お水。一息入れるんでしょ？
姫	ああ、ありがとう
主人公	ヴェルからコップを受け取り、それを口に流し込む。乾いたのどにはそれが非常にありがたかった。
姫	サンキュー。一息つけた……って、ヴェル？
主人公	コップの中身を飲み干し改めて礼を言おうとした所で、ヴェルの様子が少しおかしいことに気がつく。
主人公	どこか元気なさげにうつむいたままのヴェルに、俺は声をかけてみた。
姫	どうかしたのか、ヴェル
主人公	俺の言葉に、様子を伺うようにチラリと顔を上げるヴェル。そのまま周囲を見回し誰もいないことを確認すると、静かにこちらに近寄り抱きついてきた。
姫	お、おい、ヴェル？
ヴェル	ごめん、しばらくこのままでいさせて
姫	……
主人公	突然の事で思わず手を離してしまったコップが地面に落ちる。幸い下は芝生だったので割れることはなかった。
ヴェル	ごめんなさい……
主人公	不意に、悲しそうなヴェルの声が響いた。
姫	え？
ヴェル	私、ヒメを守れてない……
ヴェル	ヒメの武器として、ヒメを最強にする。そう誓ったのに、約束したのに……
ヴェル	アミアの時も今回のデイルの件も……結局ヒメを守れてない……
主人公	俺に抱きつくヴェルの手に力がこもる。それが、ヴェルの想いを、悔しさを俺に伝えてくれた。
主人公	俺が、自分が強くなるためと自分自身で動いてしまったことを、ヴェルはこんな形で悔やんでたんだ。
姫	そんなことはないよ
主人公	俺はそっとヴェルの両肩に手を置いた。思っていたよりも遥かに細いその肩は、ヴェルが最強の魔族である前に、一人の女の子であることを教えてくれる。
姫	ヴェルは守ってくれてるよ。試験の時だって……いや、いつだって
ヴェル	……ヒメはあの時、私を守ってくれた。あんな状況だったのにも関わらず……
ヴェル	私も、もっと強くなりたい。ヒメみたいに、強くなりたい……
主人公	俺を強いと言ってくれるヴェル。その言葉が俺に自信をくれる。俺に、きっとやれるっていう確信をくれる。
主人公	ヴェルが、俺に力をくれている。俺を守ってくれている。
主人公	だっだら俺の答えは一つだ。
姫	なら、俺も、そんなヴェルを追って強くなる
ヴェル	ヒメ……
主人公	俺の言葉にヴェルが顔を上げる。その瞳には、涙が溜まっていた。俺のことを思って、俺のために流してくれた涙だ。
姫	だから、一緒に強くなろう
主人公	そう言って笑いかける俺に、ヴェルは嬉しそうに笑ってくれた。そして小さく頷く。
ヴェル	うん。強くなろう
主人公	あの勇者のように強くなりたい。そう願って毎日剣を振ってきた。だけど、今日この日。
主人公	俺にもう一つ、強くなりたい理由ができた。
