ヴェル	よ、よし……誰もいない……
主人公	脱衣所で周囲を念入りに索敵して、私はそう呟いた。
ヴェル	しゅ、周囲に敵影なし……清掃中の札は出したし……ヒ、ヒメが中にいることも確認済み……だ、大丈夫、何も問題無い……はず
主人公	そう自分に言い聞かせるように呟くけれど、やはり今ひとつ踏ん切りが付かない。
ヴェル	ええい！　女は度胸って母様も言ってたし！　相手はヒメなんだから大丈夫！
主人公	しかし、いつまでもこうしていたところで仕方がない。あまり時間をかけすぎるとヒメが出てきてしまうかもしれない。私は勢いに任せて服を脱ぎ捨てた。
ヴェル	背中を流すだけ……ヒメの背中を流してあげるだけ。そうよ、やましいことは何もないわ
主人公	今日の特訓でボロボロになって、今にも倒れそうだったヒメの背中を流してあげる。ただそれだけなんだから。
ヴェル	ヒメも頑張ってるんだから……これぐらい、いいわよね？
主人公	誰に確認するでもなく、そう呟いて脱衣所のドアに手をかける。
ヴェル	それに、ヒメにだったら見られても大丈夫……
主人公	私は勢いとは裏腹に、ゆっくりと脱衣所のドアを開けて中に入る。
ヴェル	で、でも……やっぱり恥ずかしい……
主人公	タオルで前を隠しながらも、ゆっくりと風呂場に足を踏み入れる。ここまで来たら、あとはもう突っ走るだけ。それしかない。
主人公	私は、一気に湯船の前に降り立った。
ヴェル	ヒ、ヒメ！　びっくりしたと思うけど落ち着いて！　あの……私、考えたの！　頑張ってるヒメにご褒美というか……その、ねぎらいっていうか……
主人公	しどろもどろに自分がここに来た理由を説明しながらも、視線は明後日の方向に向いてしまう。
ヴェル	だ、だからその……せ、背中を…………あれ？　ヒメ？
主人公	だけど、そこまで言ったところで唐突に気がついた。いくら何でも無反応過ぎない？
ヴェル	あの……ヒメ？
主人公	恐る恐る視線をヒメがいるであろう、湯船の方へ向けてみる。
主人公	そこには……
姫	あぁぁぁっぁぁ……
主人公	湯船の中で、完全にのぼせておぼれかかっている、ヒメの姿があった。
ヴェル	きゃぁぁぁぁぁっ！　ヒメーーーーーー！？
