主人公	さすがに走るほどではないけれども、そこまで余裕が有るわけでもないので足早に玄関に向かう。
ヴェル	やっと来たわね
主人公	すると、そこで俺達を待っていてくれたらしいヴェルの姿を見つけた。
紅	すまない、待たせた！
姫	悪い、待たせた
ヴェル	別に平気よ。大して待ってないし。それより、はい
主人公	遅くなったことを謝る俺と紅に、ヴェルは気にしなくていいと手を振ると、手に持っていた弁当箱のような物を差し出してきた。
姫	あれ、これは？
ヴェル	その様子じゃどうせ朝食は食べる時間なんて無かったんでしょ？　だから作っておいたわ
主人公	そう言われて中身を確認すると、食べやすい大きさにカットされたサンドウィッチが入っている。
ヴェル	それなら、歩きながらでも食べられるでしょ？
主人公	どうやら俺が朝食を食べられない状況だろうと予想して、わざわざ作ってくれたらしい。
姫	悪いな、本当に助かる
ヴェル	ほ、本当？　そう言ってくれると嬉しい……
主人公	俺のお礼に、ヴェルは照れくさそうに視線を逸らしながらも嬉しそうに微笑んだ。
紅	とりあえず学園に向かおう。じゃないとせっかくの愛妻弁当を食べる余裕もなくなってしまうぞ
ヴェル	あ、愛妻弁当！？
姫	そうだな。とりあえず学園に向かおう
紅	よし、行こう――って、ヴェル？
主人公	俺達は急いで寮を出ようとするが、ヴェルは何かを呟きながら、その場に留まっていた。
ヴェル	あいさいべんとう……あ、愛妻……ヒメの、愛妻……ふふ……うふふふ
姫	おーい、本当に遅刻するぞ？
ヴェル	え？　あ！　待って！　い、今行くわ！
主人公	俺の言葉にようやく素に戻ったのか、ヴェルが慌てて駆け寄ってくる。それを確認して俺達は寮を出た。
主人公	ヴェルの作ってくれたサンドウィッチを食べながら、学園への道を歩く。シンプルながら丁寧に作られたそれは、食べやすい上に美味だった。
姫	でも、何で俺が朝食を食べる時間が無いって知ってるんだ？
ヴェル	ああ、それはね。今日の朝、食堂で紅と会って一緒に食べた後に、私もヒメの部屋を少し覗いたのよ
紅	そうだったな。なるほど、それでまだ姫が寝てるのを見て朝食の準備をしておいたのか
ヴェル	ええ。あの時点で寝てたら、到底、朝食を取るのは無理そうだったから
ヴェル	もっとも、時間的に大した物は作れなかったけれどね。それでも無いよりはマシでしょ？
姫	いや、普通に朝食を食ってたよりもよかった
紅	そうだな、あたしも少しもらったが、あの短時間で良く作れるもんだ
ヴェル	そう言ってもらうと作った甲斐があるわ
主人公	そう嬉しそうに笑うヴェル。そんな中、紅が思い出したように問いかけてきた。
紅	そういえば、姫が秘密兵器を教わったと言っていたけど、本当なのか？
ヴェル	ええ、ヒメならきっと受け取ってくれると思ってね
紅	それは気になるな。なら本番を楽しみにさせてもらうよ
主人公	今日はデイルとの決闘当日。どんな結果になろうとも、悔いだけは残らない戦いにしたい。俺はそんなことを考えながら学園に歩を進めた。
