姫	ん……
主人公	目を開けて最初に飛び込んできたのは、心配そうに俺の顔を覗き込んでいるヴェルの顔だった。
ヴェル	ヒメ……良かった……気がついたのね
アミア	あ、本当だ！　お兄ちゃん大丈夫？
姫	あれ？　俺、何で……？
主人公	一瞬状況が分からず起き上がろうとするが、全身を貫く痛みがそれを中断させた。
姫	痛ぅっ……
ウルル	あ、ダメですにいさま。まだ動いちゃ……
紅	まだ無理するな、今まで気絶していたんだからな
オペラ	それほど酷いケガは多くありませんが、それでも全身余すところなくボロボロです。なのでもう少し寝ててくださいね
ノート	はい、養護の先生が回復魔法をかけてくださったので、すぐに動けるようになると思いますよ
主人公	その言葉に身体を見ると、包帯まみれの痛々しい姿がそこにあった。それを見てようやく今の状況を理解する。
姫	俺、負けたのか……
ヴェル	……ええ、負けたわ
主人公	ヴェルの言葉に、脳裏に最後の光景が蘇る。捨て身の一撃を防がれ、逆に反撃の一撃で吹き飛ばされた。
ヴェル	もう……無茶はしないでって言ったのに……
姫	……悪い
アミア	まあ、無茶はお兄ちゃんの得意技だもんね
ウルル	分かってはいますけど、心臓に悪いです……最後、デイルさんに飛び込んだ時なんてもう……
主人公	心底心配だったという顔を見せるウルルの頭を撫でてやりつつ、俺は皆にも謝った。
姫	悪い。みんな、色々協力してくれたのに、結局歯が立たなかった
紅	そんなこと気にするな。あたしたちは好きで姫に協力してたんだからな。それに今日の動きは今までのどの特訓の時よりも良かったぞ
ノート	そうですね、やっぱり姫くんは逆境に強いです。特に最後の一撃なんて見事でしたよ？　残念ながら防がれてしまいましたけど……
主人公	確かに今日は、今まで雲の上の存在ぐらいに思っていたデイルの攻撃に、何とかついて行けた。
主人公	負けたことが悔しく無いと言えば嘘になるが、それでも充分に意味のある戦いだったと思える。
オペラ	白鷺さま、実はその試合の件で一つ、お伝えしなければいけないことがあります
姫	え？
ヴェル	そうね。実は、ヒメが気絶した後でね――
姫	デイルが、ルールを変えた？　三本先取で、俺にハンデ有り？
主人公	試合終了後のデイルの行動を聞いて、思わず目を見開く。
姫	つまり……まだチャンスがあるって事か？　でも何で……
ヴェル	分からないわ。私も試合後に問い詰めてみたけど、結局はぐらかされたわ
紅	ああ。正直デイルが何を考えているのかあたしたちにもよく分からない
主人公	一瞬、ヴェルの言っている事が信じられなかった。デイルが何故、今になって俺に有利なルールに変更したのか理解できない。
アミア	お兄ちゃんと戦うの楽しくなっちゃって、対戦の数増やしたんじゃないの？
ウルル	アミアちゃんじゃあるまいし。そんな単純な理由かな？
アミア	む！　ウルルちゃんそれ、どういう意味？
ノート	まあまあ、アミちゃん落ち着いて
オペラ	しかし、実際どういう意図でルールを変えたのでしょうね？
主人公	オペラさんの言葉に皆が首を傾げるが、当然ながらその答えは分からない。
姫	でも、これでまたデイルと戦えるんだな……
紅	はは、楽しそうだな
主人公	紅に言われて、初めて自分が笑っているの事に気がついた。そうか……何だかんだいって俺もデイルと戦う事が出来るのが楽しいのか。
ヴェル	まったく。今日これだけボロボロにされたのに、そんなに楽しそうなんて……心配するこっちの身にもなって欲しいわ
ウルル	でも、そんな所もやっぱりにいさまらしいと思います
主人公	そんなウルルの言葉に笑顔で頷く皆に苦笑しつつ。俺はオペラさんの指示で、改めてベッドの上で横になった。
主人公	今日は自分でも頑張れたと思う。もう少しくらい休んでもいいだろう……。
