主人公	みんなで飲んで騒いで最後まで楽しかった宴会も終わり、シャルを送り届けると俺達も寮へと帰った。
主人公	みんなあれだけ騒いでさすがに疲れたのか、部屋に向かいながら眠そうに目をこすっていたのを思い出す。
主人公	紅ですら珍しく、風呂から戻ってきたらすぐに眠ってしまった。
主人公	俺もすぐに寝たい気分ではあったけれど、いつもより遅く寮に戻ったとはいえ、風呂に『俺が入れる』時間まではまだ少しある。
主人公	どうしたものかと部屋でボーッとしていたはずなんだが……。
姫	気が付いたら、ここに来てたんだよなー……
主人公	目の前にあるのは扉。当然他の部屋との違いは無いが、少なくとも自分の部屋じゃない。
主人公	扉のすぐ脇のネームプレートには、
主人公	――ヴェル＝セイン――
主人公	そうハッキリと書かれている。
主人公	別に何か用がある、というわけでもないけれど、ただその顔を見たい、一緒にいたい、という衝動が、どうにも抑えられなかった。
主人公	まあ、昨日の今日で、と思わなくもないけれど……。
主人公	ヴェルも、他のみんなと同様に、もう寝てしまってるかもしれない。その時は素直に戻ろう。
主人公	俺は、控え目に扉をノックした。
ヴェル	誰？
主人公	どうやらまだ眠ってはいなかったらしい、程なくして、そっけなくも今一番聞きたい声が返ってきた。
姫	俺だよ。入っていいかな
主人公	さすがに、女の子の部屋の扉を勝手に開けるほど無神経じゃない。そんな俺の呼びかけに、中から大慌てな様子の声が轟いた。
ヴェル	へ！？　ヒ、ヒメ！？　あわわわ！！　ちょ、ちょっと待って！！
主人公	すかさず続く、先ほどのそっけなさが嘘のような感情豊かな声とドタドタと何かを片付け始める音。もしかしてタイミングが悪かったかな。
姫	あの、忙しいなら出直そうか？　どうせたいした……
ヴェル	だ、だめ！　い、いかないで！！　大丈夫、す、すぐに――うにゃぁ！！
姫	ヴェル！？
主人公	中からやたら可愛らしい悲鳴と一緒に、何かが倒れる音と崩れる音とが同時に響く。
主人公	本気で心配になって、扉を開けようと取っ手を握りしめるが、
ヴェル	開けないで！　お願い！！
主人公	中からそう静止され、思いとどまった。
姫	大丈夫か？
ヴェル	大丈夫……ちょっと荷物が崩れただけだから……すぐに片付け……
姫	ヴェル？
主人公	何かに気がついたようにヴェルの声が止まる。やがて、今まで聞いたこと無いような情け無い声が絞り出された。
ヴェル	ごめんなさい……ちょっと……時間、かかるかも……
姫	了解……
主人公	今にも泣き出しそうな声だったけど、それが妙に可愛いなあと思えてしまったあたり、俺もヴェルにはまってしまっているのかもしれない……。
ヴェル	ど、どうぞ……
姫	お、おじゃまします……
主人公	それからたっぷり十分程扉の前で待ったところで、ようやく大丈夫の声が聞こえた。俺は恐る恐る、二度目のヴェルの部屋へと足を踏みいれる。
主人公	こうして見る分には、特に散らかってるところはない。というか、昨日入った時にも全然そんな様子はなかったんだけれど、いったい何を散らかしていたんだろう。
姫	……
ヴェル	……
主人公	ヴェルに案内され、空いてるベッドの上に腰掛ける。まずい、とりあえず来たはいいものの、特に目的があったわけでもないから話が思い浮かばない。
主人公	というか、これじゃまるで俺がヴェルの身体を求めて来たみたいじゃないか。
主人公	実際ヴェルもさっきから俺の言葉を待つように、ちらちらとこちらを見ている。まずい、完全に勘違いされてる。
主人公	別に今回はそういう目的で来たわけじゃない。そりゃあヴェルが相手だし、そうなったら嬉しいなあ、なんて気持ちもないわけじゃないけれど……。
主人公	そんなことを頭の中でぐるぐると考えていると、ふといい香りが鼻腔をくすぐった。この香りは……。
姫	もしかして、風呂から出たばかりだった？
ヴェル	へ？　な、なんで……？
主人公	どうして分かったのかという顔をするヴェルに微笑み返しながら、優しくその綺麗な黒髪を撫でる。
姫	ただ、なんとなく。いい匂いがしたから、もしかしてそうじゃないかなって
ヴェル	う、うん……お風呂上りでちょっとラフな格好してたから……その
主人公	ああ、なるほど納得した。丁度風呂から帰って来て、部屋でくつろいでいたところに俺が来てしまったので、あそこまで慌てたわけか。
主人公	そんなの気にしなくいいとも思ったけれど、そもそも男と女では感覚が全然違う。俺だって、風呂上りのだらしない姿をヴェルには見られたくないしな。
姫	ごめん、タイミング悪かったな
ヴェル	そ、そんな事ないわ！　ヒメが来てくれるだけでも嬉しいもの！　むしろ私の方こそ謝らなくちゃ！
姫	え？　なんで？
ヴェル	だって、せっかくヒメが来てくれたのに外に放置するような事しちゃって……
姫	ああ、なんだその事か。大丈夫、全然気にしてないから
ヴェル	で、でも……
主人公	どうやらかなり気にしてくれていたらしい。申し訳なさそうに身体を寄せてくるヴェルに、思わずドキっとしてしまう。
主人公	顔が近くに迫り、シャンプーの香りが鼻腔をくすぐった。それだけで、ぼうーっとしかけてしまう。
ヴェル	ヒメ？
姫	あ、いや、なんでもない……
姫	それじゃあ、おあいこってことでどうだ。それが一番いい
ヴェル	ヒメがそう言ってくれるなら……
主人公	そういって離れるヴェルを少し残念に思いながらもほっとする。あのままだったら俺の方が色々な意味で我慢できなくなっていそうだ。
主人公	そうして、互いの距離が少しだけ離れたところで、ヴェルが意を決したように告げる。
ヴェル	あ、あの……もし、今日もヒメが私を求めてくれるなら……その
主人公	そういって服に手をかけようとするヴェルを、今度は俺が止める。
ヴェル	ヒメ？
姫	今日は違うんだ。今日はその……別にそういうのが目的じゃなくて……
姫	特に何があるってわけじゃないんだけれど、気がついたら急にヴェルに会いたくなって……それで……
ヴェル	あ……
主人公	こういうのを自分で言うのは照れ臭い。ヴェルから目を逸らしながら、たどたどしく言葉を続ける。
姫	ま、まあ男だからそういう願望が無いわけじゃないんだけども。なんていうか……ヴェルの所に来るのにそれだけを目的にはしたくないんだ。上手くいえないけど
主人公	自分でももっと上手い言い方があったんじゃないかと思うけれど、とにかく言いたい事は全部言った。少しでも伝わってくれてるといいんだけれど……。
主人公	俺は、恐る恐る視線を戻す。そこには、ヴェルの優しく微笑みがあった。
ヴェル	大丈夫、ちゃんとヒメの気持ち。伝わってるよ
主人公	そう言って、きゅっと優しく身体に手を回してくる。その温もりが、ヴェルの心そのものみたいで心地いい。
ヴェル	でも、ヒメになら私はいいんだけどね
姫	ヴェル……
主人公	すこしだけ残念そうに呟くヴェルだったけれど、その顔は微笑んだままだった。互いの気持ちを本当の意味で分かり合えたみたいで、ただ嬉しい。
姫	それじゃ、こういうのはどうかな？
ヴェル	え？
主人公	俺はヴェルの手を離させると、自分の膝の上をぽんぽんと叩いた。
ヴェル	あ……うん！
主人公	それで意図を察してくれたらしい。ヴェルは嬉しそうに俺の膝の上へと腰を下ろした。
主人公	そうて、そのまま身体のすべてを預けてくる。その重みが単純に気持ちいい。そんなヴェルを軽く抱きしめる。
ヴェル	ヒメ……あったかい……
姫	ヴェルこそ、身体ぽかぽかだ。風呂上りだからかな
ヴェル	えへ、ありがとう
主人公	そのまま、しばらく無言の時間が過ぎる。だけど妙な安心感があり、全然苦にならない。気がつけば、無意識にヴェルの髪を撫でていた。本当に綺麗で触り心地もいい。
姫	本当に綺麗な髪だね
ヴェル	ありがと。毎日苦労して手入れしてる甲斐があるわ
姫	やっぱりこれだけ長いと大変？
ヴェル	うん、ちょっとね。けどヒメが綺麗って言ってくれるなら全然苦じゃないわ
ヴェル	昔はね、全然手入れしてなくて母様に良く叱られたわ
姫	学園長って、そういうところにうるさいんだ。ちょっと意外だな
ヴェル	ええ、髪は女の命なんだから大切にしないとダメじゃないかっって。髪を伸ばしてたのだって単純に切るのが面倒だっただけだし
姫	なるほど、昔のヴェルはそうだったんだな
ヴェル	でもね、ヒメに会って、ヒメを好きになって私は変わったの。ううん、ヒメが変えてくれたの
ヴェル	あの日、髪の手入れの仕方を教えてって聞いた時の母様の喜びようったらもう、未だに覚えてるわ
姫	あの学園長がねえ。でも、ヴェルのことを溺愛してるもんな。目に浮かぶよ
ヴェル	でも良かった、その時母様に聞いておいて。ヒメに綺麗って言ってもらえて凄く嬉しい
主人公	そんな話を聞くと余計にこの黒髪が、そして何よりヴェルが愛おしく感じてくる。俺はその感触を楽しむように、ヴェルの黒髪を撫で続ける。
主人公	そうしてまたしばらく無言の時間が続いた。互いの熱を感じ合うようなゆっくりとした時間。そんな中で、今度はヴェルの方が話しかけてくる。
ヴェル	そういえば、街を案内してくれるって話、すっかり忘れてたわ。あれって結局どうなったの？
姫	……あ
主人公	しまった、またやってしまった。
主人公	ここ数日の間、ずっとデイルとの決闘で頭がいっぱいで、すっかり忘れてしまっていた。
ヴェル	その様子だと、また忘れてたわね。酷いわ
姫	わ、悪い！
主人公	さすが二度目はありえない。俺は両手を合わせると、深く頭を下げて謝罪する。本当に申訳ない。
主人公	が、そんな俺の態度に、ヴェルはクスクスと笑い出す。
ヴェル	ふふっ、ごめんなさい、ちょっと意地悪しただけ。私自身忘れてたんだもの、気にしてないわ
姫	いや、だけど約束を破ったのは事実だし……それも二度も、やっぱり何か埋め合わせしたいな
ヴェル	いいって言ってるのに……ま、それじゃヒメの気が済まないって言うのなら、喜んで提案に乗らせてもらうわ
主人公	その笑顔に頷きで返し、何が出来るかを考える。
姫	改めて案内っていうのも今更だよな……案内が必要なところなんてもう……
ヴェル	そうね、正直もう殆どの場所を見てしまったわね
姫	広いようでいて、実際は狭いからなこの世界は……と、なると……
主人公	案内が駄目だとすると、どこかに普通に遊びに行く事になる。埋め合わせとしては妥当な線だが、それはそれでどうだろう。もう少し何かがほしいところだ。
ヴェル	私はヒメが一緒ならどこでもいいわよ？
姫	うーん……
主人公	ヴェルはそう言ってくれるけれど、できることなら今ままで以上に楽しんでほしい。俺は頭を思い切り捻りながら、考える。
主人公	街中はもう今更、それ以外だと丘の方になるが、そこはもう特訓で嫌というほど通った場所だ。森の奥だと猛獣撃破ツアーになること必至。
主人公	他に残っていそうな所は……そこまで考えて、俺は一カ所だけ、まだ足を運んでない場所があったのを思い出した。
姫	海！
ヴェル	海？
姫	そう、知ってると思うけどこの世界は海で囲まれてる。当然、海水浴が出来る浜辺があるんだ。そこならヴェルもまだ行った事ないよな？
ヴェル	そうね、確かにまだだわ
姫	よし、なら決まりかな。もちろんヴェルが良ければだけど
ヴェル	もちろん。ヒメの提案を断るわけないし、私自身行ってみたいもの
主人公	そうと決まれば早速水着の用意をしなくちゃと張り切るヴェルの言葉に、思わず水着姿のヴェルを想像してしまう。
主人公	……それは、昨日の生まれたままの姿と重なって、ただ綺麗だった。
姫	た、楽しみだな
ヴェル	なに想像してるのよ、えっち……
主人公	思わずそう呟いてしまったところを、顔を赤くしたヴェルに突っ込まれる。もっとも、ヴェルも満更でもないみたいだけれど。
姫	あ、あはは……
ヴェル	じゃあ、さっそく明日みんなにも声をかけなくちゃね
姫	いいのか？
主人公	やっぱり、ヴェルとしては二人きりを望んでるかと思っていただけに、その発言に思わず聞き返してしまう。
主人公	そんな俺に、ヴェルはもちろんと頷くと、いたずらっぽい笑みを見せた。
ヴェル	だって、他の子達の水着姿だって見たいでしょ
姫	うっ……
主人公	俺も男である以上、四界の綺麗所が終結しているあのメンバーの水着姿となれば、当然見たいとは思ってしまう。
主人公	ヴェルはそんな俺を見て、やっぱりねとクスクス笑った。
ヴェル	大丈夫よ。私はヒメのものでいたいけれど、ヒメを束縛はしたくないの。ヒメが願うことを叶えるのが私の望みよ
姫	ヴェル……
主人公	それは強がりでもガマンしているわけでもなく、本心からの言葉だった。そんなヴェルの心遣いが素直に嬉しい。今回は、甘えさせてもうらうとしよう。
主人公	とはいえ、ヴェルと二人きりというのもやっぱり捨てがたい。今度は二人きりを提案しよう。
主人公	……でも俺、女性にとっては相当に酷いこと考えてるな。気をつけよう。
姫	それじゃあ、明日にでも皆に声をかけてみるか
ヴェル	ええ、分かったわ
姫	ヴェル
ヴェル	何？
姫	ありがとう
ヴェル	だから気にしなくていいって。でも、あんまり他の子ばかり見てたら拗ねちゃうかもよ？
姫	ぜ、善処します
ヴェル	くす。期待できないなー、姫はえっちだからなー
姫	すみません
主人公	ヴェルの言葉をまったく否定できず頭を下げる。ヴェルはそんな俺を見て楽しそうに笑っていた。
主人公	ああ、こういうのも尻にしかれるっていうんだろうか。
姫	それじゃあ、名残惜しいけどそろそろ戻るよ。時間も時間だしな
ヴェル	あ……
主人公	時間を見ると、来てからもう大分立っていた。この時間なら風呂に入っても問題なさそうだ。
主人公	正直、もっといたいって気持ちはあるんだけれど、これ以上いると本当にガマン出来なくなってしまいそうな気がする。
主人公	俺が立ち上がると、ヴェルの手が名残惜しそうに空中を彷徨った。そして、俺の手を握る。
主人公	そんなヴェルがたまらなく可愛くて、思わず抱きしめたくなるがどうにか我慢する。ここで抱きしめれば、間違いなく歯止めが利かなくなるだろう。
姫	…………
ヴェル	…………
主人公	しかし、俺にこの手を振り払う事は出来そう無い。中から湧き上がってくる欲望を、必至に抑え込む。
ヴェル	よし……
主人公	が、不意にヴェルが何かを決意したように立ち上がった。
姫	え？
ヴェル	これくらいは……ね
主人公	そして、はにかむように微笑むと、その桜色の唇を静かに俺に重ね合わせる
姫	……っ
ヴェル	ん……
主人公	それはとても柔らかくて、とても温かい。ヴェルの俺への想い、そのすべてが込められたキスだった。
主人公	唇と唇を触れ合わせるだけの軽いもの。だけどそれだけで、俺はヴェルのすべてを抱きしめたような気持ちになる。
主人公	やがて、ゆっくりとヴェルが唇を離していく。その温もりが、俺の身体から遠ざかっていく。その代わりとばかりに、ヴェルは頬を赤らめながら可愛らしく笑った。
ヴェル	うふ……お、おやすみヒメ
姫	あ、ああ。おやすみ
主人公	それは、ほんの数秒程度。ごくごく短い触れるだけのキス。にも関わらず、俺もヴェルも耳まで赤い。だめだ、これ以上この場にいると俺の理性が爆発する。
主人公	俺はもう最後にもう一度挨拶をするとと、名残惜しさを残しながらも急いでヴェルの部屋を出た。
