姫	疲れた……
ヴェル	み、右に同じく……
紅	す、すまない、興奮してつい……
デイル	ある意味自業自得だけどねー
アミア	だよねー
主人公	放課後、俺とヴェルは心身共に疲れ果てていた。
主人公	あの後、昼休みが終わるまでの間、延々と全員からの質問責めをくらい、その後ようやく解放されたと思ったら今度は視線の集中砲火だ。
主人公	さすがというべきか、昼休みが終わって教室にたどり着く頃には既に学園中に広まっていたという。
主人公	ここの連中、情報収集能力高すぎないか？
主人公	そしてそれ以降も、休み時間はもちろん授業中すら襲いかかる視線の恐怖。まるで監視されてるかのようだ。というか、他のクラスからまで覗きに来るのはどうかと思います。
ウルル	でも、まさかにいさまとヴェルさまが……うわあ、未だにドキドキしてます
ヴェル	お願いだから、今日はもうその話題は勘弁してー！
オペラ	まあ、白鷺さまならいつかやるとは思っていましたが、予想より早かったですね
姫	人を犯罪予備軍みたいに言わないでください！
紅	ははは、皆それぐらいでもう許してあげた方が良さそうだぞ
主人公	そんな、笑いながらの紅の一言。けれど、そこで、
ノート	でも、本当……羨ましいです……憧れちゃいます
主人公	意外な人物から以外な言葉が飛び出した。全員が一斉にノートの方を向く。
姫	あの、ノートさん……？
オペラ	なんと大胆な発言……ノートさまも意外と……
ノート	へ……？　ああ！　ちちちち違います！
主人公	全員に注目されてようやく自分の失言に気がついたのか、慌ててノートが否定する。
ノート	あの、その。そっちの事ではなくて……そういうお相手が居る事が……出来た事が、凄く羨ましいんです
ウルル	あ、なるほどそういうことですか……
デイル	もう、びっくりさせないでよ白姫ちゃん
ノート	す、すいません！
紅	いや、別に謝る必要は無いぞ。というか気持ちは分からなくはないしな。男女問わず、そういうのは誰しも憧れるものだからな
主人公	皆にフォローされてようやく落ち着くノート。確かに、そういう相手への憧れは男女問わないものだろう。
主人公	それでも意外な事には違いないけれど。
姫	でも、ノートだったら相手なんて選び放題なんじゃないのか？
ヴェル	そうね、ノートに限った話じゃないけど、作ろうとすれば確かにすぐできそうね。もっとも理想の相手を見つけるのって難しいのよね
ヴェル	まあ、私は偶然とはいえ見つかったけど
デイル	ぎゃー、ここで王道ののろけ攻撃とは、俺様クラインズポットに着く前におなか一杯になっちゃうよー！
主人公	そんな言葉にみんなして笑う。けれど、そんな笑いに紛れるようにノートが小さく呟いた。
ノート	だったら……いいんですけどね……
アミア	お姉ちゃん
主人公	恐らく、その言葉を聞けたのは隣にいた俺とアミアくらいなものだろう。
主人公	そして、その言葉を聞いたアミアまでが、少し寂しそうな顔を浮かべていたのは気のせいだろうか……。
主人公	そんな話をしてるうちに広場にたどり着く。そして、とある人物を捜して周囲を見回す。
主人公	幸いにも、その子はすぐに見つかった。
シャル	あ、パパー！
姫	久しぶりだな、シャル
シャル	うん！　久しぶりだよー！！
主人公	いつも通り豪快に胸に飛び込んでくるシャルを、しっかりとキャッチする。
主人公	デイルとの試合前にシャルとした約束。試合が終わったら必ず結果を伝えにくるというそれを果たすために、俺はここにやって来た。
主人公	シャルと会う日や時間を決めていたわけじゃないけれど、あの元気なシャルのことだ、この周辺をきっと飛び回っているだろうと思っていた。
主人公	そしてそれは、見事に正解だったらしい。
デイル	へえ、この子が話に出てきたシャルちゃん？
アミア	そだよー。色々あって友達になって、今はお兄ちゃんをパパって呼んで慕ってるの
デイル	にいさま、お兄ちゃんと来て、次はパパか。姫っちの守備範囲の広さには驚かされるよ
姫	こらこら、誤解を招く発言はやめなさい
シャル	？
主人公	デイルの言葉の意味が分からなかったのか、シャルは首を傾げる。それでいいシャル。君はいつまでも純粋なままでいてくれ。
紅	ま、確かにこうやって聞くと中々に壮観だな。あと足りないの『先輩』ぐらいか？
ヴェル	そういえば、年下は一杯いるのに、何故かその呼び方だけされないわね
ウルル	そういえばそうですね
オペラ	では試しに、『白鷺先輩♪』
デイル	この中で一番その言葉から縁遠い人が言っちゃったよ！
オペラ	デイルさま、ちょっとこちらへ……
デイル	し、しまった！
姫	デイルは本当に地雷を踏み抜くのが好きだなぁ……
シャル	あの……パパ？
主人公	オペラさんに引きずられていくデイルを見ながら、シャルが不思議そうに呟く。
シャル	あの人、誰ですか？
姫	ああ、俺達の新しい友人だ。ちゃんと紹介するよ。とりあえず今日は、約束を果たしに来たんだ
シャル	約束？
姫	約束しただろ、試合が終わったら必ず結果を伝えにくるって
主人公	俺の言葉にその内容を思い出したのか、シャルの顔が輝いた。俺の表情から、その結果を察したのかもしれない。
主人公	俺は、それを裏付けるように、試合の結果を報告した。
シャル	すごい！　やっぱりパパは格好いいです！
姫	ありがとう、シャル
主人公	まるで自分の事のようにはしゃいで喜んでくれるシャル。負けを報告、なんてことにならないで、本当によかった。
主人公	感情をストレートに表に出す子だから、やっぱり泣くぐらいはしたかもしれない。
ヴェル	試合が部外者立ち入り禁止でよかったわね
アミア	だねー、あの試合はシャルちゃんにはちょっと刺激が強すぎるよね
主人公	そんな俺の考えを察してか、ヴェルとアミアが苦笑する。俺は、まったくだと小さく頷いた。
主人公	トリニティの生徒である俺達だって、あれだけのケガを見れば怯むしな。シャルだったらどうなってたことか。
シャル	？
姫	なんでもないよ
シャル	～♪
主人公	不思議そうに首を傾げるシャルの頭を撫でてやる。シャルもそれに満足したのか、相変わらず子犬の様に甘えて来る。
主人公	そんな幸せ家族を満喫していると、デイルがヘロヘロになりながら戻って来た。
デイル	ひゃあー……死ぬかと思ったぜい
ウルル	その割には元気そうですね……
オペラ	手加減をしたつもりはなかったのですが、さすがと言ったところです
ノート	あんまり他の人に迷惑かけちゃ駄目ですよデイルくん
デイル	へーい……
主人公	そんなデイルを、苦笑しながらシャルに紹介する。
デイル	ほい、よろしくねシャルちゃん
シャル	じー……
主人公	しかし、シャルはデイルが差し出した手を握らずに、デイルをジッと見つめていた。
ノート	？　どうしたのシャルちゃん？
シャル	この人がパパの敵ですね。という事はシャルにとっても敵です！！
デイル	ちょっ……こんな女の子に敵扱いとか、俺様涙目すぎるんですけど……
姫	まあ、シャルが女の子である以上は敵と認識させておいた方が安心ではあるんだけど
姫	でも、大丈夫だ。俺とデイルは本気で戦ったからこそ、お互いに分かり合えた。友達になったんだ、だからもう敵じゃないよ
シャル	本当？
デイル	おうよ、俺様と姫っちはもう友達よ
シャル	うーん……わかった、パパの友だちならシャルの友だちだよ！
デイル	おう、そう言ってもらえると嬉しいぜ
主人公	そういってシャルの手をデイルが握る。シャルも、デイルのことを認めてくれたらしい。
主人公	よし、これで約束も果たした。これからが今日の本番だ。
アミア	ねえねえ、シャルちゃん。この後大丈夫？
シャル	へ？　はい、さっきまで友達と遊んでましたけど、この後は特にないです
ノート	なら、丁度よかったです
ウルル	うん、タイミングばっちりだよ！
シャル	？
主人公	みんなの言葉に疑問符を浮かべるシャルに、オペラさんが説明する。
オペラ	これからクラインズポットで、白鷺さまの勝利の祝杯とデイルさまの歓迎会をやるのです。なので是非シャルさまも招待したいと思いまして
シャル	え、本当？　行っていいの？
姫	当然。断る理由を探す方が大変だ
主人公	俺がそう言うと、シャルは『ぱあ』っと音がしそうなほど顔を輝かせる。
シャル	やったあ！　行く行く、絶対行くよー！
主人公	そして、きゃっほーと跳びはねながら喜んでくれた。この顔を見ただけでも誘った甲斐があるというものだ。
ヴェル	そう、なら良かったわ。でももう遅いから、シャルの家に寄ってシャルの母様に了解を得てから行きましょうね
シャル	うん、わかった！
主人公	そして俺達はシャルの家へと向かう。そのままシャルのお母さんに了承を得ると、クラインズポットへと足を進めた。
紅	じゃあ、とりあえず、姫の勝利の祝いと
ウルル	デイルさんを仲間に加えられた幸運と
アミア	あー、あとついでに、お兄ちゃんとヴェルさんが『結ばれた』記念に♪
ヴェル	ば、ばか！　シャルもいるのになに言ってんのよ！
シャル	？
姫	あ、あははは……ま、まあ、とりあえずみんなひっくるめて、乾杯だ！
一同	かんぱーい！！
主人公	この時間のクラインズポットは例の如く混んでいたけれど、相変わらずのオペラさんのスキルであっという間に席を確保できた。
主人公	本当に、どういうスキルを使っているんだろう……。
主人公	さすがにもう数度の来店で慣れたのか、皆も注文に慣れたものだ。思い思いの品をどんどんと頼んでいく。
デイル	あー、でも俺様、姫っちに負けたから微妙に複雑な気分ー
オペラ	当然敗残兵に人権はありませんので、今日の代金は全てデイルさま持ちということで
デイル	ちょっ、それは殺生だぜメイドちゃん！　俺様だって学生の身だぜ！？　この人数分はきつすぎるって！
アミア	あ、ここ確か皿洗い募集してたよ
デイル	なにそれ！　足りない分は身体で稼げってか！　おーい！　だれか捕虜の扱いに対する条約しらべてよ！
主人公	本気で勘弁してと泣きつくデイルに苦笑する。まあ、さすがにそれはかわいそう過ぎるだろう。
ヴェル	まあ、妥当な判断ね……と言いたい所だけど、運がいいわねデイル。今日は全額私持ちでいいわよ
姫	お、おい、いくらなんでもそれは大きく出すぎだぞ、ヴェル。いつも通り割り勘でいいだろ
紅	そうだな。今日は人数も多いから結構な額になるぞ？
主人公	唐突にとんでもない事を言い出したヴェルを、さすがに止めようとする俺と紅。けれどヴェルはにやりと笑うと、カバンから革袋を取り出した。
ヴェル	大丈夫よ、今日は秘密兵器があるもの、ほら
主人公	そういって手に持った袋を机に置く。その拍子に袋の中身がこぼれ出た。中には、ギッシリと金貨が入っている。
シャル	こ、これ全部お金ですか！？　す、凄いです！
ノート	う、うわあ。ど、どうしたんですか、こんな大金！！
主人公	突如現れた大金に全員が驚愕する。いくら魔界の王女とはいえ、持ち歩ける額じゃないだろう、これは。
主人公	ヴェルは、そんな俺達の驚く姿に満足そうな笑みを浮かべた。
ヴェル	言ったでしょ、秘密兵器があるって。といっても全部ヒメのおかげだけどね
姫	え？　俺？
主人公	ヴェルにそう言われても、心当たりがまるでない。少なくとも金に関して言えば、決して裕福な立場じゃないぞ、俺。
ヴェル	ほら、覚えてない？　デイルとの試合前にやってた賭けの話
姫	あー、あれか。あったなそんなの。すっかり忘れてた
主人公	そういえば、あの時ヴェルはかなり希少価値の高いコインを使って俺に賭けていた。なるほど、これはその支払い分か。
デイル	そういややってたねぇ、そんなの。ちゃっかり参加してたわけか、抜け目ないね姫さん
ヴェル	まあ、あの時はお金目的じゃなかったけどね。せっかくだしキッチリ請求させてもらったわ
オペラ	しかし、主催者側も良く払えましたね。聞いた話だと冗談みたいな高倍率がついてたって話ですよ？
ウルル	しかも、確かヴェルさまが賭けたって言ってたのって……
ヴェル	そ、これよ
主人公	そういってヴェルは一枚のコインを取り出すと、器用に指で弾いて机の上に落とす。
シャル	なんだか、古臭いコインですね……
デイル	って、旧魔界硬貨かよ！　こんなもん賭けに使ったのか！？
ヴェル	ええ。これを机に叩きつけてヒメに賭けるって言った時の相手の驚いた顔は、忘れられないわね
アミア	相手を驚かす為だけに普通使うかなー……こんな希少なコイン……
主人公	確か紅の話だと、１枚でとんでもない価値がある硬貨だったよな。それに対して俺が勝った場合の超高倍率が加算されるわけだから……。
ノート	あの、冗談でもなんでもなく家が買える値段になっちゃうんですけど……
ヴェル	そうね。ヒメが勝つわけないって馬鹿にして、アホみたいな高倍率にしたりするからよ。いい気味だわ
紅	相手は本当によく支払えたな……
主人公	確かに、かなり規模が大きかったとは言え、学生に払える額を大きく逸脱している。それを聞いてヴェルはクスクスと楽しそうに笑いながら言った。
ヴェル	まさか。支払いを要求したら、このコインを返した上で泣きながら土下座してきたわ。これで勘弁してくれってね
デイル	だよねー、間違い無く破産レベルだし
姫	なるほどね、それでこの金貨か
主人公	机に広がったコインを見てようやく合点がいく。もっとも、それでも相当な額であることには違いない。
主人公	本来こういった賭けは、元締めが必ず儲かるようにオッズが設定されるものだけれど、どうやら俺が勝つわけがないと甘く見られてたみたいだ。
主人公	つまりはそんなオッズでないとデイルが勝っても儲からない、という状況だったというわけか。同情の余地なし、だな。
主人公	と、そこまで考えたところでもう一つ思い出した。
姫	そういえば、紅も俺に賭けてなかったか？
紅	ああ、あの時は姫にエールを送るつもりで賭けたんだがな。せっかくだしあたしも明日取りにいってみるよ
主人公	そう楽しそうに言う紅にオペラさんも続く。
オペラ	そういえば、ウルルさまも締め切りギリギリに参加しましたよね？
ウルル	うん。ヴェルさまと紅さんの話に触発されちゃって、ほんの少しだけ
ノート	実はボクも……
アミア	お姉ちゃんも賭けてたの！？
ノート	う、うん。ボクもヴェルちゃんや紅ちゃんの話を聞いて、ちょっとだけね
オペラ	小額でも、あの倍率を見る限りそれなりの額にはなりますよ。明日取立てに行きましょう
デイル	ははは、こりゃブックメイカーは大損確定だな。というか姫さん達の抜け目のなさに感服だよ
紅	まあ、元は応援目的とはいえ、ヴェルの言う通りもらえるものはもらっておかないとね
ヴェル	ちなみに母様もかなりの額かけてたから、主催者は大変よ。母様は私ほど優しくはないから
ヴェル	それこそ身ぐるみ剥がされるわよ
オペラ	明日辺り、学園から何人か消えてるかもしれませんね
主人公	本当にありそうだから怖い。というか、やっぱりギャンブルには手をだすもんじゃないな。
姫	あれ？　そういえばもう一人賭けに参加してたような……
アミア	うう……言わないでー！　せっかく忘れてたのにー！　あ～、こんな事ならお兄ちゃんに賭ければよかったぁ！
ノート	アミちゃん元気だして。やっぱり賭け事は怖いのよ、授業料だと思えば安いものだわ
デイル	と、言いつつ、白姫ちゃんは大もうけなのでした
アミア	うわーん！　今日はヤケ酒だー！
ノート	アミちゃんだめー！　ギャンブルに負けた後のヤケ酒なんて絶対に駄目ー！　神生壊れちゃうよー！
主人公	本当、ギャンブルっておっかない。
ヴェル	ま、というわけで今日は好きなだけ飲んで食べましょ。どうせあぶく銭よ。今日使い切っちゃうぐらいのつもりで行きましょ
紅	そういうことなら遠慮はいらなそうだな
ウルル	ですねー、ウルルも今日は限定解除しちゃいますよー！
オペラ	ふふふ、他人のお金で飲む酒ほどうまいものはありません！　ここは私も本気でいかせてもらいます
シャル	ねえ、パパ！　何でも好きなの頼んでいいの！？
姫	ああ、いいぞ。飲み物でも食べ物でもデザートでもな。ヴェルに感謝してな
シャル	やったー、ヴェルママ大好き！
ヴェル	くすっ、ありがとう
アミア	デイル！　あんたのせいで損したんだから、今日はとことんつきあってよね！
デイル	へいへい。一応敗北者だしねー、理不尽な命令でも今日だけは従いますよー。ま、こんな機会めったにないし、俺様も楽しませてもらうけど
アミア	よーしよく言ったー！　今日はぶっ倒れるまで飲んで食べてやるー！　負け分を取り戻す勢いで！
ノート	ああ、破滅の道を進むアミちゃんを止められない……お母さん、ふがいないボクを許してください……
主人公	そうして始まったどんちゃん騒ぎは、結局夜まで続いたのだった。
