主人公	放課後の大聖堂。ただでさえ殆ど利用するものが居ない大聖堂は、この時間になるとさらにその静けさを増す。
主人公	明かりが落とされ、窓から差し込む夕日のみに彩られた室内は、神秘的で幻想的と言えなくもない。
主人公	しかし同時に、ほの暗いその場所は大聖堂という名が持つイメージとは真逆の不気味さも放っていた。
主人公	そんな大聖堂に一人佇み、ラーロンは先ほどその静寂を乱し続けていた。
ラーロン	くそっ！　くそっ！　くそっ！！　何故だ！　何故魔王の名を持つ私が、人族のゴミ如きに嘗められなければならないんだ！！
主人公	元々は、いらだつ気分を少しでも和らげようと一人で落ち着ける場所を探して訪れたはずだった。
ラーロン	ええい！　自分一人では何も出来ないクズが！　私は魔王だぞ！　いずれ魔界を統べる力を手に入れるものだぞ！！
主人公	だが、一人で居れば居るほど怒りがこみ上げてきて、それを留める事が出来なくっていく。
主人公	これがせめて多少なりとも人が居るところであれば、プライドの高い彼はある程度は自制することも出来ただろう。完全に行動が裏目に出ていた。
主人公	しかし、ここには彼を咎める者はもちろんいない。その怒りの炎は、際限なく燃え上がっていく。
ラーロン	どうすればあの下郎を跪かせる事が出来る……あの男を！
主人公	当然ながら、幾度と無く繰り返す疑問に答えが出る気配はない。
主人公	彼の周りには常に３界の姫君達がいる。もはや、この学園内で彼に危害を加える事が出来るものは殆どいない。
主人公	しかも、さらにはあの決闘の一件以来、デイルすらもが彼のそばにいる。もはや白鷺姫は学園最強の勢力の中心人物といってもおかしくない。
ラーロン	ぐっ……！！　自身では何も出来ないクズの分際で……
主人公	姫一人ならどうとでもなるだろう。しかし、まるで城を囲む城壁の如く、彼の最強の仲間達が立ちはだかる。
主人公	いったい、なぜこうなってしまったのだろう。つい一月前には、ただの無力な人族でしかなかったというのに。
主人公	もはや自分の力ではどうにもならない。だが、その結論だけはラーロンのプライドが許さない。結果、永遠に答えの出ない堂々巡りを繰り返す事になる。
ラーロン	ぐ……ぐ……
主人公	そうしてどれほどの時間が経っただろうか。夜の帳が下り、周囲が闇に包まれていく。夕から夜へと変わる一瞬。その時だった。
ラーロン	な……！？　誰だ！
主人公	尋常では無い気配にラーロンは叫び、振り返る。気がつけば周囲の様子もおかしい。空気が停滞し、まるで世界が閉鎖し、時すらも止まってしまった様な……。
ラーロン	な……なんだ……これは……
主人公	そんな突然の事態に動揺するラーロンの前で、薄いローブが一枚、はためいた。
