主人公	教室に辿り着いたところで、通学時と変わらない視線に少しだけ嘆息する。
主人公	それを無視して席へとに向かえば、その途中で、殺気にも似た突き刺さるような視線を感じた。
姫	ラーロンか……
紅	あの男も懲りないな……
ヴェル	学習能力が致命的なまでに壊れてるんじゃない？
主人公	ラーロンの視線も今まで違っていた。だが、それは他の生徒達のものとは違う。
主人公	今まではどこか侮蔑と蔑みが込められた視線だったが、今は明確な敵意が込められている。
主人公	昨日の八百長疑惑の一件以来、一切絡んできていないのだが、それがむしろ不気味だ。
ヴェル	ああ、もううざったいわね……
主人公	しばらくなにも言わずに無視を決め込んでいたが、ヴェルが我慢の限界だとばかりに、ラーロンの敵意を遥かに超す殺気をぶつけ返す。
ラーロン	！
主人公	それだけでラーロンは目をそらし、そのままその場を離れ席についた。
ヴェル	あそこまでいくと、もはや哀れね
紅	あれでもあたしたちよりは全然格上の実力を持っているんだがな
姫	ああ……普通に胸を張ってればいいだろうに……
主人公	そんな言葉にヴェルは呆れた様に肩をすくめる。
ヴェル	魔王の血族って本当に厄介ね……あの程度の奴にあれだけの力を与えてしまうんだから
主人公	そんなヴェルの言葉には、どこか哀れみすら感じられた。
