主人公	翌日、犯人はまだ捕まってはいないが、自分達に何も出来ない事を考えていても仕方が無い。俺達は、暴漢騒ぎに関しては意図的に触れないようにすごしていた。
主人公	表面上は皆いつも通り笑っている。あくまでも表面上は、だが。
主人公	今日も一日の授業が終わり、俺達はいつも通りに寮への帰り道を、雑談しながら歩いていく。
姫	最近は雨が続いてたけど、久々に晴れたな
ウルル	ですね、やっぱり晴れが一番です
紅	実際洗濯物がたまって困っていたんだ。今日はまとめて干してしまおう
ノート	晴れの日干した洗濯物はいいにおいがいますしね。いいと思いますよ
主人公	いつも通りの帰宅メンバーにウルル達やノート達も加えたほぼフルメンバーだ。本来はここにデイルも加わるはずだったのだが、今はいない。
アミア	それにしても、デイルはどうしたんだろうね？　珍しく慌ててたみたいだけど
オペラ	そうですね、あまりデイルさまらしからぬ動揺の仕方をされてた様に思えます
主人公	そんな二人の会話にデイルと別れた時の事を思い出す。
デイル	おーい、姫っち＆姫さんズ。俺様も一緒に帰るぜい
主人公	半日授業のせいか、授業が終わった時のデイルのテンションはやたらと高かった。そのまま帰ろうとしたデイルを、大慌てで走ってきた友人が呼び止める。
デイルの友人	おい！　デイル大変だ！
デイル	おいおい、どったよそんなに慌ててー。彼女にふられでもしたのか？
デイルの友人	そんな冗談言ってる場合か、とにかく話を聞いてくれ！
デイル	あいあい、分かった分かった。姫っち悪い。ちょい待ってて
姫	ああ、別に俺達のことは気にしなくていいよ
デイル	悪いな、ちょいと話聞いてすぐ戻ってくるわ
主人公	そう言って少し離れたところで話し始めた二人だが、すぐにデイルの表情が凍りついた。
デイル	おい……それマジか……冗談だとしたら性質わるすぎっぞ……
デイルの友人	冗談でこんな事言えるわけねぇだろ！　マジだよマジだよ！
デイル	そうか……分かった、俺様もすぐ行く。お前は他の奴にも知らせてきてくれ
デイルの友人	ああ！　分かった！
主人公	そうして、来た時と同じようにデイルの友人は慌しく駆けていった。デイルもすぐに戻ってきたが、その表情はさっきとはうって変わって暗い。
デイル	悪い、姫っち急用が出来た
姫	らしいな……大丈夫か？　顔色悪いぞ？
デイル	俺様は大丈夫さ……俺様はな……
主人公	そうしてその後、デイルも慌しくどこかに行ってしまった。本人は大丈夫だと言っていたが、あの時のデイルの真剣な顔は、あまりに印象的だった。
姫	とりあえず、明日にでも本人に聞いてみよう
紅	だな、何か問題が発生したのなら相談にも乗れるしな
主人公	そんな話をしながら広場を歩いていると、見慣れた少女の姿を見つけた。
アミア	お、シャルちゃんはっけーん！　おーい、シャルちゃーん！
主人公	俺とほぼ同時に見つけていたのか、アミアが声を上げながらシャルへと駆け寄る。シャルは広場のベンチに腰掛けていた。
シャル	あ、パパ……
姫	ああ、、シャル……って、どうした？
主人公	アミアに続いて近づいてみて、シャルの様子がおかしい事に気がつく。いつもなら俺を見つけるなり飛び込んでくるのだが、今日はそれが無い。
主人公	それどころか、どことなく元気は無いし、良く見れば目元には涙の後が残っている。
ヴェル	シャル？　何があったの……？
シャル	それが……その……一昨日の夜……友だちが……
紅	え……
主人公	そのシャルの言葉を聞くと同時、心臓が跳ね上がった。まさか、そう思った瞬間シャルが恐れていた言葉を紡ぐ。
シャル	友だちが悪い人に襲われたの……
ノート	一昨日の夜……あ！
主人公	やっぱり……心の中で思わず呟く。一昨日の夜の犠牲者の中に、１０歳前後の少女が含まれていた事をノートが言っていた。
主人公	にしても、まさかそれがシャルの友達だったなんて……。
ウルル	そんな……
オペラ	話では一命は取り留めたと聞きましたが……
シャル	うん。学園の人が助けに来てくれたおかげでなんとか……でも……でも……
主人公	話しながらシャルの瞳から涙がこぼれていく。ヴェルはそんなシャルをそっと抱きしめた。
シャル	昨日はずっと会えなくて……今日から会えるって聞いてお見舞いに行ったら……ずっと寝たまま……目を覚まさないの……
シャル	声をかけても名前を呼んでも返事……してくれないの……
主人公	そう喋ってる間にも次々とシャルの涙は溢れてくる。その声にも、嗚咽が混じり始めていた。
ヴェル	シャル……
シャル	うっううう……
ヴェル	ガマンしなくていいわ、思い切り泣きなさい。気が済むまでこうしていてあげるから
シャル	うう……うわ……うわあああああああああああああああ
主人公	ヴェルの胸の中で、眠ったままの友人を思い出してしまったのか、シャルは大声で泣き始めた。
主人公	今のシャルにかけられる言葉を、俺達は知らない。たとえ何を言ったとしても、それは気休めにしかならないだろう。
主人公	だから俺達は、ただ黙ってシャルを見守った。その想いのすべてを吐き出せるように、ただ泣き続けるシャルを見守り続ける。
主人公	暴漢事件は、俺達にとって気になる事件ではあったものの、どこか遠い所で起こっている他人事のようなものでしかなかった。
主人公	けれど、今になってようやく思い知る。今回の事件は、こんなにも身近な場所で行われているんだという事を。
