主人公	いつも通りの闘技場での実技の時間。俺は紅と互いの剣をぶつけ合わせていた。
主人公	ガキン、と硬質な音が響き、火花が飛び散る。素早い足裁きで間合いを維持しながら、少しも相手の体勢を崩そうと攻撃を繰り返す。
主人公	そして、初めて紅の姿勢が少し崩れた瞬間、俺は更に深く踏み込んだ。が。
紅	惜しかったな！
主人公	紅のステップについてゆけず、俺の剣は空を切った。すぐに打ち込みが来るが、分かっていても反応できない。
主人公	その瞬間、決着はついていた。
ヴェル	一本ね、紅の勝ちよ
姫	くそ、あとちょっとだったんだけどな
主人公	地面に座り込み、悔しさを言葉にする。そんな俺を見て、紅がクスと笑った。
紅	実際、結構危なかったしな。もしあの時の踏み込みが甘くなかったら、あたしが取られてたよ
ヴェル	それじゃあ、次は私の番ね
姫	頼む
主人公	そうして、次はヴェルと向かい合う。
ヴェル	それじゃあ、いくわよヒメ
姫	ああ。手加減無しで頼む！　訓練だからな！
ヴェル	ええ、分かった！
姫	あじゃぽああ！！
主人公	俺の身体は空を舞っていた。
ヴェル	ヒメ！？　大丈夫、ヒメ！？
姫	あ、ああ、なんとか……
主人公	落ちてきたところをどうにかヴェルに受け止められ、俺は自らの生を実感する。
主人公	やっぱり、ヴェルが相手じゃどうにもならないな……一つ利口になった。
紅	でも、間違いなく強くなったな、姫
デイル	ああ。今の姫さんの一撃、防げないにしてもちゃ～んと反応はしてたもんねえ。それだけでも充分凄いことだよなあ
ヴェル	そうね。私と戦った相手って、その大半が、なんでやられたのか分かってないもの。反応できる人なんて希有よ
ヴェル	ヒメもついに、その仲間入りね
主人公	本当に嬉しそうに言ってくれるヴェルの笑顔が、今は凄く嬉しく感じる。
主人公	しかし、次の瞬間その顔が驚愕に染まった。
ヴェル	伏せて！！
姫	なに！？
主人公	ヴェルに頭を抑えられると同時、ほとんど強引に地面へと押し付けられる。その瞬間、
フォン	はい！
ヴェル	甘い！
主人公	頭の上で、二つの刃がぶつかっていた。
ヴェル	……どういうつもり？　ヒメを狙ったなんて言ったら、生きていることを後悔させてあげるわよ
？	腕はにぶっていないみたいですね。フォン、安心しました
主人公	ギロリと冷酷な目で睨み付けるヴェル。その視線の先に、昨日出会ったばかりの、あの毒舌少女が立っていた。
主人公	さっきの一撃、彼女が？
フォン	いえ、大したことじゃないです。ただちょっと試してみたかっただけですから
ヴェル	だったら正面から来なさい。いつでも全力で全壊してあげるから
フォン	それがですねえ、フォン、ヴェルさまを試しにきたんじゃないんです
主人公	可愛らしい笑顔を見せるフォンさんに、首を傾げるヴェル。
主人公	次の瞬間、一本の半月状鎌の一撃が、容赦無く俺へと繰り出されていた。
姫	あっぶねぇ……よく防いだな俺……
主人公	俺の剣で防がれた、フォンの奮う赤い刃。だが、防げたのは本当にたまたまだ。
フォン	ちょっと驚きです。本気でないとはいえ、今の一撃で昏倒させるつもりだったんですよ
ヴェル	フォン！　あなたどういう……
フォン	ですが、これならどうですか！
主人公	まるで風が爆発でもしたみたいだった。ほとんど前動作のない状態からの二連撃。ありえない体勢から、ありえない速度の攻撃が降ってくる。
姫	ち、ちょっとフォンさん！？　あの、これってどういう……！
主人公	一撃にこめられた破壊力は、ヴェルと比べればたいしたことない。だが、重い。そして速く、強引。
主人公	両手に一本ずつ握られた、ヴェルと違った小さな鎌。
主人公	ヴェルほどの攻撃範囲はないけれど、その分速い。
主人公	だめだこのままじゃジリ貧だ。多少無茶でも手を出さないとっ。
主人公	俺はどうにか動作の大きかった一撃を横に跳ぶようにしてかわすと、そのまま横に剣を薙ぐ。倒せるとは思ってない、牽制の一つにでもなれば……。
フォン	無駄ですよ、姫先輩
主人公	だがその一撃を、フォンさんは受けようともしない。そのまま前へと踏み込んでくる。
主人公	そして、ギインッ！　と鈍い音が響き、俺の剣が弾かれた。
姫	えっ！？
主人公	鎧や何かを着ているわけじゃない。完全に身体に当たったはずなのに、なんだ今の鉄でも打ったみたいな感触。服の下に前もって防具を……？
主人公	いや違う。とてもじゃないがそんな風には見えないし。それでこんな軽い動きは無理だ。それに今の感触は、防具というよりはむしろ……。
主人公	しかし、その思考が動きを一瞬だけ、鈍らせた。
主人公	やばい！！
主人公	本能が俺の頭の中で叫んでいた。かわせない、と。
主人公	妙にゆっくりとした映像で、フォンさんの鎌が振り下ろされる。知覚はしているのに、身体が動かない。これはあれか？　死ぬ寸前に見るっていう……。
主人公	だが、フォンさんの放った一撃は、乱入したヴェルによって受け止められていた。
ヴェル	もう一度だけ聞くわよ、フォン。あなた、どういうつもり……？
主人公	低く、重いヴェルの声。まるで持てる負の感情をすべて圧縮したような、殺意そのものを声に変換したような黒い言葉。
主人公	人ではなく、獣や怪物を見るような冷たい目で、ヴェルはフォンさんを睨み付ける。ヴェルの、本気の目だ。
フォン	ふう
主人公	それに対しフォンさんは小さく息を吐き出すと、
フォン	思っていたよりはマシでした
主人公	そんなことをサラリと言って、笑ってみせた。
ヴェル	……ヒメを試した、そういうわけ……？
フォン	そうですね。まさにそう思って問題ないかと。なんといっても魔界の黒翼をたぶらかしちゃうとんでもない方ですから、気になっちゃうじゃないですか
バリアリーフ	それで、用件は済んだ、と思ってよろしいかしら
主人公	状況を見守っていたらしい先生が、ムチを構えつつ進み出る。
バリアリーフ	学園長より、あなたのことは伺っておりますわ。ですので今回は見逃しますが……
バリアリーフ	次はありませんわよ
主人公	先生の口調からは静かな怒りが感じ取れた。それは２度目は無いということ。
フォン	バリアリーフ＝クリート。竜族でありながら、滅界戦争では対魔族のエキスパートとして名を馳せた魔族狩りでしたね
フォン	さすがに黒翼と魔族狩りの二人を相手にするのはしんどいので控えます
フォン	みなさん、ごめんなさい
主人公	そしてフォンさんは闘技場を後にした。またとんでもない子だなあ……。
ヴェル	ふふふ……うふふふ……うふふふふ……
紅	ヴェ、ヴェル！？　どうした、おい！？
ヴェル	いい根性してるじゃない、フォン……私の前でヒメに刃を向けて逃げ去る？　それが何をもたらすか次は教えて上げるわ。うふふふふふふ……
紅	お、落ち着けヴェル！　お前が本気になると、きっと誰かが不幸になる！
