主人公	なんだろう。教室に入ってみれば、なんだか妙に騒がしかった。
主人公	至る所で人の輪ができて、何かをしきりに話している。
紅	なんだ、これ。何かあったのか？
ヴェル	誰かが何かやった、なんて雰囲気じゃないわよね、これ
姫	ようやく暴漢の件が片付いたってのに、まさかまた事件か？
デイル	ご名答
主人公	いつの間に近づいたのか、すぐ横でデイルが腕を組んで立っていた。
姫	ご名答って、今度はいったい何が……
デイル	姫っちが今言った通りよ。また暴漢
紅	な！？　だって、それはもう犯人も捕まって……
ヴェル	まさか、ハデラが脱走……？
主人公	ヴェルのもっともな疑問に、デイルは首を左右に振って否定する。
デイル	いやいや、あのおぼっちゃまが封印されたままなのは確認済み。それは無し
デイル	だけどもまあ、暴漢がまた出たってのは本当さ
姫	どういうことだ？
デイル	まあ、正直言って俺様もそこまで詳しいことを知ってるわけじゃないけどね
デイル	昨日の夜、街で気持ちよく酔っぱらってたあんちゃんが、いきなり剣で後ろから襲われたらしい
姫	その人、大丈夫だったのか？
デイル	それなりの重症ではあるらしいんだが、幸いにして命は助かったとさ
デイル	ただ、犯人は不明。おぼっちゃまの件と関係があるのかも不明。まったくもって分からない尽くしだとさ
紅	しかし、ただでさえあんな騒ぎがあったばかりだぞ。この時期に同じような事件を起こせばどうなるかくらい、少し考えれば分かるだろう
ヴェル	すぐに厳戒体制を敷かれて、あっという間に追い詰められて終わりよ。すぐにでも動き出すでしょうね
姫	酒によっての口論、とかじゃないんだろうなあ。なんでこんな時期に事件を起こしたのやら
バリアリーフ	何を話しているかは予想つきますが、みなさん席に戻りなさい
主人公	いつの間にやらもうチャイムも鳴っていたらしい。だがみんな席に着くことはなく、先生への質問攻撃が始まる。
女子生徒Ａ	結局、前の暴漢事件と関係があるんですか！？
男子生徒Ａ	犯人は捕まったんですか！？　何が目的だったんですか！？
女子生徒Ｂ	やっぱり、またラーロンさんが！？
主人公	抱いて当然の質問が、矢継ぎ早に先生へと投げつけられる。先生はやれやれと肩をすくめると、仕方ない、と口を開いた。
バリアリーフ	みなさんが聞きたがるのももっともだとは思います。ですが残念ながら、私もその質問に答えることはできません
バリアリーフ	現在、学園の方でも緊急会議を開くと共に街の代表者と協議をしておりますわ
バリアリーフ	事件の真相、今後の方針、すべて結果が出次第ご報告致しますので、それまでお待ち下さいな
主人公	そんな先生の回答に、みんなもそれ以上は聞けないと判断したのか、全員とぼとぼと席に戻る。
主人公	そして、いつも通りに授業は始まった。けれど、みんなも分かっているのだろう。この事件は、きっと簡単には収まらない。これからもっと大きくなっていく。
主人公	学園全体を、まるで重い空気が包み込んでいるかのようだった。
