姫	う……
主人公	ゆっくりと視界が戻って来る。見慣れたいつもの部屋の光景が映し出される。
姫	俺は……
主人公	身体の芯が重く感じる。なんだろう、この妙な疲労感は……。
オペラ	お帰りなさい、白鷺さま
主人公	その声に振り返れば、優しい笑顔のオペラさん。そしてその顔を見た瞬間、俺はすべてを思いだした。
姫	まったく、ひどいですよオペラさん。あんな無理やりに
オペラ	すみません。ですがその甲斐はあったようですね
オペラ	白鷺さまがウルルさまの夢に入られてから、ウルルさま、終始もうニッコニコでしたから
オペラ	白鷺さまにとってはいかがでしたか？
姫	い、いやまあ、その……どうなんでしょうね……
主人公	なんていうか、夢の中とはいえ俺はウルルと……なわけで。あれがもし本当にウルルの願望なんだとしたら……。
姫	ま、まあ、ウルルにとっていい夢だったなら、多分俺にとってもそうだったんじゃないかなと
オペラ	確かにそうかもしれませんね。ウルルさまが白鷺さまにとってマイナスになるような夢を喜ぶはずありませんから
オペラ	ですがまあ、その……ちょっとした想定外なこともあったんですけど……
姫	想定外？
主人公	さすがにちょっと捨て置けない。それを問いただそうとしたところで、ベッドの方から声がした。
ウルル	ほぇ？
姫	ああ、ウルルも起きたのか。まったくお寝坊さんな王女様だな
オペラ	ああっ。白鷺さま、今ベッドに近づいたらっ
主人公	苦笑しながらウルルの元へ行く俺を、珍しく慌てて引き止めようとするオペラさん。とはいえ時既に遅し。俺はもうベッドへと辿り着いていた。
姫	いい夢だった、か、い……？
主人公	思わず言葉を失ってしまう俺。えーと、これはその……。
ウルル	あー、にいさまだぁ……。にいさまぁ、ウルル、にいさまのものになっちゃいましたぁ……
主人公	どうやらまだ夢の話を引きずっているらしい。寝ぼけ眼でそんなことを言いながら、ウルルは起き上がった。
ウルル	でも、あれ……？　ウルル、闘技場にいたはずなのに、なんでにいさまの部屋に……
ウルル	服も、私服になってますし……っ？
主人公	自分の姿を見回して、そして唐突に硬直するウルル。どうやら気付いたらしい。
主人公	ウルルの下半身から広がる、その下着すらも汚している染みに。
ウルル	……えっと……
ウルル	あ、あの、にいさま……ウ、ウルルもしかして
ウルル	えっと、その……だ、だけど……
ウルル	ウ、ウルル……ウルルは……ウルル……は……
ウルル	きゃああああああっ！！
ウルル	えっ？　ええ！？　ウ、ウルル、なんでこんな、お、お、お……
ウルル	お漏らし、なんて……
ウルル	な、なんでえ！？
姫	オペラさん、これはあの、いったい……
主人公	俺の引きつり顔での質問に、オペラさんはやっぱり笑顔を引きつらせながら答えてくれる。
オペラ	あ、あくまで仮定なんですが、もしかして夢の中で、その……放水されたりしていたのではないかと……
オペラ	それが、あまりに衝撃すぎて、現実の方でも……
ウルル	そんな、じゃ、じゃあ、あれって夢！？　確かにウルル、しちゃいましたけど……いやあああん！
ウルル	にいさま聞かないで下さい！　今聞いた事忘れて下さーい！！
ウルル	ふええええん！　ごめんなさい、ごめんなさい、にいさまあっ！！
主人公	ウルルは泣きながら謝ると、顔を耳まで真っ赤にしたまま俺の部屋を飛び出していってしまった。
オペラ	ああ、恥じらいつつも泣きながら謝るウルルさま、やっぱり可愛らしい……
姫	いやあの、オペラさん？　こうなったの、ある意味あなたのせいでは……
オペラ	うっ。ま、まあ、確かに私にも多少の責任はあるようですね……
オペラ	で、ですが最大の原因はやはり、夢の中であのような行為を行わせた白鷺さま。犯人はあなたです！！
主人公	びしいっ、と俺を指差しつつ言い切るオペラさん。いやまあ、否定はできません。
オペラ	何はともあれご安心下さい。こちらは責任を持って、私の方で綺麗にさせていただきますから
主人公	言うが早いか、颯爽とベッドからシーツと下の布団を剥がすオペラさん。さすがに手際いいなあ。
オペラ	ですが、白鷺さま
主人公	手早く布団をたたむと、オペラさんは真面目な顔で俺を見た。
オペラ	正直言えば、ウルルさまがどうのような夢を見たのか、見当はついています
オペラ	ウルルさまは竜族王家の最後の生き残り。あの小さな肩には想像以上に重い未来がのしかかっています。それはきっと、ウルルさま個人の幸せにはならないでしょう
主人公	その言葉に、俺は夢の中でウルルの言っていたことを思い出した。種族を存続させる務め……。
主人公	あの小さな金竜のことだ。竜族の未来ばかりを考え、きっと自分の未来はどこかにしまってしまうのだろう。
オペラ	ですから、ウルルさまの気持ちだけでも、大事にしてあげて下さい
オペラ	いつの日か、成長し寂しさを覚えてしまったウルルさまが、その日を思い出し笑えるように
主人公	オペラさんは深く頭を下げると、シーツと布団を持って部屋を出て行った。
姫	王女の立場、か。考えたこともなかったな……
主人公	いつも俺達の前で見せてくれているあの笑顔。あれが見られなくなるなんてこと、考えもしなかった。
姫	……ヴェルやノートも、やっぱり同じなのか……？
主人公	それはきっと当然だろう。フォンが俺に向かって言ったことも、きっとこのことだ。
主人公	いつの日か俺は、そういった彼女達の未来と相対することがるのかもしれない。
主人公	その時俺は、どんな顔でその未来を見ているんだろう……。
