主人公	闘技場の壁に寄りかかるようにして立つウルル。そんなウルルの下半身に、ズボンの上からそっと触れてみた。その小さな身体がびくん、と震えるのが分かる。
姫	ウルル……怖いか？
ウルル	い、いえ、大丈夫、です。にいさまの指ですから……
主人公	そうは言いつつもガチガチに緊張しているのがよく分かる。俺を見上げるその表情に、明らかな不安が見て取れた。
主人公	それでも、俺を拒むことなく受け入れようとしてくれているウルルに、素直に微笑みかける。
姫	そうか。ウルルは、本当にいい子だな
ウルル	そ、そんなことありませんっ。ウルルがそう見えるなら、それは、相手がにいさまだから……
主人公	そんなウルルが可愛らしくて、つい指に力を入れてしまう。
ウルル	あっ
主人公	瞬間、ウルルが小さく喘いだ。
姫	まだズボンの上からなのに、それでも感じるんだ……敏感なんだな……
主人公	まさぐるように動く俺の指に、ウルルは小さく身体を震わせ続ける。
ウルル	に、にいさま……もっと、お願いします……
姫	ああ、分かってる。俺も、今日は止められそうにないよ……
主人公	そんなウルルの期待に応えるかのように、俺も興奮している自分を抑えられない。俺はウルルのズボンへと手をかけた。
ウルル	はうぅ……こ、子供っぽくてごめんなさい……
主人公	ズボンを降ろすと同時、可愛らしい緑のストライプが現われる。恥ずかしげに視線を逸らすウルルに、俺は苦笑した。
姫	なんで？　ウルルらしいし、可愛くていいと思うけどな
姫	俺としては、むしろここが……
ウルル	きゃうっ！
姫	たったあれだけしか触ってないのに、もうこんな風に湿ってることのが気になるかな
主人公	下着の上から指をウルルの筋へと埋めてやると、そこはもう熱く湿っていた。たったこれしか触れていないのに、ウルルはもう感じ始めているみたいだ。
姫	やっぱり、期待してくれてたのかな
ウルル	そ、それは、あの……
姫	もしそうなら、俺は嬉しいんだけど
ウルル	ウ、ウルルは、そんなえっちな女の子じゃ……
主人公	俺の質問に恥じらうように頬を染めるウルル。
姫	そうか？　別に隠さなくてもいいのに。ウルルは変なところで強情だから
主人公	俺は、そんなウルルの秘裂の中を、下着の上から上下になぞった。
ウルル	ひあっ！
主人公	ぴくん、とその小さな身体が大きく跳ねる。ウルルはここが弱いのかもしれない。
姫	ほら、ちょっと上からなぞるだけで、こんな可愛い声をあげてくれるんだ
姫	それじゃあ、もうちょっと
ウルル	あ、あう……う、あ、ああっ
主人公	ゆっくりとした俺の指の動きに応えるように、ウルルが甘い声をこぼし始める。
ウルル	だ、ダメですっ。ウ、ウルルは、そんな……
主人公	それでもやっぱり恥ずかしいのか、ウルルは自分を襲っているだろう快感に必死に耐えていた。
ウルル	ん、あ、あふ………
主人公	それでもこぼれてしまう声は、甘くて可愛らしい。下着のシミが少しずつ、けれど確実に大きくなっていく。
姫	ウルルのパンツ、こんなに濡れてきてる……
ウルル	そ、それは、ち、違う、んです……っ
主人公	懸命に否定をするものの、広がっていくシミはごまかせない。
姫	そうかなあ
主人公	俺は、ウルルを隠すそのスプライトの布地へと手をかけると、そっと引き下ろした。
ウルル	あ……
主人公	何もないウルルの下半身。そこに走る小さな筋が俺の視線にさらされる。
主人公	指先でそっと開くと、熱い蜜がとろりと溢れて、俺の指へと絡んできた。
姫	もう、こんなに濡れてる……やっぱり、期待してくれてたんだな
主人公	ウルルで濡れた指先で、ウルルの秘裂の中を上下に撫でる。それだけで、ウルルは大きく仰け反った。
ウルル	あぁっ！　や、に、にいさま……そ、そこはっ
ウルル	つ、つまんじゃ、や、です！　あ、ふあ、ああっ
主人公	その一番手前にある、ぷっくりとした膨らみ。ひっそりと隠れていたそれをきゅっとつまむ。
ウルル	だ、だめぇ！　ウルルは、そ、そこ、とっても弱くてっ
ウルル	や、やあんっ！　き、きちゃう！　きちゃいます！　だ、だめっ！
主人公	嫌がりはするものの、俺の手をはね除けようとはしてこない。俺はそのまま、ウルルの敏感な豆をクリクリといじる。
ウルル	お願い、にいさまっ、ゆ、許して、くださっ
ウルル	あああぁぁっ！！
主人公	そして、ぶるるっ、と震えたその刹那、ウルルは悲鳴にも似た嬌声を上げた。その中から、ぷしゅっ、と熱い液が噴き出し俺の指へとかかる。
姫	軽くイっちゃった、か。ちょっと手でいじっただけなのに……本当に、ウルルは可愛いな
ウルル	あ、は……はぁ……はぁ……
主人公	始めての感覚に、荒い息を吐くウルル。俺はそんなウルルを抱き上げると、そっと地面へと横たえた。
主人公	その細い足を左右に大きく開かせると、ウルルの恥ずかしい入り口が露わになる。
主人公	その入り口を、やはり指で左右に開くと、桃色の可愛らしい秘肉が姿を見せた。
姫	ウルルの……凄い綺麗だ……淡いピンクで……
ウルル	あう……ウルルの、恥ずかしい所……見られちゃってます……
主人公	そこは、ウルルの奥から溢れた蜜で、もう存分に濡れていた。何も生えていないその場所は、ウルルのすべてを俺の視界に映し出している。
主人公	これから俺によって開かれるだろう小さな入り口も、排泄用の小さな出口も、充血し、ぷっくりと膨らんだ豆も、そのすべてが余すところなく見えた。
姫	ああ、見ちゃった。だから、他の所も見せてくれな
主人公	ここまでくれば、ウルルのすべてが見たい。順番は逆かもしれないけれど、俺はウルルの上着の方に手を伸ばす。
主人公	ブラは無かった。上着をズリ上げただけで、その下に隠れていた控え目の丘が二つ姿を見せる。
ウルル	ご、ごめんなさい……ウルル、お胸ちっちゃいです……にいさまに喜んでもらえません……
姫	そんなことないだろ。小さくてもウルルの胸だ。魅力ばかりだと思うけどな
姫	この、ツンと尖っちゃってる先端だって、凄い可愛い
主人公	固く尖ったピンク色の尖塔。風に触れてプルプルと震えるその様子は、それだけで俺を興奮させる。
姫	それに、ウルルは竜族の中じゃあまだ若い方なんだよな。もう少し経ったら、凄い成長期に入るかも知れない
主人公	実際、オペラさんだって、先生だってあの体型だ。ウルルだってそうならない保証はない。まあ、それはそれで少し寂しい気もしてしまうけど。
主人公	そんなことを考える俺に、ウルルは恥ずかしそうに尋ねてきた。
ウルル	も、もしそうなったら、あの……
主人公	が、何を言おうとしているのか、言い淀んでしまう。
ウルル	に、にいさま、の……その……ですから、あの……
主人公	それでも、ウルルは首を左右に振って振り切ると、覚悟を決めたように言い切った。
ウルル	は、挟んだりしたら、喜んでくれますか！？
主人公	つまりは、胸で、ということか。少しでも俺を喜ばせたいと思ってくれてるんだろう、そんな必死なウルルの姿に、自然と顔が綻んでしまう。
姫	ああ、なるほどな。確かにそれは、選ばれた者のみに与えられる力だ
姫	むしろ大喜びでお願いするよ。だから、成長期に入ったらちゃんと育ててやってくれ
主人公	男として、やはり味わってみたい、と思ってしまうのはやはり仕方がないと思う。
姫	それまでは、今しか楽しめない、この胸で楽しませてもらうから
主人公	が、それと同時に、今のウルルのままでもいいなあ、とも思ってしまうのは贅沢だろうか。
ウルル	ひんっ！
主人公	そのウルルらしい胸をそっと揉む。それは確かに大きいわけではないけれど、ふにふにとした独特の感触があった。
ウルル	あ、ああ……にい、さま……む、胸は……
姫	小さくても、ちゃんと柔らかいし、気持ちいいよ。それに、感じてるウルルの顔が凄い楽しい
主人公	すべすべとしたウルルの胸を、存分に味わう。円を描くようにして愛撫しながら、その中心にあるツボミを軽くつまんだ。
ウルル	で、でも、そんな、のは……きゃうんっ
ウルル	や、あぁ……ウルル、つままれるのはダメですぅ……ま、またはしたなくなっちゃいますっ。やあぁ
主人公	ここも弱いのか、指先でこねるようにしていじる度、ウルルはその身体を震わせる。
姫	それじゃあ、もう一つこっちも……
ウルル	あ、ふあっ……ん、あ、はうんっ
主人公	乳首をいじりながら、下の唇も同時に撫でる。秘裂の中を上下に往復するだけで、ウルルの口から熱い吐息がこぼれる。
姫	凄いな……こっちいじってると、ウルルの中からどんどん蜜が溢れてくる
姫	こんなに小さな入り口の奥から……
主人公	いつものウルルからは考えもできない、こんなにもいやらしいウルルの姿。もっともっと淫靡なウルルが見たくて、俺はその指を秘裂の中で一番小さな穴へと持っていった。
姫	それじゃあ、もうちょっと上の、こっちの穴なんかどうかな
ウルル	んあっ！
ウルル	だ、だめです！　そこは、あの、違う所で……お、おしっこの……！
ウルル	や、あ、だめぇっ！
主人公	突く度にぴくぴくと動く小さな出口。が、今度は寂しいとばかりに下の入り口がひくひく動く。
主人公	俺は誘われるように、初めての穴へと口を付けた。
ウルル	ん……あぁ……っ！
主人公	狭く小さな入り口を、柔らかな舌でゆっくりとこじ開けていく。
ウルル	にい、さまの舌……や、優しい、です……
ウルル	はふ……ぞ、ぞくぞくって来て……あ、はあ、んうっ！
主人公	熱い蜜で埋まった秘洞の中を、舌を伸ばして掻き回していく。ぴちゃぴちゃと響き渡る水音に、ウルルは本気で喘いでいた。
ウルル	だ、だめぇ……ウ、ウルル、飛んじゃいそう、です……
ウルル	に、にいさま……も、もう……
主人公	そして、熱く潤んだ瞳を俺を求めるウルル。それは、妹としてではなく男としての俺を求める声だった。
姫	ウルル……
主人公	俺は、それに応えるよう口を離すと、ウルルの小さな身体をそっと抱き起こす。
ウルル	は、はじめて見ました……に、にいさまが、そんな凶器を持ってたなんて……
主人公	地面に伏せるような体勢で、お尻を上げさせる。ウルルの小さくも女な身体のすべてが、俺の位置からだとすべて見下ろせた。
主人公	いやらしく濡れそぼったその光景に、俺自身も信じられないほどに固く滾っている。
主人公	ウルルは、恐らくは初めて見るであろうそれに、不安そうな声を漏す。
姫	いや、凶器ってのはいくらなんでも……
姫	ウルル相手だと、あながち冗談にならない気がしてきた……
主人公	別に自分のが特別大きいだなんて考えたことはない。けれど、いざこうして受け入れてくれるウルルの身体と見比べると、さすがに少し考えてしまう。
姫	こんなに小さいんだな……ウルルの入り口……
主人公	さっきは柔らかな舌だったから平気だったけど、正直指すら入るのか怪しく思えてしまう。
主人公	本当に、ここに俺のを挿れてしまっていいんだろうか……。
ウルル	は、はい。でも、きっと平気です。ウルルも竜族の女の子として、人族のにいさまを受け入れられる身体の持ち主です
ウルル	だから、ウルルににいさまを下さい。きっと、耐えてみせますから
主人公	そんな俺の考えを表情から読み取ったのか、ウルルは不安そうにしながらもそう言ってくれる。
姫	……本当に、いいのか……？
ウルル	はい。ウルルが、それを望んでるんです
主人公	明らかに怖がっているのは分かった。だけどそれでも、そう強く言い切ってくれるウルルの想いを、しっかりと俺は受け止める。
姫	……分かった。それじゃあ、いくぞ。ウルルの純潔、俺がもらう……
ウルル	はい。にいさまがもらって下さい
主人公	俺は熱くたぎったそれを、ウルルの小さな入り口にあてがうと、ゆっくりと押し出していった。
ウルル	ん……く……あ、ああっ！
主人公	メリメリとウルルの膜を引き剥がしながら、俺は中へと自分を沈めていく。それは思っていた以上に固く、狭く、俺をギチギチに締め上げる。
姫	う、くうっ……
姫	ウルルの中……キツキツだ……
主人公	物理的に入りきらないんじゃないか、そう思えるほどの小さな秘洞を、それでもなんとか突き進んだ。
主人公	そして、何かをぶちんと引き裂くような感触と共に、俺の三分の一程度が、ウルルの中へと突き立った。
主人公	赤い破瓜の印が流れ落ちていく。この瞬間、俺はウルルを俺のものにした。
ウルル	はぁ……はぁ……は、はい……に、にいさまだけで、もう、いっぱい、です……
主人公	そして、自分の身体を引き裂かれた痛みに耐えながら、ウルルが声を絞り出す。
ウルル	これが……男の方で……にいさま、なんですね……
ウルル	ウルル……にいさまに奪われました……
主人公	その声は、苦しそうであったものの確かな喜びが感じられた。だからこそ、俺もしっかりとその事実を宣言する。
姫	ああ、確かに俺が奪った。まあ、半分くらいしか入らなかったけど
姫	いいか。ウルルは、もう俺のものだ。忘れるなよ。ウルルは、俺だけのものだ
主人公	この小さな少女のすべてを俺のものにした。もう他の誰にも譲る気はない。ずっと俺だけのものだ。
ウルル	はい……ウルルは、にいさまのものです……やっと、そうなれました
ウルル	にいさま。動いて下さい。ウルルの身体を、にいさまで蹂躙して下さい……
姫	無理しないでいいんだぞ。俺だって、これでもう充分なんだ。
ウルル	無視じゃありません。ウルルが、そうしてほしいんです。ウルルの身体に、にいさまのすべてを刻み込んでほしいんです
姫	ウルル……
主人公	常に他の誰かが喜ぶことを考えて動くウルル。この状況でも、あくまで俺を考えてくれてることが嬉しい。
主人公	だから俺も、そんなウルルの想いを無駄にしないよう、しっかりと味わわせてもらう。
姫	ガマンしすぎるな
主人公	それでも、できる限り苦痛を抑えられるようにゆっくりと動かす。
ウルル	は、はい……
主人公	熱く濡れそぼったウルルの体内。まるで灼熱の溶鉱炉のように、俺を内側から燃えさせる。
ウルル	ん、く……あ、あうっ……
ウルル	わ、分かります。にいさまの熱いの……動いて、る……
主人公	無数のヒダが蠢いて、俺の粘膜を包み込んだ。ゾクゾクとした電流のような響きが、背筋を一気に走り抜ける。
主人公	ダメだ。ちょっとでも気を抜けば、その瞬間で出てしまいそうだ。
ウルル	あ、ああ……す、凄、い……
ウルル	ん、あ、あふっ……い、痛い、ですけど……ぴりぴりって、きます……
ウルル	ウルルの身体を、電気みたいなのが貫いて……あ、あふ……
主人公	さっき一度イッて敏感になっているのか、ウルルの口から苦痛以外の声がこぼれる。
主人公	ポタポタと、あの甘い蜜がこぼれ、地面に小さな水たまりを作る。
ウルル	んぐ、あっ……あふ……んん、んっ……くぅ……
主人公	俺の動きに引っ張られるように響く、甘いウルルの嬌声。
ウルル	あ、あううっ……に、にいさまが……こんな気持ち、いいっ
主人公	とろけたようなウルルの声が耳から俺の心を置かし、下半身の唇が、俺をくわえ込み離さない。まるで吸い付くようなその快感に、腰のあたりに大きな何かが集まっていく。
姫	俺も、だっ。ウルルの中……キツキツだけど、それでも吸い付いてくるみたいで……こ、これ、クセになる……
姫	い、一挿入ごとに、俺を締め上げてくるっ
主人公	キュッと詩めげてくるウルルの秘洞。奥から次々と溢れる蜜に、ほんの少しだけれども動きがスムーズになっていく。
ウルル	う、あ……ああっ！　に、にいさまっ！　にいさまっ……ウルル、ウルル、気持ちいい、ですっ！
ウルル	も、もっと……もっと、下さい！
主人公	ぐちゅぐちゅと小さな水音を立てつつ動く俺の肉棒。それがウルルの身体を内面から刺激し、ウルルの女を引っ張り出す。
姫	ああっ。もっと、もっとやるぞ！　ウルルの中に、もっともっと、思いっきり、注ぎ込んでやる！
主人公	込み上がる欲望は、今にも破裂寸前だった。視界が狭まり、すぐにでもこぼれそうだ。
姫	あ、ああ、あああ！　うああっ！　ね、根本に、きてる！　も、もう！
ウルル	出して、下さい！　ウルルの中に、出して下さいい！！
ウルル	ん、あ、あふぁ……ん、う、くあぁっ
主人公	激しく喘ぐウルルの言葉。それと一緒に、ウルルがより一層きゅうっと締まった。
ウルル	あ、あう……あ、あああああぁぁぁっ！
主人公	びくん、と弾けるウルルの秘洞。その快感に、俺も最後の枷を解き放たれる。
姫	う、くうぅっ！
主人公	俺は、ウルルの中に溢れる欲望のすべてを放出していた。
ウルル	あ、はぁ……にいさまが……ウルルの中で……
主人公	荒い息を整えながらも、ぼんやりと言うウルル。その中で何度も解き放たれる大量の俺を、気持ちよさげに受け止める。
主人公	俺もその気持ちよさに呆然としながらも、いつしか地面に出来ていた水たまりに気がついた。
主人公	それは止まることなく、まだウルルの中から流れ出している。
姫	はぁ……はぁ……ウ、ウルル？　お前……
ウルル	にいさま、やっぱりかっこいい、です……
主人公	ウルルは、自分がそんな行為をしてしまっていることすら気がついていないのか、小さく笑った。
主人公	そしてその笑顔に引っ張られるかのように、俺の意識が薄れだす。
主人公	それはまるで、夢の終わりのようだった。
