主人公	ベッドの上で、ゴロリと寝返りをうつ。
主人公	いつもならとっくに見回りに行ってる時間なんだが、今は違っていた。それぞれの部屋で、こうして休んでいる。
姫	……なんか、手持ち無沙汰だな
紅	ここ数日は毎日外に出てたからな。その気持ちも分からなくはない。なんなら本でも読んでたらどうだ
主人公	紅は本棚へと向かうと一冊取り出し、俺に渡してくれた。タイトルには覚えがある。学園の方でも少し話題になってた恋愛小説だ。
姫	紅が読んでるから、てっきり歴史小説か何かだと思ってた
紅	一応言ってはおく。あたしも女なんだから、そういったものに憧れる気持ちくらいは充分あるんだ
主人公	まったく、と拗ねたように言いながら紅は机に座った。そして読みかけだった本を再び開く。タイトルからすると、どうやらそっちも恋愛もののようだ。
主人公	紅は生真面目で固いっていう印象あるけど、結構乙女モードなんだよな。
主人公	以前学園長も言っていた、見回り用の別チーム。その選抜がようやく終わり、見回りは完全に交代制となった。
主人公	とりあえず、今まで頑張って来た俺達は、今日、明日と休みをもらえた訳だけれども……あって当然と思っていたものがなくなると、こうまで暇だとは。
主人公	俺はベッドに横になりながら、渡された小説をパラパラとめくって見る。
主人公	……ごめん。俺には無理だ、この本。
主人公	静かに表紙を閉じたと同時、入り口の扉からノックの音が聞こえた。
ヴェル	お邪魔しまぁす
主人公	そして覗き込むようにして、ヴェルが部屋の中へと入ってくる。
姫	ヴェル、どうかしたのか？
紅	珍しいな、こんな時間に
ヴェル	ちょっと様子を、と思ったんだけど、本当に暇してるのね
主人公	呆れたように言うヴェルを横になったまま見上げつつ、俺は持っていた本を机の上に置いた。
姫	まあな。その分多目に素振りでもしたいんだけど、今無茶して、いざという時に動けなくなったらどうするんだー、とお目付役様が仰るんでさ
主人公	反対側の机で本を読んでいるお目付役様へと視線を送れば、当然だ、とばかりに頷いていた。
紅	お前は、やり始めたらとことんやってしまう男だからな。少しは手を抜くことも覚えろ
姫	まあ、こんな感じだ
主人公	やれやれと肩をすくめると、ヴェルは小さく吹き出した。
ヴェル	紅の言う通りね。ヒメは突っ走りすぎるところがあるから、たまには休むくらいで丁度いいのよ
ヴェル	ほんとのこと言うとね、私もおんなじ。退屈だったから、二人のところに遊びに来たってわけ
紅	おいおい。二人のところ、じゃなくて姫のところだろ。あたしの存在は抜けてたんじゃないのか？
ヴェル	そんなことないわよ。ちゃんと紅のことも考えてます
ヴェル	ただまあ、ヒメに甘えさせてもらいながら、とは思ってましたけど
主人公	えへ、と可愛らしく舌を出しながら笑うヴェル。そのままベッドの上、俺の脇へと腰を下ろす。
ヴェル	あとはまあ、お誘い、かな
姫	お誘い？　俺を？
ヴェル	ええ。明日は学園も見回りもお休みで、完全な休養日。どこかに遊びに行くには丁度よくないかしら
姫	うーん……でも、今っていつ次の事件が起こってもおかしくない状況。そんな時に、浮かれて遊びに行ったりしてもいいのかなあ
ヴェル	問題ないと思うわよ。事件中だからってみんなが家に閉じこもってたら、お店なんて全部つぶれちゃうじゃない
ヴェル	むしろこんな時でどこも大変だろうから、私たちで騒いであげないと。私たちなら暴漢なんか出たって問題ないもの
紅	確かにな。まあ、たまにはそういうのもいいんじゃないか。少しくらい息抜きしてもバチは当たらないと思うぞ
主人公	なるほど。気にしすぎるとマイナスにもなるか。
姫	そうだな。たまには遊びに行くのもいいか
ヴェル	きゃあんっ♪
主人公	胸の前で両手を握り合わせて喜ぶヴェル。ここまで喜んでもらえると、俺としても嬉しい。
紅	さて、と。それじゃあ、あたしはちょっと出てくるな
姫	あれ、どこ行くんだ？　夕飯ももう済んだし
紅	はあ……あのなあ、気を遣ってるんだからそれくらい気付いてくれ
姫	あ
紅	まあ、一時間もしたら戻るから
主人公	そう苦笑しながら、紅は部屋から出て行った。途端に静かになる部屋に、今度は気恥ずかしさが流れ出す。
姫	なんか、変なところで気を遣うなあ、紅のやつ
ヴェル	わがまま言うのが下手なのよ。自分の気持ちよりも、他人の気持ちを重視しちゃう
ヴェル	……あとで紅にお礼言わないとね
主人公	そう真面目な表情で呟くヴェル。が、次の瞬間には、
ヴェル	だけど今は♪
主人公	満面の笑みで、俺に抱きついてきた。
姫	お、おい。ヴェル？
ヴェル	せっかく紅が作ってくれた時間だもん。姫を堪能させてもらっちゃわないと
姫	ヴェルってさ、本当に甘えんぼだよな
ヴェル	うん。甘えん坊よ。ただしヒメの前でだけ
ヴェル	私のこんな姿知ってるの、ほとんどいないんだから
主人公	確かに。最近はみんなの前でも結構素を見せてる気がするけど、さすがにここまでじゃない。
ヴェル	時間は一時間。なんなら、お風呂にでも行く？　その……私は、ヒメとならまた一緒でも構わないから……
姫	あー、男として耐え難いお誘いなのですが！　残念ながら今の時間は俺は風呂を使わせてもらえませーん
ヴェル	ヒメが望んでくれるなら、占拠しちゃうけど
姫	やめて下さい。明日からの俺の肩身がより狭くなりますっ
主人公	もっとも、この状態を耐え続けることとどっちがいいかと聞かれれば……
主人公	きっとどっちも死刑宣告。
