主人公	傾き始めた陽を浴びて、世界は茜色に変わっていた。
主人公	なんだかんだありつつも、結局あのまま二人で街中デートを楽しんだ俺達。少し静かな所に行きたいというヴェルの願いを受けて、丘へと向かって歩いていた。
主人公	当然ながら、俺の腕にはヴェルがいる。今日のヴェルは一日中このポジションで、本当に甘えたがりだ。
主人公	まあ、そんなヴェルを可愛いなあと思ってしまってる時点で俺の負けなわけだけれど。
ヴェル	本当、こっちは静かなのね
姫	街の方と違って、こっちはあまり人来ないからなあ
ヴェル	絶好のピクニックコースに見えるんだけど、不思議なものね
姫	森の奥の方とかには、ちょっと凶暴な獣なんかもいるから。確率的にはかなり低いけど、普通の人じゃあその一度が命取りだし
ヴェル	そうね。少なくとも、陽が沈みかける時間までは普通いないわね
主人公	するとヴェルは、自分の言葉で何かを思い出したように周囲をキョロキョロ見回し始めた。
姫	どうかしたのか？
ヴェル	んーと、さすがにこれくらい人目が無ければ大丈夫かしら……
主人公	そう呟くと、突如俺の近くに密着するように擦り寄ってきて、とんでもないことを言い出した。
ヴェル	ヒメ、だっこー
姫	ぶっ
主人公	あまりの希望に、思わず吹きだしてしまう。
姫	いや、だっこって……
主人公	正直、ヴェルのイメージに全然似合わない言葉だと思う。まさかここでそれを求めて来るとは思っていなかった。
ヴェル	ダメ？
主人公	ちょこん、と可愛らしい上目遣いで尋ねてくるヴェル。普段の強いイメージと、この甘えん坊な可愛らしいイメージ。
主人公	正反対のイメージが同居しているところが、この少女の最大の魅力なのかもしれない。そして、そんな子に頼まれて嫌と言える男もそうはいないだろう。
姫	そうだな……まあ、実を言えば、俺も一度やってみたかった
主人公	ただし、ヴェルが思っているのとは少々違うと思うけれど。
ヴェル	きゃあっ
ヴェル	ヒ、ヒメ？　あの、これはちょっと違う気がするの……
姫	いや、だっこであることに代わりはないと思うけど。俺の周囲じゃあ、お姫さまだっこ、とか言われてたし
姫	こういうの、いや？
ヴェル	……なんか、私がヒメに手を回せないのがちょっと不安
ヴェル	で、でも……ヒメに守られてるみたいな感じがするのは、すっごくいいかも……
主人公	照れ笑いを浮かべながら、素直に俺へと身体を預けてくれるヴェル。そのまま顔を俺の胸へと埋めてくる。
ヴェル	あ、あの……私、重くない？
姫	全然。むしろ、重さと柔らかさと温かさのバランスが丁度よくて驚いてる。
主人公	小柄なヴェルの身体は思っていたよりも遙かに軽かった。この小さな身体が、あれだけの強さを生み出しているんだと思うと、ちょっと驚く。
姫	こんなにいいものなら、もっと早くやっておけばよかったな
ヴェル	私も、姫の体温と心臓の音とを感じられるの、すっごくいい
主人公	ヴェルは、俺の胸に埋めた顔を、更に押しつけてくると、満面に笑顔を浮かべてそう言った。
ヴェル	こんなことなら、もっと早くお願いすればよかったかな
主人公	別に丘に行くことが目的だったわけじゃない。ただ、こんな風に二人で甘え合える場所に行きたかっただけ。
主人公	気がつけば俺達は、道の真ん中で抱き、抱かれながら、ただお互いの顔を見つめていた。
主人公	陽がゆっくりと赤みを増し、徐々に紫から黒へと変わっていくけれど、気付かない。
主人公	少しずつ冷たさを増していく風も、お互いの温かさが忘れさせてくれた。
