姫	……すっかり遅くなっちゃったな……
ウルル	にいさま、い～っぱいウルルのこと求めてくれましたから♪
姫	う……い、いや、事実ではあるんですけど、改めてそう言われると非常に申し訳ないというか恥ずかしいというか……
ウルル	そうなんですか？　ウルルはすっごく嬉しかったですけど
ウルル	ウルルの心も身体もお腹の中も、みんなぽっかぽかです
姫	ごめんなさい。ちょっとハリキリすぎました……
ウルル	でも、二人一緒に戻ると、ちょっと変に見られちゃうかもですね
姫	そうだな。俺は少し後から戻るから、ウルルは先に戻って休むといいよ
ウルル	はい。にいさま、今日は、本当に、と～っても嬉しかったです♪
主人公	ウルルは満面の笑顔でそう言うと、寮の中へと入っていった。
主人公	一人きり。シンと静まり返った夜気の中で、ただぼーっと月を見上げる。
主人公	その空気の中に感じる寂しさ。
姫	昔は当たり前だったんだけどなあ、こんな空気は
主人公	俺は苦笑しながら呟くと、そろそろいいだろうと、寮の中に入っていった。
主人公	さすがにこの時間に帰ってくるというのは、あまりいい気分がしない。誰かに見つかれば、悲鳴を上げられても文句がいえない状況だろう。
主人公	とりあえずは、このまま抜き足差し足で部屋に……。
姫	って、待てよ？
主人公	風呂に行くところだ、とか言ってごまかすことは可能だな。俺が入れるの、どうせいつも夜中なんだし。
主人公	それに、わざわざ部屋に戻ってからまた降りてくるのも面倒だ。
姫	よし。ついでだし、このまま風呂入ってっちゃうか
主人公	俺は振り返ると、そのまま風呂場へと目的地を変更した。
オペラ	はい？
姫	え？
主人公	風呂場はまさしく戦場だった。
主人公	丁度風呂上りだったのか、ほんのりと上気した肌を、申し訳なさそうに包む小さな上下の布。
主人公	昼間と同様、降ろされた長い髪が、いつもと違った女性としてのオペラさんを感じさせる。
主人公	女性特有の二つの膨らみは、男としての俺の手で掴んでしまえるほどに豊かだ。
主人公	キュッと引き締まったウエストと、大きずぎず、けれども丸みを帯びたお尻のラインは実に理想的。
主人公	って、何批評みたいなことしてるんだ俺は！
オペラ	し、ししし、白鷺、さま？
姫	い、いや、あの……
姫	な、なんでこんな時間にオペラさんが……？
オペラ	いえ……朝まで戻られないだろうと思ったもので……
主人公	この人、本当にそのつもりで俺とウルルの背中押したのか。
姫	……
オペラ	あ……う……
主人公	ダメだ。こういう時こそ、何かを言わなければならない。硬直こそが最大の敵！　少なくとも、紅とのハプニングで俺はそれを知ってるはずだ。
主人公	さあ言え、俺！　ここは素直に謝罪の一手だ！　そしてすかさずダッシュで逃げろ！
姫	オ、オペラさん！
オペラ	は、はいっ！
姫	スタイルいいですね！
オペラ	あ、ありがとう、ございます……
姫	って、違うだろ俺ー！　この空気どうするつもりだ！
主人公	と焦りまくる俺の姿に多少落ち着きを取り戻したのか、オペラさんは小さく笑った。
オペラ	も、もう、白鷺さまったら。さすがに覗きは感心できませんよ
姫	い、いやいやいやいや！　覗きじゃないです！
姫	これは幸せ……じゃなくって不幸な偶然が産んだ悲しき現実というやつでっ
オペラ	それはまあ、白鷺さまも男性ですから、女性の身体に興味を持ってもしかたない……
オペラ	といいますか、むしろ興味持たない種なし男だったりすると、竜族の将来に響くんでやばかったりしますが
姫	なんか、今さらりととんでもないこと言いましたね
オペラ	いえいえ～。竜族の相手は人族が望ましい、なんて少しも思っていませんのでご安心を～♪
オペラ	ところで、あの～……まだ満足とかはしていただけませんでしょうかぁ……
姫	あ……
オペラ	あ、あはははは……
姫	失礼しましたあー！！
主人公	白鷺姫は逃げ出した。
姫	あ、焦った……
主人公	猛ダッシュで、どうにか玄関の方まで戻ってきた俺。あまりの衝撃映像に、本気で思考が停止してしまった。
姫	……オペラさん、ほんとにスタイルよかったな……
主人公	あれ、紅より大きかったんじゃないだろうか。
姫	って、何を考えてるんだ俺はっ！
オペラ	ウルルさまと比べて、どう思われました？
姫	いや、なんていうか、本当に正反対で……いや、ウルルのは、あれはあれで凄いよかったんですけど……
姫	って、いつの間に！？
主人公	しかし回り込まれてしまった！？
オペラ	男性たるもの、ある程度のえっち力は必要ですけど、あんまりえっちすぎるのはダメですよ
オペラ	そ、それではその……
オペラ	し、失礼しました～
主人公	その顔を、風呂上りのためか羞恥のためか、真っ赤に染めて走り去るオペラさん。なんだか新鮮だ。
主人公	普段は結構平然と下ネタ言っちゃう人だけど、やっぱり自分が対象になると恥ずかしいんだなあ。
主人公	そういえば、腕を組んだのも今日が初めて、とか言ってたなあ。
姫	中身は結構乙女なんだな、オペラさん
