主人公	それは異質な光景に見えた。
魔族Ａ	元々はお前が発端だろうが！
魔族Ｂ	そうよ！　あなたがあんなバカみたいな事件起こさなければ、何も問題なかったのに！
魔族Ｃ	ちっぽけなプライドのために、いらないケンカなんか売ろうとするからいけないんですよ！
ラーロン	ぐっ……貴様ら、いったい誰に向かって言っているのか分かってるんだろうな！
魔族Ａ	当たり前だろうが！　今、俺達の目の前に立ってる誰かさん以外に誰がいるんだよ！
ラーロン	この『慈愛の魔王』とまで呼ばれしこの私も、さすがにガマンの限界だ……
魔族Ｂ	はあ……バカみたい。誰も呼んでいないわよ、そんなの
主人公	午後の実技授業。本来なら、復活したラーロンが以前のように胸を張り、その力を誇示しているところだが、今日は違う。
主人公	そのラーロンが、かつては自分の取り巻きだった連中から糾弾を受けていた。
魔族Ｃ	あなたのために、我々魔族がどういう目で見られているかご存じですか？　まるで世界の敵ですよ
魔族Ａ	そうだ。お前が何も考えずに見知らぬ野郎の武器なんかを受け取ったりするからだ。考えが足りなさすぎるんだよ！
ラーロン	貴様ら……今まで私のおかげで上位の成績を取っておきながら……いいだろう、魔王の力をその身に刻んでくれる！
ラーロン	貴様ら、組み手と思って安心するなよ！　泣き叫び、血まみれで土下座するまで叩きのめしてくれる！
魔族Ｂ	ええ、こちらこそ望むところよ。ただ、もう少し周りを見るクセ、付けた方がいいと思うけど
主人公	待ってましたとばかりに武器を手に取る周囲の魔族達。ラーロンに見下されていた連中が、どうやら全員反旗を翻したらしい。
主人公	いくら魔王の血族とはいえ、ラーロンはその末端。ヴェルとは根本的に次元が違う。常人よりも少し強い程度で、この数の差は埋まらない。
主人公	その組み手は、まるで公開処刑のようだった……。
姫	ラーロンは？
ヴェル	養護室の方に運ばれていったわ。あれじゃあ当分まともには動けないでしょうね
紅	恨みってのは重なると怖いもんだな……
姫	まったくだ。とはいえ、まさかここまで手のひらひっくり返されるとは、ラーロンも思ってもなかったろうな
ヴェル	自業自得ね。あれだけ好き勝手やってたわけだし
紅	だが、それってつまりは、学園内での力関係の崩壊、だよな
ヴェル	そうね。今更ハデラ一人倒したところで、何も代わりはしないと思うけど
姫	学園長もミリオさんも、平穏な世界を守るために動いてたはずなんだがな……
主人公	これじゃあまるで、逆じゃないか。溜息と共に見つめた向こうでは、魔族と神族の睨み合いが続いていた。
主人公	きっかけが一つでもあれば、いきなり乱闘が始まりそうな、そんな雰囲気だった……。
