姫	お、おい、ノート？　それは……
主人公	机の上に乗り、大きく足を開くノート。そのま自分の手を、恥ずかしい場所へと持っていく。
主人公	いつものノートからは考えられない行為に、思わず尋ね返してしまう。
ノート	い、いいんですっ。姫くんは見ていて下さい！
主人公	だがノートは、恥ずかしさを必死に押し殺しながら、その行為を続けようとする。まるで俺の記憶に、自分のすべてを焼き付けようとするかのように。
ノート	これは、ボクが姫くんに見ていてほしいんです……
ノート	は、恥ずかしい、ですけど……こ、こんなことするの初めて、ですけど……
ノート	姫くんに、ボクの全部を、見てほしいから……
主人公	その身体が小さく震えているのが分かる。正真正銘の初めての行為。それをよりにもよって俺の前で見せるという恐怖によるものだろう。
ノート	んっ……
主人公	どう動かしていいかも分からない。そんな拙い動きで、ノートの指が自分の身体をまさぐっていく。
ノート	な、なんだか、不思議な感じ、です……くすぐったいみたいな……気持ちいいみたいな……
主人公	ノートの手では包みきれないくらいに大きな胸をそっと揉みしだき、最も恥ずかしい入り口を、その白く細い指がなぞっていく。
ノート	ぴ、ぴりぴりって、ちっちゃな電気が流れて……
ノート	で、でも……こ、こんなのくらい……
主人公	少しずつ熱さを含んでいくノートの吐息。その指の動きが少しずつ速く大胆になっていった。
ノート	きゃぅっ
主人公	その背をわずかに反らせながら、ノートが大きく喘いだ。敏感なところに触れてしまったのかもしれない。
主人公	そして気付けば、ノートの清楚な下着に、いやらしいシミが広がっていた。
姫	ノート、濡れてきてる……
ノート	す、すみません……ボ、ボク……
姫	感じてきてるんだ……
ノート	は、はい……多分……
ノート	姫くんが見てるんだって、姫くんが、ボクのあの……えっちな姿期待してるんだって思ったら、き、急に……
主人公	羞恥に、真っ赤になったまま俯いてしまうノート。けれどその指は止まることなく、自分の身体を攻め続ける。
主人公	徐々に広がるノートの女としての匂いに、俺の下半身も強く反応していた。
姫	そ、それじゃあ……その、濡れて来ちゃってるし、それ、脱いでもらえるか……？
主人公	その先が、ノートのもっと恥ずかしいところが見たい。そんな欲望が抑えられず、つい言ってしまう。
ノート	それ、ですか……？
ノート	え、ええ！？　で、でも、あの、それってつまり……ぜ、全部、見えちゃう……
主人公	どれほどの覚悟をしていても、さすがにそれは恥ずかしいのだろう。躊躇してしまうノート。だけど、俺ももう止められない。
姫	ああ。ノートのその……が見たい
主人公	ノートの目を見ながら言う俺に、ノートは小さく頷いた。
ノート	……は、はい。そうですよね……これから、全部見てもらうんです。それに、さ、捧げるんです……
ノート	こ、これくらいっ
主人公	頼りない薄い布地に手をかけると、一気に脱ぎ降ろす
ノート	ど、どうぞ……
主人公	淡いピンク色に輝く小さな割れ目。それを守るようにひっそりと広がった銀色の茂み。
姫	うわ……な、なんか、凄い綺麗だ……
主人公	あのノートの、一番恥ずかしい場所。あまりにも綺麗で、神聖さすら感じてしまうその場所に、俺は思わず見入ってしまった。
ノート	し、心臓が破裂しちゃいそうなくらい、バクバクいってます……
ノート	は、恥ずかしくて……死んじゃいそう、です……
姫	……アンダーも、やっぱり銀色なんだ……
主人公	そんな俺に、更にすべてを見せようとしているのか、ノートは震える手で少しだけ自分を開いた。
主人公	わずかに濡れた桃色の秘肉が、俺の視線の中にハッキリと映る。
ノート	は、はい。今姫くんが見てるのが、ボ、ボク、です……
主人公	そして、その秘肉に直接指を伸ばした。
ノート	あ、んうっ！
ノート	ぬ、濡れて来ちゃってる……恥ずかしいのに……ボク……感じてきてる……
ノート	ふあ、あっ……んく……んん、あっ……あぅ……
主人公	秘裂の中を上下にまさぐる白い指。その指に、少しずつ溢れだした透明な蜜が絡んでいく。それは徐々に量を増し、小さな水音を立て始めた。
ノート	はぁ……はぁ……あ、は……す、ごい……ぴちゃぴちゃって、音聞こえちゃう……
主人公	そして、いつしか恐怖ではなく快感に身体を震わせながら、ノートは俺を見上げた。
ノート	も、もうダメ、です……姫くん……ボクを、触って下さい……
ノート	姫くんに……感じさせてほしい……
主人公	熱く潤んだ瞳でジッと俺を見上げながら、俺の愛撫を望んでいる。そのノートの姿は、神界の王女でも完全銀髪でもなんでもなく、一人の女の子でしかない。
姫	俺も、もう限界。見てるだけなんてちょっと拷問すぎるよ、ノート
主人公	俺もとっくに限界だ。この少女に、この身体に触れたい。あの声で鳴いてほしい。そんな欲望で埋まりきっている。
ノート	ご、ごめんなさい……
主人公	可愛らしく謝るノートの手を取って、俺はノートを床へと降ろした。が、やはり恥ずかしいのか、降りる寸前にノートは再び下着を穿き直す。
主人公	どうせまた脱がしちゃうんだけどなあ。そんな風に苦笑しながら、恥じらうノートの姿を堪能した。
姫	分かってたけど……本当に凄いな、この胸……
主人公	机を支えに立たせながら、ノートの身体を後ろから抱きしめる。
主人公	穿き直したばかりの下着の中へと手をいれれば、そこは熱く充分に濡れていた。俺の指もすぐにビショビショに濡れてしまう
主人公	そしてもう片方の手は、当然ながらその胸を揉みしだく。男の俺の手を受け止めきる、大きな膨らみ。
ノート	ボクはあんまり好きじゃないんですけど……目立っちゃいますし……
主人公	確かに。少し離れたところからでも目立つし、男ならまずはここに目をやってしまうだろう。
ノート	姫くんは、やっぱり大きい方が好き、なんですか……？
姫	俺は、その子に合ってれば充分だな。だから、ノートにはこの胸、凄くいいと思う
姫	俺の手じゃ、到底足りないサイズに、手が埋まり切っちゃう大きさ……それに、このゴムマリみたいな弾力。凄い気持ちいい
主人公	その弾力に、少し強めに揉みしだく。すべての指が、ズブリと埋まった。柔らかさと反発力とが同居したその感触は、もう手を離したくないと思ってしまうほどだ。
ノート	あ……はぁ……ん、うっ
ノート	だ、だったら、よかった……大きくて。姫くんが喜んでくれるなら、それで充分価値があります
主人公	ブラの上からでも伝わる胸の感触に、思わず浸りかけてしまう。が、俺が今抱いてるのはノートの胸じゃない。ノート自身だ。
姫	でも、ノートは胸だけじゃないからな。こっちも……
主人公	下半身の方も、秘裂の中で指を前後にスライドさせる。
ノート	あっ……ん、あ、んうっ！
主人公	すっかり甘くなった声と共に、中の方からどんどんとヌルヌルした蜜が溢れ出す。下着はもう意味を成していない。
姫	こっちはもう、洪水状態だな……
ノート	ご、ごめんなさい……姫くんに触られたら、本当にいきなり……
主人公	それだけ俺を感じてくれているということが溜まらなく嬉しい。あのノートが、いまこんな格好で俺の腕の中にいるということが。
姫	でも、信じられないな。あのノートの身体を、俺がこんな風に触れることができるなんてさ
姫	これって、国宝級の宝じゃないか？
主人公	俺は言うと、その胸を覆う邪魔なものを一気に上へとずらした。あまりに大きな二つの膨らみが、柔らかそうに揺れながら飛び出してくる。
ノート	えへへ。それはちょっと言い過ぎですけど……嬉しいです
主人公	ノートは恥ずかしそうに顔を赤らめながらも、隠そうとしない。俺の言葉に嬉しそうに頬を緩めた。
ノート	こんな風に、姫くんにぎゅって抱きしめられて……今みたいに価値がある、なんて言ってもらえて
ノート	ボク、しあわせー♪　えへへ
主人公	可愛らしく笑って、俺の胸に頭を当てるノート。そんなノートに、思わず俺自身が反応してしまう。
ノート	あれ、姫くん、どうかしたの？
姫	いや、今のノートが、凄い可愛かったから……
主人公	いくらなんでも、今のはやばすぎた。まだズボンの中だっていうのに、出ちゃいそうになったぞ。
ノート	ほえ？
ノート	あ、あはは……そんな風に言われたら、照れちゃいますよぉ、姫くん
主人公	本当にこの子は、自分の可愛らしさをどれだけ理解してくれているのやら。
姫	いや、そうやって俺を惑わしてくれた罪は償ってもらいます
ノート	え？　きゃあんっ
主人公	俺は後ろから、ノートの胸をより強く揉みしだく。
姫	やっぱ凄いな、これ……
主人公	もう何にも邪魔されていないそれを、直に、自在にいじり倒す。
姫	それに、このツンと尖った先端とか……
主人公	そして同時に、既に固く突き出ている尖塔を指でつまんだ。
ノート	あ……きゃうんっ……つ、つねったらダメ、です……
ノート	や、あ……姫くん……は、激しい、です……あ、は、ああんっ
主人公	一度動いてしまったら、もう止まらない。俺は自分の欲望のまま、ノートの胸を愛撫し続ける。
ノート	姫くんの手……あったかくて……あ、ダメ……
姫	ちょっとやばいかも、俺。この胸、クセになりそう
主人公	まるで粘土みたいに自在に形を変えながら、だけどちょっと緩めるとすぐに元の形を取り戻す。そしてその先端からは、ツンと突き出た桃色の乳首。
主人公	神様はよくもこんな形に女の子を作ってくれたものだと思う。しかも、それをこのノートに与えてくれた。
ノート	あ……はぁ……ん、ああ……ふぁっ
ノート	や、やあっ……ひ、引っ張らないでぇ……で、電気みたいなの走って、お、おかしくなっちゃいそうっ
主人公	ノートの口からこぼれる、まるで楽器の音みたいな澄んだ鳴き声。熱くて甘いその声に、俺の下半身はもうパンパンだった。
ノート	きゃうっ……だ、だめ、もう！
主人公	そして、そんな快感に耐えきれなくなったのかノートの膝が突然にカクン、と折れた。俺はそれを後ろから抱きしめるようにして支えてやる。
主人公	そのまま四つん這いのような体勢で床に伏せさせる。濡れきって､既に使い物にならなくなっていた下着は脱がせてしまった。
主人公	すぐ目の前に、ノートの綺麗すぎる縦の入り口が息づいている。
ノート	う、後ろからはダメですよぉ……ぜ、全部……はしたないところまで見えちゃう……
主人公	ノートの言う通り、ちょっと視線を動かせば、そこにはもう一つの可愛らしいツボミがあった。
姫	えーと、お尻の穴？
ノート	具体的な言葉にしないで下さい！
姫	大丈夫だよ。ノートのは、綺麗で可愛いから
主人公	正直、とてもじゃないけどノートのこの姿を見て汚いとは思えない。むしろそれがどの場所であれ、綺麗としか思えない。
ノート	……姫くん、余裕ありすぎです……
主人公	だが、本人はさすがにそうはいかないんだろう。羞恥に染まりきった表情で、まっすぐに俺を見ている。
主人公	それでも隠そうとしないところは、俺が見たがっていると思って必死にガマンしてくれてるんだろう。
ノート	あの、そ、そういう特殊な行為とかも、してるんですか……？
姫	さ、さすがにそっちは無いかなあ……
主人公	そんな俺の答えにノートは微笑むと、けれどもすぐに不安そうな表情に変わった。
ノート	ボ、ボク……本当に何もかも初めてだから……
主人公	そんなノートの不安を少しでもほぐしてやろうと、俺はできるかぎり優しい声で、そしてほほえみながら言ってやる。
姫	俺も、その……威張れるほどの経験あるわけじゃないけども……
姫	できるだけ、優しくするよ
ノート	は、はい……よろしくお願いします……
主人公	そんなノートの言葉に俺は頷くと、怒張しきった自分を取りだし、その神聖な入り口へとあてがった。
姫	それじゃあ、行くぞ
ノート	あ……う……く……っ！
主人公	初めてのノートの入り口は狭くて固かった。突き進もうとする俺を必死に拒むものの、それでも充分に濡れていたせいか、どうにか俺を受け入れてくれた。
主人公	ぷちん、という感触と共に垂れてくる赤い液体に、俺は自分がノートを汚したんだということを思い知る。
姫	大丈夫、か、ノート……
ノート	は、はい……い、痛いことは痛いですけど……が、ガマン、できますっ
主人公	目を固く閉じて苦痛に堪えるノート。けれどそんなノートとは違って、俺の方がガマンできそうにない。
姫	悪い。俺が無理、かも……
姫	ノートの中、す、凄いっ
主人公	ノートの呼吸に合わせるかのうように蠢くヒダが、俺に絡みつき、そしてしごいていく。
主人公	その快感が連鎖反応のように、さらなる快感を求めて俺を責め立てる。
姫	動いてないのに……も、もう搾り取られてるみたいで……う、くっ
ノート	だ、だったら、動いちゃって下さい……
主人公	そんな俺の気持ちを読み取ってか、ノートが言葉を絞り出す。
ノート	ボ、ボクは平気ですからっ。姫くんが気持ちよくなってくださいっ
姫	大丈夫、か？
ノート	は、はい。思い切り、どうぞ
主人公	実際辛そうではあったけれど、俺ももうガマンできそうにない。俺はそれでもできるだけゆっくりと、ノートの中を動き始めた。
ノート	は、う……ん、あ……あふ……
主人公	まだ固いノートの中をゆっくりと進んでいく。熱いノートの体温が俺の先端から伝わり、俺を内部からも感じさせていった。
ノート	あ……はぁ………ん、ああっ！
ノート	あ、ああっ……す、凄い、です……お、奥、当たって！
主人公	ノートの方も、思ったほどの痛みではなかったのか、すぐに甘い声で喘ぎ始める。
主人公	次々に湧き出す蜜で秘洞は溢れ、俺とノートをより滑らかに結合させていった。
姫	はぁ……はぁ……はぁ……だ、だめ、だもう
主人公	王女というのは身体の方も特別なものを持っているのか、俺にピッタリと馴染んでくる。
姫	きゅっ、って締まって……で、でも、柔らかく吸い付いてくるみたいで……
姫	も、もう、耐えられ、ない……っ
主人公	全身を震わせる快感に、一気に射精感がこみ上げてきた。今すぐこのままノートの中に注ぎ込みたい。
ノート	で、でしたら、姫、くんっ……い、一緒に、一緒、で……
主人公	ノートも、もう限界なのか視点があっていない。俺は絶頂へと向かって、腰を動かし続ける。
姫	あ、ああ！　い、いくぞっ
ノート	は、はいっ。も、もう！
主人公	ぶるり、と大きくノートの身体が震えた。それと同時に締まる秘洞に、俺も臨界点に達する。
ノート	や、あ、ああああぁぁっ！！
姫	う、ああっ！！
主人公	自分でも分かるほどに熱く濃い精が、ノートの体内に注ぎ込まれていく。
ノート	あ、ああっ。ひ、姫くんが、何回も跳ね、て……っ
ノート	あ、溢れ、ちゃいますよぉっ！
主人公	何度も何度も、次々と溢れてくる白いもののすべてを、俺はノートの中にぶちまけていった。
姫	えーと、ノ、ノート？　大丈夫か？
主人公	ようやく収まった俺自身をゆっくりと抜き取れば、真っ赤な純潔の証と、白い俺に汚された証とが一緒にこぽこぽと垂れてくる。
ノート	ぼー……
主人公	ノートはそれを、どこか嬉しそうに眺めていた。
ノート	姫くんが……こぼれてきちゃってます……
ノート	ボク、本当に姫くんと……
姫	……ああ。本当だよ
主人公	ノートの、まだ夢を見ているかのような声に、俺はハッキリと頷いた。今この場所で、俺とノートは確かに繋がった。
ノート	姫くん……
姫	ん？
ノート	責任、とって下さいね
姫	えっ！？
主人公	えへ、と小さく笑いながらのその言葉に、思わず驚いてしまう。いやまあ、別に取らないとかいうわけじゃなく、余りに唐突だったからですが。
主人公	が、ノートも自分が言った言葉の意味にようやく気がついたのか、慌てて手を振った。
ノート	あ……ち、違いますよ、違います！　そう言う意味じゃありません！
ノート	そ、そういう責任じゃないですからぁ！！
