主人公	ノートが学園に来ていない。そんな話を聞いたのは、昼食の時間のことだった。
主人公	昨日は、ああいう状況になってしまったために、さすがにお互いに顔を合わせにくく、どちらも距離を取ってしまっていた。
主人公	そのため、あえてノートの話題をさけていたところがある。
紅	体調不良、とかじゃなくてか？
ウルル	昨日会った時には、元気そうでしたけど……ねえ、にいさま
姫	あ、ああ。俺の特訓に付き合ってもらった時には、全然……
主人公	まさか、その後ので、ってことないよな……？　確かにまあ、ちょっと乱暴だったというか、あんまり優しくとかできなかったけど……。
オペラ	となりますと、あれですね。夜おへそを出して寝てしまった
オペラ	ちなみに、ノートさまは寝る時どのような？　やっぱりその……すっぽんぽん？
デイル	おおおおっ。いいねえ、すっぽんぽーん。男心くすぐってくれちゃうじゃないのお。白姫ちゃんの、あのおおきいのがそのまんま！？
アミア	残念でしたー。お姉ちゃんはネグリジェ派でーす
アミア	まあ、大抵朝は乱れてて、色々とすんごいけど
デイル	うほっ。そいつは夢とロマンを滾らせてくれるじゃないの。ぜひ一度ご参拝したいわ。御利益ありそうっ
アミア	まあ、恥じらいに理性を無くしたお姉ちゃんと正面からやる気があるなら、いいんじゃない？
デイル	ごめんなさい。男子寮で大人しくしてます
紅	まあ、懸命だな
ウルル	何事も、命あっての物種なのです
主人公	ちなみに、ヴェルは昨日の放課後同様、学園長のところへと手伝いに言っている。
主人公	なんだかんだ言っても、やっぱり母親のことが心配らしい。仲のいい親子だと想う。
姫	でも本当に、どうしたんだ？　やっぱり体調不良で……
主人公	だがアミアは、そんな俺に首を左右に振った。
アミア	ううん。違うよ
主人公	そして寂しげに口を開く。
アミア	お姉ちゃんは……戦うことにしたんだ……
主人公	戦う。またその言葉だ。
主人公	昨日、確かにノートもそんなことを言っていた。自分自身と、だなんてノートは言っていたけれど、いったい……。
姫	アミア、ノートはいったい何を……
主人公	尋ねる俺に、アミアは、ただ寂しげな笑みを浮かべるだけだった……。
主人公	本当に、何をする気なんだろう、ノートは……。
