姫	う……
主人公	ゆっくりと目を開く。なんだ、俺、どうしたんだろう……。
フォン	昨夜はお楽しみでしたね
姫	って、フォン！？
主人公	不意に視界に入った少女の姿に、俺は慌てて飛び起きた。
主人公	いやちょっと待て。俺さっきまで何を……って、まさか！？
姫	……えーっと、あの……な、何か見たりとか……
フォン	ヴェルさまとの行為のことを言ってるんでしたら、それはもうバッチリです
フォン	といいますか、ああいうのは別に邪魔したりはしませんけど、せめて周囲を確認してからにして下さい。ほんとにもう
フォン	あまりのいちゃいちゃぶりに、フォン、まだ赤面止まんないんですよ
姫	あ、あはははは……
姫	って、そうだ、ヴェルは！？
フォン	ヴェルさまなら、お友だちを止めに行きました
姫	そんな、一人でなんて……
フォン	行って、どうするんです？
主人公	慌てて立ち上がる俺の足を、フォンの言葉が縫い付ける。
フォン	あのノートさん相手じゃ、姫先輩にできることなんてなんにもないです。むしろお邪魔虫ですね
姫	いや、事実ですけどもまたきつい単語で……
フォン	それに、ヴェルさまには、あの黒白の八枚羽があります。あれを完全開放すれば、今のノートさん相手にもヒケは取りません
フォン	それに、わざわざ言わなくっても今のヴェルさまはちゃんと分かってますよ。恨みとか憎しみとかじゃなく、あくまでも友人として止めてくれるでしょう
姫	違う！　違うんだ。それじゃダメなんだよ。友人として止めたら、いけないんだ……
主人公	以前の戦いを思い出したのか、大丈夫と言うフォンを、俺は否定する。それにフォンは不思議そうに首を傾げた。
姫	ノートは、友人として止められることを望んでいない。ノートが今望んでることは、そんなことじゃないんだ
姫	あの時、俺に向かって言った『信じてる』は、そういう意味じゃない……
姫	今本当にノートを救うなら、俺が、それをやらなくちゃいけないんだ……
ノート	ボクも、戦わなくっちゃって
ノート	姫くん、責任取って下さいね
主人公	ああ、そうだ。今になってはっきりと分かった。確信がある。ノートの言っていた意味。ノートが戦っているもの。ノートが俺に求めたこと。信じたこと。
主人公	だけどさ、ノート。それはあまりに酷ってものだろう。
姫	俺は、その酷なことを……やらなくちゃいけないんだ……
フォン	……え……
フォン	えっと……どういうこと、です？
姫	あいつが、ノートが今望んでることは……
フォン	……なんですか、それは！
フォン	そんなことを望んで、あの銀月はこんな真似をしたっていうんですか！？　トリアさまを殺してまで！
フォン	そんなことしなくたって……なんで、そんな……
姫	みんな頑張ってた。多分、フォンの言う通りだと思う。ノートがこんなことしなくたって、きっとどうにかなった
姫	だけど、どうにかなるけど……今だけだ。大きな溝は残って、次に繋がってしまうかもしれない
姫	もしそれがあるなら、次はいつだ？　十年後か？　一年後か？　それとも、明日か？
姫	ノートが見ていたのは、きっとその日だ……
フォン	はあ……それで、姫先輩は、それを引き受けるんですか？
姫	ああ
フォン	うわ、即答。本当にバカなんですね、姫先輩
フォン	はっきり言いますけど、無理です。姫先輩の力じゃ絶対に無理です。どう足掻いたって無理です。大切なことな上に確定なので三回言いました
姫	あ、相変わらずきついな……
フォン	しかも、姫先輩も間違いなく傷つきます。心も身体もすべてがです。それが分かってるはずなのに、それでも即答しちゃうわけですか？
姫	ああ
フォン	はぁぁぁぁ……本っっっっ当に大バカですね
姫	否定できないところが、やっぱりバカなんだろうなあ、俺
主人公	苦笑しながらそう答える俺に、けれどフォンは、ニッコリと笑顔を見せた。
フォン	でも、納得しました
フォン	ヴェルさまが、あの魔界の黒翼が惹かれたのは、きっとその覚悟なんですね
フォン	どんな時でも前に向かう覚悟。自分の心も身体も傷つくことを厭わない覚悟
フォン	自分が守らないといけない本質を見極め、そのために傷つくことが出来る覚悟。それを守るために全力で立ち向かうことが出来る覚悟
フォン	それは、確かに強さです。それも、ただ自らを鍛えるだけでは得ることのできない、本当の強さ
フォン	魔族にとっては強さがすべて。そんな強さを見せられてしまえば、ヴェルさまだって……
フォン	今ならフォンも、惹かれてしまうかもしれません
主人公	屈託のない笑顔で言われるその言葉。俺の中にあるという強さ。それを、あのフォンまでが認めてくれたということ。
姫	い、いやでも……
フォン	謙遜はいりません。いえ、ここは謙遜するところじゃありません。素直に胸を張っていればいいんですよ。自信を持って
姫	フォン……そうだな、ありがとう
フォン	どういたしまして
主人公	そうお互いが笑い合ったその瞬間――、
ノート	学園内にいるすべての方々に、改めて通告します
主人公	再び、ノートの魔力通信が響き渡った。
ノート	只今より一時間後、大聖堂におきまして……
ノート	魔族殲滅の始まりの儀式として、魔界の黒翼・ヴェル＝セインの処刑を行います
