主人公	静かだった。
主人公	太陽がすっかり沈みきった夜の世界。昼間の喧噪はどこかへ消え去り、今はただ少し冷たさを感じる夜の風と、内部の明かりに浮かび上がる学園の姿だけがそこにある。
主人公	まるで闇に浮かぶ宝石みたいなその光景を、俺はただボーッと眺めていた。
主人公	ほんの数時間前だ。あの場所で、俺がデイルと剣を交えていたのは。
主人公	学園の魔族の中でもトップクラスに位置する実力者。少しくらい手を伸ばしたところで、到底届くはずのない高みに立っていた本当の強者。
主人公	その足さばきは、まるで雲を相手にしているみたいだった。その剣さばきは、風の刃を受け止めているみたいだった。
主人公	こちらの動きを先読みし放たれる数々の魔法。追い詰めてもそれを逆手にとる咄嗟の判断力。
主人公	誰が見たところでデイルの実力を疑いはしないだろう。紛れもない一級品。本物の強さ。
主人公	未だに実感が湧いてこない。けれど間違いない。そのデイルに、俺は勝った。
主人公	ついさっき、デイルとかわした握手の感触が、この右手に残っている。みんなの送ってくれた喜びの声と笑顔が、俺の記憶の中にある。
主人公	滅界戦争を引き起こした罪深い種族、人族。戦士としての力量も他種族に劣り、蔑まれ続ける種族。
主人公	その一員であり、事実学園の中でも最下級に近い強さしかもっていなかったはずの俺が、今ほんのわずか……指先が掠める程度でしかないけれど、あの高みに手を届かせた。
姫	俺、本当に勝ったんだな……
主人公	これ以上疑うことは、俺の勝利を自ら認めてくれたデイルを汚すことになる。だからもう否定はしない。だけどそれでも、やっぱり言葉にしてしまう。
主人公	そしてそんな俺に向けられる笑顔があった。
ヴェル	ええ、もちろん
紅	本当に堂々たる勝利だ。胸を張れ
ノート	姫くん、かっこよかったです
アミア	好感度急上昇、間違いなし、だね
ウルル	ウルル、興奮しちゃいました！
オペラ	今日ばかりは素直に述べさせてもらいます。素晴らしい戦いでした
姫	勝ったんだ、な……
主人公	その右手を見下ろしながら、ギュッと握り締める。この手に握った剣を、今までどれだけ振ってきただろう。
ヴェル	姫……
主人公	優しげに微笑みながら、ヴェルが俺の右拳を、そっと両手で包み込む。
ヴェル	行きましょ
姫	ああ、帰ろう
主人公	俺はここにいるみんなに笑いかけると、静かに歩き出す。
主人公	間違いない。いつになるかは分からないけれど、俺の手はきっと届く。届かせられる。
主人公	俺の目指す、あの場所に。あの、勇者の立つ場所に。
