ヴェル	本当に腹立つわ、あいつらの態度。あの場で全員生まれて来たこと後悔させてやろうと思ったもの！
紅	まったくだな。にしても、よく耐えたなヴェル
ヴェル	多分、私の今までの生活で一番のガマンだったと思うわ。ヒメ、褒めて褒めて♪
姫	うん、ほんとよくガマンしてくれたと思うよ。ありがとうヴェル
主人公	そう言いながら、俺はヴェルの頭を撫でる。ヴェルはえへへー、と嬉しそうに目を細めた。
デイル	姫っちの前の姫さんは、ほんとよく懐いたペット化するよな
主人公	今は昼休み。俺達はいつも通りに、この休憩室に集まっていた。
ノート	随分ご立腹みたいですけど、何かあったんですか？
紅	いや、クラスの連中がな、昨日の姫とデイルの戦いを八百長扱いしてたのさ
アミア	八百長って、インチキってこと？　昨日のあの試合が！？
ウルル	信じられないです！　あれだけの戦いをどういう目で見たらそんな風になるんですか！
オペラ	人族に対する偏見、でしょうか。なんといいますか、種族間のいざこざというのはここまで盲目にさせるものなんですね。困ったちゃんばっかりです
デイル	ほんと、メイドちゃんの言う通りよ。昨日のあれは、俺様にとっても過去最高の戦いだった。そんな風に汚されたくないんだけどねえ
ノート	はい、姫くんは立派でした！　そんなことを言う人たち、ボクも許せません！
オペラ	まったくです。まあ、あちらの方も実にご立派でしたけれど
主人公	言って、チラリと俺の下半身へと視線を送るオペラさん。って、何いきなり爆弾落としますかこの人は！
姫	いきなり何を言ってるんですか、オペラさん！
ヴェル	ほえ？　姫、あちらの方って……？
オペラ	ぽ
姫	そこで顔を赤らめない！
ヴェル	ま、まままままままさ……か……ひ、ひひひヒメ？
アミア	お兄ちゃん、オペラさんとやっちゃったの？
姫	女の子がそんなことを平然と言うもんじゃありません！　ノート、アミアに注意しといた方がいいぞ
ノート	あの……犯っちゃったんですか……？
姫	こちらもですかー！！　ていうかその漢字はやめなさい！　なんとか言ってくれ紅！
紅	…………
デイル	残念、石化レジスト失敗だ
姫	な！
主人公	こ、この流れはマズイ！　常識人が次々とやられていってる。誰が収拾つけるんだおい！
姫	そ、そうだウルル！
主人公	その時俺に電流走る。
主人公	考えてみれば、ウルルも昨日……。
ウルル	にいさまの、怪獣さんみたいでした。えへへ……
主人公	やっぱりかあ！
ヴェル	ウ、ウルルまで……や、やっぱりヒメはちっちゃい子の方が？　で、でもオペラさんは……も、もしかして耳！？　あの耳が必要なの！？
姫	落ち着けヴェル！　頼むから戻ってきてくれ！
ノート	アミちゃん、姫くんネコミミさん好きみたいですよ
アミア	うん。さっすがお兄ちゃん。さらに濃いとこついてくるよね
オペラ	白鷺さま、なんでしたらウサギ耳とかいかがです？
姫	……一応、俺、ノーマルなんですけど……
姫	というわけでだ、まあ……じ、事故だ。うん。事故
主人公	およそ十分にも渡る必死の説明により、ヴェルはようやく落ち着いてくれた。震源地であるヴェルの収束により、他のみんなも収まりつつある。
ヴェル	ご、ごめんなさい。その、頭の中真っ白になっちゃって……
デイル	いや、あんな可愛い黒翼、ここでしか見れないだろうからねえ。実にいいもの見せていただきました
主人公	ごちそうさまといわんばかりに、顔の前で手を合わせるデイル。その行為に、ヴェルは真っ赤になって俯いてしまう。確かに可愛い。
ウルル	ところでにいさま、一つ聞いていいですか？
姫	え？　あ、ああ、構わないけど
ウルル	あの、なんでデイルさんがいるんです？
主人公	恐らくはみんな思ってはいたのだろう。全員の視線がデイルへと集中した。
デイル	うわー、さりげなく切ないお言葉ー。姫っち、説明よろしく
姫	なんでいるんだ？
デイル	すとっぷ、すとーっぷ！　王女様軍団の目の色変わった！　俺様の命のためにも、姫っち真実を！！
姫	悪い、みんな。冗談だ。一応俺の承諾付き
主人公	そんな俺の説明に、そうそう、と頷きまくるデイル。まあ、さっきのみんなの目、この変質者をどうしてくれようって感じだったしな。
ヴェル	なんだ、変質者じゃなかったのね。思わず全力で魔力の解放しようと思っちゃったわ
デイル	俺様、本気で命の危機だったのね……
姫	いやー、さっきデイルに昼食どうするのか聞かれてさ、せっかくだから誘ってみたら、約束キャンセルまでして思い切り食いついてきた
デイル	いや当然でしょ。三界の至宝と揃って仲良くお食事できるなんて機会、普通はありえないんだぜ。どんな予定より優先されるに決まってんじゃないの
姫	まあ、言われてみれば確かに
主人公	あまりに身近にいすぎて感覚麻痺しかけてたけど、ここにいる全員、それぞれの種族からすればアイドルも同然なんだよな。紅だって、人族の中では充分人気者だし。
デイル	つーわけで、まさに棚からぼた餅なこのお誘い、全力で食わせていただきました！
オペラ	実に分かりやすい欲望ですね。まあ隠そうとしないところは、そこらの野良犬より評価できますが
紅	陰湿ではないし、まあいいんじゃないか
ヴェル	姫が誘ったのなら私は問題ないわ。何かあったら生きてることを後悔させるだけだもの
アミア	そうそう。わたし、色々と試してみたい古代の魔法がいくつかあるんだよねー。グングニルとか
ノート	もう、ダメですよアミちゃん。姫くんのお友だちなんですから。何かされるまでは手を出しちゃ
ウルル	でもあの……ご飯をご一緒するのはいいんですけど……
主人公	ウルルは言いながら、申し訳なさそうに端の方のテーブルへと視線を送る。そこには明らかに殺気のこもった視線で俺達を見ている女性陣の姿があった。
オペラ	間違いなく、デイルさまに食事を断られた女性陣かと。ほんっとに女ったらしですねぇ。腕とかもいだらいい声で鳴いてくれそうです
デイル	いやっはっはっは～
デイル	姫っち……このメイドちゃん怖いわ！
姫	ああ、安心していいよ。オペラさんは間違いなく本気だから
デイル	できませんっ！
オペラ	ご安心下さい。このオペラ＝ハウス、ウルルさまに仕えしメイドとして、ありとあらゆる殺人術を仕込まれていますから♪
デイル	ねえ、それメイドに必要なの！？
アミア	あったりまえじゃん。デイルって情弱？
デイル	姫っち……よっく分かったよ。こんな中で揉まれてれば強くもなるよねえ
姫	まあ、色々と、な……
主人公	本当に、色々な意味で強い女性ばかりですから。俺の周り。
アミア	でもさ、今のお兄ちゃん、学園内でどれくらい強いんだろうね
ウルル	あ、それはウルルもかなり興味あります
アミア	昨日の戦いからすると結構上位にいっちゃったりするんじゃないかなあ
ウルル	デイルさん相手にあれだけの攻防をできる人はそうはいないと思います
主人公	楽しそうに、そんなことを話す二人。けれど俺は、それを否定するように首を左右に振った。
姫	残念だけど、まだまだ、だろうな
姫	昨日の戦いは俺もデイルももちろん本気だった。だけどデイルには俺の力を見たいっていう気持ちがあったし、どうしても甘くなったはず
姫	それに、実戦なら最後に俺がトドメを刺されて終わってるよ。昨日の俺の勝利は、あくまでもデイルが認めてくれたからこそだ
主人公	確かに、今までよりは格段に戦えるようになったとは思う。けれどやっぱりまだまだ上には上がいる。ここで気を抜くわけにはいかない。
デイル	まあ、そこまで卑下しなくてもいいと思うぜ
主人公	だが、そんな俺にデイルが笑顔を向けてくる。
デイル	確かにまあ、学園トップクラス、なんて言い出したらやばいとは思うけどさ、上位クラス、ぐらいだったら言ってもいいんじゃないか
デイル	昨日の俺様、あれ、かなり必死だったのよ。最後に立ってられたのも、ほんとギリギリ
紅	そうだな。どちらが上かと言えば間違いなくデイルだろうが、そもそもデイルのレベルが高すぎるんだ。姫が弱いってことには繋がらないさ
ノート	今の姫くんでしたら、三階級の人たちともやり合えると思いますよ
オペラ	あれだけの努力と痛い思いの結果ですからねえ。多少は胸を張ってもバチはあたりません
姫	なんか……みんなにそう言ってもらえるとさすがに恥ずかしいな
ヴェル	大丈夫。みんな本気でそう思ってるんだから。それに、戦ってるヒメ、かっこよかった……えへ
主人公	ちょっとはにかむような笑顔と一緒に贈られるヴェルの言葉。それは少しも疑うことなく俺の胸に染みこむから不思議だ。
紅	まったく。ヴェルの姫好きには負けるよ
ヴェル	当然よ。これに関しては私、世界の誰にも譲る気ないわよ。ね、ヒメ
姫	ごめん。嬉しいんだけど、どう答えていいのやら
主人公	そう言って笑い合う俺達。ほんと、ヴェルはいい子だよなあ。
トリア	おや、ヴェルに婿殿
主人公	そんな会話をしていると、不意に学園長に声をかけられた。いつの間に休憩室に来てたんだ。この人？
ヴェル	母様
姫	学園長。珍しいですね、今日はここで昼食ですか？
トリア	ああ。昨日の午後を完全に潰してしまったせいで、書類が溜まってしまってな。ようやく落ちつきはしたものの、これ以上あの部屋にいたら気が狂ってしまう
主人公	そうか。学園長も応援してくれてたんだっけ。
トリア	昨日の戦いは見事だったな、婿殿。善戦くらいはするだろうとは思っていたが、まさか勝ってしまうとは驚きだ
姫	ありがとうございます。でも、ヴェルやみんなのおかげですよ。俺だけだったら一戦目で終わってます
トリア	自分の弱さと周囲の強さを自覚できるのは強い証拠だ。これからも期待してるぞ、婿殿
トリア	ああ、それから、ヴェルのことよろしく頼む。とんだじゃじゃ馬だが、健気に尽くすぞ、こいつは
トリア	しかも、処女だ。まだまだ子供だが、婿殿の手で立派に色を付けてやってくれ
主人公	さらりと言ってのけた学園長の言葉に、俺は噴き出した。みんなも引きつっている。
ヴェル	な、ななな何言ってるのよ！！
トリア	何って、だからお前が男性未経験の処女だ、と。新品だ、と。調教しがいがあるぞ、と
ヴェル	そこまで！　だから、なんでそんな恥ずかしいこといきなり言い出してるのか、ってことよ！
トリア	最近は男の方も女の処女性を求めるというじゃないか。特に婿殿の周りは高レベルの者が揃っているからな。ここはその独占欲から攻めるべきだろう
ヴェル	べきだろう、じゃないわよ！　そういうことを言うな！
トリア	うーむ。ウチとしては精一杯のエールを贈っているつもりなんだがなあ……いや待てヴェル。まさかお前、もう経験を……
ヴェル	まだに決まってるでしょう！　悪かったわね子供で！　本当なら、昨日あげる予定だったんだから！！
トリア	なに？
ヴェル	ヒメ頑張ったし、私もヒメのかっこいいところ見たらもういっぱいいっぱいで、今ならいけるって思っちゃったのよ！
トリア	ほほ～う。が、失敗した、と
ヴェル	そうよ！　悪かったわ……ね、ぇ……？
主人公	ここまで叫んで、ヴェルはやっと気付いたらしい。自分が何を言ってしまったのか。
主人公	恐る恐る周囲を見回せば、休憩室中が凍り付いていた。
主人公	そして、わずかな静寂の後。
生徒一同	な、なんだってええええええええええええええええええ！！！
主人公	学園そのものが崩壊しそうな大絶叫が響き渡った。
トリア	婿殿ぉ、覚悟を決めた少女に恥をかかせるというのはいただけないねえ
姫	い、いや、その……ほんと気付かなくて……
ノート	あ、あの、ヴェルちゃん？　それで、そのあとどう……？
アミア	やっぱり無理やり押し倒しちゃったりとか？　ヴェルさんおっとな～
ヴェル	な、なんでそんなに興味津々なのよ、あなたたち！　神族でしょ、もっと清楚でいなさいよ！
ウルル	ね、ねえ、オペラ？　もしかしてウルルたち……
オペラ	可能性は高いですね。ヴェルさまが勇気を振り絞った時間、私たちがお風呂場の方でいただいてしまったという……
紅	ヴェ、ヴェル？　ほ、ほんとに？　その、どこまでいってダメだったんだ……？
ヴェル	ふぇ！　だ、だから、あの、その、お、お願いだから忘れて！　みんな今の話は忘れてぇ！
主人公	一瞬にして女性陣に取り囲まれ、逃げ場を失うヴェル。地獄のような質問責めタイムが始まった。
姫	ヴェ、ヴェル！？
トリア	いやいや、婿殿はこっちだ。色々聞かせてもらわんとなあ。大事な一人娘のことだ
デイル	そうそう。それで、なんで断ったりしたのよ、姫っち
姫	い、いやだから、俺は全然覚えが……
主人公	チラリとヴェルの方を見れば、ヴェルもほとんど泣きそうになっていた。その視線がこちらを向き、一瞬目が合う。
ヴェル	はうっ
主人公	が、すぐに恥ずかしさから俯いてしまった。首筋まで真っ赤に染まってるあたりが可愛いんだけれど……。
オペラ	さあさあ、お早く吐いて楽になっちゃいましょう
トリア	婿殿ぉ。あんまりボヤボヤしてると、ヴェルの身体、クモの巣はっちゃうぞぉ
主人公	……俺達が自由になるのはまだまだ先のようだ……。
