主人公	後で部屋の方に来てほしい。寮へと戻ってきてからの別れ際、ノートが俺に残した言葉。
主人公	理由は分からないけれど、ノートの頼み事なんて珍しい。特に用事があるわけでなし、俺はその願いに応えるべくノートの部屋へとやってきていた。
姫	ノート？　俺だけど入っていいか？
ノート	姫くんですか？　ど、どうぞっ
主人公	妙に慌ててる感じのするノートの声に首を傾げつつ、俺は扉の取っ手を握り締めた。
主人公	よく考えてみれば、あのノートの部屋に入るんだよな。これって結構凄いことなんじゃないだろうか……。
姫	……
ノート	……え、えへ……
姫	えーと……
主人公	俺は目の前の光景に、何を言っていいのかさっぱり分からなくなる。
主人公	こめかみへと人差し指をあてながら、自分に問う。これはなんだ。俺は今、何を試されている？
姫	その、ノート？　これはいったいどういう状況で……
主人公	部屋の中に一人佇む美少女。ここまではいい、問題ない。けれどその美少女が、なぜに水着姿なのかが分からない。
主人公	これからグラビア写真でも撮ろうというわけじゃないよなあ……。
ノート	や、やっぱりおかしい、ですか？　この水着……
姫	いや、水着がおかしいとかじゃなくって……むしろ水着はよく似合ってて視線の置き所に困ってしまうレベルなんだけれど……
ノート	ほ、ほんとですか！？
主人公	俺の言葉に、ずずいっ、と勢いよく顔を近づけてくるノート。
姫	え？　あ、はい。それはもう本当に……
ノート	えへへ……よかったです……
主人公	そして、ちょっと恥じらいながらも、嬉しそうな笑みを浮かべた。
姫	えーっと……ノート？　これっていったい
ノート	いえ、あの……ちゃんと着てる状態で見てもらってなかったので、実際に着てみたらどうか見てほしいなって……
ノート	す、すみませんすみませんすみません！　姫くんも色々予定があるのに、こんな理由で！
主人公	ぺこぺこと凄い勢いで頭を下げまくるノート。その姿が妙に可愛らしくて、俺も思わず噴き出してしまう。
姫	いや、別に怒ってるわけじゃないって
姫	ただ、部屋に入ったら水着姿のノートっていうのがあまりに予想外すぎたんで驚いただけで。謝る必要なんかないよ
ノート	で、でもでも……
姫	むしろ、一足早くこんな目の保養をさせてもらえたんだし、お礼を言うレベルかな
主人公	言いながら、わざとらしくノートの水着姿を観察させてもらう。こうして見てもやっぱりスタイルいいなあ、ノート。
ノート	そ、そんなにじっくりと見られると……あの、は、恥ずかしいです……
姫	ごめんごめん。でも本当に似合ってると思うよ。その、どこを見ていればいいのか困っちゃうぐらいに
ノート	す、すみません。そうですよね、姫くん男の子なんですし……と、とりあえずお茶淹れますね。ここ……ベッドの上にでも座っていて下さい
主人公	そう言って、顔を赤らめたままキッチンの方へ向かうノート。
姫	って、水着のまま！？
ノート	あ、あの、何か変、ですか？
姫	いや、変かと聞かれれば間違いなく変なわけだけど、ノート的にそれでいいというなら、俺も受け入れるのはやぶさかではないわけで……男としては嬉しいし……
ノート	はい。それじゃあ、姫くんがいいって言うなら、このままで
主人公	……なんていうか、今はっきり分かった。ノートは純粋培養されてたせいなのかは知らないけれど、やっぱり色々と凄い子だ。
主人公	まあ、それがマイナスではなくて可愛いって感じられてしまうところが、ノートっていう子の恐ろしいところなんだろうなあ。
主人公	ノートは俺の言葉通りに水着姿のままで、お茶の準備に行ってしまった。
主人公	さてさて、と。ちょっと用事があるから、とか珍しくお姉ちゃんが言うんで一人でお風呂に行ってきたわけですが、やっぱ様子変だったよね。なにしてるんだろ。
主人公	というわけで、こっそりと覗いてみたいと思うわけですが……ま、まさかえっちなこととかしてないよね……。
主人公	わたしは、扉をすこぉしだけ開けると、中の様子を窺った。
ノート	そ、そんなにじっくりと見られると……あの、は、恥ずかしいです……
主人公	って、お姉ちゃん水着！？　しかもお兄ちゃんがいる！？
主人公	あまりに予想外の展開に、わたしは頭の中で状況を整理。
アミア	なるほど……つまりお姉ちゃんは、お兄ちゃんに水着姿の自分を披露するために一人残ったと。二人っきりで会うために、と
アミア	ほほ～う……これはこれは……
アミア	濡れる！！
主人公	ああもうほんとに可愛いなあお姉ちゃんたらぁ。言ってくれれば最初っから二人っきりにしてあげるのに。
主人公	まさか、ここまでお兄ちゃんにらぶらぶちゅっちゅなんて。
アミア	うわっ！　水着姿のまんまお兄ちゃんの隣座った！　こいつは凄いよ！
アミア	あー、真っ赤になって俯いちゃったお姉ちゃん、らぶりー！　ぷりちー！　きゅーてぃー！
アミア	ああもう、お兄ちゃんったら！　そこで肩に手を回すくらいはしなきゃダメだっつーに！
アミア	うわ！　うわ！　うわ！　うわ！　いけ！　頑張れお姉ちゃん！　作ってしまえばこっちの勝ちだ！
主人公	そう、この時のわたしはあまりに興奮しすぎて気付いていなかったんです。この恐るべき罠に。
主人公	まさか……。
主人公	まさか……興奮しすぎたわたしの重さで、扉が開いてしまうなんて。
アミア	あいたたたぁ……
姫	えーっと……
ノート	ア、アミちゃん！？　な、なんでここに！？
アミア	……あれ？
主人公	それはあまりに突然だった。
主人公	入り口の扉がいきなり開き、それと同時にアミアが床へと倒れ込む。
姫	えーっと……
ノート	ア、アミちゃん！？　な、なんでここに！？
アミア	……あれ？
アミア	えーっと、その、うん。お風呂上がったから戻ってきましたあ
姫	で、覗いてた、と
アミア	お、お兄ちゃん、相変わらずの鋭さで……
ノート	あうっ
主人公	今までの行為を見られていたと知って、ノートの顔がぼん、と赤くなる。いやまあ、やましいことをしていたわけではないけれど、雰囲気的にねえ？
アミア	いやあ、お姉ちゃんがとっても幸せそうな雰囲気だったもんで出て行くに行けず
姫	まあ、見てたなら分かってるとは思うけれど、別に変なことはしてないぞ？
アミア	ほんとだよね。なんでしないの、お兄ちゃん
姫	え？　俺怒られてる？
ノート	ア、アミちゃあん！！
アミア	あの空気、雰囲気だよ！　少しくらい手を出したって、恥ずかしそうに笑って許してくれるに決まってるじゃん。お姉ちゃんに恥かかせるとか、ほんとありえないよね
姫	え、いや、その……ごめんなさい
ノート	あ、ああああ謝らないでくださぁい。べ、べべべ別に、ほんとに、そういうつもりだったんじゃないんですっ。ただ、姫くんと一緒だと落ち着くし、楽しいし、で……
アミア	でも、肩くらいは抱いてほしかったよねー
ノート	アミちゃん！　ちょっとそこに座りなさーい！
アミア	そういうわけだから、お兄ちゃん！　ちゃんと男見せるんだよ！
アミア	わたし、ウルルちゃんのところで遊んでくるから。二時間くらい！
主人公	そう笑顔で言い残し、アミアは部屋を飛び出していった。
ノート	こらぁ！　逃げないの、アミちゃん！
姫	なんていうか、ほんとアミアはアミアだなあ……
ノート	あうぅ……すみません。騒がしいアミちゃんで……
姫	いや、明るくていい子だよな。そこにいてくれるだけで楽しくなるし
ノート	はい。とっても可愛い妹です
主人公	微笑みながら、誇らしげに言うノート。この姉妹は本当にいい姉妹だよな。
姫	でもまあ、その……さすがに肩に手を回したりは厳しいので……
主人公	俺は、照れ隠しに顔を背けつつ、そっとノートの手を取った。
ノート	あ……そ、その、ボクの手、剣を振ってるからカチカチで……
姫	そうだな。剣士の手だ。だけど、それだけでもないよ。小さくて、温かくて、それにちゃんと柔らかいところは柔らかい
姫	尊敬する剣士の手と、可愛らしいノートの手と、両方が混じってる。この手、好きだよ
ノート	姫くん……そう言ってもらえて嬉しいです。とっても……
主人公	今度はノートが、俺の手を握り返してくる。ぎゅっと、強く。
ノート	姫くんの手は、固くて、大きくて、それに頼りがいがあって……素敵な手です。剣士としてすっごく頑張ってるのが伝わってきて
主人公	二人きりの部屋。水着姿の美少女とベッドの上に座って互いに手を握り合い、こうして見つめ合っている。
主人公	それは想像すると少しおかしくて、だけどとっても素敵な光景に思えた。
主人公	俺達はそれから一時間ほど手を握り締め合ったまま会話をし、そして少し後ろ髪を引かれながらその素敵な光景を終わりにした。
主人公	ノート＝ルゥム、か。やっぱり可愛い子だよな。外見はもちろん、その中も。
