ルアン	お待たせしました
主人公	ヴェルとフォンの暴走がルアンさんによって鎮圧されてから、およそ一時間。
主人公	二人の暴走によって大穴が開いてしまった俺達の部屋が修復可能かどうか、ルアンさんに調べてもらっていたんだけれども……。
姫	あの、どうでしたか
主人公	俺の問いかけに、ルアンさんは苦笑しながら首を横に振った。やっぱりかあ。
ルアン	ちょっと難しいわね。砕けた程度なら私の魔法でもどうにかなるけど、ヴェルちゃんとフォンちゃんの魔力がぶつかった衝撃で完全に消し炭になってしまっていて
紅	やっぱり、修復は難しいですか……
ルアン	あのレベルだと一から作り直しになっちゃうわね。それに部屋の中も魔力の余波で大分痛んでしまっているから、ちょっとすぐに使えるようにするのは無理だと思うわ
姫	そうですか……
主人公	ルアンさんの言葉にがっくりと肩を落とす俺と紅。ちなみにその大破壊を起こした張本人達は、廊下の端で二人仲良く正座をさせられている。
主人公	二人ともさすがに反省しているのか、下を向いてしゅんとなっていた。
主人公	『魔界の黒翼』と『竜魔の紅刃』、魔界の誇る二枚の刃が並んで正座してる光景なんてそうそう見られるものじゃない、というか実はとんでもない光景なんじゃ……。
ルアン	もう、ヴェルちゃんもフォンちゃんもダメですよ、こんなことしちゃ。しっかり反省してくださいね
ヴェル	ごめんなさい……で、でも元はといえばフォンが
フォン	先にしかけてきたのはヴェルさまです、フォンは正当防衛権を行使しただけで……
ルアン	二人とも、喧嘩両成敗という言葉を知ってるわよね♪
ヴェル＆フォン	ご、ごめんなさい！
主人公	再び言い合いに発展しそうになった二人をルアンさんが笑顔一つで黙らせる。
主人公	魔界の誇る二枚の刃をたった一人で、しかも一瞬で黙らせる。連れていかれた向こうでどんな説教が行われていたんだろう……考えるのやめた。怖い。
姫	そういえば、デイルは大丈夫なのか？
ウルル	あ、デイルさんなら今オペラとノートさまが回復魔法をかけています
紅	二人がかりか……
アミア	こんがりと上手に焼かれちゃったからね、まあ多分大丈夫だと思うけど。意外とデイルって頑丈だし
姫	ふたりとも、後でちゃんとデイルにも謝っておくんだぞ
ヴェル	はーい……
フォン	今回に関しましてはさすがにそうします……
主人公	それにしても困った。部屋の修復が出来ないとなると一つの問題が発生してしまう。
ルアン	紅ちゃんと姫くんの部屋、どうしましょうか？
姫	本当……どうしましょう
紅	他の部屋に移ろうにも、空いてる部屋なんて無いしな……
主人公	紅はともかく、ただでさえ俺は男子寮からあぶれる形で女子寮に、もっといえば紅の部屋に転がり込んだ身だ。
主人公	その部屋が破壊された以上、本格的に居場所がなくなってしまった。
ルアン	この場合、部屋の修理が終わるまで、どこか別の部屋でお世話になるしかないのだけれど。紅ちゃんはともかく姫くんは……
主人公	そこまで言ってルアンさんが言い淀む。それも当然だろう。紅との相部屋に関してすら普通ならあってはいけない事だ。
主人公	俺も紅も人族だったからこその特例中の特例、いわば苦肉の策だ。実際、紅が女子寮にいなければ俺はどうなっていたか分からない。
姫	まいったなあ……
主人公	一瞬デイルを頼ろうかとも思ったが、デイルはともかく、デイルのルームメイトが人族の俺を受け入れてくれるとは思えない。
主人公	本気でどうしようかと更に頭を捻ったところで、ヴェルが元気よく手を上げた。
ヴェル	は、はい！　当てが無いなら、私の部屋がヒメを迎え入れるわ
姫	え？
ルアン	あら、本当？
ヴェル	ええ、部屋を壊してしまったお詫びもしたいし
オペラ	さすがヴェルさまですね！　ちなみに本音は？
ヴェル	ヒメと相部屋よ相部屋！　こんなチャンス絶対に逃すもんですか！
紅	おい、こら
フォン	ヴェルさまも姫先輩に関しては本当に分かりやすいですね
主人公	さっきまでの落ち込みようは何処吹く風とばかり目を輝かせるヴェルに、呆れ顔で突っ込みを入れる紅とフォン。
主人公	いやまあ嬉しくはあるんですけどね、ヴェルが本当に反省と善意を込めて提案してくれている事も分かってるし。
ウルル	って、オペラ！？　いつのまに帰ってきてたの！？
オペラ	実はちょっと前から状況を見守っていました。もちろん影からこっそりと♪
ウルル	なんで影からこっそりと……
紅	デイルの方はもう大丈夫なんですか？
主人公	そうだ、オペラさんはデイルの治療をしていたはずだから、ここにいるということは治療は終わったっていうことだ。
オペラ	それが……あまりのことに手の施しようが……
ヴェル	そう……残念ね
フォン	惜しい方を亡くしました
アミア	そうか……死んだか
ウルル	もっといっぱい遊んでもらえばよかったです……
紅	いい奴だったんだがな……
姫	デイル、せめて安らかに眠ってくれ
デイル	いや、死んでねえよ！！
ノート	ああ、まだ無茶しちゃだめですよ、デイルくん
ルアン	あら、ノートちゃんにデイルくん
主人公	オペラさんの言葉に突っ込みをいれながら、デイルとノートが奥から現れる。どうやら問題はなさそうだ。
姫	お、デイル生きてたか
アミア	さすがデイル、しぶとい
デイル	勝手に殺さないでくれよー。頼むぜ本当お願い！
ウルル	あはは、ごめんなさい。ついオペラのフリに乗ってしまって
紅	悪かったな。でも心配したのは本当だぞ、傷は大丈夫なのか？
主人公	紅の問いにはデイルではなくノートが答えた。
ノート	はい、奇跡ってあるものなんですね
デイル	いや、死んだ婆ちゃんと爺ちゃんと久し振りに面会したわ
オペラ	傷の治療に関しては先ほど言った通り、死ぬか生きるかの二択でしたのでノートさまにお任せしました。結果、私は手持ち無沙汰になってしまいまして
ヴェル	本当に手の施しようなかったのね……
フォン	本当にしぶといですね。まあ、魔族の戦士たるもの、その粘り強さは称賛に値しますが
デイル	俺様、死ぬ時は女の子の膝の上か、胸に抱かれながらって決めてるのよね。こんな所で死んでられますかって
紅	その執念には本当に頭が下がるな……
主人公	その後しっかりとデイルに頭を下げたヴェルとフォンに、デイルは笑いながら、気にするなとだけ返した。
主人公	……それで済むレベルじゃなかったはずなんだけどな。
主人公	とはいえ、どうやらこの様子なら後にわだかまりを残す事もなさそうだ。
ノート	そういえばお話の途中みたいでしたけど、大丈夫ですか？
デイル	というか何の話してたのよ
姫	あ、そうだ忘れてた、実はな……
主人公	デイルとノートに俺と紅の部屋について伝えると、二人ともなるほどと頷く。
ノート	やっぱりお部屋の方はダメでしたか……
アミア	うん。お母さんの修復魔法が効かないレベルだと、魔法での修復は諦めた方がいいと思う
デイル	なるほどねえ、そりゃまた難儀なことで姫っち
姫	まあ、ちょっと厄介な問題なんだよな。紅なんかは他の女性陣の部屋に合い部屋でも大丈夫だと思うけど、俺はそう簡単にはいかないし
デイル	俺様も助けてやりたいけど、いまさら姫っちが男子寮に帰ってきたら男共に絞め殺されかねないしなー
姫	分かってはいたけど、やっぱり相当なものだな、俺の嫌われっぷり
デイル	そりゃお前、ひとりだけ女子寮でうはうは言ってる人族を受け入れてくれる男子はきっとレア中のレアだぜ
主人公	……まあ当然だろうな。普通の男なら人族だとか関係無しに腹立つだろう。
主人公	そんな事を頭を抱えながら考えていると、ヴェルが待ってましたとばかりに再び手を上げる。
ヴェル	そこで私の出番ってわけよ！
フォン	楽しそうですね、ヴェルさま……
紅	まあ、気持ちは分かるがな
主人公	苦笑する紅とフォンに気がつかず、再び俺を受け入れてくれる旨を伝えるヴェル。
主人公	さっきはデイル達が帰ってきて、うやむやになってしまっけれど、今度こそとばかりに全力アピールしてきた。
ルアン	どうする姫くん？　私としては当人達がＯＫなら問題無いと思うのだけれども
姫	俺としても問題は無いです。というか、むしろありがたい話なんですけど、その……
主人公	ルアンさんの言葉にちらりとヴェルとフォンを見る。ヴェルは乗り気全開なわけだが、問題はもう一人のルームメイトの方だ。
ヴェル	遠慮なら必要ないわよ
オペラ	ヴェルさま、白鷺さまが心配してるのは恐らくフォンさまのことかと
姫	ああ。ヴェルはいいかもしれないけどフォンが俺を受け入れてくれるかどうか……
ヴェル	う……
主人公	オペラさんと俺の指摘に、ヴェルはようやく今の自分の部屋が一人部屋でないことを思い出したらしい。
主人公	本来なら力尽くでも、というところなんだろうけれど、たった今やり合ったばかりでは、さすがにそうもいかないみたいだ。
主人公	ルアンさんいるしね。
主人公	しまったという顔をした後フォンの方を向くヴェル。他の皆もフォンに注目する。
主人公	当のフォンはそんな視線何処吹く風といった感じで少し思案すると、意外な程あっさり答えを出した。
フォン	フォンは別に姫先輩を受け入れても構いませんよ
姫	え？　いいの？
ヴェル	本当！？　きゃっほ～う♪
主人公	絶対に拒否されると思っていたので、思わず間の抜けた声を出してしまう俺。他のメンバーも一様に驚いたような顔をしている。
紅	ちょっと意外だな、てっきり断ると思っていた
デイル	俺様も俺様も。それでまた修羅場になるんじゃないかとひやひやしたぜ
フォン	失礼ですね、フォンはこれでも融通は利くほうですよ？　それに色々と都合が良いですし
ノート	都合がいい？
アミア	どゆこと？
主人公	なにやら不穏な発言にノートが聞き返すと、フォンはいつも通り天使のような悪魔の笑顔で、はっきりと宣言した。
フォン	同じ部屋ならいつでも寝首をかけるじゃないですか。こんな素敵な環境ありません♪
姫	さ、作戦ターイム！
フォン	はい、どうぞ
姫	よーし、全員集合！
主人公	俺は問答無用で叫ぶと、ヴェルとフォン、そしていまいち状況についていけてないルアンさんを除いた全員で話し合いを開始する。
姫	ど、どう思う？
紅	どう思うといわれてもだな……
ウルル	さすがに冗談ですよね……いくらなんでもあんな……
ノート	そ、そうですよね……
アミア	でもあのフォンさんだよ？　一度目をつけられたら相手を噛み砕くまで絶対に諦めない事で有名なあの竜魔の紅刃フォンさんだよ！？
オペラ	たしかに、フォンさまならやりかねませんね、ざっくりと。むしろやらねばフォンさまでないというか
デイル	ああ、俺様も同意だぜ。ばっさりといかれるな絶対
姫	ざっくりとか、ばっさりとかやめてくれ！
オペラ	それでは、ぱっくりで頭とかお腹とかその辺りを
姫	ぎゃー！
主人公	フォンの言葉の真意をさぐる作戦会議はしばらく続いたが、どう話し合っても、最後には俺が筆舌しがたい状態になる結末しか見えないという結論に達してしまう。
主人公	それから数分後。ようやく終了した作戦会議が出した結論は……。
姫	話し合いの結果、ウルルとオペラさんの部屋にお世話になる事になりました……
主人公	という無難なものだった。
ヴェル	え！？　なんでー！？
オペラ	結論から申し上げますと、白鷺さまとフォンさまを一緒の部屋にするのは危険ということになりまして
ウルル	その後の話し合いの結果、オペラがいるとはいえ実質ウルルは部屋にはルームメイトはいませんから、ウルルの部屋でということになりました
ルアン	なるほど、そういえばそうでしたね。それにオペラちゃんという保護者の方がいるのなら姫くん同室でも間違いは起こりませんね
主人公	納得顔のルアンさんには苦笑するしかないが、確かに理には適った結論だと思う。
主人公	もっとも、オペラさんに対するその認識は激しく間違っていると思いますが。
主人公	ちなみに紅はノート達の部屋に受け入れてもらえる事も一緒に決まった。
ヴェル	ふえ～ん……そんなぁ
主人公	結論を聞いてへなへなとヴェルが床に崩れ落ちる。いや、なにもそこまで落ち込まなくても。
フォン	残念ですね、色々試してみたい事があったのですけれど
姫	えーと、ちなみにどんなことを？
フォン	くす、聞きたいですか？
姫	いえ、遠慮しておきます……
主人公	フォンの目が怪しく光るのを見て思わず一歩下がる。やっぱり本気だ、この子……。
フォン	まあ、出来れば竜族の方と同室だと面白かったですけどね……ええ、残念です
姫	え？
オペラ	……
フォン	いえ、ただの独り言なので気にしないで下さい
主人公	その呟きを聞けたのは俺と、恐らく近くにいたオペラさんぐらいだろう。
ウルル	にいさま、どうかしました？
姫	いや、なんでもないよ……
主人公	なんにしても、これでようやく問題が一つ片付いた。
主人公	その後とりあえず今日は遅いからと、それぞれ解散。デイルも男子寮に向かう。俺と紅は決まり通り、ウルルとノートの部屋にそれぞれ向かって歩きだした。
ヴェル	うえーん！　ヒメとの相部屋……夢の新婚生活……うえぇーーん！
主人公	ウルルの部屋に向かう途中、背後から泣き声交じりのそんな声が聞えてきた気がしたが、俺には振り返ってそれを確認する勇気は無かった。
主人公	ごめんヴェル、本当にごめん……生きるって、辛いことなんだ……。
