主人公	話し合いで互いの合意の上とはいえ、やはり女の子の部屋に入るというのは緊張するものだ。
ウルル	はい、到着です！　ウルルとオペラの部屋にようこそー
オペラ	ようこそー
姫	おじゃまします……
主人公	控えめにそう言いながら招かれるままに部屋に入る。内装に変化があるわけでは無いため、表面上は見慣れたいつもの部屋だ。
主人公	しかし、やっぱり自分の部屋に無い小物やぬいぐるみなんかを見ると、否応無く自分の部屋では無い事を意識させられてしまう。どうにも落ち着かない。
ウルル	おじゃましますなんて、他人行儀ですよにいさま！　元の部屋が直るまでとはいえ、今日からここはにいさまの部屋なんですから
オペラ	そうです、男たるものもっと堂々としていなくてはダメですよ
主人公	逆にウルルとオペラさんは、いつも以上にテンションが高いように感じる。特にウルルは子供のようにはしゃいでいる。
姫	楽しそうだな
ウルル	え？　えへへぇ……だってにいさまと同室なんて、なんだか本当の兄妹みたいじゃないですか、そう思ったらつい
主人公	心から嬉しいという気持ち伝わってくるウルルの笑顔を見てると、なんだか緊張してるのが馬鹿らしくなってきた。
主人公	そうだな。元々ウルルとは兄妹みたいに接してきたんだ、良く考えてみれば今更かも知れない。
姫	確かに、今更他人行儀だったかもな。これからしばらくの間だけど、よろしくウルル。もちろんオペラさん
ウルル	はい！
オペラ	はい、こちらこそ宜しくお願いします
主人公	色々あった結果とはいえ、ウルルと同じ部屋になったのはあながち悪くないかも知れない。そう考えて思わず微笑んだところで、オペラさんがにこやかに口を開く。
オペラ	それではまず重要な事を決めなければなりませんね
姫	え？　なんですか
ウルル	はい？　何を決めるの？
オペラ	ずばり！　今晩白鷺さまが眠るベッドです！
姫	え？
ウルル	ふぇ！？
主人公	俺の中に生まれた温かいものを、たった一言で見事粉々に打ち砕いてくれたオペラさん。俺達は完全に固まった。
オペラ	さあ、お選びください白鷺さま！　今晩のベッドはウルルさまにしますか？　オペラにしますか？　それともふ・た・り・と・も？
姫	いやいやいやいや！　なにいきなり言い出してるんですか！？
オペラ	あら、大事なことじゃないですか。ねえウルルさま？
ウルル	に、にいさまがウルルのベッドに……そ、それってつまり……きゃー！
主人公	何を想像したのか顔を真っ赤にしてうずくまってしまうウルル。それを見て、俺も思わず妙な事を意識してしまう。顔が一気に熱くなっていくのが分かった。
オペラ	ああ、お二人とも初々しいです……特にウルルさまの恥らいったらもう！
主人公	前言撤回。ウルルはともかく、オペラさんと同室になった瞬間に俺の平和は終わりを告げたのだということを、俺は今更ながらに思い知った。
主人公	結局、紆余曲折あった話し合いの末、俺はオペラさんのベッドを借りる事になり、ウルルとオペラさんがウルルのベッドで添い寝という形に落ち着いた。
主人公	最初は俺は床で寝ると主張したが、ウルルに猛反対され却下となった。何でも床で寝て風邪でも引いたら大変だし、なにより床に寝たんじゃ疲れがとれないと。
主人公	そう決まった頃には、もう結構な時間だったので、今日のところは風呂に入って寝てしまおうという事で意見は一致。
主人公	俺も時間を見計らって風呂に入り、今はウルル達の部屋に戻ろうとしている。
姫	入って大丈夫か？
ウルル	あ、はい、大丈夫ですよー
主人公	念のため部屋の前でノックしてみたところ、元気のいい声が帰ってきた。俺は安心して扉を開ける。
オペラ	思ってたより長風呂なんですね
姫	いえ、実は風呂の中でうとう……って、えええええ！？
ウルル	ん？　どうしたんですか、にいさま？
主人公	いや、どうしたも何もウルルさん、あなたなんて格好をしているんですか。
姫	ど、どうしたんだウルルその格好……
ウルル	え？　別にいつも通りの格好ですよ？
姫	そ、それがいつも通りなのか？
主人公	半信半疑といった感じで視線でオペラさんに尋ねると、オペラさんはいつも通りにっこり笑いながら頷いた。
オペラ	はい、ウルルさまは大体寝る時はこの格好です
姫	さいですか……
主人公	いや、別にそれが悪いというわけではないんですけれど、なんといいますか非常に目のやり場に困る格好ではあるわけでして……。
主人公	あれ、でもこのＹシャツどこかで見た事があるような？
ウルル	あ、気がつきました？　実はこれ昔にいさまにもらったものなんですよ
姫	え？
主人公	ウルルにそう言われ、頭を捻って過去の記憶を掘り起こす。
姫	あー、確か小さくなって捨てようとした時に、もったいないからって……もしかして、その時の？
ウルル	はい、その通りです
主人公	なるほど。渡した時は一体何に使うかと思っていたけれど、まさかこんな形でリサイクルされていようとは。
主人公	しかしそうなると、ウルルにこの格好をさせている最大の元凶は俺、ということになってしまうような。
主人公	いや、ちょっと待て納得しないで考えろ俺。部屋にはもう一人、ウルルにこういった事を吹き込む方がいらっしゃったはずだ。
オペラ	はあ～やっぱりウルルさま最高です～
姫	あの、つかの事をお聞きしますが、もしやウルルにこの使い方を教えたのは……
オペラ	サイズの合わないぶかぶかＹシャツと小柄なウルルさまの身体、なればやる事は一つしかないではないですか！
姫	やっぱりあんたが元凶か！
ウルル	あ、はい、オペラにこの使い方を教えてもらいました
オペラ	だってＹシャツですよ、だぼだぼですよ！？　もうそれだけで眠れぬ夜が続いてしまいそうです
姫	本当にこの人は……
主人公	目をきらきらと輝かせながらウルルを抱きしめるオペラさん。それを見ながら、俺は心に固く誓った。
主人公	今後ウルルに何かを渡す時は、必ずその用途を確認しよう。
