主人公	まどろみの中、何処からか声が聞こえる。
？？？	白鷺さま……
主人公	この声は……オペラさん？　あれ、どうしてオペラさんが俺の部屋に……。
オペラ	白鷺さま、起きてください白鷺さま……
主人公	ああ、そうか。俺、昨日の夜からウルルの部屋に泊まっているんだったか。
姫	ん……あーもうちょっと寝かせてください……
主人公	しかし、そこまで考えたところで再び心地よいまどろみが俺を支配する。ああ、どうして眠りかけのまどろみとはここまで心地よいのだろうか……。
オペラ	もう、ダメですよ起きてください白鷺さま
姫	……
オペラ	白鷺さま……白鷺さま……
姫	ぐぅ……
主人公	そうして暫く呼びかけられたが、結局俺は考えるのを放棄して、再び夢の中に旅立つことを決めた。
主人公	が、次の瞬間……。
オペラ	えーい、もうまどろっこしい！　さっさとおきんかーい！！
姫	のわあ！？
主人公	一瞬の浮遊感の後、後頭部に走る激痛に一気に頭が覚醒する。
姫	痛っつうううう！
オペラ	おはようございます、白鷺さま
主人公	後頭部を抑えながら痛みにのたうち回る俺を見下ろすオペラさん。その微笑みを見て、俺は涙目になりながら起き上がる。
姫	酷いじゃないですか、何もベッドから叩き落さなくても……
オペラ	申し訳ございません。再三の呼びかけにも白鷺さまが応じませんでしたので、ちょっとした実力行使にださせてもらいました
オペラ	それに、そろそろ起きないと朝食の時間が終わってしまいますよ？
主人公	確かに時計を見るといつも起きる時間より大分遅い。いくら日曜日でもこれは少々寝すぎだろう。
主人公	昨夜は慣れない環境なのもあって、中々寝付けなかったからなあ。多分それが原因か。
主人公	と、そこまで考えたところで部屋の扉が勢い良く開く。
ウルル	な、なんか凄い音がしましたが大丈夫ですか！？
主人公	そうして、外にいたらしいウルルが部屋に飛び込んできた。どうやら俺が床に激突した時の音は部屋の外にまで届いていたらしい。
主人公	オペラさん、お願いですから今度からは手加減してください。
オペラ	大丈夫ですよウルルさま、ちょっと寝起きの悪い白鷺さまを優しく叩き起こしただけですから
姫	あなたは一度、優しさという言葉の意味を辞書で引いた方がいい
オペラ	私の辞書に優しさという文字はありません！
姫	自信満々に言う事じゃない！
主人公	毎度おなじみのオペラさんに突っ込みをいれつつ、ウルルに挨拶をする。
ウルル	おはようございます、にいさま。良く眠れましたか？
姫	ああ、おかげさまで
ウルル	それは良かったです
主人公	にっこり笑ってくれるウルルに、オペラさんに叩き起こされなければ完璧だったとはさすがに言えませんでした。
姫	とりあえず、次起こす時はもうちょっとだけ優しくお願いします
オペラ	ふむ、優しくとはこんな感じですか？
主人公	オペラさんはそう言うと、今まで俺が寝ていたベッドの上に乗る。そのまま俺が寝ていた位置に覆いかぶさるように四つんばいになると、
オペラ	こうして、このように……白鷺さま……起きて下さい
主人公	俺の頭があった位置で胸を押し付けるかのように上下に、それも扇情的に動かし始める。
姫	ちょ、ストップ！　ストーップ！！
ウルル	うわ、はわわわ！
オペラ	おろ？　なにか違いましたか？
姫	はい！　間違ってます！　むしろ間違いだらけです！
オペラ	ちぇーつまらないですー
主人公	本気でつまらなそうにベッドから降りるオペラさん。その起こし方は確かに優しいかも知れないけれど、あれでは明らかに性的な意味でという前置きがつきます。
主人公	とはいえ一瞬……本当にほんの一瞬だけ、そうやって起こしてもらいたいと思ってしまったのは内緒だ。だって仕方がないじゃない男の子だもの。
ウルル	あの、にいさま……
姫	ん？
ウルル	えと……もし、ウルルがああいう起こし方をしたら喜んでくれますか？
姫	ぶっ！？
主人公	顔を真っ赤に染めつつもじもじしながらそんな事を言ってくるウルルに、思わず噴き出してしまう。
ウルル	あ、あの、今は無理でももうちょっと大きくなれば、そのオペラの様に！
主人公	いきなり何を言い出しているんでしょうこの子は！　ひょっとして、さっきのオペラさんの行動を見たときの俺の思考を読み取られた？
主人公	しかし、俺も男の子、そんな事を言われれば思わず想像してしまうのも、なんというか悲しい性である。
ウルル	あの、こんな感じになるはずです！
主人公	ウルルの成長した姿か……
大人ウルル	兄さま、起きてください……兄さま……
姫	……これはこれで……
主人公	うん悪くない。というか、むしろ素敵なのではないだろうか……。
オペラ	ダウト！
姫	え！？
ウルル	オ、オペラ？
主人公	が、そんな俺とウルルの妄想に、オペラさんの声が横槍を入れる。
オペラ	違います！　ウルルさまは大きくなってもウルルさまです！　ウルルさまでなきゃダメなんです！
姫	いや、何を……
オペラ	具体的に言うと……
オペラ	ここです！
主人公	そう言って、ウルルの胸の辺りを指差すオペラさん。
ウルル	ええ！？
オペラ	分かっていませんね……白鷺さま、ウルルさまは今の体形こそベストなのです無駄脂肪等まったく不要です！　そうこんな感じに！
姫	あー……なるほどなんだか納得しました
オペラ	白鷺さまとは良い友人でいられそうです、むっはー！
ウルル	うう、ウルルだって、ウルルだってもう少しすればオペラみたいに……オペラみたいにー！
主人公	そういって胸を押さえて泣き崩れるウルルの姿は、なんというか不憫と言う以外に表現のしようがなかった。
主人公	何だかんだで結局目もばっちりと冴えてしまったので、顔を洗い着替えると、一人食堂へ。
主人公	ちなみに、オペラさんとウルルはとっくに食事を終わらせてしまったらしく二人とも部屋に残っている。
姫	さすがにこの時間だともうすいてるな
主人公	既に朝食が提供される時間ギリギリなだけあって、食堂内は閑散としていた。それでも日曜だけあって、まだ残って雑談をしてる面々も何人かはいるけれど。
主人公	そしてそんな中に見知った顔を見つけた。
ヴェル	あ、ヒメ
紅	なんだ、今から朝食か？
姫	あはは、さっきオペラさんに叩き起こされた。席いいか？
主人公	トレーを持ったままそう聞くと、二人とも快く頷いてくれた。
紅	それにしてもだらしがないなあ。学園がないからといってだらけすぎるのはダメだぞ
ヴェル	ヒメって朝弱いの？
姫	いや、低血圧ってわけじゃないんだけど、何故か朝起きるのは苦手なんだよな
紅	まあ、夜に自主練をしたりしていて人一倍疲れているだろうし、仕方ないのかもしれないけどな
主人公	紅と同じ部屋になってからも、大体は紅に起してもらっていた。この歳になって一人で起きられないというのも情けないので注意はしているのだけれど、どうにも難しい。
主人公	ちなみに、たまに一人で起きられた時に限って紅の着替えにぶつかったりする。我ながら妙なところでタイミングの神に愛されているみたいだ。
姫	そういえば、紅の方はどんな感じだ？
紅	ああ、特に問題無しだ。アミアは随分はしゃいでたけどな
ヴェル	目に浮かぶわね。それにしても二人とも本当にごめんなさい
姫	まあ、過ぎた事だし気にする必要ないさ
紅	まあ、ミスは誰にでもあるさ。今回のは随分とダイナミックだったけど。幸い、壁が壊れた以外の被害も無かったし
ヴェル	そう言ってもらえると少し楽になるわ、ありがとう
主人公	実際あの後、紅と一緒に学園で使うものを回収しに行ったのだけれど、一部を除いて問題無く回収できた。
主人公	ちなみに一部とは俺の机の中にあったもので、壁に穴が空いた際に、哀れ俺の机はその一部共々粉々に吹き飛んでしまっていた。
姫	いや、机の中に色々入れてなくて助かった
紅	それは褒められた事ではないような気がする……
姫	不幸中の幸いってやつかな
ヴェル	なんにせよ無事だったなら良かったわ
主人公	そうして食事も終わり、トレーを片付けた後もヴェル達と雑談を続ける。今日は特に用事が無いので暇だというのが本音だけれど。
ウルル	あ、にいさま。やっぱりまだここにいたんですね
姫	あれ、ウルルとオペラさん、どこかにお出かけですか？
オペラ	ええ、ちょっとトリアさまに呼ばれていまして
ヴェル	母様に？
紅	もしかして、例の侵入者に関する事ですか？
ウルル	詳しい事は聞いてないですけど、ルアンさまも来るらしいので多分そうじゃないかと思います
主人公	なるほど、三界のトップが揃い踏みということは何か重要な案件である事は間違いなさそうだ。
ウルル	それで、ウルルはたぶん夕方まで帰れないと思いますから、にいさまにこれを渡しておこうかと思って
主人公	ウルルの手から受け取ったものは部屋の鍵だった。なるほど、確かにこれが無いとウルル達が帰ってくるまで部屋に戻れなくなってしまう。
姫	確かに受け取りました、ありがとう
ウルル	はい、それじゃ行ってきますね
紅	ああ、行ってらっしゃい。気をつけてな
オペラ	大丈夫です、何があっても私が命をかけてお守りします！
ヴェル	頼もしすぎて困るわね……
主人公	そうして食堂を出て行く二人。が、オペラさんは不意に立ち止まると、俺にしか聞こえないような小声でこっそりと告げてきた。
オペラ	すいません、私は訳あって昼頃には戻るのですが、そのタイミングで皆さんを集めていただけませんか？
姫	え？　何でですか？
オペラ	理由はその時に詳しく話しますので
主人公	一瞬何事かと思ったものの、オペラさんの顔がいつに無く真剣だったので俺は黙って頷いた。
オペラ	ありがとうございます
ウルル	オペラぁ？　どうしたの？
オペラ	なんでもありません、すぐ行きますよー
主人公	食堂の扉からひょっこり顔を出したウルルの呼び声に答えると、オペラさんはいつもと同じ調子でウルルと一緒に食堂を出て行った。
紅	オペラさん何だって？
姫	昼にみんなを集めてほしいって
ヴェル	みんなって、ノートやアミアもってこと？
姫	多分
主人公	一体どういうことなんだろうと首をかしげる俺達だが、その答えは結局出なかった。
