主人公	こんなものを一撃でも喰らえば、それだけで戦闘不能になりかねない。俺は冷や汗を流しながら回避できた事に心から安堵する。
姫	それも分かってます！　だけど、今回は俺一人じゃないですよ！！
デイル	飛んでけ！　『風の刃！』
バリアリーフ	なっ！？
主人公	その直後、デイルが『風の刃』を放った。それを間一髪でかわす先生。
バリアリーフ	生徒デイル！
デイル	まだまだ行くぜ、続いて……
バリアリーフ	させません！
姫	俺を忘れないで下さい！
主人公	デイルに鞭を振るおうとした先生を、出来るだけ最速の攻撃で邪魔をする。
主人公	実践ならこの程度の一撃で気鱗は突破できないので無視されるだろうが、今回は一撃を当てればこちらの勝ちだ。先生も回避せざるを得ない。
バリアリーフ	くっ！
デイル	あぶねえ、サンキュ姫っち！
主人公	それにより一瞬だけ先生の鞭を振るう速度が緩む。デイルは鞭を回避すると、再び間合いの外へ逃げ、すかさず攻撃魔法を放つ。
デイル	『氷の槍』だ！
主人公	直後に飛んできた氷槍を回避する先生だが、それに合わせてすかさず俺が剣を振る。
バリアリーフ	なるほど、これは良く考えられた連携ですわね
主人公	竜族の先生に近接で勝てないなんて百も承知。それでも俺が危険を冒してまで鞭の内側に飛び込んだ理由はただ一つ、デイルの魔法攻撃を援護するためだ。
主人公	デイルには決して先生の間合いに入らず遠距離魔法戦に徹するように伝えてある。もし踏み込まれてもすぐに離脱するようにと。
主人公	離されるな！　喰らい付け！　俺が居ることを常に意識させるんだ！
主人公	そう胸中で叫びながら、的確に放たれる拳や蹴りをなんとか紙一重でかわし続ける。一撃でも喰らったら終わりという綱渡り、正直生きた心地がしない。
デイル	次行くぜ姫っち！
姫	ああ！
バリアリーフ	くっ、あの距離は鞭の射程外ですわね
姫	行かせない！！
主人公	再び踏み込もうとした先生を、今度は間に割り込むように突撃して止める。
バリアリーフ	どきなさい！
姫	ごめんこうむります！！
主人公	そうして再び放たれた拳を必死にかわす。俺の攻撃が通る必要は無い。ただ先生にとって邪魔な存在であればそれでいい。
主人公	ほんの僅かでもいい、鞭のキレが落ちてくれれば遠距離戦に徹しているデイルなら充分に回避できる。
バリアリーフ	驚きましたわ。まさかここまでやるとは……貴方への評価を改めないといけませんわね……
主人公	俺の張り付きと遠距離からの攻撃に感心したように呟く先生。その言葉は素直に嬉しいが、今はそれを喜んでいる暇は無い。
姫	デイル！　いまだ、一気に決めるぞ！
デイル	あいよ！　『雷の牙』全力展開行くぜ！
主人公	俺の言葉にデイルが足を止めながら精神を集中。周囲に次々と雷で作られた短剣を生み出していく。
バリアリーフ	けれど、まだまだ詰めが甘いですわね！
主人公	これ以上長引くと俺がもたない。そう判断したからこそ俺は、デイルに全力攻撃の指示をだした。
主人公	だが、デイルからの攻撃が止まったその一瞬の隙に、先生は気鱗を全開にして俺の剣を”掴んで”止めた。
姫	な！？
バリアリーフ	焦りすぎましたわね。生徒デイルからの援護さえなければ、貴方を捕らえる事はそう難しくありませんわ
姫	しまった！
主人公	剣を掴まれ、咄嗟に武器を手放すかを迷ってしまう。だが、その隙を先生が見逃すはずが無い。動きが止まった俺の身体を、先生は剣ごと無造作に持ち上げる。
バリアリーフ	さあ、一度仕切りなおしと行きましょう！
姫	うわあ！
デイル	姫っち！？
主人公	そして、そのままデイルの居る方へと投げ飛ばした。が、その瞬間、無防備状態の先生の姿が視界に入る。
姫	構うな！　撃て、デイル！！
デイル	ちい！！
主人公	デイルは俺と激突する寸前、展開途中だった『雷の牙』を先生に向かって一斉撃ち放った。
バリアリーフ	良い判断です、しかし……
主人公	先生の言葉の続きは、降り注いだ雷の短剣による爆音によって完全にかき消された。
デイル	ぐっ、いってぇ……大丈夫か姫っち
姫	なんとか……それよりすまない油断した
デイル	いや、上出来さ。あれだけできりゃな
主人公	投げ飛ばされたままデイルに激突したものの、デイルが受け止める形でフォローしてくれたおかげでダメージはそこまで受けていない。
主人公	俺達は立ち上がりながら煙が晴れるのを待つ。
デイル	んで、今の決まったと思うか？
姫	まさかな……って、避けろ！
デイル	うおっ！
主人公	あの程度で決まってくれるなら苦労はしない、そんな気持ちでいたのが幸いした。煙の中から飛んできた鞭を、どうにかギリギリで回避する。
バリアリーフ	まだ魔法の練りこみが甘いですわね、それに狙いも適当ですわ。あの程度なら鞭で打ち落とすのは難しくありませんわよ
デイル	ですよねー。やっぱ乱射と土煙は失敗フラグだったか
姫	まったくだな。ていうかお前が撃ったんだろうに
主人公	煙が晴れると、そこには無傷のままの先生が立っていた。先生の周囲の地面だけ綺麗に抉れている事から、恐らく鞭で全て打ち落としたんだろう。
主人公	それにしてもまずいな。さっきの作戦が勝つための数少ない手段だったんだが……。
デイル	さて、どうする姫っち。もう時間も無いぜ
姫	同じ手はもう通用しないだろうしな
バリアリーフ	さあ、逃げてばかりでは勝てませんわよ
主人公	なんとかデイルと鞭から逃げ回りながら考える。既に残り時間は少ない。仕掛けるとしたら次がラストアタックになる。
主人公	かといってネタが割れている以上、もう俺を『風の翼』で打ち出す手は通用しないだろう。間違いなく迎撃される。
姫	待てよ？　二度同じ手は通用しない？
姫	そうかその手があったか！　デイルもう一度『風の翼』だ！
デイル	おいおい、今度は間違いなく迎撃されっぞ！
姫	説明してる暇は無い！　いいから早く準備を！
デイル	どうなってもしらねえぞ！
主人公	そういってデイルが再び精神力を溜め始める。
バリアリーフ	そう何度も同じ手は通用しませんわよ！
主人公	しかし、当然の如くそれを妨害しようと鞭が跳んで来る。デイルは魔法を行使するために一瞬でも足が止まるため格好の餌食だ。
主人公	しかし、俺はむしろそれを待っていた。
姫	間に合え！
バリアリーフ	は！？
デイル	姫っち！？
主人公	同じ手は二度と通用しない。デイルが再び魔法発動を準備すれば、必ずデイルを狙って鞭が放たれるのは分かっていた。だから俺はその間に無理やり割って入り……
主人公	デイルの盾になる形で、その鞭をわざとその身に受けた。
姫	ぐあぁっ！？
主人公	余りの痛みに動きが止まる。これが鞭の痛みか、とんでもないぞ。
主人公	だけどこれでいい。これで魔法一回分の時間は稼いだ。
姫	デイル！　”跳べ！”
デイル	っ！　『風の翼』！！
主人公	その一言で意図を察してくれたのか、デイルは”自分”に『風の翼』を発動させる。
バリアリーフ	まさか！？
主人公	風によって推進力を得たデイルは、俺を飛び越え先生の下へ迫る。それと同時に俺も地面を蹴った。
バリアリーフ	味な真似をしてくれますわね！
主人公	この戦闘中、俺がデイルの近くにいる状態で『風の翼』が使用されようとすれば、先生は俺が飛んでくると警戒するはずだ。それを逆手に取ったコンビネーション。
主人公	最初に一度、見せていたからこその奇襲攻撃。
デイル	これでどうだ！　『炎の矢！』
姫	うおおおおおおおおお！！
主人公	デイルが空中で魔法を発動しようとする間、少しでも意識を引くために腹から思い切り声を出しながら先生に向かって全速力で突っ込む。
主人公	上空と地上から。同時に迫る敵に対して先生はどちらを迎撃すべきか迷う。けれどその思考も一瞬、すぐに鞭をデイルに向けて放った。
バリアリーフ	落ちなさい！
デイル	ぐっ！
主人公	空中にいては避けようが無いデイルだが、鞭で打たれる直前に剣から炎の矢を射出。そして地面に叩きつけられながらも、
デイル	爆ぜろ！！
主人公	それを展開させた。
バリアリーフ	これが狙い！？
主人公	そう、初めからデイルは当てることを考えていない。デイルは爆炎によって先生の視界をさえぎるため炎の矢を撃った。
主人公	なまじデイルの方を見ていただけに、閃光と爆音を正面から受けた先生の動きが一瞬止まる。俺はそこを見逃さずに駆け込むと、
姫	もらったぁ！
バリアリーフ	しまっ！？
主人公	すれ違い様に剣を振り払った。
女子生徒	そ、そこまで！　５分経ちました！！
主人公	それと同時に時間を見ていた女子が終了を継げる。だがその直前、俺の剣はしっかりと先生の胴を捕らえていた。
バリアリーフ	……ふう、してやられましたわね
姫	……時間ギリギリでしたけど、これは……
バリアリーフ	ええ。完璧な連携と作戦でしたわ、生徒白鷺
主人公	そう言って先生はにっこりと笑うと、
バリアリーフ	生徒白鷺、生徒デイルコンビの課題クリアを認めますわ
主人公	そう他のクラスメイトにも聞えるように宣言した。
クラスメイト	うおおおおおおおおおおおおお！！
主人公	次の瞬間、クラス中から賞賛の声が上がる。あまり賞賛を送られる事に慣れてない俺は一瞬呆然としてしまう。
ヴェル	ヒメー！
紅	姫！
主人公	そんな俺のもとに、クラスメイトを押しのけてヴェルと紅が駆けて来ているのが見えた。そしてデイルが俺の横に立つ。
デイル	やっぱ俺様の目に狂いは無かったな。言っただろ？　俺様人を見る目はあるんだぜ
姫	ああ、ほんとだな……
デイル	ま、なんにせよやったな姫っち。ほれ
姫	ああ！
主人公	デイルが上げた手を、俺は笑顔で叩いた。そこへヴェルと紅とが丁度辿り着く。
ヴェル	ヒメ大丈夫！？
姫	大丈夫だよ、ほら。ピンピンしてる
紅	見事な作戦勝ちだったな、感心したぞ
フォン	そうですね、悪くありませんでした。多少姫先輩の評価を改めないといけないかもしれませんね
主人公	そんな二人の後から、フォンもゆっくりとやってくる。
姫	いや、最後のはデイルのお陰ってのが大きいよ。目くらましの事まで伝えられなかったのに、ちゃんと先生の目をひきつけてくれたし
デイル	俺様まじ頑張ったぜー。正直、もうしばらくはがんばりたくないわー
主人公	そんな相変わらずなデイルに皆で笑う。
バリアリーフ	さあ、嬉しいのは分かりますが、まだコンビが残っていますよ。次のコンビ、準備なさい
姫	ああ、そうか。次は俺達が時間を計る係だったな
デイル	んで、次の組は紅っちと姫さんだろ？　二人とも頑張れよ
紅	ああ。姫たちのようにはいかないかもしれないが、やるだけの事はやってくる
ヴェル	そうね。それじゃ、応援してねヒメ
姫	もちろん。がんばってくれよ二人とも！
主人公	そう言って、準備を始める二人のそばから離れる俺達。フォンもまた、再びギャラリーの方に戻っていった。
バリアリーフ	それでは、次は生徒ヴェルと生徒白川のコンビですね
主人公	先生もそれを確認すると二人の前に立った。ギャラリー達が歓声を上げる。なんといっても、ヴェルと先生の勝負。盛り上がらないわけがない。
主人公	俺は両者が位置についた事を確認するとゆっくりと手を振り上げると……、
姫	試合開始！
主人公	思い切り声を張り上げた。
