主人公	そうして待望の実技の時間が訪れたのだが、何故か鐘が鳴った以降も実技の教師が現れない。
ヴェル	どうしたのかしら、先生来ないわね
姫	ああ。いつもならとっくに来てるのに
紅	さっき誰か呼びに行ったはずだから、そろそろ来るんじゃないか
デイル	お、噂をすれば確認しにいった子が帰ってきたぜ
主人公	デイルの言葉に入り口を見ると、確かに確認に行った女子の姿が見えた。
フォン	でも、先生を連れてきたわけじゃないみたいですね。やっぱり何かあったのでしょうか
女子生徒Ａ	確認してきたよー
男子生徒Ａ	それで、何だって？
女子生徒Ａ	うん。なんだか今日の授業担当の先生が二人とも急用と病欠で学園にいないんだって
男子生徒Ｂ	マジで！？　それって授業どうなんの？
女子生徒Ａ	わかんない。とりあえず何か考えるから闘技場で待機しててって言われたから
主人公	確認にしに行った女子の言葉に周囲の生徒達がざわめく。
デイル	ありゃりゃ、そりゃまたタイミングの悪い
ヴェル	こういう場合ってどうなるの？　自習かしら
姫	どうだろう……そもそもこういう事が初めてだから何とも言えないな
紅	自習は無いんじゃないか？　確か武器を使った実技授業は必ず監督の教師が付かないといけないって規則があっただろ
主人公	言われてみれば確かそんな規則があったのを思い出す。座学の授業と違って実際に武器を振り回す実技の授業に教師がつかない事なんて確かにありえない。
姫	というか、模擬戦闘用の装備が入ってる倉庫の鍵も担当の人が管理してるはずだし、勝手に使えないしな
デイル	となると、最悪授業中止で教室で自習かね？　おいおい、せっかく久々にやる気だしたのにこれは無いぜ
紅	いや、普段からやる気を出せ
主人公	どうやら他の生徒達も俺達と同じ考えに至ったのか、各所で授業が中止になったことを喜んだり悲しんだりしている声が聞こえる。
主人公	しかし、そんなクラスメイト達のざわめきが、闘技場に入ってきた見慣れた教師の姿にピタリとやんだ。
バリアリーフ	お待たせしましたわ
姫	え？　先生？
主人公	闘技場の入り口には、珍しく戦闘服に身を固めたバリアリーフ先生の姿があった。一体何事なのか、先ほどとは別の意味でざわめくクラスメイトを一言で静める。
バリアリーフ	全員静かにしなさいな。これより授業を開始しますわ。集合なさい
デイル	ここでドラ先生の登場は予想外だぜ。しかもあの格好、ドラ先生が代わりの先生ってことかね
ヴェル	でも、今日は二対二の連携戦闘でしょ？　先生一人って事はやっぱり模擬戦はないんじゃない？
紅	ま、その辺りも説明してくれるだろう、とにかく集合しよう
フォン	そうですね、遅れたら怖そうです
主人公	紅の言葉に頷くと、俺達も足早に先生の前へと集合した。
バリアリーフ	全員集まりましたわね。では、最初に皆さんに何故私がここに来たのかを説明しましょう
主人公	そう前置きをして、先生は俺達の知りたかった事を説明してくれる。
バリアリーフ	まず、もう知っているとは思いますが、今日の授業を担当するはずだった方々は急用のため学園を離れてしまいました
バリアリーフ	そこで急遽、手の空いていた私がこの時間を担当する事になりました。私は知っての通り皆さんの担任ですからね、皆さんの事は把握していますから
主人公	なるほど、確かにそれなら先生が選ばれたのも納得だ。しかし、実際の授業はどうなるのだろうかと疑問を抱いたところで手があがる。
ラーロン	一ついいか、教師Ａ
バリアリーフ	はい、なんでしょう、生徒ラーロン
ラーロン	事情は理解した。しかし、授業はどうなるのだ。今日の実技は教師との模擬戦闘が予定されていたはずだが、それはどうなるのだ？
ラーロン	正直急用が出来た等という教師がどうなろうと知ったことではないが、模擬戦が行われないのは我慢ならん。私の活躍の場を奪われるのは甚だ不愉快だ
主人公	相変わらず勝手な理論だが、模擬戦が無くなって残念だという一点においては俺も同じ気持ちだ。折角デイルとコンビが組める貴重な機会なんだから。
主人公	ま、ラーロンの場合は単に自分の活躍の場が減らされるのが我慢できないだけだろうけれど。
ラーロン	それにこの、ラーロン＝ハデラの華麗なる戦いを心待ちにしている者達も多かろう。その者達が落胆するのは多少なりとも心が痛む
ヴェル	ねえ、あれはひょっとしてギャグで言ってるのかしら？
紅	いや、本気だろうな……もっとも、ギャグで言っていたとしてもまるで笑えないが
デイル	いやあ、失笑ぐらいはもらえるんじゃね？
姫	ちなみに今は皆さん絶賛苦笑中だけどな
主人公	あまりにもいつも通りなラーロンに、もうため息も出ない。しかし、そんなラーロンにもまったく動じることなく先生は答えを返す。
バリアリーフ	今日の模擬戦闘の話に関しては聞いていますわ、二人一組での連携戦闘でしたわね。それについては考えてあります
バリアリーフ	本来なら担当教師がいない時点で自習とするべきなのでしょうが、それでは皆さんも不完全燃焼でしょう。それに、私自身、個人的に今の皆さんの錬度には興味があります
バリアリーフ	ですので、当初の予定通り模擬戦闘を行います
主人公	予想外の言葉にクラスメイト達がざわめく。
ヴェル	え？　やるの？　でも、だったら先生のパートナーはどうするわけ？
紅	まさかと思うが、先生一人相手にタッグで挑むのか？
姫	確かに滅界戦争経験者である先生と戦えるなんて、めったに無い機会だけど……
主人公	やはり周囲の生徒達からも俺達と同じ疑問について声が上がる。
バリアリーフ	予定と違い二対一での戦闘になってしまいますが、重要なのは皆さんの連携ですので問題ないでしょう
デイル	やっぱ、ドラ先生一人で二人相手にするみたいよ。やべえ、逆に怖いってそれ
フォン	まあ、実際のところ二対一どころか、フォンやヴェルさまなどの一部の例外を除けば、クラス全員でかかっても相手にならないような方ですし
姫	やっぱりそのレベルなのか……
フォン	伊達に滅界戦争時代『魔族狩り』の二つ名で恐れられていないという事です
フォン	トリアさまも『百の精鋭と対峙するより、バリアリーフ一人を相手にする方がよほど厄介』と以前おっしゃってましたし
主人公	フォンの言葉に顔が引きつる。あの学園長をもってしてそこまで言わしめる程の実力者。もはや凄すぎてまったく強さを実感できない。
バリアリーフ	さあ、時間も圧しています。全員速やかに準備を始めなさい
主人公	その言葉に全員が一斉に準備を始める。何だかんだで他のクラスメイト達も先生と戦える事にワクワクしているように見えた。
主人公	実際、学園にいても滅界戦争経験者、それも先生ほどの武勇を残した人物と戦える事なんてそうそうない。
姫	やばい、ちょっとドキドキしてきた
デイル	俺様は相手がしんどそうで嫌だぜ。まあ、興味があるのも確かなんだけどな。頼むぜ姫っち。今回は相棒として期待してるぜ
姫	ああ。せめて足を引っ張らないようにがんばるよ
フォン	威勢はいいのに、微妙に後ろ向きですね
紅	そういう所は相変わらずなんだな
ヴェル	くす、ヒメらしいわね
主人公	どこまで出来るか分からないけど、出来るところまでやってみよう。
挑戦者Ａ	は、挟み込むぞ！　左右から同時に！
バリアリーフ	悪くない動きですけど、まだ踏み込みが足りませんね
挑戦者Ｂ	え！？　嘘ッ！！　きゃあああ！
挑戦者Ａ	うわあああああああ！
主人公	さて、そうして始まった先生との模擬戦闘だが、何というか分かってはいたもののほとんどの生徒が戦いにならない。
主人公	これはあくまでも模擬戦闘であり、先生に勝つ必要は無い。コンビを組み５分間先生と戦い続ければいいだけだ。
主人公	ただ、模擬戦闘開始前に先生本人からこんな事を言われた。
バリアリーフ	ただ戦うだけでは面白味がありませんから、一つやる気の出る特典を用意しましたわ
バリアリーフ	５分の間に一度でも私に、魔力物理問わず有効打を当てる事が出来たコンビには、本日出されている課題を二階級の主任教師の権限を使って、どれでも一つ免除しましょう
主人公	その言葉にクラス中から歓声があがる。今日は確かにレポート系の厄介な課題が出ていたためだ。
バリアリーフ	ふふ、もちろんそれが出来た生徒には戦闘の評価も最大のものを与えましょう。さあ、手加減はしてさしあげますので、全力できなさい
主人公	その言葉に触発されて、今まで何人ものコンビが先生に有効打を当てようと躍起になったが、結果は当然のことながらさんざんな事になっている。
姫	またダメっぽいな……このコンビがダメだとクラスの半分が終わるぞ
紅	未だに先生の課題を突破したコンビは無しか……これは、予想以上だな
デイル	しかも、充分手加減した状態であれだぜ？　いやぶっちゃけ無理ゲーだろこれ
主人公	この通りほとんどのクラスメイトが有効打どころか戦闘にすらなっていない。
フォン	正直、あの『魔族狩り』に策無く正面から挑む時点で見積もりが甘すぎます
ヴェル	特に魔族のコンビは酷いわ。ほとんど手も足も出てないじゃない
主人公	基本的にこういった授業でコンビを組む場合、同じ種族同士でコンビを組む生徒が多い。
主人公	今回もその例に漏れず魔族は魔族同士でコンビを組んでいるクラスメイトが多いが、そのコンビのほとんどが５分間、ほとんど何も出来ずに終わっている。
デイル	前から疑問だったのよね。なんでステゴロ最強！　な、竜族のドラ先生の武器が鞭なのかって。その理由が今日分かったわ
ヴェル	そうね、何が厄介ってあの鞭が厄介すぎるわ
主人公	基本竜族は気鱗を用いた素手による近接戦闘を好む。理由は単純で、高い身体能力と気鱗による防御力と攻撃力を持つゆえに武器を持つ理由が無いからだ。
主人公	しかし、先生はその上で鞭を主武装としている。その理由は生徒の間では割と謎になっていたけれど、今回の模擬戦でその理由を身をもって知ることになった。
挑戦者Ａ	だ、ダメだ！　接近戦じゃ相手にならない！　ま、魔法で
挑戦者Ｂ	う、うん！
主人公	もう何人もの挑戦者が試みた魔法による遠距離戦。しかし先生はそれに気付くとすばやく鞭を振る。
バリアリーフ	くすっ、簡単にはさせませんわよ
挑戦者Ａ	ぎゃっ！　あああ！　くそっ魔法が！
挑戦者Ｂ	きゃあ！　だ、だめ……集中できない！
ヴェル	また魔法発動をキャンセルされたわね……
デイル	盲点だよな。発動した魔法攻撃を防ぐ事が出来ないなら、そもそも魔法を使わせなければいいって発想は
主人公	魔族に関わらず魔法というものは基本的に精神力によって行使される。故に精神を激しく乱される状況では思うように発動できなくなるという弱点もある。
主人公	先生はその弱点を的確についている。
姫	鞭による”痛み”か……
フォン	鞭による痛みというのは鋭く独特で、掠っただけでも激痛が走ります。苦痛に慣れてない者にとって、それは肉体以上に精神に響くでしょうね
主人公	そう、精神を効率よく乱す方法に術者に”痛み”を与えるというものがある。
主人公	魔法発動前に痛みを与える事で精神が乱れると、そもそも魔法が発動せずキャンセルされる、もしくはキャンセルに至らないまでも発動を遅らせる事が出来る。
紅	実際どうなんだ？　発動直前に鞭ではたかれたら
デイル	経験ないからなんともいえないけども。攻撃魔法系はわりと術式が複雑だから、集中力を乱されたら多分形にできないわ
デイル	まあ、姫さんみたいに攻撃魔法を使わなくても、魔力を単純な破壊力に変えてぶつけるようなレベルならいけるかも知れないけどな
ヴェル	そうね。ぶつけるだけなら攻撃魔法の発動より溜めが少なくてすむわ。それでも発動直前に叩かれたら制御を誤る事はあるかも。正直それが怖いわ
フォン	ヴェルさまレベルの魔力が制御を誤って暴発でもしたら、それだけで味方は全滅しますよ
主人公	実際今まで先生と戦ったクラスメイト達も、そのほとんどが鞭の一発で発動を止められてしまっている。
主人公	まあ、今まで鞭で叩かれた経験のある者なんてそういるわけが無いので、未知の痛みに精神を乱されてしまうのは仕方の無いことだとは思う。
主人公	また、先生は鞭による直接打撃以外にも様々な手段で相手の精神をかき乱し、魔法発動を阻害していた。
主人公	たとえば鞭が振るわれた際の風切り音や地面を打つ音の連続、目の前で高速で振るわれる鞭は、慣れてない者にとっては耐えられるものじゃない。
主人公	それだけで魔法発動が遅れてしまう。
紅	さらに、あの鞭は本来竜族が苦手とする中遠距離をカバーするためにも活用されてるな。竜族の身体能力による踏み込みと鞭のリーチ、避けられる気がしないな
デイル	それに魔法発動準備中ってのはどうしたって動きが鈍るもんだし
姫	まさに『魔族狩り』の名に偽りなし、か。自分の魔法攻撃を軸に戦闘する者に対して徹底的に特化したのがあの戦闘スタイルって事か
主人公	そうこう言っている間に今戦っていた二人の戦闘時間が過ぎる。結局この組も先生に触る事すら出来なかった。
バリアリーフ	さあ、どんどん行きますわよ。次の組前に出なさい
紅	さて、もうすぐ姫たちの番だぞ、どうするんだ？
姫	……正面からいっても勝ち目は薄いな、何か先生の意表をつかないと。デイル、何かいい案無いか？
デイル	正直お手上げ。隙らしい隙が無さそうに見えるぜありゃ
主人公	デイルがそういうのも無理もない。今までの戦闘を見る限り、これといった対処方がまるで見当たらない。
デイル	まあ、てなわけで俺様考えるの面倒になっちゃったから、作戦は姫っちに丸投げするぜ。姫っちの指示には逆らわないから好きに使っちゃってくれい
ヴェル	ちょっとはやる気を出しなさいよ。言っとくけど、ヒメの足を引っ張ったらただじゃ置かないわよ
姫	いや、どう考えても足を引っ張るとしたら俺の方だし……
紅	ま、適当な事を言ってはいるが、それだけ姫の指揮を期待してるって事だ。お前は自分のやりたいようにやればいい
フォン	そうでしょうか？　本当にただ面倒くさいだけのようにも見えますが……
主人公	デイルの場合、あながちそれが嘘とも言い切れない。
デイル	酷いぜフォンちっちー。俺様これでも人を見る目はあるんだぜ。姫っちも自信を持ちな。あんたは俺を倒した男なんだから
姫	でも、俺もデイル戦の時には結構その動きに振り回されたしな
主人公	特にあの『風の翼』って魔法。風魔法を足元に叩きつけ推進力として大ジャンプするあれには正直驚かされた。
姫	ん？　ちょっと待てよ……
ヴェル	どうしたのヒメ？
姫	いや、もしかしたら……デイル、ちょっといいか
デイル	なんぞ？
姫	一つ聞きたいんだけど、お前が使った『風の翼』ってさ……
主人公	俺の考えをデイルに話すと、他の皆も含めて驚いたように目を丸くする。
デイル	また、凄いこと考えるな姫っち……
姫	それで、実際の所どうなんだ？
デイル	んー、理論的には出来ない事は無いぜ？　あれは単純に風魔法を噴射して任意の方向に加速してるだけだからな
姫	出来るんだな？
デイル	ああ、多分な。ただし使った後は保障はしないぞ？
主人公	大丈夫だここまで聞ければ問題ない。これで先生の意表をつける。
紅	本気か姫？
姫	当然。折角だからきっちり勝ちにいかないともったいない
ヴェル	正直あんまり危ない事はしてほしくないけど……でもヒメのことだから、どうせもう決めちゃったんでしょ？
姫	これ以外にいい案が思いつかないからな
ヴェル	そう。だったら私には止められないわ。がんばって
主人公	そう言ってくれるヴェルに力強く頷く。
ヴェル	あ、ちなみにデイル。もしヒメに何かあったら、あなたをチリ一つ残さずに完全にこの世界から消滅させてあげるから覚悟しなさいね♪
デイル	ぎゃー！　むしろこの作戦、俺様のが危ないんですけど！？
フォン	ご愁傷さまです。化けて出られると面倒なのでちゃんと成仏してくださいね
デイル	こっちはこっちでもっと酷い事言ってるっしょ！　ちくしょう姫っち、こうなったら絶対成功させっぞ！
姫	まあ、やる気になってくれたなら俺も嬉しいよ
主人公	とりあえず方針は決まった。後は失敗せずに最後までいけるかどうかだけだ。
バリアリーフ	次のコンビは、生徒白鷺と生徒デイルのコンビですね。両者とも準備をして前に出なさい
主人公	その声に俺とデイルは頷くと準備を始める。準備といっても武装に不備が無いか程度なのですぐに終わった。
紅	頑張ってこいよ。せっかくだ課題突破第一号になってこい
ヴェル	がんばってねヒメ！　精一杯応援するから！
フォン	改めて見せてもらいますよ。姫先輩、あなたの実力を
姫	ああ、出来るだけの事はやってくる
デイル	姫っちばかりずるいぜ。俺様も声援が欲しいなあ
紅	ああそうだな、すまない。デイルも頑張れよ
ヴェル	ちゃんとヒメを守りなさいよ！
フォン	別にあなたに興味はありませんし
デイル	なに、この扱いの差……俺様泣いていい？
姫	まあまあ。とにかく頑張ろうぜ
主人公	ちょっと本気で落ち込みかけているデイルの背中を叩きながら、俺は先生の前に向かった。
バリアリーフ	準備はできましたか？
姫	はい！
デイル	おうよ、ばっちしだぜドラ先生
主人公	しっかり頷く俺達に満足したのか、先生はよろしいと言って頷いた。
バリアリーフ	それにしても珍しい組み合わせですわね。特に生徒白鷺は、生徒ヴェルか生徒白川とコンビを組んでると思いました
姫	もう結構色々な人から言われました
デイル	そんなに意外かねー、俺様と姫っちのタッグ
主人公	デイルはそう言うものの、周囲のクラスメイト達も意外な組み合わせにひそひそと話している。
主人公	実際デイルと組みたいと希望する奴は多かった。けれどデイルはそれらを全て断って俺とコンビを組みたいと言い出した。
主人公	正直何故そこまで俺とのタッグにこだわったのかは、俺自身今一つ分かっていない。
デイル	まっ、試合で証明しようぜ姫っち。俺様が姫っちを選んだのが間違いじゃ無いって事をさ
バリアリーフ	なるほど、言葉で語るより分かりやすい手段ですね。それでは期待していますよ
主人公	そういって開始位置に立つ先生を見て、俺達も武器を構える。
姫	作戦はちゃんと覚えてるか？
デイル	もちだぜ姫っち。いっちょギャラリーの度肝を抜いてやろうぜ
姫	ああ、頼んだぞ
主人公	そう言って、俺達は互いに拳をぶつけ合った。
バリアリーフ	では、開始の合図をお願いしますわ
主人公	先生の言葉に、俺達の前に戦っていた二人が頷く。その一人が俺達が武器を構えたのを確認すると、大きく手を振り上げた。
女子生徒	始め！
主人公	そして、良く通る声と共に手が振り下ろされた。直後俺達は全力のバックステップで、一瞬だけ先生の鞭の射程から逃れる。
バリアリーフ	いきなり逃げの一手ですか？
主人公	そう言って、追撃するために踏み込む先生だけれどバックステップしたお陰で届かない。一度だけだけれど、デイルが魔法を発動させる時間を稼げた。
姫	デイル！　頼む！！
デイル	よっしゃ！　行って来い姫っち！！
バリアリーフ	は？
主人公	準備が整ったと同時にデイルの手が俺の背中に触れる。
デイル	『風の翼！』
バリアリーフ	なっ！？
主人公	魔法発動と共に視界がブレる。次の瞬間、俺は背中から噴出す風に押され、先生の正面に勢い良く”射出”された。
姫	これで！
主人公	ほとんど体当たりするぐらいの勢いで、剣を前に突き出し先生に突撃する。
バリアリーフ	くっ！　なんて無茶を！
主人公	当然の如くその程度の奇襲ではやられてくれるほど甘くない。先生は俺の突撃をあっさり回避した。だけど、これでいい。
姫	止まれええええええ！
主人公	俺は強引に地面に剣を突き刺すと、そのまま両足で急制動をかける。その猛烈な勢いに地面が削れ足に痛みが走るが、それでも必死に踏ん張り、動きを強引に止めた。
主人公	正直剣が折れる可能性も考えていたけれど、どうにか持ってくれたみたいだ。さすがトリニティ均整。頑丈だ。
主人公	そして、これで俺は先生の後ろを取ったことになる。俺とデイル、二人の挟み撃ちだ。
バリアリーフ	っ！？　そういう事ですか……
姫	デイル、援護頼んだ！
デイル	任せとけ！
主人公	作戦通りだ。竜族である先生の鞭と近接格闘術に対抗する術は、やはり魔法に頼るしかない。
主人公	しかし普通に魔法を撃とうにもその鞭により妨害されてしまう。だから俺が囮になって先生の懐に飛び込む事で、デイルの魔法発動までの時間を稼ぐ。
バリアリーフ	驚きました、まさかこんな方法で後ろをとられるとは！
姫	油断しましたね。俺は確かに魔法を使えません。けれど、味方に魔法をかけてもらう事はできるんです！
主人公	先生は、なまじ俺が魔法を使えない事を知っているが故に開始直後はデイルの踏み込と攻撃魔法を警戒したはずだ。
主人公	まさか魔法を使えない俺が、デイルの魔法を利用して飛び出してくるとは思っていなかっただろう。だからこそ、本来なら迎撃できるはずの正面からの突撃に反応が遅れた。
バリアリーフ	してやられましたわ。けれど、貴方一人に遅れをとりませんわよ
主人公	そういって放たれる先生の蹴りを、全神経を集中してギリギリ回避する。完全に回避したにも関わらず、その勢いで生まれた産まれた空気の波が頬を叩いた。
