姫	にしても、本当に何もないな……
ウルル	はいです……
姫	まあ俺からすれば何も無い方が間違いなくいいんだけれど……オペラさんは何を危険に思ってるんだろうな
ウルル	フォンさん、竜族に対して何を思ってるんでしょう……
主人公	ここ数日ずっと様子を窺ってるのに何もないということは、やっぱりオペラさんの気のせいだったのか……。
姫	完全に学園から離れちゃったな
ウルル	どう見ても買い物ですよね、あれ
主人公	通り沿いの出店を覗き、適当に買い物などしながら寮の方へと向かって行くフォン。その行動には特に裏は感じられない。
姫	今日はこのまま寮に行っちゃいそうだな
ウルル	そうですね……寮だったら、ヴェルさまが見ててくれますし
主人公	気がつけば、フォンは適当に買い食いしながら路地の方へと曲がるところだった。
主人公	俺達も、その後を追って角を曲がる。
フォン	言っておきますけれど、フォンを探ったところで尻尾は見せませんよ
姫	フォン！？
ウルル	きゃうんっ
主人公	曲がった瞬間、そこにはフォンが待ち受けていた。
姫	な、なんで？
フォン	なんでも何も最初からバレバレでしたよ。ここ数日、誰かがフォンのことをつけてましたし
フォン	まあ、探られたところで痛いお腹があるわけでもないですから無視していましたが
主人公	フォンはウルルをジロリと見やると、
フォン	それが竜族に、となるなら話は別です
主人公	冷たく言い切った。
主人公	相変わらず、竜族に対するフォンの態度は辛辣だ。そんなフォンにウルルは少し落ち込むが、グッと顔を上げるとはっきりと尋ねた。
ウルル	フォンさんは、なんでそこまで竜族を憎むんですかっ。フォンさんだって、竜族の血を引いているのに！
主人公	が、その瞬間、フォンの気配が明らかに変わる。
フォン	ふざけないで下さい！
フォン	ええ、確かにこの身体には流れてます、竜族の血が。ですがそんなもの、フォンはまったくいりません。無くせるものなら今すぐにでもすべてを捨てたいくらいです
フォン	こんな汚らわしい血なんて！
ウルル	き、汚くなんてありません！
ウルル	竜族の血は、ただでさえその数の少ない竜族のみんなが一生懸命頑張って、何度も絶滅の可能性をうたわれながら、必死になって残してきたんです！
ウルル	その血を侮辱するというんでしたら、いくらフォンさんでも許しません！
主人公	そして、そんなフォンの言葉に、ウルルも怒りを爆発させる。睨み合った二人は、今にも争いを始めかねない。
姫	二人とも、そこまでだ。こんな所で二人が争えば、周囲の人達が巻き込まれる
姫	それに、ウルルの言うことももっともだぞ、フォン。何をされたのかも言わず一人で腹を立てて、しかも種族まで侮辱されれば誰だっていい気はしない
フォン	……れたからです……
ウルル	え？
主人公	唐突にフォンが何かを呟いた。俺達は聞き取れず、聞き返す。が、それが余計に許せなかったのか、フォンは思い切りその怒りをぶつけてくる。
フォン	殺されたからです！　お母様を！
姫	殺……された……？　竜族に、か？
フォン	そうです。竜族は子孫を残す関係から、人族と深い関係を持っています。でも、魔族は天敵ともいえる存在。決して良好といえる仲じゃありません
フォン	だけど、フォンのお母様は、魔族のお父様を選び、フォンを残しました。天敵との間に築かれたフォンたち家族がどんな目で見られたか、想像するのは簡単かと
フォン	お母様はそんな視線に耐えられずフォンとお父様を捨て、魔界へと追い返しました。そして一人残った竜界で……
フォン	圧倒的な差別に遭い、お母様を殺されて。これでも、フォンが竜族を憎む理由はありませんか？　竜族の王女さま
ウルル	そんな……そんなはずありません！　竜族の民が差別や、よりにもよって同じ竜殺しだなんて！
ウルル	絶対！　絶対、絶対、絶対絶対！　絶対に間違いです！！　そこには、何か理由があります！
フォン	まあ、そう言うだろうとは思っていました
フォン	竜族王家最後の一人、ウルル＝カジュタさまが盲目的な性善説を唱える方だというのは、この一月足らずで充分に分かっていましたし
フォン	別に分かってほしかったわけでもありませんので、それは構いません。フォンは、フォンの理由により勝手に竜族を憎み続ける。それだけです
フォン	もちろん、多少は痛い目を見てもらうこともあるとは思いますが
ウルル	ダ、ダメです！　竜族のみんなに手を出すことは、ウルルが許しません！
フォン	許せないのでしたらどうぞ。いつでも止めてみてください。止められるのでしたら
主人公	挑発して、戦う理由を作ろうとでもいうのか、わざとらしいイヤミ口調のフォン。
主人公	ウルルもそれを分かっているのだろうけれど、竜族をバカにされているせいか、その怒りを抑えられないようだ。
主人公	まずいな、これは……。
姫	二人とも、本当にもうやめろ！　フォンも、これ以上ウルルを挑発するな。二人が争えば、竜族と魔族の争いにもなりかねないんだぞ！
フォン	ああ、大丈夫ですよ。フォンの方から手を出すことはありませんから
姫	そうやって煽るなって言ってるんだ。ウルルも乗るなよ
ウルル	……分かってますにいさま……ウルルは、竜族の代表なんですから……
主人公	周囲では大勢の野次馬たちが既に俺達を取り囲んでいた。まずいな。ウルルはガマンできてもこの状態、他の竜族がガマンできない可能性がある。
主人公	竜族は、ウルルがバカにされることを絶対に許さない。今の状況が知れ渡れば、乱入してくることも……。
少女	ケンカはだめーっ！
フォン	え？
ウルル	はい？
姫	なんだ？
主人公	精一杯の大声と共に、一人の少女がウルルとフォンの間に割り込んだ。両手を左右に開き、まるで壁になるような格好で。
姫	シャル！？　お前、どうしてここに
シャル	だって、わたしのおうち、すぐそこだもん
シャル	それより、ウルルちゃんも、フォンちゃんも、ケンカはダメだよ！
シャル	こんな、たっくさん人がいるところでケンカなんて。どっちもいけない子だよ！
フォン	いえ、その……別に、ケンカをしていたわけでは……
ウルル	ち、違うのシャルちゃんっ。ウルルたちは別に……
シャル	ケンカりょうせいばい、って言葉、知ってますか、二人とも！　悪いことをしたら、どっちも怒られなくちゃいけないのっ
シャル	街のみんなに迷惑かけてるんだよっ。分かってます？
フォン	は、はい……
ウルル	分かってます……
シャル	はい。それじゃあ二人とも、次にやることはなんですか？
ケンカ両成敗	…………ごめんなさい
シャル	よくできましたー♪
主人公	……子供の明るさ、というんだろうか。あの雰囲気の二人を、何か言い返す暇すら与えずあっという間に仲直りさせてしまった。
姫	ほんと、こういうところは到底敵わないよなあ
主人公	笑顔でウルルとフォンの頭を撫でているシャルの姿に、俺はもちろん、見守っていた野次馬達すらもが笑顔を浮かべている。
姫	シャル、よくやったな
主人公	その小さな頭を優しく撫でてやると、シャルは嬉しそうに目を細めた。
シャル	えへへー。パパぁ
フォン	うううう……ここでシャルちゃん投入とは卑怯すぎます……
ウルル	あううう……シャルちゃんには勝てません……
オペラ	うふふふふー。さすがのフォンさまも、シャルさまの純真無垢な瞳の前には手も足も出ず！　な感じでしたねー
オペラ	さっすがシャルさま。このオペラ＝ハウスの若い頃そっくりな清らかさは、いかなる邪悪も呪い殺されるのです！
オペラ	あら？　なんですかみなさんその目。あれ？　あら？　あらはー？
フォン	邪悪に失礼です。土下座で謝って下さい
ウルル	オペラ……さすがにシャルちゃん可愛そうだと思うの……
姫	オペラさん……ギャグだとしても笑えませんよ、それ
オペラ	あー、まー、そのー……やっぱそうですよねー。いやあ、さすがに無理あるかなー、とは思ってたんですけどぉ
オペラ	そこまでこき下ろさなくたっていいじゃないですか……私にだって、純真無垢な乙女で子供な時代があったんですよ。未だに乙女ですけど……ぐすん
オペラ	ていいますか、いきなりいなくなったウルルさまを必死に追いかけ探してみれば、まさに一触即発の地獄モード
オペラ	清らかなる天使シャルさまを全力で探して連れてきた私の苦労、もう少しいたわろうって気にはなりません？　そこの立ってただけの白鷺さまっ！
姫	うぐっ！
主人公	すみません。ほんとその通りです……。
フォン	はあ……もういいです。なんか気が抜けちゃいました
フォン	これ以上騒いでシャルちゃんに怒られるのも嫌ですし、フォンはこれで失礼します
シャル	えい♪
主人公	言うが早いか、フォンはまるで逃げ去るようにこの場を立ち去ろうとした。ていうか、本当に逃げようとしたんだろう。
主人公	が、そのスカートをシャルが掴む。
フォン	はい？　な、何を……ダメです！　そんなに強く引っ張ると捲れて……
姫	ああ、なるほどな
主人公	ニコニコ笑いながらのシャルの行動に、俺はぴん、と手を打った。
姫	仲直りしたなら、一緒に遊ぼう、だってさ
シャル	さっすが、パパ、大正解です♪
フォン	い、いえあの、フォンは特に遊びたいとかは……ああ、分かりました！　スカート引っ張らないで下さぁい！
ウルル	……あのフォンさんが手玉に取られてます……
オペラ	ウルルさま、憶えておいて下さいね。子供の純粋さというのは
オペラ	時として最悪に残酷な武器となるのです……
主人公	……なるほど、知恵を与えたのはオペラさんか。
主人公	シャルとオペラさん。天使と悪魔に融合されては、確かにどうにもならないな。俺は呆れたように溜息をついた。
