姫	ただいま戻りましたー
主人公	ようやく辿り着いた我が家こと学園寮。扉を開け、中へと入ったその瞬間、
トリア	婿殿っ！！
ルアン	姫くんっ！
主人公	おっぱい死スターズ（命名：学園長）が、ズズイッ！　と押し寄せてきた。
姫	……な、なんでしょうか……お二人とも……
主人公	魔王妃と神王妃、二世界のトップの、その称号とはまったく別ベクトルの迫力に、思わず一歩下がる俺。
主人公	二人は逃がしてなるものかとばかりのその一歩を踏み込むと、思い切り俺の肩を掴んだ。
おっぱい死スターズ	なんでピクニックに誘ってくれない！？
姫	……えーと……
主人公	なんというか、非常に頭が痛くなってきた。
トリア	せっかくうまい酒があったというのに！　あー、外で飲んで騒ぎたかったあ！
ルアン	せっかくおいしいワインがあったのにぃ！　お外でみんなでおいしくいただきたかったあ！
王女ｓ	だからです！
ヴェル	まったくもう。以前魔界の方で酔っぱらって山の地形変えたのもう忘れた？
ノート	一昨年のことです。神界でお酒を飲んでいい気分になって、あらゆる税金を無しにする、なんて命令だしかけましたよね
トリア	しょぼーん……
ルアン	しょぼーん……
姫	……とんでもない王妃達だな、おい……
アミア	まあ、お母さんとトリアちゃんだしねー
主人公	そんなアミアの言葉に、一同全員がうんうん頷いた。
トリア	ちくしょー！　るーにゃん付き合え！　今夜はヤケ酒だあ！
ルアン	もちろんです、トリアちゃん！　やけ酒ですー！
主人公	ガッシリと肩を組み、食堂の方へと消えていく二人。今夜は食堂には近づかないようにしよう。この場にいた全員の心が一つになった……。
姫	ふう、やばかった。湯船の中であやうく溺死するところだった
主人公	昼間のピクニック、紅の膝枕で結構休んだはずなんだけども、やっぱり遠出っていうのは体力使うのかな。まさか落ちかけるとは。
姫	明日からはまた学園だし、早く寝よう
主人公	部屋へと向かって階段を昇ろうとしたところでふと気がついた。食堂の方から明かりがもれてる？
姫	……おかしいな。いくらなんでもこんな時間に食堂なんて……
主人公	あの二大魔神が食堂に行ってから、もう５時間は経っている。いくらなんでもまだ残ってるとは考えにくい。
姫	……学園に忍び込んだ賊……とは考えにくいけど、念のために見ておいた方がいいかもな……
主人公	俺は気配を殺すと、そっと食堂の方に歩み寄った。
トリア	そうしたらヴェルの奴な、初めてウチにありがとう、って頬を染めながら言ったわけだ！　いやあ、あの気むずかしかった子がだよ！
トリア	あの時ウチは心から感謝したね。ああ、人族の方ありがとう、と
トリア	まあその時は、まさかその人族に一途に想いを寄せるとは思わなかったけどな……ってもう空か。るーにゃん次
ルアン	はい、どうぞ
ルアン	私の方もなのよっ。あの内気で、対等のお友だちが欲しいっていつも落ち込んでた子が、お友だちができました♪　なんてすっごく眩しい笑顔で言ってきたの
ルアン	その時は私、ご飯の量が大盛りで十杯も増えちゃった
ルアン	聞いてみたら、アミアちゃんもすっごくいい笑顔でその人のこと話すじゃない。あ、この時はね、大盛りで五杯増えたの
ルアン	しかも人族の子だっていうから、ああ姫くんのことね、ってすぐ分かっちゃった♪　あら、もうグラス空よトリアちゃん。はい♪
トリア	いやあ、まさか人族の少年がここまでやるとはねえ
ルアン	本当よね。若いって素晴らしいことだわ
トリア	それじゃあ、新しい世代の台頭を祝って
ルアン	祝って～
酔っぱらい	酒持ってこ～い！
姫	……さて逃げるか
主人公	ダメだ。今捕まったら間違いなく話の餌にされる。俺は自らの命を賭けて、全力で部屋へと逃げ帰った。
