ヴェル	ヒメの顔、ちょっとおかしい
主人公	ヴェルの身体に覆い被さるようにして見下ろす俺の顔を見て、ヴェルは小さく笑った。
姫	そ、そうか？　まあ、確かにデイルみたいな二枚目っていうわけじゃないけれど……
主人公	確かにまあ、ヴェルみたいな美少女に釣り合うような顔だとは思っていないけど。こういう場面で言われると、さすがに少し傷つくというか……。
主人公	そんな俺の考えを察したのか、ヴェルは微笑んだままでその首を左右に振った。
ヴェル	ううん、違うの、そういう意味じゃなくて……私にとって、ヒメよりかっこいい男の人なんていないんだから
ヴェル	ただ、すっごく緊張してるのかな、って
姫	いや、そりゃあ当然じゃないかと……ヴェルとその、こういうことをするんだし……
主人公	今俺の目の前で、ヴェルがベッドに横たわっている。これから、俺と身体を重ねるために、横たわっている。そう考えるだけで拍動が早くなる。
主人公	よく見れば、迷宮にいた時とは下着が替わっていた。風呂に行った時に穿き替えたのか……。
主人公	これからもっとヴェルの身体を見るんだ。ヴェルに触れるんだ。そう考えるだけで、身体が強ばってしまう。
姫	ヴェルは緊張してないのか？
主人公	そんな俺の質問に、ヴェルは微笑んだまま言い切った。
ヴェル	もちろんしてるわ。胸を触ったら一緒に感じてみて。すっごいドキドキしてるんだから
ヴェル	だけどね、緊張なんかよりも、嬉しさの方が遙かに強いの
ヴェル	やっと、ヒメと一つになれる……ヒメのものになれるって思ったら、そっちのドキドキの方が強くて
主人公	笑顔のままで、本当に嬉しそうに答えてくれるヴェル。そのまま、まっすぐに俺の目を見て続ける。
ヴェル	ヒメ、これだけは憶えておいて。これからの行為で私を喜ばせたいって思うなら、決して気を遣わないで
ヴェル	私の身体でヒメが喜んでくれること。ヒメが精一杯私を愛してくれること。それが一番嬉しいし、気持ちよくなれるんだから
主人公	本心からそこまで言ってくれるヴェルがたまらなく愛しく感じる。この身体を自分のものに出来る喜びで胸がいっぱいになる。
姫	……分かった。その、上手になんてできないと思うけど……
主人公	思うがままにそう言おうとする俺の唇を、ヴェルの人差し指が封じた。
ヴェル	はい、ストップ。もう言ったそばからこれなんだから
ヴェル	言ったでしょ、気を遣っちゃダメって
姫	そうだった。それじゃあ……
ヴェル	うん♪
主人公	俺のセリフを最後まで聞くまでもなく察したヴェルは、当然とばかりに頷いてくれた。
ヴェル	な、なんだか不思議ね。こんなの、海で見せた水着姿と変わらないはずなのに……凄く恥ずかしい
主人公	そっとズリ下ろした服の下から、白い肌と清楚なブラジャーとが姿を見せる。
主人公	際立って大きい、というわけではないけれど、それでも充分な大きさを持つ二つの膨らみは、俺の視線を奪うには充分すぎた。
ヴェル	相手がヒメじゃなかったら、絶対耐えられない行為だわ……
主人公	恥じらうように視線を逸らすヴェルの姿が、俺の心を大きくくすぐる。可愛い。素直にそうとしか思えなかった。
姫	俺も、水着見るのとは違った感動みたいなものが……
姫	ヴェルの下着姿っていうだけで、なんだか凄い興奮する
主人公	他の誰も見ることのできないはずの姿。俺のすぐ下に広がる光景は、全世界のどんな風景よりも価値があると思う。
ヴェル	うん……恥ずかしいけど、好きなだけ見ていいから……
ヴェル	見て、それで触って……ヒメの手を感じたい……
主人公	羞恥に身体をよじりながらも、俺に見えやすいようにとヴェルは隠すこともなく俺の視線に耐え続ける。
主人公	その姿は俺を興奮させるに充分すぎた。俺は手を伸ばすと、その膨らみにそっと触れる。
ヴェル	ん……
主人公	ブラの上からなのにも関わらず、ふっくらとした柔らかさが手に伝わってくる。細身な身体にも関わらず、ヴェルのそれはしっかりと存在を主張していた。
姫	触ってみると、思ってたよりも大きいんだ、ヴェルの……
主人公	膨らみを包み込むようにしながら、ゆっくりと手を動かす。柔らかさと適度な弾力とが合わさって、これだけでも満足できてしまいそうなくらい気持ちいい。
主人公	そして何よりも、膨らみを通して感じるヴェルの鼓動。大きく速いそれは、俺に触られることを歓迎しているみたいだ。
姫	凄い柔らかくて……ほんとだ、ドキドキ言ってるのが分かる
ヴェル	へ、変な感じ、ね……ゾクゾクってくるんだけど、全然不快じゃなくて……もっと触ってほしい
主人公	広がる初めての感覚に戸惑っているのか、ヴェルは強く目を閉じたまま必死にそれに耐えている。
ヴェル	もっと強くてもいいから、ヒメが好きに触って
主人公	けれど決して嫌がったりはせず、俺の手を受け入れてくれた。その柔らかくて張りのある感触は、クセになってしまいそうになる。
姫	あんまり触ると、クセになりそうだ。乳首、もしかして尖ってきてる？
ヴェル	な、ないしょ……
主人公	恥ずかしそうに答えるヴェル。けれどそこはもう、ブラの上からでも分かるほどに、硬く尖っている。
姫	ブラの上からでも分かるよ、ほら
ヴェル	ひんっ
主人公	人差し指で、その尖塔をブラの上からこする。それだけで、ヴェルは小さく身体を反らして鳴いた。
主人公	俺はそのまま、再び胸を揉みしだく。ゆっくりと、その感触を味わうように大きく。
ヴェル	あ……ん、う……んく……
姫	やっぱり、そういう声って聞かれたくない、のかな……？
ヴェル	ん……ち、違うの……ガマンしてないと、隣の部屋とかに聞こえちゃい、そうで……あ、んうっ
ヴェル	ヒ、ヒメ以外の人、に……聞かれたくない、から……
主人公	俺の拙い手の動きに、しっかりと感じてくれているヴェル。それを賢明に堪える姿がたまらなく可愛く見える。
主人公	けれど、その声が聞けないのはやっぱり残念だ。あの綺麗な声で喘がれたら、どんなに興奮してしまうだろう。
姫	ちょっと残念かな。ヴェルの声、俺好きだから……
ヴェル	そ、そういう言い方、ずるい……
主人公	ちょっと拗ねたように言うヴェルに微笑み返すと、俺はブラの隙間に指を入れる。そしてそのまま、上へとズリ上げた。
ヴェル	ん……
主人公	完全に晒されてしまった自分の胸に、ヴェルはわずかに身体を震わせる。柔らかそうな膨らみが、それに合わせて微かに揺れた。
姫	……やっぱり、直接見ると違うな
主人公	瑞々しくも滑らかな肌。その中心でツンと尖った桃色の突起。少しも崩れていない二つの丘は、まるで彫刻か何かみたいだ。
姫	張りがあって、ツンて上向いて……
姫	ちょっと触れると、フルフル震えてる
主人公	けれどそれは、彫刻なんかとは間違いなく違う。直接触れてみたそれは柔らかくて、温かくて、すべすべとしていて。芸術品だけれど、芸術品なんかじゃない。
ヴェル	もう……ヒメって意外にいじめるの好きなのね。すっごく恥ずかしいんだから
姫	ごめん。恥ずかしそうにしてるヴェル見てると、つい
姫	それに、出来れば声聞きたいし
主人公	俺は言うと、その胸の先端を軽く指でつまんだ。
ヴェル	あ……
主人公	それだけで、ぴくんとヴェルが反応する。
ヴェル	や、だめ……つねっちゃ……コリコリとかさせちゃ、ダ、ダメ！
主人公	そこが弱点なのか、指でコリコリと捻るだけでヴェルは大きく喘いだ。
姫	ヴェルってここが弱いんだな……
ヴェル	ふぁ、あ……や、あ……
主人公	柔らかな乳房を楽しみながら、硬い乳首の感触を味わう。余程弱いのか、ヴェルは今までのガマンもどこへやら、小さく喘ぎ続けた。
ヴェル	だめっ……ヒメの手が直接触れてるっていうだけで……か、感じちゃって……
姫	ヴェルの胸……ただ柔らかいだけじゃなくって、しっかりした弾力があって……こうして揉んでるだけで楽しくなるな……
主人公	俺の手のあらゆる動きに応えて、自在に形を変えるヴェルの胸。その度に元の形に戻ろうと適度な弾力を俺の手を押し返してくる。
主人公	その感触と乳首の触感とが相まって、このままずっといじり続けていたいと思ってしまう。
ヴェル	も、もう……でもヒメの手、あったかいのね……
ヴェル	気持ちよくて、背中の方が震えてきちゃう……ん……ああっ
主人公	頬を赤く上気させながら、恥じらうように言うヴェル。その声には甘い震えが混じっており、更に俺を求めていた。
ヴェル	で、でも……あの……胸だけ、なの……？
姫	まさか。ヴェルのすべてを触らせてもらおうって思ってる
主人公	チラリと、恥ずかしそうに視線を自分の下半身へとヴェルは持っていく。当然、俺だって男である以上、ヴェルのそこに興味がないわけがない。
姫	その、足開いてもらっていいかな
主人公	そんな俺の願いに、ヴェルは恥じらいながらもゆっくりと応えてくれた。
ヴェル	これで、どう？　よく見える……？
主人公	大きく開かれたヴェルの足。薄い下着には小さなシミができており、その向こうにあるものがうっすらと見えてしまう気がする。
主人公	ここにヴェルの恥ずかしい場所がある。そう思うだけで、自然とそこを凝視してしまう。
姫	あ、ああ……その、もう濡れてるんだ
ヴェル	あう……だ、だって……ヒメがあんなに胸をいじるから……
ヴェル	結局声も出ちゃったし……ヒメに触られてるってそれだけで私……
主人公	真っ赤な顔で、懇願するように俺を見上げるヴェル。その表情はむしろ逆効果で、より興奮してきてしまった。
姫	俺も、ヴェルが俺の手で感じてくれてたんだって思っただけで、その……凄いことになってる
ヴェル	え？　あ……うん……
主人公	そんな俺の言葉に、ヴェルはそっと俺の下半身へを目をやった。恥ずかしさからか、瞬時に顔を逸らしてしまう。
ヴェル	そ、そうよね……これからが本番だもん……
姫	それじゃあ、その……ヴェルの、見せてもらいます
主人公	これからのことを想像したのか、ヴェルの身体が緊張で固くなる。俺はそんなヴェルの下着へと手を伸ばすと、ゆっくりズリ下げていった。
姫	うわ……
主人公	何もない柔らかそう下腹部の向こう、その先端から綺麗な筋が一本伸びている。そこから透明な蜜がわずかにこぼれ、シーツの方に垂れていった。
ヴェル	あ、あんまりじっくりとは見ないで……
主人公	隠そうとはしないものの、さすがに恥ずかしさでいっぱいなのか、その声が震えている。とはいえ、こんな光景を目の前にして、見ないでいられるわけもなかった。
姫	これがヴェルのなんだ……でも、その……
姫	は、生えてないんだ
主人公	大人ならば、本来あって当然の茂み。けれどヴェルのそこには何もなかった。そのために、ただでさえ恥ずかしいだろうその場所が、何にも隠れることなく見えている。
ヴェル	ご、ごめんなさい……やっぱり赤ちゃんみたいでいや？
ヴェル	これだけはあの、どうしてもダメ、で……
姫	い、いや、全然平気。ただ驚いただけで
姫	むしろ、ヴェルのことがよく見えていいかも
ヴェル	も、もうっ。ヒメが相手じゃなかったら、舌を噛んで死んでるくらいの恥ずかしさなんだから
姫	つまり、俺しか見てないってことだろ。うん。俺以外の相手には見せたくないな、やっぱり
主人公	男としてのワガママではあるけれど、ヴェルのこんな姿を他の誰かが見るというのは耐えられそうにない。
主人公	本当に、俺一人のものにしたくなる。男の独占欲っていうのはやっかいなもんだ。
ヴェル	相変わらずずるいんだから。そんなこと言われちゃうと、私、恥ずかしさより嬉しさのが出ちゃうのよ
主人公	けれどそんな俺の言葉に、ヴェルは嬉しそうに微笑んでくれた。それが俺に対して心を許してくれている証なんだと思うと、本当に嬉しい。
姫	うん……俺も嬉しい。これからヴェルと一つにって思ったら、凄い心臓がやばくなってきたし
ヴェル	うん。ヒメにだったら全然怖くない
姫	それじゃあ、その前にもう少しだけ……
主人公	最も恥ずかしいだろうその場所を、俺はそっと左右に開いた。現われた鮮やかなピンク色の柔肉に、俺は人差し指で優しく触れる。
ヴェル	あんっ
主人公	ぴくんと身体を震わせて、可愛らしい声でヴェルが鳴いた。そのいやらしい秘裂の中を、じっくりと眺める。
姫	ヴェルの入り口、こんなに狭いんだ……
主人公	秘裂の下の方に空いた小さな穴。まだ誰も通したことのないそこは、俺の小指すら遮るくらいに狭い。
姫	でも、ひくひくいって、中から蜜を垂らしてる
主人公	そしてその入り口の向こうから、トロリとした蜜が次々と垂れてくる。こうして見られているだけで、ヴェルは感じてくれてるみたいだ。
ヴェル	やあっ。もう、そうやってまたいぢめるんだからぁっ
姫	ごめん。でもヴェルのここ、柔らかくて凄く熱くなってる……
ヴェル	ヒメの手で熱くされちゃったのよ……
ヴェル	あんっ……や、あ、んうっ！
主人公	桃色の柔肉を優しく撫でる。それだけでヴェルの口から甘い喘ぎがこぼれた。熱く濡れそぼったそこをいじる度、ヴェルは身体を震わせて鳴き続ける。
ヴェル	あ、は……だ、だめぇ……頭の中が痺れて……わ、分かんなくなっちゃう……
主人公	奥から溢れる蜜は白みを帯びて、ネットリと俺の指に絡みついてきた。そのまま秘裂の中を、ヴェルの一番恥ずかしいそこの感触を楽しむ。
主人公	ふと目をやれば、秘裂の上部にある突起が包皮の隙間から顔を覗かせているのが見えた。
姫	ここもぷっくらしてきてる……一番敏感なとこが……
主人公	その可愛らしい豆を、濡れた指でそっとつまむ。それだけでヴェルは、大きく背中を反らして喘いだ。
ヴェル	きゃうんっ
ヴェル	ひ、あ、だめっ……そこ、は、本当に……こ、壊れちゃうっ
主人公	その反応が心地よくて、つまんだ突起を少しいじる。刺激が強すぎるのか、ヴェルは頭を大きく振って反応した。俺は慌てて指を離す。
姫	ごめん、ちょっと強かったか
姫	……でも、これだけ濡れてれば平気かな……
主人公	垂れた蜜がシーツにシミを作るほどに、ヴェルのそこは蜜にまみれていた。問いかけるようにヴェルを見ると、ヴェルは小さく頷いてくれる。
ヴェル	えへへぇ
主人公	互いに服を脱ぎ捨てると、決して大きくない、むしろ小さいとまで感じるヴェルの身体を抱きしめるように身体に乗せる。
主人公	俺の胸にヴェルの胸が押し当てられ、その心臓の鼓動が直接伝わってくる。
ヴェル	うん。この体勢、素敵。ヒメに抱きしめられたまま一つになんて、想像しただけでイっちゃいそう
主人公	本当に嬉しそうな笑みを浮かべながら、俺と一つになることを望んでくれているヴェル。その笑顔を見ているだけで、むしろこっちが放ってしまいそうだ。
姫	俺なんて、このヴェルの胸の感触だけで果てそうなんだけど
ヴェル	さっきからね、ヒメの硬いのがお腹の方に当たってるの。すっごい熱くなってるの分かる
ヴェル	私でこんなに興奮してくれたのよね
主人公	ちょっと恥ずかしそうに、だけど嬉しそうに言うヴェル。それだけで俺の興奮はピークに達してしまう。ダメだ、このままだと挿れる前にいってしまいかねない。
姫	それどころかもう限界です
ヴェル	もう、ダメよ。その時は、ちゃんと私の中でお願い
主人公	すっかりいきり立ってしまった自分を、ヴェルの秘裂の中で上下させる。わずかに窪んだ小さな入り口を見つけると、俺はそこに自分を固定した。
ヴェル	それじゃあ……
姫	ああ、行くよ
主人公	緊張を含ませた笑顔を向けるヴェルに頷き返すと、俺は腰に力を入れ、ヴェルの中へと押し込んでいく。
ヴェル	あ……うく……んうっ！
主人公	やっぱり狭い。ミチミチと肉を押し開くような感触と共に、ヴェルが苦痛の声をあげる。
姫	大丈夫か、ヴェル？　そんなに痛いなら一度止めて……
ヴェル	うん。すっごく痛い……でも痛いっていうことは、夢、じゃないのよね……
ヴェル	お願い……このまま一気に……
主人公	それでも賢明に痛みを堪えながら俺を求めてくれるヴェル。
ヴェル	せっかくヒメが抱いてくれてるのよ……私、ヒメとの時間を、何も無駄にしたくない……
ヴェル	へ、平気、だからっ……
主人公	俺を抱きしめているヴェルの手に力がこもる。俺はそんなヴェルの思いをしっかりと受け止めると、黙って腰に力をこめた。
ヴェル	あ、ぐうっ！
主人公	ぶつんっ、と何かが引きちぎれる感触と共に、一気に抵抗が緩くなる。狭い秘洞の中を俺自身が半分ほど潜り込んだ。
ヴェル	は、入った……？
姫	あ、ああ……
主人公	痛みのためか、今一つ状況が分からず恐る恐る尋ねてくるヴェルに、けれど俺も満足な言葉を返せない。
ヴェル	ヒメ……？　あの、もしかして私の中……ダメ？
主人公	そんな俺の態度に、不安そうに尋ねてくるヴェル。とはいえ、そんなはずがない。むしろまったくその逆だ。
姫	い、いや……ヴェルの中、狭くて……す、凄くて……
姫	耐えてるので精一杯、なんだよ……
主人公	中にいるだけで全方位から締め付けられる。しかも熱く濡れそぼったそこは、ヴェルの体温が直接感じられる。
主人公	ただでさえ興奮しきっていたところでのこれだ。暴発してしまいそうな自分を押さえ込むのだけで精一杯だ。頼むから、お互いに慣れるまではこのままで……。
ヴェル	そう、なんだ……それじゃあ……えいっ
主人公	が、そんな俺の願いに気付いているのかいないのか、ヴェルは自分から腰を動かすと、俺を更に奥へと埋めようとする。
姫	こ、こら、動くなっ。痛いんだろ、ヴェル！
ヴェル	う、うん。でも、この方が男の子って気持ちいいのよね……？　だ、だったら、ガマンするっ
ヴェル	あ、う……ん、んん！
主人公	その目に涙の雫を溜めながら、強引に腰を落としていくヴェル。俺の肉棒はより深くヴェルの中へと沈み込み、その快感が全身を痺れさせた。
姫	い、いやだから！　俺の方がまずいんだって！
ヴェル	はぁ……ん、うぅ……
主人公	危うく出してしまいそうになった自分を、ギリギリでガマンする。それでも、ヴェルは腰を動かすのをやめようとはしない。
主人公	ゆっくりと、本当にゆっくりとだけれども、自ら腰を動かして、俺を刺激し続ける。
ヴェル	う、うん。好きな時にイっていいから。何度でも気持ちよく……なって
ヴェル	私もね、痛いけど、気持ちいいから
ヴェル	ヒメと一つになるって凄いね……心の中からジンジンきて……全身が感じちゃってるみたい
ヴェル	私を……あ……こんな風に、させられるの……世界中探したって……んう、ヒメだけよっ
主人公	痛みの中に確かな甘さを含ませた声が耳に響く。
主人公	一つになった下半身からはぐちゅっ、ぐちゅっと淫靡な水音が聞こえ、耳元では震える嬌声。俺の全身が快感に震えてるみたいだ。
姫	う、ああっ。ダメだっ。ほ、本当に、もう！
主人公	ヴェルを貫いた先端から、ビリビリとした震えが背筋を通って脳髄に突き刺さる。必死に押さえようとするものの、もうどうしようもない。
ヴェル	はぁ……はぁ……ん、あ、ふあぁっ。じ、じゃあ、もうちょっと頑張れば、はぁん……ヒメ、イっちゃうのねっ
ヴェル	が、がんばる……んあっ！
主人公	ヴェルが言うと同時に、その秘洞がキュッと締まった。その瞬間、俺に絡みついていた無数のヒダが、俺を一気に締め上げる。
姫	き、急に締まって……で、出る！！
主人公	いきなり全身を貫いたその快感を、今の俺がガマンできるはずがない。俺の奥に溜まっていたすべての欲望が、ヴェルの熱い体内へと吐き出されていく。
ヴェル	あ……
姫	う……く……
ヴェル	うわ、うわ、うわぁ……凄い……これがヒメの、なんだ……
主人公	どくん、どくん、と放たれている熱いそれを、ヴェルは嬉しそうに受け止めてくれる。
ヴェル	ん……あ、ああっ！　お、お腹の奥に……あ、あっついのがいっぱい……
主人公	誰にも汚されていなかったヴェルの体内を、俺がこうして汚しているんだと思うと、申し訳ないと思うと同時に、何かが満たされていってしまっているの感じる。
主人公	ヴェルのすべてを、今俺のものにしたんだ。そんな喜びが湧いてくる。
ヴェル	ヒメがびゅくん、っていく度に、たくさん溢れて……は、あぁ……
姫	はぁ……はぁ……大丈夫か、ヴェル。あんな無理に動いて……
ヴェル	うん……それどころか、すっごく幸せ……
主人公	本心から嬉しそうに笑いながら、ヴェルは俺の胸にその頬を乗せた。そして甘えたように頬ずりをしてくる。
姫	ごめん。ヴェルの方はあんまり気持ちよくなかっただろ……
ヴェル	もう……さっきから笑顔が収まってくれない私の顔を見なさい。これで気持ちよくないわけないじゃない
ヴェル	むしろヒメの方こそ、収まってないみたいだけど？
主人公	いつの間にか、ヴェルへの射精は収まっていた。けれどいきり立った俺は、少しも萎えた気配がない。むしろヴェルの中で更に大きくなったようにすら思える。
姫	……ヴェルが気持ちよすぎまして……
主人公	さすがにこれは恥ずかしい。視線を逸らしながら言う俺を、けれどヴェルは笑顔で見上げた。
ヴェル	だったら素直に言えばいいのに。あ、むしろ私の方から言った方がいいのかしら
ヴェル	もう一回……お願いします
主人公	……すみません。また大きくなってしまったみたいで……。
