紅	それじゃあ、あたしたちは先に行くな
フォン	くれぐれもフォンの足を引っ張らないで下さいね
紅	分かってる。あたしよりもフォンの方が遙かに強いからな。あたしはフォローに回らせてもらうよ
フォン	分かっているなら問題ありません
フォン	それからヴェルさま
ヴェル	何よ。私に、気をつけて、なんて言葉はいらないわよ
フォン	ええ、ですからヴェルさまに向けてじゃありません
フォン	気をつけて
主人公	そう言い残し、紅とフォンは迷宮を進んでいった。
主人公	午後の授業。再建された地下迷宮を使っての実戦授業。二人一組になって、モンスターと戦いながら迷宮を進んでいく。
主人公	試験の時のように最奥まで潜りはしない。あくまでこのフロアのみを使っての実技授業だ。
主人公	一組ごとに一定の時間を空けて次の組が入っていく方式。
主人公	中は入り組んだ迷路状態。最初の分かれ道を直前の組とは反対に行くことで、出来るだけ他の組とぶつからないようにしている。
ヴェル	……むう。あの子、段々ヒメのこと理解できるようになってるわよね。まったくもう
姫	今のやり取り、なんだったんだ、ヴェル？
ヴェル	なんでもないわ……
主人公	ちょっと拗ねたような口調で返すヴェル。俺はその態度の意味が分からず、首を傾げた。
姫	よし時間だ。それじゃあ俺達も行こうか
ヴェル	ええ。基本は私が前衛で行くわ。ヒメは後衛でフォローをお願い
姫	いや、それなんだけどさ、今日は俺に前衛をさせてくれないか？
ヴェル	え？　でも……
姫	悪い。ヴェルが前の方が正しいのは分かってるんだ。ただ、俺も男として、少しくらいは守る側にまわってみたいなあってさ
ヴェル	私からすれば、ヒメの存在そのものが私を守ってくれてるのと同じなんだけどな
ヴェル	それに、ヒメのかっこいいところは一瞬だって見逃さない自信あるもの
主人公	ヴェルは少し不満そうに言うと、諦めたように息を吐いた。
ヴェル	分かったわ。ヒメの願いは断れないもの……だけど、本当に気をつけてね。私、ヒメがケガするところ見たくない……
姫	ああ、充分に気をつけるよ。ありがとう
主人公	そして俺達は、迷宮へと足を踏み入れていった。
姫	ふう……
ヴェル	大丈夫ヒメ？　少し休憩した方が……
姫	いや、まだ平気だよ。やっぱり迷宮内だからかな、少し気分的に疲れただけだから
主人公	スタートしてから三十分ばかり。多少ながらもモンスターと遭遇し、それを退けることもできた。多少のトラップも解除したし、それなりに順調ではある。
主人公	まあ、少しばかりの傷は負ったけれど大した傷でもない。まだまだいける。
主人公	この程度で音を上げていられるはずがない。俺はもっと前に進まないといけない。
ヴェル	ヒメ……少し急ぎすぎじゃない？　時間を競ってるわけじゃないんだし、もうちょっと慎重に行った方がいいわ
ヴェル	さっきも、それで罠を解除し損ねたし……
姫	いや、特に急いでるつもりはないんだけどな……でも、罠の解除失敗はごめん。次はもう少し慎重にやるよ
ヴェル	……うん
主人公	ヴェルが俺のことを心配してくれてるのは分かる。正直言うなら、疲労もかなりのものだ。こんな密閉された迷宮で実戦までしているわけだし。
主人公	それでも、もう動けないわけじゃない。まだ全然身体は動くし、前にも進める。
主人公	休んでる暇があるなら、少しでもこの身体に経験を積ませないと……。
ヴェル	ヒ、ヒメ！
主人公	突然、ヴェルが俺を後ろから呼んだ。
姫	ヴェル、どうかしたのか！？
主人公	何か覚悟を決めたようなその声に、俺は慌てて振り返る。が、次の瞬間、俺はその場で凍り付いた。
主人公	そこには、俺の目の前で、自らスカートをめくり上げているヴェルの姿があった。
主人公	常に隠されているはずの可愛らしい下着が、思い切り俺の視界に晒されている。
主人公	当然ながら、ヴェルは別に露出狂というわけじゃない。こんな下着一枚だって、他人に見られれば恥ずかしがる普通の女の子だ。
主人公	だけど、そのヴェルが、こうして俺に恥ずかしい姿をさらしている。
姫	ヴェ、ヴェル？　何を……
主人公	返答はなかった。ヴェルはその顔を真っ赤に染めたまま、必死にスカートを捲り続ける。
姫	その……さすがに目のやり場に困るんで、そろそろ隠してもらえると……
主人公	そう言って目を逸らそうとしても、ついそちらに視線を送ってしまうあたり自分が男であることを思い知らされてしまう。
ヴェル	い、いいから、見て……
主人公	必死なヴェルの声。それでようやく分かった。これは間違いなく俺のために無理をしてる。
主人公	ヴェルは、俺が無理をしていることなんて当然分かっていた。それでも見て見ぬフリをしてくれていた。
主人公	だけど、もう限界だと悟ったんだろう。言葉では分からない俺を止めるために、こんなことまでしてくれているんだ。
姫	も、もういいよヴェル。その……さすがにそこまでしなくてもいいから……
主人公	それでもヴェルは、首を左右に振った。
主人公	ここまで無理をした俺が、まだ止まらないと思ってるのかもしれない。
主人公	……確かに、それは正しいと思う。俺自身、これで止まれるとは思えない。
ヴェル	もっと……見ていい……
主人公	それは、そうされることを望んでいるような言葉だった。
主人公	それが必死のガマンの上で紡ぎ出された声だというのは簡単に分かった。
主人公	俺は、その言葉に操られているかのように、言われるままそっと手を伸ばす。
主人公	目の前の下着へと指をかけ、少し手前に引っ張った。
ヴェル	んっ！
主人公	ヴェルの口から、さすがに驚きの声が漏れる。顔の赤さも一段増したみたいだ。
主人公	服と下着との間に見える、滑らかな下腹部。
主人公	このまま下に引っ張れば、もっと危険な部位までが確実に見える。男としてヴェルのそれを見たいという欲望が溢れてくるのは当然だった。
主人公	下腹部から、足の付け根の方へと伸びる淫靡な曲線。何も無いなだらかな丘を、そのまま下へと辿っていく。
主人公	ヴェルの一番神秘に満ちたその場所が俺の視界に入りかけたところで、ヴェルの身体が小さく震えていることに気付く。
主人公	見上げてみれば、ここまでされながらも視線を逸らして必死に羞恥に耐えるヴェルの顔があった。
姫	……
主人公	ここにきて、ようやく俺も納得した。ヴェルがこれだけ無茶をするほどに、俺は落込んでいるらしい。
主人公	確かに、自分が強がっていることは分かっていたし、ここで折れてしまわないためにも強がり続けなくちゃいけないとも思っていた。
主人公	だけど、そんな俺の理解以上に、周囲には俺が落ち込んでいるように見えていたわけだ。
姫	ごめん、ヴェル。その……もう分かったから、隠してくれないかな……
主人公	つまり、ヴェルのこの行為は、ヴェルなりに俺を元気づけようとしてのものなわけだ。
主人公	まあ、男としては間違いなく元気が出るものではありますが、さすがに……。
主人公	けれどヴェルは、おれがまだ強がっていると思っているのかスカートを下ろそうとしてくれない。いや、あまり長くこの格好を続けらると……。
姫	その、そろそろ後から進んでる人達に追いつかれてもおかしくないし、そうするとだ……
姫	俺は、他の人にヴェルのそういった格好とか見られたくないんだよな……
姫	その、本当に元気も出たから……
主人公	そう頼み込む俺の言葉に、ヴェルは『本当？』とばかりに俺を見る。俺は素直に頷いた。
ヴェル	本当に大丈夫……？
主人公	スカートを下ろしはしたものの、やっぱり相当恥ずかしかったんだろう。俺に尋ねてくるその顔は、まだ真っ赤だ。
主人公	俺は、そんなヴェルに苦笑しながら頷き返す。
ヴェル	本当の本当に？
姫	ああ
ヴェル	本当の本当の本当？
姫	ヴェルのあんな格好を見させられれば、そりゃあね
ヴェル	……ヒメにだからよ。そうでなきゃ、あんなこと絶対……
主人公	でもなぜだろう。確かにその顔は赤いけれど、妙に嬉しそうでもある。
姫	分かってる。でもその、あんなことさせちゃったのに、なんか嬉しそうじゃないか？
ヴェル	だ、だって……ヒメ、言ってくれたわよね。他の人に見られたくないって……
姫	あ、ああ……
ヴェル	私にとっては、その言葉だけで充分ご褒美だもの
ヴェル	えへへぇ……ヒメに独り占めされちゃった……自分以外には見せたくないって……あー、もうニヤニヤ止まってくれないよぉ……
姫	……えーと、いいのか？　その反応で
ヴェル	だって嬉しいんだもん♪
姫	ま、まあ、ヴェルがそう思ってくれてるならそれでいいけどさ
主人公	つい苦笑して、そして気付いた。ああ、いつも通りになってきてるな……。
主人公	ヴェルのおかげで、本当に元気を、少しだけれど取り戻せたみたいだ。
主人公	まったく、この子は……。
姫	ありがとな、ヴェル
ヴェル	べ、別に大したことはしてないわよ……その、ヒメにはいつかもっとその……
姫	ただその、ごめん。おかげで今は落ち着いてるけど、多分、またすぐに思い出すと思う。あの子のことを忘れるとか、やっぱりできないから……
ヴェル	ヒメ……
姫	……だけど、それでも大丈夫だから
姫	正直、少し時間かかるかもしれないけど、それでも必ず立ち直るから
ヴェル	……うん。もしちょっとでも苦しくなったら言って。また何度でも見せてあげるから
姫	いや、それは女の子としてどうなんだ、ヴェル……嬉しいけど……
ヴェル	だ、だって……男の子が喜ぶことなんて、私それくらいしか……
主人公	言って、お互い赤面してしまう俺達。
主人公	本当に、しっかり元気出さないとな、俺も。
