オペラ	……こうして男の人の前で脱ぐっていうのは恥ずかしいものですね
主人公	メイド服のボタンに指をかけながら、オペラさんは恥ずかしそうに言った。外そうとするものの、俺の視線が気になってしまうのか、モジモジとためらってしまう。
オペラ	冗談で見せるフリくらいは簡単なんですけれど……本気だとそうもいかないみたいです
姫	オペラさんさえよければ、俺が脱がせますけれど……
主人公	メイド服を脱がせるなんていう機会はまずない。俺は少しの期待を込めて言ってみるものの、オペラさんは首を左右に降った。
オペラ	それはいけません。年上の魅力溢れるお姉さんメイドたるもの、こういうところではやはりリードいたしませんと
オペラ	年下の可愛らしい美少年を、手取り足取り腰取りと導く優しいお姉さん……という設定はいかがです？　大変萌えるかと思われますが
主人公	それは照れ隠しなのか、その顔には恥じらいが浮かんでいる。
姫	まあ、その設定はともかく……そうですね。誰かにリードされるオペラさんなんてオペラさんらしくないかと。お任せします
オペラ	かしこまりました。それでは……その……あ、あはははぁ……やっぱり恥ずかしさは消えませんね
主人公	オペラさんはニッコリと笑うと、再びボタンに手をかける。が、やはり困ったように苦笑した。
オペラ	それでも、白鷺さまがお相手なら、逃げるわけには参りません
主人公	それでも、このままではダメとばかりに、思い切って外し始める。
オペラ	い、いかがでしょうか……
主人公	左右に開かれたメイド服の中から、清楚な下着に包まれた双丘が姿を見せた。
主人公	もっと大人っぽい下着を想像していた分驚いたけれども、こういう可愛らしいところがオペラさんらしいなとも納得してしまう。
姫	……その……分かってはいたんですけれど、大きいですね……
主人公	俺の手に収まると思えないほどの二つの膨らみ。それは下着越しであっても、俺の目を惹き付けるのに充分だった。
オペラ	白鷺さまの場合、ウルルさまとの情事がありますし、小さい方が好みなのではないかとも思っていたのですが……
姫	別にそこまで胸のサイズにはこだわりませんよ。その、オペラさんの胸にだって充分興奮してますし
主人公	むしろ、これだけのものを見せられたら、男なら『触れてみたい』くらいは思ってしまう。
オペラ	正面からそう言われてしまいますと、やはり恥ずかしいものですね……
オペラ	それでは、あの……ど、どうぞ……
主人公	笑顔の裏に羞恥を押し込めながら、その胸を突き出すオペラさん。俺は破裂しそうな心臓を必死に抑えながら、そっと手を伸ばした。
オペラ	ん……
姫	……やっぱり、凄いボリュームですね……手に収まりきらない……
主人公	少し力を込めるだけで、指が膨らみの中へと沈んでいく。そして力を抜くと押し返される。そんな心地よい感触を味わいながら、俺はその膨らみの愛撫を続ける。
主人公	ゆっくりと揉みしだきながら、徐々に円を描くように手を動かしていくと、オペラさんの口から甘い吐息がこぼれ始めた。
オペラ	う……ん……白鷺さま……結構慣れていますね……いつの間にこんな……
オペラ	ウルルさま相手では……あ……胸を触る練習は無理でしょうし……
オペラ	やはり、ヴェルさま……んく……ですか……？
主人公	はしたないと思っているのか、声を押し殺し、その感覚に耐えるオペラさん。けれど小刻みに震える身体が、ちゃんと感じていることを教えてくれる。
姫	さすがにそこまで触り慣れてはないんですけど……今だって、試行錯誤しながらですし……
姫	オペラさんの胸、ブラ越しなのに凄い触り心地がよくて……つい乱暴にしそうになっちゃうんですよ……
主人公	紅やノートにも全然負けていない大きさ。思い切り揉みしだいてしまいたい。そんな欲求が湧き出してしまう胸だ。
オペラ	白鷺さまがお望みなら、それでも……
主人公	そう言ってはもらえるものの、初めてのオペラさんにさすがにそこまで乱暴にはできない。
主人公	俺は少しだけ強めに、その乳房を味わい始めた。
オペラ	あ、はぁ………や、やっぱり慣れすぎ、です……声が、ガマンできませ、ん……
主人公	さっきまでよりも大きく、強く形を歪ませる乳房に、オペラさんは頬を上気させながら喘ぎ始める。
主人公	今まで飲み込んでいた声も、もう抑えきれないらしい。耳から脳髄へと届くその響きは、より俺を興奮させる。
姫	オペラさんにそう言ってもらえると嬉しいですけど、俺が慣れてるんじゃなくて、オペラさんが敏感なんですよ。ほら……
主人公	ブラの上からでも分かるほどのそそり立った突起を、そっと指でなぞる。それだけで、オペラさんはびくん、と身体を跳ねさせた。
オペラ	ふあぁっ……や、だ、だめです……そんな、先端の方、は……
オペラ	あ、んうっ……か、身体が、浮いてしまいそう、です……
主人公	そのままブラ越しに指で突起をつまみ上げる。小さくクリクリと捻ると、オペラさんは更に甘い声で鳴き始めた。
主人公	乳房とは全然違う、コリコリとした固い感触。触っていることが、ただ楽しい。
オペラ	あの……で、できれば……その……直接……
主人公	やがて、全身を奮わせながら呟くオペラさんに、俺はブラへと手をかけた。
主人公	その包みの中から、大きな球体が二つこぼれ落ちてくる。反動でふるふると震えるそれは、見ているだけで俺に興味を抱かせた。
主人公	その中心にある突起と共に、ツンと上を向いた膨らみは理想の形で俺の前に晒されている。
オペラ	あ、あまりじっくりは見ないで下さい……
姫	す、すみません。凄い綺麗だったんで
オペラ	もう……そんなことを言われても何も出ませんよ……
オペラ	男の人に肌を見られるのは初めてなんです……まさか、こんなに恥ずかしいだなんて……
オペラ	白鷺さま相手でなければ、悲鳴をあげているところです……
主人公	そんな恥じらうオペラさんの姿は新鮮で、ついつい口元が緩んでしまう。
姫	オペラさんの悲鳴だったら聞いてみたいですけど……
オペラ	悲鳴をあげるのは男の人の方ですから
姫	……すっごい納得しました……
主人公	……これもまあ、恥じらいの一つと見れば……。
主人公	取り合えず、許可されていることに素直に感謝しよう。俺は胸を撫で下ろすと、外気に晒されたままの乳房に手を伸ばした。
オペラ	んんっ……直接触られると、こんなにビリビリとくるんですね……
主人公	吸い付くような弾力に滑らかな肌の感触。こうして触れているだけで、夢中になってしまいそうな感触が伝わってくる。
主人公	手のひらを通じて伝わってくるオペラさんの温もりに、俺は貪るようにその乳房を揉みしだいた。
オペラ	あ……はぁ……ん、く……声、漏れてしまうほど気持ちいい、です……
姫	オペラさんの胸が、気持ちよすぎるんですよ……触るの止められないです……
姫	こんなに簡単に形を変えて……なのにすぐに戻ったりとか
主人公	少し強めに握り締めても、それは好き勝手に形を変えて、そしてすぐ元に戻る。その弾力を楽しみながら、今度は乳首を直接つまんだ。
姫	ここもコリコリしてて、ずっと触りたくなっちゃいます……
オペラ	ああっ！　そ、そこは、やぁ……し、白鷺さまっ、もう少し……よ、弱く……
主人公	素直に喘いでくれるオペラさんに感動しながら、俺はその尖塔を赤ちゃんみたいにそっと咥える。そして軽く歯を立てた。
オペラ	ふあ、あ、ああ！　か、噛んじゃいやぁ……
主人公	クニクニとした柔らかさと、コリコリとした硬さ、二つが合わさった感触が脳髄に染み渡る。
姫	オペラさんのそんな声、初めて聞きました。すごく可愛いですよ……
オペラ	白鷺さまが出させてるんじゃないですか……私、こんなの初めて……で……
オペラ	や、ああっ。頭の中が、飛んじゃいそうでっ
主人公	両方の乳首を少し強めに責めながら胸を弄ぶ。オペラさんは身体を震わせながら、感じるままに喘いでくれた。
オペラ	あ、あう……ん、あ、あああああっ！
主人公	そして、唐突にびくん、と小さく跳ねる。
姫	軽くイっちゃったみたいですね……
オペラ	はぁ……はぁ……もう……白鷺さまのいじわる……
主人公	初めてだろう感覚に息を荒らげるオペラさん。綺麗というよりも可愛いが似合う人だなと、つくづく思い知らされた。
オペラ	次は私の番ですからね……
主人公	そして、拗ねたように言うと、こんどはその場にしゃがみ込む。
オペラ	いかがですか。私の胸で包まれた感触は……
姫	あ、あったかくて……吸い付いてくるみたいで……ゾクゾク震えがきます……
主人公	硬く漲っている俺を、オペラさんの温かな双丘が包み込んでいる。
主人公	熱く怒張したそれに柔らかな乳房がシットリと貼り付き、気持ちいい。
オペラ	そうでしょう、そうでしょう。と言ってもその、初めてですので、お世辞にも上手に、とは言えないんですけれど……
主人公	オペラさんはちょっと満足げに言うと、そのまま俺に視線を落とし、頬を赤らめた。
オペラ	にしましても、そのぉ……し、白鷺さまって、随分と猛々しいんですね……
姫	オペラさんの胸のせいでこうなってるんですよ……普段は全然です
主人公	さっきあれだけ楽しませてもらった上に、こんな風に包まれているんだ、萎えるはずがない。むしろ大きくなっているくらいだ。
姫	こうなったらすぐには回復しませんから、オペラさん、ちゃんと責任取って下さい
主人公	俺の身体全体が期待感に満ちあふれてる。これでおしまいとなったら、さすがに気が狂ってしまいそうだ。
オペラ	お任せ下さい、と言いたいところではあるのですが……その、正直未知の物体すぎまして……
オペラ	とりあえず、できるかぎりの奉仕はさせていただきます
主人公	オペラさんは、小さく可愛らしい笑みを浮かべると、そっと舌を伸ばし始める。
オペラ	ん……
オペラ	ぴちゃ
姫	あ……
主人公	熱い舌が、俺の先端にそっと触れる。唾液に濡れた舌は、俺の表面をゆっくりとなぞり始めた。
オペラ	ぴちゃ　ぴちゃ
オペラ	ぴちゃ　ぴちゃ　ぴちゃ
オペラ	いかがでしょう……場所とか、強さとか言っていただければ……
姫	は、はい……そのままで……な、なんか、頭の奥がゾクゾクきてます。うわ……こ、これ、凄い……
主人公	先端から、背筋を奮わせるような感触が上っていく。それだけで、俺の下半身へと何かが集まってくるような気がした。
オペラ	なんだか、先ほどまでより大きくなった感じがします……
主人公	オペラさんの舌が気持ちいいから。そう言いたかったものの、オペラさんの舌による快感のせいで言葉が出ない。俺は黙って身体を震わせる。
オペラ	ぴちゃ　ぴちゃ
オペラ	ぴちゃ　ぴちゃ　ぴちゃ
姫	オ、オペラさんの、胸と舌、が、凄……熱くて……
主人公	少しずつ大きくなっていく舌の動き。自然と漏れてしまう快感に、俺の中で射精感が急激に高まっていく。
主人公	まるで、この舌に吸い上げられてるみたいだ。
オペラ	ん……んあ………はぁ……
主人公	そしてオペラさんは、ゆっくりとその乳房をも動かし始める。
主人公	熱い膨らみ包み込まれた俺。その先端を、熱く濡れた舌が丁寧に刺激していく。
主人公	そんな行為にオペラさんも感じ始めているのか、次第に吐息が荒くなっていった。
オペラ	ぴちゃ　ぴちゃ
オペラ	ぴちゃ　ぴちゃ　ぴちゃ
オペラ	んむ……んく……あむ……ヌルっとしたものが出てきました……んぁ……
主人公	自然とこぼれだしてしまう先走りを、オペラさんの舌先が拭い取るっていく。そして更に絞りだそうとするかのように、乳房で激しく俺をしごく。
姫	あの、胸の方、でも……
オペラ	は、はい……んう……
オペラ	この先端……の方を………ん……はぁ………
主人公	こじ開けるかのように俺の割れ目へと、オペラさんの舌先が入ってくる。ゾクッとした快感がほとばしり、大きな波が駆け上ってきた。
姫	う……あ……力、入らなくて……が、ガマンができ……ないです……
主人公	肉棒の中ほどまで、俺の欲望が昇ってきているのが分かる。俺は必死にそれを抑え込むものの、力が入ってくれない。
オペラ	凄い……白鷺さまの、こんな……あむ……固くなって……んう……っ
オペラ	ぴちゃ　ぴちゃ
オペラ	ぴちゃ　ぴちゃ　ぴちゃ
主人公	先端から、裏の方にまで赤い舌先が伸びていく。俺の先端からこぼれたそれは、オペラさんの唾液とまじって胸の方にまで垂れていった。
姫	こ、こみ上げて、きて……もう……
オペラ	んくっ……んあ……はぁ……ああ……んむっ……
主人公	垂れていったそれで滑りのよくなった俺を、豊かな膨らみが上下に激しくしごいていく。
主人公	もう限界へと達していた俺に、その刺激をガマンすることは出来そうにない。
オペラ	ん……あん……うむ……んん……
主人公	熱く甘い吐息と共に再び俺の割れ目を刺激するオペラさん。その瞬間、俺の堤防は崩壊した。
姫	あ、あう……う、くっ……ほ、ほんとに、あ、あああっ！
オペラ	きゃあぁっ
主人公	賢明に溜めていた欲望が、一直線に噴き出していく。目の前にあったオペラさんの綺麗な顔を、勢いよく汚していった。
オペラ	え？　あ、あの、これって……
主人公	いきなりのことに驚くオペラさん。俺はその綺麗な顔に、これでもかというほどの白濁を吐き出した。
オペラ	白鷺さまの……？
姫	す、すみません……もう抑えられなくて……
オペラ	ふふ。こんなに熱いんですね……
主人公	そんな俺の反応に、オペラさんはクスと笑う。
オペラ	なんていいますか、私の力で白鷺さまをイかせた、というだけで誇らしいものがありますね
主人公	どうやら、さっき軽くでもイかされてしまったことを根に持っていたらしい。してやったりとばかりに俺を見上げてきた。
姫	なんていうか、本当に全身が痺れて……逆らえませんでした……
オペラ	よかった……まずは一つクリアですね
主人公	少し放心気味の俺に、オペラさんは安堵したかのよう言う。
オペラ	それでは、本番の方も……
主人公	そして、更にその先へと行くために俺を床へと押し倒した。
姫	あの、本当にこの体勢でいいんですか……？
オペラ	はい。こういうのは経験豊富なお姉様にお任せ下さい
オペラ	すぐに気持ちよくして差し上げますから
主人公	その恥ずかしい場所を俺の顔へと見せながら、オペラさんは俺へとまたがる。
主人公	既に存分に濡れている下着は、オペラさんのそこの形が分かるほどに透けていた。
姫	いやでも、確かオペラさん初めて……
オペラ	おっといけません。まずはこちらを脱がないと……
主人公	その強がりをごまかすように、オペラさんはその下着へと手をかける。が、俺の視線がそこに集中しているのに気がつくと、またモジモジと顔を赤らめた。
オペラ	う……あの、さすがにそんな風に凝視されてしまうと、恥ずかしくて……
姫	す、すみません……
主人公	視線を背けた俺に恥じらったまま、オペラさんはその下着を脱ぎ捨てた。
オペラ	い、いかが、でしょう……
オペラ	あ、あははー……こ、こんなにも恥ずかしいものだったとは……お、お願いですから……あまり見ないで下さい……
主人公	オペラさんの女性の部分が、俺の本当に目の前にある。淡いアンダーヘアを自らの蜜で存分に濡らしながら、俺にそのすべてを晒している。
主人公	ひくひくと蠢くそこは、とにかくいやらしいと思った。
姫	すみません。それはちょっと聞けないかと……
主人公	他の誰のものとも違って見えるそこを、俺はどうしても凝視してしまう。
主人公	いやらしくて、けれど柔らかそうで、気持ちよさそうで。俺はそっと両手を添えると、左右に開いた。
姫	オペラさんのここ……綺麗ですね……
主人公	トロリ、と垂れてくる熱い蜜。すっかり濡れそぼったそこは、淡いピンク色だった。
主人公	そのピンク色の肉壁の中に、出すための小さな穴と、俺を受け入れるための、やっぱり狭く閉じられた穴がある。
オペラ	も、もう……白鷺さま、本当にスケベです……
姫	男だったら、誰でも見ますよ。こんな、綺麗でいやらしいところ……
主人公	女性にとって一番恥ずかしくて、一番いやらしい場所。そこをこうして眺めているだけで、俺の肉棒はもう限界まで怒張していた。
オペラ	さっきあんなに出したのに……またこんなに硬くされて……
オペラ	そ、それでは……いきますね……
主人公	オペラさんは俺自身をそっと手に取ると、自分の入り口にへとあてがった。
オペラ	うぐっ！
主人公	そして、一気に腰を落とす。何かがぷちんと裂け、そのまま俺を半分ばかし飲み込んでいっった。
姫	うあ！　オ、オペラさん！？　そんな、一気になんて……
主人公	きつい初めての穴が、俺をキュッと締め上げる。
主人公	オペラさんはその眉間を歪ませながら、それでも笑顔を浮かべている。
オペラ	こ、これはまた……結構な……
オペラ	だ、大丈夫、です……少しばかり、想定より上でしたけれど……
オペラ	で、ですがこれで、白鷺さまのヤンチャなものが……私に……突き立ちました……
オペラ	い、いかが、でしょう……？
主人公	笑顔のままで、その痛みごと俺を受け入れながら訪ねてくるオペラさん。熱く蕩けたその身体は、気持ちいいとしかいいようがなかった。
姫	凄くいい、です……
姫	熱いオペラさんに締め付けられて……と、溶けそうです……
主人公	無理やりに広げられた秘洞は俺をガッチリとくわえ込み、締め上げている。
主人公	ここにいる。今はただそれだけで充分に気持ちいい。
オペラ	私の身体は気に入っていただけたみたいですね、よかった……
主人公	けれど、オペラさん的にはそれだけでもダメらしい。
オペラ	でしたら……いきます
主人公	覚悟を決めたように言うと、ゆっくりと腰を動かし始めた。
オペラ	ん……あ……
姫	オ、オペラさん？　あまり無理しなくても……
主人公	ゆっくりと抜き出されていく俺に、オペラさんの赤い筋が絡んでいるのが分かる。今の今まで処女だったオペラさんは、それがどうしたとばかりに無理やり腰を動かし続けた。
オペラ	い、いえ、これくらいなら大丈夫、です……は、あ……白鷺さまのが、わ、私の内側をこすって……
主人公	秘洞の中にある無数の壁が、俺と擦れ合い、互いを痺れさせる。
オペラ	や、だ、だめっ。ブルブルきて……か、身体が、震えちゃう……！
姫	あぐ！　そ、そんなに速く、されたら……っ
主人公	ゾクゾクと駆け上ってくる快感に、出したばかりなのにも関わらず、再び大きな波が溢れ始める。
主人公	このままオペラさんの中へと思う存分解き放ちたい。そんな期待が胸の中をグルグルと回っていく。
オペラ	はぁ……はぁ……も、もっと……白鷺さまで、もっと私を……はぁ……ゾ、ゾクゾクさせて、下さいっ
主人公	擦れ合うそこは、いつの間にかオペラさんの熱い蜜を溢れさせていた。
主人公	オペラさんが動く度に、ぐちゃぐちゃと水音を立てながらポタポタとこぼれていく。そんないやらしい様子が、俺の目の前で行なわれている。
主人公	それだけで俺は興奮し、昂ぶっていった。
オペラ	こんな、に……男女の営み、が……こんなに感じてしまうもの、だなんて……
オペラ	い、いかがですか……白鷺、さま……！
主人公	苦痛と快感とを織り混ぜながら鳴くオペラさん。ぐっちゃ、ぐっちゃと動き続けるその腰に、俺は限界寸前だった。
姫	ぜ、全部吸い上げられそう、ですっ。も、もう、身体の抑えがききませんっ
姫	オペラさんが、俺をキュウキュウって締め付けて……も、もう噴き出しそうっ
主人公	正直、もう寸前まで俺の白濁液は辿り着いている。あとはもうほんのわずかでも気を抜けばいい。それだけで、このオペラさんの体内を存分に汚すことができる。
オペラ	え、ええ、どうぞっ。い、いつでも、私の中、に！
主人公	そしてオペラさんは、早く出してほしいとばかりにより動きを速めだ。
オペラ	あ……はぁ……んあっ、く、んんっ、ひゃうっ
オペラ	し、白鷺さまとの結合部……も、もう、ぐちゃぐちゃに、なって……
オペラ	ん、ああっ……あ、うっ……んあっ……！
姫	っ！　そ、そんな急に締め付けられたら……！
オペラ	ん、んう、ふあ……あ、あ、ふぁ……
オペラ	はぁ……はぁ……ん、ううっ！　あ、あ、ああっ
主人公	ぎゅうっと、突然にオペラさんの体内が締まる。その刺激に今の俺が耐えられるはずもない。
姫	うあああああっ！！
オペラ	ん、あ、は、ん、んうううぅぅぅ！！
主人公	大きく背筋を反らせて震えるオペラさん。それと同時に、俺も自分のすべてを熱い体内へと発射していた。
オペラ	す、凄い……こんな、波みたいなものが……お、押し寄せて……
オペラ	白鷺さまが……噴き出して、ます……
姫	と、止まらない、です……
姫	どんどん、溢れて、きて……
主人公	一度出した直後だっていうのに、後から後から溢れてくる。その欲望のすべてを、俺は片っ端から解き放っていく。
オペラ	白鷺さまの、熱くて……激しくて……
オペラ	本当に、私の中を犯し尽くしてます……
主人公	そしてそのすべてを、オペラさんの身体は受け止めてくれた。
主人公	ゆっくりと俺を抜き取ると、ぱっくりとひらいたその穴から、白いものがぼたぼたとこぼれてくる。
主人公	今放ったばかりの俺と、オペラさんの蜜とが混ざり合ったものだ。
主人公	そして、その余韻を噛みしめるかのように、オペラさんは俺に微笑んでくれる。
オペラ	こんなに凄いことを、愛し合う男女というのはするわけですね……
オペラ	すべてを包んで、包み込まれて……
