ウルル	これが、にいさまの……
主人公	ズボンから取りだした俺を、ウルルは恥ずかしそうに両手でそっと持つ。
姫	いや、そんなマジマジと見なくても……その、前も見てるはずだし……
ウルル	あの、前の時は必死だったので、そんな余裕なかったんです
ウルル	それに、こんな状態じゃなくて……も、もっと凄い凶器みたいでしたっ
主人公	まあ、風呂場の時もその……反応しちゃってたしなあ。疲れのせいで……。
主人公	ウルルはそのまま、マジマジと色々な方向から俺を見る。いや、こういうのかえって恥ずかしいんですけれど。
主人公	そして納得したのか、ウルルはニコっと笑って言った。
ウルル	だけど、これだとちょっとかわいく感じます。えへへ。よろしくお願いしますね、にいさま
姫	な、なんか普通に言われるより照れるな、それ……
ウルル	そ、それであの……これってどうすれば……
姫	えっと、興奮すると自然になっていくので、擦ったりとか色々いじってみてくれれば……
主人公	どうしていいのか分からず、俺を凝視し続けているウルル。苦笑しながら教えた瞬間、ウルルの目が真剣になった。
ウルル	は、はいっ。頑張ります
ウルル	え、えっと、こんな感じで……
主人公	そしてゆっくりと俺をシゴキ始める。
主人公	ウルルの小さな手がゆっくりと上下に動く。どこかたどたどしいその動きが、むしろウルルの一生懸命さを表わしてるみたいで俺を興奮させた。
姫	う、うん……いい感じだ……
姫	う……うあ……
ウルル	うわぁ……本当にムクムクってなってきました……
主人公	変に慣れていないからこそ、余計に感じてしまう。これからのことも想像し、俺はあっという間にいつも以上の大きさになる。
ウルル	あう……こ、こんなにおっきく……
主人公	すっかり怒張しきった俺に、ウルルが驚いたような声を出す。まあ、大きくなったどころか、前回、初めてやった時くらいの大きさになってるしなあ……。
ウルル	可愛らしかったにいさまが、凄い凶器みたいです……
姫	ま、まあ……この後の行為のこととか、ちょっと期待しちゃってる分もある、かな……
主人公	あの熱くてキツイウルルの中へと再び入る。それを考えただけで、あの時の快感までもが脳裏に蘇ってくる。
姫	いつもよりも結構キてるかと……
ウルル	でも、これもにいさまの一部で、ウルルと一つになるためのものなんですよね
ウルル	だ、だったら、頑張らないと、です
主人公	ウルルは自分に言い聞かせるように言うと、その可愛らしい舌を、チロリと出した。
ウルル	んう……
主人公	熱い柔らかなものが、俺の先端にそっと触れる。瞬間、俺の背中に電気が走った。
姫	うわ……びく、ってきた……
ウルル	あの、大丈夫ですか？
姫	ああ。凄い良かったから続けてくれ
ウルル	は、はいっ
主人公	俺の感想に、ウルルは嬉しそうに笑うと、再び俺を舐め始める。
ウルル	ぴちゃ
姫	う……あ……
主人公	ウルルの舌が、俺の亀頭をゆっくりと舐めていく。
ウルル	ぴちゃ　ぴちゃ
ウルル	ぴちゃ　ぴちゃ　ぴちゃ
主人公	まるで壊れ物でも扱うような動きで、俺を刺激していくウルル。舌の熱さが俺の肉棒からジンワリと染み込み、俺をゾクゾクと震わせる。
ウルル	はぁ……ど、どうです、か……気持ちよくないです……？
姫	あ……う、く……
姫	い、いや、凄くいい……そのままで……
主人公	女の子が、恥じらいながら俺のものを口で攻めている。これだけでも充分に興奮できるシチュエーションなのにも関わらず、相手はウルルだ。
主人公	ウルルがこの小さな口で、俺を気持ちよくさせようと一生懸命になっている。それだけでも何かがキてしまう。
ウルル	は、はいっ……それじゃあ……ん……
ウルル	ぴちゃ　ぴちゃ　ぴちゃ
ウルル	ん……んく……あむ……んっ、何か、ヌルってしたのがにいさまから……
ウルル	んん……ちょっと変な味、です……んう……
主人公	その快感から漏れ出した先走りを舌ですくって、ウルルがわずかに顔を歪める。それでも後から後からこぼれてくるそれを、ウルルは嫌がることなく舐め取っていった。
ウルル	ぴちゃ　ぴちゃ
ウルル	ぴちゃ　ぴちゃ　ぴちゃ
主人公	一生懸命に俺を愛撫するウルルの舌で、俺の肉棒は唾液と先走りにまみれてヌラヌラと光っている。
主人公	俺の反応を見ながら、気持ちいい場所を探っていくウルルが、いやらしくて可愛らしい。
姫	んく……ウルルの、凄く熱くて、気持ちいい……
ウルル	に、にいさまのも……すごく熱い、です……んん……
ウルル	も、もうちょっと……
主人公	更に昂ぶり、熱くなる俺の先端を、ウルルは一生懸命に口を開き咥えこんだ。
ウルル	んむっ
主人公	いきなりウルルの口内へと迎え入れられ、その熱さに腰が震える。
姫	うぁ……熱い吐息が……
ウルル	ん……んぅっ……
ウルル	ん……こ、この、割れてるところ……んむ……ここから……ヌルヌルが……ん、んん……でてきて……
主人公	頬と舌とが俺を全方位から責め上げ、封じ込める。駆け上がってくる快感に、足の力が抜けていく。
ウルル	んく、ん……あはっ……んうっ
ウルル	ん……ふあっ、あっ……あぐぅ……
ウルル	ん、んむっ……す、少しまたおっきく……んんっ
主人公	コツを掴んできたのか、少しずつ大胆に口を動かし始めるウルル。けれど限界までいきり立った俺は、ウルルの口に入りきらない。
ウルル	んん……口、に……はあっ、んあっ……入らない、です……
主人公	頑張って少しでも咥えようとしてくれているものの、どうしても今が限界だった。
主人公	ウルルは残念そうに、俺の先端を様々な方向から刺激し続ける。
ウルル	はむっ、んあ、あうっ……
姫	あ……うぐ……ウ、ウルル！　俺、もう……
主人公	身体の芯の方から湧き上がった欲望が、下半身へと集まっていく。それを吸い出そうとするかのようなウルルの口に、俺は耐えられそうもない。
ウルル	あむっ、ん……へ、平気、です……んく……このまま、で……っ
ウルル	ん……ん、むっ、んう……！
姫	あ……ああ！　ん、くうっ！
主人公	むしろそれを望み、より口を激しく動かすウルルに、俺の堤防は白旗を揚げた。
主人公	俺はガマンし続けた大量のそれを、一気にウルルの口へと解き放つ。
ウルル	んうぅっ！！
主人公	勢いよく噴き出したそれにウルルが顔を歪める。ドクドクと溢れるそれを、こぼさないようにと口で受け止め続けるが、小さなウルルの口では不可能だった。
ウルル	ん……んく……んく……んくうっ
主人公	その唇の端から溢れさせながら、それでもなんとか、できるかぎりの量を喉の奥へと流し込んだ。
主人公	ウルルが俺の精を飲み込んでいく。その光景に、どうしても興奮を隠せない。
姫	大丈夫か、ウルル？
ウルル	はぁ……はぁ……にいさまの、いっぱい出ました……
主人公	やがて、ようやく収まった俺の肉棒を口から離し、苦しそうに空気を求めるウルル。その口から、溢れた白い精が垂れていくのが妙にいやらしく見えた。
ウルル	すっごく熱いのが、いっぱい……
姫	ごめん。ウルルの口が気持ちよくって……
ウルル	いいえ、にいさま。ウルルには遠慮なんてしなくていいです
ウルル	ウルル、にいさまのたくさん受け止められて、嬉しかったですから
主人公	そう言って、嬉しそうに頬を赤らめるウルル。そのまま恥じらうように視線を逸らすと、俺の顔を見上げながら言った。
ウルル	ですから、あの……今度はウルルも気持ちよくして下さい……
ウルル	あ、あの、にいさま？　こんな後ろからで……
姫	この方が、ウルルの可愛いところがよく見えるから
主人公	地面に四つん這いにさせながら、そのお尻を上げさせる。突き出されるような形になったウルルのお尻が可愛らしい。
ウルル	あう……ぜ、全部見られちゃいます……
ウルル	で、でも、にいさまになら……
姫	ごめん。なんかウルルの本当に全部を知りたくて……
ウルル	は、はい……ウルルはもうにいさまのものですから、にいさまが見たい場所は全部見せちゃいますっ
主人公	羞恥と緊張から身体をガチガチにさせながら、けれどはっきりと言い切ってくれたウルル。
姫	うん。それじゃあ……
主人公	俺は、そんなウルルのズボンへと手をかけ、ズリ下ろした。
姫	な、なんか、この体勢だと確かに、すごいいやらしく見えるな……
姫	ウルルのお尻が、なんだか凄く触りたくなる
主人公	可愛らしい下着に包まれたウルルのお尻。張りのあるそれは、見ているだけでも楽しく感じる。
ウルル	あんっ……も、もう、にいさま、すっごくえっちです……
ウルル	でも、失敗しました。こうなるなら、もっとオシャレとかも考えてれば……
姫	いや、変に大人ぶるよりも、この方がウルルらしくて可愛いからいいと思うぞ
ウルル	そ、そうですか？　ならいいんですけど
姫	それじゃあウルル、触るぞ……？
ウルル	は、はい。にいさまの好きなように……
主人公	俺は、もうガマンできないとばかりに、その瑞々しいなだらかな曲線へと手を伸ばした。
ウルル	あ……
主人公	下着の上から、その曲線を撫で回す。そしてそのまま、秘裂の上を指でなぞった。ぴくん、とウルルの身体が小さく反応する。
ウルル	は、あ……ん、ああっ
主人公	秘裂に沿って、少し激しく指を動かす。ウルルの呼吸がわずかに荒くなり、その声も甘さを含み始めた。
主人公	そして続けているうちに、下着に小さなシミが生まれてくる。
ウルル	ふあ……あ……にいさまの指……すっごく優しくて、ぞ、ぞくぞくしちゃいます……
ウルル	や、あぁ……な、中からはしたないのが出ちゃって……
主人公	少し強めに秘裂を押すと、中からウルルの蜜がジワっと溢れだした。下着のシミが大きく広がっていく。
主人公	俺はシミの上から、秘裂の中へと指を押し込んだ。俺によって広げられた入り口へと、下着ごと指先を挿入する。
ウルル	んあ、あ、ああっ……お腹の奥の方が……あ、熱くなってきて……
姫	うん……下着の方もこんなに塗れてて、指に絡んでくる……
主人公	下着越しに染み出してくる愛液。指に絡んだそれはネットリと熱い。
姫	脱がすよ。ウルル……
ウルル	はい……ど、どうぞ……
主人公	頃合いと見た俺は、ウルルの下半身を大聖堂の荘厳な空気の中にさらけ出した。
姫	やっぱり、ウルルのすっごく綺麗だ……割れ目も、こんなに小さくて……
主人公	何も生えていない、可愛らしいウルルの股間。そこには、中から漏れた蜜で濡れた一本の筋がある。
ウルル	ウルルの全部、見られちゃってます……
主人公	一度汚した場所ではあるものの、あの時はここをしっかりとは見られなかった。ドキドキと速まる鼓動を落ち着かせながら、俺はその小さな割れ目を左右に開いた。
ウルル	や、やあ……開いちゃうのは、は、恥ずかしすぎて……
姫	大丈夫だよ。ウルルの、ほんと綺麗だから……
主人公	こぼれる熱い蜜と共に、ピンク色の肉壁が姿を見せる。薄く透明がかったピンクは鮮やかで、思わず見とれそうになってしまった。
姫	すっごい鮮やかな桃色で……それが蜜に濡れてて……すごくいやらしい……
姫	奥の方から蜜がトロトロ出てきてる……
主人公	一度俺を受け入れ広がったそこは、まだ少し痛々しい。けれどその奥からは、次々と蜜が垂れてきている。
ウルル	にいさまがウルルをそんな風にさせてるんですよ……
ウルル	にいさま、責任とって下さいね……
姫	ああ。ちゃんと気持ちよくなってもらう。こことか……
主人公	俺は言うと、ウルルの一番敏感な豆を、キュッとつまんだ。
ウルル	ひゃんっ！
主人公	瞬間、ウルルは大きく背筋を反らして鳴いた。同時に、大量の蜜がこぼれ出す。
主人公	俺は、その蜜で指を濡らすと、そのままクリトリスを撫で回す。前回よりは少し強めに。
ウルル	あ、そ、そこ、いきなりは……きゃうっ
ウルル	あ……は……あふ、ん、んんっ……！
ウルル	やあぁっ……こんな、びくびくってきて！　あ、ふあぁん！　背筋、そっちゃい、ます！
主人公	相当に感じやすいのか、大聖堂中を響かせるような大声で、ウルルは甘く喘ぐ。
姫	ウルルの中から、ポタポタ垂れてきてる……こういうの大洪水っていうのかな……
姫	こんなに濡れてるの、初めて見た……
ウルル	ふあ、あ、ああ！　にいさま、指、ダメ、です！
ウルル	ひ、あ、あふ……だ、だめぇ！　おかしく、なっちゃうっ！
主人公	感じて、大きく膨らんでくるそこを、更に強くいじった。早くウルルの中に入りたいとも思ったけれど、目の前で喘ぐウルルが可愛くて、少し意地悪を続けたくなる。
姫	ここもぷっくりしてきて……ウルルって、どこでも触る度に反応あって、それが凄く可愛いんだよ
ウルル	だ、だってだってだって！　にいさま、が！　にいさまが感じさせるんですっ！！
ウルル	や、あ、ああ！　もっと、もっと下さい！　に、にいさまが欲しい、です！
主人公	ビクビクと身体を震わせ懇願するウルル。その姿に、俺ももうガマンできそうになかった。
主人公	ウルルの小さな身体を背中からしっかりと抱きかかえ、自分を、その入り口へと押し当てる。
姫	それじゃあ、挿れるけど、大丈夫かウルル？
ウルル	あ……は、はい……
主人公	二度目とはいっても、まだ少し辛いだろう。その苦痛を和らげようと、俺はウルルの胸を片手でいじる。
主人公	ふにふにとした柔らかな感触が気持ちいい。
ウルル	にいさまの指が……気持ちいい、です……
ウルル	ウルルの、小さいですから……ごめんなさい……
主人公	少しうっとりとしながらも謝るウルルに苦笑する。
姫	こんなに柔らかくて気持ちいいんだけどな
主人公	俺はそう言い返しながら、その可愛らしい胸を少し激しく揉みしだいた。
主人公	そのまま、乳首を指の股に挟み込む。
姫	乳首も、いつの間にかこんなに硬くなってて……
ウルル	ふあ、あ、きゃうっ！
姫	それじゃあ……
主人公	ウルルが、胸からの快感に身体を震わせているそのうちに、俺はウルルの体内へと自分を押し進めていった。
ウルル	んっ……んん！
主人公	まだ少し苦痛を感じさせる声でウルルが喘ぐ。ウルルの中は前回同様にキツく、俺を容赦無く締め上げてくる。
姫	く……前みたいな抵抗はないけど……でも、やっぱりキツイ……平気か？　ウルル
ウルル	は、はい……前よりは全然……だ、だから、にいさま、動いて下さい……
主人公	それでも苦しいのは間違いないんだろう、その目尻に涙を浮かべながら言うウルル。
姫	うん。それじゃあ、ゆっくりいくから……
主人公	俺はゆっくりとウルルの中を動き始めた。
ウルル	あ……んく……う、あ、ああっ……
姫	んう……や、やっぱりウルルの中、凄い、な……
姫	もう濡れそぼってて……溶鉱炉みたいに熱い……
主人公	ドロドロとした蜜でいっぱいのウルルの中。それの助けを借りて、ゆっくりと動く俺。
主人公	その動きに合わせて、ウルルは甘い声で喘ぐ。
ウルル	に、にいさま、のも、です……んあ……ふぁ………
ウルル	あ、はぁっ……あく……ん、あぁ……
ウルル	ま、前よりも……にいさまを感じ、ます……気持ちいいのが、背筋、走って……
主人公	その言葉には確かに苦痛もまじっていたけれど、それよりも強い甘さが感じられた。明らかにウルルは感じている。
姫	それじゃあ、もう少し平気かな……？
主人公	俺は、確認するように言うと、少しずつ腰の動きを速めていった。
ウルル	あ、んう……ふぁ……ああっ……！
ウルル	に、にいさま、が……奥に、あ、当たって……ますっ
主人公	少しずつ、けれど確実にリズミカルになっていく腰の動き。ウルルの中からは粘着質を帯びた蜜がこぼれ、ウルルの嬌声は大きくなっていく。
主人公	しっかりと俺に絡みついた無数のヒダは、その動きに合わせるように、俺をシゴき、感じさせていた。
主人公	腰の奥が震え、今日二度目になる射精感が、俺の肉棒の根本に集まっていく。
ウルル	こんなの……んあ、あぁ……んっ、あうっ……っ
ウルル	だ、だめ……あ、頭の中、が……し、白くなって……あ、ふあ、ああ！
姫	う、あ、ああ！　ウルルの中……し、締め付けて、くる……！
主人公	ずちゅずちゅと淫靡な音と共に響くウルルの喘ぎ。下半身を締め付ける快感と、脳髄を痺れさせる甘い声。
姫	や、やめ……絞りとられ、そうで……うああ！
主人公	今すぐにでも中に放ってしまいそうになるのを、辛うじて抑える。
ウルル	にいさまっ、をっ！　ウルルに……あ、あく……んああっ！
ウルル	にいさまが……にいさま、ウルルの中、掻き回し、て……うあ、ああ！
主人公	それでも、熱いウルルの中は気持ちよくて、腰は止まってくれない。そのキツイ秘洞の中を、ただガムシャラに犯し続ける。
ウルル	にいさまっ、もっと、ウルルに……く、下さい……んああっ！
主人公	ブルブルと身体を震わせながら、ウルルは俺を求め続ける。俺自身も、ウルルの身体を求めて動き続ける。
ウルル	も、もう、だ、だめです！　な、何かきて……やあぁっ！
主人公	瞬間、ウルルの秘洞が強く締まった。その刺激に、俺のガマンも崩壊する。
ウルル	ん、あ、ああっ……はふ……ん、う……あ、ああああああっ！！
姫	ん、くう！
主人公	達したウルルの絶叫と共に、俺もまたすべてを放出していた。
ウルル	ふあ、あ、あああ……にいさまの熱いのが……た、たくさん出てきて、ます……
ウルル	ウルルに……ウルルにいっぱい注がれて……
主人公	二度目とは思えない量が、何度も、何度もウルルの中へと解き放たれる。欲望を放つ心地よさに飲み込まれながら、俺は自分をウルルの一番深い場所へと突き立てていた。
ウルル	ふああぁ……
主人公	そして、その欲望と引き換えに、何か大きな力を自分の中へと吹き込まれていくように感じた。
主人公	すべて出し終えた俺を、ウルルの中からゆっくり抜き取る。と同時、ウルルを満たしていた俺の精が、ごぽ、っと音を立てながらこぼれ落ちた。
ウルル	ほえ……にいさまの、こぼれちゃってます……ウルルから……
姫	はぁ……はぁ……ウルル平気か？　放心してるけど……
ウルル	は、はい……
ウルル	でも……これが祝福、なんですね……
主人公	垂れていく俺をボーッと眺めながらウルルは呟く。
ウルル	にいさまに、ウルル、心も全部持ってかれちゃいました……
ウルル	相手がにいさまで、本当によかったです……
主人公	そんなウルルを、俺はもう一度強く抱きしめた。
