和登	すみません、出来心だったんです……
主人公	春うららかな季候に包まれ、誰もが気持ちよく迎えられるであろう、爽やかな朝。
主人公	俺は正座した状態で頭をこすりつけながら、誠心誠意の謝罪をしていた。
主人公	目の前には刀を持った女の子がいて、殺気と共に鋭利な刃を俺に突きつけている。
静音	そんな初めての万引きで掴まった中学生、みたいな言い訳が通用すると思ってるの？
主人公	そんな俺の精一杯の謝罪でも、どうやら彼女の怒りは収まらないらしい。刀を持つ手がぷるぷると震えている。
和登	い、いや、ちょっと待て、まず言い訳をさせてくれ！
和登	これには海より深い理由があるんだ！
主人公	そう言って、俺はこれまでの経緯を身振り手振りも交えて弁明し始める。
主人公	その日、俺こと赤城和登は、朝も早くから、家にほど近いこの天城神社にやってきていた。
主人公	理由は単純で、朝が非常に弱い幼なじみを迎えに来たからだ。
和登	あ、静雄さん、おはようございます
主人公	鳥居をくぐり、境内の掃除をしていた静音の親父さんに声をかける。向こうもこっちに気がついてくれたらしく、笑顔で挨拶を返してくれた。
静雄	おや、和登君じゃないか。どうしたんだい？　日曜の朝から
和登	静音に聞いてません？　今日は兄貴達と朝から出かけるって約束してたんですけど
静雄	そういえばそんな事を言っていましたね……ああ、それで、ですか
主人公	俺の説明に事情を理解してくれたのか、苦笑しながら神社の近くにある自宅の方へ静雄さんが視線を送る。
和登	やっぱ、まだ寝てます？
静雄	ええ、すみません。我が娘ながら朝に弱くてね
主人公	静雄さんの言葉に俺も苦笑する。やはり迎えに来て正解だったみたいだ。
和登	それじゃあ、ちょっとお邪魔しちゃってもいいですかね？　静音起こして来ちゃうんで
静雄	約束の時間に遅刻して、和登君達に迷惑をかけるわけにはいきませんね。家に上がって、叩き起こしちゃってかまいませんよ
主人公	俺の言葉に静雄さんはあっさりと了承してくれる。実際、こうやって俺が静音を起こしに来るのは今回が初めてじゃないしな。
主人公	天城の家とは子供の頃からの付き合いで、正直互いの自宅は勝手知ったるという感じだ。
和登	でも、最近寝てる間に部屋に入ると怒るんですよね。少し前は平然と明日起こしてとか頼んできた癖に
静雄	はは、あの子も一応年頃ですからねぇ。男の子に寝顔を見られるのは恥ずかしいんじゃないですかね
和登	あいつ寝相も寝起きも悪いもんなー、たまに凄い体勢で寝てるし。そうなると反撃を考えて静雄さんに起こしに行って貰った方が安全？
静雄	いやいや、それがそうでもないんですよ。この前なんてね、起き抜けに何を勘違いしたのか術で攻撃されましてね。危うく黒こげになるところでしたよ
和登	あ～、寝起きの静音って戦闘力五割増しぐらいになりますからね
静雄	まったくです。それも年々威力が上がってますからね
主人公	そういって静雄さんと世間話をしながら互いに笑い合う。家族ぐるみの付き合いをしているだけに、こういった会話も普通に出来てしまう。
主人公	まあ、本人の目の前で言うと滅ぼされる事必至なので、絶対に言わないが。
静雄	というわけで、私が起こしに行くと痛い目を見そうなので、ここは和登君にお願いします
和登	いや、俺を生け贄に捧げようとしてません！？
主人公	娘の寝起きが悪い事を知っていて、それを幼なじみに押しつける父親というのもどうなんだろう。
主人公	まあ、実際俺も静音の寝起きの悪さは身をもって実感しているので、気持ちは凄くよくわかるのだが。
静雄	ふふふっ、何のことか分かりかねますね。それじゃあ、私は社務所の方に用事があるのでこれで
和登	げぇ！？　逃げた！？
主人公	俺の指摘にとてもいい笑顔のまま、静雄さんは社務所の方へと走っていってしまった。
和登	なんて逃げ足、さすが静雄さんだ
主人公	こうなると、どれほどの危険があろうと俺が起こさずにはいられない。が、さすがに俺も幼なじみを起こす為に命は張りたくない。
主人公	そうだ、気心の知れた幼なじみとはいえ、一応は女の子。勝手に部屋に入るのは良くない。ここは静音が起きるのを信じて待つという選択肢をとっても仕方ないのではないか。
和登	けど、こういう時のあいつって、起こさないと昼過ぎまで寝てるしなぁ……
主人公	しかし、長年の付き合いがその選択肢を許してくれない。
主人公	静音の家はある事情から父子家庭だ。静雄さんが起こす事を放棄した以上、俺が行かなければ本格的に起こす相手がいない。
主人公	まあ正確に言えばもう一人、静音を起こす可能性を持った奴がいるにはいるのだが、そちらは静音以上に無精なのでさらにあてにならない。
和登	まあ、今回は約束の為だし、不可抗力だ。きっと静音も許してくれるだろう
主人公	だから俺は、そう楽観的に思いながら静音の部屋へと向かって歩き出した。
主人公	その結果がこれである。
和登	――という、事情がありましてね
静音	お父さん……後で覚えておきなさい……
主人公	そういって頭を抱える静音を見ながら、胸中で静雄さんに、フォロー出来なくてごめんなさいと謝る。
主人公	でも俺を見捨てて生け贄に差し出したんだし、これぐらいあってもいいよねと思わなくもない。
静音	まあ、でも事情は理解したわ。一応あたしの為に、わざわざ来てくれたわけね
和登	うむ、幼なじみに朝起こしてもらえるという、夢のシチュエーションだ！
和登	喜んでもいいのよ？
静音	それって普通、女が男にするものじゃない？　ていうか、今日が初めてってわけでもないじゃない
和登	そこはほら、ノリ？
静音	そこを疑問系で聞かれても困るわよ
主人公	俺の話にため息をつきつつ、軽く額に手を置く静音。
主人公	ぶっちゃけた話、幼なじみに起こして貰うという王道ギャルゲー的な展開は、俺自身の願望だったりする。
主人公	しかし、静音が朝に弱い事を知っているので、そのシチュエーションが絶望的であることも理解している。
静音	まあ、あんたが朝から家に居る理由は分かったし、迎えに来てくれた事にもお礼は言うわ
主人公	どうやら、納得してくれたらしく、ほうと胸をなで下ろす。
和登	だろ？　俺がんばっただろ？
静音	け・ど！
静音	就寝中の女の子を、悪質な手口で叩き起こしてくれた事に関する弁明はないのかしら？
主人公	再び殺気全開の笑顔を向けてくる静音に、冷や汗が背中を伝う。
主人公	実は俺が土下座で謝る事を強いられている、最大の理由はそれが原因だったりする。
和登	え～、初めは普通に起こそうと思ったわけですよ
和登	うん、ちゃんと扉の前で必要最低限の努力はしましたよ。それがマナーって奴ですから
静音	そうね、親しき仲にも礼儀ありって言うしね
和登	そうそう！
静音	で？　どんな努力をしたの？
和登	ドアを最低限の力でノックした後、さらにドアに向かって最低限のボリュームで声をかけ、それでも反応が無かったので最低限の動作でドアを開けて部屋に入りました
静音	それは起こす為の努力じゃなくて、あたしに気づかれず部屋に侵入する為の努力だ！
主人公	そうとも言う。実際ここまで来て起きてたらつまらないとちょっと思ってはいたし。
主人公	まあ、そもそも熟睡している静音は、部屋をノックしたり声をかけた程度では、到底起きないのだが。
和登	いや、それでも部屋に入った後は、やさしーく！　本当にやさしーく起こそうと思ったのよ！　俺も寝起きのお前に攻撃されたくないし！
主人公	実際これは本当で、直前まではなるべく穏便に静音を起こそうと思っていた。
主人公	思っていたのだが。
和登	けど、なんかこう、気持ちよさそうに寝てるお前の顔見てたら、ムラムラっと……
静音	……
和登	いたずらしてやりたい衝動に駆られまして……それでつい
静音	それで、つい気持ちよく睡眠中のあたしの顔の目の前に般若のお面を被って、ドスの利いた声でグッドモーニングと叫んで起こしたわけね……？
和登	いえす
静音	よし！　滅ぼそう！
和登	やめてください、これ以上“炙られたら”本当に死んでしまいます
主人公	実際、俺は跳ね起きた静音に筆舌しがたいレベルの反撃を受けた。自業自得とはいえ、これ以上ダメージを受けたら本気でやばい。
静音	まったく！　出来心って言ったって限度があるでしょ！　本気で心臓が止まるかと思ったんだから！
和登	あ、ああ……でもその後、俺の心臓も止まりそうになってるから、おあいこじゃないかな？
主人公	土下座状態から、ちらっと静音の顔を見ながらそう言うと、冷や汗を通り越して、背筋が凍るような殺気が飛んで来たため、再び顔を伏せる。
静音	大体、般若のお面なんて、なんで持ってたのよ！
和登	いや、こんな事もあろうかと
静音	こんな事ってどんな事だー！
？？？	くくっ、はははは！　その辺りにしておいたらどうだ静音。和登も困っておるぞ
主人公	再びのツッコミに俺が顔を伏せていると、すぐ頭上から声が聞こえてくる。しかし、静音の部屋に誰かが入ってきたわけではない。
静音	むぅ、だって安綱……
？？？	ぬしの言い分も分からなくはないが、このままだと待ち合わせに遅刻するぞ。せっかく起こしに来てくれた和登の好意が無駄になる
静音	はあ……。もう、わかったわよ
主人公	そう言うと、静音は仕方ないといった風に刀を収めてくれた。
和登	ふぃ……た、助かった
静音	もう、今度あんな事したら許さないんだからね。起こすなら普通に起こしてよ
和登	おう、今度はもうちょっと穏便にいたずらするよ
静音	そもそも、いたずらするなって言ってるのよ！
主人公	静音の言葉にそれではつまらないしなぁと思ったが、その台詞は飲み込んでおく。これ以上彼女の逆鱗に触れると、それこそ真っ二つにされかねない。
安綱	くくっ、いたずらするのは駄目だが、和登が部屋に入ったり起こしに来るのに関しては怒らんのじゃな
主人公	すると、先ほどと同じ声が再び俺の耳に届く。声の発生源は確認するまでもなく、俺は知っている。それは静音の持っている刀からだ。
静音	そ、それはあれよ！　昔から和登に起こして貰ってるから、今更っていうかなんていうか……
安綱	くくく、素直じゃないのう
安綱	まったくお前等は、本当に愉快じゃのう
主人公	そう言うと、静音の持っていた刀が、ぽんと音を立てて消える。いや、正確にいえば消えたのではなく変化した。
安綱	いやあ、朝からいきなりたたき起こされたと思ったが、面白いものを見せて貰ったよ。これもいわゆる“早起きは三文の得”というやつじゃな
主人公	大きさは普通の人間より大分小さく、何よりふわふわと静音の横に浮かんでいる。一見して人間ではないと分かるが、俺も静音も特に驚きはしない。
静音	あたしの場合、強制的に早起きさせられた感があるけどね
安綱	なんじゃ、内心じゃちゃんと起こしに来てくれた和登に感謝しつつ、喜んでおる癖に。これが世にいうツンデレかのう
静音	ツンデレじゃないわよ！
主人公	安綱の言葉に顔を赤くする静音を見て軽く笑いつつ、安綱に顔を向ける。
和登	ういっす、おはよう安綱。それと仲裁ありがと
主人公	この一見するとＵＭＡレベルの不思議生物の名前は安綱。正式名称は“童子切安綱”という、知ってる人は知ってる名刀だ。
主人公	正確に言うと、その名刀が長い年月を経て九十九神となった、いわゆる妖怪の一種だ。
主人公	本人曰く非常に珍しい存在らしいのだが、昨今では九十九神程度はさほど珍しくはなく、いまいちどれほど凄いのかイメージしづらい。
主人公	静音同様、子供の頃からの付き合いで、この名刀様が俗世に染まりきっているのを知ってるからかもしれないが。
安綱	気にするな、ここでお前が滅せられたら、こういった事も見られなくなるしのう
和登	う～ん……あながち、冗談とも思えないのが恐ろしい
静音	そう思うなら、くだらないいたずらは自重しなさい
主人公	ぴこんと額をつつかれ、頭をかきながら苦笑する。
和登	りょーかい、努力はしてみるよ。うん、今後は最低限努力する！
静音	せめて最大限の努力をしなさいよ！
主人公	まったくと嘆息して、静音が朝食を作るために台所へ向かって歩きだしたので、俺もその後ろに続いて歩きだした。
