和登	悪い、遅くなった！
静音	あ、やっと戻ってきた
大樹	思ったよりかかりましたね。何かあったんですか？
主人公	教室に入ると、既に他の生徒の姿は無く、静音と大樹のみがこちらを見ていた。
和登	あれ？　大樹も残ってたのか？
静音	あ、それなんだけど、この後の予定話したら大樹も行きたいって
大樹	ええ、新しい甘味処と聞いて興味がでました。あ、お二人の用事の方は僕にお構いなく。店内で甘い物でも食べながら待ってますから
主人公	そう言えば、大樹はケーキやあんみつみたいな甘いものが好きだったな。
静音	一応、おやじさんにメールしたんだけど、特に問題無いって。むしろ他に友達がいるなら誘ってもかまわないぞって返ってきた
和登	なるほどね
大樹	なので、兄貴さんにもメールしたんですけどね。まだ返信が返ってこないんですよ
静音	今日休みだからって、寝てるのかしらね
和登	あー、兄貴なら多分今メール返信する余裕がないんじゃないかな？
主人公	当然のことの様に答える俺に、大樹と静音が首をかしげる。
静音	え？　どういうこと？
和登	あ、実は先生の話が終わった後に兄貴に会ってさ。どうやら入学式後の片付けを手伝わされてるみたいなんだ
大樹	へぇ、そうなんですか
大樹	ああ、それで和登君が戻って来るのに時間がかかったわけですね。兄貴さんと話してたわけだ
和登	そういうこと
静音	なるほどね。じゃあ、五郎先輩には仕事が終わって暇だったら、お店で合流しようってメール送っておきましょうか
和登	だな、それでいいと思う
大樹	了解しました。それじゃあ僕から送っておきますよ、先ほどメールしたのも僕ですしね
静音	お願いね
主人公	手伝いがどれほどかかるかは分からないが、ここで兄貴だけ誘わないのもなんだか寂しい。
和登	それじゃあ、行こうか
静音	そうね、なんだかんだであたしも楽しみだし
大樹	ええ、非常にわくわくします。まずは何を頼みましょうか
主人公	そうして俺達は期待を胸に、商店街に向かうため教室を出た。
静音	それにしても、生徒会の人達は大変よね。これから入学式の片付けしないといけないんだから
大樹	ええ、結構規模の大きな式でしたからね、片付けも大変でしょう
和登	まあ、だから兄貴みたいに、手伝いにかり出されてる人がいるんだろうけどね
主人公	実際意識して見てみると、もう新入生のほとんどが帰ったというのに、あちこちを忙しそうに歩いている生徒達が結構いることに気がつく。
雪女の少女	これ、ここに置いて大丈夫ですか？
上級生	うん、そこで大丈夫
静音	あれ？
主人公	そんな中、丁度近くの教室から出てきた女子生徒を見て静音が首をかしげる。
大樹	どうかしましたか？
静音	あの子、あたしたちと同じ新入生じゃない？
和登	ん？
主人公	静音の視線を追うと、確かに女子生徒が二人で片付けを行っているようだが、俺には彼女達が新入生かどうかの判断はつかなかった。
上級生	でも、ごめんね。入学式なのに手伝ってもらっちゃって
雪女の少女	いえ、美琴お姉様の頼みですし。元からお手伝いするつもりでいましたから
上級生	本当に助かるわ
主人公	そんな会話をしながら、二人が離れていくが、やはり俺には判断がつかなかった。
静音	あの白髪の子、多分同じクラスだったと思うんだけど、気のせいかな？
大樹	さあ、どうでしょう。僕もまだクラスメイトの顔は把握してませんし
和登	あー、でも言われてみれば、いたかもしれないな
主人公	でも、そうすると確かに何故同じ新入生の彼女が手伝いをしてるのだろうか。
静音	まあ、明日直接聞いて確かめればいっか
和登	だな、俺も気になるし、同じクラスだったら明日聞いてみよう
主人公	首を捻ったがわからず、俺達は明日直接聞こうと結論付けて、その場を後にした。
和登	ん？
主人公	しかし、校舎を出た所で、俺は教室で感じた視線と同じものを感じて辺りを見渡した。
静音	和登？
和登	あれ？　おかしいな
大樹	教室の時もありましたけど、何かあったんですか？
和登	いや、なんか今日はやたら視線を感じてさ
静音	え？　なにそれ、誰かに見られてるって事？
主人公	静音の言葉に、俺自身が疑問を持ちつつも頷く。静音と大樹が顔を見合わせて周囲を見るが異常は見られない。
和登	ん～？　やっぱり気のせいかなぁ？
大樹	寝不足みたいですし、それが原因なんじゃないですか？
和登	かもしれない
主人公	大樹の言葉に否定出来ないと苦笑する。確かに、昨日の寝不足がたたって神経が過敏になってるのかもしれない。
静音	もう、しっかりしなさいよね。明日から普通に学園なんだから、今日はちゃんと寝るのよ
和登	だな、今日はしっかり睡眠を取るよ
主人公	静音に笑い返し、俺は再び歩き出した。
主人公	しかし、
？？？	待って！　かずくん！！
静音	え！？
大樹	は？
主人公	歩き出してすぐに、突然の大声が周囲に響き渡った。
主人公	時は和登達が校舎の外に出るちょっと前にさかのぼる。
雅	う～、どうしよう……結局こんな時間まで残っちゃった……
主人公	和登に会いたい一心で、勢いで学園に来ていた雅だが、結局中には入れず和登が出てくるまで正門の所で待っていた。
雅	で、でも、会ったら何て声をかければいいんだろう……？
主人公	雅は今日ここに来ることはおろか、この学園に入学する事すら静音と和登には黙っていた。
主人公	理由は単純に二人をびっくりさせる為だが、そっちにばかり気をとられて、一番肝心な再会した時の事を考えていなかった。
主人公	そもそも実際に対面するのは数年ぶりなのだ。いくら手紙や電話のやりとりがあったとはいえ、いきなり対面してまともに話が出来るかも怪しい。
雅	あわ、あわわわ……ど、どうしよう。考えたら急に緊張してきた
主人公	実際、先ほども教室に和登の姿を見つけたが、様々な思い出が蘇り、赤面して意味もなく身を隠してしまった。
主人公	遠目に見ただけでこれなのだ、実際に対面したらどうなってしまうのか分かったものではない。
雅	ど、どうしよう、本当にどうしよう……
主人公	結果、雅は一人で慌てる羽目になり、他の生徒達が下校を始め、一人であわあわしている雅を怪訝な顔で見ていくのも気がつかないでいた。
主人公	そうして時間は過ぎ、ようやく落ち着いてきた雅の耳にある声が入ってきた。
和登	にしてもおやっさん、どうしてわざわざ俺達を呼び出したんだろう？
静音	そうね、それも昨日あの場で用件言わずに、新しくできた甘味処に来てくれなんて
雅	！
主人公	それは待ち望んだ声だ。もちろん声だけなら電話等で聞くが、やはり実際に聞くと実感する。
主人公	すぐ近くに、ずっとずっと会うことを待ち望んだ人がいることを。
大樹	何か心当たりは無いんですか？
和登	ん～、おやっさんって基本的にこっちの予想を軽く飛び越えていくからなぁ
静音	そうね、おやじさん相手に予想や推測なんて無意味だわ
主人公	しかし、待ち望んだ瞬間だからこそ、それが唐突に現れた事による混乱は大きく、雅は再び近くに身を隠してしまった。
主人公	隠れずにその場で待っていれば、自分の存在に気がついた和登の方から声をかけてもらえたかもしれなかったのだ。これではその期待の芽を自ら摘んだようなものだ。
和登	ん？
主人公	そう思ってすぐに和登の前に飛び出そうとするが、こちらの視線に気がついたのか、和登が立ち止まり、周囲を見渡す。
主人公	結局その反応に驚き、再び身を隠してしまう。引っ込み思案は昔に克服したと思っていたが、どうやらそうでもなかったようだ。
主人公	今この瞬間に和登の前に飛び出す勇気が足りず、体がどうしても動かない。
主人公	そうこうしているうちに、和登達は先ほどの視線を気のせいかと結論づけて、再び歩き出してしまう。
主人公	もはや自分から声をかける以外に、和登に気づいてもらう術はなくなった。
主人公	ここまで来て一歩踏み出せない自分が情けなくなり、思わず和登の方へと視線を送ると、ゆっくりと遠ざかる和登の背中が見える。
主人公	その姿が、昔の思い出と重なった。
主人公	数年前、自分のせいで人生を大きく変えてしまい、故郷を離れざるを得なくなった彼。
主人公	その背中を、ただ見守ることしか出来なかった自分。
主人公	雅はぐっと自分の拳に力を入れると、息を思い切り吸い込み、隠れていた場所から飛び出すと、大声で彼の名前を呼びながら走り出した。
雅	待って！　かずくん！！
静音	え！？
大樹	は？
主人公	そしてそのまま、驚く和登達に追いつき、
和登	いったい、なに――ふぐぉあ！
主人公	勢い余って、そのまま和登の背中に抱きついてしまった。
？？？	待って！　かずくん！！
主人公	突然響いた大声に、俺が何事かと思った刹那。
和登	いったい、なに――ふぐぉあ！
主人公	背中から何者かにタックルされ、俺は衝撃に体をのけぞらせた。
雅	かずくん会いたかった！　会いたかったよかずくん！
和登	ぐおぉっ！？
主人公	突然の衝撃に驚く間もなく、そのまま強烈な力で締め上げられる。後ろからの声に耳を貸す余裕も無い。
静音	え？　ええ！？
大樹	ちょっ、何事ですか一体？
主人公	横の二人も突然の事態に驚くばかりで、なにが起こったのか把握できていないらしい。
雅	本当に、ずっとずっと会いたかったよ！
和登	ちょっ！　ま、まじやば……た、たす……
主人公	けれどその間にも俺の体を締め付ける力は強くなる。というか体内から、ミシミシと鳴ってはいけない音が聞こえてくる。
主人公	まずい……これ以上締め上げられたら、いくら俺でもただではすまない。
主人公	そう必死に苦しみと戦っていたところで、静音がびっくりしたように声を上げた。
静音	え、み、雅！？　なんで白夜島にいるの！？
和登	なっ、雅！？
主人公	苦しみつつも後ろに顔を向けると、確かに俺を後ろから締め上げているのは、よく知る幼なじみの姿だ。
大樹	え？　お知り合いですか……？
静音	あたしと和登の幼なじみよ。今はずっと遠く……あたし達の故郷にいるはずなんだけど……
主人公	そう今は俺と静音の故郷にいて、彼女とはある事情で、特に俺とは会うことが出来ないはずなのだが、一体どうしてここにいるのだろう。
雅	かずくーん！
和登	う、うごぉ……
主人公	一体どうしてと思うが、その思考を締め付けによる激痛がかき消す。ああ、まずいこのままだと意識が……。
静音	って、今はそれどころじゃない！
静音	ストップ！　ストップよ雅！　それ以上は和登がもたないから止まりなさい！
雅	え？
主人公	静音の言葉に俺を締め上げていた雅はようやく我に返ったのか、その手から力が抜ける。
雅	え？　わ、私……
主人公	周囲をきょろきょろ見渡してるのが、気配で分かる。
静音	正気に戻った？　あんたってば暴走すると周りが見えなくなる癖抜けてないのね
雅	あ……
主人公	見なくても分かる。多分今の雅は盛大に赤面してるだろう。子供の頃から興奮すると周りが見えなくなり、我に返って赤くなるって姿を何度も見てきた。
和登	し、死ぬかと、思った……
大樹	大丈夫ですか？
和登	な、なんとか……
主人公	俺は体に抱きつかれた状態のまま、どうにか後ろを見る。そこにいるのはやはり間違いない。俺のもう一人の幼なじみ、伊吹　雅だった。
和登	えーと？　雅？
雅	うん、その、久しぶり……だね
和登	お、おう、久しぶり。でも、なんで……
主人公	俺は先ほど抱きつかれた衝撃も忘れて思わず聞き返した。彼女とは直接会うのは数年ぶりだ。それは単純に俺や静音がこの島に引っ越してきたからというだけの理由ではない。
主人公	俺と雅の二人は、直接会うことをある理由によって“禁じられていた”からだ。
主人公	だからこそ俺も静音も、何故ここにいるのかと思わず聞いてしまったのだ。
主人公	俺の問いに、雅は若干名残惜しそうに俺から離れると、真剣な顔で口を開いた。
雅	え、えとね……そのね、昔した“約束”覚えてる？
和登	……静音
静音	あーはいはい、了解っと
主人公	それを聞いて俺は静音に目配せすると、静音はすぐに意図を理解してくれたのか、手を振りながら大樹の背中を押す。
大樹	え？　何ですか？
静音	和登は、ちょっとあの子と二人きりで話す事があるから、邪魔者のあたしたちは退散しましょ
大樹	え？　何ですかそれ、すっごく気になるんですけど。告白シーンなんて滅多に見れませんし
静音	大丈夫よ、あんたが思ってるほど甘酸っぱい展開にはならないから
大樹	はぁ……？
主人公	未だ納得していない感じの大樹の背を押しながら静音が離れていく。
和登	ありがとう
静音	いいわよ別に。雅もがんばりなさいよ。覚悟、決めたんでしょ？
雅	うん。ありがとう、しずちゃん
主人公	雅の言葉にひらひらと手を振りながら、静音は商店街の方へと大樹を押しながら消えていった。
主人公	そうして、ここにいるのは俺と雅の二人だけ。
主人公	目の前の少女の姿に、様々な感情が湧き上がっては消えていく。もう何年も前の思い出が、現実のように浮かび上がって消えていく。
主人公	そんな想いのすべてをしっかりと受け止めて、俺は小さく微笑んだ。
和登	もちろん、覚えてるよ
主人公	忘れられる筈がない。あの約束は、下手すれば今後の彼女の人生を大きく変えてしまうものだった。
主人公	だから……。
和登	雅がその制服を着てここに居る時点で、もう覚悟は決まってるんだろうけど……一応聞くよ
主人公	だから、今度は俺が聞き返す。
和登	本当に、いいのか？　あの約束を果たすって事はつまり……
雅	うん、わかってる。覚悟は出来てるよ
雅	かずくんと離れてた数年の間、ずっと考えてた。ずっとずっと考えて、それで、ちゃんと答えをだしたから
主人公	俺の言葉を遮りながら、雅はしっかり頷くとまっすぐにこっちを見た。
和登	そっか、決めちゃったか
雅	はい、決めちゃいました
主人公	微笑みながらの俺の言葉に、雅もやっぱり笑顔を返す。
和登	まったく、だったらもっと前から言ってくれればよかったのに。そうすればちゃんと歓迎会とか用意したんだぞ
雅	えへ、二人をびっくりさせようと思って
和登	いや、そりゃあびっくりしたよ。再会していきなり後ろから絞め殺されそうになったわけだからな
雅	あうぅ！　ご、ごめんなさい！　なんか久々にかずくんとしずちゃん見たら、その、なんだか我慢出来なくなっちゃって！
和登	はは、本当に変わってないな
和登	本当に……変わってない。安心したよ
雅	むぅ、私だってちゃんといろいろ成長してるんだよ！　昔のままじゃないんだよ！
主人公	そうやって頬をふくらませて拗ねる雅だが、そういう仕草はやっぱり子供の頃のままだ。体はしっかり成長してるのに、それでもどこか子供っぽい印象をうけてしまう。
和登	はは、わかってるって。だからそう拗ねるな
雅	むぅ、かずくんのいじわる。そっちだって昔と全然変わってないんだから
主人公	ぷいっと可愛く怒る雅に俺は小さく微笑むが、和んでばかりはいられない。
和登	それじゃあ雅、改めて聞かせてもらえるか。お前の言葉で
主人公	俺は軽く一息つくと、真剣に彼女を見ながらそう告げる。それに対して雅の方もすっと姿勢を正すと、こくりと頷いた。
和登	改めて聞く。雅は約束を果たすために来たんだな？
雅	はい。私のせいで、人間でも妖怪でもなくなってしまった、かずくんとの約束を果たす為に
和登	本当にいいんだな？　俺も精一杯がんばるけど、いつ“その時”が来るか分からないぞ？
雅	うん、もう決めました。その為の力もちゃんと身につけて、その覚悟もしっかり持って、それで、ここに来ました
主人公	雅の決意は固いらしい。だったら、俺から言うことはもう何もない。
和登	そっか……じゃあ、その時が来たら頼むな、雅
雅	はい。もしその時が来たら……
主人公	俺の言葉に雅はしっかり頷くと、まっすぐに俺を見たまま、はっきりとその先を口にした。
雅	私が、あなたを殺します
