主人公	全員で騒げば時間が過ぎるのはあっという間だ。気がつけば空は茜色に染まっていて、今日の所はこの辺で解散という流れになった。
和登	ふう、楽しかったな
静音	そうね、久しぶりに雅と会ったけど、やっぱりあの子、全然変わってなかったわね
和登	だな、昔のままだ
主人公	一条戻り橋を出て、それぞれが家路に向かう。兄貴と蓮華ちゃんは別方向なので店を出た所で別れた。
主人公	大樹は同じ方向だったので一緒に帰るつもりだったのだが、どうやらネトゲの方で約束があったらしく、慌てて先に帰ってしまった。
主人公	そのため、帰り道は俺と静音の二人で、のんびりと家に向かって歩いていた。
静音	あの子の決意、聞いたんでしょ？
主人公	そんな静かな帰り道の途中で、ぽつりと呟くように静音が聞いてきた。
和登	……ああ
主人公	俺はその言葉に小さくうなずく。それに対して、静音はそっかと呟いた。
静音	まあ、そうなるんじゃないかなって、予感はしてたんだ。あの子、あんたを変えちゃったこと、気にしてたし
和登	俺は気にしなくていいって言ったんだけどな。むしろ感謝してるって
静音	それで納得するような子じゃないのは、あんただってよく知ってるでしょ？　一度決めたら絶対折れないし曲がらない、そういう所は本当に鬼の娘よね
和登	違いないな
主人公	そういって互いに軽く笑い合った後、静音はやっぱり同じ調子で軽く聞いてくる。
静音	でも雅の方もそうだけど、あたしが立てた誓いも忘れてないでしょうね？
和登	そりゃもちろん
静音	そ、なら大丈夫ね。まあ、心配はしてなかったけど
主人公	俺が即答すると、どこか安心したように言葉を返してきた。
主人公	忘れる訳がない。なにせ、俺がこうやって日々を安心して過ごせるのは、あの時の誓いがあるからに他ならないのだから。
和登	あ、そうだ。ちょっとコンビニ寄っていいか？
静音	いいけど、何か買う物でもあるの？
主人公	少しだけしんみりした雰囲気を吹き飛ばすように、俺は静音にコンビニに寄りたいと提案する。
和登	おう！　今日から発売のシャリュトリュクリームパンを買っていかないといけないんだ
静音	あんた、さっきおやじさんの所でデザート食べたのに、まだクリームパンなんて食べるの？
和登	あ、いや、ぶっちゃけクリームパンはどうでもいいんだ
静音	はぁ？
主人公	俺の言葉に静音が盛大に首をかしげる。普通に考えてクリームパンを買ったにも関わらず、クリームパンに用は無いと言えば、そういう反応にもなるだろう。
和登	俺の真の目的はシャリュトリュクリームパンについてくる、ロゼブルウォーズのプロモーションカードだ！
静音	それって、確かあんたがはまってるカードゲームだっけ？
和登	そうそう、今日から期間限定でクリームパンにプロモカードが付属するから、絶対にゲットしないと
静音	あきれた。カードの為にパンを買うなんて
和登	いや、それは俺も思うけど、今手に入れとかないと、多分絶対手に入らないし……
主人公	うん、まあ俺自身、カードの為にパンを買うのはどうかと思うが、これもカードゲーマーの性だ。
主人公	というか、メーカー側も食品にプロモカードつけるのは勘弁していただきたい。コンプリートするまで朝食が毎日クリームパンだ。
静音	まあ、いいわ。コンビニ行くならさっさと行きましょ
和登	おう！
主人公	俺は呆れる静音を尻目に、ノリノリでコンビニに向かって歩き出した。
和登	よっしゃー、無事ゲット！
主人公	俺は無事にクリームパンを手に入れ、それを貢ぎ物よろしく空にかがげていた。三つほど。
静音	まさか、三つも買うとは思わなかったわ……
和登	いや、だって入ってるカードが何種かあって、それがランダムで入ってるから……コンプするためには数を買うしかないのです
静音	ちなみに、全何種類なのよ？
和登	十種類……
静音	は？　じゃあ、全部集めるために、最低十個は買わないといけないわけ？
和登	あ、いや、一つのデッキに入るのが三枚までで、それぞれ三枚ずつ集めたいから……単純計算で、最低三十個は買う計算に……
静音	あんたそれ、完全に売り手側に踊らされてるじゃない
和登	おっしゃる通りです
主人公	静音の言葉に頭を下げる。いや、俺だって分かってるんだよ。分かってるけどやめられないのがカードゲーマーの性というか、文句言いつつ買ってしまうというか。
静音	言っておくけど、いくらカードが目当てだからって、食べ物をないがしろにするのは許さないわよ
和登	当然、ちゃんと全部食べるよ。まあ、多分しばらくの間、朝食はクリームパン固定だけど……
主人公	だからメーカーさん、日持ちしない商品にプロモつけるのはマジで勘弁してください。
和登	まあ、というわけで、食べ物をないがしろにしない事にご協力ください
静音	え？　なに、くれるの？
主人公	俺はカードをはがしたクリームパンの一つを、再び貢ぎ物よろしく静音に差し出す。
和登	うん、さすがに明日の朝食べるにしても三つは多いので一つもらってくれ
静音	いや、別にくれるなら断らないけど、本当にいいの？
和登	むしろ、貰って下さいお願いします
主人公	別にクリームパンは嫌いじゃないが、今後、毎朝これを食べ続けるとなると話は別だ。少しでも減らしておくに越したことはない。
静音	ん、じゃあありがたく貰っておくわ。ありがと
和登	多分、今後もちょいちょいお願いすると思うからお願いします
静音	まあ、たまにだったらね
主人公	そう言って静音はうれしそうにパンを一つ受け取った。俺がその笑顔に少しだけ見とれていると。
猫	んにゃー
静音	猫！？
和登	うおっ！？
主人公	後方から聞こえた猫の鳴き声に、静音は勢いよく振り向いた。
静音	どこ？　どこから？
和登	ああ、あそこだ
主人公	周囲をきょろきょろ見回す静音の肩を叩き、近くの塀の上でこちらを見下ろしている猫を指さす。首輪をつけてないところを見ると、野良だろう。
静音	あ、本当だ～、かわいい～
主人公	静音は、先ほどの笑顔を吹き飛ばすほどの眩しい笑顔で、猫に手を伸ばす。
和登	相変わらず、猫が好きだなぁ
静音	違うわよ。猫が好きなんじゃないわ、猫“も”好きなのよ
和登	さいですか
主人公	こう見えて静音は猫等の小動物が大好きで、部屋にもそれ系統のぬいぐるみがあふれている。
猫	にゃ？
静音	猫ちゃんおいで～
主人公	そういって猫にしきりに声をかけるが、野良猫がそう簡単に人の声に応えるはずもなく、不思議そうに首をかしげるだけだ。
静音	ん～、何か餌になるものがないと駄目そうね。何かないかしら？
和登	クリームパンならあるけど？
静音	そんなもの、あげられるわけないでしょ
和登	ですよねー
主人公	それにしてもあの猫、降りてこないわりにここから離れようとしないな。こちらをじっと見下ろしているだけだが、何が目当てなんだろう。
主人公	そう思った瞬間。
猫	うにゃー！
静音	え！？
和登	はぁ！？
主人公	いきなり鳴いたかと思うと、俺に向かって飛びかかってきた。
主人公	突然の事に俺が反応出来ずにいると。
猫	んにゃ！
和登	げっ！？
静音	うそっ！？
主人公	俺の手に持っていたクリームパンの包みを咥えて、そのまま走り出した。
和登	はぁ！？　ちょ、ちょっと待て！！
主人公	俺は未だ何が起こったか分からない静音に、持っていた鞄と残りのクリームパンを押しつける。
静音	ちょっ、和登！？
和登	すまん！　荷物頼む！
主人公	そして、そのまま静音の抗議の声を無視して猫を追って走り出した。
和登	ぬおおおおお！　待ちやがれえええええ！　それにはまだカードが付いとるんじゃああああああ！
主人公	最悪クリームパンだけなら仕方ないと諦めもつくが、あのパンについているカードはまだ回収していない。それだけは確保しないわけにはいかない。
主人公	俺は後ろから聞こえてくる静音の声にも耳を貸さず、見失わないように全力疾走で猫を追いかけた。
