和登	逃がすかぁ！
猫	ふにゃあああ！
主人公	静音をおいたまま、猫と俺の追いかけっこはその後しばらく続いた。正直運動はあまり得意な方ではないが、体力だけには自信がある。
主人公	文字通り地の果てまで追いかけてカードを回収してやる！
和登	ぐっ、いい加減あきらめろよぉ！
猫	ふしゅー！
主人公	絶対に回収してやると思っていたのだが、猫の方も猫の方で存外根性のあるやつだったのか、盗んだパンを諦めずにダッシュを続ける。
主人公	さすがにいくら体力があろうとも、俺の体は猫のように狭いところや高い所を通る事は出来ない。
和登	ぜぇ、はぁ……ぜぇ、はぁ……
主人公	その結果、この自然公園に入るのを目撃したのを最後に完璧に見失ってしまった。
和登	ぐっ、俺のプロモカード……
主人公	ガックリとその場に膝をついて絶望する俺。こんな事なら買った時点でカードは全部剥がしておくんだった。
猫	にゃぁ
和登	ん？
主人公	そんな俺の耳に、再び猫の声が聞こえ俺は顔を上げた。これはもしかして俺の事を撒いたと油断して近くに居るのかと、立ち上がって耳を澄ませる。
猫	うにゃん
主人公	俺は声に出さずに胸中で叫ぶと、草の影を伝って、ゆっくりと声のする方へと歩いていった。
和登	えーと……多分この辺だと思うんだけど
主人公	俺は気配を消しながら、草の影からゆっくりと顔を出す。
和登	？
主人公	しかし、草むらの影から顔を出して見えたものは、俺が予想していたものとは大分違った。
狐耳の少女	そうか、子育ても大変なんだなぁ
猫	んな～
狐耳の少女	くすっ、にゃ～
猫	にゃう～
主人公	そこで俺が目にしたのは、数匹の猫に囲まれ楽しそうに微笑む、妖狐の少女だった。
猫	にゃ～ん
美琴	ふふっ、だが楽しそうで何よりだ
主人公	猫の鳴き声に答えて話しかけている姿を見ると、どうやら彼女は動物の言葉が分かるのだろう。動物系の妖怪にはよくあることなので特に驚きはしない。
主人公	俺は彼女を見て、もしかしたら俺のクリームパンを取った猫の事を知っているかと思ったが。
主人公	楽しそうにしている彼女と猫の間に入るのはなんだか躊躇われた。ここは黙って離れるのが正解だろう。
主人公	そもそも、こっそり覗いてるのが見つかったら、気まずいしな。
主人公	などと胸中でかっこつけつつ、ゆっくりその場を離れようとしたところで、彼女の所に新たな猫が駆け寄る。
狐耳の少女	おや？
和登	ん？
主人公	見ると、その猫は何かを咥えていて、それを彼女に差しだそうとしていた。
狐耳の少女	君は確かここの新入り君か？
猫	ふにゃー
狐耳の少女	ん？　わたしにくれるのか？　これは、クリームパン？
和登	！
主人公	よく見るまでもない。あのクリームパンは先ほど俺が奪われたもので、それを咥えているのは当然俺からクリームパンを奪取した猫だ。
狐耳の少女	気持ちは嬉しいが、一体こんなものをどこで……？
猫	んな～
狐耳の少女	ふむふむ、親切な人に貰った？
和登	嘘つけええええええ！
狐耳の少女	！？
主人公	いけしゃあしゃあと貰ったとのたまった泥棒猫に、俺は思わず草むらを飛び出してしまっていた。
狐耳の少女	な、なんだ君は！？
和登	はっ！
主人公	思わず飛び出してしまったが、これじゃまんま俺は不審者だ。いくら猫を捕まえるためとは言え何か弁明しなければ。
和登	あ、いやちょっと待ってくれ！　俺は決して怪しいものじゃない！
狐耳の少女	いや、この状況でその台詞を聞いて、はいそうですかと納得できる者はそうそういないと思うのだが……
和登	いや、まあ……うん、俺もそう思う……
主人公	客観的に見て、どう考えても俺は草むらに隠れて彼女を覗いてた不審者で、事情を知らない彼女がそう思うのも仕方ない。
主人公	というか、先ほど彼女と共にのんびりとしていた猫たちが、一斉に俺に向かって威嚇を始めたので、ぶっちゃけ凄く怖いです。
猫達	ふしゃあああああ！
主人公	たかが猫と侮るなかれ。敵意と牙を全開でむき出しにしてしゃーしゃーいってる猫の集団というのは、思いの他迫力がある。
主人公	てゆうか、パン泥棒、なにしれっと威嚇側に回ってやがる。この状況全部おめぇのせいだから！　自分は被害者ですみたいな面してんじゃねぇ！
主人公	さて、どうやってこの状況を切り抜けようか。
和登	いや、話すと長くなるのだが……
狐耳の少女	できればわかりやすく三行で頼む
和登	クリームパン買った
和登	その猫に取られた
和登	追いかけたらここに着いた
狐耳の少女	把握した。確認してみる
和登	予想以上に話の通じる人で良かったぁ！
主人公	彼女の要望に従って出来るだけ簡素に状況をまとめると、彼女は一つ頷いた後に、真剣な顔で件の猫に向き直り、
狐耳の少女	うにゃ？　にゃにゃ？
和登	あ、会話する時って、本当ににゃーにゃー言うんだ……
主人公	真剣な表情のまま、にゃーにゃー言い出した。
主人公	端から見るとふざけているようにも見えるが、彼女が真剣な顔をしているのと、話しかけた瞬間から泥棒猫の挙動が不審になった事をみると、ちゃんと通じているのだろう。
主人公	シュールな事には違いないが……。
狐耳の少女	んにゃ？　にゃー！
猫	ふにゃ～ん……
主人公	何というか、狐耳の少女が猫語で猫と会話している姿は非常にシュールだ。そもそも狐って確か哺乳網ネコ目イヌ科の動物だから、どちらかというと犬に近い動物なんだよな。
主人公	まあ、彼女は狐ではなく妖狐であり、性質は人間に近いのだから元々の動物とは色々違うのだけれども。とはいえ、それでもやっぱり変な感じだ。
狐耳の少女	……確認した
和登	どうだった？
狐耳の少女	どうやら、わたしにプレゼントして喜ばせようと思って、つい盗んでしまったらしい。
猫	にゃ～……
主人公	どうやら彼女に説教されたようで、会話が終わってから泥棒猫はしょんぼりしている。
狐耳の少女	すまない、わたしの方からちゃんと言い聞かせたので、許してやってほしい。もちろんパンは弁償させてもらう
和登	いや、君にそこまでして貰わなくて大丈夫だよ。ちゃんと返して貰えればそれでいいし
主人公	実際俺の目的はパン本体よりも、付属しているカードなので、それさえ回収できれば文句は無い。
主人公	俺の言葉に彼女はほっとしたように微笑む。
美琴	そういって貰えると、ありがたい
猫	にゃー……
和登	ん？
主人公	俺が彼女の笑顔に半ば見とれていると、横から先ほどのネコが彼女に隠れるようにしながら、申し訳なさそうに俺を見上げている。
和登	なんて？
狐耳の少女	え～と……ぷっ
和登	？
主人公	猫の言葉を確認した彼女が吹き出すように笑う。俺が疑問符を浮かべて首をかしげると。
狐耳の少女	いや、すまない。彼女は“出来心だったんです、許してください”と、言っているよ
和登	ぶほっ！
主人公	彼女の翻訳を聞いて、俺も思わず吹き出してしまう。何しろその台詞は、初めての万引きで掴まった中学生の様だったからだ。
和登	はははは！　人間も猫も、悪い事したときの言い訳ってのは一緒なんだな
狐耳の少女	くすっ、まったくだな
猫	？
主人公	俺と狐耳の少女は二人でしばらくの間、笑い合う。そんな姿を猫たちはきょとんとした顔で見上げていた。
主人公	彼女としばらく笑い合った俺は、彼女にパンを返して貰った。幸い中のカードは無事で、俺はほっと一安心する。
和登	えーと、とりあえず自己紹介がまだだったから名乗っておくよ。俺は赤城　和登。君は？
美琴	聖　美琴だ。よろしく頼む
和登	美琴ちゃんか
美琴	美琴……ちゃん？
主人公	俺の言葉に美琴は首をかしげる。小柄な容姿から年下で、蓮華ちゃんと同じぐらいの歳だと当たりをつけていたのだが、もしかしたら違っていたのかと焦る。
和登	あ、ごめん。知り合いの妹にいつもちゃん付けで呼んでるからつい……
美琴	いや、異性にそう呼ばれた経験が無いのでな、ちょっと驚いただけだ。別にかまわないよ
美琴	それより君は、制服を見る限り白峰学園の学生ではないかな？
和登	ん？　ああ、今年から入学した新入生って事になるかな
美琴	ふふ、なるほど
主人公	俺の説明に何かを納得した様に小さく笑う美琴ちゃんに、俺は疑問符を浮かべる。
主人公	そういえば、さっきから感じていたんだけれど、最近この子に会ったことあるような気がするんだよな、どこだっけ。
美琴	さて、君はもしかして、入学式中に居眠りをしていたんじゃないかな？
和登	え！？
主人公	俺が美琴ちゃんの事を思い出そうと頭を捻っていると、突然美琴ちゃんは入学式中の俺のミスを言い当ててみせた。
和登	え？　ちょっと待って、なんでそのこと……？
美琴	その答えは簡単だよ。あの場にわたしもいたからだ
和登	うわっ、もしかして君も白峰学園の……？
主人公	俺の言葉に、いたずらっぽい笑顔で美琴ちゃんはこくりと頷いた。
主人公	うおぉ、ぬかったぁ。完全に年下だと思ってた。いや、年下にしては妙に貫禄あるなとは思ってたけど。まさか同級生だとは思わなかった。
和登	ご、ごめん。てっきり年下だと……
美琴	やっぱりか。よく間違えられるので、もしやと思ったのだがな
和登	申し訳ありません
美琴	いや、気にしなくていい。年下に見られがちな事は自覚してるし、もう慣れっこだからな
和登	いや、それにしたって、同級生に年下扱いされたら嫌だっただろうし……本当にごめん
美琴	だから気にしなくて――ん？
和登	え？
主人公	自分の失態に頭を下げていると、美琴ちゃんは何かに引っかかったように言葉を止める。
和登	ごめん、またなんかやらかした？
美琴	あ、いや別に何でもないよ
主人公	俺の言葉に彼女は楽しそうに笑顔を見せてくる。
美琴	なるほど……そう来たか
和登	？
主人公	笑顔の後に、何かを呟いたような気がしたが、この辺りは若干風が強く、聞き取る事が出来なかった。
和登	あ、でもそれだと美琴ちゃんって呼び方も失礼だよな
美琴	ん？　別にわたしはかまわないぞ？　新鮮なのは間違いないしな
和登	えーと、むしろ俺が同級生をちゃん付けで呼ぶのが恥ずかしいです
美琴	くすっ、なら好きなように呼ぶといい。わたしは特にこだわりはないしな
和登	ん～……そう言われるとぱっと思いつかないなぁ
主人公	まだ知り合ってそう経っていないので、あだ名呼びというのも変だし、ここに来て名字で呼ぶのも他人行儀だろう。
和登	ん～、それじゃあ、普通に美琴で
美琴	なんだ。何か面白いあだ名でも付けてくれるかと思ったんだが、案外普通だな
和登	それは、いきなりハードルが高くないっすかね！？
美琴	ふふっ、まあ君がそれで呼びやすいなら、それでいいさ
和登	それじゃあ、美琴。これからよろしく
美琴	ああ、よろしく頼む。和登くん
主人公	そういって笑う姿はやっぱりどこか大人びていて、どきりとする。ここで出会ったのは完全に偶然だったが、その偶然に感謝すべきだろう。
和登	そういや、美琴はいつもここで？
美琴	ん？　ああ、散歩がてらここの猫たちと話していたら、いつの間にかなつかれてしまってな。たまに世間話に付き合って貰っている
和登	へぇ、動物と話せるって便利だなぁ
美琴	人間や妖怪と違って、気楽に話せるからな。愚痴を聞いて貰ったり重宝している
美琴	まあ、人通りが多い時にやると奇異の視線を貰う事があるので、もっぱらこの時間のこの場所だ
主人公	ああ、確かに妖怪の中には動物と話せる者がいるという知識が無ければ、猫に話しかける変わった人に見えてしまうかもしれない。
主人公	だからこの自然公園の中でも端っこにあるこの場所で、世間話というわけか。
和登	ちなみに今日はどんな話を？
美琴	ああ、前々から仲の良かった猫が出産してな。子育ての相談に乗っていた所だ
和登	ず、ずいぶんと所帯じみた話題というか、なんというか……
主人公	別にもっとメルヘンチックな話題を期待していたわけではないが、美琴の話を聞く限り、近所のおばちゃんと同レベルの会話だ。
美琴	ふふ、人間も妖怪も猫も、恋をして家族となり、子をなすというプロセスに何ら変わりはないよ。猫同士のコミュニティーだってちゃんとあるしな
和登	ああ、確かに縄張りとか作るもんなぁ
美琴	まあ、妖怪と人間が共存する今の社会に比べたら幾分単純ではあるがな。単純故に無用なトラブルも起きにくい
和登	う～ん、そんな事考えたこともなかったけど、なんかそう考えると面白いな
主人公	今まで自分が考えもしなかったことに触れて、純粋に感心する。
主人公	けど何でだろう、今の美琴の言葉に、どこか彼らをうらやましがるようなニュアンスが混じっていたような気がする。
和登	っと、電話だ。ちょっとごめん
主人公	そのことを深く考えるより前にポケットの中の電話が鳴る。ディスプレイを見ると、そこには静音の名前が表示されていた。
和登	うおっ、しまった！　静音にいろいろ預けてたの忘れてた！
主人公	俺が慌てて通話ボタンを押して電話に出ると、いきなり不機嫌全開の声が聞こえてくる。
静音	和登～あんた、あたしに荷物押しつけてどこまで行ったのよ……
和登	悪い！　猫を追いかけて自然公園の方まで来ちゃってさ……
静音	はぁ？　あんたどこまで全力で追いかけてんのよ
和登	いや、俺も今全力で反省してます……
静音	とりあえず、あんたの鞄はあんたの家に放りこんでおいたからね
和登	重ね重ねすまん。今度何かお礼するよ
静音	もう、いきなり走っていってびっくりしたんだから。せめてメールぐらいしてよね。ちょっと心配しちゃったじゃない
主人公	その言葉に、確かに少し早計だったかと反省する。
静音	まあ、なにもないならいいわ。それじゃあ、また明日学園でね
和登	おう、色々サンキューな
主人公	何とか納得してくれたのか、最後はいつも通りの口調に戻っていた静音にほっとしつつ、俺も携帯を耳から話す。
主人公	大分暗くなってきたし、帰る頃合いとしては丁度いいだろう。
和登	それじゃ、美琴。俺はそろそろ帰るわ
美琴	そうか。悪いな、引き留めてしまって
和登	いや、全然。こっちも楽しかったし
美琴	そう言ってもらえると、こちらも嬉しいな
和登	それじゃ、また学園で
美琴	ああ、学園内であったら、よろしく頼む
主人公	互いに手を振り合いながら俺はその場を後にした。
主人公	後になって思えば、この時ちゃんと美琴のクラスを確認しておけば良かったんだが、その時の俺は急いで帰ろうとするあまり、そのことをすっかり忘れていた。
