主人公	それぞれ体操服から着替えた俺達は、昼食を取るために屋上まで来ていた。
和登	やっぱ昼は屋上だな！
静音	まあ、食堂と購買が使い物にならないって事は、この一週間で痛いほど思い知らされたものね
雅	ですね……まさか、あそこまで食堂が混んでるなんて……
主人公	そう、この学園は知っての通り、この都市一のマンモス校だ。当然ながら生徒の数も凄まじく、教師や事務の人まで合わせるととんでもない数になる。
主人公	その上、付属校の生徒も基本的には食堂エリアには出入り自由なので、付属校の生徒達も利用する。その結果どうなるかは火を見るより明らかだ。
大樹	食堂の規模も相当なものなんですけどね。利用者の数が桁違いでした
和登	ああ、俺達は完全にこの学園の生徒数を舐めてた
主人公	実際、この学園の食堂は有名店などが入っていて、小規模のフードコートのような作りになっている。
主人公	席数もかなりのものなのだが、昼時になるとあっという間に埋まってしまう上、それぞれが友達同士で固まって動かないため、中々席に空きが出来ない。
主人公	更に言うなら、混雑を理解している上級生は、あらかじめ席取り係を決めていたりしており、俺達新入生はそんな高度な席確保争いに勝つことが難しい。
雅	購買も購買で、ものすごく混んでて、目が回っちゃいます
静音	あれはもはや戦場よ。戦う覚悟がなければ生き残れないわ
主人公	食堂同様、この学園の購買部も中々のもので、弁当やパン等を数多く仕入れていて、ちょっとしたコンビニ以上の品揃を誇っている。
主人公	だが、いかんせんこちらも、圧倒的な数の暴力の前には無力であり、特に人気の高い商品はチャイムが鳴り終わってから三分もてばいい方だ。
大樹	ちょっと時間をずらして行ったら、売れ残り全開な微妙な商品しか残ってませんでしたからね
和登	あの日食べたコッペパンは、涙の味がしたぜ……
静音	いくら安いって言っても売れないの分かってるんだから、塩むすびなんて置かないでほしいわ
雅	売り切れならまだ諦めがつくけど、なまじ残っちゃってるからね……
大樹	いやぁ、あの日は近年まれに見るわびしい昼食風景でしたね。現代の学生とは思えないほどに
和登	あの日からだな。俺達の中で弁当持参が決定したのって
主人公	俺の言葉に全員がしっかりとうなずく。あんな思いを二度としない為に、各自しばらくの間は昼食を持参しようと誓いあったのだ。
主人公	ちなみに、前述の理由もあってか昼食を持参する生徒は少なくなく、大抵は教室か正門前の広場で昼食を取っている。この屋上もそんなお弁当持参組の憩いの地の一つだ。
和登	さってと、適当に空いてる場所はないかな？
雅	あ、かずくん、かずくん。あそこなんてどうかな？
静音	お、中々よさげな所ね
主人公	雅が指さした方を見ると、確かに日当たりのよさそうな場所が丁度良く空いていた。
和登	だな、あそこにしよう
大樹	異議なしです
主人公	雅の意見に頷き、俺達は春の陽気が気持ちよい、日当たりのいい場所に陣取って弁当箱を広げる。
和登	うしっ、準備完了！
飛鳥	あれ～？　和登くんじゃん！
和登	ん？
静音	あ、飛鳥先輩だ
主人公	最近すっかり聞き慣れてしまった声に振り返ると、静音の言った通り、飛鳥先輩が片手に購買の紙袋を持ってこちらに手を振ってきていた。
飛鳥	もしかして今からご飯？　ならあたしも一緒していいかな？
雅	はい、全然かまいませんよ
和登	もちろん。むしろ歓迎しますよ
飛鳥	本当？　やったー！
主人公	飛鳥先輩は、俺の言葉に幸運な偶然に巡り会えたと軽くガッツポーズすると、俺達の横に腰を下ろした。
飛鳥	いや～、いつもお昼食べてる子が生徒会の仕事とかでドタキャンでさ。どうしようか悩んでたんだよね～
大樹	なるほど、それで一人だったんですか
飛鳥	そうそう。いつもは生徒会室にお邪魔させて貰って、お茶しながらお昼ご飯食べてたからさ。急に使えなくなった時のプランを考えてなかったんだよね～
飛鳥	それで、とりあえず屋上にでも行って、他の友達探そうかな～、なんて思ってたら和登くんたちが見えてさ
雅	へー、そうだったんですか。生徒会に友達がいるなんて凄いですね
飛鳥	まあ、付属校時代からの親友だからね。結構昔から助けられちゃってます
主人公	軽く舌を出して笑う飛鳥先輩の顔から、その人との友情が感じられて、俺も思わず頬が緩む。やっぱりそういう友達がいると、学園生活もぐっと楽しくなるよな。
和登	それじゃあ、飛鳥先輩も加えて、改めて！
和登	いただきます！
主人公	俺はタイミングを見計らって手を合わせると、そのままいただきますと定番の挨拶をする。
主人公	それに続いて他のみんなも口々にそれを繰り返し、そのまま昼食タイムが始まった。
静音	うわ、飛鳥先輩のパンって購買部のスペシャルカレーパンですよね！？　人気ベスト１０に入ってるのに、よく買えましたね
飛鳥	ふふん、これでも素早さには自信があるんだよ？　だから授業終わったと同時にダッシュすれば、これくらい余裕余裕
雅	すごいです。私なんてあの人ごみ見ただけで、食欲がなくなっちゃいました
飛鳥	まあ、最初はびびるよね、やっぱり。あたしも初めて見た時そうだったもん。でもね、実は購買も食堂もちょっとしたコツがあるんだよ
飛鳥	それさえ分かれば、意外といけるよ
和登	あ、それは是非聞きたいです
大樹	ええ、せっかく食堂がありますしね。是非一度行ってみたいので、伝授をお願いします
主人公	なにやらためになりそうな話に、俺達がずいっと身を乗り出すと、飛鳥先輩は得意げに笑うと指を立てる。
飛鳥	おっけー、別にいいよ。けど、タダってわけにはいかないな～
和登	なるほど、ならば交渉材料に……雅！
雅	うん、分かってるよ、かずくん！　情報の為なら私、卵焼きだって差し出す覚悟だよ！
飛鳥	いい覚悟ね！　ならその覚悟が本物かどうか！　実際に食べて確かめるよ！
雅	はい、お口に合うかわかりませんが……どうぞ！
主人公	すすっと飛鳥先輩の前に自分の弁当箱を差し出す雅。その弁当箱にはまだほとんど手が付けられておらず、非常に綺麗なおかずの数々が敷き詰められている。
主人公	ちなみに、俺達のメンバーの中で手作りの弁当を持ってきたのは、雅と大樹の二人だけだ。
主人公	雅は自己紹介の時の発言通り料理を趣味にしている他、自分の家が甘味処で仕込み等で朝が早い事もあり、学園に来る前にしっかりと弁当を作ってくる。
主人公	大樹の方はといえば、本人は全く料理は出来ないが、母親が事情を聞いて作ってくれたという事だ。
飛鳥	うわっ、なにこれ……この卵焼きおいしい……
和登	ふふふ、この卵焼き、おいしいと言わずにはいられまい！
雅	照れます……
静音	いや、なんで和登がドヤ顔なのよ？
和登	いや、何となく？
大樹	何故疑問系……？
雅	だって、かずくんの為にがんばって料理勉強したから、かずくんのおかげだよ？　だからかずくんが胸を張って私の料理を自慢しても大丈夫！
主人公	そういって満面の笑顔を向けてくる雅だが、ストレートな言葉にこちらは赤面を禁じ得ない。
飛鳥	うわっ、甘い！　甘いな～！　くっ、味覚だけじゃなくて視覚でも甘さを伝えてくるなんて……あたしの完敗だぁ……
和登	あ、あれ？　なんでだろう？　俺ってば勝ったはずなのに色々とダメージ受けてない？
静音	雅をダシにするのがいけないのよ
雅	？
主人公	本人は無自覚なのか、可愛らしく小首をかしげているあたり始末に負えない。
和登	と、とりあえず対価は払いましたし、教えて下さい！　購買と食堂を利用する時のコツって奴を
大樹	また、わかりやすく話題をそらしましたね。いや、別にいいですけど
飛鳥	おっけー！　こんだけおいしい卵焼きもらったんだもの、先輩とっておきを教えちゃうよ～
主人公	こほんと一つ咳払いをしたあと、飛鳥先輩は俺達に色々と教えてくれた。特に食堂関係の裏技については思わず唸ってしまうようなものが多かった。
主人公	そんな会話の終わり、飛鳥先輩は何かを思いだしたように、俺達に尋ねてきた。
飛鳥	そういやみんなは、おっきい化け猫が出たって話は聞いてる？
雅	あ、はい。それなら少しだけ小耳に挟みました
静音	それでこの前餌やりを見学した猫達が心配だねって話をしてて、放課後に見に行こうって事になったんですよ
主人公	どうやら、あの噂は飛鳥先輩の耳にも届いていたようで、俺達と同じように猫達を心配していたみたいだ。
飛鳥	やっぱり、みんなも気になるよね。あたしも今日の放課後に様子を見に行く予定だったんだ
和登	あ、それじゃあ、一緒に来てもらえますか？　多分猫達も餌をもらったことある人が来た方が警戒しないでくれるだろうし
飛鳥	うん、もちろんＯＫだよ
主人公	飛鳥先輩の言葉を聞いての思いつきの提案だったが、飛鳥先輩はあっさりとＯＫしてくれた。これは思わぬ所で心強い味方が増えた。
雅	よかったです。様子を見に行くと言ってみたものの、猫ちゃんたちが普段からどの辺にいるのか聞いてなかったので
静音	そうね、猫達を探して学園の周りをぐるぐる回るのは効率悪いものね
大樹	確かに、餌かなにかを持っていれば良かったんですけど、急だったんでそういった用意もありませんしね
飛鳥	まあ、あたしもそこまでばっちり居場所を知ってるわけじゃないけど。友達に色々聞いてるから簡単な案内ぐらいはできると思うよ
和登	十分です。それじゃあ、放課後に正門前で待ってますから、そこで合流しましょう
飛鳥	オッケー！
主人公	飛鳥先輩との約束も取り付け、俺達は予定通り放課後に猫達の様子を見に行く事にした。
主人公	それにしても巨大な化け猫なんて、一体どこから入り込んだんだろう。
