和登	それではこれより！　化け猫説得作戦を開始する！　各員番号！
雅	いち！
静音	に～
飛鳥	さーん♪
美琴	よん
五郎	ごお！！
安綱	ろくじゃ
大樹	なな…………このくだり必要ですか？
和登	いや、ごめん。何となく一度やってみたくて
主人公	というか、打ち合わせ無しで乗ってくれた皆さん。ありがとうございます。
主人公	さて、俺が人生最大級の過ちによって土下座を慣行した翌日の放課後。俺達は化け猫説得作戦（仮称）を決行するために、集合していた。
和登	あ、そういえば美琴さん。生徒会の方は大丈夫ですか？
美琴	ああ、そっちの方は話してある。事後処理も含めて細かいところは任せてくれ
和登	はい、ありがとうございます
主人公	やはり生徒会長のお墨付きは頼もしい。名目上は外部協力者扱いの俺たちに対しても色々と便宜を図ってくれる。
美琴	ところで和登くん
和登	はい？
美琴	もう、呼び捨てでは呼んでくれないのかな？
和登	ぶほっ！
主人公	美琴さんの言葉に思わず吹き出す。完全に不意打ちすぎてまともに対応出来なかった。
飛鳥	そうそう、昨日言った通りあたしの事だって、飛鳥って呼んでくれていいんだよ？
和登	いや、もう、美琴さんも飛鳥さんもマジで勘弁して下さい
主人公	いたずらっぽく笑いながら、飛鳥さんが肩に手を置いてくる。
主人公	ちなみに美琴さんはともかく、なんで飛鳥さんまで呼び方が変わっているかというと、昨日の放課後、飛鳥さんに強制連行に近い形で美琴さんと一緒に連れ出され、
主人公	それまでの経緯を説明した際に、
飛鳥	今更先輩呼びもなんだし、いっそのこと呼び捨てでいいんじゃん。あたしはもちろん、みこっちゃんも多分気にしないよ？
美琴	ああ。廊下でも言ったが、別にわたしは気にしないから今まで通りの話し方でいいんだぞ？
主人公	なんて言われた結果だ。
主人公	流石に、年上相手に呼び捨てはまずいですと本気で頼み込み、なんとか折衷案として、先輩呼びでなく、さん付けで二人を呼ぶことで落ち着いたわけだ。
五郎	いや、話聞いた時は爆笑しちまったぜ。その場にオレもいたかったぜ
大樹	まったくですね。そうそう見れるものじゃないですからね
安綱	本当にぬしは我を退屈させんのう
和登	くぅ、人ごとだと思って……
静音	完全に自業自得でしょうが。まったく、入学式中に居眠りなんて不真面目なことしてるから、そういう目に遭うのよ
和登	おっしゃるとおり……
五郎	それにしたって、お前。会長を一年生と間違えるってのはないわー
和登	ぐぬぬ……！
主人公	何か言い返したいところだが、自分でもそんな馬鹿なと思う事なだけに、言い返せないのが辛い。
大樹	そういえば、兄貴さんは会長さんと知り合いだったんですね
五郎	まあ、飛鳥繋がりでな。わりと色々と世話になってるから、オレも会長には頭が上がらないんだが
五郎	カズの奴は今後もっと頭が上がらないだろうな
和登	ぐぬぬぬぬ！
主人公	にやりと笑う兄貴だが、実際その通りなのでまったく言い返せない。ちっくしょう、なんたる屈辱。
雅	ま、まあまあ、これ以上はかずくんが可哀想そうだよ
和登	ああ！　雅が女神に見える！
雅	え？　そうかな？　えへへ
飛鳥	うわ、ちょろい！　みやびん、ちょろいよ！　これで大丈夫なのしずっち！？
静音	あ～……わりといつも通りなんで、気にしなくていいですよ
美琴	ん、なんというか色々苦労してそうだな、静音くん
静音	わかります？　この学園に入ってからツッコミ率が三倍に跳ね上がったんですよ
主人公	俺の言葉に顔を赤くして笑う雅に、静音が額に指を当てながら、ため息混じりに話す。
主人公	昨日俺が飛鳥さんに強制連行された現場には静音と雅もいたのだが、話し合いの後は一条戻り橋でみんなでお茶したこともあり、女子組はかなり仲が良くなっている。
主人公	いつの間にか呼び方まで変わっているが、二人とも特にそれを嫌がってはいないようだ。
安綱	静音のツッコミがないと、場がしまらんからな。これも仕事だと思ってがんばるんじゃな
静音	そんな仕事お断りよ！
主人公	ちなみに、今回は天城の巫女としてこの場に来ている静音は制服ではなく巫女服姿で、今回の作戦の要である安綱も同伴している。
主人公	俺達も一度家に戻り、それぞれ私服に着替えてきている。学園側の代表である美琴さんだけが制服姿だ。
大樹	いやあ、静音さんがいると僕が突っ込まなくていいので、楽できます
五郎	それじゃあ、オレがさらに引っかき回すか
五郎	場を引っかき回す事に関して、オレの右にでる奴はいねぇからな
静音	やめて下さい、収集がつかなくなります。というか、あたしのツッコミが許容量越えたらどうなるか分かりませんよ？　今日は仕事モードで来てるんですから
五郎	お、おう……
主人公	きらりと眼光を光らせつつ、そう話す静音に、さすがの兄貴もたじろぐ。なんというか、仕事モードの時の静音は普通に怖い。
安綱	けけけ～、今宵の我はコーラを求めておる！
飛鳥	あれ？　それって単にのどが渇いてるだけじゃ？
大樹	というか、まだ今宵って時間でもないですよね
安綱	まあ、細かい事は気にするな
雅	細かいかなぁ？
安綱	というわけで、我が錆びになりたくなければ今すぐコーラを買ってくるのじゃ！　十秒以内でじゃぞ
五郎	ひでぇ！？
和登	なんだかんだで安綱が一番フリーダムだよなぁ
美琴	まあ、それについては同感だ
美琴	それより、そろそろ話を進めた方が良さそうだな
和登	あ、そうでした
主人公	いつまでもここで馬鹿騒ぎをしていたら日が暮れてしまう。俺は手を挙げると、全員の注目を集めてから全員に呼びかけた。
和登	それじゃあ、今回の作戦を説明するから、全員注目
雅	はーい
五郎	おうよ、カズ。今日はどんな血湧き肉躍る戦いが待ってるんだ？
静音	いや、戦っちゃだめですから。あたしたちは説得に行くんです
飛鳥	拳で語り合うだね！
安綱	むしろ、拳で分からせるんじゃな！
静音	ちっがーう！
大樹	これで大丈夫でしょうか？
美琴	まあ、多少不安がないでもないが、なんとかなるだろう。なんだかんだで優秀な者が多いしな
主人公	相変わらず賑やかながらも、俺の方へ注目したメンバーに今日の作戦の説明を始める。
和登	まあ、といっても大した作戦じゃないんだけどね。安綱の力を使って化け猫を見つけ出して、美琴さんの力で事情を聞く。その後はその場の流れ次第かな
大樹	わりと行き当たりばったりの作戦ですね
和登	発案から決行までに日がなかったしなぁ。アラが目立つのは多めに見て欲しいかな
静音	まあ、何か不測の事態が起こってもあたしと雅がいれば、大抵の事はどうにかなるしね
雅	うん、かずくんの為にも私がんばるよ
美琴	わたしも妖術には多少覚えがあるしな。余程の事がなければ大丈夫だろう
主人公	実際それを期待しての人選でもある。正直静音と雅の二人だけでも、妖怪の群れが出てきたとしても負ける気はしない。わりとマジで。
五郎	にしても、ここにいる全員で行くのか？　説得が目的なら、ちょいと大げさじゃねぇか？
飛鳥	そういえばそうだね、全員で行くと相手も警戒しちゃうんじゃない？　ごろーちゃん顔怖いし
五郎	ふっ、それほどでもねぇよ
安綱	相変わらず、こやつの琴線はようわからんのう……
主人公	何故かドヤ顔の兄貴に苦笑する。まあ、実際この人数で行けばいらない威圧感を与えてしまうかもしれないが、その点に関してはちゃんと考えてある。
和登	実は兄貴と大樹には別の仕事を用意してるんだよ
五郎	別の仕事？
大樹	ああ、昨日話してた奴ですね
和登	そうそう、昨日の夜から進展はあったか？
大樹	ええ、問題ありません。データもちゃんと保存して、僕のパソコンの中に保存してあります
和登	さすが！
五郎	おいおい、なんの話だ？　オレにも分かるように話してくれよ
主人公	昨日のうちから大樹には話してあったので俺達二人は理解しているものの、まったく知らない兄貴達は疑問符を浮かべていた。
和登	ああ、ごめんごめん
和登	兄貴と大樹には、今回の事件の渦中の人物に話を聞いてきて欲しいんだ
飛鳥	渦中の人物って、例の最初に化け猫を目撃した生徒？
和登	そう！
静音	今回の化け猫事件のきっかけね
安綱	しかし、そんな奴に話を聞いてどうするんじゃ？
和登	猫の証言だけじゃ色々言われそうだからね。せめてその生徒が襲われていないって言質が欲しいんだよ
美琴	ほう……だが、それは難しいぞ？　生徒会でももちろん同じ事を考えて事情を聞きに行ったが、のらりくらりと逃げられてしまった
飛鳥	そもそも、素直に事情を話すような子だったら、ここまで話が大きくなってないよね
和登	まあ、そうなんだよね
主人公	そう、もとはと言えばこの生徒からの噂に尾ひれがついて、目撃談が化け猫に襲われた話にすり替わったのが今回の騒動の原因だ。
主人公	もちろん生徒会や学園側だって、この事件を収める為にその生徒へ聞き込みを行っただろう。
主人公	しかし、生徒が頑として襲われたという意見を曲げなかったのは想像に難くない。
和登	だから、大樹と兄貴に協力して貰うのさ
雅	あ、かずくん。なんか悪いこと考えてるでしょ？
静音	悪い顔になってるわよ、和登
五郎	いいね、お前がそういう顔をするときは大抵面白くなる。話してみろよ
主人公	にやりと笑う俺に、付き合いの長い面子は何となく俺が何かを企んでいる事を察したようだ。
和登	実は大樹にはその渦中の生徒について軽く調べてもらってたんだ
飛鳥	え？　調べるって？
大樹	大した事はしてませんよ。学内ネットのチャットや掲示板、本人のブログやツイッターでのつぶやき、そういったネット内での彼の発言や周囲の評判を軽く流し見ただけです
美琴	ネット内の？
和登	そう、現実じゃ猫被ってても、ネットじゃ本性を現す人ってのは意外と多いんだよね
雅	そうなの？
静音	そうね。ネットは顔が見えないからね、現実と違って好き放題言いまくる人もいるわ。それこそ人格が変わっちゃったようにね
安綱	それで、そやつはどうだったんじゃ？　何かボロはだしたのか？
大樹	残念ながら、そこまで馬鹿ではなかったらしく、決定的な証拠は掴めませんでした。あるいはそういった発言は削除されてしまった後かもしれませんが
五郎	それじゃ、駄目じゃねぇか
大樹	いえ、その代わり、怪しいログはいくつか見つけました
美琴	ほう……
大樹	ブログの過去ログを漁ってみたら、初めての時と最近では化け猫に対する意見に食い違いがみられます
主人公	そういって、大樹が持ってきたノートパソコンを開き、みんなにそのログを見せる。
静音	あ、本当だ。化け猫関係の最初の記事だと襲われたなんて一言も書いてないのに、最近の記事だと襲われた事になってる
五郎	おいおい、これは決定的なんじゃねぇか？
主人公	確かに文章だけ見れば決定的な矛盾だが、この程度では残念ながら弱い。思い違いや記憶違いで強引にごまかすことも出来るだろう。
和登	いや、この文章だけじゃ弱いんだ。だから、兄貴と大樹にはこいつの所に直接行って、事情を聞き出して欲しいんだ。本人の口からね
主人公	化け猫の証言、ネットでの発言。そして本人からの証言が揃えば、たとえそれが状況証拠だけだとしても、言い訳が聞かないだろう。
静音	でも、その証言をとるのが簡単にいかないから、生徒会の人たちは困ってたんでしょ？
和登	そこで今度は兄貴の出番
五郎	おう？
飛鳥	え……まさか、ごろーちゃんに力ずくで？
雅	なるほど！　ストレートでわかりやすいね！
五郎	ふっ、なるほどそういう事か。任せな、拳をつかった尋問ならオレの右にでる奴はいねぇ
安綱	それは、尋問ではなく拷問と言わないかのう？
安綱	しかし、そういうのも嫌いじゃないぞ！　まずは指か？　指を一本一本――
美琴	いや、さすがに暴力での解決はしないでほしいのだが……
主人公	なにやら勝手に盛り上がってる兄貴達を慌てて制止する。いくら何でもそんな直接的な手段じゃない。
和登	いや、違うって！　そんなことしたら逆に兄貴たちが問題になるよ！
五郎	なんだ違うのか……
静音	うわ、露骨にがっかりしたよ、この座敷童
大樹	この人はどうして、座敷童に生まれてきたんでしょうね？
主人公	とりあえず兄貴を落ち着かせて、ほっとする。本当に大樹の言う通り、どうしてこの人は座敷童として生まれてきたんだろう。雅よりよっぽど鬼っぽい。
雅	あ、そうなんだ。てっきり“折ったり”“潰したり”“抉ったり”して、聞き出すのかと思ったよ
和登	……
主人公	ごめんなさい、雅は立派な鬼でした。
五郎	それじゃ、どうやって口を割らせるんだよ
和登	あ、それは簡単。兄貴を同類だと思わせればいいだけだから
静音	同類？
和登	この手の手合いは、教師や生徒会の前だと警戒して猫被ってるけど、同類や格下相手だと、自分の事を自慢したがるからね
和登	というわけで、これから兄貴と大樹には、最低のゲス野郎になってもらいます
主人公	俺の言葉に美琴さんたちがぽかんとする。逆に兄貴は今回の趣旨が分かったのかにやりと笑った。
五郎	相変わらずえげつねぇ事考えるな、お前
大樹	ちなみに昨日の夜にチャットで根回し済みです。某所のチャットで、本人だと思われる相手と楽しくゲスなトークを堪能してきました
大樹	なので、今日は兄貴さんと一緒にリアルでゲスなトークで盛り上がってきます
和登	録音忘れずにね♪
大樹	もちろんです
飛鳥	あれ？　もしかして和登くんって結構えぐい？
静音	ええ、まあ。和登って基本的にやるとなったら、わりと何でもするタイプです
安綱	和登は敵に回すと厄介なタイプじゃからな。身内以外には基本的に容赦せんしの
美琴	なんというか、頼もしいやら恐ろしいやら複雑な心境だな
主人公	本当ならもっとじっくりと色々やりたかったのだが、なにぶん先生から頂いた時間が週末までだった事もあり、少々強引に話を進めさせて貰った。
主人公	まあ、正直本命はこれから行われる化け猫との会話なので、こっちに関しては特に失敗しても問題ない。いわゆる保険という奴だ。
和登	それじゃあ、兄貴たちの任務説明も終わったことですし、俺達はさっそく化け猫探しに行きましょうか
美琴	そうだな、元々本来はそっちが目的で集まったものだ。あまり時間が過ぎてもあれだろう
和登	了解。それじゃあ静音、よろしく
静音	ええ、いきましょ安綱
安綱	やっと我の出番じゃな！
主人公	静音の呼びかけに安綱は得意顔で前に出ると、集中するように目を閉じる。恐らく周囲の索敵に入ったのだろう。
大樹	それじゃあ、僕達は先に行ってますね
和登	ああ、頼んだ
五郎	おうよ、頼まれたぜ。ばっちり情報をゲットしてくっからな
雅	いってらっしゃい
飛鳥	がんばってねー
主人公	安綱が周辺索敵を行っている間に、兄貴と大樹の二人が任務遂行の為に別行動をとる。あっちは二人に任せておけば大丈夫だろう。
静音	どう？　安綱、いける？
安綱	んー、さすがにこの辺りは妖怪が多いのう……。まあ、ちょいと面倒だが、問題はないじゃろう。もうちょいまっとれ
主人公	そうして更に集中するためか、その後は口を開かなくなった安綱に習って俺達も黙って成り行きを見守る。
主人公	すると数分後、今まで静かに目を閉じていた安綱が、さっと目を開く。
安綱	お、これっぽいの
飛鳥	見つかったの？
安綱	まだ断定はできんが、ほぼ間違い無いじゃろ。この辺りで強い妖力を持った化け猫となると、この妖力以外ないからのう
静音	そうね、人の大きさほどある化け猫だったら、妖力をため込んでるだろうし。多分それで間違いないと思う
美琴	おお、さすが名刀・童子切安綱さま。わたしたちに出来なかったことをあっさりと
安綱	くっくっ、もっと我を称えてもいいのじゃよ？
静音	はいはい。調子に乗ってないで、とっとと行きましょ。日が暮れちゃったら山の中は結構危ないんだから
和登	そうだな、夕方になる前にここに戻ってきたい
主人公	ドヤ顔の安綱を華麗にスルーして、さっさと話を決める。事実、日が暮れる前には帰ってきたいというのが本音だ。
雅	それじゃあ、安綱さま。案内をよろしくお願いしますね
飛鳥	よーし、それじゃしゅっぱーつ！
安綱	うむ、我についてこい！
主人公	先頭に浮かんで俺達を誘導する安綱について行きながら、俺達は目的の化け猫に向けて歩きだした。
