和登	ただいまぁ……
主人公	放課後、とりあえずの聞き込みを終えて、俺は部室へと戻ってきた。
主人公	部室には、俺とは違う階を担当していた静音と雅を始め、大樹も兄貴も飛鳥さんも揃っていた。
主人公	俺は疲れ切った体を癒すように、空いてる椅子へと腰を下ろす。
静音	どうだった、なんて聞くまでもなさそうね、その様子だと
和登	ああ。成果無し。そっちもみたいだな
主人公	机に突っ伏しながら尋ね返す俺に、静音も雅も同時に頷いた。
主人公	あれから数日、事件の捜査は進んでいない。あまりに犯人に関する情報がなさ過ぎて、進めようがない、というのが本当のところだ。
主人公	なんといっても手がかりが何もない。現場に何かが残っていたわけでもないし、目撃証言もない。被害者に共通点があるわけでもない。
主人公	……性別すら共通しないんだもんな。
和登	なあ大樹。あれから被害者とかって増えてないのか？
主人公	捜査が進んでいない間にも被害者が増えるのはさすがに申し訳ない。
主人公	申し訳ないのだが、ここは少しでも手がかりが欲しい。証言を聞ける相手が増えれば、手がかりが手に入る可能性も増える。
主人公	そうだ。かの名探偵金田一先生だって、どうにもならない時は事件が発生するのを待ったじゃないかっ。
主人公	……被害者の皆さんごめんなさい。
大樹	そうですね。学内ネットで、転ばされたりした人がいないか調べてみたんですが、触られたという痴漢事件はないようです
主人公	大樹は、部室のＰＣを慣れた手つきで捜査すると、学内ネットのページを開いた。
和登	良かったって気持ちと、残念だって気持ちとが混ざって不思議な気持ちだなあ……
和登	……って、ちょっと待った。その言い方、触られたんじゃない痴漢事件はあったのか？
大樹	ええ。謎の白い液体を何者かにかけられるという事件ですね
和登	……変態か
大樹	そうですね。被害者はまだそれほど多くないんですが、確実に増えているそうで
大樹	内容が内容なので、学園側としてはあまり大事にしたくないようです。生徒会の方で独自に動いてるみたいですね
飛鳥	そういえば、みこっちゃん確かに言ってたよね。他にも変な事件が発生してる、って
五郎	なるほどな。そっちが忙しいから、こっちの事件は俺らに回したわけだ。どうりであっさり捜査の許可出したわけだぜ
主人公	いくら美琴さんが被害に遭ったとはいえ、随分あっさり許可するなあとは思ったけど納得だ。そんな事件が起きてるなら、こっちに注力はできないよな。
和登	にしても……
静音	……白い、ねちゃねちゃした液体……
雅	想像したくないです……
飛鳥	な、なんか、女の子としてはその……あまり見たくないかなあ、それ……
和登	男としても見たくないんで安心して下さい
主人公	俺達が今想像しているものとは違うもの、と信じたい……。
安綱	しかし、妙じゃな
和登	妙って、何がだ？　自分が痴漢に遭わないから、とかは無しの方向でな
安綱	たわけ。少しくらいは考えてみよ
安綱	仮にも、妖狐一族の中でも天才と呼ばれる、あの美琴が本気で動いているのじゃぞ。それがなぜ、まだ解決しておらん
安綱	変態が、妙な液体をぶっかけて逃げる。目撃証言なぞいくらでも出てくるじゃろうに
和登	……言われてみれば、確かに
主人公	確かに変だ。液体をかける、ってことは普通は目の前にいるわけだし、犯人の特徴くらい聞けるよな。
主人公	それが、なんでまだ捕まってないんだ？
静音	ねえ、大樹。それって、結局どういう事件なの？
大樹	ええと……ちょっと待って下さい。そうですね、どうやらいきなり後ろから転ばされて、それから液体を浴びせられるそうです
主人公	その説明に、大樹以外の全員が顔を見合わせた。
和登	ちょっと待て。今なんて言った？　転ばされて？
大樹	ええ。それから……ちょっと待って下さい。もう一つ面白い情報がありますね
大樹	こちらの事件も、犯人の目撃情報がまったくないそうです
飛鳥	それって、被害者も犯人を見てないってこと？
大樹	はい
雅	な、なんだか、私たちが追ってる事件とそっくり、だよね？
五郎	そっくりっつーか、同じじゃねえのか？　触るかぶっかけるかの違いなだけで
主人公	なるほど。変な白い液体をかけられた、こう聞くとまったく違う事件だ。生徒会が別ものとして考えたのもよく分かる。
主人公	だけど、こうして全体図を比べてみると、妙にそっくりな点が目立つ。
大樹	ですが、あの会長さんがそれに気づいていない、とは考えにくいですよね
和登	だよなあ。当然、生徒会には両方の事件が集まってるはずだし、あの美琴さんが気づかないっていうのはさすがに……
飛鳥	つまり、気づいていてわざと言わなかった？
大樹	考えられるのは、それぞれの事件をあえて別の方向から見てみたかった、というところでしょうか
大樹	生徒会の方でも完全に行き詰まってしまっていて、なんとかそれを打破するキッカケが欲しかったんでしょうね
和登	同じ考え方で調べてたら、自分たちと同じ袋小路にはまってしまう、ってとこか
五郎	だったら、違う考え方で追えばいいんじゃねえのか？
飛鳥	えっと……生徒会の方は、多分二つの事件を同じもの、として考えようとしてるよね。今あたしたちが思ったみたいに
飛鳥	だけど、それで袋小路だ助けろーっ、なわけだから
和登	あえて別の事件。別の犯人、という視点で追ってみるか。まずは情報集めかな
大樹	その液体があれば、うまくいけばＤＮＡ検査が出来るかもしれませんね
和登	お前、よくそんな冷静に……
大樹	重要な証拠なのは間違いありませんからね。その時の制服とか借りられればいいんですけれど
和登	でもまあ、洗うよなあ、普通は
静音	洗うどころか捨てるわ、あたしなら……
飛鳥	持ってるだけで何かうつりそう……
雅	見るだけで汚されちゃう……
安綱	そもそも、その液体の正体が本当にそれならば、それこそ痴漢で警察が動くのではないか？
和登	あ
静音	そ、そうよね。当然よ
飛鳥	うんうん。だからあたしは最初から分かってたんだ
雅	男の子のえっちな液なんかじゃないって、ですか？
飛鳥	ストレートに言うなあっ
静音	雅……相変わらず恐ろしい子……
静音	でも、っていうことは警察で既に調べてもらってるのかしら
鏡花	わざわざそんなことせんでも、あんなの匂いで一発で分かるからな
和登	……先生！？　い、いつの間に……
鏡花	疲れたんでな、お茶飲みに来た
雅	あ、はい。すぐ淹れまーす
主人公	ぱたぱたと、慌ててティーセットを取り出す雅。先生、相変わらず適当だなあ。
鏡花	ちなみにだ。さすがに内容が内容なんで、こっちの方はまだ警察に届けていない
鏡花	ま、そもそもこっちも手がかりゼロだからな。もう一つの方と同じになるのが見え見えだ
主人公	確かに、色々と調べられた挙げ句、事件じゃない、って言われておしまいな気がするなあ。学園の評判だけ下がって終了、か。
鏡花	なんでまあ、聖の奴も必死になってるわけだ
鏡花	学園の平和を守るためには、私達自らで守るしかないっ
和登	思いっきりだらけきったポーズでんなこと言われても説得力ないですよ、先生
鏡花	当然だ。ここにいる私は仕事をしない私だからな。サボるために来てるのに、そこで張り切ってどうする
五郎	さすが鏡花さんだぜっ。この人の右にだけはオレも立てる気がしねえ！
飛鳥	むしろ、立たない方がいいからね、ごろーちゃん……
大樹	浅間先生。ということは、その液体の正体がなんなのか、まだ生徒会の方では分かっていない、ということですか？
鏡花	そんな科学検査、普通の学園で出来るはずないだろ
鏡花	ま、聖家の力を使えばすぐにでも分かるんだろうが、イコール妖狐一族の学園に対する影響力を強める、ということだからな
鏡花	聖としても当然考えてはいるだろうが、最後の手段にしたいところだろう
大樹	ですが、それがなんなのか分からなければ進めようがありませんね。会長さんとしてもジレンマでしょう
主人公	捜査のためには必要だろうけれど、事件として立証は難しい。妙な形で噂になれば、この学園に通う生徒達が変な目で見られかねない、か。
大樹	和登くんのルートで、研究所の方にコッソリとお願いできませんか？
和登	敬吾さんにか？　うーん……現物さえあればやってくれるとは思うけど、あの人ちょっと苦手なんだよなあ
和登	悪い人じゃないんだけれども、その……
静音	和登とは正反対の、イケメン紳士だしね。そりゃまあ落ち込むわ
和登	うううう……反論できない俺がマジ涙目
和登	分かった、分かりました。頼んでみるよ
主人公	犯人を捕まえるためだ、仕方ない。
和登	で、その液体ってどこにあるんだ？
鏡花	私は知らんぞ
主人公	部員全員が凍り付いた。
