敬吾	はい、今日の検査はこれで終了です
主人公	敬吾さんの声に俺は診察台から起き上がり、体を伸ばしながら尋ねる。
和登	ありがとうございます。それで、どうでした？
敬吾	ええ、前回同様、非常に安定しています
和登	ふう、それを聞いて安心しました
敬吾	そうですね。以前覚醒寸前まで追い詰められたので、警戒して検査の回数を増やしているのですが、暴走の兆候どころか、むしろ以前より安定している
敬吾	いや、馴染んでいるようにすら感じます
和登	馴染んでる？
主人公	データを見ながら呟く敬吾さんに、首を傾げる。
主人公	馴染んでいるとはどういう意味だろう。
敬吾	ええ、今更説明するまでもないですが、本来狭間の者の中に流れる妖力は、非常に不安定でいつ爆発してもおかしくはありません
敬吾	その理由は、本来妖力を持たない人間の体が、妖力に対して拒絶反応を起こしているためです
和登	確か、人間の体と妖力が互いに反発し合ってるから、常に不安定なんですよね
敬吾	ええ。しかしここ最近の赤城君の妖力は反発し合うどころか、まるで互いを受け入れようとしているかの様に、落ち着いているのです
敬吾	このような反応は過去の歴史を振り返ってみても確認されていません。いったい何故このような事が赤城君だけに起こるのか、興味はつきませんね
和登	は、はあ……
主人公	データを見ながら興奮気味の敬吾さんを見て、少しだけ引いてしまう。
主人公	相変わらず敬吾さんは、研究の事になると人が変わったようになるな。
敬吾	おっと、失礼、少し興奮してしまいました。いけませんね、どうにもこういう過去に類を見ない事例を見ると、研究者としての血が騒いでしまいます
和登	はは、別に気にしてないんで大丈夫ですよ
主人公	と言いつつ、研究について語っている時の敬吾さんの目は、若干苦手だったりする。
敬吾	お恥ずかしい。しかし、研究者として興味が尽きないと同時に、赤城君にとっても嬉しい話だと思います
敬吾	このまま妖力が安定すれば、暴走の恐怖に怯えることはなくなるのですから
和登	だと嬉しいんですけどね
主人公	実際、このまま暴走の危険が無くなってくれればいいんだが、さすがにそこまで都合よくはいかないだろう。
敬吾	何故このような現象が自分に起こるのか、なにか心当たりはありませんか？
和登	心当たりですか？
敬吾	ええ、最近の生活の中で変わったこと等があれば教えてください。それらを分析すれば、今回の現象を解析することができるかもしれません
主人公	そんな事言われてもな。常に自分の環境を意識しながら生活しているわけじゃないし。
主人公	強いてあげるなら……。
和登	う～ん……変わったことなんて……彼女が出来たぐらいですよ？
主人公	そう、強いてあげるなら雅という恋人が出来た事ぐらいか。
敬吾	……
和登	あーすみません、マジすみません、真面目な話の途中で惚気てすみません。だからそのゴミ虫を見るような目をやめてください、お願いします
主人公	敬吾さんの視線に耐えきれず俺が平謝りしていると、後ろから聞き覚えのある笑い声が聞こえてきた。
酒呑童子	がはははははは！　本当に彼女が出来て妖力が安定したんだったら、まごうことなき愛の力だ
雅	もう、お父さん。愛の力なんて、当たり前のこと言わないで恥ずかしい
和登	雅さーん、今一番恥ずかしいの俺なんで、出落ちでいきなり惚気るやめてもらえますかー！？
敬吾	お二人ともいらしてたんですか
酒呑童子	おうよ。俺様はこれからちょいと用事があって本土に行っちまうだろ？　その前に挨拶しておこうと思ってな
和登	あ、そっか、今日からだっけ。おやっさんが本土に行っちゃうの
主人公	なんでも、本土の方で鬼と妖狐と天狗による三大妖怪合同の話し合いがあるらしく、おやっさんはそれに参加するために、白夜島をしばらく離れるらしい。
酒呑童子	まあ、二週間で帰ってくるがな
雅	それで、それじゃあついでに私もって事で一緒についてきちゃった
和登	まあ、どうせこの後みんなと遊ぶ約束してるしな
主人公	雅と俺は、この後静音達も含めたパト部のメンバーと遊ぶ約束をしているので、丁度いいと思ってついてきたのだろう。
酒呑童子	それにしても、ここ最近安定してるって事は聞いてたが、なんか凄い事になってんだな
敬吾	ええ……なにしろこのまま安定し、制御が可能になれば、赤城君は歴史上初めて人間と妖怪を超えた超越者になれるかもしれません
和登	なんか、大袈裟な言葉が出てきたなぁ……
主人公	超越者なんて単語、普通に生活してたら絶対に使わないぞ。
敬吾	大袈裟なものですか。今まで人間でも妖怪でもないと蔑まれてきた狭間の者が、その二つを超越し新たな生命となるのですよ？
敬吾	人間と妖怪を超えた高み、素晴らしいとは思いませんか？
和登	ん～、別に俺は俺だしなぁ。そもそも進化とか高みとかあんまり興味ないし
雅	そうですね、どんなに変わってもかずくんはかずくんです
主人公	実際今の体で十分すぎるほど満足しているので、特にこれ以上変わりたいとは思わない。
主人公	というか、そもそもそんなこと、意識した事すらない。
酒呑童子	はは、振られたな所長
敬吾	ええ、残念です
酒呑童子	まあ、それでもすごいなカズ坊。もしかしたらお前なら、本当に狭間の者の歴史を変えられるかもな
和登	う～ん、実感わかないな～
雅	やっぱり愛の力だよ、愛の！
和登	まだ言うか
主人公	瞳を輝かせて愛と言う単語を連呼する雅。正直悪い気はまったくしないが、それでも気恥ずかしいので、できればそういうのは二人きりの時にしていただきたい。
酒呑童子	いんや～、あながち間違ってねえかもよ？
主人公	雅を必死でなだめる俺に、おやっさんが呟く。それを聞いて敬吾さんが、そんな馬鹿なと苦笑した。
敬吾	はは、まさか、愛などという非科学的なものを根拠にするとは、酒呑童子さまは本当に冗談がお上手ですね
酒呑童子	まあ、最後まで聞けよ
主人公	ばかばかしいと頭から否定してかかる敬吾さんに、おやっさんは手を振りながら考えを語る。
酒呑童子	妖力ってのは持ち主の感情に敏感なんだ。感情の爆発によって、妖力を暴走させちまった妖怪は意外と多い。まあ、妖怪なら暴発させてもせいぜい怪我する程度ですむがな
酒呑童子	そんで狭間の者ってのは、妖怪以上にその感情に敏感なんだろ？
敬吾	ええ、故に感情の爆発、恐怖や苦痛などをトリガーに暴走を始めます。そして、妖力と共に暴走したそれらの感情に自我が飲み込まれ、理性を失い暴れ回るのです
敬吾	そして、自我という枷が外れた感情は更に肥大化し、それを餌に妖力は膨れあがり、最後には自身の肉体を飲み込み暴発します
酒呑童子	だろ？　過去を振り返っても、狭間の者の暴走のほとんどが精神的動揺による妖力の暴走だ。絶望した恐怖に追い詰められたりな
酒呑童子	けど自分が好きな奴といると、心ってのは安らぐもんだし、そいつが近くにいたり、そいつのことを思ったりすると、恐怖や絶望にも耐えられたりすんだろ？
敬吾	つまり、人を愛することで精神の安定を得て、結果的に暴走が抑えられると？
酒呑童子	そういうこと
主人公	確かに、そう言われてみれば、雅と一緒にいるようになってから心休まる時間が増えている気がする。
雅	つまり、最後に愛は勝つってことだね
和登	雅さん、もうそれが言いたいだけですよね……
主人公	難しい話題についていけないので、とりあえず言ってみた感がひしひしと伝わってくる。
酒呑童子	まっ、本当の所は専門でもなんでもねえ俺様にはわかんねえけどな。ただ、頭ごなしに否定するにはちょいと惜しい理論のような気がするな
敬吾	ふむ、無茶苦茶な理論ですが、精神安定による暴走の軽減は一考の余地がありますね
主人公	まあでも、専門家でもないのに、理論に妙に説得力があるあたり、さすがおやっさんだ。
酒呑童子	っと、そろそろ行かねえと電車に遅れちまうな
和登	あ、それじゃあ敬吾さん、俺も今日は帰りますね
主人公	おやっさんが時計を確認したのを見て、俺もそろそろ帰ると敬吾さんに話す。
敬吾	え？　あ、はい。それではまた次の検査の日に
主人公	敬吾さんは、また研究者モードに入って何かを考えていたのか、俺の言葉にワンテンポ遅れて頷いた。
和登	それじゃあ、俺着替えてくるから外で待っててくれ
雅	うん、分かった
主人公	それにしても愛で狭間の者の宿命を克服か、本当にそんな事が出来たのならいいんだけどな。
