ねずみ男	よう和登、この前借りたＣＤマジいいな。思わず買っちまったよ
主人公	朝、教室へと入った瞬間、目のあったクラスメイトの妖怪が声をかけてくる。
和登	だから言ったろ、財布の中身に覚悟して聞けってさ
ねずみ男	いやあ、和登の言うことだから完全疑ってたんだけどなあ
和登	疑ってたのかよっ
ねずみ男	いや、参った参った。またいいのあったら頼むぜ
和登	任せとけ。今度はちゃんと大損させてやる
ねずみ男	ちょ、待っ
主人公	俺はそんなたわいない話をしながら席へと向かう。
女生徒	あ、赤城くん。この前はパト部ありがとね。おかげで助かっちゃった
主人公	そして席へとつくと同時、隣のクラスの人間の女生徒が声をかけてきた。丁度友人に会いに来てたらしい。
和登	あ、それじゃ間に合ったんだ、コンサート
女生徒	うん。パト部総出で探してくれたおかげだよ。もしチケット見つからなかったら、あたし絶対自殺してたね
和登	おーい、物騒な話はやめてー
女生徒	あはは。これも赤城くんたちが見つけてくれたからこそ出来る話ってことで
女生徒	それじゃねー
主人公	ひらひらと手を振りながら、自分の教室へと戻っていく女生徒。うん、助けになったのならマジ何よりだ。
主人公	どうも、この前の薬の事件解決が密かに噂になってるらしい。おかげでパト部の信用もかなり上がってくれた。
主人公	まあ、さすがにあの事件みたいなヤバイものはないものの、捜し物からケンカの調停、ちょっとした部活の手伝いなど、ちょこちょこと依頼が来るようになった。
主人公	それで喜んでもらえるんだから、パト部を作った甲斐もあるというものだ。
主人公	人間も妖怪も気軽に相談に来てくれる。それが俺としてはとにかく嬉しい。どちらかに偏ってしまったら、それこそ意味がないもんな。
主人公	そんなどこか穏やかな時間の中でチャイムが鳴り響き、
鏡花	あー、ほら席着けー。長引かせるとめんどくさいからちゃきちゃきホームルーム進めるぞー
主人公	いつも通りにめんどくさそうな顔をした先生が教室へと入ってくる。
主人公	先生はクラスの中をぐるりと見回すと、やがてその視線を俺に向け、溜息をついた。
主人公	あれ？　俺何かやったっけ？
鏡花	あー、その、なんだ……赤城
和登	は、はい？
鏡花	あれには早急に戻ってもらえ。うちのクラスを覗いてたせいで生徒会長が授業に遅れるとか、私の教師生命に関わる
和登	……美琴さん、まだやってたんだ……
主人公	俺達は、苦笑するしかできなかった……。
主人公	そんな、美琴さんの監視が始まってから早五日。その監視も、平穏な毎日を過ごす俺に慣れてきたのか、減っていた。
主人公	以前なら休み時間はもちろん、部活の間もちょこちょこと扉の隙間から覗いてきていたが。
美琴	うん。やっぱり角砂糖入りの緑茶はいいなあ……
主人公	今ではこうして、普通に部室でお茶を飲んでいる。いや、それもどうかと思うんだけどな。これでいいのか生徒会。
鏡花	ほんと、これでお酒でもあればいいんだけどねえ
美琴	浅間先生、ここはあくまでも学園内なので自重して下さい
鏡花	分かってる分かってる。だからこうして、ウィスキーボンボンでガマンしてるんじゃないか
美琴	それもどうかと思うんですが……
主人公	ちなみに、他のメンバーは依頼でお出かけ中。仕事をさぼるためにやってきている先生のお相手を、俺と美琴さんがさせられている状況だ。
主人公	ほっとくとウザイから縛り付けといて、とは静音の談だ。
鏡花	聖こそ、そうやって何にでもぽちゃんぽちゃん角砂糖入れてると太るぞぉ
美琴	……脂肪というものはどうしてついて欲しいところにつかないんでしょうか……
鏡花	そうか？　お前の場合むしろ付かない方がファンの連中が泣かないだろ。なあ赤城
和登	はい！　美琴さんはちっちゃいからこそ美琴さんです！
美琴	……み、見るな……このけだもの……
鏡花	あら、けだものは聖の方だろう。妖狐なんだし
美琴	意味が違いますっ
主人公	そんな、実にいつも通りの平穏な時間を、
女生徒	パト部のみなさん！　ごめんなさい、ちょっと助けて！！
主人公	そんな、突然の依頼が吹き飛ばした。
和登	ケンカ？
女生徒	はいっ。サッカー部で蹴り出したボールが、偶然トラックを走ってた陸上部の人にぶつかっちゃって……
和登	あー、部活でのいざこざかあ。たまにあるんだよなあ
主人公	どうやら、陸上部の方がかなりいいタイムが出そうだったらしく、謝ってきたサッカー部に対し、キレてしまったらしい。
主人公	気持ちは分かるけれど、もうちょっと考えてほしいなあ。
和登	って、サッカー部の方、あれ鬼か！？
主人公	校庭のほぼど真ん中で睨み合っている二人の男子生徒。陸上部は普通の人間だが、サッカー部の方は、紛れもない鬼の一族だ。
主人公	いくらなんでも、あれにケンカ売るとか無謀ってレベルじゃないぞ。さすがに鬼相手にどうこうするのは、普通の状態の俺じゃちょっと荷が重い。
女生徒	そうなんですっ。陸上部の方、三年の先輩なんですけど長距離のエースで、もしケガでもしちゃったら……
主人公	両方の部員が必死になって止めようとしているけれど、当の二人はもう爆発寸前だ、限界だろう。
美琴	仕方ないな、ここはわたしが……
鏡花	あー、お前は出ない方がいいと思うぞ。生徒会長が出張ったとなれば記録にも残る。大事になりかねん
鏡花	下手すれば大会も参加不可だ。それがイヤだからこそ、教師でも生徒会にでもなく、パト部に飛び込んできたわけだろう
和登	なるほど。それはつまり、俺に行け、と？
鏡花	うむ。私が顧問をしている部がもめ事を収めたとなれば、私の点数もどっかどっかアップだ
主人公	この人、本当に隠さないなあ。
鏡花	それにこの状況、人間と妖怪の争いだ。これがきっかけで大会に出場できなくなったり、部活動停止なんてことになってみろ。一部の連中とはいえ、遺恨を残すぞ
美琴	そんな……
和登	なるほど、確かにパト部の出番ですな、こりゃ
女生徒	ごめんなさいっ。お願いしますっ
主人公	とはいえ、どうするか。こういう時こそ雅がいてくれれば……いやダメだな。鬼の方は雅で止まってくれるかもしれないが、陸上部の方が爆発しかねない。
主人公	両方をそれなりに納得させないと。
美琴	ここはやはり、わたしが行こう。この場合、両方の怒りの矛先を第三者に変えてしまうのが一番早い。生徒会長ならばその役目にピッタリだ
和登	それ却下。美琴さんが嫌われるっていうのは俺がイヤです
美琴	う……だ、だがそれでは……
和登	つまり、それを俺がやればいいわけですね。任されました
美琴	だ、だが、相手は鬼だぞ！？　ただの人間である君で……は……
主人公	そこまで言って、美琴さんは気がついた。
美琴	まさか……ダ、ダメだ、それは絶対！
主人公	慌てて手を伸ばし、俺を引き留めようとする美琴さんだったが遅い。俺は既に走り出していた。
鬼	もう限界だ！　てめえ、邪魔された方だからって調子に乗りやがって！
鬼	こっちは充分に謝罪もしてんだ！　てめえの言い分なんかもう通じねえぞ！！
陸上部先輩	なんだと！　その言い方がもう、まったく反省していない証拠じゃないかっ
陸上部先輩	やれるものならやってみやがれ！　てめえら妖怪共にはいい加減むかついてたんだよ！　いつも偉そうにしやがって！
和登	お前ら、いいかげんにしろ！！
主人公	ついに堤防が決壊し、その拳を振り下ろした鬼の先輩。だがその一撃を、俺は片手で受け止める。
鬼	誰だてめえ！　邪魔すんな！
陸上部先輩	おい、何いきなりしゃしゃり出てきてやがる！　邪魔だ消えろ！
和登	うるせえっ！
主人公	体を流れる鬼の血。普段は閉じ込めてる狭間の者としての力を、俺は少しだけ解放してやる。
主人公	それは、ブレーキの壊れたダンプと同じ。何かを破壊する、傷つけるという行為が、そのまま衝動へと変化していく。それが楽しいとさえ思えてくる。
主人公	決して制御できない力が、今も体の奥底から、とにかくぶん殴れ、何も言えなくなるまで蹴り飛ばせ、と、俺に囁いてきている。
主人公	その声に対抗する力を俺は持っていない。その声に従って漲ってくる破壊の衝動のままに、俺は二人を睨み付けた。
和登	あん？　やるのか？　やるっていうなら受けてやるぞ
和登	もれなく一月程度、病院食を食わせてやるよ……
主人公	生きてれば、の話だけどな。心の中でそう付け加え、楽しげに舌なめずり。
主人公	うん、ぶん殴ろう。そうすればきっと気持ちいい。
鬼	お、おい……こいつ……
陸上部先輩	あ、ああ……なんか、ヤバくない、か？
主人公	そんな俺の本心に気がついたのか、二人がジリジリと下がっていく。おいおい、ここまで来てそれは勘弁だぞ。殴らせてくれよ頼むから。
和登	んじゃ、いくかあ
主人公	満面の笑顔で一歩前に。目の前の二人はもちろん、周囲の他の生徒達までもがその場に固まり、動けなくなっていた。
主人公	うん、殴る対象がいっぱいいるぞ！
雅	か～ずくん、何してるの♪
静音	かっこつけようとしても似合ってないわよ、和登
主人公	その瞬間、すぐ後ろから聞こえた声が、俺の衝動を吹き飛ばした。
雅	あれ？　確か三年の酒鬼さん？
酒鬼	い、伊吹さま！？　ど、どうしてここに……って……かずくん！？
酒鬼	お前、いや、あなたは……間違いなく赤城さん……
雅	えっと……まさかとは思うんだけど、かずくんに暴力ふるってたのかな？
酒鬼	い、いえ、あの、そのようなことは断じて絶対だからその……
静音	そちらは確か、陸上部の十勝先輩でしたっけ
十勝	お前は……ひょっとしてパト部の天城？　って、ひょっとしてこいつ、赤城和登か！？
静音	ご名答です。なので、ここは流した方がいいと思いますよ。雅がキレたら、あたしは止めませんから
十勝	せ、せめて止めようとする意思を見せてほしいな！？
静音	だって、あたしの命に関わりますから。この子、普段は人畜無害のくせに、和登が関わると人変わりますし
十勝	確か、赤城にぶつかりかけた車を片手で投げ飛ばした、とか……
静音	ああ、それ違います。トラックです
主人公	ニッコリと、実に可愛らしい笑みを浮かべている雅と静音。鬼の酒鬼先輩と、陸上部の十勝先輩。二人は悪魔でも見るような顔で俺を見ている。
主人公	いや、この場合、見るのは俺じゃなくて雅の方じゃないかなあ。
和登	えっと……続きやります？
酒鬼	な、なにをかな？　十勝くん、僕達何かやっていたっけ？
十勝	あ、ああほら、これから一緒に二人三脚の練習をするところだったじゃないか、酒鬼くん
酒鬼	おお、そうだそうだったっ。というわけで、僕達はこれから二人仲良く練習に戻るのでっ
十勝	よーし、頑張ろう酒鬼くんっ
主人公	ぽかあん、と見守る他生徒の中、二人は仲良く肩を組んで去っていった。
和登	いやあ、さすがだなあ雅の笑顔は。可愛すぎる
静音	ほんとよね。一瞬で仲良くなっちゃった
雅	そ、そうかな。私の笑顔って、そんな可愛い？
和登	もちろんだ、なんというミラクルフェイス
静音	それで、これで解決、でいいわけ？　こっちは
和登	おう、見事完了だ。戻ってお茶でも飲もうぜ
主人公	俺達は、さっきまでの緊張感などどこへやら、周囲の生徒達に軽い挨拶だけして、美琴さん達の元へと戻る。
主人公	助けを求めてきた女生徒も、何度も頭を下げて去っていった。
鏡花	まあ上出来だろう。とりあえず、変な噂が広がってるとまずいからな、私は一度職員室へ行く
鏡花	すぐ部室に戻るからな、お茶の準備はしておけよ
主人公	ほんと、真面目かそうでないのか分かんない人だなあ。
美琴	……和登くん
和登	あ、美琴さん。すいませんちょっと手間取り……
美琴	……なぜ狭間の者の力を使った
主人公	俺の言葉なんて聞く気がないとばかりに、美琴さんは俺を睨み付けていた。
和登	あー……やっぱり、分かりますか
美琴	当然だ！　しかも、暴走寸前にまでいっていたことも！
美琴	あそこで奇跡的に収まったからよかったものの、あと数秒でも収まるのが遅れていたなら、周辺にいた生徒たちは間違いなく死んでいた
美琴	君の手で、だ！
和登	……いえ、まあ大丈夫だろうな、と
美琴	君が、天城の魔封じによって守られていることも理解した
美琴	だが、いくらなんでも軽率すぎないか？　君は、狭間の者の危険性をどれだけ考えたことがある！　狭間の者をどう考えている！
和登	……破壊衝動の固まり、ですか
美琴	そんな簡単なものじゃあない！
美琴	狭間の者は、人間と妖怪の境界を、その関係のバランスを破壊するキッカケとなる存在だ！
美琴	人間は妖怪の力を恐れ、妖怪はその力を貸す代わりに、人間の文明を利用する
美琴	それは、あくまでも妖怪が人間よりも上位の存在だと信じているからこそ成り立つ関係だ
美琴	だが、もし人間が、妖怪を越えることができたとしたら、どうなる
美琴	妖怪はその姿を隠し、人は妖怪の力などを当てにすることもなく、人間だけの未来を目指すだろう
美琴	そうだ。人間が妖怪を越える存在となれる証明、それこそが狭間の者
美琴	多くの人間と妖怪が懸命に築き上げ、そして守り続けてきた関係を、君は容易く崩す。それがどれほど残酷なことか、少しでも考えたことはあるのか！
美琴	わたしは、君が危険だと思っていた。けれど同時に、期待もしていたんだ……
美琴	もしかしたら……君は……
主人公	美琴さんの体は震えていた。それはもちろん寒さとかによるものじゃあなくて、俺に対する……怒りによるもの。
主人公	そして、本当に悔しそうな顔で、俺を睨み付ける。
雅	みこちゃん！？
主人公	そのまま、俺に背を向けて走り出す美琴さん。雅が、慌ててその後ろを追いかけていく。
静音	和登、いいの？
和登	……ごめん、頼む
静音	うん、了解。気にしちゃダメよ。美琴先輩、知らないだけなんだから
主人公	俺を慰めるようにそう言って、静音も二人の後を追っていった。
主人公	本当なら、俺も追うべきだったのかもしれない。そして、俺の口から言うべきなのかもしれない。
主人公	けれど俺は、その小さくなっていく背中を、俺は追えなかった。
主人公	最後、走り出すその瞬間、美琴さんに瞳に浮かんでいたものが見えてしまったから……。
