主人公	思いっきり楽しんだモンスターキングダムを後にして、俺達は二人並んで歩いていた。
主人公	以前よりも距離が近い、そんな風に感じるのは、やっぱり美琴さんの昔を知ることが出来たからなのかもしれない。
主人公	とはいえ、少し深いところに触れすぎてしまったせいか、俺達の間に会話はなかった。
主人公	嫌な空気があるわけじゃない。ただ、少し照れくさかった。今のこの状況で何かを話せば、また何かが変わってしまうんじゃないかという、そんな恥ずかしさがあった。
美琴	な、なあ、和登くん……
主人公	だが、そんな沈黙を耐えかねたのか、明らかに夕日によるものとは違う色で頬を染めながら、美琴さんが口を開く。
美琴	その……すまないが、最後に一箇所だけ付き合ってくれないか？
和登	一箇所と言わず、何カ所でも付き合いますよ。なんでしたら一晩中でも
美琴	……凄くいかがわしく聞こえてしまうのは気のせいか？
和登	やだなあ、期待してるに決まってるじゃないですか。美琴さんみたいな美少女が相手ですよ
美琴	褒めてもらって喜ぶべきか、その回答に身の危険を感じるべきか、分からないぞ……
和登	それは当然、両方でいいかと。美少女たるもの男相手に無防備はいけません。恋人相手ならともかく
美琴	まったく、君という男は
主人公	美琴さんは呆れたように言うと、小さく笑った。そして、ゆっくりと歩き出す。
和登	学園、ですか？
主人公	迷い無く歩いていた美琴さんの足が止まったのは、学園の前だった。
主人公	通い慣れたその入り口で立ち止まり、静かに校舎を見上げる。
美琴	……少しね、問いかけてみたかったんだ
美琴	わたし自身と……それから、何よりも君に
主人公	美琴さんは、その先の言葉を音にしようとして、けれども少し躊躇した。それだけで、どんなことを聞いてこようとしているのか推測ができる。
主人公	本当に聞いていいのか、そんな戸惑いを表情に浮かべ、けれども自分を落ち着かせるように小さく深呼吸をすると、改めて俺を見る美琴さん。
主人公	真っ直ぐに俺を見上げたまま、覚悟を決めたようにその小さな唇を開いた。
美琴	和登くん。君は、自分自身の危険さを誰よりも分かっている。分かっているからこその、今の生き方なんだろう
美琴	人間とあやかし、その中間に立ち、その両方へと手を差し伸べる
美琴	だが、もし少しでも間違ってしまえば、その両方の悪意が君を襲うことになるだろう
美琴	君を都合のいい悪と決めつけ、武器を、力を振りかざし、殺そうとするだろう。自分たちの命と考えを守るために、だ
美琴	そうなったとしても、君は今の生き方を続けていくのか？
美琴	人間とあやかし……その両方を守り続けていくのか？
和登	ええ、そのつもりです
主人公	それは、ほぼ予想通りの質問。迷うことなんて少しもない。俺はそれが当たり前とばかりに、ハッキリと頷いていた。
主人公	人間とあやかし、俺の周りにはその両方が常にいてくれた。
主人公	静音が、雅が、いてくれた。
主人公	俺にとって大切な二人。その間に境界なんてない。どっちも同じ、ただ大切な幼なじみだ。人間だろうが、あやかしだろうが関係ない。
主人公	だから、俺が守ろうとするなら、力になろうとするなら、やっぱりどっちも同じだ。
主人公	それに……。
和登	俺が狭間の者になった時、やっぱり両方いたんですよ
美琴	人間とあやかしが？
和登	いいえ。俺を助けようとしてくれた存在と、俺を殺すべきだと言っていた存在と、です
主人公	あまりにあっさりと言い切った俺に、美琴さんが言葉を失う。
和登	まあ、どちらかといえば後者の方が多かったんですけどね。自分達の命がかかってるわけですし、過去の例を考えれば当然でしょう
和登	だから、そのことを恨む気なんてまったくありません
和登	むしろ、嬉しかったんですよ。その当然に逆らって、俺を助けようとしてくれた人達がいたことが
主人公	そうだ。自分達が危険になることすら呑み込んで、俺を信じてくれた人達が確かにいた。そういう人達がいてくれるんだ、その事実が俺に生き続けることを決意させてくれた。
和登	殺せと助けろ、両方いるのなら、やっぱり自分にとってプラスな方を信じたいじゃないですか
和登	俺は、人間にもあやかしにも、どちらにも俺を助けろと言ってくれる人達がいるんだって、そう信じることにしました
和登	だから、俺を助けようとしてくれたどちらも助けたい。守りたい
主人公	俺は忘れていないから。あの時、俺を助けるために必死になってくれた雅と静音。それからたくさんの町の人達を。
主人公	そんな俺の言葉を聞いて、美琴さんは笑っていた。
主人公	小さく、けれど確かに。嬉しそうに、笑っていた。
美琴	やっと、分かったよ
主人公	そしてそのまま、嬉しそうに、言った。
美琴	自分の危険さを知りながらも笑い続ける君に、なぜあんなにも腹が立ってしまったのか……
美琴	わたしは、怖かったんだ
美琴	人間とあやかし、その両者による新しい世界。わたしはそれを目指していながらも、いつしかその自信を失っていた
美琴	だからこそ、それを本当に叶えてくれるんじゃないかと、君に期待をし……
美琴	それを裏切られてしまうことが怖かった
美琴	そして、やはり裏切られたと思ってしまった
美琴	まったく……本当に自分勝手だな、わたしは
主人公	自嘲するような笑みと共に、そう言う美琴さん。
美琴	君は、わたしにとって初めての……わたしの想いを間違っていないと証明してくれる、希望だったんだ
美琴	わたしも……もう一度、今度は君のように信じてみたい
主人公	言うが早いか、美琴さんは俺と密着するかのように前に出た。その真剣な瞳が、すぐ下から俺を射貫く。
和登	美琴、さん？
美琴	……すまない。どうやらわたしは思っていた以上に自分を抑制できなかったらしい
美琴	こんな気持ちは初めてで……もう、我慢できそうにないんだ……
主人公	その二つの紅玉が閉じられた刹那、温かな感触が俺の唇へと重ねられた。
和登	っ！？
美琴	ん……
主人公	あまりに唐突な出来事に、俺は反応できない……いや、反応はできた。
主人公	けれど、唇から伝わってくる美琴さんの吐息が……まるで美琴さんの想いすべてがこめられているかのように熱くて、動けない。
主人公	唇から染み渡ってくる想いと柔らかな感触とが脳髄まで伝わり、俺の心にまで甘く染み渡っていく。
主人公	このまま、この人のすべてを味わっていたい。そんな官能的な欲望が俺の体を支配する。
美琴	ん……む……
主人公	まだ足りない。そんな想いのこもった唇が、俺を求め続ける。
美琴	ん……はぁ……
主人公	それは茜色の光の中で一分近くも続き、ようやく、名残惜しそうに離れていった……。
美琴	えへ……
主人公	朱色に染まった顔に恥じらいと笑みとを浮かべ、美琴さんは俺を見上げ続ける。
主人公	その表情は、思わず見とれてしまいそうなほどに可愛らしい。
和登	あの、美琴、さん……？
美琴	すまない。どうしても、君とキスがしたくなってしまった
美琴	君が欲しくて……君をわたしで染めたくて……たまらなくなってしまった
美琴	初めてだったんだが……うん、いいものだな。なんていうか……心がポカポカとしてくる感じだ
美琴	恋人たちが何度もしたくなるのもよく分かる……
美琴	うん……胸の中がすっごく満たされた感じで……なんていうのか……幸せだ
美琴	君はその……どう、だった？
美琴	わたしとじゃあ、やっぱりイヤ、だったか……？
和登	そんなことあるわけないですよ
和登	むしろ光栄というか……気持ちよすぎてその……
和登	もう一回、リクエスト有りですか……？
美琴	そ、そうか。それはよかった……
美琴	だ、だが、今日はダメ、だ
美琴	実はその、わたしももう一度くらい、と思ってしまっているのだが……心臓がドキドキしすぎていて……
美琴	もう一度してしまったら、破裂してしまいそうで……
和登	そんなに、俺との……よかったですか？
美琴	いや、その……確かにそうなんだが……そうハッキリ言うのはだな、やっぱり恥ずかしい……
和登	……シッポ、さっきからバッサバサ動いてますよ？
美琴	はにゃっ！？
美琴	い、いや、これは……
和登	あ、また動いた
美琴	はにゃぁ……
美琴	し、仕方ないじゃないか……勝手に動いちゃうんだから……
和登	ええ。すごく可愛いです
美琴	はにゃにゃっ！？
美琴	ば、ばかぁ……そんな、恥ずかしいことをあっさりとだなあ……
和登	可愛いものは可愛いんですから仕方ありません。むしろこんなに可愛い美琴さんの存在がずるいです
美琴	か、可愛いなんて言っちゃだめぇっ
美琴	君に言われたら、わたし、う、嬉しくて……
美琴	くぅん……だ、だめ……シッポ止まんないよぉ……
主人公	なんていうか、今日一日で俺の中の美琴さん株が上がりまくりなんですが。
主人公	もちろん可愛いのは知っていたけれど、まさかここまで可愛い物体だったとは。
和登	そうですね、今日はここまでにしておきましょう。俺も限界です
美琴	げ、限界って、なんの……？
和登	無理やりにでもお持ち帰りして色々したくなっちゃいます
美琴	はにゃっ♪
美琴	……う、うん、そうだな……ここまでにしよう
美琴	お持ち帰りという言葉に、嬉しいって思ってしまった……このままだとわたし、流されちゃう……
和登	流されて下さって結構ですともっ
美琴	……すけべ……
主人公	そうして、俺達はここで別れた。うん、強がっては見せたけど、俺の方がいっぱいいっぱいです。
主人公	ていうか……明日以降、まともに美琴さんと話せるかなあ、俺……。
