美琴	わたしはデートがしたいっ
ざわざわ	ざわ……ざわ……ざわ……ざわ……
主人公	唐突な美琴さんの宣言に、クラス中がざわめいていた。
和登	……えーと……あの、美琴さん？　ここがどこだか……
美琴	もちろん分かっている。和登くん、君の教室だ。だが今は休み時間。上級生とはいえ、愛しい恋人に会うために足を運んだとしても、なんの不都合もないだろう？
ざわざわ	ざわざわざわざわ！！
和登	いやまあ、そうなんですが……その、周囲の視線というものをですね、できればちょっと……
主人公	少なくとも、美琴さんと恋人同士になったことは、あえて広めていなかったわけでして……。
主人公	あの美琴さんと恋仲、となれば、ああほら、そこかしこで嫉妬の炎が燃えさかってるしー。
美琴	もう一度言うぞ。わたしはデートがしたいんだ！
主人公	そんな俺の思考は、美琴さんにはまったく伝わらなかったらしい。まあ仕方ないか。この人、自分が相当人気あるってこと、これっぽっちも気にしてないもんな。
和登	デートなら、もうしましたよね？　ほら、遊園地
美琴	ああ、確かにした。あれは実に楽しかったな。帰りにはその……大切な思い出もできたし……
美琴	えへへぇ……
主人公	あ、やばい。甘え子狐モードに入りかけてる。こうなった美琴さんの破壊力は、一撃で厚さ十メートルの壁をぶち抜くぞ。主に見てる人達が。
ざわざわ	ざわ！　ざわ！　ざわ！　ざわ！！
美琴	だから、デートをしようっ
和登	え？　いやでも、もう遊園地で……
美琴	む～～～～～～～っ
美琴	だからっ、わたしは正式な恋人同士としてのデートがしたいのっ
美琴	二人で腕を組んだり、食べ物を半分こしたり、もっとも～～～っと、いちゃいちゃ感いっぱいの思い出が作りたいのっ
和登	ああ、なるほど
美琴	和登くんは、わたしとそういう思い出を作りたくないのかっ？
美琴	わたしのことを、ぎゅっと抱きしめたくなるとか、お姫様だっこしてみたいだとか、あ～んしてほしいだとか、その……キ、キスをもう一度したい、だとか……
美琴	思わない……？
和登	思いますっ
和登	しましょう！　デートマジしましょう！　なんだったら、学校サボって今からいきましょう！
美琴	そんなに喜んでくれるのは嬉しいけれど、授業をサボるのはさすがにダメだぞ、うん♪　それじゃあ、次の日曜日でどうだ？
和登	まったく問題ありません。あったとしてもなくします
和登	それじゃあ、細かいことはまた電話で、でいいですか？
美琴	ああ、分かった。それじゃあ、わたしは次の授業の準備があるので戻る
美琴	また放課後に、ね
主人公	可愛らしいウィンクを残しつつ、美琴さんは超ご機嫌モードで教室を去っていった。
主人公	いやぁ、子狐モードの美琴さん、ちょっと可愛すぎますわあ……。
和登	恋人になって初めてのデートかあ……考えてみれば、こんなのすぐにでも思いついていいことだよなあ
白子	赤城さん、ちょっとよろしくて♪
和登	うっわ、いつも通りに丁寧口調だけどなんか違うー！！
雅	うん♪　かずくん、私もちょっといいかな
和登	こっちもいつも通りにフランクな口調だけどやっぱりなんか違うー！！
静音	おら、和登！　屋上！
和登	……はい……
白子	説明して下さいます♪
和登	あの、語尾の音符が口調と合ってなくて怖すぎます……
雅	うんうん。ここはさっさと吐いて楽になって、シロちゃんに両手両足を粉砕されて、私の看病を一生受けて生きていく方がいいよ
和登	うん。口調はすっごく優しいけど、言ってることメチャクチャ怖いからね。それ理解しようね
静音	それで、恋人になったっていうのは本当なの？
和登	ごめんなさいごめんなさいせめて一思いに優しく殺して！！
静音	待ちなさいよ！　今の普通だったじゃない！　なんで一番怖がってるわけ！？
和登	いや、つい。普段のキャラに対するイメージといいますか……
静音	安綱、この前研ぎ直したばかりなのよ……試し切りって素敵よね……？
和登	今幸せの絶頂におりますもので、何卒お許しいただければと……
白子	貴様の幸せは私の不幸……美琴お姉様を汚した罪、万死に値する……
雅	殺さない程度で頑張ってシロちゃんっ
和登	いやいやいやいや！　完全に殺すつもりだからこの人！　万死とか言ってるから！！
大樹	いやあ、大変ですねえ
和登	完全に人ごとだよね、その言い方。ていうか、大樹までなんでここにいるっ
大樹	ただの見物人のつもりだったんですが、皆さんと同じように嫉妬の炎に塗れて攻撃しろ、というのでしたら
大樹	爆ぜろリア充！！
和登	いや、いいですごめんなさい。なんか、すっげえ心へし折れそうなので勘弁
静音	まったく。そういう関係になったらなったで、ちゃんと話しなさいよ。内緒にしてるからこんなことになるんじゃない
和登	いや、別に内緒にしようと思ってたわけじゃないんだって。そりゃまあ、あの美琴さんが相手なわけだから、あまりおおっぴらにしたくないとは思ってたけどさ
白子	ふええええええええんっ、お姉様が、お姉様がああああああああああああああっ
静音	その結果がこれなわけだけど
雅	シロちゃん、みこちゃんに命捧げてたもんね
大樹	本当の意味で捧げていた、というのも凄いものですね。これはこれで尊敬します
和登	……何があったところで、美琴さんと白子がくっつく、なんてのはありえないと思うけどなあ……
主人公	ガチな人って怖いなあ……。
白子	やかましいですわ、この泥棒猫！
和登	あれ？　この場合合ってるのか、その単語？
白子	あんなにも深く愛し合っていた、この私と美琴お姉様の仲を引き裂いた悪魔の手先！　憶えていなさい。早速帰り道で呪いの本を買って試してあげるわ！
静音	やめなさい。素人がやるとほんと危険だから
雅	でも、シロちゃんだったら執念で成功させちゃうような気もするかな
大樹	確かに。といいますか、間違いなくさせるんじゃないですか、これ？
白子	がるるるるるるるるるるるるるるるるるるう！！
白子	くすん……お姉様……あんなに深く繋がっていた私たちの愛は、一体どこにいってしまったのですか……？
白子	私に押し倒され、純潔を奪われまいと必死に抵抗していた、あの力強い愛……
和登	待てやおい
白子	私のファーストキスを頑なに拒み、あと一歩で脱がせられそうだった下着を死守し、この指で一番大切な唇へと触れようとした私を、全力の妖術で丸焦げにしたあの日……
静音	……美琴先輩、よくこれを傍に置いておく気になったわね
雅	みこちゃんの全力の妖術を受けて、まだ五体満足でいるって凄いよね？
大樹	今の発言、録音しておくべきでしたねえ。生徒会に対する武器として充分使えましたよ
和登	よかった……美琴さんの純潔が無事で、本っ当によかった……
白子	いいわけないでしょう！　美琴お姉様を女にするのは、この私のはずでしたのにい！
白子	返せ！　美琴お姉様の純潔を返せえ！！
和登	く、首揺するなあ！　ギブ！　ギブアーップ！！
静音	なんか、さすがに溜息つきたくなっちゃったわね。雅
雅	うん。落ち着いて、シロちゃんっ。それ以上やると、かずくんが絶頂しちゃう
和登	せめてっ、絶命って、言ってっ
主人公	さしもの白子も、雅の力には敵わず強引に俺から引き剥がされる。よかった……本気と書いてマジと読むレベルで死ぬところだった。
白子	ちっ、もう少しで事故を装って亡き者にできたのにっ
和登	いや、出来てないから……まーったく出来てなかったから……
主人公	ほんと、愛って怖いなー。
白子	ですが、さっきはちょっと驚きました
白子	あの美琴お姉様が、まさかあんなにも子供っぽいだなんて……
主人公	まあ、普段のしっかりした美琴さんを見てるとちょっととまどうよな、あの子狐モードは。
和登	失望したか？
白子	んなわけないでしょうが！！　私の心はもうきゅんきゅん全開で乙女回路が回りっぱなしですわよ！！
白子	んっはあっ。あの、かわゆい美琴お姉様を、抱き枕カバーの中に詰めて抱きしめて揉みしだいて嘗め回して絶頂させてみたいっ！！
和登	……いや、ほんとブレないねー、白子
雅	さすがの私もドン引きだよ
静音	調伏しちゃっても許される気がするけどどう？
大樹	とりあえず、動画サイトにでもアップしておきますか
主人公	俺としては、静音に一票！　俺の命のためにもっ。
静音	それで、本当に本当なわけ？　和登と美琴先輩が付き合ってる、っていうのは
主人公	目をハートマークにして、どこか見てはいけない世界を見ている白子を放置し、静音が少し呆れたような口調で言ってきた。
主人公	呆れている理由は分かる。だからこそ、俺はしっかりと言わないといけない。
和登	ああ、本当だよ
主人公	ハッキリと答えた俺に、それを聞いていた雅の表情が少し陰る。
主人公	正直に言えば、少し心が痛んだ。
主人公	幼い頃から、ずっと俺に対する気持ちを育んでいてくれた雅。掟に背いてまで俺を生き返らせ、それからも俺を守るためにずっと頑張ってきてくれた。
主人公	本当なら、その気持ちを俺は受け入れるべきなんだろう。いや、俺自身、受け入れるものだって思ってた。雅のことは、充分に好きだから。
主人公	だけど、俺は違う答えを出してしまった。
主人公	その答えを卑下するつもりはない。俺は、あの人の、美琴さんの気持ちを受け入れたことを誇りに思っている。
主人公	だけど、それでも……。
和登	……雅
主人公	俺は真っ直ぐに雅を見つめ、そのまま頭を下げようとした。それが、今の俺が雅に出来る、唯一のケジメだと思っていたから。
雅	おめでとう、かずくん
主人公	だけど雅は、そんな俺の気持ちを先回りしたかのように、笑顔で言い切った。
主人公	俺はその言葉に何を返すか一瞬迷い……そして、答える。
和登	ありがとう
主人公	これ以上はいらない。これ以上の想いを乗せれば、それは間違いなく雅をおとしめることになる。
主人公	すべてを呑み込んで、その上で俺を祝福してくれた雅に返せる俺の気持ちは、少なくとも今はこれしかないはずだ。
主人公	笑顔を浮かべることの出来た自分が、俺は何よりも誇らしかった。
主人公	屋上には、静音と雅の二人しかいなかった。
主人公	休み時間ももうすぐ終わる。けれど二人は、他の三人に頼んで先に行ってもらうと、この場に残っていた。
主人公	二人はフェンスに背中を預けたまま、ただ空を見上げている。
静音	……それで、あなたは平気なわけ？　雅
雅	うーん……どっちかっていえば、やっぱり平気じゃない、かな……
雅	だけどほら、かずくん、幸せそうだから
雅	だったら、ガマンしなくちゃな、って……
静音	……そっか。泣きたくなったらいつでも言いなさい、胸くらいは貸してあげるわ
雅	む……しずちゃんにケンカ売られたよ？
静音	なんでそうなるのよっ。まったくもう……
静音	でもまあ……確かに幸せそうだったわね、和登の奴
雅	うん。ずっと幸せのままでいてくれるといいよね
雅	ずっとずっと……私たちがおばあちゃんになっちゃっても、ずうっと……
主人公	それは、紛れもない雅の本心。心からの言葉。
主人公	和登のことを思うからこそのその言葉に、静音は静かに頷いた……。
