主人公	教室の中へと入った瞬間、一斉に視線が俺へと向けられた。
主人公	まあ、理由は分かってる。間違いなく昨日のアミアとの件だろう。あの模擬戦は関係者以外立ち入り禁止だったため、俺達以外は結果を知らない。
主人公	だからこそ、その結果を知りたいのだろうけれど、残念ながら、俺は他の誰にも言うつもりはない。
主人公	まあ、みんなの頭の中では、一瞬で俺が負けたことになっているんだろうけれど。
ラーロン	ほう、負け犬がやってきたか
主人公	そして、そんな中から予想通りの奴が前へと出てくる。
ラーロン	聞いたぞ。なんでも、あの小生意気な神族王女に勝負を挑まれたらしいではないか。さぞや愉快な負けっぷりだったのであろう
ラーロン	なんでも、その情けない負けっぷりを見られるのが嫌で、アミア＝ルゥムに泣いて頼んで闘技場を立ち入り禁止にしてもらったそうではないか
ラーロン	さすがは人族。いや、実に汚い。この『石清水の如きラーロン』と呼ばれし私からすれば、とても真似などできそうにない
主人公	本当に相変わらずだなあ。あの誰も呼んでない二つ名、いつもどうやって考えてるんだ？　まさか寮に戻ってからノート開いてにらめっこ、とかないよなあ。
ヴェル	最近私、ハデラの口上聞いても怒るどころか哀れにしか思えなくなってきたのよね……
紅	お、ヴェルもその域まできたか。流石に早いな
主人公	これはこれでかわいそうな気もしてくる。
姫	まあ俺の場合、元々大した評判あるわけじゃないからな。今更未確認の悪評が一つ増えたところで特に変わらないし
ヴェル	さすがヒメよね。心が広いのよ
紅	いっその事、『庭園の如き白鷺』とか名乗ってみるか？
ラーロン	あ、こら、下郎Ｂ　そんな良さげな名前を下郎Ａ如きにやるのではない！
主人公	……良さげなんだ。
ヴェル	それで、ハデラ。結局あなたは何がしたいのかしら。アミアと同じようにヒメに挑みたいなら、ヒメの魔法である私がお相手してあげてもいいけれど
ラーロン	え？　いや、その……決してそういうわけではなく……
ラーロン	神族なんぞの王女に負けたのだ。今まで以上に部屋の隅で俯いているのだなっ
主人公	結局、ヴェルの笑顔の迫力に負けたのか、そそくさと引き下がっていくラーロン。
紅	あいつ、姫がアミアに勝ったって知ったらどんな顔するんだろうな。言ってみるか？
姫	いいさ。別に威張りたくて戦ったわけでもないし、昨日のあれはアミアも楽しむための戦いで本気とは言いにくいしな
主人公	さすがに、胸を張って、勝ったなんて言いふらせない。
紅	なるほど。だけど、いくらラーロンが哀れだからって、よくヴェルもガマンしたな。いつもならもっと切れてるところじゃないのか？
ヴェル	そうね。でも、今日の私は機嫌がいいのよ。この素敵な気分をあんなバカのせいで落としたくないの
紅	今日、何かあるのか？
ヴェル	ふふーん。昨日、ヒメと約束したのよ。二人でデートって
紅	デ、デート！？　姫、お前いつの間に……
姫	いやあ、戦闘終わった後で言われまして。心配かけたお詫び、ということで
主人公	ヴェルに抱きしめられていた時、耳元で囁かれた言葉。
主人公	まあ、男として、ヴェルとのデートともなれば嫌なわけもないし。
主人公	こうもニコニコと笑ってくれてるヴェルの顔を見ると、俺のテンションも自然と上がってしまうなあ。
主人公	放課後、かなり楽しみだ。
