主人公	今日の時間の進みは本当に不思議だった。早いのか、遅いのか分からない。気がつけば一気に進むし、もうそろそろかと思えばまったく進んでいない。
主人公	自分の中で、緊張と期待とが混ざり合い、どうにも落ち着かない。
主人公	そうして、気がつけば昼休み。午後はこのままノート達との模擬戦になるから、今日の授業はもう終わりだ。
主人公	俺達はいつも通りに休憩室でウルルとオペラさんと合流していた。
ヴェル	ノートたちは来てないのね
ウルル	さっき一度来てましたよ。デイルさんやアミアちゃんとミーティングをするので、今日は別だそうです
オペラ	ノートさまたちも、さすがに本気のようですね。うふふふ。今日は久しぶりに血みどろの殺戮ショーが見られるかもしれません。主に白鷺さまの
姫	血まみれになるの、俺限定！？
ウルル	だ、だめですにいさまっ。血まみれなんかにならないで下さいっ
姫	本気で涙溜めながら言われると、そうなる運命なんだって気がして切ないなぁ……
オペラ	お望みとあれば、今すぐにでもっ
姫	目をハートマークにしながら言わないで下さい
紅	まあ、姫はいざとなればすぐ無茶するからな。レーヴァテインを受けようとしたみたいに。血まみれになっても仕方ないか
ヴェル	だ、ダメよ、ダメ、ダメ！　ヒメが血まみれになんかなったら、私心配で心臓どうにかなっちゃうものっ。思わずデイルのこと血まみれにしちゃう！
ウルル	……デイルさま限定なんですね……
オペラ	これが差別というものなんでしょうか……私、デイルさまに心の底から同情しました
ヴェル	差別じゃないわよ。区別だもん
姫	それはそれでヒドイな……
主人公	なんにしても、デイルのためにもできるかぎりケガしないようにしよう。
ウルル	でも、いよいよですね、にいさま
姫	ああ。ついに、だ
オペラ	その割には随分と落ち着いてらっしゃいますね
オペラ	もっとこう、どうしようヴェルえも～ん。鼻でスパゲティ食べたら許してくれるかなぁ、なんて感じを想像してたのですが
姫	そんな風になるくらいなら最初から受けませんって。大体そこまでヴェルに頼ってたら、情けなさ過ぎます
ヴェル	私は、もっとも～っと頼ってほしいんだけどなぁ
主人公	ちょっと不満そうなヴェルに思わず苦笑してしまう。そう言ってもらえるのは嬉しいんだが、俺にも男としてのプライドがありますもので。
紅	なに。今日は嫌でも頼りまくることになるさ
姫	ああ。色々と戦い方を考えてみたんだけれど、ノートだけはどうにもなりそうにない
姫	ノートの対策は、本当にヴェル頼みしかないんだ
ヴェル	ええ。ノートには悪いけれど、今日ばかりは完全に敵よ。必ず倒してみせるわ。ヒメの魔法の名のもとに
主人公	ヴェル＝セイン対ノート＝ルゥム。観客として見るならこれ以上ない一戦なんだけれど、さすがに見てる余裕はないよなあ。残念だ。
ウルル	でも、ノートさまを抑えられても、デイルさんもアミアちゃんも強敵ですよね
オペラ	はい。どちらも三階級相手ですらトップクラスに入れるレベルですね。多少の相性はありますが
オペラ	私なりに戦力差を計算してみたのですが、非常に申し上げにくく心苦しくて心臓も痛く後ろ髪を引かれるような気持ちで涙を飲んで提言させていただきますと
姫	いえ結構です。もう分かりました
オペラ	ええーっ。本当に一生懸命に計算したんですよぉ
姫	その言い方されて結果聞きたがる人なんていませんっ
主人公	どう考えても結果が見えすぎてるでしょうが！
紅	あはは……さすがにそこまで言い淀むような結果というのは……
オペラ	くすん。コーヒー飲みながらウルルさまの寝顔愛でつつ片手間で頑張った私の努力……
主人公	それ、努力っていうのかなあ。
ウルル	でも、それだけ大変な戦いなんですね……
主人公	そんなオペラさんの発言を、ウルルはかなり本気で受け止めたらしい。その純粋さは可愛いんだけど、オペラさん相手にする以上、もう少し疑うこと覚えような、ウルル。
主人公	ウルルは、しばし真剣な表情で考えると立ち上がった。そして、そのまま俺の後ろへとやってくる。
姫	どうした、ウルル？
ウルル	にいさまは、そんなに大変な戦いに挑むのにウルルは何もできません
主人公	ウルルは言うと、ちょっと恥ずかしそうにもじもじと身体を揺らす。
ウルル	で、ですからせめて、ウルルから、にいさまに祝福ですっ
主人公	次の瞬間、俺の頭はウルルに優しく抱きしめられていた。その胸に、ぎゅっと押しつけられる。
オペラ	ウルルさま、いったあああああ！
ヴェル	あーっ、ウルルずるいっ
紅	ウ、ウルル？　何をいきなり……
主人公	女性陣から驚きの声が上がる中、俺もまた、突然ことに戸惑っていた。
主人公	ちょっと小さめではあるものの、柔らかい膨らみがしっかりと俺の頭を受け止めている。
ウルル	え、えへへ。いかがですか、にいさま。その、気持ちいいです……？
主人公	はにかむように笑いながら、俺をしっかりと抱きしめているウルル。胸の感触自体はすこぶる気持ちいいんだが……。
主人公	やっぱりこういうことに慣れていないのか、抱きしめる腕に力が入りすぎていてちょっと痛い。
姫	いや、その……もちろん嬉しいんだが、少しだけ力緩めてもらえると……
姫	ちょっと痛くて
オペラ	ですよねえ。ウルルさま、そんなちっちゃなものに無理やり押しつけたところで、相手は痛いだけですよ
ウルル	うにゃっ！
主人公	狙っていたかのような、オペラさんの右ストレート。いや違う。かのような、じゃなくて完全に狙っていただろこの人。
姫	い、いや、そんなことないぞ、ウルル？
姫	俺が言ってるのは、あくまでも腕の力のことで……
オペラ	人には骨、というものがありますから。柔らか～い女性の象徴たる、ぼいんぼい～ん！　が無ければ、少々キツイかと
オペラ	白鷺さまも、ガマンしない方がいいですよ。午後には試合もありますし、痛いものは痛い、と言ってしまった方が
ウルル	そ、そ、そんなこと、ないよ？！
ウルル	ウルルのお胸、ふっくら柔らかで、男の人にも大好評だよ！？
主人公	いつどこでどんな男に好評だったのかは、この際聞かない方がいいんだろうなあ……。
主人公	などと思っていると、
姫	むぐっ！
主人公	更に強くなったウルルの腕が、より一層俺の顔を胸へと押しつける。
ウルル	ど、どうですか、にいさま。ウルルの柔らかお胸ですよ
ウルル	にいさまのお顔を思いっきり包み込んで、全方向からしっかり気持ちよくしちゃいますよーっ
姫	んぐっ！　んむっ！　んー！
オペラ	ああ、ウルルさま……おいたわしい……
ウルル	そ、そんなことないですよねーっ。ウルルのお胸、気持ちいいですよねっ。にいさまに喜んでもらえてますよねっ
ウルル	にいさまの呼吸に、ちょっぴしばかしウルルの方がくすぐったい感じなんですけど、これってにいさまが気持ちよがってる証明ですよねっ
紅	なあヴェル。止めた方がいいんじゃないか？
ヴェル	それはヤボっていうものよ紅。ウルルが女性としての尊厳を賭けているのに、それを私たちが邪魔しちゃダメ
紅	そ、そういうものか……？
姫	んー！　むー！　んぐー！！
主人公	息が、できない。正直苦しさの方があらゆる感覚を上回っており、もはや痛いも気持ちいいも何もなかった。
姫	！！！！！！！！
主人公	もはや限界。俺は右手で椅子を叩いてタップする。ギブアップ。ヘルプミー。
オペラ	一ラウンド、５分２８秒、勝者、うるる～かじゅたー！！
ウルル	あううー。ひどいですにいさまー
オペラ	さすがはウルルさま。勝因は間違いなく、その愛らしさと可愛らしさと哀れみと悲しみをと併せ持つ、おっぱい！　ですね
ウルル	うう……今日から牛乳の量増やします……
オペラ	いけませんウルルさま。急激な牛乳の増量はお腹を壊します。そもそも、おっぱいおっきいウルルさまなんかウルルさまじゃないやい。ぷんぷん
主人公	いやあの……主従漫才はいいので……早く、助けて……。
姫	ぜぇ……はぁ……死ぬかと、思った……
主人公	ギリギリのところでなんとか開放された俺。危なかった、もう少しで顔も名前も知らないご先祖様と、川の向こうでご対面するとこだった。
ウルル	ううう、ごめんなさい、にいさま。ウルルのお胸がダメダメなせいで……
主人公	いや、今回の原因はそういうことではないんですけれど。
ウルル	で、でもでも、ウルルがんばりましたよね？　ウルルのお胸、男の人にも喜んでもらえますよね！？
主人公	必死なウルルの質問に、みんなの視線がその胸へと集中する。
ウルル	ちっちゃくたって大丈夫ですよね、ヴェルさまっ！
ヴェル	えっとぉ……が、頑張ったんじゃないかしら……？
ウルル	なんで語尾が上がるんですか！？
ヴェル	ま、まあほら、個性ってあるわよね。みんな一緒だったらつまらないし、好みもそれは人それぞれで……そうよね、紅っ
主人公	明らかに逃げるためのキラーパス。いきなり渡された紅は、急にパスが来たから、とワタワタしながら必死に返しを考える。
紅	ウ、ウルルの胸は胸でいいんじゃないかなあ、うんっ
紅	そ、そういうのが好きな特殊な男の人っていうのもいるだろうしっ
ウルル	特殊……
オペラ	ウルルさま……おいたわしや……
ウルル	おいたわしくないもんっ。同情なんていらないもんっ
主人公	抗議をしつつ振り返ったウルルの先にあったのは、
オペラ	ふふーん
主人公	両腕で持ち上げられ強調された、どっかん、という感じのドヤ顔だった。
ウルル	ふぎゃあーーーーーっ！！
オペラ	ウルルさま。ああいうものはですね、それなりに選ばれた者だけが行えることなのですよ
オペラ	たとえば、私とか白川さまとかっ
紅	ひ、人の胸を指ささないでくださいっ
オペラ	でもほら、どっかん、ときて、ぼっかーん、ってなって、ぽよよよよ～ん、って感じじゃないですか
主人公	どういう意味かはさっぱりなのに、どういうことかは伝わる気がするから不思議だ。
ヴェル	あの、オペラさん？　今の、私は入らないのかしら……？
主人公	笑顔を引きつらせながらも尋ねてくるヴェルに、オペラさんは少しだけ視線を送ると、
オペラ	残っ念！
主人公	両手で大きくＸを描いた。
オペラ	ヴェルさまのは、形と感度と柔らかさはよさげなのですが、なんと申しましても……
オペラ	ちょーっと大きさが足りませんねえ。いや、決して小さくはないのですけれど、決して大きくもないという
ヴェル	が～んっ
ヴェル	そ、そうなのヒメ！？　私の胸だと足りなかったの！？　満足できなかったの！？
ヴェル	挟んであげたり埋めてあげたりお風呂でスポンジ代わりにしてあげたりできないとダメなの！？
姫	ダメとかいう以前に、とりあえず落ち着こうなヴェル。女の子として捨ててはいけない何かがこぼれ落ちつつあるぞ
主人公	……この子は、追い詰められると本気でメチャクチャになる欠点があるなあ。
紅	ち、ちなみになんだが……姫は、今ウルルがやったみたいにされるのが好きだったりする、のか？
姫	う……
主人公	チラリ、と恥ずかしそうな横目で尋ねてくる紅。
主人公	その目の奥に輝く期待の光が、ここでごまかすことを許してくれそうになかった。
姫	そりゃまあ、男だったら誰だって……
紅	そ、そうか、やっぱりそうなのか。そ、それじゃあ、あれだ。もし今のであまり満足できて……いや、祝福が足りないっていうんだったらっ
紅	な、なんだったら、その……あたしがしてやってもいい、ぞ……
主人公	さっきオペラさんがやっていたように、組んだ両腕で恥ずかしそうに胸を持ち上げる紅。うっわぁ、これ間違いなく凶器。ていうかむしろ狂気。
主人公	思わず見とれそうになった上、唾まで飲み込みそうになってしまうが、俺はどうにかその悪魔の誘惑を振り切った。
姫	そうだな。そいつは本気で魅力的なんだが、また今度にさせてもらうよ
姫	今日は、ウルルからの祝福をもらったし、それで充分だ
ウルル	に、にいさまっ
主人公	ありがとう、と微笑み返す俺に、ウルルの目がキラキラと輝く。
主人公	いや、そこまで感動されても……。
ウルル	はいっ。やっぱりウルルにはにいさましかいませんでした
ウルル	ウルル、思いっきり全開で祝福サービスしちゃいますっ
姫	むぐーっ！！
主人公	またか、またなのかー！！
主人公	幸せな感触と共に襲いかかる痛みと苦しみ。いやまあ、他の男子から見れば、俺が憎くてたまらないとは思うのですが……。
主人公	でもやっぱり、命の方が大切だと思うのです……。
