男	あーっはっはっはっはっは！
男	おいおい、面白いことやってんじゃねえかよ。出来たら、俺も混ぜてくれねーか？
姫	え？
主人公	突如響いた太い男の声。戦いの最中であるにも関わらず、それはまるで魔法の効果でもあるかのように、俺達の意識を集めていた。
主人公	体格のいい、巨大な剣を持つ男。そしてその背後で笑顔を浮かべている、小柄な少女。
アミア	え？　何？　誰あの二人……
主人公	アミアの疑問に対する答えはなかった。そこにいるのが当り前、そんな笑みを浮かべ、ごく普通に歩いてくる二人に、俺達は動けない。
バリアリーフ	あなた方、何者ですか！　どこから入ってきましたの！
主人公	だが、そんな二人組を遮るように、先生が俺達との間に割って入る。
大男	そう固いこと言うなって、バリア姉さんよ。なあに、ちょっとばかし遊んでみたくなっただけさ
バリアリーフ	バ、バリア姉さん！？　あなた、失礼ですわよ！
少女	そうですよお父様。昔はともかく、今は初対面のようなものなんですから
少女	女性に対していきなり、姉さん、は少々失礼です
大男	そんなもんなのか？　いやすまねえな、女の扱い方ってのだけはどうにも苦手でよ
大男	思い出すねえ。あいつにもずっと文句言われてたっけか
大男	ま、そんなわけだから、大目に見てくれや、バリア姉さん
バリアリーフ	……どうやら、少しばかり痛い目を見なければ分かっていただけないようですわね……
主人公	明らかな怒気をその言葉に含ませながら、先生が愛用の鞭を握る。滅界戦争では魔族狩り、とまで呼ばれたほどの、竜族において最強クラスの戦士の鞭だ。
主人公	だが、そんな先生の行動に対しても二人の態度は少しも変わらない。ただ楽しげな笑みを浮かべながら、真っ直ぐこちらへと歩いてくる。
主人公	その歩き方は粗雑のようでいて、少しもブレがない。
主人公	そもそも、この学園のセキュリティは並大抵のものじゃない。すべての世界の技術と知識の集合だ。無関係な人間が、そう易々と入ってこられるわけがない。
主人公	恐らくはそれを知っているのだろう。観客席の方も、相当どよめいている。
主人公	だが、それでもこれ以上の警備が動かないのは、学園長達が先生のことを信頼しているからだろう。下手に人数を投入すれば、先生の動きを遮りかねない。
紅	おい、姫、あの二人……
姫	ああ、とんでもなくできるぞ……ヴェル
ヴェル	分かってる。いざという時は、二人とも私の後ろに
主人公	俺達と同じことを考えているのか、ノート達の方も構えつつ様子を見ているようだ。
バリアリーフ	止まりなさい！　それ以上進むのであれば、強制的に排除致しますわ！
大男	あっはっは！　そうだ、そうでなきゃバリア姉さんじゃねえよな！
大男	ミヤ、よく見ておけよ。この人が、あのバリア姉さんだ。もんのすげえんだぞ、いやほんと
少女	はい。ですがお父様、あまりやりすぎないで下さいね
大男	そいつは約束できねえなあ。手を抜いたりしたら、こっちが痛い目みちまうからよ
バリアリーフ	いいでしょう。その言葉、敵対するものとみなします！
主人公	小さな叫びと共に、先生の腕が動いた。わずかに手首が動いただけにしか見えなかったのに、鞭が大きく前方へと舞う。
バリアリーフ	あなたが何者かは分かりませんが、学園への無断での進入、それだけで処罰の理由は充分です！
主人公	そのまま、前方へと踏み込みながら手首を返す。翻った鞭が、小気味よい音を立てて地面を叩いた。
姫	かわした！？
主人公	百発百中の精度と速さを誇る先生の鞭が、今確かにかわされた。大男はその身を半歩ずらしただけで、あの鞭をかわしてみせた。
主人公	そして、再び先生の鞭が舞う。連続で繰り出される必殺の一撃を、けれども大男は、やはりすべてかわしきってみせる。
大男	百発百中ってのも考えもんだぜ、バリア姉さん。必ずそこに来るなら、少しずらすだけでもかわせちまう
バリアリーフ	ええ、もちろん分かっていますわ。ですから、わざとかわさせたのです！
主人公	気合いとともに放たれる鞭の一撃。大男は再び身体をズらすが、瞬間、鞭が伸びた。
主人公	いや、違う。今までの攻撃が、わざと短く放たれていたんだ。実際の長さを隠してみせるために。
主人公	つまりはすべて、この一撃のための布石。
大男	うお！？
主人公	叩き付けるためでなく、捕らえるために放たれたそれは、大男の腕へとしっかり巻き付く。同時、先生は思い切りそれを引いた。
主人公	竜族の力で引かれたそれは、大男の巨体すらをも容易く引き寄せる。
主人公	体勢を崩されたまま、問答無用で先生の間合いへと引き込まれる大男。先生の手から鞭が離れ、そこに力強く握られた拳が残る。
主人公	そうだ。竜族にとっての最大の武器は、その拳。武器を持つのは、手加減するためだと言う。
主人公	相手は人族。竜族の全力の一撃を耐えられるほどの防御力はない。
バリアリーフ	ベッドの上で、ご自分の浅はかさを後悔なさいな！
主人公	ドズン、と地面が揺れた気がするほどの踏み込みと共に放たれた拳は、大男の身体を、そのまま地面へと叩き付けていた。
デイル	ヒュー。さすがにすげえな。相当な手練れのはずなのに、一撃かよ
ノート	さすがは先生ですね。思わず見とれちゃいました
アミア	てゆーかさー、生きてる？　あのおっちゃん
紅	全力、に見えたよな、最後の。頭蓋骨とか砕けてるんじゃないか？
ヴェル	……頭蓋骨ですめばいいけど……最悪、中身まで？
姫	あまり想像したくないぞ、それは……
バリアリーフ	安心なさいませ。ちゃんと手加減はしていますわ。あくまで、死ななければいい程度ですけれど
姫	それ、手加減……？
主人公	先生の恐ろしい一言に、俺達全員の顔が青ざめた。
バリアリーフ	さて、このような結果になったわけですけれども、あなたはどうしますの？
主人公	もう一人残った少女に向かって、やはり睨み付けるように言う先生。
主人公	たった今、あれだけの光景を見たにも関わらず少女は平然と笑ったままだ。
少女	だそうですが、このような結果なんですか、お父様？
大男	がーはっはっは
バリアリーフ	な！？
主人公	少女の質問に答えるように、いきなり、それも元気よく笑いながら大男が起き上がる。
主人公	あの一撃を食らって、平然としてる！？
アミア	もしかして、化け物！？　あの、おっちゃんっ
デイル	バカ言うない、ちび姫さん！　化け物程度ならさっきので沈んでるって！
主人公	まったくもってデイルの言う通りだ。正直言って、生きてることすら驚いていいくらいのレベルだぞ！
大男	いや、さすがはバリア姉さん。一度食らったことのある技じゃなかったら、やばかったぜ
少女	充分やばいですよ。血まみれです、お父様
大男	なに、まじか？　そいつは参ったな。帰りにレバーと牛乳でも買ってくか
少女	動かないで下さいね、今拭きますから
バリアリーフ	……なるほど。少々読み違えましたわね
バリアリーフ	どうやら手加減どころか、全力で殺しにいくくらいでなければいけなかったようですっ
主人公	先生が、再び拳を固める。いや、学園内でさすがにそれはやばいのでは？　と言いそうになるものの、あの一撃をくらっておいてこれならそうするしかないか。
大男	そうだな。久しぶりにバリア姉さんの凄いところも見せてもらったし、俺も成長したところは見せなきゃいけねえか
少女	はい。それが礼儀というものですよ
大男	おっしゃあ！　それじゃあ、行くぜ！
主人公	ズン、と何気なく一歩を踏み出し、何も考えずに先生へと歩いていく大男。
主人公	その手に、その背丈よりも長い長剣を手にしながら、構えることもなく真っ直ぐに歩いていく。
バリアリーフ	竜族に対し、何の工夫もなく正面から挑みますか。無謀、としか言いようがありませんわね
バリアリーフ	ですが、良しとしましょう。そのような胆力を持つ者、あの戦争以来久しく見ておりませんもの
大男	いくぜえい！！　根性刀、全開！！
主人公	大男の手にしていた剣が、グンッ、とその長さと幅を増す。あの剣、恐らくは儀式兵器か。それも、魔力や使い手の精神エネルギーを刃にのせるタイプみたいだ。
バリアリーフ	この近接の間合いで剣を伸ばすとは笑止千万ですわよ！
主人公	伸びることで、逆に近接戦で扱いにくくなった剣を、それでも大きく振りかぶる大男。あの巨大な剣を易々と振りかぶるというだけで、その強さは充分に分かる。
主人公	しかも振り下ろされるその剣速は、あのノートよりも速い。
主人公	だが、その最速の一振りを、先生はかわしてみせる。そのまま一歩、大男の懐へと潜り込むと、今度はその腹へと、竜の一撃を突き入れた。
バリアリーフ	な？！
主人公	だが、その必殺の一撃を大男はかわしてみせる。あの距離、あのタイミングで放たれる竜族の一撃をかわせる人族。そんな存在、本当に人間か！？
主人公	それだけでも信じられないというのに、よりにもよってその大男は、先生の腕を左腕で掴むと……そのまま片手で大きな半円を描きつつ、先生を地面へと叩き付ける。
バリアリーフ	ぐうっ！！
姫	効いた！？
主人公	気鱗によって守られているはずの先生の顔が苦痛に歪む。
主人公	先生レベルともなれば、その気鱗の防御力も相当だ。にもかかわらず、地面へと叩き付けられただけで、あれほどのダメージを受けた！？
主人公	そして、大男の攻撃は、それだけでは終わらない。
主人公	左腕で先生を投げつけた大男は、その勢いを利用して、今度は空いている右手を……その手に持っていた大剣を、そのまま同じような半円を描かせ、先生へと叩きこんだ。
バリアリーフ	が、はぁっ！！
大男	必殺、星潰し！！
主人公	先生を片手で投げる膂力だけでも充分おかしいのに、なんだ、今の技……。
主人公	懐に飛び込む勢いを利用して、先生をそのまま遠心力の力で地面に叩き付ける。そしてそのダメージで動けなくなった先生に、やはり遠心力の乗った大剣を叩き込む。
主人公	投げによるダメージ。大剣によるダメージ。大剣と地面に挟まれたことによるダメージ。そのすべてが、遠心力の勢い付き……。
主人公	そもそも、そのすべてをあのタイミングで、片手で放つって、どういう身体能力をしているんだ……。
大男	ああ、安心していいぜ。この技は力と勢いで叩き潰す技だからな、刃はついてねえ
大男	ま、気鱗の防御は無意味だが、バリア姉さんだったら、死にはしねえだろ。がっはっはっは
主人公	愉快そうに笑う大男。
主人公	あのバリアリーフ＝クリートをこうも容易く倒す戦士。
主人公	闘技場にいた俺達は、誰も動けなくなっていた。
少女	ご安心下さい。私たちは、ただ楽しみにきただけです
少女	ここにいる、白鷺くんたちとの戦闘を、心ゆくまで
少女	なお、観客席にいるみなさんは、決して動かないで下さいね。もし動いた場合には、私たちの邪魔をするものとして、この場にいる全員を攻撃対象とします
少女	ですが邪魔さえしないのでしたら、この戦闘が終わり次第、私たちは立ち去りますから
主人公	笑顔で語られるその言葉に、今すぐにでも踏み込もうとしていた警備員や教師達の動きが止まった。
主人公	誰か一人でも邪魔すれば全生徒が攻撃対象。だが、何もしなければ、俺達との戦闘だけで帰る。この天秤は難しい。
主人公	無論、何もしないということはないだろうけれど、突入のタイミングやその方法は、余程しっかり練らないとまずいだろう。今すぐの突入は無理だ。
姫	目的はなんだ……あんたほどの戦士が、なんで俺達なんかとの戦闘を望む……
ゲン	なあに、簡単なことよ
ゲン	未来が欲しいからさ
主人公	男の放った言葉に、俺は本当の恐怖を感じた。
