主人公	部屋の中は静寂に包まれていた。
主人公	女子寮に入れないデイル以外の全員が、この一つの部屋にいるにも関わらず、誰も口を開こうとしない。
主人公	闘技場での戦いの後、カミシアから剪定者に関する説明を聞いて、みんなただ唖然としていた。
主人公	何を言っていいのか分からないのか、そもそも、その話を信じていいのかすらも分からずに言葉を失っている、そんな感じだ。
主人公	いや、気持ち的には当然否定したいんだろう。そんな突拍子もない話、信じられるわけがない。
主人公	けれど、さっきの戦いの中で浮かび上がった過去の三つの扉の記憶が……。
主人公	そして、実際に味わったミヤとゲンの実力が、それが事実だっていうことを示してしまっている。
主人公	俺だって、あの不思議な世界でのカミシアやミヤとのやりとりがなかったら、きっと信じられないだろう。
主人公	けれど、今ははっきりと分かってしまっている。俺の中に、すべての記憶が経験となって戻っている。
主人公	アミアとの勝負の中で出せた力も、三つの未来の中で培った経験によるものなんだろう。
主人公	俺は目の前にいる少女へと視線をやった。
主人公	カミシア。あの不思議な世界の中で、俺の前に現れ、そして俺を剪定者として巻き込んだ不思議な少女。
主人公	ミヤやゲンと敵対していたけれど、まさかあのローブに隠された正体が……。
カミシア	ん？　どうかした、パパ
主人公	何を言っていいか分からずその顔をジッと見ていた俺に気づいたのか、カミシアは俺を見ながら小さく笑った。
主人公	その笑顔には、確かにあの面影がある。
主人公	あの、シャルの面影が。
姫	いや、その……
主人公	今ままでに見てきた三つの扉。三つの世界。三つの未来。その情報が頭の中で複雑に絡み合い、何を言っていいのかが分からない。
主人公	そもそも、この子、カミシアを、本当にシャルと認めて信じていいのか、それすらも分からない。
主人公	あの可能性の世界では、少しもそんなそぶりを見せていなかったのに……。
主人公	そして、今この部屋にいるみんなも、同じような疑問を抱いているのだろう。困惑した表情で、カミシアへと視線を送っている、
ヴェル	……とりあえず、このまま黙ってても時間の無駄ね
主人公	そんな空気に嫌気が差したのか、ヴェルは立ち上がるとカミシアの正面に立った。
ヴェル	はっきり言って、聞きたいことだらけで何から聞けばいいのかも分からないんだけれど……
ヴェル	剪定者とかいうものの話は分かったわ。正直、信じることの方が難しいけど、私の中にある記憶がそれを許してくれそうにないもの
ヴェル	その記憶が本物だっていう確信もないけれど、ヒメがそれを受け入れている以上、私も受け入れることにする
ヴェル	ただ、これだけは確かめさせて。カミシア、って言ったわよね
ヴェル	あなた、誰なの？
カミシア	さっき言った通りだよ、ヴェルママ。私はカミシア。シャル＝ルトルだった者
ヴェル	……それが分からないから聞いてるのよ
ヴェル	だった、ってどういうこと？　少なくとも、私の知ってるシャルはあなたよりも全然年下よ。性格だってそんなにすれてない
カミシア	すれてる、か……やっぱりパパ以外には厳しいな、ヴェルママは
カミシア	まあ、否定はしないが
主人公	カミシアは言うと、くっくと小さく笑った。はっきりと言われた割には、特に不快にも思ってないみたいだ。むしろ、そんなヴェルの性格を心地よく思ってるみたいな。
カミシア	正解を言うならば、私は、シャル＝ルトルが生きていたなら、という可能性が具現化した存在だ。つまり、未来のシャル＝ルトルの姿、だな
ヴェル	……未来から来た、とでも言うつもり……？
カミシア	少し違う。私が来たのはすべての時間と未来とが交わった世界。可能性の世界だ
カミシア	未来というものは定められていない。そこに行くまでには、いくつもの選択肢があり、その結果として一つの未来が定められる
カミシア	本来なら、一つ一つの選択肢による影響はそれほど大きくはない。だがそんな中、希に、歴史の分岐点ともいえる大きな選択肢が発生する
カミシア	最近で言うなら、戦争が終わるか続くか、だな。そんな大きな選択肢の答えを決める者が剪定者と呼ばれる
カミシア	けれど、剪定者が選ぶにしろ選ばないにしろ、そのすべての選択肢の先には未来がある。選択肢ごとに違った未来が
カミシア	それはつまり、可能性があるということだ。どの未来にも、剪定者に選ばれ本当の未来になる可能性がある
カミシア	そんな可能性のすべてを集めた世界が、パパや私たちがいるこの世界の更に上位に存在している。それが、可能性の世界
カミシア	私は、そこから来た。シャル＝ルトルが死ぬことなく生きて成長したら、という可能性の未来から
主人公	そのあまりにも突拍子のない説明に、誰もが目を白くしていた。
主人公	どこかおかしいんじゃないか。そう言いたげな視線が、カミシアへと集まっている。けれど誰も言うことができない。否定ができない。
カミシア	そして、そんな私と対照的な位置にいるのが、あのミヤだ。あいつも、どこかの未来で死ぬ運命を持っている。もちろん、生き残る未来もな
ノート	あの、待って下さい。それって、もしかして……？
カミシア	うん、ノートママは察したみたいだな
カミシア	そうだ。私が生き残る未来ではミヤが死に、ミヤが生き残る未来では私が死ぬ。両方が生き残る未来はない
カミシア	これは一種のゲームなのさ
カミシア	私とミヤ、どちらの可能性が生き残るのかを賭けた、いつ誰が始めたのかも分からない無意味なゲーム
カミシア	この世界の未来の可能性、その可能性に生死を左右される二人が、自らの生存のために導き手となって、互いの生き残る未来を剪定者に選ばせようと競い合う
カミシア	それが私たちのやってきたこと。ママたちが取り戻した記憶は、今回のゲームで与えられた、こことは別の可能性での記憶だ
ヴェル	……何バカなことを……とは言えないわね
主人公	ヴェルは小さく溜息をつくと、呆れたように苦笑した。
ヴェル	それで、もしヒメがこの扉を生み出すことが出来なかったら、あなたは死んでいたっていうわけ？　シャル……いえ、カミシア
カミシア	ああ、そうだよヴェルママ。もしこの扉がなければ……剪定者……パパは今までの三つの扉から未来を選ばなければならなかった
カミシア	そうなれば、もちろん私という可能性は消滅していた
ノート	そして、同時にこの中の誰かが死ぬ未来になっていた……というわけですね……
主人公	その結末を記憶の中から思い出し、誰もがうつむく。
主人公	それと同時に、俺の頭の中にも鮮明な映像が浮かび上がる。三つの扉、それぞれの未来の中で死んでいった、彼女たちの姿が。
ノート	あの……この記憶は……やっぱり真実だっていうことなんですよね……
主人公	そして、それはみんなも一緒だったんだろう。
ノート	ボクが……
主人公	力なく俯き、そっとその手を見るノート。
主人公	無理もない。あの記憶が蘇ったっていうことは、憑依兵器のことや学園長を手にかけてしまったことまで思い出したっていうことだ。
主人公	より多くの人を守るためだったとはいえ、そんな記憶、辛いに決まっている。
ノート	ボクが……
ノート	ボクが……姫くんとあんなこと……え、えへへ
姫	待てノート！　今どのあたりの記憶を見返してる！？
ノート	えへへへ♪　その、ボクの部屋のと、街の広場と、教室のはその……だ、だめです。ボクから見せたりして……
主人公	顔を真っ赤にして、恥じらうように両手の指先を合わせるノート。いや、確かにその記憶は間違っていませんがっ。
ヴェル	わ、私にだってあるもの、その記憶っ。ヒメにいっぱいい～っぱい愛してもらっちゃったんだから！　部屋とか学園の養護室とか！
姫	って、ヴェルも張り合わないでくれ！
紅	あ、あたしだって！　外でばっかりだけど……
ウルル	ウルルもありますっ
アミア	えっへん。なにを隠そうわたしだって
オペラ	……白鷺さま
姫	……いやその、なんといいますか……
オペラ	つまり、私も含めてここにいるカミシア様をのぞいた全員と関係がある、ということですね
姫	……はい
主人公	決して遊びでとかではなく、どの時にもそれなりに理由があって本気だったわけだけれど、こうして突きつけられるとさすがに……反省……。
オペラ	さすがは白鷺さま……鬼畜♪
姫	うっわ、すごい笑顔……
オペラ	いえいえ、据え膳食わぬはなんとやら。求められたら躊躇せずにぱっくりいっちゃいませんと。それでこそ男の子！
オペラ	ああ……白鷺さまに身も心も蹂躙された、あの時のよ・ろ・こ・び♪
カミシア	さすがだよねえ、パパ。上はオペラさんから下はアミアちゃんまで。２００歳近い範囲があるよ？
オペラ	シャラーップ、小娘！　それではまるで、私がと～っても年長者、みたいに聞こえちゃうじゃないですか。いやん
アミア	うわー……オペラさん、さすがに今のはあざといんじゃないかなあ……肯定したも同じだよ
オペラ	まだ三桁にすら満たない子供が何ほざきますか。竜族の年齢からみれば、アミアさまなんて子供どころか幼女です。うっわ、白鷺さまってペド？　さいてー
紅	オペラさん、その開き直りはさすがに……
アミア	でもさあ、カミシアちゃんのことはとりあえず分かったけど、それじゃああの二人は結局何がしたいの？
主人公	そんな空気の中、不意にアミアが首を傾げる。
アミア	お兄ちゃんが、その剪定者ってやつなんでしょ。だったら、他の扉を選ぶわけないじゃん。この扉が生まれた時点で、もう敗北確定なんじゃないの？
主人公	アミアの意見はもっともだ。カミシアがシャルだというなら、シャルが死ぬ未来を俺が選べるわけがない。
カミシア	だったら、それ以外選べないようにしてやればいい
主人公	さらりと言ってのけたカミシアに、全員が、あっ、と小さく声をあげた。
カミシア	パパがその可能性を選びたくても選べないように、他の可能性よりも哀しい結末にしてしまえばいい。簡単なことだ
カミシア	実際、他の可能性でも、奴らは似たようなことをしている
カミシア	予定通りの未来に少しでも早く辿り着くように、魔剣を強引に発覚させたり……
カミシア	本来の未来で死ぬはずだった人が生き残ったなら、自ら、その人を襲いにいったり
主人公	二つ目、ウルルの扉を思い出す。
主人公	あの時、ミヤはウルルとフォンを直接その手にかけようとしていた。本来なら、死んでいたはずだからと。
ウルル	二つ目の扉で、ウルルとフォンさんを襲ってきたのは、そういうことなんですね……
カミシア	そういうことだよ、ウルルちゃん。あの扉では、本来二人とも死ぬ予定だった。それが死ななかったのは、パパの予想外の奮闘のせいだ
カミシア	あいつがやろうとしたのは、予定通りの未来に近づけること。そうすれば、その扉の未来は安心して残せるものになる
カミシア	パパに……剪定者に安心して選ばせることが出来るものに
ヴェル	なるほど。あなたと、あのミヤについては分かってきたわ。だけど……あのゲンって男は何者？
ヴェル	滅界戦争を終結へと導いた勇者……なのに誰もあいつのことを覚えていない
ヴェル	それに、私やノートの全力すら通じなかった、あの力。魔力の霧散化。あんな能力、今まで聞いたことすらないわ
カミシア	……あらゆる物理以外の力の霧散化。それが奴の能力だ
カミシア	どこでどうやってそんな力を得たのかは、私も知らない。だが、奴の能力は、魔力の霧散化なんて生やさしいものじゃない
カミシア	ウルルちゃんも、オペラさんも、さっき味わっただろう。奴が、竜族の気鱗すらも吹き飛ばしたのを
カミシア	あらゆる魔法と魔法による効果を無にし、気鱗のような特殊な能力すらをも無効化し、ただ己の実力のみで戦う。それが、あのゲンだ
カミシア	そして、その実力も、勇者、の二つ名は伊達じゃない
カミシア	魔力を封じられた魔族や神族でどうにかなるものではないし、気鱗がなければ、竜族の防御力だってそこまで警戒するものでもない
カミシア	魔法に気鱗。そういった力に頼ることを前提とした今の世界においては、まさしく最強。無敵の存在だよ
主人公	カミシアの説明に、俺達は言葉を失った。
主人公	確かに、魔族や神族は魔法による破壊や強化を前提に戦うし、竜族だって、どれほど身体能力が高くても、気鱗が無ければ防御は人族とあまり変わらない。
主人公	そして、俺達人族も、儀式兵器による魔法を使っての戦いが主流だ。
主人公	そういった特殊な力を無しにして、戦闘技術のみであの人に勝てる存在なんて……。
ウルル	オペラ、戦争の時に一緒に戦ってるんだよね。本当に、あの人なの？
オペラ	……そうですね。勇者様という存在に関しては確かに私も覚えています。勇者様が何をやったのか、それも思い出せます
オペラ	ですが、その勇者様が誰だったのか、どんな人物だったのか……その個人情報になると途端に何も思い出せなくなるんです
オペラ	封じられただとか、忘れただとか、そんなレベルではありません。頭の中から根本的に情報がなくなっている感じですね
オペラ	ゲン……本当に彼があの勇者様なのか、私には判別できません。確かに、あの強さそのものは本物だと思いますが……
主人公	オペラさんには珍しい、自信なさげな口調。あのオペラさんがここまで言う以上は、本当に記憶の中にないんだろう。
主人公	そんなオペラさんの言葉に、みんなが疑念の色を瞳に浮かべるが、紅が恐る恐るその手を挙げた。
紅	すまない……あたしが言えることじゃないのかもしれないが、それでもあの人は、確かに勇者だったと思う
紅	わずかな期間でも、あの人と一緒に行動して、技を学んで、そして感じた
紅	あの人は真っ直ぐだ。堅い信念を持って、真っ直ぐ突き進む
紅	けれど今は、何かの目的のために自分の進む道を強引にねじ曲げている。そんな風に見えた……
主人公	三つ目の扉の時に、紅は一時的でもあの人と一緒に行動していた。それは、身近な場所で、あの人そのものを見ていたということだ。
主人公	今のあの人を、一番近い場所で感じてきた紅。なら、その評価は間違って無いと思う。
姫	目的、か。だったらそれは一つしかないな
姫	可能性の世界……あのすべてが止まった世界で、ミヤははっきりと言っていた。お父さま、って
主人公	それはつまり……。
ノート	……自分の娘を助けるため……ですか
アミア	え？　な、なに、それ
アミア	えっと、つまり、あのおっちゃんの子供があのミヤで……今回は、カミシアちゃんとミヤの未来争いで……
アミア	あ、そっか。もし負けたりすれば、自分の子供が死ぬってことなんだ……
カミシア	そういうことだ。だからこそ、このゲームのあいつは容赦なく剣を振るう。勇者であったという、その過去すら捨てて、な
オペラ	……勇者であっても人の親、というわけですね。だからと言って、彼の行いを肯定はできませんが……
ウルル	でも、カミシアちゃん。その未来の中を変えちゃうって本当にできるの？
ウルル	ウルルも、ミヤさんに襲われたりとかはあったけど……そんなことができるなら、好き勝手な未来とか作れちゃうよね？
ウルル	ゲンおじさん、あんなに強いんだし……
オペラ	ウルル様、いくらなんでも『おじさん』は失礼かと。さしもの勇者様とはいえど、面と向かって『おじさん』呼ばわりは、腰を抜かして泣き出しますよ
ウルル	え？　あ、そうだよね、うん。それじゃあ、ゲン……
オペラ	ジジイ、で充分です。あのクソ親父、かつて共に戦った戦友であるはずの麗しきメイドを娘に殺させるとか冗談にもほどがあります
オペラ	挙げ句の果てにウルル様の命まで……うふふ、うふふ、あーうふふ。そうですよねぇ。ウルル様の命狙ったんですから、娘の命の一つや二つ、覚悟の上ですよねぇ♪
主人公	それはもう、いつも以上に楽しげに言うオペラさん。俺達はもちろん、カミシアまでもが一歩引いていた。
カミシア	あー……まあ、なんだ。今のウルルちゃんの質問だが、ズバリ言ってしまえば、可能だ
カミシア	導き手は、干渉力という未来に直接影響を及ぼすことを可能とする力を、限定的だが与えられる。その力を行使して、可能性の中身を直接変えてしまうわけだ
カミシア	無論、そこにいくつかのルールはある。たとえば、剪定者や導き手を殺すことは許されない。普通の人間でも、本来死ぬ予定になかった者を直接手にかけてはいけない
カミシア	まあ、新たに変わった未来の中で、連鎖的に、想定外の事故などで死んだ場合は例外扱いだがな
主人公	それはつまり、直接でなければ問題ないということ。前の扉のように、古代兵器の起動だけを行い、あとは暴れるに任せてしまうのならば……。
カミシア	もっとも、与えられる干渉力にも限りがある。大きく手を下すほどに消費する干渉力は激しくなるから、あまり好き勝手はできん
カミシア	事実、ミヤは最初の扉で魔剣を直接ばらまくなどという大きな行動をとって、相当な干渉力を失った
カミシア	本当なら、ラーロンとかいうゴミが色々暴れて神族との仲を壊すはずだったんだが、ミヤの奴、待ちきれなくなったらしいな
カミシア	あれのせいで、ミヤは直接的な行動をしにくくなった。古代兵器を利用したり、ゲンを送り込むことで世界を荒らしたりといった間接的行動中心にしたのはそのためだ
カミシア	パパを舐めるからだ、まったく
ウルル	え？　でも、ミヤさん、二つめの未来ではウルルとフォンさんを襲ってきたよ？
カミシア	さっきも言ったが、あの扉では、本来二人とも死ぬ予定だった
カミシア	それが死ななかったのは、パパの予想外の奮闘のせいだ。予定通りの未来にするための行為なら干渉力はいらないのさ
カミシア	ちなみに、他の扉の記憶をみんなに与えるために、私もほとんどの干渉力を使ってしまった
カミシア	パパなら、どこかで一発逆転の何かをしてくれるものと信じて温存していたわけだが、正解だったな
カミシア	話を戻すが、一つ目の扉の結果を見て、さすがにミヤもパパに驚異を感じた
カミシア	だから、それ以降に奴がやろうとしたのは、未来を変えるのではなく、予定通りに近づけること。そうすれば、その扉の未来は安心して残せるものになる
カミシア	なんといっても、三つの扉すべてが私の死の未来なんだ。パパが……剪定者がどれを選ぼうとも安心していられる
紅	ところがそこに、四つ目の扉が生まれてしまった……なるほど、向こうからすれば大慌てだな
主人公	そんな紅の言葉にカミシアは頷くと、改めてみんなを見回し、そして言う。
カミシア	この四つ目の扉の存在がいかに特別かは覚えておいてくれ。パパが望み、自らの力で生み出した可能性。いくら剪定者でも、そんなのは前代未聞だ
カミシア	忘れないで、パパ。この扉は、本当に最後の扉。もしこの未来の中で悲劇が起これば、もう修正する術はない
カミシア	たとえどの扉を選んでも、未来は悲劇の上に積み重なることになる。もう、救えなくなる……
主人公	その言葉の中には、カミシアの命が含まれていない。俺にはそう感じられた。
主人公	目の前のこの少女は、自分の生死じゃなく、俺達が哀しい未来を進むことを恐れている。
主人公	自分の存在そのものがかかったこのゲームで、あくまでも俺達のことを心配してくれている。
主人公	ああ、やっぱりそうなんだ。間違いないんだ。確信した。
主人公	この子は、シャルだ。あの、優しく、明るく、人なつっこい、シャルそのものなんだ。
姫	……そう、だな。ここは、俺達にとっての最後の可能性だ。それを忘れたらいけない
姫	けれど、カミシア。お前もこれだけは忘れないでくれ
姫	俺は、俺の大事な人達、誰の身にも悲劇を起こさせない。それはもちろん、お前にもだ
カミシア	え……
姫	まったく、意外そうな顔しやがって。やっぱりお前、自分の存在のことなんか最初から捨ててたな
姫	三回だ。俺は三回も、お前のことを助けられなかった。だからもう、こりごりだ。四度目はない。絶対に、この扉では助けてみせる
カミシア	パパ……
ヴェル	そうね。私たちにとっての勝利は、完全なハッピーエンド。そのためには一人も欠けたらダメ
ノート	もう、あんな思いをするのも、させるのも嫌です
ウルル	ウルル、もう絶対に負けませんっ
紅	あたしも、もう迷わない。ただ真っ直ぐに、姫を信じて進むよ
アミア	白鷺姫の導く扉、だっけ？　もうお兄ちゃんったらかっこいいなあ
オペラ	これはもう、行っちゃうしかありませんね、白鷺さま。ハーレムルート
姫	いやあの、オペラさん？　さすがにそれは……
ヴェル	え……私は別にそれでも……
姫	は？
主人公	予想外のヴェルの言葉に、思わずみんなの顔を見直してしまう。
主人公	……えーと、皆さん？　その、ちょっと恥じらいつつも嬉しそうな微笑みはいったい……？
アミア	もう、お兄ちゃん。据え膳食わぬはなんとやら、だよ
ノート	英雄色を好む、ともいいますし
紅	ま、まあ、あたしたちの国でも、昔は側室システムとかあったしな
ウルル	つまり、みんな、にいさまと一緒にいたいってことです。ね、カミシアちゃん♪
主人公	そんなウルルの言葉に、同時に頷くみんな。そんなみんなをカミシアは唖然としながら見ていたが、
カミシア	うん、そうだねパパ。私も、ママたちと一緒がいいよ
主人公	今にも泣き出しそうな笑顔と共に、俺に寄りかかってくる。
