主人公	さて、図書室にあった本を言葉通り、速攻で片付けた。
主人公	相変わらず超スピードで本を片付け始めたオペラさんが八割程を一瞬で終わらせてしまったため、文字通り速攻でだ。
主人公	俺達は話した通りにクラインズポットに向かっていた。
紅	そういえば、この前クラインズポットに行った時、クーポン券もらわなかったか？
姫	そういえば貰ったな。すっかり忘れて財布の肥やしになってたけど、まだ期限切れてないといいな
カミシア	パパ、財布の整理は定期的にした方がいいと思うよ？
姫	確かに、急がしいとそういう細かい所の整理ってサボりがちになるな……気をつけよう
カミシア	うんうん、そういう細かい所がきっちりしてる男に女は惚れたりするからね
デイル	はは、それだったら姫っちには余計なお世話だぜ。なにせ既に周りにいっぱい女子がいるからな
カミシア	ふむ、それもそうか
姫	えーい、ちゃかすな、ちゃかすな！
主人公	カミシアとデイルの言葉に突っ込みつつ、紅の言葉に財布を漁ると、中からデザートの割引券が出てきた。
主人公	それを見て、横からアミアが割引券をのぞき込む。
アミア	うわっ、期限ぎりぎりじゃん
ノート	本当ですね、気がついて良かったです
主人公	普段からクラインズポットは利用しているが、女性陣と違ってデザート類を頼む事が少ないので、すっかり使う機会を逸していた。
ヴェル	あ、それ私もこの前貰ったかも
オペラ	クーポン券って貰ったときは必ず使おうと思っても、結構忘れがちですよね
ウルル	うん、いざ使おうと思ったら期限切れてたりするよね
デイル	発見した時に期限切れだった時のがっかり感は異常だよな
ヴェル	ああ、わかるわ。それまで存在自体忘れてたのに、見つけて期限が切れてるとわかると途端に勿体なく感じるのよね
カミシア	逆に今見つけたって事は、きっと今日クラインズポットに行くのは運命だった。そう思うと中々面白いな
主人公	俺が見つけたクーポンを見ながら、カミシアが軽く笑ってそう話す。確かにそう考えると中々面白いな。
ノート	発想の逆転ですね。そういう考え方って結構ボクも好きです
オペラ	何事もプラス思考の方が生きてて楽しいですからね
ウルル	なんか、オペラが言うとすっごく説得力あるなあ
オペラ	うふふ、もっと褒めてくださいウルルさま。そうすれば私、もっと生きてるのが楽しくなっちゃいます♪
紅	今のは褒められたのか？
ヴェル	確かにプラス思考最強ね、本当にそう思うわ
主人公	そんな雑談中にふと視界の隅に金髪の少女を見つけ、思わずそちらに視線を送ると少女とばっちり目があった。
姫	お？　あれは？
シャル	あ、パパはっけーん！
ウルル	あ、シャルちゃん！
カミシア	！
主人公	シャルはこちらと目が合うと、手を振りながら駆け寄って来くる。それを見ていつも通り受け止めようとしたところで、カミシアの事に気がつく。
姫	おい、カミ……あれ？
主人公	カミシアにシャルと顔を合わせても大丈夫なのか聞こうと首を向けると、すでにそこにカミシアの姿は無かった。
シャル	パパー！
姫	のわぁ！
シャル	え！？
ヴェル	ヒメ！？
主人公	しかし、ほっとしたのもつかの間、気を抜いた隙を突くように、シャルがいつも通りこちらに飛びついてきた。
主人公	視線を外していたのも災いして、完全にバランスを崩してしまった。
主人公	まずい、このままだとシャルごと倒れ込んでしまう。
オペラ	おっと、大丈夫ですか？　白鷺さま
姫	っとと！
主人公	しかし倒れ込む直前に、オペラさんがさりげなく支えてくれたおかげで倒れずにすんだ。
姫	あ、ありがとうございます、オペラさん
オペラ	いえいえ、それよりお二人ともおケガはありませんでしたか？
姫	はい、おかげで平気でした
シャル	うん、ありがとうオペラお姉ちゃん
主人公	シャルの言葉にオペラさんが笑顔を返す。こういう時は本当に頼りになるなあと実感する。
ヴェル	もう、びっくりさせないでよヒメ。ヒメもシャルも何事も無かったから良かったけど
姫	いや、面目ない
シャル	パパもごめんなさい
姫	あ、いや。今のはよそ見してた俺が悪いんだから、シャルは気にしなくても大丈夫だよ
紅	そうだな、シャルのアタックによろめくなんて、まだまだ修行不足だな
アミア	あは、これからしばらくはお兄ちゃんよりシャルちゃんの方が強いって事にしよっか
ウルル	ですね、シャルちゃん最強です
姫	うわあ、それは色々とへこむ！
ノート	くすっ、だったら今度はしっかりシャルちゃんを受け止めてあげないとダメですよ、姫くん
姫	も、もちろんだ！
デイル	てなわけで、姫っちのお墨付きもでたし、次も気にせず飛びついていいみたいぜ。良かったな、シャル子
シャル	うん！　ありがとう！
ウルル	やっぱり、シャルちゃんは元気いっぱいなのが一番です
主人公	みんなのフォローもあり、シャルはいつも通りの笑顔に戻る。
主人公	シャルの出会い頭の飛びつきは、もはや恒例行事のようなものだ。今回の一件でそれがためらわれたりしたら、俺達も寂しい。
アミア	シャルちゃんはこれから遊びに行くの？
シャル	うん。これから広場で友だちと待ち合わせして、遊びに行くんだ
姫	そっか。元気なのもいいけど、怪我とかしないようにな
主人公	元気なシャルの頭をなでながら、つい他の扉の事を思い出してしまい、少しだけ切なくなる。
主人公	シャルはそんな俺の表情の変化には気づかず、無邪気に笑うと元気に返事した。
シャル	はーい！
オペラ	ふふ、元気がいいですね、やっぱり子供は元気が一番です
ヴェル	なんか、そういう言い方すると、おばちゃんっぽいわね
オペラ	ひどいですヴェルさま！　こんなピチピチな竜族を捕まえて、おばさんなどと！
紅	いや、ピチピチって……
ノート	すっごく久しぶりに聞いた気がします
主人公	そんな会話に吹き出していると、待ち合わせの時間が迫っているのかシャルが時間を確認して焦り出す。
シャル	あ、早く行かなくちゃ遅れちゃう！
姫	ああ、ごめん。引き留め過ぎちゃったな
シャル	ううん、大丈夫！　それじゃパパもみんなもまたねー！
ウルル	うん、またねーシャルちゃん
デイル	走って転ぶなよー！
主人公	シャルはまた元気よく俺から離れると、手を振りながら広場の方に駆けだしていった。
主人公	そんなシャルの後ろ姿を見送る俺の顔を見て、何か感じる事があったのか、ヴェルが決意を篭めた声で呟く。
ヴェル	今度こそ、絶対に護りましょ、あの子の笑顔を
姫	ああ、もちろんだ。もうシャルを絶対に傷つけさせない
主人公	俺の言葉に周りの仲間達もそれぞれが決意を篭めて頷いてくれた。
主人公	そんな俺達の言葉に応えるように、今までどこにいたのか、カミシアの声が聞こえてくる。
カミシア	護ってもらわないと困るさ
姫	カミシア
主人公	声の方に振り向くと、近くの路地からゆっくりとカミシアが姿を見せる所だった。どうやらとっさに路地の暗がりに隠れていたらしい。
カミシア	あの私には生き残って貰わないと困る。なにしろあの私が死んだら、今度こそ、私は消滅する事になるんだからな
ウルル	カミシアちゃん……
主人公	そう話すカミシアの表情はいつもと同じで不敵な笑顔を作っていたが、その台詞の重みを理解出来ない者はここにはいない。
主人公	そうだ、もしシャルを守れなければ、ここにいるカミシアまでも消滅することになる。そんな事が許せる訳がない。
紅	当然だ。シャルはあたしたちが絶対に護る、他の扉の様な悲劇は二度と起こさない
カミシア	ふっ、そうでなくてはな
紅	もちろん、昨日言ったとおりお前の事もな。カミシア
カミシア	……
主人公	少しだけ、かつて可能性の世界で出会った時と同じ口調に戻っていたカミシアに、紅は笑顔を向けながらそう話すと、カミシアは照れたように視線をそらした。
ウルル	そうです。カミシアちゃんだって、もうウルルたちの仲間なんですから、当然じゃないですか
アミア	そうだよ、だからそんな人ごとみたいな言い方は良くないよ
主人公	たたみかけるようにそう言われて、さすがのカミシアも照れたのか顔を背けるが、頬に赤みがかっているのがバレバレだ。
カミシア	ふん、お人好しはパパだけだと思っていたが、どうやらそうじゃないらしいな
ノート	ふふ、カミシアちゃんだってわかってるんですよね、そんな事。だってボクたちの事をずっと見てたんですから
ヴェル	そうね、ずっと見ててくれたんだものね
オペラ	わかってて、そんなつれない態度を取るなんて、まさにツンデレですね！
カミシア	つ、ツンデレじゃない！　というか、私のキャラじゃ無いそんなのは！
主人公	照れ隠しの言葉にまで突っ込まれ、ますます顔を赤くしたカミシアは、早足でクラインズポットへと歩き出す。
カミシア	も、もういい！　早く店に行かないと日が暮れてしまう！
デイル	ま、それもそだな。んじゃ、カミ子いじりはこれくらいにして、行きましょうかね
姫	だな、店が混み始める前に席を確保したいし
主人公	わかりやすいカミシアの態度に微笑みつつ、俺達は早歩きするカミシアを追いかけた。
主人公	カミシアを追いかけながら、俺は改めて心に誓う。シャルもカミシアも、それに他のみんなも、誰一人欠けずにこの扉を抜けてみせると。
