主人公	無心になって剣を振る。いつもの夜の鍛錬だが、実は俺はこの時間が結構好きだったりする。
姫	……
主人公	無心になり、ただひたすらに剣を振るう。ただそれだけに意識を集中すると、まるで剣が自分の身体の一部になったように感じ、剣が空気を切るのが伝わってくる。
主人公	振り下ろす度に鳴る空気を切る音や、夜風や虫たちの鳴き声の中でひたすらに剣を振り続ける。そして心地よい疲労感が身体を包んだ頃に剣をおろした。
姫	ふう、今日はこんなもんか……
主人公	タオルで汗を拭いながらそんな事を呟くと。
謎でも無い刺客	隙有りだ、パパ
主人公	背後に突然、気配が現れた。
姫	うおっ！
主人公	慌てて振り返ると、目の前に何かが投げつけられる。
主人公	とっさに剣でたたき落とそうとするが、すぐに投げられたものが何か気がつき、顔面に直撃する寸前にギリギリそれを受け止めた。
カミシア	ナイスキャッチだ。さすが、パパだな
主人公	見ると俺に何かを投げつけた犯人が笑いながら立っていた。カミシアだ。
主人公	ちなみに投げつけられたものは飲み物を入れるボトルだ。中にはしっかり飲み物も入っている。
主人公	危なかった。もし剣で打ち落としていたら、色々と大惨事になっていた所だ。
ヴェル	もう、いきなりそんなことしないの。もしヒメが失敗したり、振り払ったりしたらどうするのよ？
ヴェル	せっかく用意したものが無駄になるわ
姫	ヴェルにカミシアか
主人公	ボトルを投げつけた犯人であろうカミシアに、一緒にいたヴェルが注意していた。実際あと少し反応が遅れていたら危なかった。
カミシア	私はパパが絶対に成功させると信じていたからな。ヴェルママはパパを信じられないのか？
ヴェル	そんな訳無いでしょ、私だってヒメの力を信じてるわ。けど、それとこれとは別問題よ、飲み物を投げちゃだめじゃない
カミシア	ふむ、それもそうだな。今度は飲み物じゃ無くてその辺の石を投げつけるか
姫	こらこらこら！　何を物騒な事言ってるんだ！　というか石はシャレにならないからマジでやめてください！
主人公	にやりと笑うカミシアの顔を見て、慌てて止めに入る。今後訓練をするときは常に周囲からの襲撃を警戒しながらしないといけないなんて、マジで勘弁してほしい。
ヴェル	まったく……そんな事しなくても今のヒメは十分強いし、何かあっても私が護るから大丈夫よ
カミシア	相変わらずヴェルママは言い回しがストレートだな
ヴェル	回りくどいのが嫌いなだけよ
主人公	こちらに完全に信頼を置き、何かあっても自分が護る。そんな事を面と向かって言われると少し照れるが、やっぱり嬉しく思う。
ヴェル	今更だけど、お疲れヒメ。飲み物と新しいタオル持ってきたわよ
姫	ありがとう、丁度今日は切り上げるところだったからありがたいよ
カミシア	実は結構前から見てたんだがな。全く気がつかない所を見ると、たいした集中力だ
ヴェル	それは今更よ。ヒメは一つの事に集中すると結構周りが見えなくなるもの
カミシア	それはパパの長所でもあり、短所でもあるな
姫	そうかもしれないな
主人公	実際集中力には自信があるが、それ故に周りを見ることがおろそかになってしまう事が多い。
主人公	直した方がいいのはわかっているが、こればっかりは一朝一夕でどうにかなるものでも無い。
ヴェル	今日はいつもより気合いが入ってたみたいね
姫	そうかな？
カミシア	ああ、何だやっぱり無意識か。素振りもいつもよりワンセット多いぞ
姫	あ、そういえば確かにワンセット多くやったな
主人公	二人に指摘されて自覚したが、やはり今日の俺はいつもより気合いが入っているようだ。
姫	やっぱり、今の状況に無意識にプレッシャーを感じてるのかな
主人公	思わず空を見上げてそんな事を話す。いつもより気合いが入る理由と言われれば、やはりそれが一番最初に思い浮かぶ。
姫	他の未来で、護られるだけじゃダメだって分かったからな。護れる力を手に入れないと。今は無理でも
主人公	自分自身に言い聞かせる。そう話す俺の言葉を、ヴェルもカミシアも黙って最後まで聞いてくれた。
主人公	そして二人とも俺の言葉が終わると、微笑みながら言葉を返してくれた。
カミシア	大丈夫。それはきっとパパの力になるよ
ヴェル	ええ。それに私だって他の扉とは違うわ。ヒメもシャルも絶対に護ってみせる。だからヒメも私を護ってね
姫	ああ、もちろんだ
姫	二人ともありがとう
主人公	二人の言葉に、俺はしっかりと笑顔を返すことが出来た。
