バリアリーフ	はい、以上で連絡事項は終了ですわ
主人公	ＨＲの終わりをそう締めくくった先生の言葉に、教室のあちこちから脱力した声が漏れる。
主人公	いつもなら俺達も早々に教室を出て、放課後を満喫するわけだが、今日はそうもいかない。
姫	あ、先生、ちょっといいですか？
バリアリーフ	はい、なんですか生徒白鷺、何か質問ですか？
主人公	俺達は実技の授業中に話した事を実行するべく、教室を出ようとしたバリアリーフ先生に声をかけた。
姫	いえ、質問ってほどじゃ無いんですけど、ちょっと聞きたい事があって
バリアリーフ	聞きたい事ですか？
紅	はい、少し時間、大丈夫ですか？
バリアリーフ	ええ、今日はこの後は会議等もありませんし、大丈夫ですわ
主人公	その言葉に安心すると、俺達は本題を告げた。
姫	実は俺達、最近ちょっと滅界戦争時代の勇者について調べてるんです
バリアリーフ	勇者についてですか？　どこかの課題でそういったテーマがでていましたかしら？
ヴェル	そ、そういうわけじゃないんですけど、えーと……
主人公	なんでまた急にと首をかしげる先生に、慌ててヴェルが答えようとするが、まさか本当の事を話す訳にもいかず、言葉に詰まってしまう。
姫	いえ、最近ちょっと興味がでて調べてるんですよ。二階級の単位の一つに自主研究の項目がありますし、それの役に立つかなと思って
デイル	ナイスフォローだ姫っち！
主人公	俺がとっさにそう話すと、納得してくれたのか、先生はなるほどと頷いた。
主人公	ちなみに自主研究の単位とは、その名の通り授業外で何かの研究を行い、その成果を発表することで学園から評価された際にもらえる単位だ。
バリアリーフ	なるほど、自主研究での単位修得を考えているんですか。しかし、あれは審査が厳しいので簡単にいきませんよ
姫	はい、だからまだテーマを決めかねてるんですけど、個人的に勇者に興味があるのでまずはその辺りから攻めてみようかなと思って
姫	それで図書室の資料を調べてみたんですけど、どうにもしっくりくる資料が無くて。なら実際に滅界戦争に参加した先生の意見を聞いてみようって話になったんです
バリアリーフ	なるほど、自主的に色々調べることはいいことですわ
バリアリーフ	いいでしょう、私で良ければ知ってることをお話しますわ
姫	ありがとうございます！
主人公	先生の言葉に頭を下げる。
主人公	それにしても、せっかく教えてもらうのに、こっちから本当の事を話せないのは、やはり心苦しいな。
主人公	そうだ。いっそのこと本当に自主研究のテーマを勇者にしてみるのも悪くないかもしれないな。実際自主研究での単位修得を狙っていたのは事実だし。
バリアリーフ	さて、とは言ったもののどこから話しましょう
バリアリーフ	生徒白鷺達はすでにどの辺まで調べたのかしら？
デイル	あーそれなんですけど、ドラ先生は勇者本人について覚えてますか？　名前とか、どんな容姿だったとか
主人公	いきなり確信に切り込んだデイルに驚くが、確かにそれは最初に確かめたい事だ。
バリアリーフ	ずいぶん基本的な所から聞いてきますわね
デイル	いやあ、図書室の本を調べてみたんですけど、どうにも勇者本人に対する記述が無くて。ドラ先生なら知ってるかなーと
バリアリーフ	個人に対する記述が無い？　良く探しましたの？
紅	はい、さすがに図書室の全ての本を見たわけでは無いので、確証はありませんけど
ヴェル	半日図書館に篭って情報ゼロって感じだったわね
バリアリーフ	なるほど……まあ、それに関してはいずれ調べてみましょう
主人公	先生の言葉に頷いて、俺は話を戻した。
姫	それで、勇者についてなんですけど
バリアリーフ	ああ、そうでしたわね。ええ、もちろん知っていますわよ。何せ共に……あら？
主人公	笑顔でこちらの質問に答えようとした先生の言葉が戸惑ったように止まる。
バリアリーフ	おかしいですわね……共に戦った事もあるはずですのに……
主人公	しばらく思い出そうと頭を悩ませていた先生だが、やがて心底不思議だというように呟いた。
バリアリーフ	ダメですわね。共に戦ったという記憶はありますのに……名前はおろかどういった人物であったかまで思い出せませんわ
主人公	やはり予想通り、先生からもゲン本人関する記憶はきれいさっぱりに消えていた。先生本人すらも今の今まで忘れていた事に疑問すら覚えなかったという。
バリアリーフ	不思議ですわね。勇者がどんな事をしていたか等はしっかり印象に残っているのに、本人の情報になると、まるで霞がかかったように思い出せませんわ
紅	やっぱり、先生もか……
バリアリーフ	やっぱり？　どういうことですの？
紅	あ、いえ。すみません、こっちの話です
バリアリーフ	？
主人公	紅が思わず呟いてしまった言葉に首をかしげるが、やはりそれ以上に勇者本人の事が気にかかるようで、軽く流してくれた。
バリアリーフ	力になってあげたいところですが、困りましわね
バリアリーフ	歴史書や教科書に載っている程度のことなら話せますけど、そういったことはすでに調べてあるようですし……
姫	あ、いえ。気にしないで下さい。やっぱりもうちょっと自分達で調べてみますよ
主人公	ある程度予想はしていたとはいえ、やはりそう簡単にはいかないなと、思わず胸中でため息をついてしまう。
主人公	とりあえず他の滅界戦争経験者を当たろうかと、先生に礼を言って教室から出ようとしたところで。
バリアリーフ	いえ、ちょっとお待ちなさい
紅	あ、はい。なんですか？
主人公	先生は少しだけ考えると、何かを思い出したように顔を上げ、俺達を呼び止めた。
ヴェル	なにかしら？
デイル	さあ？　けどドラ先生、なにか思い出した感じだぜ
バリアリーフ	ええ、勇者本人に対する事ではありませんが、一つ思い出しましたわ
姫	ほ、本当ですか？
バリアリーフ	ええ、自主研究のテーマにするのであれば、この話はきっと役に立つと思いますわ
紅	聞かせてください
主人公	俺達はあらためて先生の前に行くと、先生に先を促した。
バリアリーフ	さきほど言ったとおりに、これは勇者本人のことではありません
バリアリーフ	これは、そのそばに常にいた女性についての話ですわ
姫	女性ですか？
バリアリーフ	ええ、常に勇者の傍らに立ち、勇者をフォローしていました
ヴェル	えと、そんな人、調べてるときに出てきたっけ？
デイル	いんや、俺様は記憶に無いな
バリアリーフ	そうですわね。能力的に特別秀でていたわけではありませんし、これといった戦果も聞きませんでしたからね。書物などには載っていないでしょうね
バリアリーフ	ああいった書物や歴史書は、目立った戦果や個人の武勇伝に記載が偏りがちですから
主人公	確かに戦争は一人では出来ない。歴史書に記された偉人達以外にも、彼らを支え、共に戦場で戦った部下や盟友が多数いるはずだ。
主人公	先生が語る女性もそういった中の一人なのだろうか。
姫	その女性は、勇者の部下かなにかだったんですか？
バリアリーフ	いえ、そういった感じではありませんでしたわね。詳しくは知りませんが勇者の幼馴染だという話を聞いた事がありますわ
紅	幼馴染ですか？
デイル	実は勇者の恋人だったりとか？
バリアリーフ	どうでしょうね、私もそこまでは知りませんが。もし違ったとしても、それに近い絆で繋がっていた事は確かですわね
主人公	先生曰く、彼女は書物に残されるような派手さこそ無かったが、常に勇者と共にあり、的確に勇者をフォローしていたという。
主人公	どうやら神族だったらしいという彼女は、珍しくも勇者とは種族違いの幼馴染だったそうだ。
主人公	彼女のおかげで勇者がピンチをしのぎ、生き残った事も多く、彼女の事は戦場に立つ者の間では語りぐさになっていたという。
バリアリーフ	そういえば、戦争終盤から彼女の姿を見なくなりましたわね
紅	え？　まさか……
バリアリーフ	いえ、戦死したという話は聞きませんので、おそらくどこかで生きているのでしょうけど。今頃どうしているのかと思いまして
主人公	そういって懐かしそうに目を細める先生を見ながら、俺はゲンが確か既婚者であることを思い出した。
主人公	もしかしたら、その女性がゲンと……？
バリアリーフ	さて、私が話せるのはこの程度ですわね
姫	あ、はい。ありがとうございます
バリアリーフ	あまり力になれなくて、ごめんなさいね
紅	いえ、色々参考になりました
紅	ありがとうございます
主人公	俺達がそういって礼を言うと、先生は満足そうに笑顔を返してくれた。
バリアリーフ	私も久々に昔が思い出せて懐かしかったですわ
バリアリーフ	勇者については、他の先生方にも話してみるといいでしょう
バリアリーフ	私以外にも、この学園には滅界戦争経験者が数多くいますので
姫	はい、わかりました
バリアリーフ	それじゃあ、がんばってくださいな
主人公	その言葉に頷いたのをみて、満足したのか。先生は教室を後にした。
姫	勇者のそばに常にいて勇者を護っていた女性か……
紅	いったい何者なんだろうな
ヴェル	デイルじゃないけど、本当に恋人だったのかもね
ヴェル	だとしたらちょっと素敵ね、戦場ですら互いを支えあって、護りあって、最後まで生き残るなんて
紅	そう聞くと、まるで物語の勇者とヒロインだな
主人公	確かに実際に見たわけでは無いが、なんだか絵画のモチーフになりそうな程しっくりとくる。
デイル	でも、戦場に立って一緒に戦うのは、ヒロインとちょっと違う気もするけどねえ
デイル	やっぱ、お姫様ってのはお城で勇者の帰りを待ってないとな
姫	まあ、それも一理あるけど……
主人公	デイルの言葉に思わず苦笑してしまう。なぜなら俺の周りには一緒に戦場に立って戦うタイプの女の子達ばっかりだ。
主人公	というか、誰一人お城で帰りを待っているタイプじゃないよな。
ヴェル	あら、そんなの古いわよ、今は女が男を護ってもいい時代なんだから
紅	ああ、一人恋人の帰りを待っているのは、あたしも性に合わないな
主人公	考えているそばからの二人の発言に、俺とデイルは思わず顔を見合わせる。
主人公	するとデイルが耐えきれないといった感じで吹き出した。
デイル	ははは、確かに姫っちと姫さん達じゃ、どちらかというと、姫っちの方がヒロイン属性強めだよな
姫	おいおい、それはそれで傷つくからやめてくれ！　ていうか笑うなよ！
主人公	全力で否定したいが、割と間違っていないと思えてしまう自分が情けない。いまだにヴェル達に助けられる事も多いしなあ。
主人公	ちなみに、ヴェル達はヴェル達で、一体何を想像したのか、軽く遠い視線で呟く。
ヴェル	捕らわれのヒメを助けるってシチュエーションも、なんていうかロマンよね
紅	ああ、姫が待っていてくれるなら、必ず帰ってこようという気になるな
姫	もうやめて！　これ以上俺をヒロイン扱いしないで！
デイル	はははははは！　やっべぇ似合いすぎだぜ姫っち
姫	お前はお前で爆笑すんなぁ！
主人公	ヴェルと紅の言葉が妙なツボに入ってしまったのか、爆笑するデイルを後で殴ろうと心に決めつつ、俺達は教室を後にした。
主人公	結局ゲン本人の事は聞けなかったが、先生からもらった情報は実に有益なものであったと思う。
主人公	まあ、情報と同時に俺の心に深い傷も残したが……。
