デイル	ふう、ようやく逃げ切った
主人公	大聖堂の椅子に腰掛けて、デイルは軽く嘆息した。姫と別れた後も大世界杯のチーム勧誘に追いかけ回されて、さきほどようやく振り切ってここに逃げ込んだところだ。
主人公	さすがに普段から人があまりこないエリアだけに、ここは今日の学園内では珍しく静かな雰囲気で、静謐な雰囲気を保っている。
デイル	いつもの俺様だったら、もうちょい適当にチームも選んだんだけどねえ
主人公	誰ともなしにそう呟く。たしかに少し前のチームなら、適当にクジでも引かせて決めたかもしれない。
主人公	しかし、今のデイルは姫と友人になり、彼らの近くにいることを楽しいと感じている。だから、勧誘をわざわざ断って逃げるという面倒な選択肢を選んだ。
デイル	まあ、今の姫っちと戦ってみたいって気持ちも結構あるんだけどな
主人公	思わず苦笑しながらそんなことを呟く。
主人公	今回の扉での対決が有耶無耶になってしまったこともそうだが、本来姫の領分は一対一よりこういった集団戦にこそ有るとデイルは思っている。
主人公	だから、今回の大世界杯のようなイベントこそ、姫は本領を発揮する。そんな姫の全力と戦うのも面白いかもしれない。
？？？	ここにいたかのか。探したぞデイル
デイル	ん？
主人公	そんな思考を遮る様に、大聖堂の扉が開く。一瞬また勧誘に来た生徒かと思い、逃げ出そうとも考えたが、相手を確認して安堵した。
デイル	なんだ、お坊ちゃんか
ラーロン	なんだとはなんだ
デイル	ああ、悪い悪い。ちょいさっきまで鬼ごっこしてたから、警戒しちゃっただけで。深い意味はないよ
ラーロン	ふん、この私を前にしてそのような態度を取るのはお前ぐらいのものだな
主人公	そこに立っていたのは、意外な事にラーロンだった。普段から魔族至上主義の彼が、神族が主に利用する大聖堂に来た事を、デイルは不思議に感じた。
デイル	んで、どうしたんだ？　お坊ちゃんが大聖堂にわざわざくるなんて珍しすぎて雨が降るぜ？
ラーロン	今日は学園中が騒がしくてかなわんからな。考え事もろくにできん
デイル	なんだ、俺様と同じ目的じゃん
主人公	今日は学園中が騒がしく、落ち着ける場所と言えばここくらいのものだ。もっとも、ここに来るくらいなら、さっさと帰った方がいいので、理由が無ければ立ち寄らないが。
デイル	ん？　でも最初に入ってきたとき、探したぞとか言ってなかったっけ？
ラーロン	それも理由の一つだ。貴様に頼み事があって探していた
主人公	話を聞く限り、何か用事があってデイルを探していたらしいのだが。
主人公	デイルはそこら中の生徒に追い回されて行方がしれず、結局今日は諦め、休憩がてら大聖堂に立ち寄った所で偶然みつけたらしい。
デイル	ふーん。で、頼み事ってなによ？　お坊ちゃんが俺様に頼みって珍しくね？
主人公	そうわざとらしく聞き返すが、デイルには何となくラーロンの頼みがわかっていた。
主人公	というより、今日に限って言えば、頼み事といえばイベントに関係する事以外はあり得ないだろう。
ラーロン	ああ、小者揃いのこの学園の魔族の中で、数少ない私が認める力の持ち主だ。そんなお前に折り入って相談がある
デイル	ふっ、ありがとさん。魔王の血族に言われるとやっぱ悪い気はしないねえ
主人公	相変わらず物言いは尊大だが、なぜだかデイルはその物言いに、いつものラーロンとは違うものを感じた。
ラーロン	来週の大世界杯で、私と同じチームになってほしい
主人公	その答え自体は予想通りのものだったが、その言葉にデイルは先ほど感じた違和感の正体に気がつく。
主人公	それは眼だ。
主人公	目は口ほどにものを言う、と言うが、事実その通りで、デイルは相手の目をみてその真意を探ることに長けていた。
主人公	だからこそ気がついた。今日のラーロンは普段のように他者を見下す目ではなく、何かの決意のようなものを固めた、真剣な目をしていた。
デイル	悪いなお坊ちゃん、既に先約がいるんだわ
主人公	しかし、それでもデイルは努めていつも通りに振る舞い、ラーロンの反応を見る。
主人公	いつものラーロンなら、その言葉に暴言の一つでも吐いて、好き勝手な理論でデイルを勧誘しただろう。
主人公	しかし、ラーロンはデイルの言葉に動揺した素振りは見せない。むしろデイルの言葉を予想していたかのように言葉を返す。
ラーロン	それの先約とは、下郎Ａか？
デイル	な～んだ、わかってんじゃん。ま、そういうことだから、またの機会にしてくれると俺様ありがたいぜ
ラーロン	……
主人公	飄々とした態度のデイルに、いらついた様子も無く、相変わらず真剣な瞳をデイルに向けたままラーロンは少しだけ考えるように悩むと。
ラーロン	今回の大世界杯、私には決着をつけなければいけない相手と、確かめなければならない事がある……
デイル	ほう……？
ラーロン	だが、遺憾な事に私一人では、目標を立って征するのはいささか難しい。だから力を貸してほしい
デイル	その、決着をつけないといけない相手ってのは、もしかしなくても姫っちのことかい？
主人公	普段とは違う言動に驚きながらも、デイルはラーロンに訪ねると、ラーロンはしっかりと頷いてみせた。
デイル	悪いが、だったら、なおのこと手伝えないな。それはお坊ちゃんだってわかってた事だろ？
主人公	友人は裏切れない、そう口には出さずに告げるが、ラーロンはそれでも引き下がらない。
ラーロン	どうしても駄目か？
デイル	ああ、悪いけどね。他を当たって――
主人公	やっぱり今日のラーロンはいつもと違うな。そう思いながら再び断りの言葉を口にしようとしたとき。
主人公	デイルは信じられない光景を目の当たりした。
ラーロン	頼む……力を貸してくれ
デイル	！！
主人公	あのプライドが高く、自尊心の塊の様な男が、頭を下げたのだ。
デイル	お坊ちゃん……
ラーロン	どうしても確かめたい事がある。絶対に負けたくない相手がいる。あいつらに勝つためにはお前の力が必要だ
ラーロン	……頼む
主人公	頭を下げた状態で発せられる言葉は真剣そのもので、そこに嘘偽りが無い事をデイルは悟る。
主人公	そもそも、この男がごまかしやその場しのぎで頭を下げるわけはない。だからこそ、今のラーロンがどれほどの決意の元にこうして頼みに来ているか、デイルは改めて理解した。
ラーロン	……
デイル	ふぅ、まいったねえ、俺様こういうノリは結構嫌いじゃないのよね
主人公	いやあ本当に参った、と頭をかきながらデイルは楽しそうに笑い両手を挙げた。
デイル	いいぜお坊ちゃん、あんたの勝ちだ。正直そこまでやられちゃあ、こっちも断れないぜ
ラーロン	……礼を言う
主人公	そういって差しだデイルの手を、ラーロンはしっかり握り礼を言う。そんなラーロンに、本当に楽しそうにデイルは返した。
デイル	よせよお坊ちゃん、調子が狂うぜ。それに実は俺様も考えてたのよね
主人公	そこで言葉を切り、今度は真剣な顔で小さく笑いながら。
デイル	全てを出し切った白鷺姫との、全力の戦いをな
主人公	胸中で姫に謝罪しながらも、デイルは面白くなってきた展開にワクワクしていた。そんなデイルを見てラーロンもある決意を固める。その刹那。
？？？	面白そうですね、その話一枚かませてもらえませんか？
ラーロン	なに！？
主人公	一体いつからいたのか、夕焼けに染められた大聖堂の暗がりから、ゆっくりと人影が現れた。
主人公	その姿は。
デイル	フォンちっち！？
主人公	今日編入してきたばかりの、竜魔の紅刃その人だった。
