デイル	おっしゃあ！！　海だああああああ！！
姫	……なんか、妙にテンション高いなデイル
デイル	おいおい姫っち、何言ってんの、お前。海だぜ海。それも女の子達と一緒にっ。それも全員が全員最高クラスの美少女ばかり！
デイル	これで高くならない方がおかしいでしょ。って、まさか姫っち、男にしか興味持てないとか！？　俺様、貞操の危機！？
デイル	あべしっ！
ヴェル	ふざけたこと言ってると本気で殺すわよ……
デイル	ひでぶっ！
フォン	姫先輩を侮辱するなんて、生きてきたこと後悔したいですか……
デイル	……すみません。もう後悔してます……
主人公	……デイルも結構頑丈だよなあ……。
ヴェル	お待たせ、ヒメ♪
フォン	お待たせしました、姫先輩♪
主人公	コロリと変わって笑顔の二人。まあこれに関しては何も言うまい。
姫	いや、思ったより早かったよ。にしても……
主人公	あまりジロジロ見るのは失礼だと分かっているが、それでもついつい見てしまう。もう何度か見ているはずなのに。
姫	二人とも、その、やっぱり似合うな
ヴェル	ありがとう、ヒメ。で、でも、そんなに見られちゃうと、やっぱりちょっと恥ずかしい……
フォン	どうぞ、姫先輩。記憶の隅々にまで、フォンの身体を記憶して下さい。ホクロの位置とか調べてみますか？　ちょっと恥ずかしい位置にもあるんですけど……
紅	ここまで正反対な反応なのも面白いな
アミア	わたしはむしろ、フォンさんの変わりっぷりにビックリだよ。あれ、ほとんど別人だし
ノート	誰かを好きになると女の子は変わるものですよ、アミちゃん
アミア	ほほう。それは自分の経験談によるものですかぁ、お姉ちゃん
ノート	はい。なんていうか、胸の奥がいつもあったかくて、姫くんのために頑張りたいなって思えるんです
オペラ	うっわぁ、堂々とノロケましたよこの方。そんなこと言うのはこの胸かこの胸か
ノート	きゃあっ。オ、オペラさん、水着脱がそうとしないで下さいーっ
ウルル	ダ、ダメだよオペラぁ！　やめなさぁい！！
カミシア	パパー、この水着見て見てー
負け組	って、あっさり抜け駆け！？
姫	そういえば、結局ノートは水着どうしたんだ？　サイズ合わないとか言ってなかったっけ？
ノート	そうなんですけど……
アミア	もう、聞いてよお兄ちゃんっ。わたしがちゃんといいのを買っていってあげたのに、お姉ちゃん着てくれないんだよ！
ノート	当り前です！　あ、あんな……あんなはしたないの着たら、姫くんに嫌われちゃいますっ
姫	……いったいどんなの買ってたんだ、アミア……
アミア	別に普通なんだけどなあ。濡れたらスッケスケになるけど。お兄ちゃんになら今更じゃん
デイル	ちなみに、俺様もいるんだぜいっ
アミア	デイルは死んでろぉ！！　れーう゛ぁていーん！！
デイル	って、本気で神話級魔法使おうとすんなー！！
主人公	そして、砂浜で魔法大戦を始める二人。ケガだけは気をつけろよー。デイルの場合ケガどころか蒸発してるかもだけど。
ノート	というわけなので、そ、そこまで大きく変わったわけじゃないので、少し詰め込む感じで……
主人公	……それでか。ノートの胸のあたりがやたらと凄く感じるのは。まあ、あまりジロジロ見ないように気をつけよう。失礼だし……見たいけど……。
紅	……あ、あんまり見ないでくれ、姫。その……さすがに恥ずかしい
主人公	こっちにも罠あったー！
ウルル	やっぱり、お胸は大きい方がにいさま喜んでくれるのかなあ……
オペラ	ウルルさま、そう気を落とさないでください。もしウルルさまの胸が大きくなられたら……
オペラ	私がこの場で切腹して死にます！　ダメー！　そのままのウルルさまでいてくれなくちゃいやなのー！！
ウルル	ええええ？！　やめてオペラ、ナイフ取り出すのはやめてえ！
姫	……なんていうか、オペラさんだなあ……
カミシア	その一言だけで説明できちゃうことが、一番問題だと思うよ、パパ
姫	それで、その勝負に勝った方の背中に、俺はオイルを塗ればいいのか？
ヴェル	ええ、お願いねヒメ。その……手がす、すべっちゃうのとかも、有りだから……
フォン	はい、お願いします姫先輩。フォンの身体全体あますところなく♪
主人公	それって、かなりやばいんじゃ……。
姫	俺は別に、二人とも塗ってもいいんだけどなあ。背中くらいなら……
オペラ	うっわ、この男つまんねー
姫	ひでぶ！
主人公	ひ、一言で殺しに来たぞこの人。
オペラ	ま、乙女心を煽っておもしろおかしく着色しながら引っかき回す楽しさという乙女心を分からない白鷺さまは置いておきまして
主人公	おかしい。乙女心がそれだというなら、今まで俺が信じていた乙女とはなんだったのか。
オペラ	それでは、遠泳勝負などいかがですか？
ヴェル	遠泳？　また随分と大変なの選ぶわね
フォン	うーん、せっかく姫先輩と遊びにきたわけですし、フォン、あまり疲れるのはご免被ります
オペラ	あら、いいんですかぁ、そんなこと言って。これからの私の話を聞いても、果たして同じことが言えますかねえ
主人公	……誰がどう聞いても詐欺の匂いしかしません。
オペラ	いいですか。遠泳は体力勝負です。疲れます。無茶ありまくりんぐです
オペラ	その結果、もし途中で溺れたりしたらどうなります？　当然ながら、皆さん必死で助けます。けれど、なんということでしょうっ。助けてみても目を覚まさず！
ヴェル	ちょ、ちょっと待ってっ。まさか、その続きは……
フォン	で、伝説の……人工、呼吸……
オペラ	その通りです。モチのロンです。その小さく可憐な唇に自らの唇を重ね、命の息吹を注ぎ込むのは当然、白鷺さま……
オペラ	あれだけハーレム拵えて、ラッキースケベで好き勝手やってるくせにえらいヘタレな白鷺さまですが、命に関わるとなれば話は別です
オペラ	それはもう、すっっっっっっんごいディープなやつをしてくださるに違いありません。そりゃもう、舌だ唾液だなんて甘っちょろくてアクビが出ちゃいますよ、ええ
ヴェル	勝負よフォン！　沖に浮かぶあの島までの往復で！
フォン	受けて立ちますヴェルさま！　それはもう、途中で溺れてしまうかもしれないくらいの全力で！
オペラ	それではお二人とも、スタート！！
ヴェル	行くわよおおおおおおおおおおおおお！！
フォン	負けませええええええええええええん！！
主人公	かくて、二人は凄まじい勢いで海へと飛び込んでいった。
紅	女って……怖いな……
カミシア	女というのは怖いのう
ウルル	ウルルはむしろ、おぺらがこわひです……
オペラ	おーほっほっほ。やはり大勢で楽しむ時にはこれくらいの遊び心がありませんと♪
姫	あんた、さっきは乙女心とか言ってませんでしたか……
主人公	ちなみに、この遠泳勝負の結果は。
姫	えっと……二人とも、泳ぎ切ってるんですが……
ヴェル	な、なんで溺れてくれないの、私……
フォン	フォン、体力には自信あるの、忘れてました……
ウルル	お二人とも同着だったんですけど、引き分けでいいのかなぁ
紅	むしろ、二人とも敗北なんじゃないのか？
オペラ	それじゃま、間をとって私などはいかがでしょうか、白鷺さま。はい、ぶちゅーっと
姫	……マヨネーズでも吸ってて下さい
オペラ	ちゅうーっ
主人公	俺は、どこかから取り出したマユネーズのチューブを本気で吸い出したオペラさんを尻目に、その場を後にした。
主人公	他のみんなの様子を見に砂浜を歩けば、そこにカミシアの姿が見えた。
姫	カミシア？　何やってるんだ
カミシア	あ、パパ。見ての通り、お城作ってます
姫	城って……また凄いの作ったな……
主人公	砂浜にそびえるそれは、確かに城だった。なんていうか、個人が遊びで作るレベルじゃないような気がするんだが。
カミシア	えっへん。凄いでしょ
姫	ああ。さすがにこれは驚いた。大抵は、ここまでいかずに崩れるだろ
カミシア	やるからには全力で、が私のモットーだもん♪　まだまだおっきくするんだから
姫	なるほど。それじゃあ、また大きくなったところで見に来た方がよさそうだな。邪魔になりそうだし
カミシア	うん、楽しみにしててね
主人公	俺はそんな笑顔のカミシアを残し、その場を離れた。
ノート	あ、姫くん
主人公	丁度海から上がったらしいノートが、砂浜へと歩いてくる。
主人公	濡れた髪からポタポタと垂れる滴と、身体を伝って落ちる水滴とがなまめかしい。
主人公	ノート、本当にスタイルいいなあ……。
ノート	あの、ボクの身体、何かついてます？
姫	おっきな肉まんが二つもついてる。これはおいしそうだー。もいじゃいたいなあ
ノート	きゃうっ。み、見ないでくださぁい
姫	全然似てないから俺の名前を語るなアミア
アミア	ちぇー、バレたかー
姫	バレないと思えるお前が俺は不思議だよ、ってノート？
ノート	あの……姫くん、もぎたい、ですか……？
ノート	姫くんが、どうしてもって言うなら……ボクは……
姫	……おいアミア
アミア	いやぁ、すっかり騙されていらっしゃいますねえ。さすがお姉ちゃん。可愛いなあ
姫	可愛いって問題じゃないだろう！
主人公	真っ赤になりつつも、期待のこもった目で、チラチラと俺を見上げてくるノート。
主人公	……これってまさか、本気で揉んじゃったりしないと、ダメ？
ノート	あの……やっぱり水着の上からじゃダメですか？　直接じゃないと……
主人公	俺が中々動かないことに疑問を抱いたのか、さらに危険に踏み込むノート。
ノート	こんなところで脱ぐのは恥ずかしいですけれど……上から手をいれてもらうのなら……
アミア	うわっ、お姉ちゃんだいたーん
主人公	あ、もうダメだ。俺、限界。
姫	アミア、責任もって誤解を解いておくように
アミア	え？　あ、こら、逃げるなおにいちゃーん！
主人公	これが逃げずにいられるか！　男にはなあ、ガマンの限界っていうのがあるんだよ！
主人公	そして俺は、風になった……。
姫	はぁ……はぁ……はぁ……
主人公	ほんと、偉いことになった……ノートのスタイルであんなことやられたら、本気でもたない……。
主人公	って、ここはさっきカミシアのいた……なんかもめてるな。
カミシア	なに？
デイル	ああ、いや悪い悪い。これだって充分大きいよな、うん
カミシア	大きいと思ってるようには聞こえないぞ
デイル	いや、本当に思ってるって。ただまあ、俺様がカミ子くらいの時に、これよりでかいの作ったことがあったんでねえ
デイル	周囲のお姉ちゃんに、俺様の凄いとこ見せつけたくてさ
主人公	理由がほんとにデイルらしいな……。
主人公	にしても、なんていうか、ほとんど子供のケンカなんだが……デイルの奴わざとか？
カミシア	いいだろう。私の全力、教えてやる！
カミシア	私を本気にさせたこと、後悔させてやるからなっ
デイル	ああ、期待しちゃうぜえ
姫	なんか、妙に煽ってたな。何かあったのか？
デイル	いやいや。子供ってのは、ああいうライバル意識を持って成長していくものなのよ。少しくらいは煽ってやった方が、面白いもの見せてくれるのさ
姫	そういうもんか？
デイル	ああ。後で見てみな、ちょっぴり可愛くなったお城が見れると思うぜ
デイル	って、何よこれっ！？
カミシア	どうだっ！
デイル	……いや、どうだ、って、マジで作ったわけ？　これ
カミシア	当然だ。私が本気になればこれくらい簡単だからな。ふふーん
デイル	降参。すいませんでした。さすがにこんなのは作ったことないわ、俺様
主人公	煽ること自体は正しかったらしい。ただ、デイルが思っていたよりも遥かに負けず嫌いだったみたいだなあ、カミシア……。
