ヴェル	ぜえ……はあ……ぜえ……はあ……つ、次こそは……溺れて……
フォン	はぁ……はぁ……竜族の血、でしょうか……この体力が……恨めしい、です……
姫	……ひょっとして、あれからずっとやってたのか……？
紅	途中でわざと溺れようともしてたんだが、それだと相手に競争で負けるだろ。それがどうにも納得いかないらしくて常に全力で挑んで……
ウルル	それで、いつも泳ぎ切っちゃうんです……
オペラ	恋する乙女って……美しいですねえ……
姫	うわー……オペラさん、ほんと眩しい笑顔ー
姫	カミシアは、楽しかったか？
カミシア	うんっ。すっごい楽しい思い出になったよ。デイル土下座させたし♪
デイル	……うう、お前の娘さんまじ容赦ない。日に灼けた砂浜で土下座だぜ。俺様、あんな焼き土下座初めてよ
デイル	磨きに磨いたお肌がもう真っ赤っか
姫	カミシア相手にいじりすぎるからだ。逆襲されてどうする
デイル	はあ……俺様もう二度と子供は甘くみないことにする
姫	そうしろ。最近の子供は本当に強いぞ
主人公	俺は、その視線の先にいるお子様ボディに目をやった。本当に小柄だったなあ……。
アミア	なにかなあ、お兄ちゃん。何かとーっても言いたそうだよねぇ
姫	いや、そんなことはないぞ。あれはあれでその……いいものだなあなんて思ったりはしていない
アミア	もう。お兄ちゃん、色々と思い出してるでしょう。顔に出てるぞ
姫	えーと、そんなことは……
アミア	ふふーん。でもまあしょうがないかなあ。一生の思い出作っちゃったもんね、お兄ちゃん
姫	ま、まあ、な
主人公	こういう場所で答えさせるのは勘弁してほしいとも思うけれど、男として、ああいう行為を無かったことにするのだけはいけないしな。
ノート	アミちゃん、姫くんと何か作ってたんですか？
アミア	うん。男の子と女の子、どっちだと思う、お兄ちゃん♪
姫	言ってることは間違って無いけど……でも人として間違ってたかもしれない俺……
アミア	なんて、冗談冗談。引っ張ったりしないから安心していいよ、お兄ちゃん
ノート	えっと……子猫でもいたんですか？
主人公	キョトン、と首を傾げるノートの純粋さが、今は心から眩しかった。
紅	よし、ヴェルとフォンも回復してきたみたいだし、そろそろ帰るぞ、みんな
ノート	ちゃんとお着替えしないと、ですね
アミア	覗いたら殺すぞー、デイルー
デイル	いや、本気で殺されるんだろうなーって分かってるから大丈夫です、はい。でもまあ、ちょーっと残念よね
姫	残念って、何がだ？
デイル	決まってるでしょ。俺様としてはもうちょっと、いや、もういっそのこといつまでも！　この美少女軍団の水着姿を見ていたいんだけどねえ
ヴェル	あんまりいやらしい目を向けてると、その目を潰すわよ。まあ、褒められてるわけだから今回は許してあげるけど
フォン	そうですね。デイルさんでしたら仕方ありません。触れることはできないわけですから、見ることでしか、その汚らわしい欲望を静められないわけですし
デイル	それもちょっぴり酷くない？　姫っちだって男なんだし、俺様とおんなじ欲望持ってんのよ
ヴェル	ヒメのは綺麗だもの
フォン	はい。それはもう七色に光り輝く美しい欲望です
姫	いやそれ、どんな欲望？
カミシア	でも、パパの欲望って言われてもピンと来ないよね。あまりがっついたりしてないもん
ノート	はい。姫くんのは、その……綺麗な欲望ですから
紅	そう、だな……あまり嫌だって思わないし
アミア	デイル、あんた脳みそ腐ってるよね。お兄ちゃんと一緒にするとかおかしいよ
ウルル	にいさまの欲望はあったかそうです♪
オペラ	七色といいますか、むしろちょっぴり黄色がかったような白い欲望ですよねー
夢持つ乙女達	…………
主人公	……素敵なはずの夕焼けの風景が、一気に最悪の思い出に変わりました……。
