主人公	暗い夜空に煌々と輝く月を、トリアは学園長室の窓越しに眺めていた。
主人公	いつもと同じ月。にも関わらず、いつもよりも眩しく見える。まるで何かの予兆のように。
トリア	……困ったことに、こういう時の予感は外れたことがないのだよな
ルアン	そうね。妙に嫌な予感がする……
バリアリーフ	こんなざわめく夜は、あの日以来ですわ。竜王様と竜王妃様が亡くなられた、あの事件の日……
ミリオ	やはり、あの賊でしょうか
トリア	可能性は、それが一番高そうではあるな。さて問題は、どこからどうくるか、だが……
主人公	学園長室には、普段ならありえない四人が揃っていた。それは、今の全世界における最強の布陣。
主人公	滅界戦争を生き残った、紛れもない魔神達。
ルアン	学園のセキュリティを信じるなら、問題無い、と言いたいところだけれど
バリアリーフ	あの者達は、生徒白鷺達の模擬戦の際にも忍び込んでおりますわ。どのような手段を用いているのかは分かりませんが……
ミリオ	セキュリティは効果がない。そう思った方がいいですね
主人公	本来ならば、誰もが盲目的にセキュリティを信じ、警戒を甘くする状況。だがこの四人に、そんな様子は微塵もなかった。
トリア	あの婿殿達の模擬戦の時は、下手に手を出すことで本気にさせる方が危険だと判断し、あえて見守った
トリア	大世界杯では、あえて泳がし、ミリオ殿に出向いてもらった。だが、その力はウチらの想像よりも上だった
トリア	そして、皆も気づいているだろう。奴が最後に残したあの言葉……
主人公	勇者とは一人でなるものじゃない。
ルアン	なぜかしら。どこかで聞き覚えがあるのよね……
ミリオ	あの賊、いったい何者なのでしょう。あれほどの腕の持ち主、もし滅界戦争で手合わせしていたなら、忘れることは無いと思うのですが
バリアリーフ	宰相ミリオをあれほどまでに追い詰める者が野に隠れていた、とは考えたくありませんわね。あんな手練れがそう何人もいられても困りますもの
ミリオ	まったくです。そんなことがあれば、私も自信をなくしてしまいそうですよ
トリア	さて、そろそろお茶会の準備が必要なようだな
ルアン	そうね。確かクッキーがこの辺に……
トリア	ああ、こら待てるーにゃん！　それはウチの秘蔵のっ
バリアリーフ	学園長。また経費で買われましたわね。そろそろ監査に報告しますわよ
ミリオ	困ったものです。トリニティの経費は、全世界によってまかなわれているのですよ
トリア	ええい、そう言いながら食うなお前ら。まったく
トリア	お客さんがいらしているというのに
主人公	その言葉と同時に、四人の視線が入り口の扉へと向かう。そして、それを待っていたかのようなタイミングで、扉が開いた。
ゲン	おっと、こいつぁお揃いじゃねえか
主人公	愉快そうに笑いながら、この四人のいる場所へと正面から入ってくるゲン。その足取りには少しも恐れや緊張はない。
ゲン	なんだなんだ、紅茶に菓子まで用意たあ、まるで同窓会みてえな集まりだな
ミリオ	想像はしていましたが、まさか本当に正面から来るとは……
バリアリーフ	まったくもって愉快な御仁ですわね
ルアン	お待ちしてました、侵入者さん
トリア	うむ、よく来た。まずはお茶でもどうだ。睡眠薬くらいは入っているかもしれんがな
ゲン	ったく、相変わらずだなお前らは。少しも変わっちゃいねえじゃねえか
ゲン	侵入者様がこうやって正面から来てんだぜ？　少しくらいは驚きやがれ
トリア	うわー、びっくりー
ルアン	なんてことでしょう。こんなところから侵入者が
バリアリーフ	セキュリティはどうしましたの？　ありえませんわ
ミリオ	まさか堂々と正面からとは。ありえん
ゲン	うっわ、ガチで棒読み。ったく、そうだよなあ。こういう奴らだったんだよ
ゲン	だがま、変わってないようで嬉しいぜ。で、この紅茶、マジで睡眠薬入ってんのか？　本気で入れかねねえからな、トリアちゃんなら
トリア	うむ。魔神すらも一撃で倒れ二度と目を覚まさんくらいに強力なのを用意はしていたんだがな
ゲン	それ、睡眠薬でなく毒薬だろうが
トリア	ま、似たようなものだろ
トリア	でだ。お主の力量は充分に把握した。ウチら四人相手でも、一歩も引かずに戦うだろう。だがその前に、少し話をしたい
ルアン	極上のダージリン、用意してますよ
バリアリーフ	こちらは、学園長が横領で用意したお茶菓子ですわ
ゲン	横領って、それはまずいんじゃねーか、トリアちゃんよ
トリア	安心しろ、証拠は残しておらん。というわけでだ、ちゃきちゃき話せ。お主、何者だ？
ゲン	聞いたところで無駄だと思うぜ。どうしてもってんなら話してやらんでもねえが……
主人公	ゲンは剣を抜くと、それを床に突き立てた。
ゲン	こいつでやりあった方が早いと思うがねえ
主人公	ニヤリと笑うゲンの顔には、やはり少しの焦りもなかった。
