主人公	トリニティ裏側の橋を渡り、そのまま丘へと登る。予想通り、追っ手はない。ゲンは、本気で俺を試すために、トリニティを占領したようだ。
姫	みんな、大丈夫か？
主人公	荒い息をどうにか静めながら、周りを見回す。全員多少の疲弊はしているものの、誰一人として欠けてはいない。
主人公	あの状況での強引な突破にも、さすがというかしっかりとついてきてくれていた。
デイル	ま、姫っちの咄嗟の指示のおかげで脱出は成功。戦力の立て直しは可能と相成ったわけだが……
デイル	これからどうするよ、姫っち
主人公	デイルの言葉に、みんなが俺を見る。俺の方針にしたがう、そう思ってくれている証だ。
主人公	だけど俺は、その言葉に何も返せない。どうするべきなのかが分からない。
主人公	トリニティの奪還。目的とすべきはこれ一つだ。けれど、どうすればそれが可能になる。
主人公	ゲンとミヤ。あの二人を相手にするだけでも、あれほどの苦戦をしていたのに、更に、あの四人までもが……。
デイル	戦争終結の英雄達、まさに全世界最強の勇者パーティーによって占拠されたトリニティを奪還せよ。こいつが試練ってわけだ
デイル	つーか、難易度高すぎない？　バランス調整おかしいでしょって
紅	ゲンさんとミヤだけならまだしも、まさか学園長たちまでもが向こうにつくとはな
ヴェル	信じられないわ、あの不良親。自分が何をしているのか分かってるのかしらっ
ノート	……多分、分かってます。トリアさん、自分のことを勇者の一員だって言っていました
ノート	恐らくは、かつて自分たちが仲間であったことを思い出して、前勇者として、現在の勇者の壁となることを選んだ、ということだと……
アミア	あちゃあ……お母さん、また無理言うなあ……いくらなんでも相手が悪すぎるよ
ウルル	かつての勇者パーティーを倒して、自分が勇者であることを示せって言うことですね
フォン	向こうの言いたいことは分からなくもないですが。無理無茶無謀にも程がありすぎます。余程綿密に考えて動きませんと、相手の思うつぼですね
紅	オペラさん。昔、あの人たちと一緒に戦っていたオペラさんから見て、どうですか？　あたしたちが勝つ方法はありそうです？
オペラ	そうですねえ。あの四人に勇者ゲンとその娘様の驚異の六人パーティー。どう考えても、間違いなく、今選べる世界最強の六人かと
オペラ	いやあ、普通は無理ですね。勝てる可能性完全に０。道筋すら見えません
オペラ	ですが、滅界戦争の時も同じですよ。たかが人族がこの戦争を終わらせる確率、０。勇者さまは、そう言われていたはずですから
ヴェル	だったら簡単ね。ゲンはかつて世界を相手にし、０を１００へと覆した
ヴェル	けれど今度の敵は、最強といってもたったの六人。六人を相手に、０を１００にすればいいだけ
デイル	あらぁ、そいつは簡単、素敵だねえ……って、いやいやさすがにそれはないから、姫さん
主人公	今の状況を確認すべく、様々に意見をぶつけ合うみんな。けれどそんな中、俺はみんなとは違う不安を抱いていた。
姫	……なあ、みんな。この試練、俺はみんなの力を借りていいのかな……
主人公	そんな俺の疑問に、みんなが驚きの視線で俺を見る。
ヴェル	どういうこと、ヒメ……？
姫	トリニティ奪還……みんなの力を借りれば、できるかもしれない。でもそれは、あくまでもみんなの力だ。ゲンに、俺の力で挑んだことにはならない
姫	これは、ゲンが俺に示した試練なんだ。俺の力を見せられなければ、俺の勝ちにはならないんじゃないか？
ノート	それは……でもヒメくん。あの布陣に一人で挑むなんて、絶対に不可能です！　ボクやヴェルちゃんだって絶対にできないっ
姫	……けれど、それができなければ勇者になんてなれない
姫	ミヤが言っていた通りなんだ。たくさんの期待を背負って、その期待に応えられなければ勇者じゃない。勇者には、それだけの力が求められる……
主人公	一人でどうにか出来る事態じゃないのは分かっている。けれど、ここでみんなの力を借りてしまっては、俺の力はどこで測られるのか。
主人公	勇者が俺に示した試練。俺が勝つには、あくまでも俺個人の力を見せる必要がある。
紅	それはその通りかもしれないが、姫、それはさすがに夢物語だ。そんな力を持っている人間、決していない。落ち着いて考えてみろ
デイル	だがまあ、姫っちの言うことにも一理あるぜ。この戦いの勝利条件は、ただやっこさんたちを倒せばいいってものじゃない
デイル	姫っちが、あの前勇者様から勇者の称号をぶんどること。だったらそこには、姫っちの力がなけりゃダメってことだ
アミア	だったら、デイルがやってみな
カミシア	パパ……これだけは忘れちゃだめだよ。あのゲンだって、無敵じゃない。一人でなんでも出来るわけじゃない……
主人公	どうしていいか分からない。迷路のような現実の前にはまり込んでしまった俺を慰めるように、カミシアが俺を見上げながら言う。
主人公	確かにその通りだろう。ゲンだって、一人で戦争を止めたわけじゃない。
主人公	けれどそれでも俺は、勇者を目指す者として勇者に力を見せなければいけない。見せられなければ俺の負けだ。
主人公	俺が、ゲンに見せられる力なんて……。
？	ふん。グダグダとうるさい奴らだ。少しは静かにできんのか
主人公	ただ俯くことしかできなかった俺の背後から、唐突に憶えのある声が響いた。驚きつつも振り返り、そこに立つその男の姿を俺は見た。
姫	ラーロン！？　お前、どうして……
ラーロン	どうして？　まったく、これだから脳の皺が足りない者は……
主人公	ここ数日、街の広場で会った後も、やっぱり学園を休み続けていたラーロン。そのラーロンが、いかにも不機嫌そうな顔で俺を睨んでいる。
ラーロン	いいか、ここにはな、私の方が先にいたのだ。この丘の上にて思慮深く佇んでいた私の前に、普段と様子の違うトリニティの姿が映った
ラーロン	そして、こちらへと走ってくる貴様達がいた。これは何かあったな、と理解した私は、状況確認するために様子を窺っていたというわけだ
フォン	要約すると、怖くて隠れていた？
ラーロン	断じて違う！
カミシア	そもそも貴様、パパに敗北して以来学園にも来ていなかっただろう。一体何をしていたのやら
ラーロン	ふん。ただ考えたいことがあった、それだけだ。力を得るよりも、優先しなくてはいけない考えがな
ラーロン	それがまさか、こんな形になるとは夢にも思っていなかったが……
主人公	ラーロンは学園を一瞥すると、悔しげに顔を歪ませた。そして、そのまま再び俺を睨む。
ラーロン	ならば次は私から聞こう。貴様は何をするつもりだ。いや、何をしている！
主人公	それは、紛れもない俺への一喝。だがそれでも、俺は答えられなかった。
主人公	今の俺の力で何ができるのか。ゲンに挑むにも、俺の力ではその資格すらないように思える。
主人公	どんなに覚悟があったとしても、それに応えられる力がなければ無意味でしかない。叶えられる力があってこそ、理想や希望は現実に変わる。
姫	……分からない。やりたいことは確かにある。やらなくちゃいけないことが……
姫	だけど、今の俺に、それをやれるとは到底思えない……
ラーロン	ふん。随分と負抜けたものだな
主人公	明らかな侮蔑を込めた視線と共に、ラーロンは剣を抜いた。
ラーロン	いいだろう。ならば貴様のその、ただでさえ足りない力とやらを、私自らが試してやる。貴様の持つ力のすべてを持って、私を退けてみろ！
ラーロン	もっとも、できるのならば、だがな
主人公	その顔が、ニヤリと意地悪げに歪む。と、同時に、凄まじい速度の斬撃が振り下ろされた。けれど、その動きそのものは読めている。俺は横に跳ぶとそれをかわした。
主人公	が、その行動によって開いた間合いを利用し、ラーロンが魔法を唱える。
ラーロン	魔法を放つ準備のための時間を、自ら作ってくれるとはな！　『業爆の魔弾』
主人公	ラーロンの周囲に、次々と現れる巨大な火球。まずい、あれ一つでも俺を倒すには充分すぎる威力がある。
主人公	俺は、全力で走り出した。
ラーロン	放て！
主人公	思い切り振り下ろされた腕の動きに合わせて、火球の一つが俺を襲う。
主人公	だがそれでも、当たりさえしなければ爆発はしない。俺は最小限の動きでかわしながら、ラーロンの懐へと入った。
ラーロン	ふん。それしか貴様の手はないだろうからな
主人公	その言葉が、俺の胸へと突き刺さる。真眼での先読みによる剣術での力押し。それしかできない自分の弱さを、俺は昨日思い知らされたばかりだ。
主人公	背筋を走る冷たい感覚に、俺は慌てて後ろに飛び退く。同時に、ラーロンの剣が薙ぎ払われた。
姫	……完全に読まれてるのか……
ラーロン	当然だ。一つ覚えのワンパターンなど、この私に効くか！　放て！
主人公	背後から、凄まじいプレッシャーと熱を感じる。これは、まさか！？
主人公	慌てて回避に入るが間に合わない。ラーロンの命令によって俺の背後から戻ってきた火球は、俺の背中で炸裂する。
姫	うああああああ！！
主人公	肉の弾け飛ぶような猛烈な痛みと、身体を焼き尽くそうとする灼熱に、俺の口から悲鳴が響く。
主人公	俺は慌てて地面を転がると、その炎を消した。
ラーロン	それで終わると思うな！
主人公	まずい、動きが読めない。いや、読めはする。けれど、いくつもの選択肢が俺の目には映っている。どの動きが正しいのかが分からない。
主人公	俺が、自分の見つけ出したラーロンの動きを信じられないんだ。だから、その迷いが俺の中にいくつもの選択を作る。
主人公	振り下ろされるラーロンの剣をどうにか受ける。だめだ、かわせない。受けることがやっとだ。カウンターなんてもっての他。
主人公	迷いがいくつもの剣筋となって、俺の思考を邪魔してくる。真眼なんてまったく使えていない。
主人公	目の前で繰り出されるいくつもの攻撃を、どうにか受け続けるのが今の俺の限界。それも多分な運に支えられてだ。
主人公	そして、ラーロンの一撃を受けた俺の身体が後ろへと吹き飛ぶ。
主人公	俺自身、既に立つのもやっとの状態なのは分かっていた。けれど、倒れられない。
主人公	前にヴェルに教わった、決して自分からは倒れるな。その教えが俺の中で生きている。
主人公	これがどんなに絶望的な状況であっても、それを忘れるわけにはいかない。
ラーロン	どうした、もう終わりか。立つことしかできないのか！
ラーロン	大世界杯での戦いぶりはただのまぐれか！　所詮は張り子の虎か！
主人公	激しく浴びせられるラーロンの怒声。けれどなんでだろう。俺は、その言葉に決して嫌悪を抱けない。むしろそこに、別の意味すら感じていた。
姫	ぐあぁ！
主人公	またもラーロンの一撃に弾き飛ばされる。もう何度目かも分からない。
ラーロン	結局は、他人の力を借りていただけか！　そろそろ貴様自身の力を見せてみたらどうだ！
主人公	そしてその言葉が俺を貫いた瞬間、俺は心の中で叫んでいた。
主人公	違う！　俺は、力を借りただけじゃない。みんなが俺を信じてくれて、俺の思い描いた通りに動いてくれたからだ。
主人公	みんなが俺に期待してくれて、それに応えるために、俺は俺の力を、指揮という形でフルに使った。
主人公	そうだ、あれは俺の力だ。どれがだ？　指揮が？　指揮で使ったみんなの力が？
主人公	あれだけの力があった。集まっていた。それだけの力が俺を信じてくれた結果、勝つことができた。
主人公	なら、なんでみんなは自分を信じてくれた？　それは決まってる。
主人公	それは、みんなが自分のしてきたことを認めてくれたからだ。
主人公	そんなみんなを自分も信じ、その力を自分の思う通りに動かした。
主人公	なら、それは自分の力じゃないのか。
主人公	ゲンの残した、勇者とは一人でなるものじゃない、という言葉の意味に、俺はやっと辿り着く。
主人公	ゲンは一人で勝ったわけじゃない。魔族、親族、竜族、人族、すべての仲間達の力を使って勝った。だったら。
主人公	だったら。
主人公	だったらっ。
主人公	だったら！！
姫	ヴェル！！
主人公	俺は全力で、その名前を呼んだ。
主人公	みんなの顔に驚きが浮かぶのが分かる。けれど一人だけ、待っていたとばかりに飛び出した黒い姿があった。
ヴェル	ハデラぁ！！
主人公	全力で薙ぎ払われる黒い刃。それを、やはり全魔力を込めた剣で受け止めるラーロン。
主人公	だがそれでも受け止めきれなかったヴェルの破壊の力は、ラーロンの身体をそのまま背後へと吹き飛ばす。
主人公	その場にいる全員が、言葉を失っていた。俺とラーロンの一騎打ちに、俺の求めに応じてヴェルが入り、一撃で倒した。それはあってはいけないはずの光景だ。
主人公	けれど俺は、ラーロンの下へと歩くと、ハッキリと言い切る。
姫	これが、俺の力だ
ラーロン	貴様、分かって言っているのか？
姫	ああ、もちろんだ。俺は本当に驕っていたらしい。俺一人の力が、白鷺姫の力じゃない
姫	ヴェル、ノート、ウルル、紅、フォン、アミア、デイル、そしてオペラさんもカミシアも、俺を信じて集まってくれたみんなの力、そのすべてが俺の力だ
姫	俺の中にある力なんてどうでもいいんだ。俺が持っている、俺が使うことのできる力こそが、それが誰のものであっても俺の力だ
姫	この力を集めた自分を、集まってくれたみんなを、俺は信じてる
主人公	俺は何を勘違いしていたんだろう。勇者なんて存在が必要となる戦いに、一人で挑んで勝てるわけがない。それこそ、みんなの期待を無駄にする行為じゃないか。
主人公	滅界戦争をゲン一人で止められたのか？　違う！　絶対に違う！
主人公	だからこそ、ゲンは言ったんだ。勇者は一人ではなれないと。共に戦った仲間が、力を貸してくれた全員が、勇者だ。
主人公	ゲンが勇者だというのなら、学園長も、ルアンさんも、先生も、ミリオさんも……そうだ、オペラさんだって勇者なんだ。
主人公	だからこそ、あの人達はゲンに力を貸した。勇者として、次代の勇者となるはずの者達を、俺達パーティーを育てるために。
主人公	今にして思えば、勇者を一人育てるのなら、才能のある一人を英才教育でもすればいい。それこそヴェルを、ノートを全力で育てればよかったはずだ。
主人公	なのに、この世界を、トリニティという学園を作り上げた。
主人公	それは一人の勇者でなく、後に勇者と呼ばれる大勢の仲間達を一緒に育てるためじゃなかったのか。
主人公	だから、これが俺の力だ。これから勇者と呼ばれることになる、俺達の力だ。
主人公	今見せるべきは俺個人の力じゃない。俺達、勇者の力だ。
ラーロン	ふん
主人公	そこに、怒りや恨みのようなものは何もなかった。それでいい。まるでそう言っているような笑みと共に、ラーロンは立ち上がる。
主人公	ヴェルの一撃は決して軽いものじゃなかった。その一撃を食らっておきながら立ち上がるラーロンに、俺は改めてその実力を知る。
ラーロン	なら見せてみろ。お前のその力がどれほどのものか。その全力を、最大の力を
主人公	言いながら、みんなの姿を見回すラーロン。そうだ。見せよう。俺が手に入れた、俺と共にある力を。今俺が放つことの出来る全力の力を。
姫	みんな、頼むっ
主人公	俺の求めに応じ、全員が武器を抜く。ラーロンの期待に応えるように、その力を見せようと。
ノート	これが姫くんの力になるというのなら
ウルル	ウルルだって、にいさまの力の一部です
紅	勇者、か……まったくもって、自分の無知が嫌になるな
フォン	とりあえず、今は敬意をもってこう呼んであげます。ラーロン＝ハデラ
アミア	ふっふっふ。手加減しないぞっ
オペラ	念のため言っておきますよ。これはイジメではありませんからね。繰り返しますがイジメではありません。ええ違いますとも、んっふっふぅ♪
デイル	ったく。俺様としたことがお前の力、見誤ってたみたいだな。だから、容赦しねえぞ、ラーロン
ヴェル	本当、初めてあなたに敬意を抱いたわ、ハデラ。だから、しっかりとその目に刻みなさい
主人公	みんなが、俺の前に立つ。ラーロン＝ハデラを一人の戦士と魔王と認め、その全力を持って相手をするために。
姫	これが、俺の力。俺の全力だ
ラーロン	そうだ、貴様個人のちっぽけな力などどうでもいい。そんなもので挑めると思っていることがまずおこがましい
ラーロン	貴様が集めたそのすべてが貴様の力だ。胸を張り、そして使いこなしてみせろ！
姫	ああ、分かってる！　行くぞ、ラーロン＝ハデラ！！
主人公	俺の合図で一斉に放たれる俺達全員の力。眩いばかりの輝きが、ラーロンの身体を飲み込んでいく。
主人公	丘の上を、白い光で包み込んでいく……。
主人公	…………。
主人公	……。
主人公	…。
主人公	そこに、ラーロンは倒れていた。わざと直撃を外したとはいえ、それでもその威力は対個人用のものじゃない。城一つを相手にしようというレベルの力だ。
主人公	俺はゆっくりと、ラーロンの下へ歩いていく。
姫	生きてるよな
ラーロン	……まったくもって無様なものだな。こんな形で貴様に見下ろされるとはな……
主人公	当然ながら生きてはいる。意識もしっかりしているようだ。けれど、指一本動かせない、それほどのダメージ。
主人公	俺は、前から感じていたその疑問を、ラーロンへと投げかける。
姫	お前も、記憶が戻っていたんだな。他の三つの扉の記憶が……
ラーロン	……そうだ
主人公	その答えは、予想通り。他世界にいたフォンですら戻っていたなら、ラーロンだって戻っていてもおかしくない。もっと早く気づいてればよかった。
ラーロン	あの時、他の扉の記憶が戻った時、私は初めて第三者としてその光景を見たのだ
ラーロン	私自身の、あまりに無様な姿をな！
ラーロン	悔しかった、あまりにも無様だった。最強の魔王の血族だと、そう胸を張り信じていた力が、まさかここまで矮小だったとは……
ラーロン	そして、分からなくなった。ならば、強さとはなんなのだ。強くなるとはどういうことなのだ。どうすれば本当の意味で強くなれるのだ……
姫	大世界杯は、そんなお前の挑戦だったんだな
ラーロン	今の私が、お前と同じように戦えばどこまで行けるのか……それを見てみたかった
ラーロン	結果は最上だ。負けはしたものの、すべてをやりきったという充足があった……
ラーロン	あれが、貴様の感じていたものだったのだな……ふん、あれなら私が勝てるはずもない
姫	でも、お前はいつから気づいていたんだ？　勇者の答えに
姫	お前は、全部分かった上で俺に勝負を挑んだんだろ。俺に気づかせるために
主人公	俺を叩きのめすためでも侮辱するためでもなく、自分が優越感に浸るためでも怒りを発散するためでもなく。
主人公	ただ、不甲斐ない俺を叱咤するため。教えるために。
ラーロン	……私も貴様と同じなのだ、白鷺姫
ラーロン	かつての私も、憧れたのだ。勇者という存在に。力に
ラーロン	誰もが尊敬し、畏怖し、そして憧れるその存在に。だからこそ、剣を取った。強くなろうと思った
ラーロン	それは、私の驕りから間違った方向へと行ってはしまったが。大世界杯で貴様らに敗れて以来、私は再び考え、そして思い出した。かつて剣を手にした理由を
ラーロン	だからこそ、私はまた憧れてしまったのだよ
ラーロン	白鷺姫、貴様という存在にな
ラーロン	自らの力の弱さに気づき、そして貴様の力に憧れた。自分の目指すものの間違いと目標、その両方を同時に得た
ラーロン	そうして、気がついた。個人の力と勇者の力、その違いに
ラーロン	まったくもって、皮肉なものだ。勇者への憧れを見失った私と、正しく追い続けた貴様。間違えていたがために、私の方が気づいてしまうとは
姫	……勇者ってのは一人でなるものじゃない。お前のおかげで、やっとその意味が分かった
姫	個人の力は、どんな英雄だってたかがしれてる。限界がある
姫	自分を信じて集まってくれたみんなの力、それを集めたものが勇者の力だ。一人じゃない。全員が集まって勇者になるんだ
主人公	昨夜、ミヤにやられてから俺の中でわだかまっていた想いが、勇者の資格という悩みが消えていく。
主人公	俺自身に力が無くていいわけじゃない。いや、むしろなくてはいけない。だけど、俺にも確かにあった。
主人公	ゲンに見せられる力が。俺の力が。
主人公	俺は胸を張り、目の前の力へと手を差しのばす。
姫	だからラーロン、お前も、勇者になってくれないか。俺は正直頼りないから、まだまだ力が必要だ
主人公	予想もしていなかったのか、俺の言葉にラーロンはキョトンと目をしばたたかせた。
主人公	そのまま真っ直ぐに俺を見、わずかながらも思案すると、本当に楽しそうに笑い出す。
ラーロン	くっくっく……あーっはっはっは！　ここにきて、その手を伸ばすか。この私にまで
ラーロン	いいだろう。ただしこの私の偉大な力、使いこなせなかったらただではすまさんぞ！
主人公	伸ばされた俺の手を、ラーロンはそのボロボロの身体で確かに取った。俺はしっかりと、力強くその手を握り返す。
姫	もちろんだ。これ以上ないくらいの見せ場をくれてやる
