主人公	淡い封印の光が、その扉から消えていく。
主人公	地下迷宮、中層にある大広間。その扉の前に立ちながら、姫は小さく拳を握った。
姫	みんな、やってくれたみたいだな
主人公	その先へと進むことを拒んでいた光の壁。それが消えたということは、恐らくは地上の英雄達を、仲間が倒してくれたということ。
主人公	俺はみんなへの感謝を胸に、その扉へと手を伸ばした。そして、ゆっくりと光の無くなった扉を押し込んでいった。
姫	来たぞ、ゲン！
ゲン	ああ、分かってるからそう大声出すなって。響いてかなわねえ
主人公	俺の叫びに、奥の方からゆっくりとゲンが歩いてくる。そこにはいつも通りの笑みではなく、確かな驚きがあった。
ゲン	だがまあ、あの連中を全員、それもこの時間で倒すとはな……正直侮ってたぜ、お前のパーティー
ゲン	だが、そいつはあくまでもお前の仲間の評価でしかねえ。坊主、お前はどれくらいの力を俺に見せてくれるんだ？
ゲン	確かに、一人の力が勇者とは言えねえ。だからといって、個人の力が不必要なわけでもねえ
主人公	ゲンの言葉に間違いはない。けれども、その言葉に対する回答を俺は既に持っている。
姫	あなたを倒せるくらいの力を
ゲン	……随分でっかくでやがったな。それも、ハッタリってわけでもなさそうだ
ゲン	俺の能力はもう分かってんだろ？　魔法、魔力、気鱗その他色々、物理以外のあらゆる力を消滅させる。さあ質問だ。お前は俺にどう挑む？
姫	どうも何もないさ。俺はいつも通りに戦うだけだ
姫	確かに、あなたの力は驚異的だ。あなたの前には、魔族、神族、竜族、そして儀式兵器を持つ手練れの人族、すべてが叶わないかもしれない
姫	けれど、だからこそこれだけは言える
姫	全世界でただ一人、魔法を使って戦わない俺は、あなたにとって天敵だ
主人公	魔力や魔法による攻撃や強化はすべて無意味になる。竜族の気鱗すらも剥がされる。
主人公	人族だって、儀式兵器がある以上は魔法を使っての戦いが基本。攻撃、防御、強化、そしてけん制。あらゆる戦いが、魔力や特殊な力を前提に組み立てられている。
主人公	誰しも、身体にそれが染みついている。ヴェルの魔力を乗せた一撃。ノートの付加魔法による身体強化。ウルルの気鱗ありきの防御と攻撃。紅すらもが速度を上げている。
主人公	今や、その力なしでの戦いはあり得ない。だからこそ、それを無効化されるゲンとの戦いは、すべてを乱されてしまう。
主人公	あって当然の力を失えば、そこにあるのは裸の力。剣士として最高の力を持つゲンの前には通用しない。だから、最強。だから、無敵。
主人公	けれど、俺にはそれがない。魔法がないことを前提の戦いしかしていない。魔法を使うという考えそのものがない。だから、乱されない。
主人公	惑わされることなく、いつも通りの力で、ただその剣の腕だけでゲンと戦える。
ゲン	……くくくく。いい顔してるじゃねえかよ。自分を周囲を未来を、そのすべてを信じてる顔だ。自分が負けるなんてことは少しも考えちゃいねえ
姫	俺一人の力なんて信じていないよ。事実俺は弱すぎる。だけど、みんながくれたこの力なら、俺は信じてる。それだけのものを見せてもらってきた
ゲン	いいだろう。俺が直接やり合う相手として認めてやるよ。正式に、勇者候補として見てやらあ！
ゲン	ミヤ、そっちは任せるぜ
主人公	その言葉に、ゲンの後ろに下がっていたミヤが前に出る。そして頷いた。
ミヤ	はい、任されましたお父様
ミヤ	たとえ過程がどうであれ、勝つのは私たちです。ここまで来たことは賞賛に値しますけれど、結果が伴わなければ、ただ無意味なだけです
ミヤ	白鷺くんとお父様の戦い、邪魔はさせません。私たちは、こちらで男を支える女の戦いといきましょう
