ミヤ	二対一、を想定していたわけじゃないんですね
紅	人数を増やしたところで、ゲンさん相手じゃどうにもならないさ。あの人をどうにかできるとしたら、それこそ本当に姫だけだ
ミヤ	だったら絶望的じゃありませんか？　お父様と白鷺くん、その実力差は絶望的ですよ
紅	実力差、か……そうだな、ゲンさんと姫の間には、あまりに開きすぎた溝がある
紅	けれど、覚えておくといい。姫はそれを、仲間の力で埋めるんだ
紅	姫以上にずるい奴はそういない。だからきっと、今回もやらかしてくれるよ
ミヤ	……本当に、前の扉の時とは違いますね。焦りがありません
ミヤ	白鷺くんを信頼し、ただ真っ直ぐにそこを目指す。本当に女の子してるんですね、紅ちゃんは
紅	否定したって今更だな。ああ、そうだ。姫の前では、あたしは女になってしまう
紅	だけど、それが嬉しいんだ。偽りのない、あたしをさらけ出せているみたいで
紅	それじゃあ、始めよう。あたしとミヤ、お互いに大切な男を守るための、女同士の戦いだ
ミヤ	そうですね。でも気をつけて下さい。私のお父様への想いは、まともに受けると胸やけしますよ
紅	はは、白鷺パーティーなめないでくれ。もう、一緒にいるだけで溜息つきたくなるような連中でいっぱいだ
