主人公	高い壁に囲まれた王都のすぐ外にある草原。俺は、勇者としての第一歩を踏み出すべく、灯と共に王都の外へと繰り出した。
新	ＲＰＧのお約束だな。まずはお城の周りでレベルアップ
灯	でも、最初から伝説の最強武器付きっていうのは珍しいよね
主人公	勇者だからといって、敵をなめてはダメだ。そうやって敗北するのはヒーローじゃなくて悪がやること。
主人公	たとえ伝説の武器を持っているとはいえ、俺はまだ勇者一年生。ここはしっかりとブレイブギアを使いこなせるようにならなければいけない。
新	おし、それじゃ頼むぜ、レイ
主人公	そう言って、俺は右手の甲を上にして突きだした。そこから白い光が噴き出し、翼の生えた小さな少女を形作る。
主人公	長い紫色の髪と白鳥のような白い羽。それはまさに、天使か妖精といった雰囲気だった。
主人公	少女は、俺の顔の前に浮かびながら、まっすぐ俺を見て言う。
レイ	はい。まずマスターには私、すなわちブレイブギアの使い方を憶えていただきます
主人公	少女の名前はレイ。ブレイブギアに宿るサポート用の人格らしい。つまりは、このブレイブギアに宿る人格のようなものであり、マニュアル、ということだろう。
レイ	私は、ブレイブギアの独立型戦闘支援用管制人格プログラム・レイです
新	独立……なんだって？
レイ	独立型戦闘支援用管制人格プログラムです
新	え～と、つまり人工知能ってやつなのか？
レイ	その認識で問題ありません。私は勇者としてこの世界に召喚されたマスターを導き、魔王との戦いに勝利させる事を目的に作られました
新	なるほど……
主人公	確かにまあ、いくら対魔王用兵器と言われても、このギアの使い方とかさっぱり分からないしな。
主人公	とりあえず使ってみればなんとかなるか、と思ってたんだが、解説役がいてくれるならそれは助かる。
新	それじゃあ、改めてレイ。俺は光島　新だ、よろしく頼む
レイ	ラジャー。マスター名、『コウジマ　アラタ』を登録しました
レイ	この私がサポートについている以上、マスターの勝利は絶対無縁です。大船に乗ったつもりでいて下さい
新	いや、勝利に無縁じゃやばくない？
レイ	ああ……あまりに無敵なこの身が口惜しい……一度でいいから敗北の味を知りたいというこの小さな願いすら、やはり聞き届けてはいただけないのですね……
レイ	マスターのいけず
主人公	オリジナルギア。俺達は、そのあまりに偉大な力に宿った意思の力が放つ威厳の満ちた言葉に、何も言うことができなかった……。
主人公	そうして、そのレイに言われて、ブレイブギアの使い方を学ぶために俺は王城を出た。
主人公	灯は、姫さまやアウロラが全力で止めたが、ついていくと言ってきかなかったので、そのまま連れてきた。まあ、俺が守ればいいことだしな。いつものことだ。
主人公	光島新！　勇者への第一歩、踏ませていただきます！
新	早速頼むよ、レイ。俺はまず何をすればいい
レイ	それでは、美少女妖精レイちゃんの『レベル１でも出来る魔王退治講座♪』。早速始めましょう
レイ	れっすんわーんっ。習うより慣れろ！
レイ	そこに、この周辺の魔物達の巣があります。まずは適当にやってサクっと滅ぼしてきて下さい
灯	うわっ、マニュアルさんがいきなりスパルタ！
新	いや、滅ぼしてくるのはいいんだが、操作方法くらいは教えてもらえないとどうにもならないぞ。素手で殴ればいいのか？
レイ	ガッ、とやってグッ、といってキュンッ、って感じでやってみて下さい
新	いや、それどんな感じ？
灯	なんか、レイちゃん教える気まったくないよね……
新	うおっ、すげえ、なんかごっつい小手みたいなの出たぞ！　これで殴れってことなのか！？
灯	ああ、うん。それでやれちゃうとか、さすがの私もドン引きしてるよ、新くん……
主人公	言われた通りにやってみた瞬間、右手の甲から噴き出した光が、瞬く間にごっつい腕になって固まった。
主人公	これ、マジで凄いぞ。力が漲ってきて止まらない。こいつで殴れば、確かにどんな魔物だって一発な気がする。
レイ	この呑み込みの早さ、素晴らしいですね。さすがはマスター、魔物の巣くらいらくしょーらくしょー
レイ	大丈夫。マスターだったら問題ないですれでぃーごー
主人公	うん、これなら確かにやれそうな気がするぞ。これはもう行くしかない！
新	おっしゃー、ちょっくら行ってくるぜー！！
灯	気をつけてねーっ！
主人公	……………………。
主人公	…………。
主人公	……。
新	おーっし、草原の巣のボス、ぶち倒してきたぜ！
主人公	中々のパワーファイターだったけれど、ブレイブギアを装備した俺とパワー合戦とか大失敗だったな。
レイ	いや、ビックリです。まさか本当に倒すとは。人間、気合いがあれば出来るものですね
灯	あれあれ？　さっきレイちゃん、問題ないですれでぃーごー、とか言ってなかったっけ？
新	ふ、当然だ！　どんなピンチでも仲間の声と愛する者達の声援と自らの気合いで跳ね返す！　それこそがヒー・ロー！
レイ	ああなるほど、よく分かりました。今度の私のマスターは、バカ！！　なのですね
新	その通り！　自他共に認める熱血ヒーローバカだ！　悪人退治と人助けは俺に任せろ！
レイ	…………なんでしょう、私今、すっごい敗北感味わってるんですが……。初めてですよ、こんな屈辱を与えてくれたマスターは……
灯	あはは……なんだろう、この会話の噛み合ってなさ……
レイ	れっすんとぅーっ。考えるな感じろ！
レイ	そこに、魔物達の砦があります。さっきと同様にサクっと滅ぼしてきて下さい
灯	また！？　レイちゃん！？　それさっきと同じっ。何も新くんに教えてないよ！？
レイ	フンッ、という感じで、ハッ、とやって、オラオラァッ！　とやってみて下さい
新	おう！　任せろ！　これも勇者の修行と思えばなんてことはないぜ！！
灯	ほ、本当に気をつけてねーっ
主人公	……………………。
主人公	…………。
主人公	……。
新	うっしゃー！　魔物の砦、粉砕してきたぜ！
主人公	さっきのとは違って、今度はスピード型のボスだったな。けれど、俺に攻撃する時は必ず俺の間合いに入る。そこを狙えば問題なしだ。
レイ	なんということでしょう。どうやらマスターは私が思っていた以上にマスターだったようですね
新	当然だっ。なんといっても俺は、お前のマスターだからな
灯	うーん……新くん、会話はちゃんとするべきだと思うよ？
レイ	れっすんすりぃーっ。見事だ。俺が教えることはもうなにもない
レイ	マスターはもう大丈夫です。さあ、さっくり魔王を倒しにいきましょう！
新	おっし、卒業！　いやー、意外となんとかこれちゃうもんだな！
灯	えーっと……うん、新くんが楽しいならそれでいいのかなー
灯	でもレイちゃん、あとで二人っきりでお話ししようか
レイ	なんでしょう……私今、生まれてこの方味わった事の無い恐怖を感じています。アカリさま、怖い子！
主人公	とりあえず魔物の巣や砦を色々破壊しまくりつつ、レイの言うままに歩いていたら、いつの間にやら俺達は魔王城の前にいた。
主人公	さすがは魔王城、その迫力は尋常じゃない。いかにも、ここにラスボスがいる、っていう雰囲気だ。
灯	だけど新くん。いくらなんでもいきなりラスボスさんの所に押しかけちゃうのはまずいんじゃないかなあ。ヤクザさんの事務所とは危険度違うと思うし
灯	ゲームでも、ちゃんとレベル上げてからじゃないと負けちゃうよね
新	確かにそうだな。勇気と無謀は別のもの、履き違えてはいけない
新	だからまあ、軽い様子見にとどめておこう。どれくらいの強さの敵がいるのか、どんな造りになっているのか、情報は必要だ
レイ	さすがはマスター、よくお分かりですね。少なくともここ三十年の間、魔王城の内部に入った人間はいません。内部がどのようになっているかも不明です
新	だったら尚更、だな。本気で攻め込む前に、一度見ておく必要はあるだろ
灯	ほ、本当にちょっとだけだよ。中の雰囲気とか、状態とか、ちょっと見るだけ
主人公	さすがに、魔王城の目の前に灯を置いておくわけにもいかない。必然的に、灯も俺と一緒に中に入ることになる。
主人公	守らないといけない人がいる時に、バカみたいな無茶をするつもりはない。守る相手を危険にさらさない。これもヒーローにとっては大事なことだ。
新	おう、俺を信じろ
主人公	言って、自信に溢れた笑みを一つ。灯は、仕方ないなあと溜息を一つつき、おずおずと俺の服の裾を握った。
レイ	まあ、バッタリ魔王と出会ったりしちゃったら、その時は殺るしかありませんけれども
新	城の中を徘徊してるラスボスとか、威厳も何もないぞおい
主人公	俺達は、その扉へと向かって足を踏み出した。
