主人公	一歩足を踏み入れた瞬間、空気が重くなった感じがした。
主人公	陰鬱な空気が身体全体にねっとりと絡みつき、俺達の動きを阻害している。そんな気がする。
主人公	この場にいるだけで、呼吸が苦しくなる。身体の奥底から怖気のようなものが噴き出してくる。　ふと見てみれば、腕に自然と鳥肌が立っていた。
新	こいつは……凄いな……
主人公	さっきまでの、どこか陽気な気持ちはもう吹き飛んでいた。ラグナギアに住む数多の人類の天敵、魔王。その力の恐ろしさを、居城の空気が教えてくれた。
レイ	魔王。その力は伊達ではありません。とはいえ、そのための私です。このブレイブギアの力を使いこなしさえすれば、なんの問題もありません
灯	あのぉ……もし使いこなせなかったら？
レイ	まあ、ミンチより酷いかと
灯	新くんっ、もう帰ろ、すぐ帰ろ、今すぐ引き返そっ
新	ああ、引き返すことに関しては異論はない。ただ、少しだけ中を見させてくれ
新	いや、マジにここまでとは思ってなかったから、少しでも敵の情報が欲しい。これから勝つために
灯	うう……その気持ちは分からなくもないけど……ほ、本当に少しだけだよ
主人公	幸いというべきか、周囲に敵の気配はない。逆に考えれば罠という可能性もあるけれど……。
新	罠が怖くてヒーロー目指してられるかよ
主人公	本当にやばくなったら撤退もする。けれどそれは今じゃない。俺の中の勘がそう言ってる。うん、言ってることにしておこう。多分言ってるんじゃないだろうか。
主人公	俺は、周囲の様子を探りながら、王城内を歩き始めた。
新	にしても、レイ。一つ聞きたいんだが
レイ	どうかしましたか、マスター。知っていることならなんでもお答えいたしますよ。知っていることなら
レイ	例えば、アカリさまのスリーサイズだとか
灯	なんで知ってるの！？
新	ああ、それはもう知ってるから別にいい
灯	あれあれ？　あの、新くん、いつの間に……？
新	なあ、レイ。なんで……
新	なんで、入り口からわずか徒歩十分の所に、こんないかにもな玉座があるんだ？
レイ	主が来客を迎えるのに、出口から遠かったら面倒ですからねえ
灯	あ、分かる分かる。ＲＰＧとかで、王様の部屋とかが思い切り遠かったりすると嫌になるもんね
レイ	ええ。クラウン王国の謁見の間も、入り口から比較的すぐの所にあったと思いますが
レイ	それとまあ、運が良かった、ということではないかと。ここに来るまでに通った三カ所ほどの分かれ道、そのすべてで大当たりを引いたということですね
レイ	さすがはマスター。運の良さも勇者の立派な資質。こう見えてもこの私、結構驚いていたりします
灯	や、やっぱりここって、魔王さんの出現場所だったりするのかな……？
新	可能性は高いな。どんなゲームでも、ラスボスが自分の個室に出現、なんてのはまずないだろうし
灯	あの、なんでそんなに冷静なのかな新くん？　だったら、早く逃げないと危ないんじゃないかな！？
新	ああ、それなんだが
魔王	ふはははははははははははははは！　よくぞきたな、新たなる勇者よ！！
新	というわけらしい
灯	はにゃーん！！
主人公	当然、広い玉座の間いっぱいに響いた声。その声からも相当な力を感じる。間違いないな、こいつが魔王だ。
レイ	魔王からは逃げられない、という名言もあります。これはもう（生きるのを）諦めて、戦うしかないでしょう
新	ああ。どんな状況でも諦めずに勝機を掴む。レイ、ブレイブギアの力、信じてるぜ
レイ	きゅーーーーーーんっ♪
レイ	やはりこのマスター侮れません。このタイミングで私のハートを狙い撃ち、ずっきゅん、とか本気で初体験
灯	なんだろ……なんかちょびっとムカムカ、ってきちゃった……
魔王	まさかここまで辿り着くとはな。だが残念だったな。それも今、ただの無駄となる
魔王	だが天上にて誇るがよいぞ！　この私直々に殺されるのだから！
主人公	まったく、姿を隠して待ち受けるとか、魔王にしては随分と卑怯なマネをしてくれるもんだ。
主人公	そもそも、まさかも何も、一度も敵と会わなかったし、罠すらなかったぞ。もう少し戸締まりはキチンとしておくべきだ。せめて俺の家くらいには。
レイ	マスター、魔王らしき魔力を感知。位置データを意識の方に送ります
主人公	さすがはブレイブギア。こういう時の対処法もバッチリか。これならいけるかもしれない。いや、いってやる！
新	そこだあ！！
主人公	俺は、今自分の放てるありったけの力を、髪の毛一本ほども残すことなくブレイブギアへと注ぎ込んだ。
主人公	こういう時はケチってはダメだ。先手必勝の全力攻撃で、少しでも相手の力を削る。
主人公	今の俺が出せる、間違いない最大にして最強の破壊力。その一撃を叩き込む。
主人公	対魔王兵器、ブレイブギアによる一撃だ。当たれば魔王といえども無事じゃあすまないはず。
主人公	そして、その一撃は寸分と違わず狙い通りの場所へと当たり、大爆発を起こした。
新	やったか！？
主人公	広がる爆煙が室内に広がり、その景色を隠す。
灯	ダメだよ新くん！　それ、こういう時に一番言っちゃダメなセリフ！
新	おっと、いけねえ。これ、絶対失敗フラグだ。レイ、魔王の反応チェック頼む！
主人公	俺としたことが失敗した。この状況で倒せた試しなんて、俺の知る限り０％。
主人公	それでも、今の俺にとっての本当に最大の一撃。これが効かなかったらさすがにヤバイ。
主人公	俺は、少しでもダメージを与えられていることを祈りつつ、魔王の反撃にすぐさま対応できるよう身構えて……。
レイ	それなのですがマスター
新	なんだ？
魔王	……ふふふふ……まさかこの私を倒せる者がいようとはな……
レイ	倒せてしまったようです
新＆灯	うっそーーーーーー！！
魔王	だが、いい気になるなよ……この世に人間がいる限り、新たなる我が必ず現れるであろう……ぐふっ！
レイ	ぱんぱかぱ～ん。おめでとうございます。勇者アラタは見事魔王退治に成功いたしました
レイ	これも、この私という優秀すぎて困りものな武器とサポートあればこそですね。ええ、これはもう私こそが勇者と呼んでいいのではないでしょうか
主人公	魔王城内の重苦しい空気が、少しずつ晴れていくような気がした。城内に充満していた魔王の魔力が消滅した、ということなのかもしれない。
主人公	これはつまり、本当にやっちゃった……？
灯	私、やったか、で本当に倒せちゃった人、初めて見たよ……
新	俺もだ……他にいなかったか脳内検索を必死でかけてみたんだが、見付からなかった……
新	いやまあ、なんていうか……フラグってのも結構折れるもんだなあ
新	というわけでごめん、なんか勢いで魔王倒しちゃった
アウロラ	はいいいいいいいいい！？
フォルト	ぶふぉーーーーーーーーーー！
ルナ	フォルトさま、ワイン噴き出すのはさすがにお行儀が悪いかと
アーベン	ふむ…………………………って、いや、さすがにありえんだろう
ルミネ	は、早すぎませんかアラタさま！？　だ、だってまだ一日ですよ！？
新	いやあ、軽い情報収集のつもりだったんだけどさ、ついうっかり
アウロラ	ついうっかりで魔王倒すなああああああああああ！！
主人公	かくてこの日、異世界ラグナギアは魔王の驚異から解放された。
