新	姫さま、何か依頼あるかー？
主人公	執務室へと入ると同時、俺は中にいた姫さまへと声をかける。
ルミネ	アラタさま、お待ちしてました
新	お、その反応。中々いい感じのが入ってるみたいだな
ルミネ	はい♪　それはもう、これぞ勇者様の本懐であろう依頼です
主人公	そう言って、姫さまは笑顔で一枚の用紙を差し出してきた。
新	お、魔物退治かっ。きたきた、って感じだな
灯	もう、ダメだよ新くん。依頼してきた人は必死なんだから
新	いやいや。俺が出て行くことでそういう人達を助けられるんだって考えたら、そりゃヒーローとしてはワクワクするってもんだろ
ルミネ	さすがアラタさまですね。困っている者に対するそのお気遣い、紛れもなく勇者さまの行い
シエル	アラタさん相手に勝てる魔物はいませんし、その人たちは救われたも同然ですね
新	いや、そういう油断はヒーローにとってあるまじき行為だからな。それで場所はっと……
主人公	俺は、渡された依頼の紙をジックリと読んでいく。
主人公	そう。俺はこの世界で、勇者稼業を続けていた。魔物退治はもちろん、護衛や人の手に余る邪魔な自然物の破壊、人捜しや荷物の運搬などなど……。
主人公	まあ言ってしまえば、なんでも屋だ。さすがにペットの猫探しみたいな仕事は受けないが、普通の人じゃあ大変な仕事を、俺とブレイブギアの力でなんとかするわけだ。
主人公	タダで住まわせてもらっている以上、この世界のためになる行為で返そうというわけだ。
ルミネ	アルの丘ですね。急げば日帰りも充分可能な場所です
主人公	魔物退治といえば、普通だったら騎士団あたりを動かす事案だが、勇者である俺の存在を知らしめる、という意味もあり、姫さまは率先して俺へと回してくれている。
主人公	まあ、騎士団を動かすということは、それなりの費用と命とがかかるし、準備にも多少の時間がかかる。
主人公	余程魔物の数が多くて苦戦しそう、という場合でもなければ、俺が行った方が早いし得でもある。
新	おし。んじゃ早速行ってきますか
主人公	ちなみに、仕事の宣伝と斡旋はエア姉に頼んである。あの人なら、客相手のやり取りはまったく問題ないだろうしな。
主人公	仕事内容によっては揉める可能性もある。その事を考えてもナイスな人選だろう。酒場でそうして集めてもらったものを、姫さまが俺に回してくれるというわけだ。
新	被害が深刻になる前に、さっさと倒してくるか
ルミネ	そういえば、レイはどこに？
新	かつての思い出を、もう一度思い返してくる、だってさ
ルミネ	あー……アイスクリーム屋、ですか
新	正解。地獄の底まで追っていくから覚悟しろとか言いながら、怪しい笑いを残して街に飛んでった
灯	レイちゃん、そこまでしてそこのアイス食べたかったんだ……
シエル	でも、確か無くなってしまったんですよね？　あ、まさか近くに移転しただけだったとかですか？
ルミネ	という可能性もあるからと、少々脅迫気味に頼まれて調査をしたのですけど……移転は移転でも、他の街に行ってしまったようでして。身内に呼ばれたとかで
ルミネ	ただ、当時そのお店で働いていた従業員の一人が、どこかで独立開業した、という話があって……
新	その辺の話まで聞いてガマンできなくなったらしい。買い占めだあ！　とか叫びながら飛んでった
シエル	うわぁ、すっごく感情豊かなサポート人格ですねえ
新	うん、躊躇なくその言葉が出てくるシエルが、やっぱりすっごくいい子だなってよく分かった
灯	オブラート何枚分くらい包んでるかな
主人公	そんな灯の言葉はまったく包まれていなかった。
主人公	それくらいストレートなやり取りができるくらいには仲良くなったからなあ、灯とレイも。
主人公	とはいえ、もう出発する以上は戻ってきてもらわないとまずい。
新	レイ、戻ってくれ
主人公	そう右手の甲へと語りかけた瞬間、そこから光が溢れ出す。そして、その光は翼の生えた妖精のような姿になった。
レイ	呼ばれて飛び出てじゃじゃじゃーん
レイ	と、これでよろしかったですか、アカリさま
灯	うん、ぱーふぇくとっ。やっぱり召喚される時はこうじゃなくっちゃね
主人公	さすが灯だよく分かってる。
レイ	それでマスター、食べ物の恨みは恐ろしいですがいかがいたしました？　列に並ぶこと四十五分。ようやく、あと二人というところだったのですが……
新	もちろん決まってるっ。ヒーローの出番だ！
レイ	なるほど、でしたら仕方ありません。了解しました
シエル	ちゃんと会話になってるところが凄いですねえ
ルミネ	なんといっても勇者さまとその伝説の武器ですから。言葉なんてなくても通じ合ってるのでしょう
灯	うーん、ただのノリと勢いで理解してるんじゃないかなあ
主人公	レイはブレイブギアのサポート人格ではあるものの、別に本体の近くにいないといけない、とかいう縛りはないらしい。
主人公	なのでまあ、いつもこんな感じで好き勝手に飛んでいってるが、呼べばこうして瞬時に来てくれるし、別に問題はないだろう。
新	それじゃあ、姫さま、行ってくるぜっ
ルミネ	はい。ご武運をお祈りしています
主人公	俺がやられるなんてこれっぽっちも思っていない、信頼に満ちた笑顔に見送られ、俺は今日の勇者稼業をスタートさせた。
