主人公	その日は体力を回復させるため、魔王城へ泊まっていくことにした。
主人公	ブレイブギアの回復促進力とシエルの治癒魔法でだいぶ回復はしたけど、今日のアレはちょっと無茶しすぎだった。
主人公	それに、シエルとふたりだけでゆっくり過ごしたかったし……。
シエル	……は、はううう
主人公	でも、さっきからシエルは照れてしまって、中々こっちを見てくれない。
新	シエル
シエル	は、はう！
新	あ……
主人公	声をかけるとシエルは耳と尻尾をびくんと反応させて、慌てて距離をとってしまう。
主人公	でも、少し離れると尻尾が嬉しそうにぱたぱた揺れるんだよな。
主人公	名前を呼ぶだけで喜んでくれてるってのはそれでわかるんだけど……そろそろ、もうちょっとくっつきたい。
新	シエル、こっち向いてくれよ
シエル	う、うう……だ、だって……
新	そんなに恥ずかしそうにしてても、尻尾が嬉しそうだぞー
シエル	……はっ！！
新	ほーら。今だってパタパタしてるじゃないか
シエル	う、ううう……
主人公	恥ずかしさのあまり、ぱたぱた動き続ける尻尾を恥ずかしそうにぎゅうっと抱きしめるシエル。
主人公	そんな仕種がまた余計に可愛くてたまらないと思ってしまう。
新	そんなことしてたら、余計に可愛いだけだぞ
シエル	か、からかわないでくださいー！
主人公	抱きしめられた尻尾がまたぱたぱた動く。
主人公	嬉しくてたまらないと全身で伝えているみたいで、それだけで一層愛しさがあふれる。
新	こっち向いてくれよ、シエル。そろそろちゃんと顔が見たい
シエル	う、う……わ、わかりました……
主人公	ようやく観念したのか、シエルは尻尾を抱きしめるのをやめてそっと俺に近付いて来た。
主人公	でも、この微妙な距離感が、なんとなく寂しいし、もっとくっつきたい。
新	なあ、シエル……せっかくお互いの気持ちがわかって、今はふたりきりなんだしさ……その、もっとシエルとくっつきたい
新	それに気持ちだけじゃなくて、身体も繋がりたいっていうか、その……あれだ。今のこの距離じゃ足りない
シエル	あ、ああ、あの……
主人公	思い切って自分の気持ちを素直に伝えると、シエルは真っ赤になってしまった。
主人公	だけど、さっきより距離を縮めて俺に身体を擦り寄せてじっと見つめてくる。
シエル	わ、私も……アラタさんともっと一緒にいたいです。それに、ぎゅうってしてもらいたい……
新	うん……
シエル	あ……うふふふ。アラタさん……
主人公	恥ずかしそうに、だけどはっきり伝えてくれたシエルの身体を抱きしめる。
主人公	抱きしめられたシエルは嬉しそうに俺に抱き着き、素直に身体を擦り寄せてくれる。
シエル	ぎゅうって……気持ちいいです。ふふふ……アラタさんのにおいがします
新	うん。シエルとこうしてると気持ちいい
シエル	気持ちいいの一緒ですね
主人公	抱きしめられながら、シエルがパタパタ尻尾を揺らす。
主人公	無防備に身体を擦り寄せられると、その身体の感触に鼓動が速くなってしまう。
主人公	それに、こんな風にしながら気持ちいいなんて言われると……。
新	あ……！
シエル	どうしたんですか、アラタさん？
新	あ、いや。あの、ひとつ気になることに気付いてしまってだな……
シエル	気になること……ですか
主人公	不思議そうに俺を見つめてシエルが首を傾げている。
主人公	無防備この上ない。いや、無知そのものの表情。その表情を見つめて更に気になってしまうこと。
主人公	それは、シエルが男女の営みのアレコレを知っているのだろうかということだ。
新	シエル、その……いきなりこんなこと聞くのもなんだけど、キスって知ってるか？
シエル	きす……ですか？
新	えっと、さっき俺とした唇をくっつけるやつ……
シエル	あ！　さっきのアレですか？　あの、最初はビックリしましたけど、途中から気持ちよくなりました
主人公	さっきの感触を思い出したのか少し頬を染めて、嬉しそうに微笑みながらシエルは答える。
主人公	この様子じゃ……シエルは何も知らないに違いない。
主人公	つーか！　こんな純粋な娘に身体も繋がりたいとか、なんてことを言ってしまったんだ俺！！！
主人公	このままコトに進んじゃったら、知らない間に色々しちゃうみたいな感じになるところだったのか。
シエル	あ、あれ？　あの、アラタさん、どうしたんですか？　わ、私何かヘンなこと言っちゃったんですか？　ご、ごめんなさい！
新	あ、あ！　違う違う。シエルのせいじゃないんだ！　俺が悪いんだよ。だからそんな顔するな
主人公	耳と尻尾を寝かせて申し訳なさそうに謝るシエルを慌てて抱きしめ、頭を撫でてやる。
主人公	少しだけ元気になったのか、耳はすぐに元に戻って尻尾もパタパタ揺れる。
シエル	あ、あの、私……アラタさんがしたいことなら、なんでも受け入れられます。だから、もっと色んなこと教えてください
新	シエル……
シエル	私、アラタさんとだったらなんでもできる気がするんです。だから……私の知らないこと、いっぱい教えて欲しいです
主人公	じっと俺を見つめてそう言うシエルは、心から俺を信じている表情だった。
主人公	今まで、これほどまでに俺を信じて、すべてを委ねてくれた子がいるだろうか……。
新	シエル、本当にいいんだな？
シエル	はい。アラタさんに全部教えて欲しいです
主人公	あまりの甲斐甲斐しさに、これ以上自分を抑えることはできないと感じた。
主人公	だけど怖がることや嫌がることはしたくない。
新	なるべく優しくするから……シエルの全部を、俺にくれるかい？
シエル	はい。アラタさんにもらって欲しいです
新	ありがとう、シエル
主人公	しっかりと頷いたシエルを抱き上げ、そのままベッドへと運んで行く。
