ルナ	アラタさま！！
主人公	早朝、いつもの冷静さからは考えられないほどに声を張り上げながら、ルナは俺の部屋へと飛び込んできた。
新	ん……ルナ……？　えーと、ここは俺の部屋、だよな……なんでルナが……
ルナ	説明は後でお願いします。ですから、今はとにかくお急ぎ下さい。玉座の間にて、皆様お待ちしてます
主人公	どこか切羽詰まったような感じのするルナの姿に、俺は眠さを振り切りながら身体を起き上がらせた。普段のルナを知ってる身からすれば信じられないような慌てっぷりだ。
主人公	この態度、どうやら緊急事態ってわけか。
新	分かった、すぐ向かう
主人公	俺はベッドから飛び出ると、急いで服に手を伸ばした。
新	おい、レイ。起きてるか
レイ	私はサポート用ＡＩですから眠るなどありえません。なのであと五分お願いします……あ、やっぱり十五分……
新	……思い切り眠そうだな、お前……
主人公	どうやら、サポートＡＩでも睡魔には勝てないらしい……。
新	悪い、待たせた
主人公	俺が部屋に辿り着くと、そこには既に中枢の四人が揃っていた。
新	それで、何があったんだ？
フォルト	とりあえず、みんなが来るまで待ってくれ……
主人公	いつもの軽い王様とは違った、重い口調。なるほど、冗談ですまない本当の緊急事態が起こってるわけか。
レイ	……ソルとの戦いの時でも、ここまで深刻な表情はしていませんでした……どうやら本当にまずい状況のようですね
新	ああ……
ルナ	遅くなりまして申し訳ありません。皆さんをお連れしました
主人公	そして、ルナに連れられ他のみんなも部屋へと入ってくる。
フォルト	そうか……やはり違ったか……
主人公	その中にシエルの姿を確認して、安心したように呟く王様。どういうことだ？
灯	うう……お日さま出たばっかり、眠いよ……
シエル	私もです……ですがルナさんがあれほど急いできたんですから、きっと相当なことがっ……だ、ダメです。寝てはいけませんっ
ソル	……あー、言っとくぞ。こんな時間に起こしといて、遊びのお誘いとか言い出したら本気で暴れるからな……
シャイン	うん……その時はぼくも全力で手伝うよ、ソル……うう、眠いぃ……
フォルト	よし……全員揃ったようだな
主人公	真剣な口調で、俺達全員を見回す王様。そして、促すように姫さまを見た。
ルミネ	みなさん、こんな時間にお呼びだてして申し訳ありません
新	相当やばいことが起こったみたいだが、何があったんだ……？
ルミネ	……魔王から、人類に対しての宣戦布告がありました
新	は？
主人公	呼び出された俺達の視線が、一斉にシエルへと集まる。
シエル	え？　え？　わ、私、そんなことしてませんよ！？
主人公	あわわ、とぶんぶん手を振って否定するシエル。当然だろう、今のシエルがそんなことをするとは思えない。
ルミネ	はい。わたしたちも、今のシエルさまがそんなことをするとは考えていません。そもそも、今この場にいる以上、不可能ですし
アウロラ	それでも、魔王からの宣戦布告があったのは事実よ。これから十二時間後、人類の国を順に攻め始める、って
主人公	魔王による人類への宣戦布告。俺が二度目の召喚をされたのも、シエルによる宣戦布告があったからだ。
主人公	だとすれば、今回も宣戦布告があるというのはおかしくない。
灯	でも、シエルちゃんはここにいるんだよ。その魔王って、本物なの？
アーベン	レイやシャインなら、魔王の反応を察知できるのではないか？
レイ	……ここと魔王城ではさすがに距離がありますので完全な確認は難しいですが、確かに魔王レベルの反応を感じます
レイ	ですが、正直シエルさまとは比較にならない強さですね
アーベン	なるほど……本物の魔王かどうかはともかく、それに匹敵する存在がいるのは確かということか
シャイン	うん……すっごく強い反応を感じる。だけどこれ……
主人公	レイと同じように魔力反応を探るシャイン。が、その表情が唐突に変わった。
シャイン	ソル！　これ、ママの反応があるっ
ソル	なに？　……マザーの反応、だと…………くそっ、そういうことか！
主人公	シャインの報告を聞いて、ソルが焦ったように言葉を吐き捨てる。
新	どういうことだ、ソル？　何か知ってるのか？
ソル	マザーだ。マザーシステムと、それが生み出した勇者システムについては、お前達ももう知っているだろう
ソル	そして今、俺とシャインがその手を離れたことで、マザーは打つ手を失っている。世界を必要以上に混乱させないため、魔王も代行者も、同時に複数は生み出せない
アウロラ	勇者の召喚術式も、アラタがいる以上行えない……そうね、残ってるのは魔物による攻撃くらいだけど、勇者と代行者相手にじゃあ決め手にかける……
ソル	そうだ。だからマザーは、自分が使うことのできる最後の力を使うことにした
シャイン	あ……まさか、ママ自身！？
主人公	シャインの言葉に、ソルは頷いて答える。
ソル	魔王そのものは作れなくとも、魔王の身体だけなら可能だろう。ただの抜け殻だからな
ソル	恐らくマザーは、その身体に自分の人格そのものを移し、自らを仮の魔王とした。自分の手で魔王と勇者と代行者、そのすべてを倒し、システムを正常に戻すために
フォルト	いくら他に手がないとはいえ、またとんでもないことしやがるな。そもそも、可能なのか、そんなこと？
ソル	可能ではあるだろうが、実際にやるとは思ってもいなかった。一度移した人格は、そう簡単には戻せん。マザーも捨て身ということだ
新	……なるほどな。ある意味じゃあ、マザーもシステムの被害者みたいなもんか……
主人公	ただ世界を守るために勇者のシステムを作り出し、それを維持するために自らもコマにする。そこに、マザー自身の意思は感じられない。
主人公	世界を守る。そんな呪いにかけられた犠牲者みたいだ。
新	だったら、マザーを止めてやるしかないな
主人公	そんな悲しい生き方から解放してやる。それが勇者の、ヒーローとしてのオレの役割だ。
シャイン	でも、ママを倒すっていうことは、マザーシステムそのものの動作を止めるっていうことだよ。システムが止まると、エーテルの生成も止まっちゃう
アウロラ	ちょっと、それって大問題じゃない！！
灯	えっと、何か困っちゃうの？
アーベン	エーテルが無くなれば魔法は使えなくなる。この世界は魔法……ギアの力があってこそ成り立っているからな、当然大混乱に陥るだろう
ルミネ	下手をすれば、人の世が崩壊します……
レイ	私やシャインの人格維持も不可能になりますね。酷い人です、マスター。こんなにも健気に尽くしている武器を殺してしまおうだなんて
新	だったら、倒さなきゃいいだけだろ。聞く限り、マザーシステムは悪じゃない。この世界を守るために動いてる
新	だったら、説得することだって可能なはずだ
シエル	で、でしたら私も行きます！　魔王という立場にある私と、勇者であるアラタさん、二人で話せば、きっと分かってくれると思います！
灯	うう……さすがに私は邪魔になっちゃうね、それだと……
ソル	オレとお前で魔物を掃討しちまうって手もあるぞ
新	さすがに全軍でこられたら物量的にやばいだろ。それに、それだといくつかの国は掃討しきる前にやられかねない。他の国に勇者はいないんだ
フォルト	……今、最小の被害で世界を守るには、勇者と魔王に頼むしかないようだな……すまん。またお前に託さないといけないようだ……
新	気にすんなよ、王様。それが勇者の仕事なんだ
シエル	私も、皆さんを……この世界を守りたいです
ルミネ	魔物の進軍は、私たちで出来るかぎり耐えてみせます。ですから、アラタさまはご自分のやりたいことをやって下さい
ルナ	勇者抜きでも、そう簡単には負けませんよ
ソル	ま、安心して行ってこい。こっちはオレが面倒みてやる
ソル	人間どもを見ていくと決めたんだ。ここで勝手に滅亡でもされたらオレが困る
シャイン	うん、こっちは任せて。だから……ママのことお願い。ちゃんと止めてあげて……
灯	新くん、シエルちゃん……頑張ってきてね。私はまったく心配してないよ
アーベン	マザーシステムか……ぜひ一度話してみたい存在ではあったが、そうもいかんようだな。頼んだぞ
アウロラ	ま、あんただったら楽勝でしょ。また１日であっさり帰ってきなさい
主人公	そんな笑顔で送りだそうとしてくれるみんなに、俺も負けじと笑顔で応える。
新	おう、期待に応えてこそのヒーローだからな、任せてくれ！
新	んじゃ、行くぞ、シエル、レイ！
シエル	はいっ。２５２５代魔王の名にかけましてっ
レイ	大暴れと参りましょう
