主人公	光が膨れあがる。
主人公	俺とシエルとで放った、先のことなんて考えない、本当に最後の一撃。
主人公	それをマザーは、さすがに危険と感じたのか、全力の防御で迎え撃った。
主人公	そしてその瞬間、爆発するかのように膨れあがった白い光が、俺達を、この玉座の間を、すべてを包み込んでいた。
主人公	その光が消えた時、目の前にはまだマザーが立っていた。だが俺達の顔を見た瞬間、床へと崩れ落ちる。
マザーシステム	なるほど……賭は私の負けでしたか……
マザーシステム	仕方ありませんね……示されてしまったのですから……
マザーシステム	勇者と魔王が……その手を固く握りしめ……そして私を倒す……あなたの言ったことが決して願望なんかではないことを……
主人公	苦しげに、言葉を紡いでいくマザー。けれどなぜだろう、その表情には、どこか満足げなものが感じられた。
新	レイ……
レイ	全身のエーテルのラインが完全に崩れています。恐らくはもう……
マザーシステム	シエル……あとはあなたに任せます。あなたの目で、この世界の行く末を見届けなさい
マザーシステム	その、勇者と共に
シエル	待って下さい！　まだ諦めるのは早いです！　見届けるというなら、あなたも一緒に！
マザーシステム	レイが言ったでしょう、もう無理だと。それに、私も少々疲れてしまいました……だから……
新	……あなたは信じてくれた。俺達人間を。それだけじゃない、あなたのやり方は最終的には間違ってしまっていたけれど、それでも今まで守っていてくれた、この世界を
シエル	だから、終わりにはしない。あなたのことも、絶対に救ってみせる
マザーシステム	ふふ……本当に……あなたは根っからの勇者なのですね……
マザーシステム	ならば、祈りましょう。あなたの願いのすべてが、叶うことを……
主人公	そしてマザーは、確かに笑った。どこか満足そうなその笑みを残して、光となって消えていく。
主人公	宙に浮き、そのまま天へと帰るように溶けていく無数の光を、シエルはそっと抱きしめる。
シエル	マザー……もう一人の私……
シエル	本当に、お疲れさまでした……
主人公	その姿は、我が子を抱きしめる母親のようだった……。
