新	灯のギアの調査が終わったってホントか、二人とも
灯	早いですね、昨日の今日なのに
アウロラ	まーね。天才アウロラちゃんに任せておけばこんなもんよ
主人公	翌日、結果を聞くために執務室へと集められた俺たち。たったの１日で結果が出たとか、さすがとしか言いようがない。
主人公	ちなみに王様とルナは仕事のために欠席だ。
主人公	机の上には昨日灯が渡したペンダントが置いてある。
アーベン	と言っても確実ではないがな。私が直接調べてないので。おそらく、仮に、の話だと思ってくれ
アウロラ	あんたはいちいちうるさいわねー。話の腰を折るんじゃないわよ
新	ん？　ということは結局わかってないのか？
アウロラ	わかってないとも言い難いのよ。まぁこいつの言う通りある程度予測の話になっちゃうって話
アウロラ	だからそれを確かめるためにアラタにも協力してほしいの
新・灯	？？？
主人公	灯と二人、顔を見合わせる。いまいち話が見えてこない。
アウロラ	それじゃあ説明するけど。ずばりアカリ、あなたのギアはブレイブギアよ。しかもかなり昔の
新	ブレイブギア？　それって……
灯	新くんのと一緒の、ですよね？
アウロラ	そ。そのブレイブギア。良かったわねー、ギアまでお揃いで
シエル	むむっ
主人公	とシエルが体を寄せてくる。
主人公	すまんアウロラ。今はそういう冗談はやめてくれ。
ルミネ	でもおかしいですね。勇者さまに託されるはずのブレイブギアが何故管理されてないのでしょうか？
新	しかもペンダントとして売られてたしな
アウロラ	焦らない焦らない。順番に説明していくから
主人公	慌てるなとジェスチャーをしてからペンダント、じゃなくてギアを指でさす。
アウロラ	多分このギアはクラウン国が出来る前から存在してたんだと思う。そうじゃなきゃ文献とか資料とか残ってそうだし
アウロラ	で、その時の勇者が使ってた。ところどころ欠けてたりするところを見ると相当激しい戦いをしたみたいね
新	確かに歴戦の傷って感じがするな。ギア自体結構頑丈だから傷なんてそうつくもんじゃないし
レイ	ですね。頑丈さもブレイブギアの売りですから。さらに人の手で修復も出来ます、対応率抜群です
アウロラ	でもこのギアはそのまま。ということは当時の勇者は魔王たちに負けちゃったのかも。だから直されることもなく回収されることもなく壊れっぱなし、と
シエル	え、えっと……ごめんなさい……
灯	別にシエルちゃんが謝ることないって
新	むしろ当時の勇者は負けないようにもっと己を鍛えるべきだったな。魔王も魔王で勇者を倒してしまうとか、魔王の風上にも置けないやつだな
ルミネ	アラタさま……魔王の風上って……
主人公	とはいえ、それも全部は当時の勇者と魔王の問題だ、シエルが気に病む必要なんて本当にないしな。
主人公	……まぁそれを言うなら俺が倒した最初の魔王もシエルも、全然魔王っぽくないんだけど。
アーベン	話の続きだが。その回収されなかったギアが最近何かの拍子で見つかったんだろう
アウロラ	でも破損してることと、召喚された異世界の人間しか使えないことからただのペンダントとして売られてたんじゃないかしら
灯	それを私たちが買って……
新	そしてこの前の、灯の危機に反応して起動したと
ルミネ	なるほど。そう考えるといろいろ辻褄が合いますね
新	事実は小説よりも奇なり。灯の元に来るべくして来たというわけだ。何という勇者力！
主人公	腕を組みうんうんと頷く。
主人公	むしろ話的には俺より灯の方が勇者っぽいなこれ。
主人公	しかし当の本人はあまり気のりしなさそうで。
灯	と言われても私自身あまり実感がないというか……私にとってこのペンダントは新くんからもらったペンダントだし
新	ここは喜ぶべきだろう。露天で買った、何の変哲もないと思っていたペンダントが古代の貴重なアイテム。なんとも勇者っぽいじゃないか
灯	う～～ん……そうだねぇ……
主人公	だけど、灯はやっぱり乗り気じゃなさそうだ。何を気にしてるんだろう……。
主人公	もし俺が灯の立場なら小躍りして喜んでると思うんだけどなあ。
アウロラ	だから慌てないの。それで本当にこのペンダントがブレイブギアなのか確かめるためにアラタの、正確にはレイの力を借りようと思って
レイ	なるほど。ギアの妖精である私に協力を要請したと。失礼、今の発言は忘れてください
レイ	ではまずはこちらのペンダントの方を調べさせていただきます
主人公	俺たちがツッコム間もなく流れるような動きでギアに触れるレイ。
主人公	瞬間、淡く光り出した。
レイ	……解析終了しました。アウロラさまの推測通りこれはブレイブギアのようですね。しかも私よりもさらに前のですね
レイ	それと、外観は破損していますが自動修復機能は問題なく動いており内部には全く問題ありません。通常通り起動できます
新	おー、流石ブレイブギア、安心の機能だな。しかも古くてもちゃんと作動するとは
レイ	僭越至極。お褒めに預かり光栄です。それとアカリさま、確かめたいことがあるので手を出してもらっていいでしょうか？
灯	手？　別にいいけど。こうでいい？
レイ	では失礼します。ふむふむ……体温、湿度、共に良好。形も美しいですね
新	確かに灯の手は綺麗だよな
灯	何だろう……新くんにそう言われるのはすっごく嬉しいんだけど、ちょっと複雑……
レイ	脈拍わずかに上昇後、緩やかに下降、と。すいません、全く関係ない報告でした。調査を続けます
レイ	ふむ……ふむ……なるほど……解析終了しました
レイ	どうやらアカリさまもマスターと同じくブレイブギアのエーテルサーキットが作成されています
灯	えっと……
新	それってつまり？
レイ	はい。繰り返しになりますがアカリさまもマスターと同じ、勇者と同等の力、勇者と同様の資格を持つということです
アーベン	回りくどいな、端的に言えばこういうことだろう。アラタだけでなく、アカリも勇者ということ
灯	わ、私が勇者？
ルミネ	すごいですっ、勇者様が二人だなんて聞いたことありません！　素敵です、素敵すぎます！　素敵マックスです！
新	ダブル勇者か！　いいなそれ、燃える展開だ
新	バイクに乗って戦うヒーローも後から一人追加されるパターンが定番になってるし
新	やろうぜ灯、一緒に勇者稼業
灯	う、うん。いいね、新くんと一緒に勇者するの
灯	でもそっか……私が、勇者か……
主人公	だけど灯はさっきと同じように考えてる様子で。
新	どうしたんだ、嬉しくないのか？　お前も勇者になれるんだぞ？
アウロラ	まぁまぁ。みんながみんなアラタみたいに単細ぼ、じゃなくて単純、じゃなくてえっと、素直……？　じゃないんだから。いきなり勇者って言われてもねー
シエル	私もそうでした。いきなり今日から魔王！　と言われても何をしていいのか、何をしなくちゃいけないのかわかりませんでしたから
主人公	いや、シエルの場合はそれだけじゃない気もするけど。
主人公	まず性格が魔王に合ってないし。
アーベン	まぁとりあえずせっかくのブレイブギアなんだ。内部に問題がないと言うなら外観を修復してくる
主人公	そして博士とアウロラは出て行った。
新	しかし灯も勇者かぁ。うんうん、あんなに小さかった灯がこんなに逞しくなって、俺は嬉しいぞ
ルミネ	本当にすごいですね。こんな歴史的瞬間に立ち会えるなんて感激です。ぽわぁぁー……
シエル	ル、ルミネさまっ？　お気持ちはわかりますけど顔がその、ちょっと……！
ルミネ	だけど、だけどですねシエルさんっ。アラタさまに続いてアカリさんまで勇者様だなんて……！
ルミネ	あっ、勇者様であるアカリさんを『さん』付けなんて失礼ですよね？　これからはアカリさまと呼ばないと！
灯	いいですよ姫さま、今まで通りでっ
シエル	でも羨ましいですアカリさん……アラタさんと一緒に勇者だなんて……
灯	ちょ、ちょっと待って。私まだ勇者になるなんて……
灯	……でも、そうなんだよね……勇者になったら、新くんと一緒に……ふふ♪
新	お、どうやら灯も勇者としての使命に目覚めたみたいだな
新	よし、これから一緒に勇者だっ。二人で世界を救うぞ！
主人公	最初は浮かない顔をしていた灯も嬉しそうに笑ってくれて。それを見て俺も頬が緩む。
主人公	こうして新しい勇者が誕生した。
主人公	……まあ、最後の笑顔になんとなく悪寒を感じたのは気づかなかったことにしておこう。
