シャイン	…………
新	くっ……！
主人公	シャインの一振りで起こった轟風を寸前で避ける。
主人公	当たらなかった魔法が後ろの壁に直撃して穴を穿つ。
シャイン	…………
灯	新くんそのまま動かないでっ。展開！
主人公	続いて放たれた魔法攻撃が目の前で弾けた。
主人公	灯が張ってくれたバリアのおかげだ。
新	サンキュー、灯。だけど……
シャイン	………………
主人公	手に魔力を溜めつつ、こちらにゆっくりと近づいてくるシャイン。
主人公	強い……！　わかってはいたけど、想像以上に！
シャイン	………………っ！
新	あ、あれは……
主人公	その細い腕を、黒い魔力が覆っていく。確かさっきシエルが使った魔法の一つだったはず。
主人公	けれど、それ以上に大きく、禍々しい雰囲気。ああ、食らったらやばいな、あれは。
主人公	腕に纏わせた黒い波動を飛ばしてくる。
灯	任せて！
主人公	それも灯のバリアが守ってくれる。
主人公	衝撃で立ち昇る黒い硝煙の中、飛び込んでくるシャイン！
新	来るか！
主人公	魔力で固めた拳を、俺はギアの拳で迎撃する。
シャイン	……っ……
新	痛っ……！
主人公	衝撃で吹き飛ぶお互いの体。
主人公	俺は、地面を引きずりながらどうにか堪える。
主人公	が、シャインはその小さな身を翻し、難なく着地。
灯	シューティングスター！
シャイン	…………
主人公	そのタイミングを灯が光弾で攻撃するも、シャインなんなく魔力弾で相殺。
主人公	すかさず、灯へ向かって一足飛びに迫った。
新	させるかよ！
主人公	灯が俺を守ってくれるように、俺も灯を守る。
主人公	女の子だからとは言ってられない、シャインの腹へカウンターの一撃。
シャイン	…………っっ
新	なっ！？
主人公	だが、完璧に捉えたと思ったその拳は、直前で止められていた。
新	ぐぅっ！
主人公	そのまま壁へと放り投げられる。
主人公	耳の横を凄い速度で風が通り過ぎていく。やばい、この速度でぶつかれば、確実に大ダメージだ。動きが止まる。
灯	新くん、足場作るよ！
主人公	だが、そんな俺の焦り吹き飛ばす、灯の声。
新	頼んだ、灯！
主人公	壁にぶつかるその直前、俺は灯が作ってくれた光の障壁を掴み、身体を支える。
主人公	これで叩きつけられることは回避。そのまま灯の元へ降り立った。
新	ありがとう、また助かった
灯	お互い様だよ新くん、私もありがと
灯	……でも。強いね、シャインちゃん
新	あぁ……強い
主人公	倒すのが目的じゃないにしろ一発も有効打を入れられてない。何とか攻撃を耐えるだけで精一杯だ。
新	一人だから、さっきみたいに連携の悪さを俺達の息の合ったコンビプレイで崩す、なんて出来ないしな
灯	うん、私たちの相性ばっちりなコンビプレイで耐えるくらいしかできないね
レイ	台詞だけ見るとかなり余裕そうなのですが、まぁ気にしないでおきます
主人公	レイはそう言うが、実際のところ余裕なんてほとんどなかったりする。
主人公	なんといっても、代行者の戦闘力に魔王の魔力、そしてギアの破壊力と三つ揃えだ。
主人公	今のところは何とか耐えられてるけど、一瞬でも気を抜けば瞬く間にやられてしまう。
シャイン	……っ……
主人公	シャインの手から黒球が宙に出てくる。まるで灯のギアの光弾のように、空に配置する。
主人公	一つ、二つ、三つ、四つ、五つ……それは次々に数を増し……。
新・灯	…………！
主人公	……数十と。部屋を覆い尽くすように。
主人公	これが魔王の真の力。
主人公	……シエルは本気でやろうと思ったらこれが出来たのに、俺達のために手加減してくれてたんだな……
新	……レイ、エーテルを攻撃に回してくれるか？
レイ	イエス、マスター。エーテル浸透率、６９％に上げました。まぁやらしい
新	だからお前はどこでそういう……
灯	レ、レイちゃんっ？　もしかしてこの前の……！
レイ	さて、何のことやら？
主人公	……ああそうか。昨日のえっちの最中、俺の中にいたんだな……終わったらお仕置きだ。
主人公	なんて、こんな大事な場面だっていうのに俺達はいつものペースのままで。
新	あの数が一気に来たらまずい。俺がまず全力で攻撃して数を減らすから
灯	私は防御と、こぼれたのを狙い撃っていくね
主人公	それは俺が灯を信じてるから。灯が俺を信じてくれてるから。
主人公	俺達がシエルを信じてるから。シエルが俺達を信じてくれてるから。
レイ	あれ？　私は？
新	もちろんレイもだよ
新	それじゃあ行くぞ！　サーキット解放、ギアドライブブレイクァァアアァァッッッ！
灯	守って、私のギア！
シャイン	…………！
主人公	そして黒い雨に耐えながら俺達はシエルを待ち続けた。
