主人公	ソルとの決着もついて、俺達にも平穏な日々が戻っていた。
主人公	でも、ソルという明確な刺客が襲って来たことを考えると、ただのんびり日常を過ごしているわけにもいかないだろう。
主人公	しかし、そもそもわからないことが多すぎる気がする。
主人公	何故、代行者は勇者を倒さなければいけないのか。ただ人類を護るためなら、代行者が魔王と戦えばいい。
主人公	どうして、この世界には魔王が繰り返し生まれ続けてしまうのか？
主人公	魔王を倒さないまま元の世界に帰る方法は本当にないのか？
主人公	二度も召喚されてこの世界、ラグナギアに来たせいで、勇者と魔王、それに代行者ってものに疑問が浮かぶんだよな。
主人公	これまでの勇者はどういう人たちで、どう魔王と戦ったんだろうか。それを代行者はどう見ていたんだろう。
主人公	……魔王に勇者に代行者、か……。
新	改めて色々調べた方が良さそうだよな
主人公	まあ、その為にはまず手っ取り早くあいつに聞いてみるのがいいだろう。
新	おーい、レイ。聞きたいことがあるんだが
レイ	どうかしましたかマスター？　私の３サイズならヒミツですよ
新	それは特に聞きたくない。俺が聞きたいのは歴代の勇者のことだ
新	ブレイブギアとして一緒に行動して来たレイなら知ってるだろ
レイ	歴代の勇者……そんなことを聞いたのはマスターが初めてです
レイ	そんなことを知ってどうするんです？
新	勇者と魔王、それから代行者っていう存在に疑問が沸いたんだ
新	過去の勇者を知ることで、その疑問を解く手がかりになるかと思ったんだよ
レイ	なるほど。ですが、過去の勇者のことはよく覚えていません。そもそも、私は最初からいたわけではありませんし
レイ	ですから、私が誕生する前は他のギアが使われていたはずです
新	そうなのか？
レイ	まぁそれでも、かなりの年月、稼働しているのは間違いないですが
新	具体的にどれくらい？
レイ	女性に年を聞くとは、マスターったらさいてーですねっ♪
新	そうですか……
主人公	少なくとも前々回の勇者は３０年前って話だから、そのくらい前からは存在しているんだよな。
主人公	しかし、レイからは役に立つような情報は得られそうにないな。
主人公	となると他にそういうことに詳しそうな人物となると……アウロラと博士だろうか。
主人公	勇者召喚の研究をしていたくらいだから、きっと色々詳しいに違いない。ふたりに話を聞きに行ってみよう。
