主人公	数日続いている勇者の伝承についての勉強会。今日も姫さまから話を聞く予定だったんだけど……新しく勇者稼業の依頼が入った。
主人公	というわけで執務室で話を聞くことになったんだが、その依頼者の顔を見て驚いてしまった。
新	依頼人って、姫さま……？
ルミネ	はい、その通りです！
ルナ	よろしくお願いいたします
新	でも、なんで？
ルミネ	最近、アラタさまと勇者様の伝承について話しているせいで、久々にわたしの勇者様魂に火がついたんです！
新	勇者魂ですか……
ルミネ	はい！　それで、伝承に残っている土地を見に行きたくなったんです。そこまで一緒について来て欲しいなと思いまして……
新	なるほど、それで勇者に対する正式な依頼ということか
ルナ	勇者様本人が護衛なら心強いですし、何よりもそうすれば一緒に出かける口実になりますので
ルミネ	る、ルナ！　余計なことは言わなくていいの！
ルナ	失礼いたしました、ルミネさま
新	あはは、なるほどな。まあ、とにかく依頼は依頼だ。護衛役として一緒に同行しよう
ルミネ	ありがとうございます、アラタさま。あ、その場所なのですがこの地図の……ここになります
新	ん……
主人公	準備万端といった感じの姫さまは、嬉しそうに地図を取り出すと目的地を指差した。
主人公	地図で見ると魔王城が割と近いみたいだけど、道のりは平坦で、特に目立ってなにかありそうな場所には思えなかった。
新	ここに行くまでなら、結構すぐみたいだな
ルナ	はい。ルミネさまの足でも問題なく辿り着ける場所です
新	そうか。それなら、せっかくだから灯達も誘ってみんなで行ってみないか？
ルミネ	あ、それは楽しそうですね。それでは、他の方も誘ってみんなで行きましょう
新	ああ、そうしよう。灯とシエルとアウロラと……声をかけたらみんな一緒に来てくれるかな
主人公	せっかく姫さまと一緒に出かけるんだ。みんなでピクニック気分の方が楽しくなるだろう。
主人公	姫さまの護衛……という名目はあるが、道中は特に何もなくみんなで賑やかに、本当にピクニック気分で目的の土地までやってきた。
主人公	勇者の伝承があるというからどんな場所かと思ったけど、辿り着いてみれば一見何もないただの草原だ。
灯	ここが、勇者の伝承がある場所なの？
ルミネ	はい、その通りです！　ここに過去の勇者様も来られたのかと思うと、なんだかわくわくしますね
灯	でも、何もない場所だよ。まあ、ここから魔王城は見えるけど
シエル	見えるだけで結構遠いですけどね……それにしても、こんなに広い場所だと駆け回りたくなりますねえ
新	シエル……犬じゃないんだから。いやまあ、あんま変わらないかもしれないけど
アウロラ	確かに何もない場所なのよ。でも、間違いなく伝承にはこの場所が残っているの
新	姫さまの話を聞いた時から気になってたんだけど、それってどんな伝承なんだ？
主人公	そんな俺の質問に、姫さまは少し悲しげな表情を俺に見せた。
ルミネ	それは、今よりもずっと前の勇者様の話です。その勇者様はどうしようもない二択を迫られたことがあったんです
新	それってどんな？
ルミネ	助けなければいけないものがふたつ……けれど、両方を救うことはできない状況でした
ルミネ	勇者様はその時、一方を犠牲にして、一方を救われました。救われた者達は勇者さまにとても感謝しました
ルミネ	けれど、勇者様は犠牲にしてしまった者達のことを考え、涙を流されたんです
主人公	伝承にしか残されていない話。でも、それを話すルミネは過去の勇者と思いを重ねているようにとても辛そうな表情だった。
主人公	正にそれは、苦渋の決断だったんだろう……でも……。
ルミネ	この地は、勇者様がその選択をした場所だと言われています……
新	…………
ルミネ	アラタさま……何を、お考えになっているのですか？
新	さっきの話のことを考えていたんだ。一方だけでなく、両方を救うにはどうしたらいいかって
ルミネ	アラタさまは、同じような状況になったら両方をお救いになるつもりなのですか？
新	当然だろう。ヒーローとしてはやっぱり、どちらかを救って、どちらかを犠牲にするという選択はしたくない
新	そんな状況でもどうにかしてすべてを救うことこそが、ヒーローってもんだろ
灯	やっぱり、新くんだねえ。いつも、そんなどうしようもない状況でも、助けを求めるすべての人のために頑張ってきたもんね
シエル	いつもそうされてきたんですか！　さすがアラタさんです、かっこいいです！！
主人公	灯はにこにこした顔で俺を見つめながらうんうんと頷き、シエルも感動したような表情で俺を見ていた。
ルミネ	わたし、勇者様ならなんとかできたんじゃないかってずっと思っていました。だから、あの選択をした勇者様に納得できなかったんです
ルミネ	自分だったらどうするだろうって色々考えもしました。結局、良い方法は浮かばなかったんですけどね……
ルミネ	でも、アラタさまならきっと、わたしでは思いもつかない方法で、あのような状況を解決してしまわれるんでしょうね
新	勇者なんて言っても別に超人でもなんでもないただの人間だよ。最適な方法が浮かぶかなんて、俺にはわからない
新	それでも、救いを求める人達のためにヒーローであろうとしているだけさ
ルミネ	アラタさま……
新	姫さまの理想を壊すようなことを言ってごめん。でも、勇者だからってなんでもできるわけではないと思うんだ
新	その伝承の勇者は、きっとそうするしかできなかった。だから、救えなかったものを思って涙を流したんだろう
主人公	その勇者がその後どうなったかは知らない。だけど、元の世界に戻っても後悔していたかもしれないよな。
ルミネ	わたし、勇者様ならなんでもできると思っていました。だから、あの選択にも納得ができなかったんです。でも、そうじゃないんですね……
ルミネ	あの物語の状況は本当にどうしようもなくて、あの時の勇者様の選択は間違いじゃなかったんですね
新	そうだろうな。たったひとりでできることは限られているから
新	でも、俺はその勇者はひとつだけ間違っていると思う
ルミネ	その間違いとは……？
新	それは……
新	……っ魔物！！　レイ！　出番だ！！
レイ	はーい！　マスター！！
主人公	姫さまに答えようとした途端、森から魔物の群れが飛び出して来た。
主人公	俺が声をかけるとレイが即座に現れ、ブレイブギアを発動させた。
主人公	ルナとアウロラもすぐに身構え、背後に姫さまと灯、シエルを移動させて魔物と対峙する。
ルミネ	きゃあっ！！！
ルナ	ルミネさま、お下がりください！
アウロラ	アカリとシエルも下がって！！
灯	は、はい！！
シエル	はい～！！
主人公	魔王であるシエルが役目を半ば放棄してから、散発的ながらこうして魔物の群れが暴れまわることがある。今回もそれと同じだ。
主人公	俺の勇者稼業の大半はこうした魔物退治だから、いつも通りの仕事だと思えばいい。
レイ	あの、マスター。あれ、一応魔王だと思われるのですが、なんで魔王に向かって襲いかかってくるんです？
新	あ、そうか！　シエル、こいつら止められないのか？　ほら、魔王の力とかで
シエル	は！　そ、そうでした！　私、魔王なんでした！　あの、あの、ちょっとやってみます！
新	ああ、頼む！　体力を消耗せずに済むならその方がいいからな
シエル	は、はい！
主人公	アウロラの背後に隠れていたシエルは慌てて魔物達の前に立ち、両手を腰にやって胸を張る。
シエル	ふ、ふ、ふははははは！！　ま、魔王たる私に向かって攻撃をしようなどと、ど、どこのどいつだ！
魔物Ａ	…………
魔物Ｂ	…………
シエル	こ、この魔王シエル様の言うことがきけないと言うのか！！
主人公	シエルが精一杯止めようとしているみたいなんだけど……。
魔物Ａ	……ぐるるるるる
魔物Ｂ	ぐおおおおお……
シエル	ひ、ひい！！　無理ですアラタさん！　全然話をきいてません！！
新	ああ、そうみたいだな。シエル、下がってろ！
シエル	は、はい！！
主人公	どうやら魔物達は興奮しているのか、話を聞き入れてくれそうにない。どうやら、倒してしまうしかなさそうだ。
新	ルナ、アウロラ！　背後をとられないように動くんだ
ルナ	わかっております！！
アウロラ	ルミネ、アカリ、シエル！　あなた達は動かずにじっとしていなさい！
灯	は、はい！
ルミネ	わかりました
シエル	うえーん！　私が頼りないばっかりに、ごめんなさいー
主人公	戦闘ができない三人を守りながら、俺達は魔物を相手にするしかなかった。
主人公	魔物に大して圧倒的な力を持つブレイブギアとレイのナビゲート、そしてルナとアウロラがいれば魔物を倒すのは難しいことではなかった。
新	おらぁあ！！
魔物Ａ	ぎゃああ！
主人公	ブレイブギアの一撃を受けた魔物はその場に倒れ、すぐに動かなくなってしまう。
主人公	そして、俺のすぐ側ではアウロラとルナも別の目標に向かって攻撃を仕掛けていた。
ルナ	ふっ……！　アウロラさま、そちらに！
アウロラ	ええ！　……はっ！
魔物Ｂ	ぎああああ！
主人公	近くの敵はルナが、そして逃げ出そうとする敵にアウロラが弓で止めを刺す。
主人公	単体の攻撃力はさほど高いわけじゃない。だが、さっきから倒しても倒しても森の中から新手がやって来ている。
レイ	マスター、森の方から新手が接近しています！
新	なに、またか！？
レイ	はい。数は先ほどと同じ程度です
新	くそ！　こうなったら、やるしかない！！
主人公	このままじゃ、まだ戦闘が長引きそうだ。こっちはなんとか持ちこたえられても、姫さま達の気力が持つか……。
主人公	なんとかみんなが消耗しないうちに終わらせないと。
レイ	マスター、別の方向に他の魔物の反応です。しかも今までのタイプより強そうなやつですねひゃっはー
新	なに！？　あ！
主人公	レイが指示した方を見ると、今までとは別の中型程度の魔物が数匹走って行く姿が見えた。
アウロラ	いけない！　あの先には村があるのよ！　このままじゃ、村に被害が！
新	なに！？
主人公	このままあの魔物を放っておけば村に被害が出るだろう。
主人公	でも、ここで誰かひとりが抜ければこの数だ……背後にいる姫さま達が危険に晒される。
主人公	それに、全員でさっきの魔物を追いかけたとしても、この数の魔物を村に引き連れて行くことになってしまう。
新	……ったく、なんて状況だよ
主人公	大勢の村の人たちか、姫さま達か。
主人公	まるで、あの伝承の勇者そのものみたいな選択じゃないか。
ルミネ	は……！　ど、どうしよう……そんなことって……
灯	姫さまどうしたの？　顔が真っ青になってる！
ルミネ	アラタさま！　わたし達よりも村を救ってください！　お願いです！
シエル	え！？　ルミネさま！？
ルミネ	さっきと一緒なんです……あの物語の勇者様と、アラタさまは同じなんです
灯	あ……！
主人公	この状況がどういうことなのか理解した姫さまの必死の叫び声が響く。
主人公	ルナとアウロラは、その声を聞いて苦渋の表情を浮かべた。
主人公	そして俺は、ひとつの決意ができた。
新	わかった、姫さま達はそこでじっとしていろ！
ルナ	アラタさま、何をするつもりですか！！
新	ルナ！　アウロラ！　ふたりはあっちの魔物を頼む！　ここは俺に任せろ！！
アウロラ	ええ！？　正気なの？　まだこれだけの数がいるのよ！
ルナ	無茶です！　背後のルミネさま達をお守りしながら、この数を倒すなど……
新	ああ、そうだな。俺もこの群れをひとりで、しかもみんなを守りながらどうにかできるなんて思っていない
新	だから、なるべく早く戻ってきてくれ。多分、そう長く保たない。頼んだぜ
アウロラ	もう、本気なの……
新	本気も本気だ。冗談でこんなこと言うわけないだろ
ルナ	……わかりました
主人公	アウロラは呆れたような表情を浮かべたが、ルナは俺をしっかり見つめて頷いた。
ルナ	すぐにあちらを片付け戻って参ります。行きましょう、アウロラさま！
アウロラ	まったく……わかったわ。絶対にすぐ戻るから！
新	ああ、頼んだぜ！
主人公	ふたりはさっきの魔物を追いかけて走り出した。あのふたりに任せておけば、村に辿り着く前に魔物は倒されるだろう。
主人公	あっちは何も心配しなくていい。残りは俺の頑張り次第だ。
レイ	とんだ無茶をしますね、マスターは
新	何言ってんだ。こっちには最強の武器と、守るべきものってもんがあるんだ……負けるわけないだろ！
ルミネ	アラタさま……わたし達のためにそこまで……！
シエル	アラタさん、かっこいいです！
灯	さっすが新くん、正義のヒーローみたい！
新	みたいじゃなくて、俺は正義のヒーローなんだよ！　さあ、行くぜレイ！　きっちりサポートしてくれよ！
レイ	お任せください
新	行くぜ！　うおおおおお！！！！
