主人公	王城へと戻る馬車の中、ルミネは沈んだ表情をしていた。
主人公	あんなことを知ってしまったら無理はない。なんとか、元気になってもらえればいいんだけど……。
新	なあ、ルミネ……っ！
ルミネ	きゃっ！！
ルナ	ルミネさま！！
新	ルミネッ！
主人公	ルミネに声をかけようとした途端、突然馬車に大きな音と衝撃が起こった。
主人公	馬車はそのまま横転し、俺とルナは必死にルミネの身体を支えた。
新	なんなんだ、一体……！
ソル	探したぞ……勇者っ！
新	……ソル！
主人公	揺れがおさまり、ルミネをルナに任せて馬車から出てみると、そこにはソルの姿があった。
主人公	どうやら、俺達が魔王城を探索している間に、体力が回復して城を抜け出して来たようだ。
ソル	勇者……貴様を殺しに来た
新	くそ……
主人公	いつでもかかってこいと言ったのは自分だ。
主人公	そう言った以上、ちょっと待ったはナシだな。
新	わかった。受けてたとう
ソル	はは……そう来ないとな。シャイン、準備だ
シャイン	わかったわ、任せて！
主人公	楽しそうに笑みを浮かべるとソルはシャインを呼び出し、ギアを装着した。
主人公	呼び出されたシャインの身体が変化し、両足を覆う装甲になる。
主人公	そしてソルは、俺を見て嬉しそうに身構えた。
主人公	その姿を確認して距離をとり、周囲に視線をめぐらせる。
主人公	他のみんなも巻き込まれたようだが、誰も命に関わるような怪我はしていない様子だ。
主人公	ルミネもルナと俺がかばったから怪我はない、少しフラついているようだが意識もちゃんとある。
新	みんな離れろ……！　レイ、サポートを頼む！！
レイ	お任せくださいマスター！
新	相手はソルだ！　最初から全開で行く！
レイ	わかりました。ブレイブギア、出力全開！
主人公	ブレイブギアを起動し、フル出力にすると、普段は右腕だけの装甲が全身を覆っていく。
主人公	フルドライブ状態のブレイブギアは、いわば全身が武器だ。
主人公	生半可な状態じゃソルには敵わない。だから、これしかない。
ソル	面白い。そうでないとな！　シャイン、こっちも全開だ
シャイン	了解！　エージェントギア、全開！
ソル	行くぞ！　勇者！！！
新	ああ、来い！！！
主人公	一斉に駆け出し、互いの攻撃をぶつけ合わせる。
主人公	凄まじい衝撃が全身を駆け抜けるが、俺もソルも一歩も引く気はなかった。
ソル	そうだ、最初から全開……それでいい……
新	そうだな。確かに油断してちゃ……こっちがやられる！
主人公	ぶつけ合わせた攻撃を一旦離すと、互いに後方へと移動し距離をとる。
主人公	そしてまた、どちらともなく地面を蹴って駆け出し、次の攻撃を繰り出した。
