ソル	なんなんだ！？
主人公	謎の光に包まれたソルはすぐにそこから離脱する。
主人公	だが、その後も何も起こる様子はなく、ソルを包んだ光は間もなく消えてしまった。
ルミネ	アラタさま！！　今です！
新	ルミネっ、ありがとう！！
主人公	聞こえた声に振り返ると、ルミネが強い瞳でソルを見据えていた。
主人公	もしかして、今のはロイヤルギアを発動した光だったのかもしれない。
主人公	まだ何も起こっていないけど、おかげで体勢を立て直して身構えることができた。
ソル	くそ！　くだらん目くらましか。絶好のチャンスを……
シャイン	あ……あ、ああああ！　ソル……ソルぅ……！
ソル	シャイン！　どうした？！
シャイン	身体が……熱い、よぉ……！　な、に……これ！
新	な、なんだ！？
主人公	攻撃のチャンスを逃し悔しがるソルだったが、次の瞬間ギアの様子が変化した。
主人公	全身を包むようにギアから光があふれ出し、ソルのエーテル制御を担当しているシャインの苦しそうな声が聞こえ始めた。
新	レイ、どうなってる？！
レイ	代行者のギアの出力が急激に上昇しています。そのためにシステム全体にも影響が出ているかと
レイ	このままでは出力を抑えきれずにギアもろともシャインが暴走を……！
新	なんだと？！
ソル	この……なんなんだ！　く、そ……！
主人公	ギアの出力上昇はソルにも反動があるらしく、苦しそうに顔をしかめる。
主人公	攻撃をしかけるのなら、今しかない！
新	ソルぅうう！！！！
ソル	ぐう！　勇者……貴様ぁああっ！！
主人公	駆け出して一気に距離を縮めて渾身の一撃を叩き込む。
主人公	だが、ソルは苦しそうにしながらそれでも攻撃を防ぐと、そのまま反撃をくわえてきた。
主人公	しかもギアの出力が上がっているせいか、その速度は今まで以上のものだった。
新	なんて速さだ！
ソル	この……！
主人公	だが、出力が上がっているせいか制御がうまくいかず、狙いも定まらず、攻撃はギリギリそれて頬を掠めるだけだ。
シャイン	ソル……ごめんなさい、ソル！　ぼ、ぼく……身体が、う、あああ！
ソル	いいから抑える努力をしろ。まだいける！
新	無茶くちゃだな！
ソル	この程度のことで……おおおお……！
主人公	ソルがすごい速度で攻撃を繰り返す。
主人公	狙いの定まらないままの攻撃だが、この速度だと避けるよりも受け止めた方が簡単そうだ。
主人公	そう思ってソルの攻撃を受け止めたまでは良かったが……。
新	……くそっ！
ルミネ	アラタさまっ！！
ルナ	いけません、ルミネさま！　お下がりください！！
主人公	そのあまりの威力に攻撃を受け止めたまま吹き飛ばされてしまう。
主人公	しかも、高出力での攻撃を受け止めたせいか、ブレイブギアの鎧状態が解除される。
新	こりゃ、ヤバイな
レイ	今すぐフル出力は無理です
新	くそ……なんて威力だ。だが、それでもやるしかない
レイ	最低限の出力でしか動かせませんよ。私はどうなっても知りませんからね
新	そんなもん、望むところだ！
主人公	すかさずソルの追撃が来ると判断し、立ち上がってギアをいつもの形態にする。
主人公	だが、身構えてもソルの追撃はこない。視線を向けると、ソルは苦しそうに顔を歪ませていた。
ソル	この……これ以上はもう、無理か……！
シャイン	そ……る……ごめんなさい、ごめ……
ソル	お前のせいじゃない。……くそ！　今は一旦引く！
シャイン	あっ！
ソル	決着は必ずつける……！
主人公	このままだと自分が危険だと判断したのか、ソルはギアをなんとか元に戻すとシャインの身体を抱えて去っていった。
新	………
レイ	代行者の気配は遠ざかっていきます。もう一度こちらに戻ることは、今はないでしょう
新	ああ……助かった……
主人公	正直、これ以上攻撃して来られて防ぎ切る自信はなかった。
主人公	なんとかピンチを凌げたとわかると、ドっと全身から力が抜けるようだった。
ルミネ	アラタさま！　アラタさま、お怪我はありませんか？！
主人公	安心しているとルミネが駆け寄り、俺の身体に強く抱きつく。
主人公	その身体をしっかり支え、安心させるように見つめる。
新	ああ、大丈夫だよ。ギリギリだったけどな
ルミネ	良かった……アラタさまに何かあったら、わたしは……
新	ルミネのおかげだ。あの時、ロイヤルギアの力を使ってくれたんだろう
ルミネ	なんとかしなくてはと必死だったんです……だから、気が付いたらロイヤルギアを……
主人公	ルミネの方も無我夢中だったらしく、涙目になっていた。その頬を撫でながら見つめると少し安心したようにため息を吐く。
新	おかげで俺は助かったんだ。本当にありがとう
ルミネ	アラタさまがご無事で本当に良かった……
主人公	あの時のルミネの機転があったからこそ、こうして今無事でいられている。それがなければ今頃はきっと……。
主人公	いや、こんなことを考えていても仕方がない。他のみんなの無事も確認して、少し休んでから急いで王城へ帰らないとな。
