主人公	王城へと帰り、一晩あけた翌日。
主人公	俺達は魔王城で知った真実と、昨晩のソルの襲撃について話し合っていた。
フォルト	ソルの件に関してはこちらの落ち度だ。すまなかったな、アラタ
フォルト	気が付いた時には王城から姿を消していたんだ。慌てて捕縛隊を派遣したが、すべて返り討ちにあっている……
ルナ	皆は無事なのですか？
フォルト	ああ、大した怪我ではない……手加減はされていた
新	王様が謝ることじゃないよ。それに、ソルを捕まえるのは生半可なことじゃない
主人公	昨日の様子じゃ俺が城に残っていたら城内での戦闘になって、ある程度の被害が出ていただろう。
主人公	むしろ、俺がいない時でよかったと思うべきなのかもしれない。
新	ソルは必ず決着をつけると言っていた。だから、すぐにあいつと戦う時は来る気がする
ルミネ	アラタさま……
新	心配しなくても大丈夫だよ、ルミネ。前の戦闘でレイにソルのデータは集めてもらってる
新	次はきっと勝つさ
アーベン	さて、では次に魔王城の最深部で見た真実についてだ……フォルト王には昨晩のうちに情報をまとめたものをお見せしたが
フォルト	ああ、確認した
主人公	博士が口を開いたのだが、誰もが暗い表情になった。
主人公	既に情報を伝えられているという王様も、暗い表情で言葉を失っている。
フォルト	まさか、これまで我々人間が必死で戦ってきた魔王が、そんなことのために存在していたとはな……
アーベン	確かにあのシステムが作り出した通り、ラグナギアでは人間同士の大きな争いは起きていないがね
アウロラ	アーベン、何を言い出すの？　あなたまさか、あのシステムの考えが正しいとでも？
アーベン	そうではない。この世界そのものにとって、アレは合理的だというだけだ
フォルト	そうだな、この世界にとっては合理的かもしれない。だが、魔物の襲撃で命を失う人間は確実にいる
フォルト	しかも、魔王はただ殺されるためだけに生まれているんじゃないか
シエル	…………
フォルト	こんなこと、納得できる話のわけがない！
主人公	俺達のいる世界では、人間同士の戦争で大勢の命が失われた。
主人公	それを考えれば、この世界のシステムというのは博士の言う通り確かに合理的かもしれない。
主人公	共通の敵さえあれば、人類は争うことなくその敵を倒すために協力して生きていく。
主人公	勇者や代行者のシステムも、この世界そのもののためという考えなら、きっと合理的なんだろう。
ルミネ	アラタさまは……どうお考えなのですか
新	俺は……この世界のシステムが正しいかどうかはわからない
新	それでも、これ以上勇者と魔王、代行者といった、ただ役目を終えたら消えてしまうだけの悲しい存在を生み出したくはない
灯	新くん……！　そうだよね。共通の敵なんかいなくても、人間は力を合わせて生きていけるよ！
新	俺もそう思う。人間同士の衝突もあるだろうけど、誰かに与えられた結束じゃ意味がないと思う
フォルト	確かにその通りだ。この世界に生きる俺達が、自分達の手で力を合わせて世界を平和にしていかなければ……
新	あのシステムをどうにか変えられないだろうか……
アウロラ	そのためには少なくとも、まずはシステムそのものを調べてみる必要があるわ。でも、本体がどこにあるのか……
ルナ	あの部屋にあったものが、そうではないのですか？
アウロラ	あの部屋にあったのは、あのデータを引き出すための装置みたいなものだったのよ。だから、あれだけでは……
アーベン	あの端末をもう一度調べれば、大元にたどり着くことは可能だろう
アーベン	大元と繋がっているからこそ、あれだけの情報も引き出せたはず
アーベン	あと、これはあくまでも私の予想だが……大元には魔王城から行ける可能性が最も高いのではないかな
フォルト	なるほどな。では、もう一度魔王城に向かって、その端末を調べ、大元を突き止めて乗り込んでいくしかないな
新	ああ、そうしよう！
主人公	魔王城に再び乗り込み、決着をつけることは確定となった。
主人公	問題は、その魔王城に行くメンバーだ。
主人公	俺と灯、シエル、博士とアウロラはすぐに決まったんだが……。
ルミネ	わたしも一緒にまいります！
フォルト	ルミネちゃん、また……昨日危ない目にあったばかりだろう
ルミネ	ですが、昨日はわたしがロイヤルギアの力を使って、アラタさまはピンチを乗り切ったのです！
フォルト	いやまあ、そういう報告は聞いているけど……
ルミネ	ですから、わたしも一緒にまいります！　またソルさんが来た時にギアの力を使えば、退けることができるはずです
新	あの、ルミネの気持ちは嬉しいけど危ないから……
ルミネ	大丈夫です。わたしがアラタさまをお守りいたします！
主人公	ルミネは行く気満々だった。
主人公	確かにルミネに助けられたから、これ以上強く言い返すこともできない。
主人公	あの時は間違いなく、ルミネがロイヤルギアを使ってくれていなければやられていた。
主人公	それに、このルミネの強い気持ちをどうにかできるとも思わない。
フォルト	む、むむむ……ルナ……
ルナ	残念ながら、ルミネさまをお止めする手段が思い浮かびません
フォルト	えーー。いやまあ、確かに襲われた時の対抗手段は必要だが……あああ、もう！
主人公	これ以上はどう考えてもルミネを止めることは無理だろうと誰もが悟っていた。
主人公	結局、最終的には今回と同じようにルナを護衛につけ、ロイヤルギアを装着して同行するようにということになった。
フォルト	アラタ、ルミネちゃんをくれぐれも頼む。無茶はさせるな。傷ひとつでもつけて帰って来させたら許さんからな
新	わかってる。ルミネに危ないことをして欲しくないのは俺も同じだ
ルミネ	大丈夫ですよ、アラタさま。わたし、決して危険なことはいたしません
新	ああ。でも、何かあった時は必ず俺がルミネを守ってみせるから
ルミネ	はい！
主人公	ルミネのロイヤルギアが心強いことは確かなことだ。
主人公	あの力は確かにすごいものだった。
主人公	でも、ひとつだけ不思議なことがある。何故、直撃を受けてシャインは破壊されなかったんだ……。
新	博士、聞きたいことがあるんだ
アーベン	おお、何か疑問が？
新	昨日、ルミネがロイヤルギアを使ってソルの攻撃を塞いでくれた話はしたよな
アーベン	ああ、ああ！　実に興味深い話だ。私もこの目で是非見たかった！　……ま、それどころではなかったがね
新	あの直撃を受けてもシャインは破壊されなかったし、あの出力急増はなんだったんだ？
新	ロイヤルギアの力は、ギアを破壊するものじゃなかったのか
アーベン	ふむ……実際に見たわけではないので確かなことは言えんが、直撃を受けた後に出力が上がったことから考えて……
アーベン	ロイヤルギアは対象の出力を異常に上げてオーバーヒートさせることで、ギアを破壊していたと憶測できる
アーベン	現にオリジナルギアを元にして我々が作った劣化品のギアは、暴走する間もなくそれで完全に破壊されてしまうからな
新	シャインは劣化品じゃないオリジナルギアだから、その出力異常に耐えてしまったということか？
アーベン	ああ。オーバーヒートして暴走こそしたものの、破壊には至らなかったのはオリジナルだからこそ……ではないか
アーベン	ただ一時的に暴走し出力が上がったとはいえ、そのままなら間違いなく機能停止していたはずだ
アーベン	決して、シャインにロイヤルギアが効かないということではないだろう
新	そうか……
主人公	なんだか、おかしな気がする。違和感というか、なんというか……。
主人公	わざわざギアを無力化するために、そんなに効率の悪いことをする必要があるんだろうか。
主人公	破壊するだけなら、もっと簡単に破壊してしまえばいいはずだ。
主人公	それなのに、わざわざオーバーヒートさせて破壊するなんて……。
主人公	もしかして、ロイヤルギアは本来意図されたものと違う使い方をされているのか？
主人公	でも、だとしてもどうやって使うものなのか……。
新	うーん……
ルミネ	アラタさま、どうされたのですか？
新	あ、ああ、いや。なんでもないよ
ルミネ	今日は消耗している身体を休め、明日出発ということになりました。ゆっくり休みましょう
新	わかったよ。ルミネも怖い思いをしたんだから、ちゃんと身体を休めてくれよ
ルミネ	はい。わかっております
主人公	決戦は明日だ。
主人公	ちゃんと身体を休めて、明日に備えないとな。そう考え、俺も部屋へと戻っていった。
