主人公	エルフの里の使者が出て行った後、俺達は研究室に移動した。
主人公	玉座の間では見てるだけだったから、みんな言いたいことがあるらしい。
灯	あれでいいのかなぁ？
ルミネ	難しいと思います……
アーベン	どうなったんだ？
主人公	研究室に残っていた博士に、姫さまが成り行きを説明した。
アーベン	そいつは確かに難問だ。天才の私でも手に負えんな
アウロラ	無駄な努力、よ
主人公	あっさりと切って捨てたアウロラは、話すことはない、とばかりにやりかけになっていた作業に戻る。
主人公	どうやら、俺達がいつもの流れでエルフを擁護する、そう思っているようだ……ちょっと耳が痛い。
主人公	確かにアウロラの言う通りなのかも知れない。でも、これでいいのか？
主人公	エルフの里には困っている人たち、いや、エルフ達がいる。態度が悪いからといって、その人達を無視していいのか……。
主人公	だが、さっきの使者の態度、あれは確かに酷すぎた。あんな態度をする者の要望をそのまま呑む。それは確かに一国としてまずいだろう。
主人公	クラウン王国はエルフ達の属国じゃない。それは事実で……にも関わらずなんでも受け入れるのは、それはもうただの偽善になりかねない。
主人公	俺の迷いは、背後の気配で停止した。
新	王様か。仕事はもういいのか？
フォルト	終わらせてきたぜ。あと一つを残して。それも、すぐ終わる
主人公	振り向くと、王様はもう私服に着替えてる。この後、エア姉の店へ行く気だろう。
新	なあ、あのままで、いいのか？
フォルト	心配か？
新	当然だろ
フォルト	俺様も、だ
主人公	溜息をつきながら、その本音をこぼす王様に、俺は安堵の笑みを浮かべる。王様自身がなんとかしたいと思ってくれてるのなら大丈夫だ。なんとかできる。
新	だったら、王様からの依頼、ってことで引き受けるぞ。エルフの使者の依頼に関して、最後まで見届けてやる
新	俺に任せてくれないか
主人公	あえて胸を張りながら、任せろと自分を親指で指さし王様に言う。
主人公	そんな俺を王様はマジマジと見回すと、ニヤリと笑って頷いた。
新	おっし、そんじゃあ早速様子を見に行くとするか。みんなはどうする？
フォルト	残念だが、別件がある。ここは、アラタに任せるぞ
灯	私も行く
シエル	お供します
ルミネ	わたしもご一緒します
ルナ	ならば、私も
フォルト	ルミネ、お前はダメだ。医薬品を送る準備作業はお前にしてもらわないと
ルミネ	それは、お兄様がして下さい。エアリー姉さまのお店へ行くの我慢して
フォルト	ぐぅぅっ、それは……
ルミネ	ね、お願いっ。お兄さま～♪
フォルト	分かった、分かったから。気を付けて行ってらっしゃい
主人公	シスコンモードになった王様はスルーして、俺はアウロラの前に行った。
新	アウロラ
アウロラ	あたしは、行かないわよ
新	エルフのこと、俺より分かってるだろ
主人公	正直に言えば、ここでアウロラを連れていくのは本当に申し訳ないと思う。今俺達がやろうとしているのは、ただ俺達が納得したいだけの自己満足だと思うから。
主人公	感謝の気持ちを示さない連中に、人々の善意を勝手に渡す。それは確かに、裏切り行為と言われてもおかしくないものだろう。
主人公	だけどそれでも、俺はエルフを助けたいと思う。俺が俺であるために、助けないといけないと思う。そのためには、アウロラの助けがきっと必要だと思うから。
主人公	俺の言葉に、けれどアウロラは反応しない。好きにやればいい、その感情が言葉にしなくても聞こえてくる。
主人公	そんなアウロラを見かねてか、姫さまがその袖を掴んだ。そして上目遣いで促す。
ルミネ	お姉さま、ご一緒に
アウロラ	……わかったわよ
主人公	そんな姫さまの要求に、アウロラは仕方ないと深い溜息をついた。
新	よし、それじゃ行こうか
主人公	かくして、俺達はエルフの里の使者を追うように、城を出て町に向かった。
主人公	町へ出てみると案の定、使者はもう、そこかしこで問題を引き起こしてた。
主人公	まず、城門近くの鍛冶屋。
鍛冶屋	見たことも聞いたこともない道具を作れって言うんだ
鍛冶屋	そんなもの作れるわけ無いから断った
主人公	次は、大通りの手前の武器店。
武器店の店主	エルフを助ける義理は無い。追い返してやった
主人公	武器店の少し先の薬問屋。
薬問屋の主	昨日、城からの使いにいろいろ聞いていたから、通りかかった使者に声をかけたの
薬問屋の主	他にも、必要なものがあるなら、ほら、少しは割安にしてもいいからって
薬問屋の主	そしたら、忙しいって、怒鳴って行っちゃったのよ。失礼しちゃうわ
主人公	他にも、鍛冶屋や工具店、武器店の場所を聞かれたという通行人達が、礼も言わないあのエルフは何者ですかと、次から次へと姫さまに聞いて来た。
主人公	そのたびに姫さまは立ち止まって、核心を上手く外した答えを返す。
主人公	ただ、そんなこんなで、なかなか使者に追い付けない。
主人公	ようやく、城壁手前の工房に入ろうとする使者を見つけた。
主人公	俺達は、工房の戸口に近付いて、中の様子を窺う。
使者	この程度の物を作るのに、一週間もあれば充分だろう
店主	そりゃ、材料があればの話ですよ
店主	一つ、二つならまだしも、二十も、三十もじゃ、材料の在庫が足らないんです
店主	このところ材料の入荷が遅れてて、どうにもならない
店主	昨日、お役人に話した通り、いくら王様からの御依頼だって、こればかりはねぇ
使者	王ではない。エルフの依頼だ！　それが出来ないのかっ！
店主	どうしたって、出来ないよ！　もう帰ってくれ！　仕事の邪魔だ！
主人公	店主は肩を怒らせて、工房の奥へ戻って行った。
主人公	使者は、怒りに満ちた顔をして店を出る。
主人公	そして、まだ続ける気なのか、更に王城から遠ざかる方向へ歩きだした。
主人公	アウロラは、その様子を見て溜息をつく。
主人公	俺は、使者を追いかけた。
新	そこの使者さん、ちょっと待ってくれ
主人公	俺のいきなりの呼びかけに、使者は立ち止まると振り返った。
新	いきなりで悪いが、俺達にも手伝わせてくれないか
使者	お前は――謁見のときに見た顔だが
新	俺は光島　新。まあ、一応勇者だ
主人公	差し出した手は無視されるが、そんなこと構わない。
新	そこの工房に戻って、もう一回、話をしてみないか？
使者	いらぬ世話をするな
主人公	あっさりと切り捨て、そのまま行こうとする使者の脇に、姫さま達が進み出る。
ルミネ	わたしも、お手伝いします。わたしはルミネ。国王フォルトの妹です
シエル	私も……
灯	私だって、手伝うよ
使者	手伝いなどいらぬ。人間に頼ることさえあってはならないことなのに
使者	まして人間の女、子供に助けられるなど、許し難いにも程がある
使者	これ以上、エルフの誇りを汚すような真似はするな
主人公	ふう。分かってはいたけれども、かなり強情だ。
主人公	女の子相手だからなのか怒鳴りはしないが、妥協する気は無いらしい。
アウロラ	あんた、いい加減にしなさいよ！　今はエルフの誇りがどうのこうの言ってる場合じゃないでしょう！？
アウロラ	そんな態度で頼み事したって、聞いてくれるわけないじゃないっ！
主人公	見るに見かねたアウロラの言葉に、使者は冷たい一瞥で応えた。
使者	ふん、エルフの里を捨てて逃げ出した裏切り者が、口を挟むな
アウロラ	ああ、そうですか――
主人公	完璧に怒った顔のアウロラが、俺を見る。その視線には、俺に対する怒りもこめられている。
主人公	こんな奴らを助けるのかと。こんな奴らのためにへりくだるのかと。
アウロラ	こんな奴、放っておけばいいのよ！　あたし、もう帰るから！
主人公	アウロラは早足で、使者の横を通り抜け、王城の方へ戻って行く。
ルミネ	お姉さま――
主人公	アウロラを追うルミネの後に、ルナが付いて行く。
主人公	シエルと灯が俺を見た。
新	ついてってやってくれ。俺は、いいから
シエル	はい
灯	うん！
主人公	二人は頷いて、アウロラ達の後を追った。
主人公	後に、使者と俺が残る。
主人公	使者は、アウロラ達の後姿が見えなくなると、俺を無視して歩き出した。その背中を眺めながら、俺は心の中で呟く。
主人公	ごめん、と。アウロラへと向けて。
主人公	アウロラの気持ちは分かる。いや、正直に言えば、普通の人はアウロラと同じ気持ちを抱くだろう。
主人公	感謝の気持ちも見せず、ただ傲慢に、それが当然だと見下す存在。そんな者達のために、なんで動いてやらなければならないのかと。
主人公	それを庇い、そんな者達のために動く俺は、アウロラにとっては裏切り者に見えていてもおかしくないだろう。本当に申し訳無いと思う。
主人公	だけどそれでも、俺はエルフという種族の力になりたい。それは、俺が勇者だから、ヒーローを目指しているからなんて理由じゃなくて……。
主人公	ただ、信じているから。
