主人公	約束の１０日目。
主人公	夜明け前にハーブエキスが届けられて、必要な物は全て揃った。
主人公	不足がないか最終チェックをしてから、荷馬車への積み込みを行う。
主人公	城側の発送担当者達と、運送屋の親方が手配してくれた積み込みの作業員達、荷馬車の御者達、そして、俺だけのはずの現場に、いつの間にか、みんなも集まっていた。
主人公	姫さまの手配で飲み物や朝食代わりの軽食が配られ、王様から激励の声が掛けられる。
主人公	否応なく作業のペースは早くなり、夜が明けきる頃には、積み込みが完了した。
主人公	そこへ、エルフの里の使者がタイミング良く現れる。旅支度を整えて。
主人公	中庭での騒ぎに目を覚まして、用意したのに違いない。
主人公	王様は素早く使者に歩み寄った。
フォルト	用意は全て整った。後はこれ、同行する荷馬車と御者についての覚え書きだ
主人公	使者は王様の差し出した紙を受け取ると、一瞥しただけで突き返す。
使者	ふん、このようなこと言われるまでもない
フォルト	失礼した。では、良い旅を
主人公	使者は言葉を返さず、でも、ほんの少しだけ会釈するように首を下げて歩き出す。
主人公	俺は、目の前を通り過ぎる使者の背中に声をかけた。
新	また何か困ったことがあったら、いつでも来てくれ。俺達が、必ず力になるからさ
主人公	エルフの里の使者が立ち止り、振り向いた。
使者	貴様は確か、勇者と言ったな。これまで見て来た人間の中でも、極め付けの愚か者だ
主人公	言葉のわりに、その表情は優しげだった。
新	はははっ、確かに。自覚はあるよ
主人公	それを聞いた使者の顔は穏やかで、微笑んでるようにすら見えた。
使者	貴様に一つ、言っておかねばならぬ事がある
使者	ある方達からの伝言だ。心して聞け
主人公	俺は反射的に頷いて、真顔になった。
使者	『あの子のことを、頼む』　それだけだ
主人公	息を呑む声に、視線が横に走る。
主人公	アウロラは息をするのも忘れたように、使者の顔を見つめていた。
主人公	それで、充分だ。
主人公	俺は使者に向かって即答する。
新	ああ、任せろ。その人達に、この俺がそう言ったと伝えてくれ
主人公	使者は、ゆっくりと頷いた。
使者	必ず、伝えよう――愚か者の勇者よ、そして、その仲間達、さらばだ
使者	そして……感謝する
使者	……ありがとう
主人公	微笑んでるような穏やかな顔をして、使者は前を向いた。そして歩き始める。
主人公	その後に付いて、荷馬車が進み始めた。
主人公	城の門を出て跳ね橋を渡り、遠ざかって行くその姿を見送りながら、思った。
主人公	エルフとして生まれ持った物は変えられない。でも、変えられる物もあるんだと。
アウロラ	……ねえ、アラタ……
主人公	俺の隣に並びながら、アウロラが小さく言う。
アウロラ	あいつ……お礼言ったわよね……
新	ああ、それに笑ってた
アウロラ	そっか……やっぱり、あたしの思い違いじゃないんだ……
新	エルフは変われる。アウロラが、その証拠だ
アウロラ	アラタ……
新	俺は信じてるよ。エルフを、アウロラを
アウロラ	……うん
主人公	アウロラは優しい目をして、城門の彼方に消えて行く故郷への隊列を見つめていた。
