主人公	あれから３日ほどが過ぎた。広間でバカと言われた俺は、その後、アウロラに会うことが出来ていなかった。
主人公	あの直後に、王様から隣国へ魔物退治に行ってほしいと依頼されたのと、出先で更に、その隣の国の魔物退治も引き受けてしまったからだ。
主人公	ようやく帰ってきた俺は、とりあえずアウロラの顔を見ておきたい、そう思って、まず研究室へと顔を出す。
新	うっす、戻ったぞー
アーベン	元気そうだな。ブレイブギアの調子はどうだ？
新	ああ、絶好調だよ。絶好調過ぎて、レイがはしゃぎ過ぎだ
アーベン	それは使用上の支障にはならんだろ。うるさいだけで――
新	んで、アウロラは……
主人公	アウロラは研究室の隅にいて、何かしている。
主人公	この前までは、俺の姿を見ると飛んできたのに、今は、しらんぷりだ。
アーベン	飲み会の後、何かあったのか？
新	いや、何かってほどのことは……
アーベン	ま、それはそれとして、アラタに一つ、頼みたいことがある
アーベン	帰って来て早々で、申し訳無いが
新	なんだ？
アーベン	新しいギアの実験なんだが、さすがに研究室内では出来ないレベルなんでな、外でやることになった。で、その手伝いと護衛を兼ねて、アウロラ嬢に付いて行ってほしい
新	そりゃ、いいけど……
主人公	俺は、またアウロラを見る。
主人公	でも、アウロラは、こっちを見ようとしない。
アーベン	なるべく人気の無い場所、王都から離れた場所でやってほしい。それから実験の項目が多いので、日帰りは無理だから、野営の用意をして行ってくれ
新	わかった。でも、アウロラは……
主人公	もう一度、アウロラを見る。今度は、ちらっと俺を見るが、すぐに、そっぽを向いてしまう。
アーベン	大丈夫だ。これはアウロラ嬢の仕事だからな。分かってるさ
主人公	俺は頷くと、キャンプ道具を取りに自分の部屋へ向かった。
主人公	王都から出て、街道から外れた森の手前の草原で、実験の場所を決める。
主人公	実験室を出てから、ずっと会話らしい会話も無しに来たが、博士の言う通りちゃんと仕事だと分かっていたらしい。アウロラから、実験に対する様々な指示が飛んでくる。
主人公	その指示通りに、新しいギアや実験の道具を出して実験を始める頃には、俺達の間の気まずい空気は消えていた。
