主人公	魔王城に来るのも三度目だ。勝手は、それなりに分かってる。
主人公	中に入れば、前に来たときと同じで、空気は軽い。レイに探索を頼めば、魔物の存在はあるものの、その数は少ないらしい。
主人公	魔王がいないせいで、ここから出て行ってしまっているのか……まあなんにせよ、俺とアウロラがいれば問題なさそうだ。
アーベン	さすがは魔王城、と言うべき広さだな……
アウロラ	でも、薄暗いのね
新	で、どこから調べる？
主人公	初めての魔王城に目を輝かせる二人に対し、俺は尋ねた。
アーベン	無論、魔王が本来いるべき場所……玉座の間だろう
新	了解
主人公	最初は一時間もかからずに、次はダンジョンに迷って辿り着くまで数時間かかった玉座の間だ。
主人公	でも、今度はそんなにかからない。
主人公	シエルを連れて出たときに通った道を、逆に行けばいいだけだった。レイに頼んでマッピングしておいてもらったのが大正解だな。
主人公	俺達は、時々現れる魔物達を倒しながら、奥へと進んでいく。レイの探索通り、その数は多くなさそうだ。強さの方も正直俺の敵じゃあない。
主人公	そして進むこと数十分。俺達は問題無く玉座の間に入った。
アーベン	時間があれば、きちんと測量して正体不明のスペースを突き止めるのだがな……
新	で、どうする？
アーベン	ここは、ヒーローの直感力を試してみるシーンだろう。任せた
アウロラ	何？　その超御都合主義的展開は
新	ま、いいじゃないか。時間がかかるわけでもなし、やってみよう
主人公	博士の言い分に苦笑しつつ、俺は魔王の玉座へ向かった。
主人公	ここは、お約束。玉座の周囲をじっくりと調べてみるが、それらしいモノは無い。
主人公	正体不明のスペースにつながる、何か。
主人公	それが簡単に見つかったら、誰も困らない。が、見つからな過ぎる。
主人公	玉座そのもの、背もたれの飾り、玉座を囲むカーテンの陰……絨毯の下も見た。
新	うーん……無いなあ
アウロラ	他に方法は無いの？
新	ないことはないんだろうが、まあ考えてみよう。その前に、一休みだ
主人公	俺は魔王の玉座に座ってみる。クッションは少し硬いが、座り心地はいい。
主人公	腕を肘掛の上に置いて、背もたれに寄りかかった。
アウロラ	へえ、こんなゴツゴツしてるしもっと座りにくいと思ってたけど、気持ち良さそうね
新	座ってみるか？
主人公	肘掛の端のしゃれこうべ型の飾りを掴んで立ち上がろうとするが、その時指が眼窩の穴に入ってしまう。
新	……ん？
主人公	なんだろう。なんとなく何かありそうな気配がする。指を更に奥の方へと差し入れてみると、指がボタンのような物に触れた。
新	！
主人公	慌てて覗き込むと、そこは、さっき見た通りの、ただの穴だった。
新	もしかして
主人公	もう一回、玉座に座って、眼窩の穴に指を入れる。
主人公	指先に、ボタンが触れた。なるほど、視認できないように幻影を貼ってるわけか……。
新	あったぞ、アウロラ
アウロラ	何が？
新	ボタンだ。隠し扉のスイッチか、自爆装置か、緊急脱出装置か――
アウロラ	……どれだと思う……？
アーベン	押せば分かる
アウロラ	それ、研究者のセリフじゃないから！　アラタ、勝手に――
新	ぽちっと、な
アウロラ	押しちゃった……
アウロラ	まさか……
アーベン	素晴らしい……大正解だったか！
主人公	玉座の背後の壁が持ち上がり、新たな通路が開いた。
主人公	深い闇に満たされた、どこへ続くか分からない道。
主人公	本物のダンジョンはここからだ、と、俺の直観が告げた。
新	よしっ！
主人公	奥に広がる世界にどこか胸をわくわくさせながら、俺はみんなと暗い通路に踏み出した。
主人公	携帯式の照明用ギアで行く手を照らし進んで行くと、銀色のドアに突き当たった。
主人公	そのドアは、俺達が前に立つと音も無く、開く。
新	えぇっ！？
主人公	想定外、または、お約束な展開だ。
主人公	開いたドアの向こうには、巨大な円形のホールが広がっていた。
主人公	眩いほどの照明で照らされた、金属の壁が銀色に光るＳＦチックなホール。
主人公	天井までの高さは、数十メートルくらいある。
主人公	そして、壁の周囲に巡らされた円形の通路より少し低くなった床の中央部は透明になっていて、その下に無数の配管が見えた。
主人公	その透明な床を囲む壁の手前に、端末にしか見えない装置が置かれている。
主人公	中世ヨーロッパ的なラグナギアとは、別世界だった。
アーベン	これが、魔王城の正体か……
新	冒険ファンタジーから、未来ＳＦへワープかよ。上等じゃないかっ！
アウロラ	アラタ、それどういう意味？
新	はは。ヒーローは、活躍する世界を選ばないってコトだな
アーベン	さあ、調査を始めよう……ふふふふふふふふ、研究者魂がうずいてきたぞ！
主人公	博士は何の躊躇いも無く、むしろ喜々としながら床に降りて行く。
主人公	そして、端末のような装置に触れた。
主人公	その仕組みは、アウロラ達がギアやエーテルの研究に使っている道具や装置に近い物のようだ。
主人公	実際、博士とアウロラがいじってみたところ、ほとんど問題無く使えるらしい。
アウロラ	これ、もしかして大発見？
アーベン	当たり前だが、はしゃいでるヒマは無い。解明しなければならん事があり過ぎる。ふふふ……調べまくってやろうではないか！
主人公	俺は取りあえず、サポート役として付いて来ている兵士の一人に、魔王城外に待機している本隊へ目的地点に到達したことを伝えるよう頼んでから、周囲の探索に入った。
